"","auth","piece","line"
"199","sakaguchi","03hanatenguryu.txt","天狗様のアンニャがクマと同じ年頃であったから、彼女が七ツ八ツのころ、ミコサマが彼女ぐらいのジャベを物色していたのである。"
"200","sakaguchi","03hanatenguryu.txt","彼女が不幸な夢をいだいたのは、この時にはじまる。"
"201","sakaguchi","03hanatenguryu.txt","彼女の一生の悲しみは、この時よりはじまった。"
"202","sakaguchi","03hanatenguryu.txt",""
"203","sakaguchi","03hanatenguryu.txt","一度びミコサマの目ガネにかない、膝下に育てられることになると、大変なものだ。"
"204","sakaguchi","03hanatenguryu.txt","まるで花が咲いたような美しい特別の着物を年中着せられている上に、七ツ八ツから紅オシロイまでつけているのである。"
"205","sakaguchi","03hanatenguryu.txt","第一、用いる言葉も違う。"
"206","sakaguchi","03hanatenguryu.txt","ジャベだのアンニャだのシッペタだのゲェルマッチョ（蛙のこと）などという下賤な言葉は禁止される。"
"207","sakaguchi","03hanatenguryu.txt","こういうモロモロの下賤なることを禁止される特別なアネサはなんとまア素晴らしいことであろうか。"
"208","sakaguchi","03hanatenguryu.txt",""
"209","sakaguchi","03hanatenguryu.txt","ミコサマは正月十五日と春秋二度の祭礼に舞いを舞う。"
"210","sakaguchi","03hanatenguryu.txt","鈴舞いと云って鈴をふって舞うのであるが、そのアイノテに、ちょッとナギナタを持って現れることもある。"
"211","sakaguchi","03hanatenguryu.txt","しかし、それも舞いの手のようなもので、調多羅坊の奥の手をしのぶことはできないのである。"
"212","sakaguchi","03hanatenguryu.txt",""
"213","sakaguchi","03hanatenguryu.txt","しかし村のジサ、バサの言うところによると、なんでもないナギナタの舞いのように見えて、しとやかに、やさしく、美しく、あでやかな差す手引く手にすぎないが、この奥には無限の修錬がつまれていて、ミコサマはナギナタの奥儀に達し、そこに至るまでには、実に泣き、血を吐かんばかりの苦しい修業をつまねばならないのであるという。"
"214","sakaguchi","03hanatenguryu.txt","ミコサマの生涯は、美しく着飾り、うまい物をたらふく食べて威張りかえっているようであるが、どういたしまして。"
"215","sakaguchi","03hanatenguryu.txt","七ツ八ツから、人の寝しずまった深夜に、冷水を浴びせられてミソギをさせられ、つらい悲しい修業をつまされているのだ。"
"216","sakaguchi","03hanatenguryu.txt","だから、とても並の人間にはつとまらない。"
"217","sakaguchi","03hanatenguryu.txt","ミコサマはアンニャが腹の中にいるうちから、生れてくる村の女の子に目をつけて、特別のジャベを物色しているのだそうである。"
"218","sakaguchi","03hanatenguryu.txt",""
"219","sakaguchi","03hanatenguryu.txt","オトコジャベと呼ばれるぐらいだから、オレがミコサマの目にかなう特別のジャベだろうと、クマは七ツ八ツのとき、自らひそかに恃んでいた。"
"220","sakaguchi","03hanatenguryu.txt","そして祭礼のとき、ミコサマが舞いを舞うと、自分の方ばかり見ているような気がして、あかくなって、顔を上げることができないのである。"
"221","sakaguchi","03hanatenguryu.txt",""
"222","sakaguchi","03hanatenguryu.txt","当ては外れた。"
"223","sakaguchi","03hanatenguryu.txt","ミコサマはあんなにジッと自分を見ていたのであるから、そんな筈はないのであるが、オソメというどこにもここにもあるジャベの一人にすぎないのが選ばれてミコサマにひきとられてしまったのである。"
"224","sakaguchi","03hanatenguryu.txt","ちょッと突いても、スッとんで泣きだすような女の子で、なんの取柄もないのに、世間は案外なもので、"
"225","sakaguchi","03hanatenguryu.txt","「オソメがミコサマの目ガネにかのうたてや。"
"226","sakaguchi","03hanatenguryu.txt","大したもんだ。"
"227","sakaguchi","03hanatenguryu.txt","ミコサマの目は良う睨んだもんだわ。"
"228","sakaguchi","03hanatenguryu.txt","オッカネ。"
"229","sakaguchi","03hanatenguryu.txt","オッカネ」"
"230","sakaguchi","03hanatenguryu.txt","「本気に、オッカネなア。"
"231","sakaguchi","03hanatenguryu.txt","それに、オソメは綺麗だてば」"
"232","sakaguchi","03hanatenguryu.txt","村の人々はそう云って賞讃した。"
"233","sakaguchi","03hanatenguryu.txt","クマが甚しく心外であったのは言うまでもない。"
"234","sakaguchi","03hanatenguryu.txt",""
"235","sakaguchi","03hanatenguryu.txt","オソメが病気になって死んでしまえばいいと思っていたのに、馬にも蹴られずに無事に育って、次のミコサマはなんてまア美しくて品があるのだろうと評判が良くなるばかりであった。"
"236","sakaguchi","03hanatenguryu.txt","そして天狗のアンニャの元服の時にヨメの式もあげて、晴れてミコサマの跡をつぐことになった。"
"237","sakaguchi","03hanatenguryu.txt","クマときては、それから五年たってもヨメに所望する者がない。"
"238","sakaguchi","03hanatenguryu.txt","クマはそれを天意と見た。"
"239","sakaguchi","03hanatenguryu.txt","つまり近々オソメが死んで、自分が改めてミコサマに選ばれるための天のハイザイであろうと見ていたのである。"
"240","sakaguchi","03hanatenguryu.txt",""
"241","sakaguchi","03hanatenguryu.txt","あにはからんや、オソメは死なずに、キンカの野郎のオカカからヨメの口の所望がきた。"
"242","sakaguchi","03hanatenguryu.txt","ツラツラ思えばヨメの所望をうけるのはマンザラではないから、してみると、もう結婚してもいいという天のハイザイであろう、神様の思想が変ることもあるものだ、と、クマはよろこんでキンカの野郎のヨメになった。"
"243","sakaguchi","03hanatenguryu.txt",""
"244","sakaguchi","03hanatenguryu.txt","しかし馬吉の一家のアクセク働くこと。"
"245","sakaguchi","03hanatenguryu.txt","オカカは朝ッパラからラッパのようにブウブウ云って、野良へでればまるでテンカンを起したような忙しさでクワをふりふり働いてけつかる。"
"246","sakaguchi","03hanatenguryu.txt","ああ、なんたることだ、と思えば、そぞろ無念でたまらないのはオソメである。"
"247","sakaguchi","03hanatenguryu.txt","たしかに、あのとき、ミコサマは鈴をふって舞いながら、ジッと自分ばかり見ていたはずだ。"
"248","sakaguchi","03hanatenguryu.txt","その目がいまでも自分の額にも腕にも背中にもしみついて、かゆいような気がする。"
"249","sakaguchi","03hanatenguryu.txt","どうしてオソメが天狗様のアンニャのヨメになり、自分がキンカの野郎のヨメになったか、どう考えてもワケが分らない。"
"250","sakaguchi","03hanatenguryu.txt",""
"251","sakaguchi","03hanatenguryu.txt","馬吉のオカカがラッパを吹くたびに、アネサは実に虚無を感じた。"
"252","sakaguchi","03hanatenguryu.txt","全身の力が一時にぬけてしまう。"
"253","sakaguchi","03hanatenguryu.txt","決して怠けているのではない。"
"254","sakaguchi","03hanatenguryu.txt","シンからねむたくなったり、力がスッカリぬけおちて身動きをするのもイヤになる。"
"255","sakaguchi","03hanatenguryu.txt","誰が一々返事をしたり、喋ったりする気持になるものか。"
"256","sakaguchi","03hanatenguryu.txt",""
"257","sakaguchi","03hanatenguryu.txt","しかし、どうしても、オソメが死ぬような気がするのであった。"
"258","sakaguchi","03hanatenguryu.txt","谷を渡るとき、足をすべらして死ぬような気がする。"
"259","sakaguchi","03hanatenguryu.txt","ちょッと病気では死なないようだ。"
"260","sakaguchi","03hanatenguryu.txt","いくらヒヨワに育っても、若い者はなかなか病気ぐらいではくたばらないのが実に面白くないことである。"
"261","sakaguchi","03hanatenguryu.txt","オソメが死ぬ。"
"262","sakaguchi","03hanatenguryu.txt","ミコサマはビックリして、自分が考えちがいしていたことに気がつく。"
"263","sakaguchi","03hanatenguryu.txt","選ぶべからざるオソメを選んだアヤマチに気がつくのである。"
"264","sakaguchi","03hanatenguryu.txt","どうしてミコサマともあろうものがそんな軽率なことをしてしまったか。"
"265","sakaguchi","03hanatenguryu.txt","しかし、今からでもおそくはない。"
"266","sakaguchi","03hanatenguryu.txt","ミコサマは空をきる矢のように畑や森や谷をとんで、クマをむかえにくる。"
"267","sakaguchi","03hanatenguryu.txt","そうでなければならないはずだ。"
"268","sakaguchi","03hanatenguryu.txt","さもなければ、てんで話が合わない。"
"269","sakaguchi","03hanatenguryu.txt","キンカの野郎のアネサは朝ごとにオカカの奴が耳もとでラッパをふいてゆり起すたびに、今日こそは、と考える。"
"270","sakaguchi","03hanatenguryu.txt","オソメが谷を渡りそこなって死ぬ。"
"271","sakaguchi","03hanatenguryu.txt","ミコサマがとんでくる。"
"272","sakaguchi","03hanatenguryu.txt","アネサはだんだんねむくなる。"
"273","sakaguchi","03hanatenguryu.txt","それは快いねむりだ。"
"274","sakaguchi","03hanatenguryu.txt","オカカのラッパがどんなに音色が高くても、もうきこえる筈はない。"
"275","sakaguchi","03hanatenguryu.txt","オソメが谷を渡っている。"
"276","sakaguchi","03hanatenguryu.txt","足をすべらしている。"
"277","sakaguchi","03hanatenguryu.txt","ミコサマが畑や森の上をとんでいるのだ。"
"278","sakaguchi","03hanatenguryu.txt",""
"279","sakaguchi","03hanatenguryu.txt","ところが思いがけないことになった。"
"280","sakaguchi","03hanatenguryu.txt","オソメが谷を渡りそこなって死なないうちに、ミコサマの方が死んでしまったのだ。"
"281","sakaguchi","03hanatenguryu.txt","こうなれば、もはや取り返しがつかない。"
"282","sakaguchi","03hanatenguryu.txt","オソメはすでに決定的にミコサマなのである。"
"283","sakaguchi","03hanatenguryu.txt","否、すでに彼女はミコサマであった。"
"284","sakaguchi","03hanatenguryu.txt",""
"285","sakaguchi","03hanatenguryu.txt","どうして、そんなことになったのか。"
"286","sakaguchi","03hanatenguryu.txt","キンカの野郎のアネサは途方にくれた。"
"287","sakaguchi","03hanatenguryu.txt","どう考えてもフシギであった。"
"288","sakaguchi","03hanatenguryu.txt","ただ途方にくれ、考えあぐねるばかりであった。"
"289","sakaguchi","03hanatenguryu.txt",""
"290","sakaguchi","03hanatenguryu.txt","ミコサマの葬式もすんだ。"
"291","sakaguchi","03hanatenguryu.txt","天狗様のアンニャのアネサが新しいミコサマだということは、もはや誰も疑ぐる者がなかった。"
"292","sakaguchi","03hanatenguryu.txt","キンカの野郎のアネサが本当のミコサマになるジャベで、先代のミコサマの軽率な思いちがいであったことは、もはや誰にも知れることがないような、フシギなことになったのである。"
"293","sakaguchi","03hanatenguryu.txt",""
"294","sakaguchi","03hanatenguryu.txt","キンカの野郎のアネサは、たまりかねて、天狗様のアンニャのアネサをよびだした。"
"295","sakaguchi","03hanatenguryu.txt","彼女は相手をミコサマだとは思わなかった。"
"296","sakaguchi","03hanatenguryu.txt","ただの天狗のアネサである。"
"297","sakaguchi","03hanatenguryu.txt","そのアネサを手長神社のホコラの裏手へよびだして、"
"298","sakaguchi","03hanatenguryu.txt","「ンナ、どうして本気のことを村の人に言わねのか。"
"299","sakaguchi","03hanatenguryu.txt","いつまでも隠してけつかると、かんべんしねど」"
"300","sakaguchi","03hanatenguryu.txt","ミコサマはヤブから棒の話におどろいた。"
"301","sakaguchi","03hanatenguryu.txt",""
"302","sakaguchi","03hanatenguryu.txt","「なんの話なのよ。"
"303","sakaguchi","03hanatenguryu.txt","あなたの言うこと、わけがわからないわ」"
"304","sakaguchi","03hanatenguryu.txt","「わけがわからね？この野郎、しらッぱくれると、くらすけるから、そう思え。"
"305","sakaguchi","03hanatenguryu.txt","ミコサマが死ぬ時の遺言、隠してけつかるでねか」"
"306","sakaguchi","03hanatenguryu.txt","「お母さんの遺言て、どんな遺言？」"
"307","sakaguchi","03hanatenguryu.txt","「この野郎ゥ。"
"308","sakaguchi","03hanatenguryu.txt","どうォしても、言わねか。"
"309","sakaguchi","03hanatenguryu.txt","ミコサマは死ぬとき、ンナに遺言したでねか。"
"310","sakaguchi","03hanatenguryu.txt","オレが死んだら、キンカの野郎のアネサにたのんでミコサマになってもらえと言うたでねか。"
"311","sakaguchi","03hanatenguryu.txt","オレの見違げえだッたと言うだろが。"
"312","sakaguchi","03hanatenguryu.txt","ミコサマが舞うている時目エつけたのはキンカの野郎のアネサのがんだわ。"
"313","sakaguchi","03hanatenguryu.txt","その時ンナがアネサの横に居たがんだ。"
"314","sakaguchi","03hanatenguryu.txt","ミコサマが一舞いクルリと振向いた時、ンナがアネサの前にのさばって出て居たろが。"
"315","sakaguchi","03hanatenguryu.txt","そらすけ、ミコサマが取りまちがえてしもうたがんだわ。"
"316","sakaguchi","03hanatenguryu.txt","ミコサマはンナに言うたろが。"
"317","sakaguchi","03hanatenguryu.txt","ンナことをアンニャのヨメにもろうたのは、かえすがえすもオレのマチゲエであった。"
"318","sakaguchi","03hanatenguryu.txt","ンナとキンカの野郎のアネサは入れ代らねばならね。"
"319","sakaguchi","03hanatenguryu.txt","ンナはミコサマにはなれねえジャベであるから、キンカの野郎のアネサにたのんで来てもろえ。"
"320","sakaguchi","03hanatenguryu.txt","この村にジャベは一パイ居るけれども、ミコサマたるべきジャベはあのアネサのほかには居ねがんだ。"
"321","sakaguchi","03hanatenguryu.txt","そう言うたろが。"
"322","sakaguchi","03hanatenguryu.txt","オレが死んだら、ンナはキンカの野郎のアネサのとこへ行かねばならぬ。"
"323","sakaguchi","03hanatenguryu.txt","そうして、キンカの野郎のアネサに来てもろてミコサマになってもろて、ンナはその代りにキンカの野郎のアネサにしてもろえばええがんだ。"
"324","sakaguchi","03hanatenguryu.txt","そう言うたろが。"
"325","sakaguchi","03hanatenguryu.txt","ンナそれ聞いていたねッか。"
"326","sakaguchi","03hanatenguryu.txt","この野郎。"
"327","sakaguchi","03hanatenguryu.txt","ンナ、どういうわけでキンカの野郎のアネサのとこへ行かねがんだ。"
"328","sakaguchi","03hanatenguryu.txt","コラ。"
"329","sakaguchi","03hanatenguryu.txt","どうら。"
"330","sakaguchi","03hanatenguryu.txt","キンカの野郎のアネサと云うがんはオレのことらわ」"
"331","sakaguchi","03hanatenguryu.txt","ミコサマはとんでもないインネンをつけられて弱った。"
"332","sakaguchi","03hanatenguryu.txt",""
"333","sakaguchi","03hanatenguryu.txt","「お母さんはそんなこと言わなかったわよ」"
"334","sakaguchi","03hanatenguryu.txt","「この野郎ゥ」"
"335","sakaguchi","03hanatenguryu.txt","「あなた、そんなこと、誰から聞いたの？誰がそんなこと言ったのよ」"
"336","sakaguchi","03hanatenguryu.txt","「この野郎ゥ。"
"337","sakaguchi","03hanatenguryu.txt","よウし言わねな」"
"338","sakaguchi","03hanatenguryu.txt","キンカ野郎のアネサは歯をバリバリかんで口惜しがった。"
"339","sakaguchi","03hanatenguryu.txt","しかし分別深げに、ジックリとうちうなずいて、"
"340","sakaguchi","03hanatenguryu.txt","「ようし。"
"341","sakaguchi","03hanatenguryu.txt","わかった。"
"342","sakaguchi","03hanatenguryu.txt","ンナ、どうしても、ミコサマの位を盗もてがんだな。"
"343","sakaguchi","03hanatenguryu.txt","ンナがその気らば、オレもカンベンしね。"
"344","sakaguchi","03hanatenguryu.txt","ンナ、ミコサマになろてがだば、ナギナタできるろ。"
"345","sakaguchi","03hanatenguryu.txt","そうらろが。"
"346","sakaguchi","03hanatenguryu.txt","できねばならねもんだろが。"
"347","sakaguchi","03hanatenguryu.txt","ンナがミコサマの位盗もてがんだば、ンナはオレにナギナタの試合して勝たねばならんど。"
"348","sakaguchi","03hanatenguryu.txt","ンナ、オレを打ち殺さねば、ミコサマにはなれねわ。"
"349","sakaguchi","03hanatenguryu.txt","オレの目玉の黒いうちは、ンナ、ミコサマになれねど。"
"350","sakaguchi","03hanatenguryu.txt","あしたの朝、まら皆んなの起きね時、オレがここへナギナタ持って来るすけ、ンナもナギナタ持ってこい。"
"351","sakaguchi","03hanatenguryu.txt","ンナが勝つか、オレが勝つか。"
"352","sakaguchi","03hanatenguryu.txt","どッちか一人は死なねばならんど。"
"353","sakaguchi","03hanatenguryu.txt","ンナがミコサマの位盗もてがんだば、オレを殺さねばなれねがんだ。"
"354","sakaguchi","03hanatenguryu.txt","わかったか」"
"355","sakaguchi","03hanatenguryu.txt","とうとう二人は明朝太陽の登る時刻に、ホコラの前でナギナタの果し合いをすることになった。"
"356","sakaguchi","03hanatenguryu.txt",""
"357","sakaguchi","03hanatenguryu.txt","馬吉のオカカは、どうも近頃アネサの様子が変だと思っていたのである。"
"358","sakaguchi","03hanatenguryu.txt","用がある筈もないのに、野良をはなれてどこかへ行くから、いったいアネサどこへ行きやがるのだろうと秘かに後をつけて来た。"
"359","sakaguchi","03hanatenguryu.txt","そしてホコラの裏へミコサマをよびだして怖しい約束をむすんだテンマツをみんな見とどけたのである。"
"360","sakaguchi","03hanatenguryu.txt",""
"361","sakaguchi","03hanatenguryu.txt","「どうも、変テコらて。"
"362","sakaguchi","03hanatenguryu.txt","オラトコのアネサは浮気だけはしねもんだと思うていたが、天狗様のアンニャに惚れていたがんだろか。"
"363","sakaguchi","03hanatenguryu.txt","あんげの熊だか鬼みてのオッカネ女が、誰に惚れても、なんにもならねエもんだろが、面ッ白ャエことになったもんだわ」"
"364","sakaguchi","03hanatenguryu.txt","と、オカカはタマゲて、庄屋のオトトのところへ報告にでかけたのである。"
"365","sakaguchi","03hanatenguryu.txt",""
"366","sakaguchi","03hanatenguryu.txt",""
"367","sakaguchi","03hanatenguryu.txt","★"
"368","sakaguchi","03hanatenguryu.txt",""
"369","sakaguchi","03hanatenguryu.txt","庄屋のオトトも、この話にはブッタマゲた。"
"370","sakaguchi","03hanatenguryu.txt",""
"371","sakaguchi","03hanatenguryu.txt","「ンナ、それ、本気の話らか」"
"372","sakaguchi","03hanatenguryu.txt","「何言うてるがんだね。"
"373","sakaguchi","03hanatenguryu.txt","オラトコへ来てみなれ。"
"374","sakaguchi","03hanatenguryu.txt","オラトコのアネサは、オラトコにナギナタがないすけ、一丈五尺もある樫の棒をこしらえてるれ。"
"375","sakaguchi","03hanatenguryu.txt","それでミコノサマをしャぎつけよてがんだ」"
"376","sakaguchi","03hanatenguryu.txt","しャぎつける、は、叩きつける、ぶちのめすと云うことだ。"
"377","sakaguchi","03hanatenguryu.txt",""
"378","sakaguchi","03hanatenguryu.txt","「フウン。"
"379","sakaguchi","03hanatenguryu.txt","それは大変なことが出来たもんだ。"
"380","sakaguchi","03hanatenguryu.txt","ンナ、どうしる気らか」"
"381","sakaguchi","03hanatenguryu.txt","「オラ、知らね」"
"382","sakaguchi","03hanatenguryu.txt","「オレも知らねわ」"
"383","sakaguchi","03hanatenguryu.txt","どうも、困った。"
"384","sakaguchi","03hanatenguryu.txt","キンカの野郎のアネサに理を説いても、すべて論争が役に立たないタテマエであるから話にならない。"
"385","sakaguchi","03hanatenguryu.txt",""
"386","sakaguchi","03hanatenguryu.txt","「マア、なんだわ。"
"387","sakaguchi","03hanatenguryu.txt","ミコサマは利巧な人らすけ、バカなことは、しなさらねにきまってるわ。"
"388","sakaguchi","03hanatenguryu.txt","仕方がねえすけ、オレもあしたの朝は天狗様へ行って待ってるわ。"
"389","sakaguchi","03hanatenguryu.txt","オカカも来ねばならんど。"
"390","sakaguchi","03hanatenguryu.txt","オトトもキンカの野郎も連れて来た方がええがんだ。"
"391","sakaguchi","03hanatenguryu.txt","万が一、アネサがあたけやがったら手がつけられねわ。"
"392","sakaguchi","03hanatenguryu.txt","オッカネなア。"
"393","sakaguchi","03hanatenguryu.txt","オラも、こんげのオッカネことは、生れてから聞いたことがねえもんだて。"
"394","sakaguchi","03hanatenguryu.txt","誰に来てもろたら、ええもんだろか。"
"395","sakaguchi","03hanatenguryu.txt","この村にいッち強ッついモンは、困ったもんだのう、一番目はあのアネサにきまッてるこて。"
"396","sakaguchi","03hanatenguryu.txt","あのアネサがオッカねえというモンは、どこの誰らろかのう？」"
"397","sakaguchi","03hanatenguryu.txt","庄屋が大そう苦心しているところへ、ちょうどいいアンバイに、たそがれたころ、遠乗りの家老が山道に行きなやみ、一人の侍をしたがえて庄屋のところへ辿りついた。"
"398","sakaguchi","03hanatenguryu.txt",""
"399","sakaguchi","03hanatenguryu.txt","庄屋から明朝の果し合いの話をきいて大いに興がり、よろこんで一しょに行ってくれることになった。"
"400","sakaguchi","03hanatenguryu.txt","まさかミコサマが相手になって出てくることはあるまいが、アネサがそれを怒って、天狗様の屋敷の門をぶち破ってあたけはじめたら、家老と侍が取り抑えてくれる約束であった。"
"401","sakaguchi","03hanatenguryu.txt",""
"402","sakaguchi","03hanatenguryu.txt","翌朝になった。"
"403","sakaguchi","03hanatenguryu.txt",""
"404","sakaguchi","03hanatenguryu.txt","まだ真ッ暗のうちから、家老は庄屋の案内でホコラの前の物蔭に隠れていた。"
"405","sakaguchi","03hanatenguryu.txt","そこへ馬吉のオカカが血相変えて駈けつけたが、家老を見るとホッとして、"
"406","sakaguchi","03hanatenguryu.txt","「オラ、ほんに安心したれね。"
"407","sakaguchi","03hanatenguryu.txt","あのネボスケのアネサが今日は暗いうちに起きたもんだ。"
"408","sakaguchi","03hanatenguryu.txt","マサカと思うていたがんだがね。"
"409","sakaguchi","03hanatenguryu.txt","オラ、ビックリして、オトトもキンカの野郎も叩き起しているヒマがありましねがんだ。"
"410","sakaguchi","03hanatenguryu.txt","別の道からアネサの一足先に報らせに飛んで来ましたがんだろも、アネサは本気に殺す気られね。"
"411","sakaguchi","03hanatenguryu.txt","太ッてえ樫の棒られねエ。"
"412","sakaguchi","03hanatenguryu.txt","あんげのもんで、アネサの力でしャぎつけられて見なれや。"
"413","sakaguchi","03hanatenguryu.txt","虎れも熊れも狼れもダメらてば。"
"414","sakaguchi","03hanatenguryu.txt","オラ、胸がまらドキドキして、どうしていいがんだか分らねわ。"
"415","sakaguchi","03hanatenguryu.txt","たのむれね。"
"416","sakaguchi","03hanatenguryu.txt","アネサ、今、来ますれね。"
"417","sakaguchi","03hanatenguryu.txt","なんにしても、ほんにオッカナげな太ッてえ棒らわ」"
"418","sakaguchi","03hanatenguryu.txt","と云っているうちに、夜がだんだん白んできた。"
"419","sakaguchi","03hanatenguryu.txt",""
"420","sakaguchi","03hanatenguryu.txt","アネサが現れた。"
"421","sakaguchi","03hanatenguryu.txt","なるほど太くて長い樫の棒を担いでいるが、まさかの用意か、クワも一本ぶらさげている。"
"422","sakaguchi","03hanatenguryu.txt","ちゃんと野良ごしらえ、手甲にキャハン。"
"423","sakaguchi","03hanatenguryu.txt","ハチマキまでキリリとしめている。"
"424","sakaguchi","03hanatenguryu.txt","殺気満々たるものがある。"
