"","auth","piece","line"
"425","sakaguchi","03hanatenguryu.txt","オカカがドキドキするのもムリがない。"
"426","sakaguchi","03hanatenguryu.txt","庄屋はアネサを一目見ると、蛇に見こまれたように、冷汗が流れ、からだがふるえて、動けなくなってしまった。"
"427","sakaguchi","03hanatenguryu.txt",""
"428","sakaguchi","03hanatenguryu.txt","「家老様が来てくれたのは良かったろも、こんげのジサマにあのアネサがふんづかまるもんだろか。"
"429","sakaguchi","03hanatenguryu.txt","家老様に万が一のことがあると、オラの首が危ねもんだが、困ったことになるもんだわ」"
"430","sakaguchi","03hanatenguryu.txt","と、庄屋は大いに悲しくなった。"
"431","sakaguchi","03hanatenguryu.txt",""
"432","sakaguchi","03hanatenguryu.txt","ところが、とんでもなく意外なことが起ったのである。"
"433","sakaguchi","03hanatenguryu.txt",""
"434","sakaguchi","03hanatenguryu.txt","アネサがまだイライラして天狗様の屋敷の門をぶち破らぬうちに、門が静かに開いて、花のような装束の人がただ一人現れてきた。"
"435","sakaguchi","03hanatenguryu.txt","ミコサマだ。"
"436","sakaguchi","03hanatenguryu.txt","ミコサマは細身のナギナタを持っている。"
"437","sakaguchi","03hanatenguryu.txt","本当に真剣勝負をやるツモリらしいのである。"
"438","sakaguchi","03hanatenguryu.txt",""
"439","sakaguchi","03hanatenguryu.txt","村の伝えによると、調多羅坊のナギナタの手がミコサマからミコサマへと伝授していることにはなっているが、そういう伝説があるだけで、誰も見たものがなく、信用している者もいない。"
"440","sakaguchi","03hanatenguryu.txt",""
"441","sakaguchi","03hanatenguryu.txt","第一、調多羅坊は全長一丈五尺、刃先の長さだけで六尺七寸五分の天下一の大ナギナタをふりまわしたことになっているが、それに匹敵する大物をぶら下げているのはアネサの方で、ミコサマは一間よりもちょッと長いぐらいの祭礼用の飾りのついたナギナタを持っているだけだ。"
"442","sakaguchi","03hanatenguryu.txt","ミコサマがナギナタの達人なら伝説に合わなければならないのだが、全然伝説に合ってやしない。"
"443","sakaguchi","03hanatenguryu.txt","イヤハヤ、とんでもないことになった。"
"444","sakaguchi","03hanatenguryu.txt",""
"445","sakaguchi","03hanatenguryu.txt","ミコサマが現れるのを見ると、すでに殺気満々たるアネサはさらに一段とひきしまって、もはや殺気は張りさけるばかり。"
"446","sakaguchi","03hanatenguryu.txt","おのずからその極に達して、一言の発する言葉もなく、キッと構える大きな棒。"
"447","sakaguchi","03hanatenguryu.txt","アネサはすでに構えた。"
"448","sakaguchi","03hanatenguryu.txt",""
"449","sakaguchi","03hanatenguryu.txt","アネサは腕に覚えがあるのだ。"
"450","sakaguchi","03hanatenguryu.txt","相手をなぐり倒せばいいのである。"
"451","sakaguchi","03hanatenguryu.txt","それには先方がこッちに打ッてかかる先に、相手をしャぎ伏せてしまえばいい。"
"452","sakaguchi","03hanatenguryu.txt","アネサの棒は一丈ぐらいある。"
"453","sakaguchi","03hanatenguryu.txt","ミコサマのナギナタは六尺ぐらいしかありやしない。"
"454","sakaguchi","03hanatenguryu.txt","ナギナタはこッちに届かなくても、こッちの棒は先方へ届くし、アネサのふり払う棒の速さをただのジャベが体をかわせる筈はないのである。"
"455","sakaguchi","03hanatenguryu.txt",""
"456","sakaguchi","03hanatenguryu.txt","アネサは怠け者ではあるが、年百年中クワをふり下しふり上げているし、斧で大木を斬り倒すのも馴れている。"
"457","sakaguchi","03hanatenguryu.txt","男の野郎が三百ふり降して斬り倒す木を、アネサは百もかからずに斬り倒すことができる。"
"458","sakaguchi","03hanatenguryu.txt","木を斬る斧にも、斬り下げる要領はあるし、斧の先にこもる力と、それを按配してふり下す握りにかかる力との釣合い。"
"459","sakaguchi","03hanatenguryu.txt","それは何を斬り、何をふり廻す要領にも通じているものだ。"
"460","sakaguchi","03hanatenguryu.txt",""
"461","sakaguchi","03hanatenguryu.txt","アネサはチャンと心得ているのだ。"
"462","sakaguchi","03hanatenguryu.txt","アネサは棒の握りが外れないようにギザギザを入れて仕掛を施しているばかりでなく、棒の先に鉄をはめて、自分の一振りに最適の速さ重さのかかるような仕掛も施しているのだ。"
"463","sakaguchi","03hanatenguryu.txt",""
"464","sakaguchi","03hanatenguryu.txt","アネサは決してクワや斧を握るように棒を握ったり、それと同じように棒を構えてはいなかった。"
"465","sakaguchi","03hanatenguryu.txt","その棒にふさわしく、然るべく構えている。"
"466","sakaguchi","03hanatenguryu.txt","上からふり下すのではない。"
"467","sakaguchi","03hanatenguryu.txt","それは外れることが多い。"
"468","sakaguchi","03hanatenguryu.txt","アネサは水平にふり払うツモリなのだ。"
"469","sakaguchi","03hanatenguryu.txt","しかし水平に構えているわけではない。"
"470","sakaguchi","03hanatenguryu.txt","ちょうど野球のバットぐらいの角度に、肩からふり下しふり払うツモリなのである。"
"471","sakaguchi","03hanatenguryu.txt","その構えは、野球の選手のようにスマートである筈はないが、決して力点が狂ったりハズしたりはしていない。"
"472","sakaguchi","03hanatenguryu.txt","それどころか、必殺の気魄がこもり、その一撃のきまるところ、結果は歴々として、あまりの怖しさに身の毛がよだつようであった。"
"473","sakaguchi","03hanatenguryu.txt",""
"474","sakaguchi","03hanatenguryu.txt","アネサの必殺の気魄に応じて、静々と現れたミコサマであったが、響きに応ずる自然の構え、一瞬にして応戦の気魄は移っている。"
"475","sakaguchi","03hanatenguryu.txt","全然両者無言のうちに、すでに戦いは始っているのだ。"
"476","sakaguchi","03hanatenguryu.txt",""
"477","sakaguchi","03hanatenguryu.txt","ミコサマは充分用意しないうちに、アネサの必殺の気魄に応じて、その瞬間の姿勢のまま一瞬同じ気魄だけ移して構えに変ったから、見た目にはアネサのように充分の構えが出来ているようではないけれども、それがたしかに、構えであるということは分った。"
"478","sakaguchi","03hanatenguryu.txt","まるで小鳥が羽を立てているような、どうも大したものではない。"
"479","sakaguchi","03hanatenguryu.txt",""
"480","sakaguchi","03hanatenguryu.txt","見ている方には全然分らなかったが、アネサは誘う力を自然にうけて、いきなり棒をふり下し、ふり払ったのである。"
"481","sakaguchi","03hanatenguryu.txt","その瞬間に、これはシマッタと思った。"
"482","sakaguchi","03hanatenguryu.txt","アネサは知っているのだ。"
"483","sakaguchi","03hanatenguryu.txt","棒にこもるカが正しい力であったか、そうでなかったかを。"
"484","sakaguchi","03hanatenguryu.txt","実にその一瞬、アネサは複雑なことを感じとった。"
"485","sakaguchi","03hanatenguryu.txt","敵を見くびったということ。"
"486","sakaguchi","03hanatenguryu.txt","敵は大変な奴だということ。"
"487","sakaguchi","03hanatenguryu.txt","自分が棒をふり下したのではなく、相手の誘いにかかってふり下してしまったということ。"
"488","sakaguchi","03hanatenguryu.txt","そういうことをさせる相手がとんでもない魔力の持主であるということ。"
"489","sakaguchi","03hanatenguryu.txt","だから、ヒドイ目にあうかも知れないということ。"
"490","sakaguchi","03hanatenguryu.txt",""
"491","sakaguchi","03hanatenguryu.txt","しかしアネサは自分の腕を恃んでもいた。"
"492","sakaguchi","03hanatenguryu.txt","少しぐらい力の配分をあやまっても、自分ほどの者がふり下した棒であるから、相手が何者であるにしても、たぶんしャぎ伏せているだろう、と。"
"493","sakaguchi","03hanatenguryu.txt",""
"494","sakaguchi","03hanatenguryu.txt","しかし、アネサの棒は空をきった。"
"495","sakaguchi","03hanatenguryu.txt","そして空をきったとさとって、シマッタと思った時に、アネサの厚い胸は物凄い力で地面にむかって衝突していた。"
"496","sakaguchi","03hanatenguryu.txt","何かの力がそうさせたのだ。"
"497","sakaguchi","03hanatenguryu.txt","そしてそれは、アネサが空をきって横に泳いだ時、背後の方から、首か背か尻のあたりのどこかへ何かの力が加ってそうなったのであるが、アネサにはそれがハッキリわからないのだ。"
"498","sakaguchi","03hanatenguryu.txt",""
"499","sakaguchi","03hanatenguryu.txt","アネサは棒を遠くとばして、大地へ四ツン這いにめりこんでいた。"
"500","sakaguchi","03hanatenguryu.txt","一瞬気を失ったが、すぐ正気に戻った。"
"501","sakaguchi","03hanatenguryu.txt","アネサの胸は岩のようなものだ。"
"502","sakaguchi","03hanatenguryu.txt","一度や二度、気を失ったぐらいで、どうなるというようなチャチな構造ではないのである。"
"503","sakaguchi","03hanatenguryu.txt","第一、必殺の闘志は、それぐらいで、失われやしない。"
"504","sakaguchi","03hanatenguryu.txt",""
"505","sakaguchi","03hanatenguryu.txt","アネサは起き上ると、クワをとって、ふりかぶった。"
"506","sakaguchi","03hanatenguryu.txt","先方は遊んでいるようだった。"
"507","sakaguchi","03hanatenguryu.txt","そう見えた。"
"508","sakaguchi","03hanatenguryu.txt","斬ってくると思ったナギナタの刃がそうではなくて、その行手にサッと心の奪われた時、アネサは斬られず、その石突きで突きあげられて、五六間もケシ飛んでいた。"
"509","sakaguchi","03hanatenguryu.txt",""
"510","sakaguchi","03hanatenguryu.txt","ナギナタの柄の尻の方で突かれるということと、ダイナマイトがヘソのあたりでバクハツしたことと、まるで同じような結果になるものであるらしい。"
"511","sakaguchi","03hanatenguryu.txt","アネサがダイナマイトでヘソのあたりをやられると、たぶんそう感じたであろう。"
"512","sakaguchi","03hanatenguryu.txt","アネサは自分の両手がフワッと左右にひらき、両の股も左右にひらき、左右にひらいたまま手足ははなれて勝手にとんで行ったように思った。"
"513","sakaguchi","03hanatenguryu.txt","つまりダイナマイトにヘソをやられて、手足がとんでいったのである。"
"514","sakaguchi","03hanatenguryu.txt","しかし、ダイナマイトではなかったから、同じように感じはしたが、手も足もバラバラにならずにくッついていたし、くッついていたから、中空の四方にとびちる手足にひきずられて、アネサの胴体は、二十六貫のものをそッくりくッつけたまま、あッけなく、五六間ケシとんでいたのである。"
"515","sakaguchi","03hanatenguryu.txt",""
"516","sakaguchi","03hanatenguryu.txt","地面へ落っこッて、身体がクルクルまわったと思ったのは、アネサの目がまわっただけだった。"
"517","sakaguchi","03hanatenguryu.txt","アネサは五六間ケシとんだ場所へ、気を失って、ぶッ倒れて、全然うごかなかったのである。"
"518","sakaguchi","03hanatenguryu.txt",""
"519","sakaguchi","03hanatenguryu.txt","ミコサマのナギナタの手錬は驚くべきものであったのである。"
"520","sakaguchi","03hanatenguryu.txt","しかし、庄屋と馬吉のオカカには、それがハッキリのみこめなかった。"
"521","sakaguchi","03hanatenguryu.txt","ミコサマのナギナタが手もとでクルッと廻って流れて、何かチョッとなんでもないようなことがあっただけだ。"
"522","sakaguchi","03hanatenguryu.txt","アネサがバカのようにスッとんだだけのことであった。"
"523","sakaguchi","03hanatenguryu.txt",""
"524","sakaguchi","03hanatenguryu.txt","「なんたる手錬。"
"525","sakaguchi","03hanatenguryu.txt","なんたる気合。"
"526","sakaguchi","03hanatenguryu.txt","その静かなること林の如く、動起って雷光も及ばず。"
"527","sakaguchi","03hanatenguryu.txt","これは大変な掘り出し物だ」"
"528","sakaguchi","03hanatenguryu.txt","家老は呆れて、それからようやく驚いて、それからようやく感心して、それから我にかえった。"
"529","sakaguchi","03hanatenguryu.txt",""
"530","sakaguchi","03hanatenguryu.txt","彼はさッそくミコサマを城へつれて行って殿様に披露した。"
"531","sakaguchi","03hanatenguryu.txt","真庭念流の石川淳八郎が立合ってみると、とても、とても、問題にならない。"
"532","sakaguchi","03hanatenguryu.txt","もともと、ナギナタと刀では、現在の剣士に立合わせても、女の子のナギナタの方が勝つ公算が大きいのである。"
"533","sakaguchi","03hanatenguryu.txt","しかしミコサマの手錬は話の外だ。"
"534","sakaguchi","03hanatenguryu.txt",""
"535","sakaguchi","03hanatenguryu.txt","直ちに召抱えられてナギナタ師範になる筈であったが、天狗様の神事をうッちゃるわけにいかないから、ミコサマの職のまま村に止ることになり、心ある武士の娘が出かけて行って習うことになったのである。"
"536","sakaguchi","03hanatenguryu.txt",""
"537","sakaguchi","03hanatenguryu.txt","キンカの野郎のアネサもミコサマの手錬の凄味がつくづく分ったから、"
"538","sakaguchi","03hanatenguryu.txt","「オラ、死なねで、ホンニ、よかったれ。"
"539","sakaguchi","03hanatenguryu.txt","オッカネ。"
"540","sakaguchi","03hanatenguryu.txt","オッカネ」"
"541","sakaguchi","03hanatenguryu.txt","と、それからはいくらか怠け癖も治ったということである。"
"542","sakaguchi","03hanatenguryu.txt",""
"543","sakaguchi","03hanatenguryu.txt",""
"544","sakaguchi","03hanatenguryu.txt",""
"545","sakaguchi","03hanatenguryu.txt",""
"546","sakaguchi","03hanatenguryu.txt","底本：「坂口安吾全集11」筑摩書房"
"547","sakaguchi","03hanatenguryu.txt","1998（平成10）年12月20日初版第1刷発行"
"548","sakaguchi","03hanatenguryu.txt","底本の親本：「別冊文藝春秋第一九号」"
"549","sakaguchi","03hanatenguryu.txt","1950（昭和25）年12月25日発行"
"550","sakaguchi","03hanatenguryu.txt","初出：「別冊文藝春秋第一九号」"
"551","sakaguchi","03hanatenguryu.txt","1950（昭和25）年12月25日"
"552","sakaguchi","03hanatenguryu.txt","※底本は、物を数える際や地名などに用いる「ヶ」（区点番号5-86）を、大振りにつくっています。"
"553","sakaguchi","03hanatenguryu.txt",""
"554","sakaguchi","03hanatenguryu.txt","入力：tatsuki"
"555","sakaguchi","03hanatenguryu.txt","校正：noriko saito"
"556","sakaguchi","03hanatenguryu.txt","2009年8月30日作成"
"557","sakaguchi","03hanatenguryu.txt","青空文庫作成ファイル："
"558","sakaguchi","03hanatenguryu.txt","このファイルは、インターネットの図書館、青空文庫（http://www.aozora.gr.jp/）で作られました。"
"559","sakaguchi","03hanatenguryu.txt","入力、校正、制作にあたったのは、ボランティアの皆さんです。"
"560","sakaguchi","03hanatenguryu.txt",""
