"","auth","piece","line"
"0","sakaguchi","06manbiki_kazoku.txt","明治開化安吾捕物"
"1","sakaguchi","06manbiki_kazoku.txt","その五万引家族"
"2","sakaguchi","06manbiki_kazoku.txt","坂口安吾"
"3","sakaguchi","06manbiki_kazoku.txt",""
"4","sakaguchi","06manbiki_kazoku.txt","-------------------------------------------------------"
"5","sakaguchi","06manbiki_kazoku.txt","【テキスト中に現れる記号について】"
"6","sakaguchi","06manbiki_kazoku.txt",""
"7","sakaguchi","06manbiki_kazoku.txt","《》：ルビ"
"8","sakaguchi","06manbiki_kazoku.txt","（例）良人"
"9","sakaguchi","06manbiki_kazoku.txt",""
"10","sakaguchi","06manbiki_kazoku.txt","｜：ルビの付く文字列の始まりを特定する記号"
"11","sakaguchi","06manbiki_kazoku.txt","（例）二千｜米"
"12","sakaguchi","06manbiki_kazoku.txt",""
"13","sakaguchi","06manbiki_kazoku.txt","：入力者注主に外字の説明や、傍点の位置の指定"
"14","sakaguchi","06manbiki_kazoku.txt","（例）明治開化"
"15","sakaguchi","06manbiki_kazoku.txt",""
"16","sakaguchi","06manbiki_kazoku.txt","／＼：二倍の踊り字（「く」を縦に長くしたような形の繰り返し記号）"
"17","sakaguchi","06manbiki_kazoku.txt","（例）キョロ／＼"
"18","sakaguchi","06manbiki_kazoku.txt","-------------------------------------------------------"
"19","sakaguchi","06manbiki_kazoku.txt",""
"20","sakaguchi","06manbiki_kazoku.txt","スギ子未亡人はシンは心のあたたかい人のようでもある。"
"21","sakaguchi","06manbiki_kazoku.txt","嫁入道具というものを一切持たない咲子の着物のことに気を使ってくれて、季節々々の着物を自分で見たてて作ってくれる。"
"22","sakaguchi","06manbiki_kazoku.txt","顔に親切を見せないし、優しい言葉をかけてくれることも殆どないだけ、シンの親切が身にしみるのだが、しかしとりつく島もない。"
"23","sakaguchi","06manbiki_kazoku.txt","威厳があって、キリリと見るからに利巧らしくて、うちとけることも、甘えることもできないのである。"
"24","sakaguchi","06manbiki_kazoku.txt",""
"25","sakaguchi","06manbiki_kazoku.txt","その未亡人に、万引という病癖があると知って、咲子は呆気にとられた。"
"26","sakaguchi","06manbiki_kazoku.txt","病気というものは、奇妙なものだ。"
"27","sakaguchi","06manbiki_kazoku.txt","実に厳然として威風そなわり、見るからに利巧そのものの大家の奥様が、万引をするとは意外なことだ。"
"28","sakaguchi","06manbiki_kazoku.txt","買う金は腐るほど有り余っている大富豪なのである。"
"29","sakaguchi","06manbiki_kazoku.txt","おまけに、金庫のカギは未亡人の手中にあって、自分で使うぶんには誰に気兼ねもいらないという結構な御身分なのである。"
"30","sakaguchi","06manbiki_kazoku.txt",""
"31","sakaguchi","06manbiki_kazoku.txt","呉服物は三井、貴金属は何屋、小間物は何屋というようにお買いつけの店はきまっている。"
"32","sakaguchi","06manbiki_kazoku.txt","当今のように店に商品が並んでいるわけではなくて、一々奥の土蔵から店のお客様の前まで品物を運んできて、ひろげて見せる。"
"33","sakaguchi","06manbiki_kazoku.txt","その品物の中から、お買上げの物のほかに不足した物があれば、万引の犯人はお買い上げの当人にきまっているし、見ず知らずの人ではなくて、顔の知れたオトクイ様なら、犯人の名は一目瞭然というわけだ。"
"34","sakaguchi","06manbiki_kazoku.txt",""
"35","sakaguchi","06manbiki_kazoku.txt","しかし、商店はなれているから、何食わぬ顔、毎度ありがとうございます、と送り返しておいて、月末のツケの中へ、お買い上げ品として万引の品物も書きこんでおく。"
"36","sakaguchi","06manbiki_kazoku.txt","ちゃんと払って下さるのだから、万引には相違ないが、益々ありがたいオトクイ様でもある。"
"37","sakaguchi","06manbiki_kazoku.txt","諸方の商店は、浅虫家の未亡人御来店とあればたくさん品々を前に並べ、存分に万引していただくことになっている。"
"38","sakaguchi","06manbiki_kazoku.txt",""
"39","sakaguchi","06manbiki_kazoku.txt","ところが、病癖というものは、遺伝するから怖しい。"
"40","sakaguchi","06manbiki_kazoku.txt","咲子の良人の正司には姉に当るキク子が、やっぱり万引してくるのである。"
"41","sakaguchi","06manbiki_kazoku.txt",""
"42","sakaguchi","06manbiki_kazoku.txt","キク子は二十五にもなって、まだ独身者という変り種、非常に美人ではあるが、我が強く、陰気で、無口で、てんで男など眼中にないらしい様子である。"
"43","sakaguchi","06manbiki_kazoku.txt","立居フルマイが荒々しく、投げやりで、奔放だ。"
"44","sakaguchi","06manbiki_kazoku.txt","そういう変り者であるから、万引の手口が豪放をきわめていて、人力とは思えないほどゴッソリ持ってくる。"
"45","sakaguchi","06manbiki_kazoku.txt","コートの裏に何十本というカギのついたヒモがぶら下っていて、ここへ反物を何十反もぶら下げてくるような、妙に芸のこまかい技巧派のところもあるのである。"
"46","sakaguchi","06manbiki_kazoku.txt","母の血をうけて利巧なことは確かであるから、粗雑、奔放のようでも、無口で陰気で考えこんでいるような放心状態のとき、実は万引の手口について新発明をこらしているのかも知れない。"
"47","sakaguchi","06manbiki_kazoku.txt","母にくらべて、大胆不敵、武者振り堂々たる万引常習者であった。"
"48","sakaguchi","06manbiki_kazoku.txt",""
"49","sakaguchi","06manbiki_kazoku.txt","彼女らにとっては、買うことと万引とは、結局同じことにすぎないのに、そこは病人のことで、万引は又特別、戦利品というような快感があるらしい。"
"50","sakaguchi","06manbiki_kazoku.txt","貧故の万引とちがって、金持の万引は完全な病癖なのだから、その快味は又、特別に相違ない。"
"51","sakaguchi","06manbiki_kazoku.txt",""
"52","sakaguchi","06manbiki_kazoku.txt","だから、買ってきた品物は、ちゃんと居間のタンスにしまうけれども、戦利品は土蔵の中へ秘かに隠して貯蔵して、その戦利品の山を日夜のぞきに行って満足しているのだ。"
"53","sakaguchi","06manbiki_kazoku.txt","だから彼女らは、土蔵の中へは誰も入れない。"
"54","sakaguchi","06manbiki_kazoku.txt","土蔵は、この家の一番奥の主人夫妻の居間、今では未亡人一人の居間であるが、そこに接している上に、カギは未亡人の手中にあるから、未亡人の眼を盗んで土蔵に入ることは誰もできない。"
"55","sakaguchi","06manbiki_kazoku.txt","ただ娘のキク子だけは母の居間に出入自由で、同時に土蔵の中へも自由に出入できるらしい。"
"56","sakaguchi","06manbiki_kazoku.txt","二人は特に仲が良いのである。"
"57","sakaguchi","06manbiki_kazoku.txt","共通せる病人のせいかも知れない。"
"58","sakaguchi","06manbiki_kazoku.txt",""
"59","sakaguchi","06manbiki_kazoku.txt","大金持の土蔵であるから、実に壮大雄渾な大土蔵で、花川戸の蔵吉という土蔵造りの名人が、九年かかって仕上げたという国宝的な土蔵であった。"
"60","sakaguchi","06manbiki_kazoku.txt","その大土蔵のどこに、どんな風に戦利品が陳列してあるのか誰も見ることが出来ないが、気品あくまで高き未亡人と、奔放にして美しき娘とが、時々そこへ忍び佇んで戦利品に魅入られている姿を想像すると、咲子は怖しくもあるが、凄いような美しさを感じないこともなかった。"
"61","sakaguchi","06manbiki_kazoku.txt",""
"62","sakaguchi","06manbiki_kazoku.txt","しかし変った家族である。"
"63","sakaguchi","06manbiki_kazoku.txt","何から何まで変っている。"
"64","sakaguchi","06manbiki_kazoku.txt","食事にしても、未亡人とキク子は未亡人の居間で差し向いで食べる。"
"65","sakaguchi","06manbiki_kazoku.txt","フキヤという小女がお二人の係りの女中である。"
"66","sakaguchi","06manbiki_kazoku.txt",""
"67","sakaguchi","06manbiki_kazoku.txt","正司と咲子は、二人の居間で食事する。"
"68","sakaguchi","06manbiki_kazoku.txt","これにはタケヤという小女が係りの女中だ。"
"69","sakaguchi","06manbiki_kazoku.txt",""
"70","sakaguchi","06manbiki_kazoku.txt","正司の弟の一也という大学生は自分の居間で一人で食べる。"
"71","sakaguchi","06manbiki_kazoku.txt","これにはハナヤという小女が係りである。"
"72","sakaguchi","06manbiki_kazoku.txt","まるで銘々旅館に居るようなものである。"
"73","sakaguchi","06manbiki_kazoku.txt","ちゃんとレッキとした大食堂があるのに、殆ど使うことがない。"
"74","sakaguchi","06manbiki_kazoku.txt","しかし尤もな理由もある。"
"75","sakaguchi","06manbiki_kazoku.txt","家族の起居がそれぞれ時間が違っていて、一堂に会して食事をするわけにはいかないのだ。"
"76","sakaguchi","06manbiki_kazoku.txt","未亡人のお目覚めが最もおそくて、九時ごろ。"
"77","sakaguchi","06manbiki_kazoku.txt","で、未亡人が洗顔して朝のお化粧を終ったころ、咲子はその居間の外の廊下に坐って、"
"78","sakaguchi","06manbiki_kazoku.txt","「お母さま、お早うございます。"
"79","sakaguchi","06manbiki_kazoku.txt","お姉さま、お早うございます」"
"80","sakaguchi","06manbiki_kazoku.txt","と挨拶する。"
"81","sakaguchi","06manbiki_kazoku.txt","一日に、その時だけしか、顔を合せないような日も多い。"
"82","sakaguchi","06manbiki_kazoku.txt","用があると、女中がよびにくるが、又、未亡人が自分で咲子のところへ来ることもある。"
"83","sakaguchi","06manbiki_kazoku.txt","キク子はそんなことは殆どない。"
"84","sakaguchi","06manbiki_kazoku.txt","しかし二人とも悪い人ではない。"
"85","sakaguchi","06manbiki_kazoku.txt","風来坊の咲子を憎んだり、さげすんだりしていることはないのである。"
"86","sakaguchi","06manbiki_kazoku.txt","咲子はそれを有り難くは思うが、どうも、打ちとけられない。"
"87","sakaguchi","06manbiki_kazoku.txt","母、姉という肉親感はもつことができなかった。"
"88","sakaguchi","06manbiki_kazoku.txt",""
"89","sakaguchi","06manbiki_kazoku.txt","正司と咲子は恋愛結婚であッた。"
"90","sakaguchi","06manbiki_kazoku.txt","明治には珍しい話で、おまけに咲子は小さな牛肉屋の娘である。"
"91","sakaguchi","06manbiki_kazoku.txt","女中が手不足で、自分で客に給仕するような小さな店だ。"
"92","sakaguchi","06manbiki_kazoku.txt",""
"93","sakaguchi","06manbiki_kazoku.txt","まだ当時大学生の正司と何も知らずに恋仲になり、あんまり飛びはなれた大富豪の子供と分って、これではとても結婚はできないと思った。"
"94","sakaguchi","06manbiki_kazoku.txt","正司の親や親類が許してくれる筈がないからである。"
"95","sakaguchi","06manbiki_kazoku.txt","当時としては、完全に有りうべからざる事情だからだ。"
"96","sakaguchi","06manbiki_kazoku.txt","ところが、案外にも、正司の母は反対しなかった。"
"97","sakaguchi","06manbiki_kazoku.txt","そして正司の卒業と同時に、二人は結婚した。"
"98","sakaguchi","06manbiki_kazoku.txt","時に正司は二十二、咲子は十八。"
"99","sakaguchi","06manbiki_kazoku.txt","咲子は浅虫家の若奥様となったが、それは去年のこと。"
"100","sakaguchi","06manbiki_kazoku.txt","まる一年たった近ごろになって、咲子ははじめて浅虫家の秘密が分った。"
"101","sakaguchi","06manbiki_kazoku.txt","スギ子未亡人が咲子の結婚に反対しなかったも道理、浅虫家は良家と縁組みできかねるような陰惨な血があったのである。"
"102","sakaguchi","06manbiki_kazoku.txt","万引ぐらいは、まだしも呪われた血の中では軽い方の口であった。"
"103","sakaguchi","06manbiki_kazoku.txt",""
"104","sakaguchi","06manbiki_kazoku.txt","咲子は一也という弟の大学生が嫌いであった。"
"105","sakaguchi","06manbiki_kazoku.txt","一也は秀才であった。"
"106","sakaguchi","06manbiki_kazoku.txt","利巧な母と姉にくらべて、この秀才の弟が生れたことは自然であるが、正司だけは不思議に出来が悪い。"
"107","sakaguchi","06manbiki_kazoku.txt","世間から見れば、バカという程ではないのであるが、この家族の中ではバカが目立つ。"
"108","sakaguchi","06manbiki_kazoku.txt","一也は兄をバカ扱いである。"
"109","sakaguchi","06manbiki_kazoku.txt","そこで、その嫁の咲子もバカ扱いだ。"
"110","sakaguchi","06manbiki_kazoku.txt","いつも皮肉な薄笑いでニヤリ、ジロリと見て、ソッポをむく。"
"111","sakaguchi","06manbiki_kazoku.txt","それは言葉で皮肉られるよりも、むしろ腹の立つ仕打ちであった。"
"112","sakaguchi","06manbiki_kazoku.txt",""
"113","sakaguchi","06manbiki_kazoku.txt","その一也が、話のハズミで、実に事もなく、自分の家の呪われた血をバクロしたものだ。"
"114","sakaguchi","06manbiki_kazoku.txt","まるで自分には関係がないように。"
"115","sakaguchi","06manbiki_kazoku.txt",""
"116","sakaguchi","06manbiki_kazoku.txt","未亡人の亡夫浅虫権六は病死となっているけれども、実は自殺したのであった。"
"117","sakaguchi","06manbiki_kazoku.txt","その自殺もタダの自殺ではなかった。"
"118","sakaguchi","06manbiki_kazoku.txt","彼は自分が癩病であることを知った。"
"119","sakaguchi","06manbiki_kazoku.txt","癩の徴候が現れたのを、ひそかに気附いたのである。"
"120","sakaguchi","06manbiki_kazoku.txt","彼はいろいろ癩について調べたあげく、自分がまさしくその病人の一人であることを確信せざるを得なかったのである。"
"121","sakaguchi","06manbiki_kazoku.txt","ついに彼は、発狂して、自殺した。"
"122","sakaguchi","06manbiki_kazoku.txt","しかも、その自殺の悲惨なること。"
"123","sakaguchi","06manbiki_kazoku.txt","彼は自ら刃物をふるって、自分の癩の徴候の部分の肉をえぐり、皮をはいだ。"
"124","sakaguchi","06manbiki_kazoku.txt","自らの額の皮までそぎ落したのである。"
"125","sakaguchi","06manbiki_kazoku.txt","そして、腹を一文字にさいて、自殺した。"
"126","sakaguchi","06manbiki_kazoku.txt",""
"127","sakaguchi","06manbiki_kazoku.txt","咲子は一也の話をにわかに信用するわけにいかなかった。"
"128","sakaguchi","06manbiki_kazoku.txt","とは云え、良人にきいてみるのも怖しい。"
"129","sakaguchi","06manbiki_kazoku.txt","なぜなら、なんとなく思い当る節があるのだ。"
"130","sakaguchi","06manbiki_kazoku.txt",""
"131","sakaguchi","06manbiki_kazoku.txt","この家へ家族のように繁々と出入するたった一人の人物がある。"
"132","sakaguchi","06manbiki_kazoku.txt","その親しさや、威張り返っている様子、人々がなんとなくその人物を煙がりながら鄭重にする様子から、睨みの利く親類の親玉と思っていたら、正司が病気のとき、カバンをぶら下げ、医者になって、診察に来た。"
"133","sakaguchi","06manbiki_kazoku.txt","彼は花田医院の院長であった。"
"134","sakaguchi","06manbiki_kazoku.txt","決して親類ではないのである。"
"135","sakaguchi","06manbiki_kazoku.txt",""
"136","sakaguchi","06manbiki_kazoku.txt","花田がくると、彼は未亡人の居間で酒をのみ、赤い顔をして帰る例であった。"
"137","sakaguchi","06manbiki_kazoku.txt","未亡人はゆすられているらしい。"
"138","sakaguchi","06manbiki_kazoku.txt","咲子は一也の話で、謎が氷解した思いであった。"
"139","sakaguchi","06manbiki_kazoku.txt","亡父権六の癩病、発狂、自殺、という事実を知っているのは花田だけなのだ。"
"140","sakaguchi","06manbiki_kazoku.txt","そして彼が、病死というニセ診断書を書いたのである。"
"141","sakaguchi","06manbiki_kazoku.txt","咲子はそこに思い当った。"
"142","sakaguchi","06manbiki_kazoku.txt",""
"143","sakaguchi","06manbiki_kazoku.txt","正司は次男であった。"
"144","sakaguchi","06manbiki_kazoku.txt","キク子の上に博司という今年二十七になる長男がいるのである。"
"145","sakaguchi","06manbiki_kazoku.txt","ところが、彼は日本には居ない。"
"146","sakaguchi","06manbiki_kazoku.txt","父が死んでまもなく、百ヶ日もすぎないうちに、外国へ行った。"
"147","sakaguchi","06manbiki_kazoku.txt","そして五年になるが、まだ帰ってこない。"
"148","sakaguchi","06manbiki_kazoku.txt","そればかりでなく、向うの女と結婚して、もう帰国する意志がないらしいという話なのである。"
"149","sakaguchi","06manbiki_kazoku.txt","未亡人もキク子も、兄は死んだものと、すでに諦めきっているようであった。"
"150","sakaguchi","06manbiki_kazoku.txt","まったく、この家族たちの感情の上では、兄はもう居ないもの、帰らぬもの、死んだものときまっている様子である。"
"151","sakaguchi","06manbiki_kazoku.txt","咲子は生きている兄がいると知ったときに、信じられないような気持であった。"
"152","sakaguchi","06manbiki_kazoku.txt","その謎も、どうやら、解けるではないか。"
"153","sakaguchi","06manbiki_kazoku.txt","咲子は思い知った。"
"154","sakaguchi","06manbiki_kazoku.txt","博司は生きて日本には帰ることができないワケがあるのだ。"
"155","sakaguchi","06manbiki_kazoku.txt","彼はすでに「癩」に犯されているからである、と。"
"156","sakaguchi","06manbiki_kazoku.txt",""
"157","sakaguchi","06manbiki_kazoku.txt","もう一人、毎月、月末に一度だけ、きまって訪ねてくる怪しい人物がいた。"
"158","sakaguchi","06manbiki_kazoku.txt","野草通作という中年の男である。"
"159","sakaguchi","06manbiki_kazoku.txt","高価な着物を着流しに、いかにも結構な楽隠居という様子であるが、いかにも人品が下司である。"
"160","sakaguchi","06manbiki_kazoku.txt","女中のタケヤにきいてみた。"
"161","sakaguchi","06manbiki_kazoku.txt",""
"162","sakaguchi","06manbiki_kazoku.txt","彼女の話によるよ、野草通作はお茶にも菓子にも手をつけたことがない。"
"163","sakaguchi","06manbiki_kazoku.txt","包んで貰った菓子は、帰るとき、ハイヨ、と云って見送りの女中に投げてやり、毒があっても知らねえよ、と云いすてて帰るのだという。"
"164","sakaguchi","06manbiki_kazoku.txt","タケヤはいかにも顔をしかめて、あの男はイヤらしい好かない人物だという表現をするのであるが、その素性については知らない。"
"165","sakaguchi","06manbiki_kazoku.txt","ここの女中はみんな小女ばかりで、古い女中は一人もいなかった。"
"166","sakaguchi","06manbiki_kazoku.txt",""
"167","sakaguchi","06manbiki_kazoku.txt","女中たちは、花田医師は未亡人の情夫で、野草通作は長兄博司が洋行前に孕ませた女の父だと思っている様子であった。"
"168","sakaguchi","06manbiki_kazoku.txt","毎月一度月末に勘定とりのような正確さで来るので、そう思うのだろう。"
"169","sakaguchi","06manbiki_kazoku.txt","博司には、たしかに恋人がいたのである。"
"170","sakaguchi","06manbiki_kazoku.txt","博司は別れがたいその恋人すらも振りすてて、故国をはなれたのだという、その悲しい話は正司が時々咲子に語ることであった。"
"171","sakaguchi","06manbiki_kazoku.txt",""
"172","sakaguchi","06manbiki_kazoku.txt","咲子は正司にきいた。"
"173","sakaguchi","06manbiki_kazoku.txt",""
"174","sakaguchi","06manbiki_kazoku.txt","「野草さんて、どういう方？」"
"175","sakaguchi","06manbiki_kazoku.txt","こうきかれて、正司はイマイマしげに、顔をそむけたが、"
"176","sakaguchi","06manbiki_kazoku.txt","「彼奴は以前、うちの下男をしていた奴さ。"
"177","sakaguchi","06manbiki_kazoku.txt","何かボロもうけして成りあがったらしい。"
"178","sakaguchi","06manbiki_kazoku.txt","あんな奴には挨拶にも及ばないぜ」"
"179","sakaguchi","06manbiki_kazoku.txt","と答えた。"
"180","sakaguchi","06manbiki_kazoku.txt",""
"181","sakaguchi","06manbiki_kazoku.txt","今にして、咲子は思い当るのだ。"
"182","sakaguchi","06manbiki_kazoku.txt","野草も、亡父の癩病、発狂、自殺、を知る人物なのである、と。"
"183","sakaguchi","06manbiki_kazoku.txt","医師一人で始末のつく事件ではなかった筈だ。"
"184","sakaguchi","06manbiki_kazoku.txt","誰かしら、召使いの中にも、それを知り、その後始末に立働いた人物が居るのは当然であろう。"
"185","sakaguchi","06manbiki_kazoku.txt","野草もユスっているのである。"
"186","sakaguchi","06manbiki_kazoku.txt","毎月、必ず月末に来ることでも、それを知ることができる。"
"187","sakaguchi","06manbiki_kazoku.txt",""
"188","sakaguchi","06manbiki_kazoku.txt","当時、癩病は、伝染病ではなくて、血筋であると思われていたから、咲子の思いは、当然良人も癩病の筋をひき、自分に生れてくる子供も癩病の血をひくものと信ぜざるを得なかった。"
"189","sakaguchi","06manbiki_kazoku.txt",""
"190","sakaguchi","06manbiki_kazoku.txt","咲子は自分の人生が、暗い幕で行手を立ちふさがれたような絶望を思い知った。"
"191","sakaguchi","06manbiki_kazoku.txt","この運命からのがれる術はないであろうか。"
"192","sakaguchi","06manbiki_kazoku.txt","彼女はすでにニンシンしていたのである。"
"193","sakaguchi","06manbiki_kazoku.txt","まだ良人もそのニンシンには気がつかない。"
"194","sakaguchi","06manbiki_kazoku.txt","彼女がそのニンシンを独り気がついたとき、その喜びを死の宣告に代えるための悪魔からの伝言のように、一也が呪われた血の秘密を語りあかしたのであった。"
"195","sakaguchi","06manbiki_kazoku.txt",""
"196","sakaguchi","06manbiki_kazoku.txt","彼女の胎内に宿った者の中には悪魔がすんでいるのだ。"
"197","sakaguchi","06manbiki_kazoku.txt","その胎児をおろし、呪われた浅虫家から逃げだすべきであろうか。"
"198","sakaguchi","06manbiki_kazoku.txt","彼女は良人を愛していた。"
"199","sakaguchi","06manbiki_kazoku.txt","しかし、それよりも、呪われた血が怖しかったのである。"
"200","sakaguchi","06manbiki_kazoku.txt",""
"201","sakaguchi","06manbiki_kazoku.txt","自分を下賤の生れの者と見て、呪われた血の一員に平然ひきこんだ未亡人もキク子も憎らしい。"
"202","sakaguchi","06manbiki_kazoku.txt","又、良人すらも、その悪漢の一人ではないか。"
"203","sakaguchi","06manbiki_kazoku.txt","良家との縁組みは不都合でも、下賤の者ならよかろうというコンタンには変りがないではないか。"
"204","sakaguchi","06manbiki_kazoku.txt",""
"205","sakaguchi","06manbiki_kazoku.txt","咲子はにわかに思いみだれて怒りに狂った。"
"206","sakaguchi","06manbiki_kazoku.txt","彼女は正司を詰問した。"
"207","sakaguchi","06manbiki_kazoku.txt",""
"208","sakaguchi","06manbiki_kazoku.txt","「あなたが牛肉屋の娘を妻に選んだのは、こんな下賤な者なら癩病人の妻になっても苦情はでまいという肚ですね。"
"209","sakaguchi","06manbiki_kazoku.txt","私はもうこんな家には居りません」"
"210","sakaguchi","06manbiki_kazoku.txt","正司は薄ノロではあるが、金持の子供らしく、チャッカリと、ずるいところ、抜け目のないところを失ってはいない。"
"211","sakaguchi","06manbiki_kazoku.txt","いずれ、こうなることを覚悟はしていたらしく、ふだんに似ず冷静に応じた。"
"212","sakaguchi","06manbiki_kazoku.txt",""
"213","sakaguchi","06manbiki_kazoku.txt","「オレが癩病患者の子供だということを隠していたのは、済まないと思っている。"
"214","sakaguchi","06manbiki_kazoku.txt","しかし好きな娘に向って、実はオレの父は癩病になって狂って死んだと云えるわけがないじゃないか。"
"215","sakaguchi","06manbiki_kazoku.txt","決して悪意があって隠していたわけではない。"
"216","sakaguchi","06manbiki_kazoku.txt","オレだって、父が癩病を苦にして狂って自殺したときには寝耳に水、その呪われた運命に茫然としたものだ。"
