"","auth","piece","line"
"423","sakaguchi","06manbiki_kazoku.txt","あるいは、又、一也が疑っているように、悪魔の心の人であるなら、花田は何を企み、何を狙ってキク子を嫁に貰うのであろうか。"
"424","sakaguchi","06manbiki_kazoku.txt","考えてみると、あまりにフシギで、あまりに陰惨で、人の世の常識にかけはなれすぎている。"
"425","sakaguchi","06manbiki_kazoku.txt","まるでワケがわからなかった。"
"426","sakaguchi","06manbiki_kazoku.txt","ただ、何か悪いことが起らぬようにと、咲子は小さな胸をいためていたのである。"
"427","sakaguchi","06manbiki_kazoku.txt","彼女の胎内でも子供は育って、これも次第に生れる日が近づいていた。"
"428","sakaguchi","06manbiki_kazoku.txt",""
"429","sakaguchi","06manbiki_kazoku.txt",""
"430","sakaguchi","06manbiki_kazoku.txt","★"
"431","sakaguchi","06manbiki_kazoku.txt",""
"432","sakaguchi","06manbiki_kazoku.txt","あと十日ほどで結婚式という浅虫家にとっては慌ただしい一日のことであった。"
"433","sakaguchi","06manbiki_kazoku.txt",""
"434","sakaguchi","06manbiki_kazoku.txt","白金の浅虫家の庭は下から五十尺余という高い崖になっているのである。"
"435","sakaguchi","06manbiki_kazoku.txt","その崖下に住んでいる人家に働いている人の目の前に二人の男が上からもつれるように落ちてきた。"
"436","sakaguchi","06manbiki_kazoku.txt","一しょに崩れたらしく三ツ四ツ崖の石が人間と一かたまりに落ちてきた。"
"437","sakaguchi","06manbiki_kazoku.txt","下の家では今庭普請で、たくさん庭石を寄せ集めた上へ落ちたから、たまらない。"
"438","sakaguchi","06manbiki_kazoku.txt","人々が直ちにかけつけた時すでに虫の息、医者をよぶヒマもなく死んでしまった。"
"439","sakaguchi","06manbiki_kazoku.txt","一万余坪の大邸宅、下からグルッとまわって、浅虫家へ報らせるまでが大そうな道のり。"
"440","sakaguchi","06manbiki_kazoku.txt","浅虫家の人が報によって駈けつけてみると、死んでいるのは、花田医師と野草通作であった。"
"441","sakaguchi","06manbiki_kazoku.txt",""
"442","sakaguchi","06manbiki_kazoku.txt","花田は昼から酔っていた。"
"443","sakaguchi","06manbiki_kazoku.txt","そこへ野草が来た。"
"444","sakaguchi","06manbiki_kazoku.txt","花田は飲んでいるが、野草はお茶にも菓子にも手をふれないという用心堅固な人物。"
"445","sakaguchi","06manbiki_kazoku.txt","妙なグアイなところへ、ちょうど家にいて写真機をいじくっていた一也が珍客到来と二人を庭へひきだして撮影をはじめた。"
"446","sakaguchi","06manbiki_kazoku.txt","広い芝生で撮しているうちに、酔った花田が何か言ったことから野草と口論をはじめた。"
"447","sakaguchi","06manbiki_kazoku.txt","一也は撮影がすんだので、口論している二人を庭へのこしてサッサと室内へ戻ってしまった。"
"448","sakaguchi","06manbiki_kazoku.txt","二人は崖の上へ来て争論のあげく、足をふみすべらして崖下へ落ちたものらしい。"
"449","sakaguchi","06manbiki_kazoku.txt",""
"450","sakaguchi","06manbiki_kazoku.txt","喧嘩して落ちて両方死んだのだから、仕方がない。"
"451","sakaguchi","06manbiki_kazoku.txt","ところが妙なことに、花田の方には変ったことは何もないが、野草の住所が分らない。"
"452","sakaguchi","06manbiki_kazoku.txt","浅虫家では誰も彼の住所を知る者がなかった。"
"453","sakaguchi","06manbiki_kazoku.txt","未亡人にきいてみると、彼は住所を誰にも言わなかったし、きき忘れてもいたというのである。"
"454","sakaguchi","06manbiki_kazoku.txt","野草の懐中からは手の切れるような十円札の百枚束、千円という大金のフクサ包みが出てきたが、立派な和紙で包まれていて、小銭入れと別になっているのを見ると、人にやる金か、人から貰った金か、特別な金であるらしく思われる。"
"455","sakaguchi","06manbiki_kazoku.txt","所轄の警察ではちょッと臭くも思ったが、喧嘩両成敗で、二人ともに死んだ以上は文句はない。"
"456","sakaguchi","06manbiki_kazoku.txt","ただ野草の屍体の引取人が現れるのを待っていた。"
"457","sakaguchi","06manbiki_kazoku.txt",""
"458","sakaguchi","06manbiki_kazoku.txt","新聞の記事を見て、野草の女房がひきとりに来た。"
"459","sakaguchi","06manbiki_kazoku.txt","水商売あがりのまだ三十に二ツ三ツ間がありそうな若いちょッとした美人。"
"460","sakaguchi","06manbiki_kazoku.txt","大そう着かざって、威張った女だ。"
"461","sakaguchi","06manbiki_kazoku.txt",""
"462","sakaguchi","06manbiki_kazoku.txt","「変だねえ。"
"463","sakaguchi","06manbiki_kazoku.txt","オレは殺されるかも知れないと、この人は口癖のように言ってたんですよ」"
"464","sakaguchi","06manbiki_kazoku.txt","「誰に殺されるといっていたのだネ」"
"465","sakaguchi","06manbiki_kazoku.txt","「さア。"
"466","sakaguchi","06manbiki_kazoku.txt","誰だか知りませんが、医者の奴がいやがるから、危くッて、お茶も呑めやしねえなんて言ってたんです」"
"467","sakaguchi","06manbiki_kazoku.txt","「それなら話が合っている。"
"468","sakaguchi","06manbiki_kazoku.txt","その医者と組打ちして、崖から落ちて死んだのだ。"
"469","sakaguchi","06manbiki_kazoku.txt","医者も死んだのだから、あきらめなさい」"
"470","sakaguchi","06manbiki_kazoku.txt","「そうですか」"
"471","sakaguchi","06manbiki_kazoku.txt","と、女房は屍体をひきとって退去した。"
"472","sakaguchi","06manbiki_kazoku.txt",""
"473","sakaguchi","06manbiki_kazoku.txt","ところが、その翌日、この女房をかこんで一人の婆さんと年のころ二十二三のイナセな兄チャンが警察へのりこんできた。"
"474","sakaguchi","06manbiki_kazoku.txt","この婆さんが野草の先妻でイナセな兄チャンは野草の長男であった。"
"475","sakaguchi","06manbiki_kazoku.txt","野草が浅虫家の下男の時は、邸内の小住宅に婆さんも長男も一しょに住んでいた。"
"476","sakaguchi","06manbiki_kazoku.txt","先代が急死すると、野草は浅虫家からヒマをもらい、妻子を離別して行方をくらました。"
"477","sakaguchi","06manbiki_kazoku.txt","数年たって、野草の家をつきとめてみると、大そうな金持になっている。"
"478","sakaguchi","06manbiki_kazoku.txt","婆さんが泣きつくと、毎月三十円ずつくれたが、後に手を合して五十円にしても貰った。"
"479","sakaguchi","06manbiki_kazoku.txt","どうして金持になったのか婆さんは知らなかったが、野草が死んだので今のカミサンに会って事情をきいてみると、野草は働いて金を稼いでいたのではない。"
"480","sakaguchi","06manbiki_kazoku.txt","何もしないで、毎月千円ずつ金がはいってくるのである。"
"481","sakaguchi","06manbiki_kazoku.txt","家の中をひッかきまわしても銀行預金というものが在るらしいようには見えないから、今にしてハッキリしたが、その毎月の千円は浅虫家から出ていたものに相違ない。"
"482","sakaguchi","06manbiki_kazoku.txt","今のカミサンは彼が死ぬまで浅虫家のことは知らなかったが、先妻の婆さんには思い当るフシがある。"
"483","sakaguchi","06manbiki_kazoku.txt","浅虫家の先代は何かで急死したのである。"
"484","sakaguchi","06manbiki_kazoku.txt","野草は案外口が堅くて、癩病のこと自殺のことを先妻にもらしていなかったが、ただならぬ屋敷の様子で、何か大きな曰くがあることは察せられたのである。"
"485","sakaguchi","06manbiki_kazoku.txt",""
"486","sakaguchi","06manbiki_kazoku.txt","毎月千円という大金を五年間もゆすッていたとは驚くべきこと、いかに先方が大金持にしても、よほどの秘密に相違ない。"
"487","sakaguchi","06manbiki_kazoku.txt","それほどの大秘密を握っている人物を生かしておきたくはないから、これは殺されたと見るのが正しいようだ。"
"488","sakaguchi","06manbiki_kazoku.txt","この秘密は先代の急死に関係していることだから、その秘密を出入りの医者が握っているのは当然のこと。"
"489","sakaguchi","06manbiki_kazoku.txt","そこで秘密を握っている二人が、自分一人でうまい汁を吸いたいのは人情であるから、二人で殺し合いをしたようにも考えられるが、浅虫家の立場から考えてみると、二人一しょに殺してしまえば永久に秘密の洩れることがなくなるのだから、二人を殺してしまいたいのは更に必死な願望であるに相違ない。"
"490","sakaguchi","06manbiki_kazoku.txt",""
"491","sakaguchi","06manbiki_kazoku.txt","野草の長男はちょッと才走った兄チャンで、人間と一しょに三ツ四ツ崖の石が崩れて落ちたのはおかしい。"
"492","sakaguchi","06manbiki_kazoku.txt","シンコ細工の崖じゃアあるまいし、人間が多少喧嘩なぐりッこをしたところで地震が起りやしまいし、コチトラはトビだから、崖を見れば分る。"
"493","sakaguchi","06manbiki_kazoku.txt","浅虫家の崖は念入りの石組み、人間が足をすべらしたって、石が一しょに崩れるような細工じゃない。"
"494","sakaguchi","06manbiki_kazoku.txt","これは、そこへ登ると落ちるように仕組んだ者があったに相違ないと睨んだ。"
"495","sakaguchi","06manbiki_kazoku.txt","そこで三人、警察へ乗りこんだのであった。"
"496","sakaguchi","06manbiki_kazoku.txt",""
"497","sakaguchi","06manbiki_kazoku.txt","「しかし、よくまア憎い二人を一しょにそろえて、あつらえ向きに仕掛けの石の上へ乗せることができたものだな」"
"498","sakaguchi","06manbiki_kazoku.txt","と警官は笑って、"
"499","sakaguchi","06manbiki_kazoku.txt","「お前の父は浅虫家をゆすっていた悪者ではないか。"
"500","sakaguchi","06manbiki_kazoku.txt","よくまア畏れ気もなく、そんなことが言って出られたものだ。"
"501","sakaguchi","06manbiki_kazoku.txt","その話しぶりじゃア、ゆすられている浅虫家が大悪者で、ゆするのが当然というようじゃないか」"
"502","sakaguchi","06manbiki_kazoku.txt","と、ひやかされて追い返された。"
"503","sakaguchi","06manbiki_kazoku.txt",""
"504","sakaguchi","06manbiki_kazoku.txt","そこで野草の長男は考えた。"
"505","sakaguchi","06manbiki_kazoku.txt","フン、警察の奴はうまいこと教えてくれた。"
"506","sakaguchi","06manbiki_kazoku.txt","犯人なんぞをふんづかまえても、一文にもなりやしないが、浅虫家の秘密を握れば、毎月千円には確かになる。"
"507","sakaguchi","06manbiki_kazoku.txt","こんな大モウケは当今ほかに落ッこッているものか。"
"508","sakaguchi","06manbiki_kazoku.txt","ちょッとはモトデがかかったって、秘密を握れば〆たもの。"
"509","sakaguchi","06manbiki_kazoku.txt","五年前に雇人がヒマをもらッたというから、それを探してきいて廻ると、必ず何かが掴めるだろう。"
"510","sakaguchi","06manbiki_kazoku.txt","全部は掴めなくとも、野草の子供と名乗れば、若干匂わすだけで先方はふるえあがって千両包むはず。"
"511","sakaguchi","06manbiki_kazoku.txt","奴め、こう悪智恵をめぐらした。"
"512","sakaguchi","06manbiki_kazoku.txt",""
"513","sakaguchi","06manbiki_kazoku.txt","そこで母の記憶をたどり、横浜のオ月ドン、荏原郡矢口村のオキンドン、浅虫家の故郷から来ている何々ドン、何子チャンというのを手がかりに雲をつかむような捜査をはじめた。"
"514","sakaguchi","06manbiki_kazoku.txt","路銀を工面しては東奔西走、よほど悪智恵にたけ、手腕にたけているらしく、十日もたつと、なんなく秘密のアウトラインを探りだしてしまった。"
"515","sakaguchi","06manbiki_kazoku.txt",""
"516","sakaguchi","06manbiki_kazoku.txt","浅虫の先代は癩病を苦にやんで発狂して自殺した。"
"517","sakaguchi","06manbiki_kazoku.txt","それを普通の病死と称して世間をごまかしたのは花田医師の助力である。"
"518","sakaguchi","06manbiki_kazoku.txt","さすれば花田がゆすッていたのは当然のこと。"
"519","sakaguchi","06manbiki_kazoku.txt","益々もって父と花田は浅虫家によって謀殺されたに相違ない。"
"520","sakaguchi","06manbiki_kazoku.txt","この殺人の証拠を握れば、毎月千円どころの段ではない。"
"521","sakaguchi","06manbiki_kazoku.txt","浅虫家の大身代を半分もらうのもお易いことだ。"
"522","sakaguchi","06manbiki_kazoku.txt","実に大運が降ってわいてくれた、とほくそえみ、更に殺人の証拠を握るべく、努力しようと思ったが、これは素人が外部からのぞいただけでは、とてもどうなるものでもない。"
"523","sakaguchi","06manbiki_kazoku.txt","ええ、当って砕けろ、と浅虫家へのりこみ、わめきたてると、未亡人はキッと制して、"
"524","sakaguchi","06manbiki_kazoku.txt","「花田さんとお前の父御を当家の者が殺したとは、何を証拠にお言いだい。"
"525","sakaguchi","06manbiki_kazoku.txt","無礼のことを申すと、その分には捨ておきませぬぞ」"
"526","sakaguchi","06manbiki_kazoku.txt","証拠といわれるとグッと詰って、こればッかりは、どうにも言い返してやれないから、"
"527","sakaguchi","06manbiki_kazoku.txt","「エエ、畜生め。"
"528","sakaguchi","06manbiki_kazoku.txt","何が証拠がいるものか。"
"529","sakaguchi","06manbiki_kazoku.txt","癩病やみの血筋の秘密を握られて二人の男を殺したと言いふらしてやるから覚えていやがれ」"
"530","sakaguchi","06manbiki_kazoku.txt","「なるほど当家は癩病の筋には相違ないが、人殺しと言われてはカンベンはなりませぬ。"
"531","sakaguchi","06manbiki_kazoku.txt","出るところへ出て、もう一度、同じことを申してごらん。"
"532","sakaguchi","06manbiki_kazoku.txt","癩病は当家ののがれがたい運命、それは覚悟いたしているから怖れはせぬが、人殺しと言われてそのままに済まされぬ。"
"533","sakaguchi","06manbiki_kazoku.txt","訴えて出るから、さ、一しょにおいで」"
"534","sakaguchi","06manbiki_kazoku.txt","「フン。"
"535","sakaguchi","06manbiki_kazoku.txt","バカめ。"
"536","sakaguchi","06manbiki_kazoku.txt","誰が警察なんぞへ出向いていられるか。"
"537","sakaguchi","06manbiki_kazoku.txt","癩病は当家の筋だとハッキリいったな。"
"538","sakaguchi","06manbiki_kazoku.txt","その言葉を忘れやしめえ。"
"539","sakaguchi","06manbiki_kazoku.txt","明日から日本中駈けまわって喚きちらし言いたててやるから覚えてやがれ」"
"540","sakaguchi","06manbiki_kazoku.txt","「待ちなさい」"
"541","sakaguchi","06manbiki_kazoku.txt","未亡人は静かに制して、"
"542","sakaguchi","06manbiki_kazoku.txt","「お前の父にはその口封じに月々千円のお金をあげていたが、お前がその秘密をまもってくれるなら、お前にも父と同じことはしてあげよう。"
"543","sakaguchi","06manbiki_kazoku.txt","秘密はまもってくれるだろうね」"
"544","sakaguchi","06manbiki_kazoku.txt","「ハナからそう出てくれるなら、何も余計な口は動かしませんや。"
"545","sakaguchi","06manbiki_kazoku.txt","口は案外堅い方で」"
"546","sakaguchi","06manbiki_kazoku.txt","と千円もらってフトコロに入れ、門を出るところを、警官に捕えられた。"
"547","sakaguchi","06manbiki_kazoku.txt","この警官は彼が警察へ三人づれで押しかけて来たのを見覚えていたから、ハテ、何か悪事を企んでいるのではないかと、訊問し、フトコロをしらべると手の切れるような札束で千円。"
"548","sakaguchi","06manbiki_kazoku.txt","サテハと署へひッたてた。"
"549","sakaguchi","06manbiki_kazoku.txt",""
"550","sakaguchi","06manbiki_kazoku.txt","「ナニ、ユスリ、タカリなんぞするものですか。"
"551","sakaguchi","06manbiki_kazoku.txt","もらってきた金でさア。"
"552","sakaguchi","06manbiki_kazoku.txt","ウソだと思ったら、浅虫さんへきいて下さいな」"
"553","sakaguchi","06manbiki_kazoku.txt","浅虫家へ問い合せると、いかにも呉れてやった金。"
"554","sakaguchi","06manbiki_kazoku.txt","決してユスリ、タカリではありません、という返事。"
"555","sakaguchi","06manbiki_kazoku.txt",""
"556","sakaguchi","06manbiki_kazoku.txt","そこで、これは怪しい、何かあるな、と、却って警察の第六感をシゲキしてしまった。"
"557","sakaguchi","06manbiki_kazoku.txt","そういえば、かねて野草の長男が言った通り、あの崖から足をふみすべらしたにしては、たかが格闘ぐらいで、地震ではあるまいし、石が同時に三ツ四ツ落ちたというのは解せないことである。"
"558","sakaguchi","06manbiki_kazoku.txt","ひとつサグリを入れてみようということになった。"
"559","sakaguchi","06manbiki_kazoku.txt",""
"560","sakaguchi","06manbiki_kazoku.txt",""
"561","sakaguchi","06manbiki_kazoku.txt","★"
"562","sakaguchi","06manbiki_kazoku.txt",""
"563","sakaguchi","06manbiki_kazoku.txt","相手が大家であるから、ウッカリ間違えると取返しがつかない。"
"564","sakaguchi","06manbiki_kazoku.txt","署の方から結城新十郎に応援をたのんだ。"
"565","sakaguchi","06manbiki_kazoku.txt","新十郎の一行は崖の上下をメンミツに調べたが、崖の石が四ツ崩れて落ちている。"
"566","sakaguchi","06manbiki_kazoku.txt","その他の石には影響がなく、ほかに崩れそうな石は一ツもない。"
"567","sakaguchi","06manbiki_kazoku.txt",""
"568","sakaguchi","06manbiki_kazoku.txt","家人をはじめ関係者すべて一人一人しらべてみると、浅虫家の風変りな内容、癩病の筋のこと、先代の狂死のことも、すべて判明した。"
"569","sakaguchi","06manbiki_kazoku.txt","まことに気の毒な家族であるが、人殺しの容疑とあれば、仕方がない。"
"570","sakaguchi","06manbiki_kazoku.txt",""
"571","sakaguchi","06manbiki_kazoku.txt","新十郎は取調べが一段落すると、浮かない顔。"
"572","sakaguchi","06manbiki_kazoku.txt","刑事にわかれて、例の一行四人だけになると、馬をめぐらせて、区役所へと向う。"
"573","sakaguchi","06manbiki_kazoku.txt","彼がそこで調べたのは、五年前まで浅虫家にいた使用人たちの原籍であった。"
"574","sakaguchi","06manbiki_kazoku.txt",""
"575","sakaguchi","06manbiki_kazoku.txt","「私はこれから五年前の召使いを一々訪ねて廻らなければなりませんが、あなた方はそんなことに興味はお持ちにならないでしょうね」"
"576","sakaguchi","06manbiki_kazoku.txt","虎之介はバカらしそうに、"
"577","sakaguchi","06manbiki_kazoku.txt","「そんなことが、今回の殺人事件に何か関係がありますか」"
"578","sakaguchi","06manbiki_kazoku.txt","「さア。"
"579","sakaguchi","06manbiki_kazoku.txt","それは分りません。"
"580","sakaguchi","06manbiki_kazoku.txt","しかし、今回の事件でしたら、二人がどんな方法で誰に殺されたか、大分当りはついています。"
"581","sakaguchi","06manbiki_kazoku.txt","だが、この事件に至っている大体の秘密が知りたいのです。"
"582","sakaguchi","06manbiki_kazoku.txt","なにしろ、秘密を握っていた二人の人は死んでしまったのですから。"
"583","sakaguchi","06manbiki_kazoku.txt","そして、今我々に分っていることは、殺人動機として充分うなずけるものですが、しかし、たぶんこうだろうと人々が推測しているだけのことにすぎません。"
"584","sakaguchi","06manbiki_kazoku.txt","当時ここにいた人は今は一人も居ないのです。"
"585","sakaguchi","06manbiki_kazoku.txt","しかし、何がでてくるにしても人の心を明るくしてくれることは出てくる筈はありますまいよ」"
"586","sakaguchi","06manbiki_kazoku.txt","「ウーム。"
"587","sakaguchi","06manbiki_kazoku.txt","御｜炯眼。"
"588","sakaguchi","06manbiki_kazoku.txt","先ず、そこから当り始めるのが順序でげす。"
"589","sakaguchi","06manbiki_kazoku.txt","ヤツガレもチクと同行いたしましょう」"
"590","sakaguchi","06manbiki_kazoku.txt","と花廼屋が尤もらしく打ちうなずくから、虎之介も負けていられない。"
"591","sakaguchi","06manbiki_kazoku.txt","ナニ、バカな、といいながらも、手順を略してドジをふんでは心外であるから、そこで三人づれが、旅行することになった。"
"592","sakaguchi","06manbiki_kazoku.txt",""
"593","sakaguchi","06manbiki_kazoku.txt","昔の女中たちの話からは、殆ど今までに分っている程度のことしか知ることができない。"
"594","sakaguchi","06manbiki_kazoku.txt","七人いた女中のうち全部はまわらなかったが四人には会った。"
"595","sakaguchi","06manbiki_kazoku.txt","当時、男の使用人は三人居た。"
"596","sakaguchi","06manbiki_kazoku.txt","野草のほかには、植木屋が一人、車夫が一人。"
"597","sakaguchi","06manbiki_kazoku.txt","これだけが庭内に宿をもらっていたのであるが、車夫も植木屋も今は行方が知れないのである。"
"598","sakaguchi","06manbiki_kazoku.txt",""
"599","sakaguchi","06manbiki_kazoku.txt","女中たちの証言で、特に異様なことが一ツあった。"
"600","sakaguchi","06manbiki_kazoku.txt","新十郎は必ずこう訊くのである。"
"601","sakaguchi","06manbiki_kazoku.txt",""
"602","sakaguchi","06manbiki_kazoku.txt","「奥様と娘のキク子さんは毎月どれぐらいの買物をなさるのだね」"
"603","sakaguchi","06manbiki_kazoku.txt","「ハア、よくは存じませんが、時に一軒の店から五千円、一万円等と莫大なものがあったようです。"
"604","sakaguchi","06manbiki_kazoku.txt","それはまア貴金属類でございます」"
"605","sakaguchi","06manbiki_kazoku.txt","「そのツケに書いてある半分ぐらいが万引の品なんだね」"
"606","sakaguchi","06manbiki_kazoku.txt","「ハ？」"
"607","sakaguchi","06manbiki_kazoku.txt","「奥様とキクさんが万引なさッた品物のことさ」"
"608","sakaguchi","06manbiki_kazoku.txt","「ハア。"
"609","sakaguchi","06manbiki_kazoku.txt","万引でございますか？あの大家の奥様、お嬢様が万引なさる筈はございませんでしょうが」"
"610","sakaguchi","06manbiki_kazoku.txt","「ホウ。"
"611","sakaguchi","06manbiki_kazoku.txt","東京では浅虫の奥様、お嬢様の万引といえば、かなり知れている事実なのだが」"
"612","sakaguchi","06manbiki_kazoku.txt","「いえ。"
"613","sakaguchi","06manbiki_kazoku.txt","そんなこと、きいたことがありません。"
"614","sakaguchi","06manbiki_kazoku.txt","その筈がないではありませんか」"
"615","sakaguchi","06manbiki_kazoku.txt","今迄の四人の女は、癩のことは渋々肯定しても、万引の事は必ず否定するのであった。"
"616","sakaguchi","06manbiki_kazoku.txt",""
"617","sakaguchi","06manbiki_kazoku.txt","女の方の調べは終って、あとは二人の男であるが、どうにも行方の知り様がない。"
"618","sakaguchi","06manbiki_kazoku.txt",""
"619","sakaguchi","06manbiki_kazoku.txt","車夫の方は東京でモーローでもやっているのか、てんで故郷へ寄りつかないから、どこにいるか分らないが、ヒマをもらった当座はなんでも、ためた小金で居酒屋のような店をもったが、自分がのみつぶして失敗したという話である。"
"620","sakaguchi","06manbiki_kazoku.txt","退職金にもらった金が、女中でも千円以下ではないから男は相当もらった筈で、小さな店をひらくには充分だったに相違ない。"
"621","sakaguchi","06manbiki_kazoku.txt","しかし彼が店をひらいて失敗しても、その後主家をゆすっていないところを見ると、彼も女中なみの秘密を知るだけで、直接屍体の後始末などにはたずさわらないようである。"
"622","sakaguchi","06manbiki_kazoku.txt","彼は浅虫家の小作人の子供であるが、その家の者は顔をしかめて、"
"623","sakaguchi","06manbiki_kazoku.txt","「あの野郎は三人兄弟の末ッ子ですが、なんしろ雪国の野郎は大酒のみで、なまじ小金を貰ったのが却っていけなかったようですよ。"
