"","auth","piece","line"
"217","sakaguchi","06manbiki_kazoku.txt","父が死ぬまで、そうとは知らなかった。"
"218","sakaguchi","06manbiki_kazoku.txt","父だって、それまで、そうとは知らなかったのだろう。"
"219","sakaguchi","06manbiki_kazoku.txt","知らなかったからこそ、発病して、にわかに気が狂うほど驚き逆上したのだろうよ。"
"220","sakaguchi","06manbiki_kazoku.txt","どうか、我々の悲痛な気持を察して、カンベンしてもらいたい」"
"221","sakaguchi","06manbiki_kazoku.txt","こう打ちしおれて詫びられると、咲子も愛情のない良人ではない。"
"222","sakaguchi","06manbiki_kazoku.txt","しばしは返す言葉もない。"
"223","sakaguchi","06manbiki_kazoku.txt","思わずホッと溜息がもれてしまう。"
"224","sakaguchi","06manbiki_kazoku.txt",""
"225","sakaguchi","06manbiki_kazoku.txt","「癩病って、顔も手足もくずれるそうじゃありませんか」"
"226","sakaguchi","06manbiki_kazoku.txt","「そんな話をしてくれるな。"
"227","sakaguchi","06manbiki_kazoku.txt","今に我身もそうなるかと思えば、毎日鏡を見るのも怖しいばかりだよ。"
"228","sakaguchi","06manbiki_kazoku.txt","はじめはオデコや眉のあたりがテラテラ光って、コブのようにかたくなるということだ。"
"229","sakaguchi","06manbiki_kazoku.txt","父の死んだときは、オレはまだ十八という若い時で、癩病などは何も知らないから、父のどこに異状が現れたのか、気がつかなかったが、毎朝、鏡を見るときのオレのおののく切なさ苦しさを察してもらいたい」"
"230","sakaguchi","06manbiki_kazoku.txt","「それにつけても、兄様は正直、潔白な人格者ですよ。"
"231","sakaguchi","06manbiki_kazoku.txt","離れがたい愛人の方と別れて、外国へお去りになったではありませんか。"
"232","sakaguchi","06manbiki_kazoku.txt","こんな立派な兄様がいらっしゃるから、貴方の卑怯さが尚更腹立たしいのです」"
"233","sakaguchi","06manbiki_kazoku.txt","「イヤ、この兄は、あまり神経過敏すぎる。"
"234","sakaguchi","06manbiki_kazoku.txt","別に癩の徴候が現れたわけではないのに、居ても立ってもいられぬらしく、外国へ逃げてしまった。"
"235","sakaguchi","06manbiki_kazoku.txt","外国に癩を治す名医がいるならとにかく、そうまで慌てるのも、甚しすぎるというものだ。"
"236","sakaguchi","06manbiki_kazoku.txt","おまけに、外国へ逃げて、結婚したというではないか。"
"237","sakaguchi","06manbiki_kazoku.txt","外国人ならだましてもかまわないというのかね。"
"238","sakaguchi","06manbiki_kazoku.txt","人格者というわけにもいかないではないか」"
"239","sakaguchi","06manbiki_kazoku.txt","「本当に結婚なさったの？」"
"240","sakaguchi","06manbiki_kazoku.txt","「手紙でそう知らせてきたということだ。"
"241","sakaguchi","06manbiki_kazoku.txt","もう日本には帰らないと云っているそうだ。"
"242","sakaguchi","06manbiki_kazoku.txt","外国から帰ってきた人の話でも、アイマイ女と結婚して、酒を浴びて、身をもち崩しているということだ」"
"243","sakaguchi","06manbiki_kazoku.txt","「それにしても、癩病だの、自殺だのということが、よく秘密に保てたものですね」"
"244","sakaguchi","06manbiki_kazoku.txt","「さア、それだ。"
"245","sakaguchi","06manbiki_kazoku.txt","それがこの家のガンというものだ。"
"246","sakaguchi","06manbiki_kazoku.txt","癩病と知って、召使いの者はヒマをとる。"
"247","sakaguchi","06manbiki_kazoku.txt","一人去り二人去り、一週間目には、一人も召使いがいなくなったよ。"
"248","sakaguchi","06manbiki_kazoku.txt","中には、癩病と知った当日逃げだした弱虫の慌て者もいたほどだよ」"
"249","sakaguchi","06manbiki_kazoku.txt","大家にも拘らず、大勢の召使いが一人残らずそう古くない理由がうなずけるのである。"
"250","sakaguchi","06manbiki_kazoku.txt",""
"251","sakaguchi","06manbiki_kazoku.txt","事件の起ったとき、未亡人のりりしい態度と処置は水ぎわ立っていたそうだ。"
"252","sakaguchi","06manbiki_kazoku.txt","なまじ召使いに隠し立ててはいけないと思い、一同に、癩病、自殺を打ちあけて、業病の家に奉公もつらいであろうから、自由にヒマをとるように。"
"253","sakaguchi","06manbiki_kazoku.txt","ただ葬式までは居て欲しい。"
"254","sakaguchi","06manbiki_kazoku.txt","又、この事実を人に他言しないように。"
"255","sakaguchi","06manbiki_kazoku.txt","父母兄弟良人妻にも他言だけは慎んでくれ、と、多額の金を与えたという。"
"256","sakaguchi","06manbiki_kazoku.txt","その策が功を奏して召使いはヒマをとったが、その口から秘密がもれなかったという。"
"257","sakaguchi","06manbiki_kazoku.txt","肉をえぐり、皮をはぎ、顔の皮までそぎ落しているから、会葬者に屍体を見せるわけにいかない。"
"258","sakaguchi","06manbiki_kazoku.txt","それで、お通夜には苦労した。"
"259","sakaguchi","06manbiki_kazoku.txt","すぐ白木の棺におさめ、花田医師は特殊な病状を会葬者に語りきかせてごまかさなければならなかった。"
"260","sakaguchi","06manbiki_kazoku.txt",""
"261","sakaguchi","06manbiki_kazoku.txt","かほどの大事件に度を失うことがなく振舞ったという女丈夫の未亡人が、万引せずにいられない妙な病気があるというから、皮肉でもあるし、いたましい。"
"262","sakaguchi","06manbiki_kazoku.txt",""
"263","sakaguchi","06manbiki_kazoku.txt","咲子は未亡人の心事を思いやった。"
"264","sakaguchi","06manbiki_kazoku.txt","彼女こそは家族全員の中で、咲子と立場を同じくする者なのだ。"
"265","sakaguchi","06manbiki_kazoku.txt","彼女も亦呪われた家とは知らずに嫁してきた人である。"
"266","sakaguchi","06manbiki_kazoku.txt","彼女は知らずに子らを生んだが、その子らにも呪われた血が宿っていると知って、その悲しさ驚きはいかほどであったであろう。"
"267","sakaguchi","06manbiki_kazoku.txt","それを思えば、未亡人がそれとなく咲子をいたわる気持が、その表現がさりげないだけ、深い同情がこもっているような気がしないでもなかった。"
"268","sakaguchi","06manbiki_kazoku.txt","そして、今も尚、気品高く凜然たる未亡人の姿を見、その裏にこの悲しさが秘められていると思えば、咲子も我が身を省み、自分もこの運命に辛抱し、悲しさに堪えるべきではないかという考えにもなるのであった。"
"269","sakaguchi","06manbiki_kazoku.txt",""
"270","sakaguchi","06manbiki_kazoku.txt","この家をでて尼になろう。"
"271","sakaguchi","06manbiki_kazoku.txt","そんなことをトツオイツ考えながら、一日は二日になり三日になり、ニンシンの知れないうちに胎児をおろして、と思い焦るうちに、未亡人の目にニンシンを見破られてしまった。"
"272","sakaguchi","06manbiki_kazoku.txt","胎児をおろして尼寺へかけこむことも、もはや不可能となったのである。"
"273","sakaguchi","06manbiki_kazoku.txt",""
"274","sakaguchi","06manbiki_kazoku.txt","身分ちがいの嫁と思えば肩身もせまかったが、こうなってみると気が強い。"
"275","sakaguchi","06manbiki_kazoku.txt","と云って、凜然たる未亡人の気品には勝てないし、ひどく虚無的なキク子にも圧倒されざるを得ないが、弟の一也の皮肉だけは、もう怖くはない。"
"276","sakaguchi","06manbiki_kazoku.txt","むしろ、こうなると、家族の中で一番気のおけない相手であった。"
"277","sakaguchi","06manbiki_kazoku.txt",""
"278","sakaguchi","06manbiki_kazoku.txt","一也が書生に似合わない舶来の写真機をいじくりはじめたから、"
"279","sakaguchi","06manbiki_kazoku.txt","「一也さんも、万引やるんじゃないの。"
"280","sakaguchi","06manbiki_kazoku.txt","あなた方には怪しからぬ血がいろいろとこんがらがって流れているのだから」"
"281","sakaguchi","06manbiki_kazoku.txt","「フン。"
"282","sakaguchi","06manbiki_kazoku.txt","その代り、天才の血が流れているのさ。"
"283","sakaguchi","06manbiki_kazoku.txt","もっとも、キミの旦那様だけ、天才の血が外れているらしいぜ、このウチにバカの血だけはない筈だが、どうも奇妙だ。"
"284","sakaguchi","06manbiki_kazoku.txt","すると癩病の血も万引の血も外れているかも知れねえな。"
"285","sakaguchi","06manbiki_kazoku.txt","そう思って我慢するがいいぜ。"
"286","sakaguchi","06manbiki_kazoku.txt","癩病一家へ御降臨あそばしたからッて、牛肉屋の娘がにわかに気が強くなるのは考え物だな」"
"287","sakaguchi","06manbiki_kazoku.txt","「あなたの何が天才なのさ。"
"288","sakaguchi","06manbiki_kazoku.txt","ちょッとした学問を鼻にかけるのは、見苦しいわよ」"
"289","sakaguchi","06manbiki_kazoku.txt","「ハハ。"
"290","sakaguchi","06manbiki_kazoku.txt","愚物には分らねえのさ。"
"291","sakaguchi","06manbiki_kazoku.txt","マ、写真を撮してやるから、せいぜい良い顔を工夫するがいいね」"
"292","sakaguchi","06manbiki_kazoku.txt","一也はにわかに写真に凝って、女中から来客まで、やたらに撮しまわる。"
"293","sakaguchi","06manbiki_kazoku.txt","昔の機械だから、大そう大きな箱で、黒幕をかぶってやる。"
"294","sakaguchi","06manbiki_kazoku.txt","現像も自分でやらなければならない。"
"295","sakaguchi","06manbiki_kazoku.txt","始めは不出来であったが、どうやら、うまくなってきた。"
"296","sakaguchi","06manbiki_kazoku.txt","彼は猛烈な凝り性で、昼夜をわかたず、写真にかかりきっているようであった。"
"297","sakaguchi","06manbiki_kazoku.txt",""
"298","sakaguchi","06manbiki_kazoku.txt","浅虫家はもともと地方の旧家で大金持であった。"
"299","sakaguchi","06manbiki_kazoku.txt","千町歩ちかい田地を持っている上に、山林や海抜二千｜米ほどの山岳までいくつとなく所有している。"
"300","sakaguchi","06manbiki_kazoku.txt","その山林から銀がでたり、十年ぐらい前から大して苦労もしないのに石油がでて、前途益々有望、居ながらにして益々大金がころがりこむこと明々白々、まったくお金などというものは、この家にとっては湯水と変りなくタダで出てくるものなのである。"
"301","sakaguchi","06manbiki_kazoku.txt",""
"302","sakaguchi","06manbiki_kazoku.txt","これより石油の大会社をつくり、大発掘しようというので、薄ノロの正司は多忙である。"
"303","sakaguchi","06manbiki_kazoku.txt","ところが良くしたもので、薄ノロながら、会社管理については、彼は決して薄ノロではない。"
"304","sakaguchi","06manbiki_kazoku.txt","もっともスギ子未亡人という才媛が背後に控えてサイハイをふるい、一々指令を発している。"
"305","sakaguchi","06manbiki_kazoku.txt","正司に自ら発明する才がなく、小才をはたらかそうとする野心がないだけ、却って危気がない。"
"306","sakaguchi","06manbiki_kazoku.txt","二十三の若冠ながら充分に社長の重責を果している。"
"307","sakaguchi","06manbiki_kazoku.txt","咲子の知りそめた書生のころとは打って変って、日に日に貫禄がついてくるから、咲子も案外な思い、あらためて、たのもしくも、いとしくもなる思いであった。"
"308","sakaguchi","06manbiki_kazoku.txt","結婚したてのころとちがって、正司を訪ねてくる人は、立派な大紳士、大紳商という見るからに威風堂々たる人々で、正司はそれらの人々と何のヒケ目もなく談議している。"
"309","sakaguchi","06manbiki_kazoku.txt","若僧だけに、甚だひき立って、大紳士にもまして立派に見える。"
"310","sakaguchi","06manbiki_kazoku.txt","咲子もいつまでも牛肉屋の娘の気持ではいられない。"
"311","sakaguchi","06manbiki_kazoku.txt","正司と同じ速力で奥様の貫禄をつくらなければならないが、追いつきがたい程であった。"
"312","sakaguchi","06manbiki_kazoku.txt",""
"313","sakaguchi","06manbiki_kazoku.txt","ある昼下りのことである。"
"314","sakaguchi","06manbiki_kazoku.txt","花田医師がフラリと咲子の部屋へやってきた。"
"315","sakaguchi","06manbiki_kazoku.txt","なんの遠慮もなくヌッと大きな顔を現して、"
"316","sakaguchi","06manbiki_kazoku.txt","「やア。"
"317","sakaguchi","06manbiki_kazoku.txt","若奥さん。"
"318","sakaguchi","06manbiki_kazoku.txt","あなたのところへゴキゲン伺いは今日がはじめて、御降嫁以来御無沙汰していたが、うん、こうして御対面、シミジミ拝顔すると、さすがに正司君は目が高い。"
"319","sakaguchi","06manbiki_kazoku.txt","ヒナには稀な美顔ですなア。"
"320","sakaguchi","06manbiki_kazoku.txt","いつだったか、正司君の診察をしてあげた時は、あなたはまだ山家育ちの風情であったが、今ではすでに立派な浅虫家の若奥様。"
"321","sakaguchi","06manbiki_kazoku.txt","イヤ、お見事、お見事。"
"322","sakaguchi","06manbiki_kazoku.txt","天性利発の性がなくては、こうは変るものではない。"
"323","sakaguchi","06manbiki_kazoku.txt","当家の客人たるヤツガレも、一安心、また、敬服もいたした。"
"324","sakaguchi","06manbiki_kazoku.txt","天晴れ、天晴れ」"
"325","sakaguchi","06manbiki_kazoku.txt","と大そう浮かれてお世辞がよい。"
"326","sakaguchi","06manbiki_kazoku.txt","その筈である。"
"327","sakaguchi","06manbiki_kazoku.txt","彼は手にウイスキーのビンをぶらさげ、又片手にはカップを持っている。"
"328","sakaguchi","06manbiki_kazoku.txt","本日はあいにく未亡人もキク子も外出しているので、咲子を肴に一杯かたむけるコンタンである。"
"329","sakaguchi","06manbiki_kazoku.txt","すでにホロ酔いのキゲンであった。"
"330","sakaguchi","06manbiki_kazoku.txt",""
"331","sakaguchi","06manbiki_kazoku.txt","「女中というものは口サガないから、すでに御存知であろうが、かの母と娘なる深窓の二女が外出あそばすと、お帰りのミヤゲが多くてねえ。"
"332","sakaguchi","06manbiki_kazoku.txt","しかし、未亡人は、常にあなたの服飾について意を用いておられる。"
"333","sakaguchi","06manbiki_kazoku.txt","意のあるところは充分に感謝しなければなりませんぞ」"
"334","sakaguchi","06manbiki_kazoku.txt","どっちが口サガないか分りやしない。"
"335","sakaguchi","06manbiki_kazoku.txt",""
"336","sakaguchi","06manbiki_kazoku.txt","「昼のうちから御酒を召上って、急病人ができたときにどうなさいますの」"
"337","sakaguchi","06manbiki_kazoku.txt","「ナニ、医者は東京にワシ一人ではあるまいて。"
"338","sakaguchi","06manbiki_kazoku.txt","第一ワシは漢方に洋学のサジ加減をちょッと加味したような雑種なのさ。"
"339","sakaguchi","06manbiki_kazoku.txt","ワシの倅が三年前に医学校を卒業して、今ではワシよりもサジ加減がよい。"
"340","sakaguchi","06manbiki_kazoku.txt","特に婦人には親切をつくすそうだから、あなたも診てもらいなさい。"
"341","sakaguchi","06manbiki_kazoku.txt","そういえば、あなたもニンシンの由承ったが、当家の初孫、まことにお目出たい」"
"342","sakaguchi","06manbiki_kazoku.txt","咲子はからかわれていると思った。"
"343","sakaguchi","06manbiki_kazoku.txt","あまりにも皮肉、残酷なからかいというものだ。"
"344","sakaguchi","06manbiki_kazoku.txt",""
"345","sakaguchi","06manbiki_kazoku.txt","咲子は涙ぐんだ。"
"346","sakaguchi","06manbiki_kazoku.txt",""
"347","sakaguchi","06manbiki_kazoku.txt","「先生は呪われて生れる子供をフビンと思わないのですか」"
"348","sakaguchi","06manbiki_kazoku.txt","こう怨じて詰問すると、まさかそれを知るまいと思っていたらしく、花田はさすがにビックリ仰天、酔眼をパチクリさせて、しばし酒臭い大息をフウフウ吐いている。"
"349","sakaguchi","06manbiki_kazoku.txt",""
"350","sakaguchi","06manbiki_kazoku.txt","「フン。"
"351","sakaguchi","06manbiki_kazoku.txt","正司君もちかごろは見ちがえるような若社長ぶり、見上げたものだと思っていたが、持って生れたバカの性根は仕方がない。"
"352","sakaguchi","06manbiki_kazoku.txt","余計なことを言わなければよいものを、無役に人を嘆かせるばかりのものを」"
"353","sakaguchi","06manbiki_kazoku.txt","「いいえ。"
"354","sakaguchi","06manbiki_kazoku.txt","私がそれを知りましたのは主人からではありません。"
"355","sakaguchi","06manbiki_kazoku.txt","一也さんが、まるでヨソのウチの話のように皮肉タップリ語っておきかせだったのです」"
"356","sakaguchi","06manbiki_kazoku.txt","「フン。"
"357","sakaguchi","06manbiki_kazoku.txt","あの一也が。"
"358","sakaguchi","06manbiki_kazoku.txt","そうだったか」"
"359","sakaguchi","06manbiki_kazoku.txt","花田はフキゲン千万な面持だった。"
"360","sakaguchi","06manbiki_kazoku.txt",""
"361","sakaguchi","06manbiki_kazoku.txt","「あの小才子には困ったものさ。"
"362","sakaguchi","06manbiki_kazoku.txt","同じ兄弟にも色々あるものだ。"
"363","sakaguchi","06manbiki_kazoku.txt","キョロ／＼と気をまわしてばかりおる」"
"364","sakaguchi","06manbiki_kazoku.txt","花田は一也を好まぬらしく、露骨に不快を隠さなかった。"
"365","sakaguchi","06manbiki_kazoku.txt",""
"366","sakaguchi","06manbiki_kazoku.txt","「ナア。"
"367","sakaguchi","06manbiki_kazoku.txt","浅虫家の若奥様よ。"
"368","sakaguchi","06manbiki_kazoku.txt","不快なことはすべて忘れてしまうがよい。"
"369","sakaguchi","06manbiki_kazoku.txt","忘れるが第一。"
"370","sakaguchi","06manbiki_kazoku.txt","忘れてしまえば、誰の血も呪われてはいないのだ。"
"371","sakaguchi","06manbiki_kazoku.txt","癩病の血も、万引の血も、忘れてしまえば、誰の中にも流れてはいないものだて。"
"372","sakaguchi","06manbiki_kazoku.txt","クヨクヨするのが、何よりよろしくない。"
"373","sakaguchi","06manbiki_kazoku.txt","つまらぬことが世間にもれては一大事。"
"374","sakaguchi","06manbiki_kazoku.txt","みんな忘れて暮しなされ」"
"375","sakaguchi","06manbiki_kazoku.txt","花田は咲子をなぐさめてくれた。"
"376","sakaguchi","06manbiki_kazoku.txt","彼は無遠慮で、礼儀知らず、わが家よりもワガママの仕放題にふるまっているが、こうして話をしてみると、シンは悪心のある人のようではなかった。"
"377","sakaguchi","06manbiki_kazoku.txt",""
"378","sakaguchi","06manbiki_kazoku.txt","翌日、咲子は未亡人の部屋へよばれた。"
"379","sakaguchi","06manbiki_kazoku.txt","あたりに人の気配のないのをたしかめた上で、未亡人は咲子をジッと見つめて、"
"380","sakaguchi","06manbiki_kazoku.txt","「あなたは本当にお気の毒です。"
"381","sakaguchi","06manbiki_kazoku.txt","あの一也が、余計なことを言ってくれなければ、あなたも幸せに過せたものを。"
"382","sakaguchi","06manbiki_kazoku.txt","今となっては仕方がありません。"
"383","sakaguchi","06manbiki_kazoku.txt","今まで隠していたことは、お詫びいたさねばなりません。"
"384","sakaguchi","06manbiki_kazoku.txt","あらためて私からお願い致しますが、今まで通りここをわが家として、正司の面倒を見ていただき、生れる子供を育てていただきたいのです。"
"385","sakaguchi","06manbiki_kazoku.txt","あなたは利発で、落ちついた方。"
"386","sakaguchi","06manbiki_kazoku.txt","正司にはモッタイない嫁御です。"
"387","sakaguchi","06manbiki_kazoku.txt","私は拾い物をしたように、安心していたのです。"
"388","sakaguchi","06manbiki_kazoku.txt","あなたならば私が当家で果した役割を、代って果して下さることができるでしょう。"
"389","sakaguchi","06manbiki_kazoku.txt","呉れ呉れもおたのみいたしますよ」"
"390","sakaguchi","06manbiki_kazoku.txt","と、手をとらんばかりに頼まれた。"
"391","sakaguchi","06manbiki_kazoku.txt","未亡人も、今は秘密なく、ホッと安心、すっかり打ちとけたらしく、"
"392","sakaguchi","06manbiki_kazoku.txt","「今度、キク子が花田さんの御子息と結婚することになりましたよ。"
"393","sakaguchi","06manbiki_kazoku.txt","生涯当家のヤッカイ者、売れ残りかと思っていましたが、これで私も肩の荷が一ツおりました。"
"394","sakaguchi","06manbiki_kazoku.txt","一安心です。"
"395","sakaguchi","06manbiki_kazoku.txt","花聟は二十五、キク子と同い年ですが、父まさりの腕達者で、若年ながらとても評判のよい若先生なのですよ」"
"396","sakaguchi","06manbiki_kazoku.txt","未亡人はよほど嬉しいらしく、その話になると飛び立つように浮き浮きした話しぶりであった。"
"397","sakaguchi","06manbiki_kazoku.txt",""
"398","sakaguchi","06manbiki_kazoku.txt","キク子の婚約はすぐ家中に知れ渡った。"
"399","sakaguchi","06manbiki_kazoku.txt","女中まで一様に嬉しそうな中に、一人甚だ不キゲンなのは一也であった。"
"400","sakaguchi","06manbiki_kazoku.txt","花田が一也に対してそうであるように、一也も花田に対して悪感情をいだいているらしい。"
"401","sakaguchi","06manbiki_kazoku.txt","彼は姉を悪魔にさらわれ、そのイケニエに供されたように、内心、やみがたい怒りにもえているようであった。"
"402","sakaguchi","06manbiki_kazoku.txt",""
"403","sakaguchi","06manbiki_kazoku.txt","それ迄結婚を眼中にしなかったキク子であるから、縁談がきまると、いそがしい。"
"404","sakaguchi","06manbiki_kazoku.txt","年頃の娘なら当然それを前提として心掛けているような嫁入り仕度が殆どできていないからだ。"
"405","sakaguchi","06manbiki_kazoku.txt","さア、嫁入仕度の買物がいそがしくなると、万引の方もいそがしくなる。"
"406","sakaguchi","06manbiki_kazoku.txt","裏表両方合せて三人前ぐらいの嫁入り仕度が忽ち出来上ろうというもの。"
"407","sakaguchi","06manbiki_kazoku.txt","そうでしょう。"
"408","sakaguchi","06manbiki_kazoku.txt","母と娘と両方の稼ぎがダブルのだから、裏道の御買上げ品の方が集りも早いし、上物も多い。"
"409","sakaguchi","06manbiki_kazoku.txt","奥の部屋々々にタンスが並び、着物がおさまるにつれて、土蔵の中にはより上等の嫁入り衣裳貴金属がひそかに勢ぞろいをととのえているのであった。"
"410","sakaguchi","06manbiki_kazoku.txt",""
"411","sakaguchi","06manbiki_kazoku.txt","キク子の嫁入りの日も近づいてきた。"
"412","sakaguchi","06manbiki_kazoku.txt","キク子の顔は晴れ晴れとしている。"
"413","sakaguchi","06manbiki_kazoku.txt","今までとは人が変ったように、女らしさが急速に、めざましく生れ育って、にわかに万人の目をうち、心をひきつける初々しい色気が溢れたっているのであった。"
"414","sakaguchi","06manbiki_kazoku.txt","咲子も思わずその美しさにひきこまれて、ウットリと、うれしい気持になる。"
"415","sakaguchi","06manbiki_kazoku.txt","けれども、その血のことを考えると、どうにも切なく、可哀そうで、たまらない気持になるのであった。"
"416","sakaguchi","06manbiki_kazoku.txt",""
"417","sakaguchi","06manbiki_kazoku.txt","そして、ただ一人、うきたつ人々に背をむけ、たのしげな姉に皮肉な視線をジッとそそいでいる一也の心が、うなずけもするのである。"
"418","sakaguchi","06manbiki_kazoku.txt","あの血を負うて、うれしい嫁入りとは。"
"419","sakaguchi","06manbiki_kazoku.txt","怖しく、暗くもなろうではないか。"
"420","sakaguchi","06manbiki_kazoku.txt","あの血を承知でキク子を貰う花田医師の心が解せなかった。"
"421","sakaguchi","06manbiki_kazoku.txt","あるいは神のようにひろく大きな愛の持主なのだろうか。"
"422","sakaguchi","06manbiki_kazoku.txt","あの粗暴な礼儀知らずにも拘らず。"
