"","auth","piece","line"
"624","sakaguchi","06manbiki_kazoku.txt","三年前までは盆になると戻ってきて景気の良さそうなことをいっていましたが、店を潰してからは手紙一本よこしません。"
"625","sakaguchi","06manbiki_kazoku.txt","恥サラシをやらなきゃよいがと心配しているのです」"
"626","sakaguchi","06manbiki_kazoku.txt","「年はいくつだね」"
"627","sakaguchi","06manbiki_kazoku.txt","「今年は四十になりやがった筈です。"
"628","sakaguchi","06manbiki_kazoku.txt","女房子供五人家族ですから、妻子が哀れですよ。"
"629","sakaguchi","06manbiki_kazoku.txt","女房はこの村からでた女ですが、わりとシッカリ者で、なんでも貧民窟のようなところで内職して子供だけは育てているそうですが、こまったものです」"
"630","sakaguchi","06manbiki_kazoku.txt","「すると離縁したのかね」"
"631","sakaguchi","06manbiki_kazoku.txt","「いゝえ。"
"632","sakaguchi","06manbiki_kazoku.txt","時々金をせびりに行きやがるそうで、十銭二十銭の血と汗の銭をせびって消えて行きやがるそうです」"
"633","sakaguchi","06manbiki_kazoku.txt","女房の実家できいてみても同じ程度のことしか分らなかった。"
"634","sakaguchi","06manbiki_kazoku.txt",""
"635","sakaguchi","06manbiki_kazoku.txt","植木屋の行方の方は、さらに雲をつかむようなものである。"
"636","sakaguchi","06manbiki_kazoku.txt","彼の生れは秋田であった。"
"637","sakaguchi","06manbiki_kazoku.txt","三人はそういう遠路まで出向いたのである。"
"638","sakaguchi","06manbiki_kazoku.txt","彼の故郷の家人は頭をかいて、"
"639","sakaguchi","06manbiki_kazoku.txt","「どうも、あの野郎の行方は全くわかりません。"
"640","sakaguchi","06manbiki_kazoku.txt","元はここの殿様のお屋敷の植木職の親方のところへ十三の時から住みこんだのですが、二十一二のころ、浅虫様へ親方からの紹介で住みかえたのです。"
"641","sakaguchi","06manbiki_kazoku.txt","五六年つとめましたかね。"
"642","sakaguchi","06manbiki_kazoku.txt","別に女房をもらったような話もききません。"
"643","sakaguchi","06manbiki_kazoku.txt","こっちからあの野郎のところへ便りをだしたら、先日ヒマをとって出たという話で、それから五年になりますが、どこにいるともいってきません。"
"644","sakaguchi","06manbiki_kazoku.txt","独り身で気軽のせいでしょうが、しかし、もう三十一二の筈、どこで何をしていやがるかサッパリ心当りがありません」"
"645","sakaguchi","06manbiki_kazoku.txt","どうにも仕様がない。"
"646","sakaguchi","06manbiki_kazoku.txt","それでも車夫とちがって、親方の住所が分るから、東京へ戻って親方の所も訊いてみた。"
"647","sakaguchi","06manbiki_kazoku.txt","親方も頭をかいて、"
"648","sakaguchi","06manbiki_kazoku.txt","「ヘエ。"
"649","sakaguchi","06manbiki_kazoku.txt","どうもあの野郎は出来損いで。"
"650","sakaguchi","06manbiki_kazoku.txt","どこで何をしていやがるか、行方が分りません。"
"651","sakaguchi","06manbiki_kazoku.txt","職人の腕は良いのですが、腕にまかせて、よその職人が刈りこんだばかりの庭木を頼まれもせずに乗りこんでチョイと手を入れてくるような出すぎた生意気野郎で、それが面白いというお方もありましたが、そういう奴ですから、若造のくせに一パシ名人気どりで、鼻もちのならないところもありました。"
"652","sakaguchi","06manbiki_kazoku.txt","それがために、身を亡しているのかも知れませんや」"
"653","sakaguchi","06manbiki_kazoku.txt","どうにも分らない。"
"654","sakaguchi","06manbiki_kazoku.txt","新十郎は残った女の居所をたぐり、燈台元くらし、神楽坂で商家の嫁になっている二十五のツネという女を訪ねた。"
"655","sakaguchi","06manbiki_kazoku.txt","ちょッと渋皮のむけた女であった。"
"656","sakaguchi","06manbiki_kazoku.txt",""
"657","sakaguchi","06manbiki_kazoku.txt","「私は新聞を見て、さてはと思っていました」"
"658","sakaguchi","06manbiki_kazoku.txt","と、今までの女と打って変って、お喋り好きの女らしい。"
"659","sakaguchi","06manbiki_kazoku.txt",""
"660","sakaguchi","06manbiki_kazoku.txt","「思い当ることがあるかね」"
"661","sakaguchi","06manbiki_kazoku.txt","「思い当る段ではありません。"
"662","sakaguchi","06manbiki_kazoku.txt","どうしてあれが忘れられるものですか。"
"663","sakaguchi","06manbiki_kazoku.txt","オノブサンという三十五の人と私が奥の女中でしたが、まだ春先の午後三時ごろというのに奥で戸をしめる音がしますから行ってみますと、戸をしめていらッしゃるのは奥様で、お嬢様が、廊下に見張りのように立っていらッしゃるのです。"
"664","sakaguchi","06manbiki_kazoku.txt","お嬢様は私を睨みつけて、花田先生に来ていただくように、と仰有るのですよ。"
"665","sakaguchi","06manbiki_kazoku.txt","花田先生をお連れしますと、呼ぶまでは誰も来てはいけないというキツイ御命令で、夕飯も召上らず、真夜中の十二時まではヒッソリと物音もありませんでした。"
"666","sakaguchi","06manbiki_kazoku.txt","夜中に私どもが一室によび集められて、旦那様は癩病を苦に狂死なさったが、必ず他言してくれるな。"
"667","sakaguchi","06manbiki_kazoku.txt","一同にはヒマをやるから、葬式がすんだらひきとるように、と大枚のお金を下さいました」"
"668","sakaguchi","06manbiki_kazoku.txt","「屍体の始末に手伝った者はいないかね」"
"669","sakaguchi","06manbiki_kazoku.txt","「女中は一人も奥の部屋へは召されませんでしたが、下男の野草さんと植木屋の甚吉さんが奥へ召されてズッと出て来ませんでした。"
"670","sakaguchi","06manbiki_kazoku.txt","車夫の馬吉は棺桶を運んで来ましたが、運んできて、廊下まで持って参っただけで、これも手伝ってはおりません。"
"671","sakaguchi","06manbiki_kazoku.txt","正司様、一也様はまだ子供ですから、これも奥からは締めだされて、女中のたまりへいらして心配そうに奥の気配を気にしていらッしゃいましたよ。"
"672","sakaguchi","06manbiki_kazoku.txt","下男と植木屋はどういう御用があったのか、ズッと葬式の終るまで姿を見せませんでしたが、秘密がもれるといけないからでしょうね。"
"673","sakaguchi","06manbiki_kazoku.txt","私がヒマをもらう日になって、その時はもう、女中の半分はヒマをとってからですが、野草さんだけヒョッコリどこかから戻ってきました。"
"674","sakaguchi","06manbiki_kazoku.txt","私がヒマをもらう時はまだ植木屋の方は戻りませんでした。"
"675","sakaguchi","06manbiki_kazoku.txt","下男の野草さんとお医者の花田さんが、ゆすっていたのは当然ですとも。"
"676","sakaguchi","06manbiki_kazoku.txt","旦那様は自殺ではありませんね。"
"677","sakaguchi","06manbiki_kazoku.txt","誰かが殺したのです」"
"678","sakaguchi","06manbiki_kazoku.txt","「誰が殺したと思うね」"
"679","sakaguchi","06manbiki_kazoku.txt","「それは分りません」"
"680","sakaguchi","06manbiki_kazoku.txt","ツネは言葉を濁してニヤニヤしたが、"
"681","sakaguchi","06manbiki_kazoku.txt","「私は奥づきの女中ですから、存じていますが、お嬢さまはニンシンなさっていたのです。"
"682","sakaguchi","06manbiki_kazoku.txt","殆ど外出をなさらないお嬢さまがですよ。"
"683","sakaguchi","06manbiki_kazoku.txt","家族のほかに男気なんてない筈の奥にひッこんでいらッしゃるお嬢さまがネ。"
"684","sakaguchi","06manbiki_kazoku.txt","これを知っているのは、オノブサンと私だけ、ほかの女中は知りません」"
"685","sakaguchi","06manbiki_kazoku.txt","と、ツネは意味深長にシタリ顔をして笑った。"
"686","sakaguchi","06manbiki_kazoku.txt","三人はすでにオノブサンなる女中には会っているのであるが、浅虫家の郷里の女では年は四十、甚だ冷静沈黙で、殆ど何も語らなかったのである。"
"687","sakaguchi","06manbiki_kazoku.txt",""
"688","sakaguchi","06manbiki_kazoku.txt","「そのお嬢さんのオナカの子はどう始末をしたのだね」"
"689","sakaguchi","06manbiki_kazoku.txt","「私がヒマをもらうまでは、まだその儘だったと思いますよ。"
"690","sakaguchi","06manbiki_kazoku.txt","花田先生がついておいでだから、いつでも、どうにかなったでしょうとも」"
"691","sakaguchi","06manbiki_kazoku.txt","「胎児の父は誰だと思うかね。"
"692","sakaguchi","06manbiki_kazoku.txt","思う通り、言ってごらん」"
"693","sakaguchi","06manbiki_kazoku.txt","「それは分りやしません。"
"694","sakaguchi","06manbiki_kazoku.txt","ですが、奥へ出入りする男といえば、旦那様、お兄様、花田先生、この御三方のほかにはありません」"
"695","sakaguchi","06manbiki_kazoku.txt","「博司さんの男友だちは」"
"696","sakaguchi","06manbiki_kazoku.txt","「そんな方は奥へ出入りなさいません」"
"697","sakaguchi","06manbiki_kazoku.txt","意外なことが分ったが、最も重大な人物博司は海外に退去し、今や秘密を知る唯一の人物、植木屋の甚吉はまったく行方が知れない。"
"698","sakaguchi","06manbiki_kazoku.txt","こうなると、海の外まで追って行くことはできないから、どうしても植木屋を探さなければならないことになった。"
"699","sakaguchi","06manbiki_kazoku.txt","再び親方を訪れて、"
"700","sakaguchi","06manbiki_kazoku.txt","「どうだろう。"
"701","sakaguchi","06manbiki_kazoku.txt","甚吉の友だちというのは居ないだろうか」"
"702","sakaguchi","06manbiki_kazoku.txt","「それが、それ、先日もお話いたしましたが、生意気な野郎で、名人気どり、仲間を怒らせやがるばかりで、仲良しなんて一人だって居やしませんや。"
"703","sakaguchi","06manbiki_kazoku.txt","色女なら一人ぐらいは居たかも知れませんが、あッちこッち手当り次第、別にこれという極った女は少いようで。"
"704","sakaguchi","06manbiki_kazoku.txt","あの野郎ばッかりは、こッちで身を堅めさせてやろうという気持になりませんや。"
"705","sakaguchi","06manbiki_kazoku.txt","フン、という顔をしやがるのでね。"
"706","sakaguchi","06manbiki_kazoku.txt","ウチのカカアなんぞ、一度親切気を起したばかりに、ひどく腹を立てましたよ」"
"707","sakaguchi","06manbiki_kazoku.txt","「そうかい。"
"708","sakaguchi","06manbiki_kazoku.txt","それでは内儀に会わせていただこうではないか」"
"709","sakaguchi","06manbiki_kazoku.txt","内儀は五十がらみの中々品のよい女。"
"710","sakaguchi","06manbiki_kazoku.txt","職人の内儀に似合わず、タシナミがあるらしい様子。"
"711","sakaguchi","06manbiki_kazoku.txt",""
"712","sakaguchi","06manbiki_kazoku.txt","「さア。"
"713","sakaguchi","06manbiki_kazoku.txt","甚吉の親しい仲間は、私も目がとどきませんで、心当りがございません。"
"714","sakaguchi","06manbiki_kazoku.txt","なんしろ同輩よりは一枚も五枚も上のツモリで、フンという顔をしておりますから、友だちはできません。"
"715","sakaguchi","06manbiki_kazoku.txt","同輩のバカ話の話相手にも加わりませんから、甚吉がどこで何をしているのやら、何を思っているのやら、それも誰にも分りやしません。"
"716","sakaguchi","06manbiki_kazoku.txt","実際腕はよいのだから、まア仕方がなかろうというわけで、御近所に、今は零落なさッていますが、元は二百石とりの武士のお方のお嬢さんが、躾けもよく、よく出来た方で、こういうお方なら甚吉には向くかも知れないと、話をしてみたことがあるのですが、貧乏ザムライの売れ残りがイキのいい職人のカカアにもらえるもんですかい、という挨拶で、この野郎、とあの時ぐらい腹の立ったことはございません。"
"717","sakaguchi","06manbiki_kazoku.txt","生意気と申したらありやしませんでした。"
"718","sakaguchi","06manbiki_kazoku.txt","しかし言うだけのことはあって、読み書きなども相当にできましたし、洋学を勉強しようか、西洋の植木屋の極意書をチョット見てやろうか、なんて大きなことを申すような奴でした」"
"719","sakaguchi","06manbiki_kazoku.txt","「浅虫家にいたころはチョイ／＼遊びに来ましたか」"
"720","sakaguchi","06manbiki_kazoku.txt","「めったに参りませんでしたが、たまに来ることはありました。"
"721","sakaguchi","06manbiki_kazoku.txt","浅虫家からヒマをとって後は、一度も参りません」"
"722","sakaguchi","06manbiki_kazoku.txt","どうしても知りようがない。"
"723","sakaguchi","06manbiki_kazoku.txt","新十郎も処置なしと諦め顔、"
"724","sakaguchi","06manbiki_kazoku.txt","「もうこれ以上は仕方がありません。"
"725","sakaguchi","06manbiki_kazoku.txt","三人づれの旅は今日で終ることに致しましょう」"
"726","sakaguchi","06manbiki_kazoku.txt","虎之介はダラシなくアクビをして、"
"727","sakaguchi","06manbiki_kazoku.txt","「イヤハヤ。"
"728","sakaguchi","06manbiki_kazoku.txt","ムダのムダ。"
"729","sakaguchi","06manbiki_kazoku.txt","莫大の時間と路銀を費して、鼠一匹でやしない。"
"730","sakaguchi","06manbiki_kazoku.txt","心眼の曇る時はそんなものさ。"
"731","sakaguchi","06manbiki_kazoku.txt","私は旅にでる前から、こうあることがピタリと分っていたね」"
"732","sakaguchi","06manbiki_kazoku.txt","「イエ、泉山さん。"
"733","sakaguchi","06manbiki_kazoku.txt","決してムダではありません。"
"734","sakaguchi","06manbiki_kazoku.txt","甚しく重大なことが分ったではありませんか」"
"735","sakaguchi","06manbiki_kazoku.txt","「キク子のニンシンのことだろうが、それぐらいの隠しごとはどこのウチの女中でも必ず嗅ぎつけているものなのさ」"
"736","sakaguchi","06manbiki_kazoku.txt","「それに甚吉の行方不明が今度判った重大な二ツではありますが、もっと重大な事があるのです。"
"737","sakaguchi","06manbiki_kazoku.txt","泉山さんはお忘れですか。"
"738","sakaguchi","06manbiki_kazoku.txt","未亡人とキク子さんは、あの事件が起るまでは万引したことがなかったのですよ」"
"739","sakaguchi","06manbiki_kazoku.txt","と新十郎は面白そうにクスクス笑った。"
"740","sakaguchi","06manbiki_kazoku.txt","そして、つけ加えた。"
"741","sakaguchi","06manbiki_kazoku.txt",""
"742","sakaguchi","06manbiki_kazoku.txt","「さて、明日は皆さんと浅虫家へ参ることに致しましょう。"
"743","sakaguchi","06manbiki_kazoku.txt","明日が、この事件の最後の日となることでしょうよ」"
"744","sakaguchi","06manbiki_kazoku.txt","まだ道遠しと思っているのに、だしぬけの言葉。"
"745","sakaguchi","06manbiki_kazoku.txt","虎之介と花廼屋は、しばし、茫然。"
"746","sakaguchi","06manbiki_kazoku.txt","しかし、虎之介はやがて打ちうなずいて、"
"747","sakaguchi","06manbiki_kazoku.txt","「なんのことだい。"
"748","sakaguchi","06manbiki_kazoku.txt","今度の二人殺しの犯人なら始めから分ってらアな。"
"749","sakaguchi","06manbiki_kazoku.txt","それは浅虫家の全員さ。"
"750","sakaguchi","06manbiki_kazoku.txt","それだけじゃア、昔のナゾがとけていないよ。"
"751","sakaguchi","06manbiki_kazoku.txt","なア、新十郎どん」"
"752","sakaguchi","06manbiki_kazoku.txt","「いいえ、たぶん、全てのナゾの最後の日です。"
"753","sakaguchi","06manbiki_kazoku.txt","そして、恐らく、大そう陰鬱な日となるでしょうよ。"
"754","sakaguchi","06manbiki_kazoku.txt","では、さよなら」"
"755","sakaguchi","06manbiki_kazoku.txt",""
"756","sakaguchi","06manbiki_kazoku.txt","★"
"757","sakaguchi","06manbiki_kazoku.txt",""
"758","sakaguchi","06manbiki_kazoku.txt","虎之介の話をきき終った海舟、悪血をとりつつ黙々たること半時間あまり。"
"759","sakaguchi","06manbiki_kazoku.txt","朝食がすんで間もないらしく、虎之介の前には持参の竹の包がちらかっている。"
"760","sakaguchi","06manbiki_kazoku.txt",""
"761","sakaguchi","06manbiki_kazoku.txt","「その未亡人は、智力胆力兼備の女丈夫さ。"
"762","sakaguchi","06manbiki_kazoku.txt","事に処して神速適切、殆どあやまったところがない。"
"763","sakaguchi","06manbiki_kazoku.txt","沈着細心、大丈夫といえども史上にあまたその例を見かけぬほどの豪の者さ」"
"764","sakaguchi","06manbiki_kazoku.txt","と、意外な大讃辞を呈して、一息。"
"765","sakaguchi","06manbiki_kazoku.txt",""
"766","sakaguchi","06manbiki_kazoku.txt","「癩病とあるのは事実無根の作りごとだ。"
"767","sakaguchi","06manbiki_kazoku.txt","業病の汚名に甘んじても隠さねばならぬ大きな秘密があったのだ。"
"768","sakaguchi","06manbiki_kazoku.txt","言うまでもなく浅虫権六は自殺ではなかろう。"
"769","sakaguchi","06manbiki_kazoku.txt","殺されているのさ。"
"770","sakaguchi","06manbiki_kazoku.txt","下手人は長男博司。"
"771","sakaguchi","06manbiki_kazoku.txt","親殺しの大罪とあれば、癩病、狂死と家名に傷のつくことをいいふらしても、ひた隠しに隠さなくちゃアならねえや。"
"772","sakaguchi","06manbiki_kazoku.txt","癩病狂死ということを余りハッキリ使用人どもに申しきかせてあるのが手落ちだが、あの急場に処しては最上の分別であったろうさ。"
"773","sakaguchi","06manbiki_kazoku.txt","利巧者の未亡人のことだから、その手落ちには気がついている。"
"774","sakaguchi","06manbiki_kazoku.txt","親殺しを隠すに癩病の手を用いたが、若干ヘタに用いすぎたと悟ったから、次にはその癩病を隠すフリをしてみせなくちゃア、親殺しまでバレてしまう。"
"775","sakaguchi","06manbiki_kazoku.txt","そこで用いたのが、万引の手さ。"
"776","sakaguchi","06manbiki_kazoku.txt","アヤマチをアヤマチによって隠す。"
"777","sakaguchi","06manbiki_kazoku.txt","犯罪を犯罪によって隠す。"
"778","sakaguchi","06manbiki_kazoku.txt","人の自然によくやる手だが、それを逆用しているのさ。"
"779","sakaguchi","06manbiki_kazoku.txt","実に芸の細かい人だよ。"
"780","sakaguchi","06manbiki_kazoku.txt","あいにく、花田と野草に秘密を握られたのが運の尽きだが、いかな達人といえども、火急にせまられて身を処す際には仕方がない。"
"781","sakaguchi","06manbiki_kazoku.txt","我一人じゃア手がまわらねえや。"
"782","sakaguchi","06manbiki_kazoku.txt","浅虫家ほどの金持なら、ゆすられる金額はアブがとまったほどのこともなかろうが、親殺しの秘密を握られているのが辛いところだ。"
"783","sakaguchi","06manbiki_kazoku.txt","キク子を花田家の嫁にやって一方の口はふさいでも、野草の口はふさげねえや。"
"784","sakaguchi","06manbiki_kazoku.txt","どうせ野草を殺すなら、花田も一しょに二人まとめて片づけるのが何よりと見たのは、これも策の得たるものであったろう。"
"785","sakaguchi","06manbiki_kazoku.txt","この殺人のカラクリは一也の写真道楽だ。"
"786","sakaguchi","06manbiki_kazoku.txt","仕掛を施した崖の上へ二人同時に立たせるには、写真をおいて外にはない。"
"787","sakaguchi","06manbiki_kazoku.txt","一万余坪の邸宅だもの、崖下から人が報せにくるまでには、仕掛のアトを存分に取り片づけができようというものさ」"
"788","sakaguchi","06manbiki_kazoku.txt","掌を指すが如くにピタリと謎の数々を解きあかす。"
"789","sakaguchi","06manbiki_kazoku.txt",""
"790","sakaguchi","06manbiki_kazoku.txt","海舟の心眼を拝借した虎之介は、夢心持から解き放されて、勇気リンリン、そう遠くない白金の地へ芝山内を突ッ走って先廻りして、新十郎の到着を浅虫家の門前で今やおそしと待っている。"
"791","sakaguchi","06manbiki_kazoku.txt","ニヤリ／＼と、実に骨がとろけるほど、ねむたく快い時間であった。"
"792","sakaguchi","06manbiki_kazoku.txt",""
"793","sakaguchi","06manbiki_kazoku.txt",""
"794","sakaguchi","06manbiki_kazoku.txt","★"
"795","sakaguchi","06manbiki_kazoku.txt",""
"796","sakaguchi","06manbiki_kazoku.txt","「アヤマチをアヤマチによって隠す。"
"797","sakaguchi","06manbiki_kazoku.txt","犯罪を犯罪によって隠す。"
"798","sakaguchi","06manbiki_kazoku.txt","人の自然によくやる手だが、それを逆用しているなア、この事件は」"
"799","sakaguchi","06manbiki_kazoku.txt","と、相好をくずし、口からヨダレをたらして虎之介が言いたてようとするのを新十郎は制して、一同は案内を乞い、浅虫家の奥の間へ通る。"
"800","sakaguchi","06manbiki_kazoku.txt","古田巡査を廊下へ立たせて見張らせ、未亡人とキク子の二人をよんで相対した新十郎。"
"801","sakaguchi","06manbiki_kazoku.txt",""
"802","sakaguchi","06manbiki_kazoku.txt","「奥様。"
"803","sakaguchi","06manbiki_kazoku.txt","土蔵の中へ御案内下さいませぬか」"
"804","sakaguchi","06manbiki_kazoku.txt","と、単刀直入。"
"805","sakaguchi","06manbiki_kazoku.txt","未亡人はキッと構えて、"
"806","sakaguchi","06manbiki_kazoku.txt","「イエ。"
"807","sakaguchi","06manbiki_kazoku.txt","それは相成りませぬ。"
"808","sakaguchi","06manbiki_kazoku.txt","人様には見せられぬ秘密の品々がありますから」"
"809","sakaguchi","06manbiki_kazoku.txt","「それは分っております。"
"810","sakaguchi","06manbiki_kazoku.txt","ですが奥様。"
"811","sakaguchi","06manbiki_kazoku.txt","五年間辛苦なさった万引の品々が見たいと申すのではございませぬ。"
"812","sakaguchi","06manbiki_kazoku.txt","その品々がおさまる前から在ったもの。"
"813","sakaguchi","06manbiki_kazoku.txt","万引常習者を装い、その品々を土蔵に積んで、人々の立入りを禁じる自然の口実をつくって、万人の目から隠さなければならなかったもの。"
"814","sakaguchi","06manbiki_kazoku.txt","又、この居間で他の御家族と別に、奥様お嬢様だけで食事なさらなければならなかった理由をもつもの」"
"815","sakaguchi","06manbiki_kazoku.txt","そう言いながら、新十郎の目は優しくうるんだ。"
"816","sakaguchi","06manbiki_kazoku.txt",""
"817","sakaguchi","06manbiki_kazoku.txt","「御心労の数々、敬服も致し、衷心より御同情もいたしております。"
"818","sakaguchi","06manbiki_kazoku.txt","私どもは警察の者ではありませぬ」"
"819","sakaguchi","06manbiki_kazoku.txt","新十郎はくつろいでみせた。"
"820","sakaguchi","06manbiki_kazoku.txt",""
"821","sakaguchi","06manbiki_kazoku.txt","「御当家へはじめて参りました時から、土蔵の中にある人物が五年間生きて暮していることは察しがついておりました。"
"822","sakaguchi","06manbiki_kazoku.txt","わからないのは、顔の皮をはがれ、御主人の身代りに埋葬された者は何者かということ。"
"823","sakaguchi","06manbiki_kazoku.txt","そしてそのようなことが起ったのは何故かということ。"
"824","sakaguchi","06manbiki_kazoku.txt","それを突きとめるために昨日まで若干苦労いたしましたが、御安心なされませ。"
"825","sakaguchi","06manbiki_kazoku.txt","甚吉の行方不明に疑念を起している者は、この世に一人もおりませぬ。"
"826","sakaguchi","06manbiki_kazoku.txt","両親兄弟も親方も彼の行方不明を案じてはおりませぬ。"
"827","sakaguchi","06manbiki_kazoku.txt","又、私どもの捜査については、警察の人々は関知してはおりませぬ」"
"828","sakaguchi","06manbiki_kazoku.txt","新十郎は益々くつろいでみせた。"
"829","sakaguchi","06manbiki_kazoku.txt","彼はクスリと笑って、"
"830","sakaguchi","06manbiki_kazoku.txt","「しかし、奥様の御手腕はお見事ですなア。"
"831","sakaguchi","06manbiki_kazoku.txt","私が何より敬服いたしましたのは、癩病や万引のことではありませぬ。"
