"","auth","piece","line"
"246","sakaguchi","08ishino_shita.txt","こういう頼りない家族であるから、千代とても避けうるならば難を避けたいのは山々であるが、今や、こうして父の説得をきくうちに、ふと思いついたことがあった。"
"247","sakaguchi","08ishino_shita.txt","ハハア、さては、と気がついた。"
"248","sakaguchi","08ishino_shita.txt",""
"249","sakaguchi","08ishino_shita.txt","千頭家には妙な家憲があるのだ。"
"250","sakaguchi","08ishino_shita.txt","この家憲は世間の人々にも知られているが、世間の噂は元々｜当にならないものだ。"
"251","sakaguchi","08ishino_shita.txt","けれども、千代は千頭家に嫁して、津右衛門から、世間の噂が正しいことをたしかめていた。"
"252","sakaguchi","08ishino_shita.txt",""
"253","sakaguchi","08ishino_shita.txt","千頭家では息子の成人に当って、先祖伝来門外不出の言い伝えを語りつぐことになっている。"
"254","sakaguchi","08ishino_shita.txt","その語り伝えられるものが何事であるかは、父と息子以外の誰にも分らない。"
"255","sakaguchi","08ishino_shita.txt","息子の母も弟も知ることができないのである。"
"256","sakaguchi","08ishino_shita.txt","そしてその語り伝えられるものは決して文字に記してはいけないとされていた。"
"257","sakaguchi","08ishino_shita.txt",""
"258","sakaguchi","08ishino_shita.txt","千頭家は元々この土地の人ではなかった。"
"259","sakaguchi","08ishino_shita.txt","徳川初期のころ、三代家光の頃と云われるが、いずこよりかこの地へ移住し、莫大な山林原野を買い、人足をあつめて開墾し、今日の元をひらいたのである。"
"260","sakaguchi","08ishino_shita.txt","莫大な土地を買ったほどであるから、元々お金持であったには相違ない。"
"261","sakaguchi","08ishino_shita.txt","平家の落武者の子孫だの、豊臣家の血縁の者ではないかというような田舎らしい風聞があったのである。"
"262","sakaguchi","08ishino_shita.txt",""
"263","sakaguchi","08ishino_shita.txt","今でも土地の人々が信じていることは、千頭家の祖先が何者かは知れないが、高貴の出で、祖先伝来の山の如き金箱をつんでこの地へ移ってきたが、移り住むと、盗難を怖れて、車に何台という金箱をいずこへか埋め隠したのである。"
"264","sakaguchi","08ishino_shita.txt","父が息子に語りつぐのはその金箱の隠し場所だ。"
"265","sakaguchi","08ishino_shita.txt","その証拠には、ほかのことなら、文字に書き残して悪かろう筈がない。"
"266","sakaguchi","08ishino_shita.txt","あやまって人目にふれると大変だから、文字にすることができないのだ。"
"267","sakaguchi","08ishino_shita.txt","即ち金箱の隠し場所に相違ない、と。"
"268","sakaguchi","08ishino_shita.txt",""
"269","sakaguchi","08ishino_shita.txt","しかし、また人々は云う。"
"270","sakaguchi","08ishino_shita.txt","文字に記して人目にふれて困るのは金箱の隠し場所とは限らない。"
"271","sakaguchi","08ishino_shita.txt","もしも豊臣の子孫なら、その系図を文字に記して残すのも不安であろう。"
"272","sakaguchi","08ishino_shita.txt",""
"273","sakaguchi","08ishino_shita.txt","そして一部の人々が信じていることは、千頭家は決して高貴というのではないが、実は切支丹の残党である、と。"
"274","sakaguchi","08ishino_shita.txt","千頭家の祖先が隠したのは、金箱ではなくて、切支丹の品物を地下に埋めたものだ、と云うのだ。"
"275","sakaguchi","08ishino_shita.txt","どういう証拠でそんな噂が残っているのか分らないが、なるほど三代家光のころは切支丹断圧最後の時、その絶滅の時であるから、単なる風聞にしては時代がよく合っている。"
"276","sakaguchi","08ishino_shita.txt","あるいは土民の先祖に切支丹の品々を目利きし得る人がいて、千頭家の持参した荷物の中に秘密の祭具を見かけたのかも知れなかった。"
"277","sakaguchi","08ishino_shita.txt",""
"278","sakaguchi","08ishino_shita.txt","津右衛門は千代に語って、"
"279","sakaguchi","08ishino_shita.txt","「世間の人は色々のことを云うが、オレのうちはそのような大それたものではない。"
"280","sakaguchi","08ishino_shita.txt","まア多少はある一人のちょッとした曰くづきの人物に関係があるが、この家の者がその血筋ではないのだ。"
"281","sakaguchi","08ishino_shita.txt","わが家の血筋などはとるにも足らぬものさ。"
"282","sakaguchi","08ishino_shita.txt","関係があるという血筋の人については、ちょッと先祖は言外をはばかる事情があったが、今ではさしたることもない。"
"283","sakaguchi","08ishino_shita.txt","そこで私のオジイサンの代からそれを系図に書き入れてあるよ。"
"284","sakaguchi","08ishino_shita.txt","東太が成人して家督をついだら、東太にたのんで見せてもらうがいいさ」"
"285","sakaguchi","08ishino_shita.txt","「では、父から息子へ語り伝える必要はもうなくなったのですか」"
"286","sakaguchi","08ishino_shita.txt","「イヤ。"
"287","sakaguchi","08ishino_shita.txt","それはまだある。"
"288","sakaguchi","08ishino_shita.txt","これだけは文字に記するわけにはいかないのだよ」"
"289","sakaguchi","08ishino_shita.txt","と津右衛門は笑ったものだ。"
"290","sakaguchi","08ishino_shita.txt",""
"291","sakaguchi","08ishino_shita.txt","千代は今までそういうことを気にかけなかったので、この家に関係ありという人物が誰であるか、それを知ることなどは津右衛門の死後も忘れていた。"
"292","sakaguchi","08ishino_shita.txt",""
"293","sakaguchi","08ishino_shita.txt","しかし、今、こうして実父と実兄が、言葉巧みな方法で、この家を我が手に収めようとするのに気付くと、ここに何かがあるナと気がついた。"
"294","sakaguchi","08ishino_shita.txt","即ち、父と兄は見破ったのだ。"
"295","sakaguchi","08ishino_shita.txt","東太はまだ幼少であるから、云うまでもなく父の語り伝えをうけていない。"
"296","sakaguchi","08ishino_shita.txt","とすれば、瀕死の父は、その語り伝えを残さなければ、死んでも死にきれなかったろう。"
"297","sakaguchi","08ishino_shita.txt","彼があの断末魔ののたうちまわる苦悶の中で、右手を必死に動かしていたのは、その語り伝えの内容を暗示しようとしていたのだ。"
"298","sakaguchi","08ishino_shita.txt",""
"299","sakaguchi","08ishino_shita.txt","天鬼はまるで気違いのように津右衛門の死にゆく様のマネをしたではないか。"
"300","sakaguchi","08ishino_shita.txt","よほど重大な理由がなければ、あのように必死に、あのように愚かな所業のできるものではない。"
"301","sakaguchi","08ishino_shita.txt","天鬼は瀕死の津右衛門が必死に指し示した方向に、村人の噂に高い金箱の隠し場所があると判断したのに相違ない。"
"302","sakaguchi","08ishino_shita.txt","その指の示す方向の山林中を、彼らは二日間も歩き廻っていたではないか。"
"303","sakaguchi","08ishino_shita.txt","しかし彼らはその所在地を知ることができなかった。"
"304","sakaguchi","08ishino_shita.txt","いったん帰宅して色々と検討したあげく、多分この屋敷内のどこかに金箱があるべきことを推定したのであろう。"
"305","sakaguchi","08ishino_shita.txt",""
"306","sakaguchi","08ishino_shita.txt","こう気がつくと、主婦たるものの本能がムクムクと頭をもたげた。"
"307","sakaguchi","08ishino_shita.txt","千代は既に東太の母であり、千頭家の主婦であった。"
"308","sakaguchi","08ishino_shita.txt","安倍兆久の娘でもなく、天鬼の妹でもなかった。"
"309","sakaguchi","08ishino_shita.txt","千代はキッと額をあげて父をマジマジと見すえて、"
"310","sakaguchi","08ishino_shita.txt","「お父様も情けないことを仰有いますね。"
"311","sakaguchi","08ishino_shita.txt","私は千頭津右衛門の妻ではございませんか。"
"312","sakaguchi","08ishino_shita.txt","主人が死んで一周忌もすまぬのに、三十五日、四十九日の法要もつとめずに、どうしてこの家がうごかれましょうか。"
"313","sakaguchi","08ishino_shita.txt","女ばかりの私たちが戦乱が怖しいのは申すまでもございませんが、一周忌もすまぬうちにここを空き家にするぐらいなら、ここで泥棒に締め殺された方が本望でございます。"
"314","sakaguchi","08ishino_shita.txt","東太や私や家屋敷が助かるよりも、ここを守って死に果てることを、亡き津右衛門も満足してくれるだろうと思います。"
"315","sakaguchi","08ishino_shita.txt","もう二度とそのようなことを仰有って下さいますな」"
"316","sakaguchi","08ishino_shita.txt","気品あくまで高く、余言を許さぬ鋭さ。"
"317","sakaguchi","08ishino_shita.txt","しかし兆久天鬼とてもオメオメ引き下りはしない。"
"318","sakaguchi","08ishino_shita.txt","尚もしつこく食い下って数日を重ね、その日中は何食わぬフリをして屋敷内をくまなく調べている様子であったが、ついに目的を果さず、千代のリンリンたる気魄におされて、むなしく退却してしまった。"
"319","sakaguchi","08ishino_shita.txt",""
"320","sakaguchi","08ishino_shita.txt","父と兄が去ると、千代はホッとした。"
"321","sakaguchi","08ishino_shita.txt","そして亡き津右衛門の必死に示した指を追い、その意味を判じ先祖伝来の遺言を復活して東太に伝えるのは自分に課せられた一生の仕事であると心に誓うところがあった。"
"322","sakaguchi","08ishino_shita.txt",""
"323","sakaguchi","08ishino_shita.txt","さッそく仏間に入り、本尊の秘密の胎内から系図をとりだして調べた。"
"324","sakaguchi","08ishino_shita.txt","この系図はまさしく慶長年間からはじまっていた。"
"325","sakaguchi","08ishino_shita.txt",""
"326","sakaguchi","08ishino_shita.txt","その系図の文字とは別に、何かこまかく書きこまれているのは、それが津右衛門のオジイサンが書き加えたという文字にちがいない。"
"327","sakaguchi","08ishino_shita.txt","そのほかには書きこみがなかった。"
"328","sakaguchi","08ishino_shita.txt","しかし、その書きこみには、別にそう重大らしいことは書いてなかった。"
"329","sakaguchi","08ishino_shita.txt",""
"330","sakaguchi","08ishino_shita.txt","「千頭家は当地移住まで特に記すべき血統なし。"
"331","sakaguchi","08ishino_shita.txt","初代津右衛門長女さだ」"
"332","sakaguchi","08ishino_shita.txt","そこまでは当り前の文字であるが、その次から風が変って、字ではあるが、読みようのない文字である。"
"333","sakaguchi","08ishino_shita.txt",""
"334","sakaguchi","08ishino_shita.txt","「人左川度。"
"335","sakaguchi","08ishino_shita.txt","キウンヨザギンブ。"
"336","sakaguchi","08ishino_shita.txt","クレビラキ。"
"337","sakaguchi","08ishino_shita.txt","当家大明神大女神也」"
"338","sakaguchi","08ishino_shita.txt","こう書かれていた。"
"339","sakaguchi","08ishino_shita.txt",""
"340","sakaguchi","08ishino_shita.txt","千代は考えたが、分らなかった。"
"341","sakaguchi","08ishino_shita.txt","それを紙片に書きとり、系図を元の場所へおさめ、折にふれ紙片をとりだして考えふけったが、どうしても、手がかりがない。"
"342","sakaguchi","08ishino_shita.txt",""
"343","sakaguchi","08ishino_shita.txt","四十九日がきて、近在の人々が集った。"
"344","sakaguchi","08ishino_shita.txt","そのとき、江戸から回向にきてくれた碁打の一人が、"
"345","sakaguchi","08ishino_shita.txt","「人の話では、仏は勝碁の途中になくなられたとのこと、神田の甚八に四目置かせて勝碁とはさてさて怖しいことでござるが、棋譜は書きとめでございませぬか」"
"346","sakaguchi","08ishino_shita.txt","千代もこれには参った。"
"347","sakaguchi","08ishino_shita.txt","亡父最後の勝局、この譜を残しておかなかったのは残念だが、あの唐突の死に際してそんな余裕のありうる筈のものでもない。"
"348","sakaguchi","08ishino_shita.txt",""
"349","sakaguchi","08ishino_shita.txt","「私もそれを残念に思いますが、終盤ちかくチラと見ただけの盤面、しかと覚えておりませぬ」"
"350","sakaguchi","08ishino_shita.txt","「甚八と申せば江戸の素人天狗は三目でもめったに歯の立たぬ豪の者。"
"351","sakaguchi","08ishino_shita.txt","まず二段はたっぷり打ちましょう。"
"352","sakaguchi","08ishino_shita.txt","甚八に四目置かせて勝つなどとは名人と雖も考えられぬことでござる。"
"353","sakaguchi","08ishino_shita.txt","棋譜の知られぬは残念千万でござるのう」"
"354","sakaguchi","08ishino_shita.txt","「うち見たところでは白によい碁ではございませぬ。"
"355","sakaguchi","08ishino_shita.txt","黒は置き石を生かして白を圧迫し、黒に充分の碁ですが、隅の黒石に平凡な死に筋があるのを見落して、せっかくの好局を負けにしたのでした」"
"356","sakaguchi","08ishino_shita.txt","千代はこう答えて、目にアリアリと黒の見落した筋を思い浮べた。"
"357","sakaguchi","08ishino_shita.txt","その時、千代の頭にひらめいたのは、その手筋であった。"
"358","sakaguchi","08ishino_shita.txt","彼女は顔色の変るほど驚いた。"
"359","sakaguchi","08ishino_shita.txt","彼女は腹に力を入れて、ウンとこらえた。"
"360","sakaguchi","08ishino_shita.txt","しばしして、人に顔色をさとられぬうちと座を立って、わが部屋へ逃げこんだが、その踏む足もウワの空、宙を踏む夢心地である。"
"361","sakaguchi","08ishino_shita.txt",""
"362","sakaguchi","08ishino_shita.txt","「アア！」"
"363","sakaguchi","08ishino_shita.txt","彼女はフスマをしめて部屋にはいり、崩れるように坐りこんだ。"
"364","sakaguchi","08ishino_shita.txt","断末魔の津右衛門が指さしていたのは、一つの方角ではなかったのだ。"
"365","sakaguchi","08ishino_shita.txt","すぐその指の先にあるもの、碁盤なのだ。"
"366","sakaguchi","08ishino_shita.txt","のたうちまわって前へ前へすすみつつも、指さしていたのは、たしかに碁盤であった筈。"
"367","sakaguchi","08ishino_shita.txt","然り。"
"368","sakaguchi","08ishino_shita.txt","たしか碁盤そのものであったのだ。"
"369","sakaguchi","08ishino_shita.txt",""
"370","sakaguchi","08ishino_shita.txt","甚八が見落していた手筋というのは、敵の石をとって二眼できたとき、とった石を又とり返される筋があるのを見落していたのである。"
"371","sakaguchi","08ishino_shita.txt","甚八ほどの打ち手が見落すのはフシギであるが彼は血迷っていたのであろう。"
"372","sakaguchi","08ishino_shita.txt","この手筋を碁の術語で「石の下」と云うのである。"
"373","sakaguchi","08ishino_shita.txt",""
"374","sakaguchi","08ishino_shita.txt","「石の下！」"
"375","sakaguchi","08ishino_shita.txt","津右衛門の言いたい言葉はこれだったのだ。"
"376","sakaguchi","08ishino_shita.txt","人々の噂する金箱が、もしも隠されているとすれば、石の下なのだ。"
"377","sakaguchi","08ishino_shita.txt",""
"378","sakaguchi","08ishino_shita.txt","その日から千代の思案と探索が新しく再びはじめられた。"
"379","sakaguchi","08ishino_shita.txt","しかし謎も解けなければ、どの石の下とも判断の下し様がなかった。"
"380","sakaguchi","08ishino_shita.txt","千代は遂にあきらめて、東太が成人したら、すべてを東太に明かして、東太の力で探させようと思ったのである。"
"381","sakaguchi","08ishino_shita.txt",""
"382","sakaguchi","08ishino_shita.txt","それから二十年すぎた。"
"383","sakaguchi","08ishino_shita.txt","そして新しく事件が起るのである。"
"384","sakaguchi","08ishino_shita.txt",""
"385","sakaguchi","08ishino_shita.txt",""
"386","sakaguchi","08ishino_shita.txt","★"
"387","sakaguchi","08ishino_shita.txt",""
"388","sakaguchi","08ishino_shita.txt","あのときから二十年たって、甚八は立派な棟梁になっていた。"
"389","sakaguchi","08ishino_shita.txt","デップリふとって、目から鼻へぬけるような鋭いところは表には現れていないが、碁は相変らずの好きな道で、石を握れば、今もって江戸の素人では並ぶ者なし、彼を打ちまかす新進の素人天狗は一人もでたことがない。"
"390","sakaguchi","08ishino_shita.txt","折にふれて思いだすのは千頭津右衛門のこと。"
"391","sakaguchi","08ishino_shita.txt",""
"392","sakaguchi","08ishino_shita.txt","「彼奴ばかりはメッポウ強かったなア。"
"393","sakaguchi","08ishino_shita.txt","オレを打ち負かした素人碁打は天下に彼奴一人だが、よくもこッぴどく打ち負かしおったものだ。"
"394","sakaguchi","08ishino_shita.txt","オレを負かしてトタンに血を吐いて死んだのも、鬼神の力を借りてオレに勝ったがために、約束によって鬼神にイノチを召されたのさ。"
"395","sakaguchi","08ishino_shita.txt","さもなきゃオレに勝てやしねえな」"
"396","sakaguchi","08ishino_shita.txt","と、ウヌボレはいくつになっても治らない。"
"397","sakaguchi","08ishino_shita.txt","この甚八のところへ、ある日、千頭家から使いの二人の男が現れた。"
"398","sakaguchi","08ishino_shita.txt","中年者は安倍｜地伯といって、津右衛門の寡婦千代の実弟。"
"399","sakaguchi","08ishino_shita.txt","その連れの若い男は地伯の妻｜比良の弟で和具須曾麻呂という者であった。"
"400","sakaguchi","08ishino_shita.txt","その口上をきくと、津右衛門の二十一周忌の法要を営むについて、仏の急死に縁の深い甚八にもぜひその席につらなっていただきたい。"
"401","sakaguchi","08ishino_shita.txt","急死に縁が深いといえば語弊があるが、二十一周忌という昔話になれば、あれもこれもなつかしいばかり。"
"402","sakaguchi","08ishino_shita.txt","仏もさだめし甚八を、また彼との最後の対局をなつかしんでいるであろう、というような話であった。"
"403","sakaguchi","08ishino_shita.txt","こう云われてみれば甚八とても、なつかしさはこみあげてくる。"
"404","sakaguchi","08ishino_shita.txt",""
"405","sakaguchi","08ishino_shita.txt","「もう二十一周忌かねえ。"
"406","sakaguchi","08ishino_shita.txt","早いものだ。"
"407","sakaguchi","08ishino_shita.txt","まったく、なつかしいねえ。"
"408","sakaguchi","08ishino_shita.txt","そうですかい。"
"409","sakaguchi","08ishino_shita.txt","それじゃア、何をおいても、お供させていただきましょう」"
"410","sakaguchi","08ishino_shita.txt","さっそく旅支度をととのえ、二人に案内されて、川越在の千頭家へおもむいた。"
"411","sakaguchi","08ishino_shita.txt","きいてみれば、村の姿も、建物も昔に変るところがない。"
"412","sakaguchi","08ishino_shita.txt","変ったのは、人の姿ばかりである。"
"413","sakaguchi","08ishino_shita.txt","甚八がはじめてここを訪れた時は、彼の頭も人の頭もチョンマゲだった。"
"414","sakaguchi","08ishino_shita.txt","千代の腕にだかれていた三ツの東太は二十三の男ざかりとなったそうだが、どこにいるのやら挨拶にも出てこないし、姿を見かけたこともない。"
"415","sakaguchi","08ishino_shita.txt","その代り妙な人間がタクサン住みついている。"
"416","sakaguchi","08ishino_shita.txt",""
"417","sakaguchi","08ishino_shita.txt","千代の弟の地伯がここに住んでいるのは、まだ話が分るが、地伯の細君比良の一族、父の和具｜志呂足、比良の弟の須曾麻呂、妹、宇礼の父と子三人がそっくり住みついているのである。"
"418","sakaguchi","08ishino_shita.txt","志呂足は山の神の行者で、病気を治し、悪魔疫病をはらい、吉凶禍福を占う。"
"419","sakaguchi","08ishino_shita.txt","バカに人の出入りが多いな、と思ったのは理りで、日中は山の神の信者が相当数訪れるのである。"
"420","sakaguchi","08ishino_shita.txt","津右衛門の先妻の子で、肺病の玉乃、今はもう三十九のウバ桜であるが、どうやら行者志呂足の愛人とも妾ともつかないような関係ができているらしい。"
"421","sakaguchi","08ishino_shita.txt",""
"422","sakaguchi","08ishino_shita.txt","二十年も昔のことで、甚八は津右衛門の命日を忘れていたが、誘われるままに来てみると、すぐ命日かと思いのほか、法要の当月までにはまだ一週間も間があるのだ。"
"423","sakaguchi","08ishino_shita.txt",""
"424","sakaguchi","08ishino_shita.txt","「どうも、変だな。"
"425","sakaguchi","08ishino_shita.txt","何かあるんじゃないかな」"
"426","sakaguchi","08ishino_shita.txt","と、そこは生馬の目をぬく賭け碁の大家甚八、鋭い眼力で、なんとなく怪しい気配を感づいた。"
"427","sakaguchi","08ishino_shita.txt",""
"428","sakaguchi","08ishino_shita.txt",""
"429","sakaguchi","08ishino_shita.txt","★"
"430","sakaguchi","08ishino_shita.txt",""
"431","sakaguchi","08ishino_shita.txt","地伯が姉の婚家へころがりこんできたのにはワケがあった。"
"432","sakaguchi","08ishino_shita.txt","父の兆久が死んだのは今から十五年前のことである。"
"433","sakaguchi","08ishino_shita.txt","安倍家は秩父の豪家であったが、兆久に事業癖があって、鉱山に手をだしたり、陶工をよびカマをつくって大々的に陶器をやかせて失敗したり、山気を起して江戸を往復するたびに先祖伝来の莫大な財宝をすりへらして死んでしまった。"
"434","sakaguchi","08ishino_shita.txt",""
"435","sakaguchi","08ishino_shita.txt","安倍家をついだ長子天鬼は親の山気を慾気の方へうけついで、強慾のケチン坊。"
"436","sakaguchi","08ishino_shita.txt","弟の地伯に天保銭一枚わけてやるのも惜しいのである。"
"437","sakaguchi","08ishino_shita.txt","兆久が死んで二十日ばかり経たころ、弟をよんで、"
"438","sakaguchi","08ishino_shita.txt","「お前に分家もさせぬうちに父が死んでしまったが、財産をしらべてみると父が使い果して、めぼしいものは何一ツ残っておらぬ。"
"439","sakaguchi","08ishino_shita.txt","そういう次第でお前に分けてやるような田畑も金もないが、幸い長の山の山林だけが残っている。"
"440","sakaguchi","08ishino_shita.txt","それをそッくりやるわけにはいかぬが、長の山には平地があるから、お前一人の腕で今年一年かかって山をきりひらいて畑にしただけくれてやる。"
"441","sakaguchi","08ishino_shita.txt","明日からさッそく仕事にかかるがよい。"
"442","sakaguchi","08ishino_shita.txt","しかし、人手を頼んではならないし、また今年一パイきりひらいた分だけだぞ」"
"443","sakaguchi","08ishino_shita.txt","時は三月はじめであるから、年の暮までには相当ある。"
"444","sakaguchi","08ishino_shita.txt","地伯は兄の厚意をよろこんで、翌日から雨風にもめげず、日のあるうちは開墾にかかる。"
"445","sakaguchi","08ishino_shita.txt","なれない労働だが、働く分だけ自分のものになると思えば、夢中であった。"
"446","sakaguchi","08ishino_shita.txt","と、半月ほどすぎたころ開墾の現場へ役人がきて、彼を捕えて牢へぶちこんでしまった。"
"447","sakaguchi","08ishino_shita.txt","そこは安倍家の山林ではなく、他家のものであった。"
"448","sakaguchi","08ishino_shita.txt",""
"449","sakaguchi","08ishino_shita.txt","地伯は役人に哀訴して、兄の天鬼にきいてくれ。"
"450","sakaguchi","08ishino_shita.txt","兄がこれこれ云ったのだから、兄の思いちがいなら、兄がなんとかしてくれるに相違ないから、とたのんだが、役人が天鬼の言葉だと伝えたものは、"
"451","sakaguchi","08ishino_shita.txt","「とんでもない。"
"452","sakaguchi","08ishino_shita.txt","あのバチ当りめが。"
