"","auth","piece","line"
"453","sakaguchi","08ishino_shita.txt","長の山は今ではウチの山ではないと云ってきかせても、そう云ってオレをだましてオレに何もくれないツモリだろうと一人ぎめに開墾をはじめた悪者でござる。"
"454","sakaguchi","08ishino_shita.txt","ウンとこらしめて下され」"
"455","sakaguchi","08ishino_shita.txt","という返答だった。"
"456","sakaguchi","08ishino_shita.txt","幸い微罪によって一月ばかりで釈放されたが、わが家へ戻ると、一足も玄関へ入れず、お前のような悪者はただ今かぎり勘当だ、と突きだされてしまった。"
"457","sakaguchi","08ishino_shita.txt","仕方なく姉の千代をたよって千頭家の居候になったのである。"
"458","sakaguchi","08ishino_shita.txt",""
"459","sakaguchi","08ishino_shita.txt","姉の千代はお人よしで気の小さい地伯をあわれんで、番頭代りに帳づけなどの仕事に当らせた。"
"460","sakaguchi","08ishino_shita.txt","先妻の遺した玉乃が病身ではあるが、一ツ玉乃が年上の似た年ごろ、ゆくゆくは二人を一しょにさせて幼い東太の片腕にもと千代は考えていたのである。"
"461","sakaguchi","08ishino_shita.txt",""
"462","sakaguchi","08ishino_shita.txt","ところが、好事魔多し。"
"463","sakaguchi","08ishino_shita.txt","千頭家の広大な地所のうちに、タナグ山という海抜四五〇｜米ぐらいの相当な深山がある。"
"464","sakaguchi","08ishino_shita.txt","山の入口に小さな鳥居があって、これを山の神というのであるが、さて鳥居をくぐって山の奥へどこまで行っても、どこにもホコラがあるわけではなく、どこが山の神の所在地だか誰にも分らない。"
"465","sakaguchi","08ishino_shita.txt","山の神というものは、どこの山の神でもそういうもので、まア頂上、むしろ山全体が神体なのかも知れない。"
"466","sakaguchi","08ishino_shita.txt","タナグ山には登山道すらもない。"
"467","sakaguchi","08ishino_shita.txt","頂上へ行くには谷を渉り岩をよじ道なきところを這いまわらねば行かれないが、どこの山でも昔はたいがいそういうもの。"
"468","sakaguchi","08ishino_shita.txt","登山という遊びが流行して以来名山高山には一ツのこらず道がついたが、全国の名もない小山は登山家の対象にならないから中腹ぐらいまでキコリの道がある程度で、頂上までの登山道など先ずめッたに在るものではない。"
"469","sakaguchi","08ishino_shita.txt",""
"470","sakaguchi","08ishino_shita.txt","タナグ山は昔から何人かの信仰があったらしく、その麓には誰がたてたのか小ッポケながら鳥居があり、それが古くなると、いつのまにか誰かがたて代えて今につづいていた。"
"471","sakaguchi","08ishino_shita.txt","すべて山の神の信仰は闇夜に行われるものだそうで、鳥居のたて代えも闇夜に誰がやっているのか、知る人もなかったし、気をまわす者もなかった。"
"472","sakaguchi","08ishino_shita.txt","どんな人間が信仰しているのか、それを問題にする必要もなかったのだ。"
"473","sakaguchi","08ishino_shita.txt",""
"474","sakaguchi","08ishino_shita.txt","ところが川越の近在で酒造業をやっていた男が、せっかく仕込んだ酒を、樽を叩きこわしてみんな土にすわせたアゲクに、"
"475","sakaguchi","08ishino_shita.txt","「ワレこそは先祖代々タナグ山の神霊に仕えてきた神の血をひく家柄で、酒造業は時至るまで世を忍ぶ仮の営み、ワガ本名は和具志呂足、ワガ長女の名は比良、長男は須曾麻呂、次女は宇礼と名のる。"
"476","sakaguchi","08ishino_shita.txt","すべて神慮によって定められた神族の神名である。"
"477","sakaguchi","08ishino_shita.txt","神託によって本日より公然と山の神の祭祀一切つかさどるであろう」"
"478","sakaguchi","08ishino_shita.txt","と名乗りをあげた。"
"479","sakaguchi","08ishino_shita.txt","つもる負債に発狂したという説もあり、佯狂だという説もあった。"
"480","sakaguchi","08ishino_shita.txt",""
"481","sakaguchi","08ishino_shita.txt","しかし彼の病気の治療がフシギにきく。"
"482","sakaguchi","08ishino_shita.txt","占いが当る。"
"483","sakaguchi","08ishino_shita.txt","そういう評判がたつようになって遠路訪れる病人もあり相当繁昌するようになった。"
"484","sakaguchi","08ishino_shita.txt",""
"485","sakaguchi","08ishino_shita.txt","その評判をきいて、長い病気に悩む玉乃が志呂足の施術を乞いにでかけた。"
"486","sakaguchi","08ishino_shita.txt","フシギや日増しに力もつき、心気とみに冴えて、血色もよくなったから、玉乃はたちまち志呂足を生き神様と狂信するに至った。"
"487","sakaguchi","08ishino_shita.txt","これだけで済めばさほどのこともなかったろうが、ここに千代の一大心痛事があったのである。"
"488","sakaguchi","08ishino_shita.txt","ほかでもないが、一粒種の東太の智能が低いのである。"
"489","sakaguchi","08ishino_shita.txt","父は素人日本一とうたわれた碁の打ち手、母とても結婚後習い覚えた碁が東太が三ツになる時には素人天狗を打ちまかすほどに上達した利巧者、二人の仲に低能が生れる筈はないから、よほどオクテの大器晩成塑。"
"490","sakaguchi","08ishino_shita.txt","むしろ大物が育つのかも知れないなどと先を楽しみにしていたが、いつまでたっても智恵がつかない。"
"491","sakaguchi","08ishino_shita.txt","日に日に心痛が深まり、いッそわが子を殺して一思いに死にたいと思うほどの悲痛な心境になっていた。"
"492","sakaguchi","08ishino_shita.txt","折から玉乃が志呂足を信仰してメキメキと元気になり、義母の千代にも信仰をすすめるから、目の前にその実際を見ては心の動くのも当然だ。"
"493","sakaguchi","08ishino_shita.txt","そこで東太をつれて志呂足を訪ねた。"
"494","sakaguchi","08ishino_shita.txt",""
"495","sakaguchi","08ishino_shita.txt","志呂足は東太母子をむかえて、いと満足げにうちうなずき、"
"496","sakaguchi","08ishino_shita.txt","「ソチたちがここへ来ることは、とうに私は知っていたよ。"
"497","sakaguchi","08ishino_shita.txt","東太にはタナグ山の神霊の怒りがタタリをしている。"
"498","sakaguchi","08ishino_shita.txt","ソチの祖先が神様の山を金で買って所有したのがいけないのだよ。"
"499","sakaguchi","08ishino_shita.txt","そのタタリが東太に現れ、またそのタタリを私がといてやることがチャンと定められているのだから、何も心配することはない。"
"500","sakaguchi","08ishino_shita.txt","ソチの家がタナグ山の神霊の化身たる私の神殿となることも太古からの定めであるから、ただ今からソチの家へ引き移る。"
"501","sakaguchi","08ishino_shita.txt","東太のタタリは津右衛門の二十一周忌の日にバラリと解けて東太は立派な男になるぞよ」"
"502","sakaguchi","08ishino_shita.txt","こう云って、一族をひきつれさッさと千頭家へ引越してしまった。"
"503","sakaguchi","08ishino_shita.txt","おぼれる者は藁のタトエで、千代にはそれを拒むことが、できなかった。"
"504","sakaguchi","08ishino_shita.txt","それが今から十年ほど前のことである。"
"505","sakaguchi","08ishino_shita.txt",""
"506","sakaguchi","08ishino_shita.txt","それ以来、千代は様子を見ていたが、東太の頭の発育に見るべきような変化は現れてくれないが、なにがさて、津右衛門の二十一周忌の当日に至ってバラリとタタリが解けるのだという。"
"507","sakaguchi","08ishino_shita.txt","ちゃんとはじめにこう宣言がしてあるのだから、変化がなくとも文句も云えない。"
"508","sakaguchi","08ishino_shita.txt","果して実力ある行者であろうか、山師ではあるまいかと、日夜に思い悩んでいるうちに、ウバ桜とはいえ美貌の玉乃は志呂足の情婦とも妾とも侍女ともつかぬ得体の知れないものとなり、地伯もいつか狂信して、志呂足の長女比良をめとり、千頭家の番頭よりも、山の神の忠実な玄関番になってしまった。"
"509","sakaguchi","08ishino_shita.txt","下男も女中もみんな志呂足の信者となって、広い邸内に千代の味方は一人もいなくなったのである。"
"510","sakaguchi","08ishino_shita.txt",""
"511","sakaguchi","08ishino_shita.txt","千代は心細さにたまりかねて、兄の天鬼に相談した。"
"512","sakaguchi","08ishino_shita.txt","心のよからぬ兄ではあるが、得体の知れない行者にくらべれば、どれぐらいタヨリになるか分らない。"
"513","sakaguchi","08ishino_shita.txt","利にさとく、人心の表裏に鋭く眼のはたらく兄であるから、心がねじけているだけ志呂足の敵手としては手ごわい手腕を現してくれるかも知れない。"
"514","sakaguchi","08ishino_shita.txt","それを心だのみに天鬼に相談すると、天鬼は苦笑して、千頭家へ遊びに現れ、一ヶ月の余もユックリ滞在して志呂足の正体を観察していた。"
"515","sakaguchi","08ishino_shita.txt",""
"516","sakaguchi","08ishino_shita.txt","「イワシの頭も信心からと云う通り、人間は気の持ちようで多少の病気はなおるようだな。"
"517","sakaguchi","08ishino_shita.txt","しかし死病の人が生き返ったり、バカが利巧になることはあるまい。"
"518","sakaguchi","08ishino_shita.txt","あの志呂足は食わせ者さ。"
"519","sakaguchi","08ishino_shita.txt","東太を憐れむ余りとはいえ、あんな食わせ者に屋敷をかしたお前もバカだな。"
"520","sakaguchi","08ishino_shita.txt","だが、今となっては仕方がない。"
"521","sakaguchi","08ishino_shita.txt","二十一周忌に志呂足のツラの皮をひんむいてやるから、それまで待つがよい。"
"522","sakaguchi","08ishino_shita.txt","東太はオレが秩父へつれて帰って、仕込み甲斐もなかろうが、多少は智恵のつくように手をほどこしてやろう」"
"523","sakaguchi","08ishino_shita.txt","愛児を手ばなすのは心もとないが、志呂足一味の中におくよりは兄の手にまかせた方が無難かも知れないと、千代もその気になった。"
"524","sakaguchi","08ishino_shita.txt","ところが、この話を伝えきいた志呂足が思いもよらぬ大立腹。"
"525","sakaguchi","08ishino_shita.txt","千代を明々と燈明のゆらぎたつ神前によびつけ、須曾麻呂、比良、宇礼、地伯はじめ信徒の重立つものがこれを取りかこんで、"
"526","sakaguchi","08ishino_shita.txt","「東太はタナグ山神のタタリをうけている罪人。"
"527","sakaguchi","08ishino_shita.txt","私が当家に神殿を移したのも、東太に代って日夜山神のアワレミを乞い、ツツガなくタタリの解ける日を待つためである。"
"528","sakaguchi","08ishino_shita.txt","東太がこの地を動くならばタタリのとけることはなく、さらに山神の怒りにふれて神隠しにあい、地底へ封じこまれてしまうぞ。"
"529","sakaguchi","08ishino_shita.txt","それでもよいか」"
"530","sakaguchi","08ishino_shita.txt","こう云って千代をおどかす。"
"531","sakaguchi","08ishino_shita.txt","千代も仕方なく、この由を天鬼に告げると、"
"532","sakaguchi","08ishino_shita.txt","「アッハッハ。"
"533","sakaguchi","08ishino_shita.txt","なんとか口実をつけて二十一周忌の解禁をごまかされては大変だ。"
"534","sakaguchi","08ishino_shita.txt","なんでも志呂足の云う通りになっておれ。"
"535","sakaguchi","08ishino_shita.txt","お前もまわりの者がみんな志呂足の信者では心細かろう。"
"536","sakaguchi","08ishino_shita.txt","オレの知人に御家人クズレの漢方医がいて、夫婦ともに世なれた人だから、この人を差し向けて上げよう。"
"537","sakaguchi","08ishino_shita.txt","礼を厚くもてなして、東太の教育をたのむがよい」"
"538","sakaguchi","08ishino_shita.txt","天鬼は秩父から約束通り、入間玄斎、同人妻お里の両名をさしむけた。"
"539","sakaguchi","08ishino_shita.txt","天鬼の知人にしては上品で落着いた人物。"
"540","sakaguchi","08ishino_shita.txt","御家人くずれで、漢学の素養もあるが、道楽に身をもちくずしたこともある酸いも甘いもかみわけた通人夫婦。"
"541","sakaguchi","08ishino_shita.txt","五十をすぎて子供もなく、デタラメに薬を煮たてて病人をだましてきた呑気な夫婦で人生を達観し、一向にクッタクがない。"
"542","sakaguchi","08ishino_shita.txt","低能の東太のお守り役にはまことに適当な人物であった。"
"543","sakaguchi","08ishino_shita.txt","願ってもない人が来てくれたと千代はことごとく喜んで、離れの下と二階を分け合って、入間夫婦と東太母子の四人が仲よく水入らずで暮すことになった。"
"544","sakaguchi","08ishino_shita.txt","天鬼は時々訪れてユックリ滞在し、ここに離れの一味と母屋の志呂足の一味は邸内を二分して、津右衛門の二十一周忌を待つこととなったのである。"
"545","sakaguchi","08ishino_shita.txt",""
"546","sakaguchi","08ishino_shita.txt","ところが二十一周忌が近づいた時になって志呂足はタナグ山神のお告げと称して、変なことを言いだした。"
"547","sakaguchi","08ishino_shita.txt",""
"548","sakaguchi","08ishino_shita.txt","その一ツは、当日津右衛門の霊が法要の席に現れて何か告げることがあるそうだから、彼の死の日に千頭家に居合した者一同が法要に参集すること。"
"549","sakaguchi","08ishino_shita.txt",""
"550","sakaguchi","08ishino_shita.txt","他の一ツは、東太は当日、志呂足の次女宇礼（十八歳）と結婚すること。"
"551","sakaguchi","08ishino_shita.txt","結婚の儀終って東太のタタリはバラリと解けるというのであった。"
"552","sakaguchi","08ishino_shita.txt",""
"553","sakaguchi","08ishino_shita.txt","津右衛門の死んだ日に千頭家に居合した者といえば、云うまでもなく甚八と千代が中心人物。"
"554","sakaguchi","08ishino_shita.txt","そのほかには玉乃をはじめ、女中のギン、ソノという二人、文吉、三次という下男、いずれもまだ当家に働いているばかりでなく、みんな志呂足の信者であった。"
"555","sakaguchi","08ishino_shita.txt",""
"556","sakaguchi","08ishino_shita.txt","これをきいて天鬼は笑い、"
"557","sakaguchi","08ishino_shita.txt","「おいでなすッたな。"
"558","sakaguchi","08ishino_shita.txt","何かやるだろうとは思っていたよ。"
"559","sakaguchi","08ishino_shita.txt","イヤ、面白い、アッハッハ。"
"560","sakaguchi","08ishino_shita.txt","津右衛門殿の霊が現れるか。"
"561","sakaguchi","08ishino_shita.txt","何を言わせるツモリだろうな。"
"562","sakaguchi","08ishino_shita.txt","何を言わせるにしても大きにタノシミのある話だ」"
"563","sakaguchi","08ishino_shita.txt","津右衛門の霊が何を言っても天鬼にカカワリのないことだから、彼は甚だクッタクがないが、当事者には薄気味わるい話である。"
"564","sakaguchi","08ishino_shita.txt","ひょッとすると、千代に一服盛り殺されたというようなことを言わせかねない。"
"565","sakaguchi","08ishino_shita.txt",""
"566","sakaguchi","08ishino_shita.txt","「まア、まア、心配するな。"
"567","sakaguchi","08ishino_shita.txt","霊魂をよぶなどと云ってどんなことを告げさせるにしても、オレがみんな化けの皮をはいでみせる。"
"568","sakaguchi","08ishino_shita.txt","それよりも困ったことは、東太と宇礼の結婚だな。"
"569","sakaguchi","08ishino_shita.txt","うまいことを考えおったな」"
"570","sakaguchi","08ishino_shita.txt","東太を自分のムコにしてしまえば、あとは野となれ山となれ、すでに同族親類で、バラリがうまくいかなくともまたゴマカシもきくし、強いてインネンもつけにくくなる。"
"571","sakaguchi","08ishino_shita.txt",""
"572","sakaguchi","08ishino_shita.txt","それに天鬼が今もって甚しく気がかりなのは、たしかにこの邸内に隠してあるに相違ない伝説の金箱であった。"
"573","sakaguchi","08ishino_shita.txt","もはや志呂足の企みには、その伝説の金箱が含まれているのではあるまいか。"
"574","sakaguchi","08ishino_shita.txt","近在の者には知れわたっている伝説なのである。"
"575","sakaguchi","08ishino_shita.txt","津右衛門がのたうちながら碁盤の方を指したということも、すでに人々に知れ渡っているのだ。"
"576","sakaguchi","08ishino_shita.txt",""
"577","sakaguchi","08ishino_shita.txt","天鬼が時々見まわりにきてユックリ千頭家に滞在する習慣をつくッたのも、東太の身を案じてのことではなくて、志呂足の企みが実はそッちに根を発しているのではないかという疑いによるのであった。"
"578","sakaguchi","08ishino_shita.txt","しかし今までの偵察では、志呂足一味が邸内や建物を探索したという事実だけは一度もなかった。"
"579","sakaguchi","08ishino_shita.txt","その探索を人知れず行うことは不可能だ。"
"580","sakaguchi","08ishino_shita.txt","そして、それらしい素振りだけは全くなかったのである。"
"581","sakaguchi","08ishino_shita.txt",""
"582","sakaguchi","08ishino_shita.txt","しかし、東太と宇礼の婚礼を行うというダンドリの発表にあって、天鬼もおどろいた。"
"583","sakaguchi","08ishino_shita.txt","そのダンドリなら、天鬼も考えていたのである。"
"584","sakaguchi","08ishino_shita.txt","天鬼の娘のお舟も宇礼と同年、十八であった。"
"585","sakaguchi","08ishino_shita.txt","イトコ同士であるが、そんなことは問題ではない。"
"586","sakaguchi","08ishino_shita.txt","津右衛門の二十一周忌に志呂足の化けの皮をはぎ、千頭家から一味の者を叩きだして、千代の感謝をかい、何の面倒もなく、東太とお舟の縁組を結ばせようというコンタンだ。"
"587","sakaguchi","08ishino_shita.txt","二十年前に父兆久と共にひどく真剣に邸内を探しまわったのは今から思えばムダな話。"
"588","sakaguchi","08ishino_shita.txt","東太という低能児と自分の娘を結婚させれば、期せずして千頭家をきりまわす力は嫁方のもので、おまけに東太の母だって、自分の妹ではないか。"
"589","sakaguchi","08ishino_shita.txt","お舟と東太を一しょにさせれば、自然に千頭家はわが意のままだ。"
"590","sakaguchi","08ishino_shita.txt",""
"591","sakaguchi","08ishino_shita.txt","このことは、東太と宇礼が結婚しても同じことだ。"
"592","sakaguchi","08ishino_shita.txt","低能の東太に当主の実力は有りッこないから、家をきりまわす者は嫁であり嫁の一族だ。"
"593","sakaguchi","08ishino_shita.txt","志呂足一味が邸内の探索などとそれらしいどんな素振りもしなかったのは、はじめからこの結婚を予定しており、それを見越して落着き払っていたようだ。"
"594","sakaguchi","08ishino_shita.txt",""
"595","sakaguchi","08ishino_shita.txt","なぜかと云えば、邸内の探索らしい素振りをミジンもしたことがないというのがその証拠である。"
"596","sakaguchi","08ishino_shita.txt","近在では噂に高い伝説の金箱であるから、この邸内に移り住めば、誰だって先ずそれを探してみたいのが人情だ。"
"597","sakaguchi","08ishino_shita.txt","十年間も住んでいて、一度も金箱の在りかを探したことがないというのは、もっと確実な方法が予約されていたせいだろう。"
"598","sakaguchi","08ishino_shita.txt",""
"599","sakaguchi","08ishino_shita.txt","こう考えると、さすがの天鬼もくさッてしまった。"
"600","sakaguchi","08ishino_shita.txt","まてよ、なにかよい方法はないか。"
"601","sakaguchi","08ishino_shita.txt","悪智恵では人に負けない天鬼、そこで人知れずジックリ考えはじめた。"
"602","sakaguchi","08ishino_shita.txt",""
"603","sakaguchi","08ishino_shita.txt",""
"604","sakaguchi","08ishino_shita.txt","★"
"605","sakaguchi","08ishino_shita.txt",""
"606","sakaguchi","08ishino_shita.txt","こういうことを何も知らずにやってきた甚八、しかし、鋭い勘ですぐ邸内の異様な気配だけは感じとった。"
"607","sakaguchi","08ishino_shita.txt","こいつァいけねえと思いついて、邸内の人間を相手にせずに、散歩のフリをして村人から事情をきいて廻ったのはさすがに賭け碁の名人。"
"608","sakaguchi","08ishino_shita.txt",""
"609","sakaguchi","08ishino_shita.txt","「なるほどねえ。"
"610","sakaguchi","08ishino_shita.txt","当日、津右衛門の霊のお告げがあるのかえ。"
"611","sakaguchi","08ishino_shita.txt","それでオレが一枚加えられたとは知らなかった。"
"612","sakaguchi","08ishino_shita.txt","こいつァ要心しなきゃアいけねえよ。"
"613","sakaguchi","08ishino_shita.txt","なア。"
"614","sakaguchi","08ishino_shita.txt","どんなヘボな碁打だって、自分でムダと思う手は打ちッこないね。"
"615","sakaguchi","08ishino_shita.txt","オレをここへ呼んだ意味というものが必ず有るに相違ないよ。"
"616","sakaguchi","08ishino_shita.txt","その筋を見のがしてると、とんでもない不意打をくらい、どんな目に会うか分りやしねえや。"
"617","sakaguchi","08ishino_shita.txt","クワバラ。"
"618","sakaguchi","08ishino_shita.txt","クワバラ」"
"619","sakaguchi","08ishino_shita.txt","碁の手筋にしたって、深く究めなくては本当の筋は分らない。"
"620","sakaguchi","08ishino_shita.txt","和具志呂足のうつ手筋を見破るには、千頭家のあらゆることを知らなければならない。"
"621","sakaguchi","08ishino_shita.txt","甚八はいささかもタメラわなかった。"
"622","sakaguchi","08ishino_shita.txt","彼は足にまかせて疲れを知らずに村内を軒並にきいてまわった。"
"623","sakaguchi","08ishino_shita.txt",""
"624","sakaguchi","08ishino_shita.txt","「へい。"
"625","sakaguchi","08ishino_shita.txt","そうですかい。"
"626","sakaguchi","08ishino_shita.txt","千頭家の祖先は豊臣の大将か切支丹の親玉かという大物ですかねえ。"
"627","sakaguchi","08ishino_shita.txt","大八車に何台という金箱がねえ。"
"628","sakaguchi","08ishino_shita.txt","話が大きいねえ。"
"629","sakaguchi","08ishino_shita.txt","親から子へ門外不出の語り伝えをねえ。"
"630","sakaguchi","08ishino_shita.txt","なるほど。"
"631","sakaguchi","08ishino_shita.txt","え？津右衛門さんが死ぬときに、もがいたって？ええ、そう。"
"632","sakaguchi","08ishino_shita.txt","そう。"
"633","sakaguchi","08ishino_shita.txt","な、なんですッて？それが金箱の在りかを指していたんですッて！」"
"634","sakaguchi","08ishino_shita.txt","甚八の頭は敏活だ。"
"635","sakaguchi","08ishino_shita.txt","彼はハッと思わず大きい目玉をひらいて里人を見つめて、"
"636","sakaguchi","08ishino_shita.txt","「それで、金箱の在りかを、どなたか突きとめましたか」"
"637","sakaguchi","08ishino_shita.txt","「それが未だに分らねえだねえ。"
"638","sakaguchi","08ishino_shita.txt","チョックラ指をさしたぐらいじゃ分らないねえ」"
"639","sakaguchi","08ishino_shita.txt","「そうでしょうなア」"
"640","sakaguchi","08ishino_shita.txt","二十年前のこととは云え、あの碁に負けた手筋だけは、どうして忘れられようか。"
"641","sakaguchi","08ishino_shita.txt","石の下！実に無念の見落し。"
"642","sakaguchi","08ishino_shita.txt","石の下！"
"643","sakaguchi","08ishino_shita.txt","それだ！甚八はひそかに思った。"
"644","sakaguchi","08ishino_shita.txt",""
"645","sakaguchi","08ishino_shita.txt","「そうだとも。"
"646","sakaguchi","08ishino_shita.txt","アア、大変なことだぜ。"
"647","sakaguchi","08ishino_shita.txt","津右衛門が必死に指したのは、ほかでもない、あの碁盤だよ。"
"648","sakaguchi","08ishino_shita.txt","碁燈に仕掛けがあるものか。"
"649","sakaguchi","08ishino_shita.txt","あの最後の局面。"
