"","auth","piece","line"
"166","sakaguchi","aoi_jutan.txt","その傷跡は腫物の跡の如くではなく、大砲の破片を受けてそれを引抜いた跡の如くに壮烈である。"
"167","sakaguchi","aoi_jutan.txt","僕のやり方が遥か無難であったのだ。"
"168","sakaguchi","aoi_jutan.txt",""
"169","sakaguchi","aoi_jutan.txt","けれども、こういう思い出も今となってはただなつかしいばかりである。"
"170","sakaguchi","aoi_jutan.txt","貧乏の苦、恋の苦、うしとみし世ぞ今はという昔の和歌の通りである。"
"171","sakaguchi","aoi_jutan.txt",""
"172","sakaguchi","aoi_jutan.txt","ところがここにただ一つ、明るさ、なつかしさの伴わぬのが、芥川の書斎ですごした青春多感の年月であった。"
"173","sakaguchi","aoi_jutan.txt","あの頃は貧乏の苦もなかった。"
"174","sakaguchi","aoi_jutan.txt","恋情に痩せる思いをしたということもない。"
"175","sakaguchi","aoi_jutan.txt","希望と若さに溢れ、怖れや妥協にまみれることも尠く闊歩していたではないか。"
"176","sakaguchi","aoi_jutan.txt","ただ葛巻の正論には最も参った。"
"177","sakaguchi","aoi_jutan.txt","表面に弱身をみせぬ僕であるから内心最も圧倒されていたのだけれども、それは単に理窟の上の話であり、葛巻の芸術に圧倒されたわけでもなければ、わが芸術に自信を失う、絶望した、ということと全然意味が違っている。"
"178","sakaguchi","aoi_jutan.txt","この時期は、まさしく僕の若さの時、希望の時、伸びようとする力だけの時期だった。"
"179","sakaguchi","aoi_jutan.txt",""
"180","sakaguchi","aoi_jutan.txt","けれども思えば、この時期のあの姿、あの部屋、あの道、あの言葉、なぜか思いだす全てに暗さばかりがつきまとうてくる。"
"181","sakaguchi","aoi_jutan.txt","まるで、若さは暗い、というかのように。"
"182","sakaguchi","aoi_jutan.txt","事実、或いは青春は暗いものであるかも知れぬ。"
"183","sakaguchi","aoi_jutan.txt","青春には病的自体も健康であり、暗さ自体健全なのだ。"
"184","sakaguchi","aoi_jutan.txt","けれども、あの希望にみちた時期に、なぜ太陽をふり仰ぎ青空をいっぱいにあびている思いがぬけ落ちているのだろうか。"
"185","sakaguchi","aoi_jutan.txt","僕はいつも暗い路を歩いている。"
"186","sakaguchi","aoi_jutan.txt","その路は芥川の書斎へ通う路なのだ。"
"187","sakaguchi","aoi_jutan.txt","暗い部屋で葛巻と対坐している。"
"188","sakaguchi","aoi_jutan.txt","ペンを握り飜訳している。"
"189","sakaguchi","aoi_jutan.txt","あの部屋は日当りの良い部屋だった。"
"190","sakaguchi","aoi_jutan.txt","クッキリと青空も見え、絨毯に冬日がさやかに射しこみ、徹夜の朝の澄んだ夜明けもあったのに。"
"191","sakaguchi","aoi_jutan.txt",""
"192","sakaguchi","aoi_jutan.txt","あれは全く死の家だよ、僕は痛烈に芥川家を呪ったものだ。"
"193","sakaguchi","aoi_jutan.txt","まったくだよ、こう答えるのは長島萃で、冷やかすようにニヤニヤあとは無言、あいつは何を考えていたのだろう。"
"194","sakaguchi","aoi_jutan.txt","雑誌の同人はちょくちょく芥川家へやってくるが、あいつばかりは殆んど姿を現すということもなく、そのうち芥川よりも、もっとハツラツと自殺して死んでしまいやがった。"
"195","sakaguchi","aoi_jutan.txt",""
"196","sakaguchi","aoi_jutan.txt","君は知らないだろうけど、あのウチときたら、下の座敷へ降りると、跫音のないお婆さんがいつも立っていたり、歩いていたり、しているんだぜ。"
"197","sakaguchi","aoi_jutan.txt","せいが馬鹿に高くて肩幅のひろい角力の痩せたようなお婆さんなんだ。"
"198","sakaguchi","aoi_jutan.txt","そのお婆さんが一人かと思うと、たしかに二人なんだね。"
"199","sakaguchi","aoi_jutan.txt","嘘のことがあるものか。"
"200","sakaguchi","aoi_jutan.txt","たしかに二人だ。"
"201","sakaguchi","aoi_jutan.txt","そのくせ俺は跫音をきいた覚えがありやしない。"
"202","sakaguchi","aoi_jutan.txt","こういう風に僕は長島に言うのである。"
"203","sakaguchi","aoi_jutan.txt","ワッハッハと彼は笑って無言である。"
"204","sakaguchi","aoi_jutan.txt","便所から出たら跫音のないお婆さんがカモイの下を歩いて行ったよ、葛巻はニヤリと笑って之も無言。"
"205","sakaguchi","aoi_jutan.txt","この絨毯燃しちゃったらどうだろうね。"
"206","sakaguchi","aoi_jutan.txt","だって、君、君ったら、どうしてこの絨毯が厭なんだろうね。"
"207","sakaguchi","aoi_jutan.txt",""
"208","sakaguchi","aoi_jutan.txt","葛巻はカリエスで肋膜が悪くそのレントゲン写真を僕がひっくり返って眺めていると彼は頬杖をついて、どう？なんだか厭でしょうとニヤリと笑う。"
"209","sakaguchi","aoi_jutan.txt","毎日致死量に近いぐらいのカルモチンをのみ、少年貴族の顔は黄色く濁って皺だらけだ。"
"210","sakaguchi","aoi_jutan.txt","カルモチン止したらどうかね。"
"211","sakaguchi","aoi_jutan.txt","だって眠れないもの。"
"212","sakaguchi","aoi_jutan.txt","眠れる人は幸福よ。"
"213","sakaguchi","aoi_jutan.txt","馬鹿馬鹿しい話だよ。"
"214","sakaguchi","aoi_jutan.txt","叔父さんの亡霊にすぎないのさ。"
"215","sakaguchi","aoi_jutan.txt","叔父さんと縁を切るのだよ。"
"216","sakaguchi","aoi_jutan.txt","バッサリと。"
"217","sakaguchi","aoi_jutan.txt","じゃ眠らせて下さいよ。"
"218","sakaguchi","aoi_jutan.txt","少年貴族は爽やかに笑うのである。"
"219","sakaguchi","aoi_jutan.txt",""
"220","sakaguchi","aoi_jutan.txt","芥川は自殺したけど、だいたい自殺などというウチじゃないのだね。"
"221","sakaguchi","aoi_jutan.txt","誰かがあのウチで殺されている。"
"222","sakaguchi","aoi_jutan.txt","短刀とかピストルというものが投げだしてあって、それで君、犯人なんか必要ないよ。"
"223","sakaguchi","aoi_jutan.txt","だいたい、そういうウチなんだ。"
"224","sakaguchi","aoi_jutan.txt","いつだって青空から隠されているよ。"
"225","sakaguchi","aoi_jutan.txt","僕は又こういう風に長島に言う。"
"226","sakaguchi","aoi_jutan.txt","彼は又腹をかかえて大笑い。"
"227","sakaguchi","aoi_jutan.txt",""
"228","sakaguchi","aoi_jutan.txt","要するに長島は、僕という蕪雑な男はそういう風な困り方をする男で、死の家の暗さなどという妙なものをデッチあげて独りで参ってよろこんでいる、要するに一つのポーズだ。"
"229","sakaguchi","aoi_jutan.txt","尤もフロイド風に分析すれば持って廻った底の方に謎を解く鍵もあろうけれども、ポーズの方が重要なのさ、と思いこんでいたかも知れぬ。"
"230","sakaguchi","aoi_jutan.txt",""
"231","sakaguchi","aoi_jutan.txt","僕自身僕のポーズに眩惑される傾向もたしかにあるが、正しく敬虔なる心に於て、あの家は暗い家だと僕はやっぱり判定する。"
"232","sakaguchi","aoi_jutan.txt","笑うなかれ。"
"233","sakaguchi","aoi_jutan.txt","少女の祈りの如き幼い心が今なお僕の心に少しく宿り、その言葉が、あの家は暗い家だと言っている。"
"234","sakaguchi","aoi_jutan.txt","葛巻は暗くない。"
"235","sakaguchi","aoi_jutan.txt","芥川家は暗くない。"
"236","sakaguchi","aoi_jutan.txt","住む人々も暗くない。"
"237","sakaguchi","aoi_jutan.txt","婆さんに跫音がないよなどとはまこと無礼なる悪表現で僕の無躾なポーズのせいに他ならぬ。"
"238","sakaguchi","aoi_jutan.txt","要はあの時期が暗いのだ。"
"239","sakaguchi","aoi_jutan.txt",""
"240","sakaguchi","aoi_jutan.txt","少年の希望のなんと暗くあることよ。"
"241","sakaguchi","aoi_jutan.txt","貧乏の苦も、恋の苦も知らず、多くの汚れを知らず、ただ人生の重さだけを嗅ぎ当てている。"
"242","sakaguchi","aoi_jutan.txt","希望に燃え、虚名にあこがれ、成功を追いながら、死の正しい意味を知る者はただ青春のみ。"
"243","sakaguchi","aoi_jutan.txt","最も希望のない時期だ。"
"244","sakaguchi","aoi_jutan.txt","そういうことも言えると思う。"
"245","sakaguchi","aoi_jutan.txt",""
"246","sakaguchi","aoi_jutan.txt","そういう時期の一日、暮方｜駿河台下の道を一人歩いていると、レンコートの青年によびとめられた。"
"247","sakaguchi","aoi_jutan.txt","見覚えがあるかときくので無いと答えると、そうでしょう、僕のような平凡な男がお目にとまる筈はないのです。"
"248","sakaguchi","aoi_jutan.txt","僕の一生など僕には分りすぎる程よく分っているのです。"
"249","sakaguchi","aoi_jutan.txt","安サラリーマン、右にも左にも動く筈がないではありませんか。"
"250","sakaguchi","aoi_jutan.txt","まだしも失業していないだけが不思議です。"
"251","sakaguchi","aoi_jutan.txt","あの頃は青年の半分ぐらいが失業している時代であった。"
"252","sakaguchi","aoi_jutan.txt",""
"253","sakaguchi","aoi_jutan.txt","十分か十五分だけ一緒にお茶をのむ時間を与えてくれ、と言うので、手近かな茶店で休んだのだが、彼がだしぬけに言いだした言葉は、あなたには美しい令嬢達のお友達が数えきれないほどお有りでしょうね。"
"254","sakaguchi","aoi_jutan.txt","そうして、その令嬢達がみんなあなたに思いをかけているに相違ないことも知っています、という途方もない言葉であった。"
"255","sakaguchi","aoi_jutan.txt","この男はそれを信じこんで返答の余地もない有様であった。"
"256","sakaguchi","aoi_jutan.txt","あなたのように聡明闊達王者のような青年紳士に無数の美しいお友達が出来るのは当然で、自分はアテネフランセの末席から、あなたのようになりたいということをいつも考えていた。"
"257","sakaguchi","aoi_jutan.txt","偶然一人でいらっしゃるのを見かけたので思わず呼びとめてしまったけれども、こうして十分か十五分一緒にお茶をのんでいただく光栄だけで充分なので、決して令嬢の一人に紹介していただきたいなどということは考えていない。"
"258","sakaguchi","aoi_jutan.txt","令嬢達が僕などに注意を向ける筈が有り得るものではないのですから、と言って、彼は一人で喋って、そそくさと立去ってしまった。"
"259","sakaguchi","aoi_jutan.txt","尤もこの男はまるでソファーにふんぞりかえるように坐って、腕組みをして煙草をふかして威張り返って天井を睨みながら、甚だ自卑的なことをまくしつづけていたのである。"
"260","sakaguchi","aoi_jutan.txt",""
"261","sakaguchi","aoi_jutan.txt","奇妙な話があるものだ。"
"262","sakaguchi","aoi_jutan.txt","僕には美しい令嬢の友達などは一人もなかった。"
"263","sakaguchi","aoi_jutan.txt","僕のことをこんな風に考えている人が有るというのは不思議であったが、要するに世の中はこんなものであろう。"
"264","sakaguchi","aoi_jutan.txt","誰一人思い通り、望み通りの生活などをしている人はいないので、みんな他人が幸福だと思っているだけ。"
"265","sakaguchi","aoi_jutan.txt",""
"266","sakaguchi","aoi_jutan.txt","葛巻なども多くの人々に最も幸福な人よと思われていたに相違ない。"
"267","sakaguchi","aoi_jutan.txt","その葛巻は痩せる思いで令嬢に恋いこがれ致死量に近いカルモチンをガブガブのんで辛じて眠りをとっている。"
"268","sakaguchi","aoi_jutan.txt","世はままならぬものである。"
"269","sakaguchi","aoi_jutan.txt","先年葛巻が結婚のとき、結婚記念にあの絨毯を燃しちゃいなさいと手紙を書いたが、この手紙はとうとう出しそこなってしまった。"
"270","sakaguchi","aoi_jutan.txt",""
"271","sakaguchi","aoi_jutan.txt",""
"272","sakaguchi","aoi_jutan.txt",""
"273","sakaguchi","aoi_jutan.txt",""
"274","sakaguchi","aoi_jutan.txt","底本：「風と光と二十の私と・いずこへ他十六篇」岩波書店、岩波文庫"
"275","sakaguchi","aoi_jutan.txt","2008（平成20）年11月14日第1刷発行"
"276","sakaguchi","aoi_jutan.txt","2013（平成25）年1月25日第3刷発行"
"277","sakaguchi","aoi_jutan.txt","底本の親本：「坂口安吾全集15」筑摩書房"
"278","sakaguchi","aoi_jutan.txt","1999（平成11）年10月20日初版第1刷発行"
"279","sakaguchi","aoi_jutan.txt","初出：「中央公論」"
"280","sakaguchi","aoi_jutan.txt","1955（昭和30）年4月号"
"281","sakaguchi","aoi_jutan.txt","※底本は、物を数える際や地名などに用いる「ヶ」（区点番号5-86）を、大振りにつくっています。"
"282","sakaguchi","aoi_jutan.txt",""
"283","sakaguchi","aoi_jutan.txt","入力：Nana ohbe"
"284","sakaguchi","aoi_jutan.txt","校正：酒井裕二"
"285","sakaguchi","aoi_jutan.txt","2015年6月9日作成"
"286","sakaguchi","aoi_jutan.txt","青空文庫作成ファイル："
"287","sakaguchi","aoi_jutan.txt","このファイルは、インターネットの図書館、青空文庫（http://www.aozora.gr.jp/）で作られました。"
"288","sakaguchi","aoi_jutan.txt","入力、校正、制作にあたったのは、ボランティアの皆さんです。"
"289","sakaguchi","aoi_jutan.txt",""
