"","auth","piece","line"
"0","sakaguchi","aoi_jutan.txt","青い絨毯"
"1","sakaguchi","aoi_jutan.txt","坂口安吾"
"2","sakaguchi","aoi_jutan.txt",""
"3","sakaguchi","aoi_jutan.txt","-------------------------------------------------------"
"4","sakaguchi","aoi_jutan.txt","【テキスト中に現れる記号について】"
"5","sakaguchi","aoi_jutan.txt",""
"6","sakaguchi","aoi_jutan.txt","《》：ルビ"
"7","sakaguchi","aoi_jutan.txt","（例）飜訳"
"8","sakaguchi","aoi_jutan.txt",""
"9","sakaguchi","aoi_jutan.txt","｜：ルビの付く文字列の始まりを特定する記号"
"10","sakaguchi","aoi_jutan.txt","（例）二階｜二間"
"11","sakaguchi","aoi_jutan.txt","-------------------------------------------------------"
"12","sakaguchi","aoi_jutan.txt",""
"13","sakaguchi","aoi_jutan.txt","僕らが「言葉」という飜訳雑誌、それから「青い馬」という同人雑誌をだすことになって、その編輯に用いた部屋は芥川龍之介の書斎であった。"
"14","sakaguchi","aoi_jutan.txt","というのは、同人の葛巻義敏が芥川の甥で、彼はそのころ二十一、二の若年だったが、芥川死後の整理、全集出版など責任を負うて良くやっており、同人雑誌の出版に就ても僕らの知らないことに通じていて、彼が主としてやってくれたからである。"
"15","sakaguchi","aoi_jutan.txt","当時は芥川の死後三年目であった。"
"16","sakaguchi","aoi_jutan.txt",""
"17","sakaguchi","aoi_jutan.txt","芥川の家は僕の知る文士の家では最もましな住家だけれども、中流以上の家ではない。"
"18","sakaguchi","aoi_jutan.txt","和風の小ざっぱりとした家で、とりわけ金をかけたと思われる部分もなく、特に凝った作りもない。"
"19","sakaguchi","aoi_jutan.txt","僕の知るのは二階｜二間と離れの書斎二間と座敷二間、それから庭だけ、家族の居間は知らない。"
"20","sakaguchi","aoi_jutan.txt","日当りの良い家だけれども、なぜか陰気で、死の家とはこんなものかと考え、青年客気のあのころですら、暗さを思うと、足のすすまぬ思いがしたものである。"
"21","sakaguchi","aoi_jutan.txt",""
"22","sakaguchi","aoi_jutan.txt","僕の生れた新潟の家は昔坊主の学校で、だからお寺のような建築であった。"
"23","sakaguchi","aoi_jutan.txt","おまけに二抱から三抱ぐらいの天然の松林の中にあって、ろくろく日の目を見ることも出来ず、鴉と梟の巣であった。"
"24","sakaguchi","aoi_jutan.txt","坊主の一人が屋根裏の梁に首をくくって死に、その部分だけ一｜間ぐらい切りとってある。"
"25","sakaguchi","aoi_jutan.txt","この屋根裏は女中部屋だが、子供の僕は坊主のお化けが出るなどとおどされながらも梁から梁を渡って歩いて、あの建築に就て一向に暗い印象を持たないのである。"
"26","sakaguchi","aoi_jutan.txt",""
"27","sakaguchi","aoi_jutan.txt","牧野信一の自殺した小田原の家、あの家にも暫く泊っていたことがある。"
"28","sakaguchi","aoi_jutan.txt","お寺の隣で、前後左右墓地を通りぬけて出入するという家であり、彼が首をくくった子供部屋は三畳ぐらいの板敷きの日当り悪い陰気な部屋だが、一向に「死の家」という感じは残らぬ。"
"29","sakaguchi","aoi_jutan.txt",""
"30","sakaguchi","aoi_jutan.txt","それらの家に比べれば、芥川家は高台の日当りの良い瀟洒な家で、屋根裏、病的、陋巷、凡そ「死の家」を思わせる条件の何一つにも無関係だが、僕にとっては陰鬱極まる家であった。"
"31","sakaguchi","aoi_jutan.txt","葛巻の起居していた二階八畳の青い絨毯など特に僕の呪ったもので、あの絨毯の陰気な色を考えると、方向を変えて、ほかの所へ行きたくなってしまったものだ。"
"32","sakaguchi","aoi_jutan.txt","この絨毯は、僕の記憶に誤りがなければ、芥川全集の最初の版の表紙に用いた青布の残りで、部屋いっぱい敷きつめると、汚れたような黒ずんだ青だ。"
"33","sakaguchi","aoi_jutan.txt","実に陰鬱な絨毯だ、よしたまえよ、と言って、あの頃も頻りに呪って、でも君、葛巻少年、実際彼は少年貴族という感じであったが、そういう時には急にクスリと老人のような笑い方をして言葉を濁す習慣であった。"
"34","sakaguchi","aoi_jutan.txt","彼の好きな絨毯であったに相違ない。"
"35","sakaguchi","aoi_jutan.txt","そして、生前の芥川には一切無関係の絨毯であったと思う。"
"36","sakaguchi","aoi_jutan.txt",""
"37","sakaguchi","aoi_jutan.txt","この部屋には、違い棚の下にガス管があり、叔父（芥川のこと）がこのガス管をくわえて死にかけていたことがあってネと葛巻が言っていたが、なぜか僕は死んだあるじにひどく敵意をいだいていて、この自裁者の心事などには一向に思いを馳せていなかった。"
"38","sakaguchi","aoi_jutan.txt","又、この部屋では、芥川の遺稿を読まされたこともある。"
"39","sakaguchi","aoi_jutan.txt","この遺稿は数年後、再読したときに驚嘆した未完の小品で、この作品に就てはすでに二度僕の感想を発表したが、当時は全然わからなかった。"
"40","sakaguchi","aoi_jutan.txt","否、旺盛な敵意によって、ろくろく目も通さず押し返して、つまらないと断言したのを覚えている。"
"41","sakaguchi","aoi_jutan.txt",""
"42","sakaguchi","aoi_jutan.txt","この部屋では、よく徹夜した。"
"43","sakaguchi","aoi_jutan.txt","実にくだらなく徹夜した。"
"44","sakaguchi","aoi_jutan.txt","こんな下らない原稿ばかりで雑誌をだすのは厭だと言いだすのは葛巻で、いいじゃないか、人の原稿は下らなくても、自分だけ立派な仕事をすればよい、同人雑誌はそういう性質のものだと言って、年中二人で口論する、葛巻は文学的名門に生育した人であるから、自分が編輯にたずさわる以上くだらぬ原稿はのせられぬという誇りを放すことができぬ。"
"45","sakaguchi","aoi_jutan.txt","もう印刷所へ原稿が廻してあり、校正がでている最中にすねはじめて、あしたまでに何か書いて頂戴よ、とか、之を飜訳して頂戴よ、とか、じゃ君自身書きたまえ、ウン僕も書くけどさ、弱々しく笑いだされると仕方がないので、二人でよく徹夜して原稿を書いた。"
"46","sakaguchi","aoi_jutan.txt","葛巻という人は、こういう時に、たった一夜で百何十枚という小説を書く、破りすてて結局一作も発表はしなかったが、実際一夜に百枚二百枚という信じられない書き方をする。"
"47","sakaguchi","aoi_jutan.txt","毎日丹念に短篇を書いた叔父とは全く似ていなかった。"
"48","sakaguchi","aoi_jutan.txt","僕も仕方なく飜訳にとりかかって、たった一夜にいくつか相当厚味のある原書を訳してしまったものだ。"
"49","sakaguchi","aoi_jutan.txt","ジッドの「ワイルドの思い出」という本も三日ぐらいで全部訳してしまったし、マリイ・シェイケビッチ夫人という有閑マダムの「プルウストの思い出」この本も一夜で訳した。"
"50","sakaguchi","aoi_jutan.txt","尤も、一冊の本ではあるが、有閑マダムの豪華本であるから、全訳して三十枚ぐらいのもの。"
"51","sakaguchi","aoi_jutan.txt","何分僕は大してフランス語はできないところへ、一晩という時間であるから、辞書をひかぬ、分らぬところは面倒くさい飛ばしてしまえ、というわけで、諸所に五行ぐらいずつ飛ばしたところもある始末で、「プルウストの思い出」でも、プルウストの好きな献立の半分ぐらい料理の名前や原料に知らない言葉がでてきたので、此奴面倒と飛ばしてしまった。"
"52","sakaguchi","aoi_jutan.txt","無責任なことをしたもので、僕の飜訳を読んだ人はプルウストという男は随分皿数の少い宴会をひらく奴だと思いこんだであろう。"
"53","sakaguchi","aoi_jutan.txt","ヴァレリイの「ヴァリエテ」などの幾つかもこうして飜訳したものだから、分らぬところはみんな抜かす、結局あの晦渋な原文が、僕の手にかかると明快至極なものになり、原文を知らない人々が讃嘆したものであるが、分らぬ所を抜くのだから明快流麗、無茶な話であった。"
"54","sakaguchi","aoi_jutan.txt","飜訳をほめられる度に困った思いをしたものである。"
"55","sakaguchi","aoi_jutan.txt",""
"56","sakaguchi","aoi_jutan.txt","いったい徹夜というものは壮年健康な時ほど疲労が劇しいようである。"
"57","sakaguchi","aoi_jutan.txt","近頃は徹夜をしてもさのみ疲れを覚えず徹夜を生活の一部分に心得てしまっているが、あの頃の疲労はひどかった。"
"58","sakaguchi","aoi_jutan.txt","事実本を一冊訳しあげるようなワキ目もふらぬ緊張のせいもあったであろうが、顔に表れる憔悴が顕著で、目はくぼみ、顔全体が脂でギラギラ皺だらけで黄色であった。"
"59","sakaguchi","aoi_jutan.txt","ウサギ屋のモナカを食い濃い珈琲をよく呑んだ。"
"60","sakaguchi","aoi_jutan.txt","そうして朝は大概カレーライスの食卓だったことを忘れない。"
"61","sakaguchi","aoi_jutan.txt","食慾などは殆どなかった記憶である。"
"62","sakaguchi","aoi_jutan.txt",""
"63","sakaguchi","aoi_jutan.txt","僕は徹夜を呪った。"
"64","sakaguchi","aoi_jutan.txt","葛巻がすねはじめると、僕は怒気満々、食ってかかる勢いで口論になるのであったが、葛巻は女性のように柔和な病弱にも拘らず、自説の執着に至っては話の外で、おだやかな言い方と、弱々しい微笑と、持って廻った表現で、最後の最後まで食いさがる。"
"65","sakaguchi","aoi_jutan.txt","結局僕の根負けであった。"
"66","sakaguchi","aoi_jutan.txt","尤も、葛巻の主張の方に多くの道理があったのだろう。"
"67","sakaguchi","aoi_jutan.txt","なぜなら僕らの原稿が下らないという彼の説は正しかったし、彼の野心に邪念が少い。"
"68","sakaguchi","aoi_jutan.txt","というのは、彼は有名な文士になりたいなどとは考えず、良い雑誌をだしたいということを専一に考えていた。"
"69","sakaguchi","aoi_jutan.txt","彼はある令嬢を熱愛して、それが生活のほぼ全部であり、そのほかにも別の希いがあるとすれば、三、四の名流婦人に好かれたいという名家の少年らしい願望であった。"
"70","sakaguchi","aoi_jutan.txt","良い雑誌はいわば彼の身だしなみの一つであり、どうしても「良い」雑誌でなければならぬ。"
"71","sakaguchi","aoi_jutan.txt","下らぬ原稿があっては困る。"
"72","sakaguchi","aoi_jutan.txt","彼の気風心事は王朝さながら、之に対する僕の心事に至っては粗放蕪雑、野武士の心事の如くである。"
"73","sakaguchi","aoi_jutan.txt","天下に名を為したいということだけで目がくらみ、自家の菲才浅学の如きを恬として念頭におきたがらぬ。"
"74","sakaguchi","aoi_jutan.txt","この家の自殺したあるじに本能的な敵意を懐いてしまったのも、たまたまあるじの書斎を本拠としたために世人の買い被りを受けたような風説となり、あたら槍一筋の手柄に傷をつけては残念だという向う見ずな意気込みによるものであった。"
"75","sakaguchi","aoi_jutan.txt",""
"76","sakaguchi","aoi_jutan.txt","己れの愛情に就て葛巻は至極率直で、この愛情は一方的な片思いにすぎないのだが、葛巻は万事友人に隠しておらぬ。"
"77","sakaguchi","aoi_jutan.txt","ただ令嬢に向ってだけ打開けることができないという気の毒なものであった。"
"78","sakaguchi","aoi_jutan.txt","だから、良い雑誌によって身を飾りたい、あわよくば、それによって令嬢の心を惹く一助ともしたい、という願望は純一｜無垢で、原稿の良非に対する追求は邪念がない。"
"79","sakaguchi","aoi_jutan.txt","ところが僕らは全くの野武士で、拾い首をしてでも立身出世がしたいという根性であるから、純粋な批判によっては不良品でも、商品として通用し、むしろ営利的に成立ち得るような作品だったら、その方がいいじゃないか、というような良からぬ思いを蔵している。"
"80","sakaguchi","aoi_jutan.txt","さすがにそれを表向きふりかざすわけにも行かないので、あれやこれや持って廻って言い廻しているが、心底をわれば、君はそういうけれども、案外こんな作品が受けやしないかというサモしい性根が本心だ。"
"81","sakaguchi","aoi_jutan.txt",""
"82","sakaguchi","aoi_jutan.txt","編輯に当るのは葛巻と僕で、時には詩人の本多信が加わることもあったけれども、大体同人全体は野武士の心を持っている。"
"83","sakaguchi","aoi_jutan.txt","だから僕が何かにつけて有利のようだけれども、有りていはそうではないので、何と言っても葛巻の純粋な立場には千鈞の重味があるのである。"
"84","sakaguchi","aoi_jutan.txt","野武士の僕といえども少年期をすぎたばかりの多感な年頃であるから、曇りなきものに打たれる素直な心を失ってはおらぬ。"
"85","sakaguchi","aoi_jutan.txt","葛巻の道理に勝てないものが必ず残り、常に心中無念であった。"
"86","sakaguchi","aoi_jutan.txt",""
"87","sakaguchi","aoi_jutan.txt","ふと昔を思いだす。"
"88","sakaguchi","aoi_jutan.txt","二十の年、二十五の年、三十の年。"
"89","sakaguchi","aoi_jutan.txt","京都｜伏見の弁当仕出し屋の二階に住んでいた頃は最も太平楽、利根川べりの取手にいた時は水だけ飲んで暮さねばならないことが時々あったが、その思い出も楽しいものだ。"
"90","sakaguchi","aoi_jutan.txt","あと八銭しかない、一週間は金のはいる見込もない、という時に、八銭でソバを食うべきか、タバコを買うべきか、と深刻なる難関に逢着する。"
"91","sakaguchi","aoi_jutan.txt","幾度かあったが、結局タバコを買うもので、最後の金でウドンを食ったという記憶は一度もない。"
"92","sakaguchi","aoi_jutan.txt","後日同好の士に訊き合せてみるに、結局タバコを買う方が共通の心事のようである。"
"93","sakaguchi","aoi_jutan.txt",""
"94","sakaguchi","aoi_jutan.txt","だが伏見でも苦しい病気の思い出があった。"
"95","sakaguchi","aoi_jutan.txt","このとき葛巻に助けられたので今歴々思いだしたが、まだ弁当仕出屋の二階に移らぬ前に、火薬庫の前の計理士の二階を借りていたことがあった。"
"96","sakaguchi","aoi_jutan.txt","僕が京都に住んだのは、一切友人を離れ、本当に孤独というものを底の底まで突きつめてやれ、という一時の気まぐれに発した移住であったが、計理士の二階で病気になった。"
"97","sakaguchi","aoi_jutan.txt","背中の手だけは辛じてとどくけれども絶対に見ることの出来ぬ場所に腫れ物ができ、構わずにおくと、一ヶ月目ぐらいにだしぬけに高熱がでて、目はくらみ、耳は唸り、苦痛のために身体をエビの如くに曲げてみても冷汗が流れ、自然のたうちまわって、まったく意識せずして唸り声を発してしまう。"
"98","sakaguchi","aoi_jutan.txt",""
"99","sakaguchi","aoi_jutan.txt","あいにく月末で、僕自身｜一文の金もないのみならず、宿主の計理士が月末の例によって行方をくらませてしまった。"
"100","sakaguchi","aoi_jutan.txt","彼は常に月末になると行方をくらます習慣で、自然僕が借金取の応待をせざるを得ぬ立場になる。"
"101","sakaguchi","aoi_jutan.txt","借金取と言っても、事実は家主、八百屋、電燈、水道、そういう当然なる料金の類い。"
"102","sakaguchi","aoi_jutan.txt","この計理士は五十がらみの年齢に似もやらぬ少年詩人の如き気分屋で、ええ天気やさかい仕事してられえへんどすわと言って大概のお天気の日は外出し、酒も飲まず女遊びもしないけれども、仕事の期日に遅れるために顧客も失い貧乏もするという様子である。"
"103","sakaguchi","aoi_jutan.txt","細君と別居して自分はこの事務室階下に（階上は僕）ヤモメ暮しをしており、一人ぐらしは清々とええどすわと述懐していたが、先生（僕のこと）ウチに気兼ねせんと、ええ人｜云々ということをすすめるだけの雅量を失わぬ通人でもあった。"
"104","sakaguchi","aoi_jutan.txt","だから、月末になると姿を消す。"
"105","sakaguchi","aoi_jutan.txt","一週間ぐらいは雲隠れで、之には僕も参ったけれども、他人の借金の言訳というものは極めて気楽でさしたる苦労でもなかったから、僕もとりわけこだわらず、雲隠れを咎めだてたことは一度もなかった。"
"106","sakaguchi","aoi_jutan.txt","又、この男は五十ぐらいの年にもなり鼻下にヒゲなどというものまで貯えているくせに、ちょっとのことで赤面してマッカになってしまうという奇妙な好人物であった。"
"107","sakaguchi","aoi_jutan.txt",""
"108","sakaguchi","aoi_jutan.txt","けれども、身動きならぬ病中に行方をくらまされた時には全く参った。"
"109","sakaguchi","aoi_jutan.txt","とはいえ借金の言訳が苦痛だというわけでもない。"
"110","sakaguchi","aoi_jutan.txt","なぜと云うに、こういう劇烈な病苦になると、世に孤独ほど呪うべきものがなくなってしまう。"
"111","sakaguchi","aoi_jutan.txt","道を通る一人の人の跫音ですらなつかしい。"
"112","sakaguchi","aoi_jutan.txt","さらに最もやりきれぬのが夜であり、あの暗闇であり、あの静寂だ。"
"113","sakaguchi","aoi_jutan.txt","夜の電燈は僕のイノチで、この光が消えたなら僕のイノチも消えてしまう。"
"114","sakaguchi","aoi_jutan.txt","僕の窓の正面に火薬庫があり、崖の上を銃剣さげてグルグル廻る番兵の姿が見えるが、病中僕の幻覚はこの火薬庫へ忍びより忽ち銃剣に追いつめられてとたんに火薬庫が爆発する、はじかれて我に返れば全身の苦痛で、腹這いになり、エビの如くに身をちぢめ、呼吸のかぎり唸りをひく。"
"115","sakaguchi","aoi_jutan.txt","夜が明けてくれ。"
"116","sakaguchi","aoi_jutan.txt","窓の下を誰か人が通ってくれ。"
"117","sakaguchi","aoi_jutan.txt","誰でもいい、誰か来てくれ。"
"118","sakaguchi","aoi_jutan.txt","希うことはそれ一つ。"
"119","sakaguchi","aoi_jutan.txt","借金取の訪れでもよかった。"
"120","sakaguchi","aoi_jutan.txt","戸が開く。"
"121","sakaguchi","aoi_jutan.txt","借金取の声がする。"
"122","sakaguchi","aoi_jutan.txt","アア助かった、嘘ではないのです、まったく恋人の訪れの如くイソイソと、とはいえ階段を一足降りるにもアルプスの崖をつまぐるていたらくで歯をくいしばり、四這いになって一足一足降りて行く。"
"123","sakaguchi","aoi_jutan.txt","ただなつかしさで一杯だから、借金取のふくれッ面に向い合うと親愛の微笑が自然に浮び、歌うように借金の言訳をのべたてることのたのしさ。"
"124","sakaguchi","aoi_jutan.txt","病中唯一の慰めはただそれだった。"
"125","sakaguchi","aoi_jutan.txt","けれども、電燈の集金人がイキリ立って、電燈をとめてしまうといきまきはじめた時には驚いた。"
"126","sakaguchi","aoi_jutan.txt","夜の光はイノチなのだ。"
"127","sakaguchi","aoi_jutan.txt","之を消されてどうして生きていられよう。"
"128","sakaguchi","aoi_jutan.txt","必死であった。"
"129","sakaguchi","aoi_jutan.txt","僕が払う。"
"130","sakaguchi","aoi_jutan.txt","何を売っても必ず払う。"
"131","sakaguchi","aoi_jutan.txt","一週間だけ待ってくれ、とはいえ全く集金人が憎くはない、彼が訪う人であるというばかりでなつかしさには変りがないから、必死に叫ぶ僕の声がやっぱり歌声の如くたのしかった。"
"132","sakaguchi","aoi_jutan.txt","借金取がひきあげ、戸が閉じ、跫音が去る。"
"133","sakaguchi","aoi_jutan.txt","はりつめた力がぬけて板の間へヘタヘタ倒れ、暫くはまったく意識がなくなってしまう。"
"134","sakaguchi","aoi_jutan.txt","電燈の集金人がともかく一応了解して引上げたあとでは、板の間の上に気を失って、僕は自然に泣いていた。"
"135","sakaguchi","aoi_jutan.txt","気がついたとき板の上に一握の涙がたまっていて、昔、涙で鼠を書いた絵描きの子僧がいたというが、僕の方は一の字をひっぱるだけの力もなかった。"
"136","sakaguchi","aoi_jutan.txt",""
"137","sakaguchi","aoi_jutan.txt","ともかく医者にかかってみようと決意して、このとき葛巻に電報を打った。"
"138","sakaguchi","aoi_jutan.txt","どういう風にして料金をつくり、どういう風に歩いて電報を打ったかという大事なことが全然記憶にないのである。"
"139","sakaguchi","aoi_jutan.txt","ところがこの返電が早かった。"
"140","sakaguchi","aoi_jutan.txt","待つ身のつらさというが、予期し得ぬ早さのうちに電報為替がとどいた時の喜びは忘れられぬ。"
"141","sakaguchi","aoi_jutan.txt","始め僕は葛巻から為替がとどいたとして、いったい郵便局まで歩くことができるだろうかということを甚だ不安に思っていた。"
"142","sakaguchi","aoi_jutan.txt","ところが電報為替がとどく。"
"143","sakaguchi","aoi_jutan.txt","そのよろこびの為ばかりで勇気は忽ち百千倍、郵便局まで歩くばかりか駈けだすことすら出来そうな起死回生の有様である。"
"144","sakaguchi","aoi_jutan.txt",""
"145","sakaguchi","aoi_jutan.txt","尚又一層馬鹿なことには、まったく馬鹿ゲタ話である。"
"146","sakaguchi","aoi_jutan.txt","為替を握って家をでる、十｜間ぐらい歩いたところで、坂口さん、僕を呼びとめる男に会った。"
"147","sakaguchi","aoi_jutan.txt","三宅勇蔵である。"
"148","sakaguchi","aoi_jutan.txt","この春大学を卒業し、京都のＪＯ撮影所の脚本部員となり、僕を訪ねてきたのであった。"
"149","sakaguchi","aoi_jutan.txt","窓下を通る人の跫音すらなつかしかった僕である。"
"150","sakaguchi","aoi_jutan.txt","友｜来る。"
"151","sakaguchi","aoi_jutan.txt","ああ友遠方より来る。"
"152","sakaguchi","aoi_jutan.txt","夢の如くであった。"
"153","sakaguchi","aoi_jutan.txt","酒を飲もう。"
"154","sakaguchi","aoi_jutan.txt","共に盃をあぐる日、かかる日の再びあるべきや。"
"155","sakaguchi","aoi_jutan.txt","酒をのんだ。"
"156","sakaguchi","aoi_jutan.txt","まことに不思議な酔い方をした。"
"157","sakaguchi","aoi_jutan.txt","全身に泥がしみわたり泥細工の濡れ人形に化したような奇怪な感覚がしみ通る。"
"158","sakaguchi","aoi_jutan.txt","泥酔の極に達し、一夜に医療費を飲みあげて意気高らかに家に帰り、あの怖るべき寝床に怖れ気もなくひっくり返り、電燈などが何じゃイと此奴もパチンと消してしまって悠々と眠り、目が覚めると、不思議不思議、一夜のうちに全く熱が去り、突然病気が治っていた。"
"159","sakaguchi","aoi_jutan.txt","微塵も嘘ではないのです。"
"160","sakaguchi","aoi_jutan.txt","即ち、一夜のうちに腫物が破れ、自然に膿が流れでたのだ。"
"161","sakaguchi","aoi_jutan.txt","尤もその後の五ヶ月ほど膿がとまらなかったけれども、痛みはこの日を境にして拭い去られてしまったのだ。"
"162","sakaguchi","aoi_jutan.txt",""
"163","sakaguchi","aoi_jutan.txt","万事偶然の成行だったが、然し、極めて理想的に病気を退治たということが出来る。"
"164","sakaguchi","aoi_jutan.txt","なぜなら、後日、三好達治の背中に拳に余る傷跡を見たからで、彼も同じく腫物を病み、手術をした。"
"165","sakaguchi","aoi_jutan.txt","手術の途中に気絶したということで、手術後の半年間苦しんだ。"
