"","auth","piece","line"
"137","sakaguchi","dekadan_bungaku_ron.txt","人間が好むものを欲しもとめ、男が好きな女を口説くことは自然であり、当然ではないか。"
"138","sakaguchi","dekadan_bungaku_ron.txt","それに対してイエスとノーのハッキリした自覚があればそれで良い。"
"139","sakaguchi","dekadan_bungaku_ron.txt","この自覚が確立せられず、自分の好悪、イエスとノーもハッキリ言えないような子供の育て方の不健全さというものは言語道断だ。"
"140","sakaguchi","dekadan_bungaku_ron.txt",""
"141","sakaguchi","dekadan_bungaku_ron.txt","処女の純潔などというけれども、一向に実用的なものではないので、失敗は成功の母と言い、失敗は進歩の階段であるから、処女を失うぐらい必ずしも咎むべきではなかろう。"
"142","sakaguchi","dekadan_bungaku_ron.txt","純潔を失うなどと云って、ひどい堕落のように思いこませるから罪悪感によって本格的に堕落の路を辿るようになるので、これを進歩の段階と見、より良きものを求める為の尊い捨石であるような考え方生き方を与える方が本当だ。"
"143","sakaguchi","dekadan_bungaku_ron.txt","より良きものへの希求が人間に高さと品位を与えるのだ。"
"144","sakaguchi","dekadan_bungaku_ron.txt","単なる処女の如き何物でもないではないか。"
"145","sakaguchi","dekadan_bungaku_ron.txt","尤も無理にすて去る必要はない。"
"146","sakaguchi","dekadan_bungaku_ron.txt","要は、魂の純潔が必要なだけである。"
"147","sakaguchi","dekadan_bungaku_ron.txt",""
"148","sakaguchi","dekadan_bungaku_ron.txt","失敗せざる魂、苦悩せざる魂、そしてより良きものを求めざる魂に真実の魅力はすくない。"
"149","sakaguchi","dekadan_bungaku_ron.txt","日本の家庭というものは、魂を昏酔させる不健康な寝床で、純潔と不変という意外千万な大看板をかかげて、男と女が下落し得る最低位まで下落してそれが他人でない証拠なのだと思っている。"
"150","sakaguchi","dekadan_bungaku_ron.txt","家庭が娼婦の世界によって簡単に破壊せられるのは当然で、娼婦の世界の健康さと、家庭の不健康さに就て、人間性に根ざした究明が又文学の変らざる問題の一つが常にこのことに向って行われる必要があった筈だと私は思う。"
"151","sakaguchi","dekadan_bungaku_ron.txt","娼婦の世界に単純明快な真理がある。"
"152","sakaguchi","dekadan_bungaku_ron.txt","男と女の真実の生活があるのである。"
"153","sakaguchi","dekadan_bungaku_ron.txt","だましあい、より美しくより愛らしく見せようとし、実質的に自分の魅力のなかで相手を生活させようとする。"
"154","sakaguchi","dekadan_bungaku_ron.txt",""
"155","sakaguchi","dekadan_bungaku_ron.txt","別な女に、別な男に、いつ愛情がうつるかも知れぬという事の中には人間自体の発育があり、その関係は元来健康な筈なのである。"
"156","sakaguchi","dekadan_bungaku_ron.txt","然しなるべく永遠であろうとすることも同じように健康だ。"
"157","sakaguchi","dekadan_bungaku_ron.txt","そして男女の価値の上に、肉体から精神へ、又、精神から肉体へ価値の変化や進化が起る。"
"158","sakaguchi","dekadan_bungaku_ron.txt","価値の発見も行われる。"
"159","sakaguchi","dekadan_bungaku_ron.txt","そして生活自体が発見されているのである。"
"160","sakaguchi","dekadan_bungaku_ron.txt",""
"161","sakaguchi","dekadan_bungaku_ron.txt","問題は単に「家庭」ではなしに、人間の自覚で、日本の家庭はその本質に於て人間が欠けており、生殖生活と巣を営む本能が基礎になっているだけだ。"
"162","sakaguchi","dekadan_bungaku_ron.txt","そして日本の生活感情の主要な多くは、この家庭生活の陰鬱さを正義化するために無数のタブーをつくっており、それが又｜思惟や思想の根元となって、サビだの幽玄だの人間よりも風景を愛し、庭や草花を愛させる。"
"163","sakaguchi","dekadan_bungaku_ron.txt","けれども、そういう思想が贋物にすぎないことは彼等自身が常に風景を裏切っており、日本三景などというが、私は天の橋立というところへ行ったが、遊覧客の主要な目的はミヤジマの遊びであったし、伊勢大神宮参拝の講中が狙っているのも遊び場で、伊勢の遊び場は日本に於て最も淫靡な遊び場である。"
"164","sakaguchi","dekadan_bungaku_ron.txt","尤も日本の家庭が下等愚劣なものであると同様に、これらの遊び場にもただ女の下等な肉体がころがっているにすぎないのである。"
"165","sakaguchi","dekadan_bungaku_ron.txt",""
"166","sakaguchi","dekadan_bungaku_ron.txt","夏目漱石という人は、彼のあらゆる知と理を傾けて、こういう家庭の陰鬱さを合理化しようと不思議な努力をした人で、そして彼はただ一つ、その本来の不合理を疑ることを忘れていた。"
"167","sakaguchi","dekadan_bungaku_ron.txt","つまり彼は人間を忘れていたのである。"
"168","sakaguchi","dekadan_bungaku_ron.txt","かゆい所に手がとどくとは漱石の知と理のことで、よくもまアこんなことまで一々気がつくものだと思うばかり、家庭の封建的習性というもののあらゆる枝葉末節のつながりへ万べんなく思惟がのびて行く。"
"169","sakaguchi","dekadan_bungaku_ron.txt","だが習性の中にも在る筈の肉体などは一顧も与えられておらず、何よりも、本来の人間の自由な本姿が不問に附されているのである。"
"170","sakaguchi","dekadan_bungaku_ron.txt","人間本来の欲求などは始めから彼の文学の問題ではなかった。"
"171","sakaguchi","dekadan_bungaku_ron.txt","彼の作中人物は学生時代のつまらぬことに自責して、二、三十年後になって自殺する。"
"172","sakaguchi","dekadan_bungaku_ron.txt","奇想天外なことをやる。"
"173","sakaguchi","dekadan_bungaku_ron.txt","そのくせ彼の大概の小説の人物は家庭的習性というものにギリギリのところまで追いつめられているけれども、離婚しようという実質的な生活の生長について考えを起した者すらないのである。"
"174","sakaguchi","dekadan_bungaku_ron.txt","彼の知と理は奇妙な習性の中で合理化という遊戯にふけっているだけで、真実の人間、自我の探求というものは行われていない。"
"175","sakaguchi","dekadan_bungaku_ron.txt","自殺などというものは悔恨の手段としてはナンセンスで、三文の値打もないものだ。"
"176","sakaguchi","dekadan_bungaku_ron.txt","より良く生きぬくために現実の習性的道徳からふみ外れる方が遥かに誠実なものであるのに、彼は自殺という不誠実なものを誠意あるものと思い、離婚という誠意ある行為を不誠実と思い、このナンセンスな錯覚を全然疑ることがなかった。"
"177","sakaguchi","dekadan_bungaku_ron.txt","そして悩んで禅の門を叩く。"
"178","sakaguchi","dekadan_bungaku_ron.txt","別に悟りらしいものもないので、そんなら仕方がないと諦める。"
"179","sakaguchi","dekadan_bungaku_ron.txt","物それ自体の実質に就てギリギリのところまで突きとめはせず、宗教の方へでかけて、そっちに悟りがないというので、物それ自体の方も諦めるのである。"
"180","sakaguchi","dekadan_bungaku_ron.txt","こういう馬鹿げたことが悩む人間の誠実な態度だと考えて疑ることがないのである。"
"181","sakaguchi","dekadan_bungaku_ron.txt","日本一般の生活態度が元来こういうフザけたもので、漱石はただその中で衒学的な形ばかりの知と理を働かせてかゆいところを掻いてみただけで、自我の誠実な追求はなかった。"
"182","sakaguchi","dekadan_bungaku_ron.txt",""
"183","sakaguchi","dekadan_bungaku_ron.txt","元より人間は思い通りに生活できるものではない。"
"184","sakaguchi","dekadan_bungaku_ron.txt","愛する人には愛されず、欲する物は我が手に入らず、手の中の玉は逃げだし、希望の多くは仇夢で、人間の現実は概ねかくの如き卑小きわまるものである。"
"185","sakaguchi","dekadan_bungaku_ron.txt","けれども、ともかく、希求の実現に努力するところに人間の生活があるのであり、夢は常にくずれるけれども、諦めや慟哭は、くずれ行く夢自体の事実の上に在り得るので、思惟として独立に存するものではない。"
"186","sakaguchi","dekadan_bungaku_ron.txt","人間は先ず何よりも生活しなければならないもので、生活自体が考えるとき、始めて思想に肉体が宿る。"
"187","sakaguchi","dekadan_bungaku_ron.txt","生活自体が考えて、常に新たな発見と、それ自体の展開をもたらしてくれる。"
"188","sakaguchi","dekadan_bungaku_ron.txt","この誠実な苦悩と展開が常識的に悪であり堕落であっても、それを意とするには及ばない。"
"189","sakaguchi","dekadan_bungaku_ron.txt",""
"190","sakaguchi","dekadan_bungaku_ron.txt","私はデカダンス自体を文学の目的とするものではない。"
"191","sakaguchi","dekadan_bungaku_ron.txt","私はただ人間、そして人間性というものの必然の生き方をもとめ、自我自らを欺くことなく生きたい、というだけである。"
"192","sakaguchi","dekadan_bungaku_ron.txt","私が憎むのは「健全なる」現実の贋道徳で、そこから誠実なる堕落を怖れないことが必要であり、人間自体の偽らざる欲求に復帰することが必要だというだけである。"
"193","sakaguchi","dekadan_bungaku_ron.txt","人間は諸々の欲望と共に正義への欲望がある。"
"194","sakaguchi","dekadan_bungaku_ron.txt","私はそれを信じ得るだけで、その欲望の必然的な展開に就ては全く予測することができない。"
"195","sakaguchi","dekadan_bungaku_ron.txt",""
"196","sakaguchi","dekadan_bungaku_ron.txt","日本文学は風景の美にあこがれる。"
"197","sakaguchi","dekadan_bungaku_ron.txt","然し、人間にとって、人間ほど美しいものがある筈はなく、人間にとっては人間が全部のものだ。"
"198","sakaguchi","dekadan_bungaku_ron.txt","そして、人間の美は肉体の美で、キモノだの装飾品の美ではない。"
"199","sakaguchi","dekadan_bungaku_ron.txt","人間の肉体には精神が宿り、本能が宿り、この肉体と精神が織りだす独得の絢は、一般的な解説によって理解し得るものではなく、常に各人各様の発見が行われる永遠に独自なる世界である。"
"200","sakaguchi","dekadan_bungaku_ron.txt","これを個性と云い、そして生活は個性によるものであり、元来独自なものである。"
"201","sakaguchi","dekadan_bungaku_ron.txt","一般的な生活はあり得ない。"
"202","sakaguchi","dekadan_bungaku_ron.txt","めいめいが各自の独自なそして誠実な生活をもとめることが人生の目的でなくて、他の何物が人生の目的だろうか。"
"203","sakaguchi","dekadan_bungaku_ron.txt",""
"204","sakaguchi","dekadan_bungaku_ron.txt","私はただ、私自身として、生きたいだけだ。"
"205","sakaguchi","dekadan_bungaku_ron.txt",""
"206","sakaguchi","dekadan_bungaku_ron.txt","私は風景の中で安息したいとは思わない。"
"207","sakaguchi","dekadan_bungaku_ron.txt","又、安息し得ない人間である。"
"208","sakaguchi","dekadan_bungaku_ron.txt","私はただ人間を愛す。"
"209","sakaguchi","dekadan_bungaku_ron.txt","私を愛す。"
"210","sakaguchi","dekadan_bungaku_ron.txt","私の愛するものを愛す。"
"211","sakaguchi","dekadan_bungaku_ron.txt","徹頭徹尾、愛す。"
"212","sakaguchi","dekadan_bungaku_ron.txt","そして、私は私自身を発見しなければならないように、私の愛するものを発見しなければならないので、私は堕ちつづけ、そして、私は書きつづけるであろう。"
"213","sakaguchi","dekadan_bungaku_ron.txt","神よ。"
"214","sakaguchi","dekadan_bungaku_ron.txt","わが青春を愛する心の死に至るまで衰えざらんことを。"
"215","sakaguchi","dekadan_bungaku_ron.txt",""
"216","sakaguchi","dekadan_bungaku_ron.txt",""
"217","sakaguchi","dekadan_bungaku_ron.txt",""
"218","sakaguchi","dekadan_bungaku_ron.txt",""
"219","sakaguchi","dekadan_bungaku_ron.txt","底本：「堕落論・日本文化私観他二十二篇」岩波文庫、岩波書店"
"220","sakaguchi","dekadan_bungaku_ron.txt","2008（平成20）年9月17日第1刷発行"
"221","sakaguchi","dekadan_bungaku_ron.txt","2013（平成25）年4月5日第6刷発行"
"222","sakaguchi","dekadan_bungaku_ron.txt","底本の親本：「坂口安吾全集04」筑摩書房"
"223","sakaguchi","dekadan_bungaku_ron.txt","1998（平成10）年5月22日"
"224","sakaguchi","dekadan_bungaku_ron.txt","初出：「新潮第四三巻第一〇号」"
"225","sakaguchi","dekadan_bungaku_ron.txt","1946（昭和21）年10月1日"
"226","sakaguchi","dekadan_bungaku_ron.txt","入力：Nana ohbe"
"227","sakaguchi","dekadan_bungaku_ron.txt","校正：酒井裕二"
"228","sakaguchi","dekadan_bungaku_ron.txt","2015年12月13日作成"
"229","sakaguchi","dekadan_bungaku_ron.txt","青空文庫作成ファイル："
"230","sakaguchi","dekadan_bungaku_ron.txt","このファイルは、インターネットの図書館、青空文庫（http://www.aozora.gr.jp/）で作られました。"
"231","sakaguchi","dekadan_bungaku_ron.txt","入力、校正、制作にあたったのは、ボランティアの皆さんです。"
"232","sakaguchi","dekadan_bungaku_ron.txt",""
