"","auth","piece","line"
"0","sakaguchi","dekadan_bungaku_ron.txt","デカダン文学論"
"1","sakaguchi","dekadan_bungaku_ron.txt","坂口安吾"
"2","sakaguchi","dekadan_bungaku_ron.txt",""
"3","sakaguchi","dekadan_bungaku_ron.txt","-------------------------------------------------------"
"4","sakaguchi","dekadan_bungaku_ron.txt","【テキスト中に現れる記号について】"
"5","sakaguchi","dekadan_bungaku_ron.txt",""
"6","sakaguchi","dekadan_bungaku_ron.txt","《》：ルビ"
"7","sakaguchi","dekadan_bungaku_ron.txt","（例）活花"
"8","sakaguchi","dekadan_bungaku_ron.txt",""
"9","sakaguchi","dekadan_bungaku_ron.txt","｜：ルビの付く文字列の始まりを特定する記号"
"10","sakaguchi","dekadan_bungaku_ron.txt","（例）奇妙｜奇天烈"
"11","sakaguchi","dekadan_bungaku_ron.txt","-------------------------------------------------------"
"12","sakaguchi","dekadan_bungaku_ron.txt",""
"13","sakaguchi","dekadan_bungaku_ron.txt","極意だの免許皆伝などというのは茶とか活花とか忍術とか剣術の話かと思っていたら、関孝和の算術などでも斎戒沐浴して血判を捺し自分の子供と二人の弟子以外には伝えないなどとやっている。"
"14","sakaguchi","dekadan_bungaku_ron.txt","尤も西洋でも昔は最高の数理を秘伝視して門外不出の例はあるそうだが、日本は特別で、なんでも極意書ときて次に斎戒沐浴、曰く言い難しとくる。"
"15","sakaguchi","dekadan_bungaku_ron.txt","私はタバコが配給になって生れて始めてキザミを吸ったが、昔の人間だって三服四服はつづけさまに吸った筈で、さすればガン首の大きいパイプを発明するのが当然の筈であるのに、そういう便利な実質的な進歩発明という算段は浮かばずに、タバコは一服吸ってポンと叩くところがよいなどというフザけた通が生れ育ち、現実に停止して進化が失われ、その停止を弄んでフザけた通や極意や奥義書が生れて、実質的な進歩、ガン首を大きくしろというような当然な欲求は下品なもの、通ならざる俗なものと考えられてしまうのである。"
"16","sakaguchi","dekadan_bungaku_ron.txt","キセルの羅宇は仏印ラオス産の竹、羅宇竹から来た名であるが、キセルは羅宇竹に限るなどと称して通は益々実質を離れて枝葉に走る。"
"17","sakaguchi","dekadan_bungaku_ron.txt","フォークをひっくりかえして無理にむつかしく御飯をのせて変てこな手つきで口へ運んで、それが礼儀上品なるものと考えられて疑られもしない奇妙｜奇天烈な日本であった。"
"18","sakaguchi","dekadan_bungaku_ron.txt","実質的な便利な欲求を下品と見る考えは随所に様々な形でひそんでいるのである。"
"19","sakaguchi","dekadan_bungaku_ron.txt",""
"20","sakaguchi","dekadan_bungaku_ron.txt","この歪められた妖怪的な日本的思考法の結び目に当る伏魔殿が家庭感情という奴で、日本式建築や生活様式に規定された種々雑多な歪みはとにかくとして、平野謙などという良く考える批評家まで、特攻隊は女房があっては出来ないね、などとフザけたことを鵜呑みにして疑ることすらないのである。"
"21","sakaguchi","dekadan_bungaku_ron.txt","女房と女と、どこが違うのだろう。"
"22","sakaguchi","dekadan_bungaku_ron.txt","女房と愛する人と、どこに違いがあるというのか。"
"23","sakaguchi","dekadan_bungaku_ron.txt","誰か愛する人なき者ありや。"
"24","sakaguchi","dekadan_bungaku_ron.txt","鐘の音がボーンと鳴ってその余韻の中に千万無量の思いがこもっていたり、その音に耳をすまして二十秒ばかりで浮世の垢を流したり、海苔の裏だか表だかのどっちか側から一方的にあぶらないと味がどうだとか、フザけたことにかかずらって何百何千語の註釈をつけたり、果ては奥義書や秘伝を書くのが日本的思考の在り方で、近頃は女房の眉を落させたりオハグロをぬらせることは無くなったが、刺青と大して異ならないかかる野蛮な風習でもそれが今日残存して現実の風習であるなら、それを疑るよりも、奥義書を書いて無理矢理に美を見出し、疑る者を俗なる者、野卑にして素朴なる者ときめつけるのが日本であった。"
"25","sakaguchi","dekadan_bungaku_ron.txt","女房のオハグロは無くなったが、オハグロ的マジナイは女房の全身、全心、魂の奥底にまで絡みついて生きており、それが先ず日本の幽霊の親分で、平野謙のように私などよりも考える時間が余程多いらしい人ですら、人間の姿を諸々の幽霊から本当に絶縁しようという大事な根本的な態度を忘れ、多くは枝葉に就て考える時間が多いのではないかと思う。"
"26","sakaguchi","dekadan_bungaku_ron.txt","彼は人の小説を厭になるほどたくさん読むが、僕が三行読んで投げ出すものを彼は三千万語の終りまで無理に読み、無理に幽霊をでっちあげ、そして自分の本当の心と真に争う、自分の幽霊と命を賭しても争うという大事なたった一つのことが忘れられているのだ。"
"27","sakaguchi","dekadan_bungaku_ron.txt",""
"28","sakaguchi","dekadan_bungaku_ron.txt","日本的家庭感情の奇怪な歪みは浮世に於ては人情義理という怪物となり、離俗の世界に於てはサビだの幽玄だのモノノアワレなどという神秘の扉の奥に隠れて曰く言い難きものとなる。"
"29","sakaguchi","dekadan_bungaku_ron.txt","ポンと両手を打ち鳴らして、右が鳴ったか左が鳴ったかなどと云って、人生の大真理がそんな所に転がっていると思い、大将軍大政治家大富豪ともならん者はそういう悟りをひらかなければならないなどと、こういうフザけたことが日本文化の第一線に堂々通用しているのである。"
"30","sakaguchi","dekadan_bungaku_ron.txt","西洋流の学問をして実証精神の型が分るとこういう一見フザけたことはすぐ気がつくが、つけ焼刃で、根柢的に日本の幽霊を退治したわけではなく、むしろ年と共に反動的な大幽霊と自ら化して、サビだの幽玄だの益々執念を深めてしまう。"
"31","sakaguchi","dekadan_bungaku_ron.txt","学問の型を形の如くに勉強するが、自分自身というものに就て真実突きとめて生きなければならないという唯一のものが欠けているのだ。"
"32","sakaguchi","dekadan_bungaku_ron.txt",""
"33","sakaguchi","dekadan_bungaku_ron.txt","毎々平野謙を引合いにして恐縮だが、先頃彼の労作二百余枚の「島崎藤村の『新生』に就て」を読んだからで、他の批評家先生は駄文ばかりで、いかさま私が馬鹿げたヒマ人でも駄文を相手にするわけには行かない。"
"34","sakaguchi","dekadan_bungaku_ron.txt",""
"35","sakaguchi","dekadan_bungaku_ron.txt","「新生」の中で主人公が自分の手をためつすかしつ眺めて、この手だな、とか思い入れよろしくわが身の罪の深さを思うところが人生の深処にふれているとか、鬼気せまるものがあるとか、平野君、フザけたもうな。"
"36","sakaguchi","dekadan_bungaku_ron.txt","人生の深処がそんなアンドンの灯の翳みたいなボヤけたところにころがっていて、たまるものか。"
"37","sakaguchi","dekadan_bungaku_ron.txt","そんなところは藤村の人を甘く見たゴマ化し技法で、一番よくないところだ。"
"38","sakaguchi","dekadan_bungaku_ron.txt","むしろ最も軽蔑すべきところである。"
"39","sakaguchi","dekadan_bungaku_ron.txt","こんな風に書けば人が感心してくれると思って書いたに相違ないところで、第一、平野君、自分の手をつくづく眺めてわが身の罪の深さを考える、具体的事実として、それが一体、何物です。"
"40","sakaguchi","dekadan_bungaku_ron.txt",""
"41","sakaguchi","dekadan_bungaku_ron.txt","自分の罪を考える、それが文学の中で本当の意味を持つのは、具体的な行為として倫理的に発展して表われるところにあるので、手をひっくり返して眺めて鬼気迫るなどとは、ボーンという千万無量の鐘の思いと同じこと、海苔をひっくり返して焼いて、味がどうだというような日本の幽霊の一匹にすぎないのである。"
"42","sakaguchi","dekadan_bungaku_ron.txt",""
"43","sakaguchi","dekadan_bungaku_ron.txt","島崎藤村は誠実な作家だというけれども、実際は大いに不誠実な作家で、それは藤村自身と彼の文章（小説）との距離というものを見れば分る。"
"44","sakaguchi","dekadan_bungaku_ron.txt","藤村と小説とは距りがあって、彼の分りにくい文章というものはこの距離をごまかすための小手先の悪戦苦闘で魂の悪戦苦闘というものではない。"
"45","sakaguchi","dekadan_bungaku_ron.txt",""
"46","sakaguchi","dekadan_bungaku_ron.txt","これと全く同じ意味の空虚な悪戦苦闘をしている人に横光利一があり、彼の文学的｜懊悩だの知性だのというものは、距離をごまかす苦悩であり、もしくは距離の空虚が描きだす幻影的自我の苦悩であって、彼には小説と重なり合った自我がなく、従って真実の自我の血肉のこもった苦悩がない。"
"47","sakaguchi","dekadan_bungaku_ron.txt",""
"48","sakaguchi","dekadan_bungaku_ron.txt","このように、作家と作品に距離があるということは、その作家が処世的に如何ほど糞マジメで謹厳誠実であっても、根柢的に魂の不誠実を意味している。"
"49","sakaguchi","dekadan_bungaku_ron.txt","作家と作品との間に内容的には空白な夾雑物があって、その空白な夾雑物が思考し、作品をあやつり、あまつさえ作家自体、人間すらもあやつっているのだ。"
"50","sakaguchi","dekadan_bungaku_ron.txt","平野謙にはこの距離が分らぬばかりでなく、この距離自体が思考する最も軽薄なヤリクリ算段が外形的に深刻｜真摯であるのを、文学の深さだとか、人間の複雑さだとか、藤村文学の貴族性だとか、又は悲痛なる弱さだとか、たとえばそのように考えているのである。"
"51","sakaguchi","dekadan_bungaku_ron.txt",""
"52","sakaguchi","dekadan_bungaku_ron.txt","藤村は世間的処世に於ては糞マジメな人であったが、文学的には不誠実な人であった。"
"53","sakaguchi","dekadan_bungaku_ron.txt","したがって彼の誠実謹厳な生活自体が不健全、不道徳、贋物であったと私は思う。"
"54","sakaguchi","dekadan_bungaku_ron.txt",""
"55","sakaguchi","dekadan_bungaku_ron.txt","彼は世間を怖れていたが、文学を甘くみくびっていた。"
"56","sakaguchi","dekadan_bungaku_ron.txt","そして彼は処世的なマジメさによって、真実の文学的懊悩、人間的懊悩を文章的に処理しようとし、処理し得るものとタカをくくっていた。"
"57","sakaguchi","dekadan_bungaku_ron.txt","したがって彼は真実の人間的懊悩を真に悩み又は突きとめようとはせずに、ただ処世の便法によって処理し、終生自らの肉体的な論理によって真実を探求する真の自己破壊というものを凡そ影すらも行いはしなかった。"
"58","sakaguchi","dekadan_bungaku_ron.txt",""
"59","sakaguchi","dekadan_bungaku_ron.txt","距離とは、人間と作品の間につまるこの空白をさすのであり、肉体的な論理によって血肉の真実が突きとめられ語られていないことを意味している。"
"60","sakaguchi","dekadan_bungaku_ron.txt","こう書けば、こう読み、こう感心するだろうぐらいに、批評家先生などは最も舐められていたのである。"
"61","sakaguchi","dekadan_bungaku_ron.txt","批評家をだますぐらいわけのないことはない。"
"62","sakaguchi","dekadan_bungaku_ron.txt","批評家は作家と作品の間の距離などは分らず、当人自身の書くものが距離だらけで、距離をごまかすためのヤリクリが文学のむつかしい所だぐらいに考えており、藤村ほどの不器用な人でも批評家とはケタの違う年期のはいった筆力があるから、批評家をごまかすぐらいはわけがない。"
"63","sakaguchi","dekadan_bungaku_ron.txt","問題は如何に生くべきか、であり、然して如何に真実に生きているか、文章に隠すべからざる距離によって作家は秘密の真相を常に暴露しているのである。"
"64","sakaguchi","dekadan_bungaku_ron.txt",""
"65","sakaguchi","dekadan_bungaku_ron.txt",""
"66","sakaguchi","dekadan_bungaku_ron.txt","★"
"67","sakaguchi","dekadan_bungaku_ron.txt",""
"68","sakaguchi","dekadan_bungaku_ron.txt","藤村も横光利一も糞マジメで凡そ誠実に生き、かりそめにも遊んでいないような生活態度に見受けられる。"
"69","sakaguchi","dekadan_bungaku_ron.txt","世間的、又、態度的には遊んでいないが、文学的には全く遊んでいるのである。"
"70","sakaguchi","dekadan_bungaku_ron.txt",""
"71","sakaguchi","dekadan_bungaku_ron.txt","文学的に遊んでいる、とは、彼等にとって倫理は自ら行うことではなく、論理的に弄ばれているにすぎないということで、要するに彼等はある型によって思考しており、肉体的な論理によって思考してはいないことを意味している。"
"72","sakaguchi","dekadan_bungaku_ron.txt","彼等の論理の主点はそれ自らの合理性ということで、理論自体が自己破壊を行うことも、盲目的な自己展開を行うことも有り得ないのである。"
"73","sakaguchi","dekadan_bungaku_ron.txt",""
"74","sakaguchi","dekadan_bungaku_ron.txt","かかる論理の定型性というものは、一般世間の道徳とか正しい生活などと称せられるものの基本をなす贋物の生命力であって、すべて世の謹厳なる道徳家だの健全なる思想家などというものは例外なしに贋物と信じて差支えはない。"
"75","sakaguchi","dekadan_bungaku_ron.txt","本当の倫理は健全ではないものだ。"
"76","sakaguchi","dekadan_bungaku_ron.txt","そこには必ず倫理自体の自己破壊が行われており、現実に対する反逆が精神の基調をなしているからである。"
"77","sakaguchi","dekadan_bungaku_ron.txt",""
"78","sakaguchi","dekadan_bungaku_ron.txt","藤村の「新生」の問題、叔父と姪との関係は問題自体は不健全だが、小説自体は馬鹿馬鹿しく健全だ。"
"79","sakaguchi","dekadan_bungaku_ron.txt","この健全とは合理的だということで、自己破壊がなく、肉体的な論理の思考がない代りに、型の論理が巧みに健康に思考しているという意味なのである。"
"80","sakaguchi","dekadan_bungaku_ron.txt",""
"81","sakaguchi","dekadan_bungaku_ron.txt","藤村が真実怖れ悩んでいることは小説には表われていない。"
"82","sakaguchi","dekadan_bungaku_ron.txt","それに又、彼が真実怖れ悩んでいることは決して文学自体の自己探求による悩みではなく、単に世間ということであり、対世間、対名誉、それだけの「健康」なものだった。"
"83","sakaguchi","dekadan_bungaku_ron.txt","彼はちょうど、例えば全軍の先頭に死なざるを得なかった将軍の場合と同じように（この将軍が本当は死を怖れていることは敗戦後我々は多すぎる実例を見せられてきた）藤村も勇をふるって己れと姪との関係を新聞に発表した。"
"84","sakaguchi","dekadan_bungaku_ron.txt","けれども将軍の遺書が尽忠報国の架空の美文でうめられていると同様に、彼の小説は型の論理で距離の空白をうめているにすぎない。"
"85","sakaguchi","dekadan_bungaku_ron.txt",""
"86","sakaguchi","dekadan_bungaku_ron.txt","何故彼は「新生」を書いたか。"
"87","sakaguchi","dekadan_bungaku_ron.txt","新らしい生の発見探求のためであるには余りにも距離がひどすぎる。"
"88","sakaguchi","dekadan_bungaku_ron.txt","彼はそれを意識していなかったかも知れぬ。"
"89","sakaguchi","dekadan_bungaku_ron.txt","そして彼は自分では真実「新生」の発見探求を賭けているつもりであったかも知れないのだが、如何せん、彼の態度は彼自身をすらあざむいており、彼が最も多く争ったのは文学のための欲求ではなく、彼は名誉と争い、彼自らをも世間と同時にあざむくために文学を利用したのだと私は思う。"
"90","sakaguchi","dekadan_bungaku_ron.txt","私がこれを語っているのではなく、「新生」の文章の距離自体がこれを語っているのである。"
"91","sakaguchi","dekadan_bungaku_ron.txt","彼は告白することによって苦悩が軽減し得ると信じ、苦悩を軽減し得る自己救済の文章を工夫した。"
"92","sakaguchi","dekadan_bungaku_ron.txt","作中の自己を苦しめる場合でも、自分を助ける手段でしかなかった。"
"93","sakaguchi","dekadan_bungaku_ron.txt","彼は真に我が生き方の何物なりやを求めていたのではなく、ただ世間の道徳の型の中で、世間を相手に、ツジツマの合った空論を弄して大小説らしき外見の物を書いてみせただけである。"
"94","sakaguchi","dekadan_bungaku_ron.txt","これも彼の文章の距離自体が語っているのである。"
"95","sakaguchi","dekadan_bungaku_ron.txt",""
"96","sakaguchi","dekadan_bungaku_ron.txt","彼がどうして姪という肉親の小娘と情慾を結ぶに至るかというと、彼みたいに心にもない取澄し方をしていると、知らない女の人を口説く手掛りがつかめなくなる。"
"97","sakaguchi","dekadan_bungaku_ron.txt","彼が取澄せば女の方はよけい取澄して応じるものであるから、彼は自分のポーズを突きぬけて失敗するかも知れぬ口説にのりだすだけの勇気がないのだ。"
"98","sakaguchi","dekadan_bungaku_ron.txt","肉親の女にはその障壁がないので、藤村はポーズを崩す怖れなしにかなり自由に又自然にポーズから情慾へ移行することが出来易かったのだと思う。"
"99","sakaguchi","dekadan_bungaku_ron.txt",""
"100","sakaguchi","dekadan_bungaku_ron.txt","彼は姪と関係してその処理に苦しむことよりも、ポーズを破って知らない女を口説く方がもっと出来にくかったのだ。"
"101","sakaguchi","dekadan_bungaku_ron.txt","それほども彼はポーズに憑かれており、彼は外形的に如何にも新らしい道徳を探しもとめているようでいながら、芸者を芸者とよばないで何だか妙な言い方で呼んでいるというだけの、全く外形的な、内実ではより多くの例の「健全なる」道徳に呪縛せられて、自我の本性をポーズの奥に突きとめようとする欲求の片鱗すらも感じてはいない。"
"102","sakaguchi","dekadan_bungaku_ron.txt","真実愛する女をなぜ口説くことが出来ないのか。"
"103","sakaguchi","dekadan_bungaku_ron.txt","姪と関係を結んで心ならずも身にふりかかった処世的な苦悩に対して死物ぐるいで処理始末のできる執拗な男でいながら、身にふりかかった苦悩には執拗に堪え抵抗し得ても、自らの本当に欲する本心を見定めて苦悩にとびこみ、自己破壊を行うという健全なる魂、執拗なる自己探求というものはなかったのである。"
"104","sakaguchi","dekadan_bungaku_ron.txt",""
"105","sakaguchi","dekadan_bungaku_ron.txt","彼は現世に縛られ、通用の倫理に縛られ、現世的に堕落ができなかった。"
"106","sakaguchi","dekadan_bungaku_ron.txt","文学の本来の道である自己破壊、通用の倫理に対する反逆は、彼にとっては堕落であった。"
"107","sakaguchi","dekadan_bungaku_ron.txt","私は然し彼が真実欲する女を口説き得ず姪と関係を結ぶに至ったことを非難しているのではない。"
"108","sakaguchi","dekadan_bungaku_ron.txt","人各々の個性による如何なる生き方も在りうるので、真実愛する人を口説き得ぬのも仕方がないが、なぜ藤村が自らの小さな真実の秘密を自覚せず、その悲劇を書き得ずに、空虚な大小説を書いたかを咎めているだけのことである。"
"109","sakaguchi","dekadan_bungaku_ron.txt","芥川が彼を評して老獪と言ったのは当然で、彼の道徳性、謹厳誠実な生き方は、文学の世界に於ては欺瞞であるにすぎない。"
"110","sakaguchi","dekadan_bungaku_ron.txt",""
"111","sakaguchi","dekadan_bungaku_ron.txt","藤村は人生と四ツに組んでいるとか、最も大きな問題に取組んでいるとか、欺瞞にみちた魂が何者と四ツに組んでも、それはただ常に贋物であるにすぎない。"
"112","sakaguchi","dekadan_bungaku_ron.txt","バルザックが大文学でモオパッサンが小文学だという作品の大小論はフザけた話である。"
"113","sakaguchi","dekadan_bungaku_ron.txt","藤村は文学を甘く見ていたから、こういう空虚軽薄な形だけの大長篇をオカユをすすって書いていられたので、贋物には楽天性というものはない。"
"114","sakaguchi","dekadan_bungaku_ron.txt","常にホンモノよりも深刻でマジメな顔をしているものなのである。"
"115","sakaguchi","dekadan_bungaku_ron.txt","いつか銀座裏の酒場に坂口安吾のニセモノが女を口説いて成功して、他日無能なるホンモノが現れたところ、女共は疑わしげに私を眺めて、あなたがホンモノなのかしら。"
"116","sakaguchi","dekadan_bungaku_ron.txt","ニセモノはもっとマジメな深刻な人だったわよ、と言った。"
"117","sakaguchi","dekadan_bungaku_ron.txt",""
"118","sakaguchi","dekadan_bungaku_ron.txt",""
"119","sakaguchi","dekadan_bungaku_ron.txt","★"
"120","sakaguchi","dekadan_bungaku_ron.txt",""
"121","sakaguchi","dekadan_bungaku_ron.txt","私は世のいわゆる健全なる美徳、清貧だの倹約の精神だの、困苦欠乏に耐える美徳だの、謙譲の美徳などというものはみんな嫌いで、美徳ではなく、悪徳だと思っている。"
"122","sakaguchi","dekadan_bungaku_ron.txt",""
"123","sakaguchi","dekadan_bungaku_ron.txt","困苦欠乏に耐える日本の兵隊が困苦欠乏に耐え得ぬアメリカの兵隊に負けたのは当然で、耐乏の美徳という日本精神自体が敗北したのである。"
"124","sakaguchi","dekadan_bungaku_ron.txt","人間は足があるからエレベーターでたった五階六階まで登るなどとは不健全であり堕落だという。"
"125","sakaguchi","dekadan_bungaku_ron.txt","機械にたよって肉体労働の美徳を忘れるのは堕落だという。"
"126","sakaguchi","dekadan_bungaku_ron.txt","こういうフザけた退化精神が日本の今日の見事な敗北をまねいたのである。"
"127","sakaguchi","dekadan_bungaku_ron.txt","こういう馬鹿げた精神が美徳だなどと疑られもしなかった日本は、どうしても敗け破れ破滅する必要があったのである。"
"128","sakaguchi","dekadan_bungaku_ron.txt",""
"129","sakaguchi","dekadan_bungaku_ron.txt","然り、働くことは常に美徳だ。"
"130","sakaguchi","dekadan_bungaku_ron.txt","できるだけ楽に便利に能率的に働くことが必要なだけだ。"
"131","sakaguchi","dekadan_bungaku_ron.txt","ガン首の大きなパイプを発明するだけの実質的な便利な進化を考え得ず、一服吸ってポンと叩く心境のサビだの美だのと下らぬことに奥義書を書いていた日本の精神はどうしても破滅する必要があったのだ。"
"132","sakaguchi","dekadan_bungaku_ron.txt",""
"133","sakaguchi","dekadan_bungaku_ron.txt","美しいもの、楽しいことを愛すのは人間の自然であり、ゼイタクや豪奢を愛し、成金は俗悪な大邸宅をつくって大いに成金趣味を発揮するが、それが万人の本性であって、毫も軽蔑すべきところはない。"
"134","sakaguchi","dekadan_bungaku_ron.txt","そして人間は、美しいもの、楽しいこと、ゼイタクを愛するように、正しいことをも愛するのである。"
"135","sakaguchi","dekadan_bungaku_ron.txt","人間が正しいもの、正義を愛す、ということは、同時にそれが美しいもの楽しいものゼイタクを愛し、男が美女を愛し、女が美男を愛することなどと並立して存する故に意味があるので、悪いことをも欲する心と並び存する故に意味があるので、人間の倫理の根元はここにあるのだ、と私は思う。"
"136","sakaguchi","dekadan_bungaku_ron.txt",""
