"","auth","piece","line"
"8351","sakaguchi","fubuki_monogatari.txt","不思議な魔力に恵まれて生れ変つた自分のやうな新鮮さに彼は自ら打たれたのである。"
"8352","sakaguchi","fubuki_monogatari.txt","文子の返事はこなかつた。"
"8353","sakaguchi","fubuki_monogatari.txt","彼は二度目の手紙を書いた。"
"8354","sakaguchi","fubuki_monogatari.txt","やがて三度目の手紙を書いた。"
"8355","sakaguchi","fubuki_monogatari.txt","愛情の不屈の激しさに感動し、自分の心に突然めばえた強烈な行動力をいとほしんだ。"
"8356","sakaguchi","fubuki_monogatari.txt","然し返事はこなかつた。"
"8357","sakaguchi","fubuki_monogatari.txt",""
"8358","sakaguchi","fubuki_monogatari.txt","「手紙の末路は――」と彼は思つた。"
"8359","sakaguchi","fubuki_monogatari.txt","破り棄てられてゐるのだらうか。"
"8360","sakaguchi","fubuki_monogatari.txt","それとも女中や出入りの人の目にふれて笑ひものの道具にされてゐるのだらうか。"
"8361","sakaguchi","fubuki_monogatari.txt","それも良からうと彼は思つた。"
"8362","sakaguchi","fubuki_monogatari.txt","笑ひものになることが尠しも不安でないといふ自分を見出したことだけで充分だつた。"
"8363","sakaguchi","fubuki_monogatari.txt",""
"8364","sakaguchi","fubuki_monogatari.txt","――あの手紙が世間へ洩れて人々の蔑みを受けても俺は微塵もひけめを覚えずただ傲然と構えてゐやう。"
"8365","sakaguchi","fubuki_monogatari.txt","病院の看護婦どもがわいわい言つて笑つても冷然と空うそぶいてゐるだけだ。"
"8366","sakaguchi","fubuki_monogatari.txt","俺をうぶな子供のつもりの父母兄弟や故郷の人が長嘆しても俺の心は動かない。"
"8367","sakaguchi","fubuki_monogatari.txt","俺は自分を軽蔑しない。"
"8368","sakaguchi","fubuki_monogatari.txt","それゆえ人を怖れない。"
"8369","sakaguchi","fubuki_monogatari.txt","これはひとつの身構えだが、こつちの身構えを立て直せば人生は自然に新らしい青空がひらけてくるのだ。"
"8370","sakaguchi","fubuki_monogatari.txt","強者には青空だけがあるのである。"
"8371","sakaguchi","fubuki_monogatari.txt","思ふことによつてではなく、意志することによつて、人生は意のままに誕生する。"
"8372","sakaguchi","fubuki_monogatari.txt","己れを軽蔑しないといふ鉄則によつて、人生は突然二つに岐れるのである。"
"8373","sakaguchi","fubuki_monogatari.txt",""
"8374","sakaguchi","fubuki_monogatari.txt","――さて、誰にひけめも覚えずに、俺は傲然と恋をしやう。"
"8375","sakaguchi","fubuki_monogatari.txt","と彼は自信にみちながら自分に言つてみるのであつた。"
"8376","sakaguchi","fubuki_monogatari.txt","そして四度目の手紙を書いた。"
"8377","sakaguchi","fubuki_monogatari.txt","破られやうと焼かれやうと人目にふれて笑はれやうと構はないのさと彼は冷然と呟くのである。"
"8378","sakaguchi","fubuki_monogatari.txt","返事をしないことによつて返事に代えるといふことが、教養の不足に思はれて軽蔑したくなるのであつた。"
"8379","sakaguchi","fubuki_monogatari.txt","惚れることも勝手なら厭がることも勝手だが、共存する人間同志はその当然の礼節があつて然るべきものである。"
"8380","sakaguchi","fubuki_monogatari.txt","個人生活は各々独立の尊厳を持ちあひ又尊敬を持ちあはなければならないものだ。"
"8381","sakaguchi","fubuki_monogatari.txt","個人の自由が許されなかつた封建時代の、個人主義と罪悪を混同した意識がまだ生き残つてゐるのである。"
"8382","sakaguchi","fubuki_monogatari.txt","日本人は文化人ではないのである。"
"8383","sakaguchi","fubuki_monogatari.txt","なぜなら個人主義といふものが正当に意識されずまた育つてもゐないからだと林平は思つた。"
"8384","sakaguchi","fubuki_monogatari.txt","そして無教養な俗世間が彼を苛々させるのだつた。"
"8385","sakaguchi","fubuki_monogatari.txt","厭なら厭だと言ふがいいのだ。"
"8386","sakaguchi","fubuki_monogatari.txt","それは当然の礼儀であり、他人の尊厳に対する敬意である。"
"8387","sakaguchi","fubuki_monogatari.txt","直接返事のあるまでは。"
"8388","sakaguchi","fubuki_monogatari.txt","……林平は五度目の恋文を書いたのである。"
"8389","sakaguchi","fubuki_monogatari.txt","そして彼は吊鐘マントに身体をくるんで夜の街へ消えこむのだつた。"
"8390","sakaguchi","fubuki_monogatari.txt","彼の酒癖は良くなかつた。"
"8391","sakaguchi","fubuki_monogatari.txt","無口であつたが粗暴であつた。"
"8392","sakaguchi","fubuki_monogatari.txt","そして女にいやがられたが彼はそれを気にしなかつた。"
"8393","sakaguchi","fubuki_monogatari.txt",""
"8394","sakaguchi","fubuki_monogatari.txt","文子にふられた腹癒せに酒をのみ女にたはむれるわけではないのである。"
"8395","sakaguchi","fubuki_monogatari.txt","むしろさういふ生き方や、こぢつけや、解釈を彼は最も軽蔑してゐた。"
"8396","sakaguchi","fubuki_monogatari.txt","それぞれひとつの現象にすぎないのである。"
"8397","sakaguchi","fubuki_monogatari.txt","首尾一貫した理窟によつて現象を結び合せる労力は愚かであるが、これを生活に就て言へば、その労力は生活を殺す時間にほかならない。"
"8398","sakaguchi","fubuki_monogatari.txt","人生に脈絡はいらないのである。"
"8399","sakaguchi","fubuki_monogatari.txt","そして最後にくるものは――ただ自我の終滅があるばかりだ。"
"8400","sakaguchi","fubuki_monogatari.txt","それは一切の批判を拒んでゐるのである。"
"8401","sakaguchi","fubuki_monogatari.txt","生きることに敗けつづけた弱者にとつては棺の後にも批評の言葉があつたであらうが、生きた人強者にとつては棺と共にすべては終つてしまふのだ。"
"8402","sakaguchi","fubuki_monogatari.txt","行動とそして終滅があつたのみ。"
"8403","sakaguchi","fubuki_monogatari.txt","然りひとつの物質の終滅があるのみである。"
"8404","sakaguchi","fubuki_monogatari.txt","この宇宙に何物も永遠ではあり得ない。"
"8405","sakaguchi","fubuki_monogatari.txt","太陽すら。"
"8406","sakaguchi","fubuki_monogatari.txt",""
"8407","sakaguchi","fubuki_monogatari.txt","そのころの一日だつた。"
"8408","sakaguchi","fubuki_monogatari.txt","かねがね彼と反目してゐた一人の若い看護婦が通りすぎる彼のうしろでくすりと笑ひを洩したのである。"
"8409","sakaguchi","fubuki_monogatari.txt","ただそれだけのことであつた。"
"8410","sakaguchi","fubuki_monogatari.txt","彼は矢庭にかたへの椅子をふりあげて物をも言はず一撃した。"
"8411","sakaguchi","fubuki_monogatari.txt","女の負傷は軽くなかつた。"
"8412","sakaguchi","fubuki_monogatari.txt",""
"8413","sakaguchi","fubuki_monogatari.txt","その事件をきつかけに、かねて彼と不和だつた某先輩が校内を暗躍して、彼に不利な策謀をしたと伝えられた。"
"8414","sakaguchi","fubuki_monogatari.txt","さういふ噂が行はれてからまもない一夜のことである。"
"8415","sakaguchi","fubuki_monogatari.txt","林平は某先輩の私宅へ現れ、突然彼を投げ倒し、殴つてゐた。"
"8416","sakaguchi","fubuki_monogatari.txt","某先輩は晩酌を終つたばかりで、酒気を帯びてゐたのである。"
"8417","sakaguchi","fubuki_monogatari.txt","相手になつて立ち向つたのがよくなかつた。"
"8418","sakaguchi","fubuki_monogatari.txt","家人が色を失つて手段を忘れてゐるうちに、二人は戸外へとびだした。"
"8419","sakaguchi","fubuki_monogatari.txt","近隣の人々が駈けつけたとき、某先輩は私宅の前を流れてゐる堀の中へ投げこまれて、水面へ足だけだしてもがいてゐた。"
"8420","sakaguchi","fubuki_monogatari.txt","致命傷はなかつたが、危く不具者になりかねない深傷を数ヶ所に受けてゐた。"
"8421","sakaguchi","fubuki_monogatari.txt",""
"8422","sakaguchi","fubuki_monogatari.txt","看護婦と某先輩の負傷は示談ですんだ。"
"8423","sakaguchi","fubuki_monogatari.txt","学校当局の奔走によるのであらう。"
"8424","sakaguchi","fubuki_monogatari.txt","一週間目に留置場をでた林平は無期停学の処分を受けて、思ひがけなく穏便に鳧がついたのであつた。"
"8425","sakaguchi","fubuki_monogatari.txt","冬のはじまる頃である。"
"8426","sakaguchi","fubuki_monogatari.txt","もう冬休みも近づいてゐた。"
"8427","sakaguchi","fubuki_monogatari.txt","この学期は停学処分のとかれる見込もまづないからと家人は帰郷をすすめたが、林平は一も二もなく拒絶した。"
"8428","sakaguchi","fubuki_monogatari.txt","そして謹慎の期間中彼が自ら選んだ日課は、朝夕二回海へでて、逆まく怒濤へ飛びこむことであつたのである。"
"8429","sakaguchi","fubuki_monogatari.txt","もはや雪が降りはじめてゐた。"
"8430","sakaguchi","fubuki_monogatari.txt","荒れた日は北風に逆らひながら海へ降りることだけでも苦痛であつた。"
"8431","sakaguchi","fubuki_monogatari.txt","海上へ低く垂れ落ちた雲の凄味もうんざりさせる。"
"8432","sakaguchi","fubuki_monogatari.txt","ひどく小さな暗い海が底から揺り動いてゐるのである。"
"8433","sakaguchi","fubuki_monogatari.txt","彼は泣きたくなるのであつた。"
"8434","sakaguchi","fubuki_monogatari.txt","そして逃げたくなるのであつた。"
"8435","sakaguchi","fubuki_monogatari.txt","海と空のうねりのなかで苦もなくひねり殺されてしまひさうに思はれた。"
"8436","sakaguchi","fubuki_monogatari.txt","けれども彼は逃げなかつた。"
"8437","sakaguchi","fubuki_monogatari.txt","彼の顔は苦痛のために断末魔の惨めな歪みをつくつたまま、かたまりついてほぐれなかつた。"
"8438","sakaguchi","fubuki_monogatari.txt","呼吸がとまり、波にまかれて、一枚の布片のやうにくるくるもまれて、波打際へ四つ這ひに投げつけられてゐるのであつた。"
"8439","sakaguchi","fubuki_monogatari.txt","ヒイといふ掠れた呻きが洩れるほかにはどうすることもできないのである。"
"8440","sakaguchi","fubuki_monogatari.txt","気が遠くなり、身体の動きが咄嗟に自由にならないのだ。"
"8441","sakaguchi","fubuki_monogatari.txt","うつかりすると起きあがることができないうちに、足の方からもはやずるずる波にさらはれかけてゐた。"
"8442","sakaguchi","fubuki_monogatari.txt","そのときは夢中であつた。"
"8443","sakaguchi","fubuki_monogatari.txt","逃げるためにあらゆる努力を意志してゐるが、それのすべてが徒労に終つて呼吸のとまる瞬間だけがまざ／＼分かるのであつた。"
"8444","sakaguchi","fubuki_monogatari.txt","再び一枚の布片のやうにくるくるまかれて波打際へ投げあげられた腕間には死者ぐるひでありながら這ひだすことが精一杯になつてゐた。"
"8445","sakaguchi","fubuki_monogatari.txt","海へ一足降して以来どうして呼吸がつづいてゐたのか、あとになつて考へると不思議な思ひがするのである。"
"8446","sakaguchi","fubuki_monogatari.txt","呼吸器が胎内にない思ひであつた。"
"8447","sakaguchi","fubuki_monogatari.txt","やうやく砂丘へ登りつめて、市街の方へ一足降すころになつても、肺臓がやうやく肩の上あたりへ雀のやうに戻つてきてそつととまつた感じであつた。"
"8448","sakaguchi","fubuki_monogatari.txt",""
"8449","sakaguchi","fubuki_monogatari.txt","――俺は誰にも負けてゐないと彼は思つた。"
"8450","sakaguchi","fubuki_monogatari.txt","俺は勝つてゐるのだと彼は叫んだ。"
"8451","sakaguchi","fubuki_monogatari.txt","異常な苦痛を自分に課した満足が、やうやく街へ戻つたころに細々と分かりかけてくる始末だつた。"
"8452","sakaguchi","fubuki_monogatari.txt","誰に裁かれてもゐないのだ。"
"8453","sakaguchi","fubuki_monogatari.txt","もとより自分に裁かれてゐるのでもない。"
"8454","sakaguchi","fubuki_monogatari.txt","ひとつの課題に答えてゐるにすぎないのである。"
"8455","sakaguchi","fubuki_monogatari.txt","その満足がすべてであつた。"
"8456","sakaguchi","fubuki_monogatari.txt",""
"8457","sakaguchi","fubuki_monogatari.txt","気違ひじみたこの行動には一人も気付いた人がなかつた。"
"8458","sakaguchi","fubuki_monogatari.txt","このことが人に知れたら、その日から海へ行かないつもりでもあつた。"
"8459","sakaguchi","fubuki_monogatari.txt","知る者が自分ひとりであるために、これだけの苦痛も忍べるのだ。"
"8460","sakaguchi","fubuki_monogatari.txt","また満足もあるのである。"
"8461","sakaguchi","fubuki_monogatari.txt","学期が変ると彼は処分を許された。"
"8462","sakaguchi","fubuki_monogatari.txt",""
"8463","sakaguchi","fubuki_monogatari.txt","まもなく文子と高梨の事件が起きて、毎日の新聞紙面が賑ひはじめた。"
"8464","sakaguchi","fubuki_monogatari.txt","そして文子が帰つてきた。"
"8465","sakaguchi","fubuki_monogatari.txt",""
"8466","sakaguchi","fubuki_monogatari.txt","「びくびくするんぢやないわ」と左門の長屋の踊り子が見舞ひがてら遊びにきて文子に言つた。"
"8467","sakaguchi","fubuki_monogatari.txt","「それぐらゐのこと大概の人が陰でしてゐることぢやないの。"
"8468","sakaguchi","fubuki_monogatari.txt","あなたは運が悪かつただけよ。"
"8469","sakaguchi","fubuki_monogatari.txt","男の人を愛してゐるなら仕方のないことぢやないの。"
"8470","sakaguchi","fubuki_monogatari.txt","誰に羞ぢることもないわ。"
"8471","sakaguchi","fubuki_monogatari.txt","人目なんか気にしないで街へ気晴らしにでたらどう。"
"8472","sakaguchi","fubuki_monogatari.txt","うちのホールへ踊りにをいでな。"
"8473","sakaguchi","fubuki_monogatari.txt","誰もなんとも言はないから。"
"8474","sakaguchi","fubuki_monogatari.txt","うるさいことを言ふ奴はこつちが真面目に暮してゐてもなんとかかんとか言つてゐるわ。"
"8475","sakaguchi","fubuki_monogatari.txt","そんなこと一々気にしたら、ああ、きりがない……」"
"8476","sakaguchi","fubuki_monogatari.txt","文子はある日踊り子に言つた。"
"8477","sakaguchi","fubuki_monogatari.txt",""
"8478","sakaguchi","fubuki_monogatari.txt","「私ダンサーにならうかしらと思ふことがあるのよ。"
"8479","sakaguchi","fubuki_monogatari.txt","眠る前にきつと思ふわ。"
"8480","sakaguchi","fubuki_monogatari.txt","この土地ではどうせできない相談だけど、ひと思ひに東京へでも行つて……」"
"8481","sakaguchi","fubuki_monogatari.txt","高梨と泊つた宿屋は壁も柱も煤けたやうな陰鬱な建物だつた。"
"8482","sakaguchi","fubuki_monogatari.txt","さういふ宿を狙つたわけではなかつたのだが、泊る宿が次から次へそんな煤けた建物だつた。"
"8483","sakaguchi","fubuki_monogatari.txt","大概は停車場前の恐らく土地では指折りの宿屋であつたには違ひない。"
"8484","sakaguchi","fubuki_monogatari.txt","汽車の発着があるたびにいくらか休憩の客はあつたが、泊りの客はめつたになかつた。"
"8485","sakaguchi","fubuki_monogatari.txt","夜中に便所へ起きたりすると、暗い廊下は重たい雨戸が敷つめてゐて内も外も音が死んでゐるのである。"
"8486","sakaguchi","fubuki_monogatari.txt","便所の小窓を開けてみると腐つたやうな雪明りだ。"
"8487","sakaguchi","fubuki_monogatari.txt","泣きたくなつてしまふのだつた。"
"8488","sakaguchi","fubuki_monogatari.txt","もはや家へも帰れないと思はなければならなくなつてしまふのである。"
"8489","sakaguchi","fubuki_monogatari.txt","遠い所へ行つてしまつてダンサーにでもならうかしらと思つたのは、さういふ宿の一夜の思ひがはじまりだつた。"
"8490","sakaguchi","fubuki_monogatari.txt",""
"8491","sakaguchi","fubuki_monogatari.txt","「真面目な人は私なんか相手にしてはくれないでせう。"
"8492","sakaguchi","fubuki_monogatari.txt","私も真面目な人達とつきあひたいと思はないわ。"
"8493","sakaguchi","fubuki_monogatari.txt","ひけめを感じて小さくなつてゐるだけでも窮屈でやりきれないもの。"
"8494","sakaguchi","fubuki_monogatari.txt","時々お酒がのみたいと思ふことがあるわ」"
"8495","sakaguchi","fubuki_monogatari.txt","その酒も亦高梨と泊りを重ねた頃に覚えたひとつであつた。"
"8496","sakaguchi","fubuki_monogatari.txt","茫莫たる旅寝の夜の部屋に降つた電燈の光が瞼に浮んでくるのである。"
"8497","sakaguchi","fubuki_monogatari.txt","鈍い光であるけれども、霧のやうな光であつた。"
"8498","sakaguchi","fubuki_monogatari.txt","それが部屋に降りしぶいてゐて、そして目に沁み心にも沁みた夜毎の思ひがなつかしいのだ。"
"8499","sakaguchi","fubuki_monogatari.txt","煤けた宿の夜なのである。"
"8500","sakaguchi","fubuki_monogatari.txt","侘しいものではあるけれども、忘れられないなつかしさだつた。"
"8501","sakaguchi","fubuki_monogatari.txt","部屋の外の暗らい廊下に濡れきつた重い雨戸がおりてゐたが、その廊下を忍び足で歩いて通つた一人の気配も思ひだすことができないのだ。"
"8502","sakaguchi","fubuki_monogatari.txt","思ひだす多くのことが、それほど重く濡れた感じで、侘びしいのである。"
"8503","sakaguchi","fubuki_monogatari.txt","酔つてゐた。"
"8504","sakaguchi","fubuki_monogatari.txt","そして悲しい思ひをしてゐた。"
"8505","sakaguchi","fubuki_monogatari.txt","もはやすべてに見捨てられ、帰るところを失つたと思はなければならなかつた。"
"8506","sakaguchi","fubuki_monogatari.txt","そのせつなさに泣いたのである。"
"8507","sakaguchi","fubuki_monogatari.txt","然しもはや恐らく生涯忘れることのできないだらうなつかしさ。"
"8508","sakaguchi","fubuki_monogatari.txt","悲しかつたが、また厳しさが張りつめてゐた。"
"8509","sakaguchi","fubuki_monogatari.txt","そして若しくはなかつたのである。"
"8510","sakaguchi","fubuki_monogatari.txt","せつなかつたが澄んでゐたのだ。"
"8511","sakaguchi","fubuki_monogatari.txt","ひと思ひにどういふこともやれる思ひがしてゐたのである。"
"8512","sakaguchi","fubuki_monogatari.txt",""
"8513","sakaguchi","fubuki_monogatari.txt","高梨もこのまま東京へ逃げやうかと言ひだしてゐた。"
"8514","sakaguchi","fubuki_monogatari.txt","その言葉をきいた当時は、表面の意味の通りのただ単純な内容とのみ思つたのだが、今になつて考へると、もう新潟を食ひつめてゐたのであらう。"
"8515","sakaguchi","fubuki_monogatari.txt","そして未練もなかつたのだらう。"
"8516","sakaguchi","fubuki_monogatari.txt","その高梨を文子は仄かにいとしかつた。"
"8517","sakaguchi","fubuki_monogatari.txt",""
"8518","sakaguchi","fubuki_monogatari.txt","「私も東京へついてくわ」文子は何度も高梨に言はうと思つた。"
"8519","sakaguchi","fubuki_monogatari.txt","言ひさへすれば恐らく心もきまつたのである。"
"8520","sakaguchi","fubuki_monogatari.txt","そのころは然しはつきり言ひきることが到頭できないのであつた。"
"8521","sakaguchi","fubuki_monogatari.txt","どうして言へなかつたのであらう。"
"8522","sakaguchi","fubuki_monogatari.txt","今なら却つて言へるやうに思へるのだ。"
"8523","sakaguchi","fubuki_monogatari.txt","そしてこれほど言ひやすい、言ひたい言葉もないやうに思へるのだつた。"
"8524","sakaguchi","fubuki_monogatari.txt","言ひさへすれば恐らく心のきまることが、あのころは怖しかつたに違ひない。"
"8525","sakaguchi","fubuki_monogatari.txt","けれども今なら――言つて心がきまるものなら、これほど言ひたいことはなかつた。"
"8526","sakaguchi","fubuki_monogatari.txt","東京へ行きたいのだつた。"
"8527","sakaguchi","fubuki_monogatari.txt","いや何よりもこの家を逃げたいのだつた。"
"8528","sakaguchi","fubuki_monogatari.txt","高梨が恋しいわけでもないのである。"
"8529","sakaguchi","fubuki_monogatari.txt","けれども逃げるきつかけに、逃げたい心に弾みをつける道具のために、今こそ東京へ逃げませうとあの人に言ひたい思ひがせつないのだ。"
"8530","sakaguchi","fubuki_monogatari.txt","あの人を盗られた今ではもう手遅れなのだらうか。"
"8531","sakaguchi","fubuki_monogatari.txt","何よりも夢のやうな広く深いあるロマンスが恋しいのだ。"
"8532","sakaguchi","fubuki_monogatari.txt","この現実ほど退屈な、死のやうな、惨めなものはないのであつた。"
"8533","sakaguchi","fubuki_monogatari.txt","高梨と酔ひ痴れ泣き痴れて暮したころはこの現実に未練があつたが、戻つてみると、この現実ほどああ退屈なものはない。"
"8534","sakaguchi","fubuki_monogatari.txt","そのみすぼらしい正体がいよいよはつきり分つた気がした。"
"8535","sakaguchi","fubuki_monogatari.txt","左門の愛。"
"8536","sakaguchi","fubuki_monogatari.txt","それがなんのたしにならうか！家名。"
"8537","sakaguchi","fubuki_monogatari.txt","それが何物だらう。"
"8538","sakaguchi","fubuki_monogatari.txt","もはやなんの未練もなかつた。"
"8539","sakaguchi","fubuki_monogatari.txt","肉体のよろこび。"
"8540","sakaguchi","fubuki_monogatari.txt","そして自由。"
"8541","sakaguchi","fubuki_monogatari.txt","広い世界。"
"8542","sakaguchi","fubuki_monogatari.txt","もはやそれを忘れることもできなかつたが、何よりも夢のやうなロマンスが生々しいまで恋しいのだ。"
"8543","sakaguchi","fubuki_monogatari.txt","そのロマンスの逞しい激しい息吹に追ひかけられる思ひがした。"
"8544","sakaguchi","fubuki_monogatari.txt","その跫音が背中にきこえる思ひがした。"
"8545","sakaguchi","fubuki_monogatari.txt","その肉体の体温がほのかに肩に伝はるほど追ひつめられた思ひなのだ。"
"8546","sakaguchi","fubuki_monogatari.txt","それはひとりの男であつた。"
"8547","sakaguchi","fubuki_monogatari.txt","やがてそれは男のひとつの肉体であつた。"
"8548","sakaguchi","fubuki_monogatari.txt","意志であつた。"
"8549","sakaguchi","fubuki_monogatari.txt","そしてひとつの現実であつた。"
"8550","sakaguchi","fubuki_monogatari.txt",""
"8551","sakaguchi","fubuki_monogatari.txt","「私ひと思ひに東京へ行つてしまひたいのよ。"
"8552","sakaguchi","fubuki_monogatari.txt","東京へたつたひとり投げだされても怖くないと思ふやうになつてきたわ。"
"8553","sakaguchi","fubuki_monogatari.txt","新潟で人目に怯えながらじめじめ暮すぐらゐなら、ひと思ひに……怖いことや苦しいことも、きつとこれよりましだと思ふわ。"
"8554","sakaguchi","fubuki_monogatari.txt","ここにかうして暮してゐて、何を待たされてゐるのかしら。"
"8555","sakaguchi","fubuki_monogatari.txt","お婆さんになるほかには何を待つこともできないぢやないの。"
"8556","sakaguchi","fubuki_monogatari.txt","働くことも悲しいことも私つらいと思へないわ。"
"8557","sakaguchi","fubuki_monogatari.txt","苦しいことだつて怖しいことだつて、ここにかうして暮すよりつらくはないと思へるのよ。"
"8558","sakaguchi","fubuki_monogatari.txt","誰に気兼もない自由な生活ができたら……」"
"8559","sakaguchi","fubuki_monogatari.txt","「それはさうにきまつてるさ。"
"8560","sakaguchi","fubuki_monogatari.txt","だけど我儘かも知れないよ」と踊り子は煙草をふかしながら気のない返事をした。"
"8561","sakaguchi","fubuki_monogatari.txt","「そんなこと考へたつて結局仕様がないぢやないの。"
"8562","sakaguchi","fubuki_monogatari.txt","自由の生活つてどこにあるのさ。"
"8563","sakaguchi","fubuki_monogatari.txt","ほんとに気兼のいらないところは家庭だけだよ。"
"8564","sakaguchi","fubuki_monogatari.txt","結局さうだわ。"
"8565","sakaguchi","fubuki_monogatari.txt","あなたのお爺さんぐらゐ物の分かつたお爺さんは世間にざらにゐるものぢやないよ」"
