"","auth","piece","line"
"5899","sakaguchi","fubuki_monogatari.txt","この部屋の主人は火をおこす煩労にも堪えかねるので、炬燵もかかつてゐなかつた。"
"5900","sakaguchi","fubuki_monogatari.txt",""
"5901","sakaguchi","fubuki_monogatari.txt","「寒いわ。"
"5902","sakaguchi","fubuki_monogatari.txt","ひどい吹雪ね」"
"5903","sakaguchi","fubuki_monogatari.txt","澄江はつぶやいた。"
"5904","sakaguchi","fubuki_monogatari.txt","椅子にかけたものかどうかと部屋を見廻してみたらしいが、火鉢もないし、座蒲団もないので、とにかく椅子に腰を下してしまつたらしいが、かう寒々としてゐては腰かけ具合も落付かないし、なるほど寒いに相違ない。"
"5905","sakaguchi","fubuki_monogatari.txt","卓一はどうしていいか分からなかつた。"
"5906","sakaguchi","fubuki_monogatari.txt","炭だけは、あるにはあるのである。"
"5907","sakaguchi","fubuki_monogatari.txt","他巳吉のゐる六畳へ火のない火鉢をとりに行つて、花合戦をしばらく待つてくれと言ふと、え、ほれ、あれはペアノ弾きの娘かねと他巳吉は悦に入つてにたにたと卓一の顔をのぞきこんだが、卓一は夢の中に置き放されてゐるやうな訝しげな顔付を最もかすかに動かすこともできないやうな有様だつた。"
"5908","sakaguchi","fubuki_monogatari.txt",""
"5909","sakaguchi","fubuki_monogatari.txt","卓一はただ訝しい思ひであつた。"
"5910","sakaguchi","fubuki_monogatari.txt","別に感動といふものもなかつた。"
"5911","sakaguchi","fubuki_monogatari.txt",""
"5912","sakaguchi","fubuki_monogatari.txt","澄江を知り、そして恋心を知つてから、もはや四年すぎてゐる。"
"5913","sakaguchi","fubuki_monogatari.txt","四年間。"
"5914","sakaguchi","fubuki_monogatari.txt","その年月の流れるうちに、たつた一人の澄江をめぐつて、どれほど多くの物思ひがあつたであらう。"
"5915","sakaguchi","fubuki_monogatari.txt","澄江ひとりの姿をめぐつて、思ひうるあらゆることは思ひつくしてきたのである。"
"5916","sakaguchi","fubuki_monogatari.txt","そしてすでに結論すらもあつたのだ。"
"5917","sakaguchi","fubuki_monogatari.txt","新らたに附加ふべき何物も、今更あらうとは思はれない。"
"5918","sakaguchi","fubuki_monogatari.txt",""
"5919","sakaguchi","fubuki_monogatari.txt","卓一はあらためて澄江を見た。"
"5920","sakaguchi","fubuki_monogatari.txt","この女である。"
"5921","sakaguchi","fubuki_monogatari.txt","そしてたしかに特殊の感動を心に覚えたとも思はなかつたが、然しただ甚だ訝しい思ひだけが頭の入口をはいつた所に舞ひ漂ひ、あらゆる思念がそれから奥へはいることができない感じだ。"
"5922","sakaguchi","fubuki_monogatari.txt",""
"5923","sakaguchi","fubuki_monogatari.txt","四年間澄江をめぐつて思ひ耽つたあらゆる思念が、この瞬間に中断され、暗黒の幕の彼方にさえぎられて、過去の思念の一切を振向くことがもはやできない。"
"5924","sakaguchi","fubuki_monogatari.txt","あの明確に下された筈の結論すらも、もはや振向く術がない。"
"5925","sakaguchi","fubuki_monogatari.txt","在るものはこの瞬間に始められたこの現実と、そして過去のあらゆる思念を暗黒の幕の彼方へ見失ひ、この瞬間から誕生した新らたなそして幼稚な心があるばかりである。"
"5926","sakaguchi","fubuki_monogatari.txt",""
"5927","sakaguchi","fubuki_monogatari.txt","「この女なのだ……」卓一は思ふのだつた。"
"5928","sakaguchi","fubuki_monogatari.txt","この女。"
"5929","sakaguchi","fubuki_monogatari.txt","なんといふことだらう。"
"5930","sakaguchi","fubuki_monogatari.txt","すべては実にくだらない偶然の仕業ではないか。"
"5931","sakaguchi","fubuki_monogatari.txt","もしもこの女に遇はなかつたら……否、遇つてゐてもいいのである。"
"5932","sakaguchi","fubuki_monogatari.txt","然し澄江に遇ふ以前に女友達がないことはなかつた。"
"5933","sakaguchi","fubuki_monogatari.txt","そして澄江を一目見たとき心を惹かれたそれ以上に、それらの一人二人には心を惹かれた思ひ出がある。"
"5934","sakaguchi","fubuki_monogatari.txt","ただ深入りをしなかつたのだ。"
"5935","sakaguchi","fubuki_monogatari.txt","そして心が絡みあつてしまふほど踏みこむ勇気と偶然がなかつたまでの話なのである。"
"5936","sakaguchi","fubuki_monogatari.txt","たまたまそれらの女の一人に深入りをして心と心を交えてゐたら……恐らくその人が卓一の心の裡に澄江の位置を占めてゐるに相違ないのだ。"
"5937","sakaguchi","fubuki_monogatari.txt","その後に澄江を知つたにしても、澄江はもはや彼の心に今の澄江である筈はない。"
"5938","sakaguchi","fubuki_monogatari.txt","あたかも由子と同じやうな千万人の美女のひとりにすぎない筈だ。"
"5939","sakaguchi","fubuki_monogatari.txt","すべては偶然の仕業なのである。"
"5940","sakaguchi","fubuki_monogatari.txt",""
"5941","sakaguchi","fubuki_monogatari.txt","この女でなければならない筈はなかつた。"
"5942","sakaguchi","fubuki_monogatari.txt","然り。"
"5943","sakaguchi","fubuki_monogatari.txt","この女でなければならぬ筈はない。"
"5944","sakaguchi","fubuki_monogatari.txt","けれども、ひとたび偶然が終りをつげた今となつては、もはや澄江が唯一人の女でなければならないやうに決定されてしまつたのか。"
"5945","sakaguchi","fubuki_monogatari.txt","もはや心が宿命を負ふてしまつてゐるのだらうか。"
"5946","sakaguchi","fubuki_monogatari.txt","ひどく訝しい思ひがする。"
"5947","sakaguchi","fubuki_monogatari.txt","宿命なぞといふ言葉で、手軽に片附けてはならないやうに思ふのである。"
"5948","sakaguchi","fubuki_monogatari.txt","もつと深く突きつめて、考へたことがある筈なのだ。"
"5949","sakaguchi","fubuki_monogatari.txt","四年間の歳月が流れるうちには、同じ問ひを幾度も心のうちに取りあげて、精密な式も答えも出してをいた思ひがする。"
"5950","sakaguchi","fubuki_monogatari.txt","単にかうではなかつた筈だと思はぬことはないのである。"
"5951","sakaguchi","fubuki_monogatari.txt","然し考へてみやうとしても、結局やつぱり徒労なのだ。"
"5952","sakaguchi","fubuki_monogatari.txt","頭の入口をはいつた所に、恰も漠然と雲を敷きつめてゐるやうな訝しい思ひが舞ひ狂ひ、そして頭の入口へふと浮かびでるあらゆる思念が、もはやそれ以上に深入りすることを禁じられ、まとまることを拒まれてゐる様子であつた。"
"5953","sakaguchi","fubuki_monogatari.txt",""
"5954","sakaguchi","fubuki_monogatari.txt","「実に不思議だ。"
"5955","sakaguchi","fubuki_monogatari.txt","そして奇妙だ。"
"5956","sakaguchi","fubuki_monogatari.txt","そしてたしかに滑稽らしい」と卓一は思つた。"
"5957","sakaguchi","fubuki_monogatari.txt",""
"5958","sakaguchi","fubuki_monogatari.txt","滑稽らしいと思ひはするが、さういふ意識を突き破つて、彼はもはやこの人となら結婚しても悔ひないといふ確信をいだきはじめてゐるのであつた。"
"5959","sakaguchi","fubuki_monogatari.txt",""
"5960","sakaguchi","fubuki_monogatari.txt","この確信はたしかにあまり唐突だと彼は思つた。"
"5961","sakaguchi","fubuki_monogatari.txt","澄江を宿命の女のやうに思ひこませ、確信させやうと焦せりぬいてゐるやうな、そわそわと落付きのない自分が見える。"
"5962","sakaguchi","fubuki_monogatari.txt","卓一は冷めたい火鉢に火をおこさうと頻りに紙を燃しながら、もつと自分を落付かせて、もつと深いほんとの肚を突きとめやうとするのであつた。"
"5963","sakaguchi","fubuki_monogatari.txt","部屋は煙でいつぱいになる。"
"5964","sakaguchi","fubuki_monogatari.txt","やがてのことに火の方はどうにかつきかけてきたのだが、頭の方はどうしても思念が奥へはいらないのだ。"
"5965","sakaguchi","fubuki_monogatari.txt","そのくせ唐突な確信が、もはや自分のすべてのやうな落付きを見せて、無性に悠々とひろがつてくる。"
"5966","sakaguchi","fubuki_monogatari.txt",""
"5967","sakaguchi","fubuki_monogatari.txt","澄江が火鉢へ近づいてきた。"
"5968","sakaguchi","fubuki_monogatari.txt",""
"5969","sakaguchi","fubuki_monogatari.txt","「私がするわ」澄江は火箸を受取つて、火を動かしてゐるのである。"
"5970","sakaguchi","fubuki_monogatari.txt","澄江も考へにまとまりがなくて、困りはて、ぼんやりしてゐるやうに見える。"
"5971","sakaguchi","fubuki_monogatari.txt","澄江が火鉢のそばへ来たので、卓一は自然に澄江のそばを離れ、それゆえ火鉢のそばを離れて、立ち上ると、椅子へ腰を下してしまつてゐるのであつた。"
"5972","sakaguchi","fubuki_monogatari.txt",""
"5973","sakaguchi","fubuki_monogatari.txt","「私ね。"
"5974","sakaguchi","fubuki_monogatari.txt","満洲国へ行くのよ」"
"5975","sakaguchi","fubuki_monogatari.txt","「いつ」"
"5976","sakaguchi","fubuki_monogatari.txt","「二週間ぐらゐのうちに」"
"5977","sakaguchi","fubuki_monogatari.txt","「どうして」"
"5978","sakaguchi","fubuki_monogatari.txt","「行つてしまふだけよ」"
"5979","sakaguchi","fubuki_monogatari.txt","東京へ行つてしまふわといふ由子の言葉と、同じやうな言葉である。"
"5980","sakaguchi","fubuki_monogatari.txt","然し卓一は由子の場合と同じやうに、冷めたく聞き流してゐることはできなかつた。"
"5981","sakaguchi","fubuki_monogatari.txt","自分を愛してゐるといふ一つの表現だと思ひはする。"
"5982","sakaguchi","fubuki_monogatari.txt","そしてもしも果してさういふ意味だとすれば、澄江だけのことではない。"
"5983","sakaguchi","fubuki_monogatari.txt","自分だつて……卓一はさう思ふのだ。"
"5984","sakaguchi","fubuki_monogatari.txt","俺は澄江を愛してゐる。"
"5985","sakaguchi","fubuki_monogatari.txt","澄江の暗示にひきづられて思ひ当つたわけではなく、澄江が自分を思ふよりも、もつと愛してゐたのだつた。"
"5986","sakaguchi","fubuki_monogatari.txt","そしてさういふ心のうちを、どういふ言葉で表現したらいいのだらうか。"
"5987","sakaguchi","fubuki_monogatari.txt","お前が俺を愛すよりも俺はもつとお前を愛してゐたのだといふ心のうちを。"
"5988","sakaguchi","fubuki_monogatari.txt","――卓一の頭のはたらきから、もはや内省のはたらきが、失はれてゐるわけではなかつた。"
"5989","sakaguchi","fubuki_monogatari.txt","結局ただあらゆる内省は無視されることによつて圧倒され、そして空転するのみであつた。"
"5990","sakaguchi","fubuki_monogatari.txt",""
"5991","sakaguchi","fubuki_monogatari.txt","「私ね」澄江は火鉢のそばを離れた。"
"5992","sakaguchi","fubuki_monogatari.txt","そらぞらしく口を噤んで立ち上ると、卓子を差しはさんで、卓一の正面へ腰を下した。"
"5993","sakaguchi","fubuki_monogatari.txt","「私ね。"
"5994","sakaguchi","fubuki_monogatari.txt","満洲国へ行つてもう帰つてこないわ。"
"5995","sakaguchi","fubuki_monogatari.txt","新京に叔父さんのうちがあるの。"
"5996","sakaguchi","fubuki_monogatari.txt","もしかすると……」"
"5997","sakaguchi","fubuki_monogatari.txt","「…………」"
"5998","sakaguchi","fubuki_monogatari.txt","「ふふ」澄江は笑つた。"
"5999","sakaguchi","fubuki_monogatari.txt","「なんでもないのよ。"
"6000","sakaguchi","fubuki_monogatari.txt","私ね、そんなことを言ふために、ここへきたんぢやないのよ」"
"6001","sakaguchi","fubuki_monogatari.txt","卓一は澄江の言葉がとぎれるたびに、今度こそは言ひださうと、たつた一つの同じ言葉にこだはりつづけてゐるのであつた。"
"6002","sakaguchi","fubuki_monogatari.txt","卓一はそれを言ひきつた。"
"6003","sakaguchi","fubuki_monogatari.txt",""
"6004","sakaguchi","fubuki_monogatari.txt","「僕と結婚してくれないか」と。"
"6005","sakaguchi","fubuki_monogatari.txt",""
"6006","sakaguchi","fubuki_monogatari.txt","その瞬間澄江の瞳に憎しみの冷めたい光が凝結した。"
"6007","sakaguchi","fubuki_monogatari.txt","そして澄江は突きさすやうに卓一の瞳を見たが、やがてもはや眼をとぢて、椅子の背に軽く頭をもたせかけて、微動もしなくなつてゐた。"
"6008","sakaguchi","fubuki_monogatari.txt","長い長い時間であつた。"
"6009","sakaguchi","fubuki_monogatari.txt",""
"6010","sakaguchi","fubuki_monogatari.txt","澄江はやがて眼をあけた。"
"6011","sakaguchi","fubuki_monogatari.txt","憎しみの光はもはやなかつた。"
"6012","sakaguchi","fubuki_monogatari.txt","諦らめきつてゐるやうな、悲しい冷めたさが浮かんでゐた。"
"6013","sakaguchi","fubuki_monogatari.txt",""
"6014","sakaguchi","fubuki_monogatari.txt","「四年間……」と澄江は小さく呟いた。"
"6015","sakaguchi","fubuki_monogatari.txt","そして卓一をちらと見て「四年間よ」と繰返すと、澄江はまるで自らを嘲けるやうな冷めたい笑ひを顔に浮かべてしまつたのだ。"
"6016","sakaguchi","fubuki_monogatari.txt","やがて澄江は椅子を離れた。"
"6017","sakaguchi","fubuki_monogatari.txt","卓一の方へ背を向けて、火鉢の前へ静かにしやがむと、つめたさのために凍てついてしまつたやうに、微動もしなくなつてゐた。"
"6018","sakaguchi","fubuki_monogatari.txt","泣いてゐるのではあるまいかと卓一は思つた。"
"6019","sakaguchi","fubuki_monogatari.txt",""
"6020","sakaguchi","fubuki_monogatari.txt","澄江はやがて立上つた。"
"6021","sakaguchi","fubuki_monogatari.txt","身装のくづれをなほしてから、ふりむいて、椅子にかけた。"
"6022","sakaguchi","fubuki_monogatari.txt","突然澄江は蒼ざめた顔をあげて、きびしい詰問の口調で卓一に言つた。"
"6023","sakaguchi","fubuki_monogatari.txt",""
"6024","sakaguchi","fubuki_monogatari.txt","「どうしてそれを四年前に言つてくれなかつたの」"
"6025","sakaguchi","fubuki_monogatari.txt","そして再び一層激しいヒステリックな詰問の声で、同じ言葉をくりかへした。"
"6026","sakaguchi","fubuki_monogatari.txt",""
"6027","sakaguchi","fubuki_monogatari.txt","「どうして言つてくれなかつたのよ。"
"6028","sakaguchi","fubuki_monogatari.txt","四年前に」"
"6029","sakaguchi","fubuki_monogatari.txt","恨みと怒りと詰問のきびしい表情が、然し突然くづれてしまふ。"
"6030","sakaguchi","fubuki_monogatari.txt","そして再び諦らめきつた悲しさに変るのだ。"
"6031","sakaguchi","fubuki_monogatari.txt","弱い声でつぶやいた。"
"6032","sakaguchi","fubuki_monogatari.txt",""
"6033","sakaguchi","fubuki_monogatari.txt","「もうおそいわ。"
"6034","sakaguchi","fubuki_monogatari.txt","もうおそいのよ。"
"6035","sakaguchi","fubuki_monogatari.txt","おそすぎる。"
"6036","sakaguchi","fubuki_monogatari.txt","おそすぎる。"
"6037","sakaguchi","fubuki_monogatari.txt","四年間だもの」"
"6038","sakaguchi","fubuki_monogatari.txt","その悲しさのせつなげな有様をみて、卓一は当惑のあまり、思はず絶望の呟きをもらしてしまふのであつた。"
"6039","sakaguchi","fubuki_monogatari.txt",""
"6040","sakaguchi","fubuki_monogatari.txt","「もうおそすぎたのか」と。"
"6041","sakaguchi","fubuki_monogatari.txt","卓一の心のはたらきはもはや子供のそれのやうに単純となり、澄江の言葉の通りのものをそれが意味のすべてのやうに意識してしまふばかりで、その幼稚さを憎みながらも、手も足もでない状態だつた。"
"6042","sakaguchi","fubuki_monogatari.txt",""
"6043","sakaguchi","fubuki_monogatari.txt","澄江はやがて、やうやくかすかな笑ひを浮かべた。"
"6044","sakaguchi","fubuki_monogatari.txt","いいえ、さうではないのよと言ふやうに、首をふつて見せるのだつた。"
"6045","sakaguchi","fubuki_monogatari.txt",""
"6046","sakaguchi","fubuki_monogatari.txt","「それでは結婚できるのか」"
"6047","sakaguchi","fubuki_monogatari.txt","澄江はしばらくすぎてから、頷いた。"
"6048","sakaguchi","fubuki_monogatari.txt",""
"6049","sakaguchi","fubuki_monogatari.txt","卓一の感動はその須点に達してゐた。"
"6050","sakaguchi","fubuki_monogatari.txt","静寂な風景を眺めまた雄大な自然に接することはあつても、一応の美を感じ、そしていくらか愁ひの晴れた思ひはしても、愁ひの発するその根源から根こそぎさらひとられるやうな感動を受けた覚えはもとよりない。"
"6051","sakaguchi","fubuki_monogatari.txt","もとより風景の美はたかの知れたものである。"
"6052","sakaguchi","fubuki_monogatari.txt","たまたま水の波紋のやうな、極めて表面的な愁ひの波に適合する程度のもので、深い苦悩の奥にまで達しうる筈はないのだ。"
"6053","sakaguchi","fubuki_monogatari.txt","まだしも人間関係の世界は、その最も日常的な皮相のものであつてさへ、風景よりはいくらか深くまた複雑に苦悩の襞の奥の方へふれてくる。"
"6054","sakaguchi","fubuki_monogatari.txt","そしてたまたま人間の愁ひの発する源から根こそぎ揺りうごかしてくるやうな感動の世界があるとすれば、当然それは人間関係の世界以外にありうる筈はないのだ、と常に卓一は信じてゐた。"
"6055","sakaguchi","fubuki_monogatari.txt","けれども大自然に接するたびに常に殆んど退屈し、慰さむことがなかつたやうに、彼の経てきた人間関係のパノラマも、また常に陳腐で、魅力がなかつた。"
"6056","sakaguchi","fubuki_monogatari.txt","たのしさもなかつた。"
"6057","sakaguchi","fubuki_monogatari.txt","感動もなかつた。"
"6058","sakaguchi","fubuki_monogatari.txt","そして常に退屈だつた。"
"6059","sakaguchi","fubuki_monogatari.txt",""
"6060","sakaguchi","fubuki_monogatari.txt","「なんといふ美しさだらう」卓一は感動のあまり、思はず口にでかかるのだつた。"
"6061","sakaguchi","fubuki_monogatari.txt","卑小な一人の人間に、この絶対の美しさが秘められてゐることを、かつて信じえたであらうか。"
"6062","sakaguchi","fubuki_monogatari.txt","否々々。"
"6063","sakaguchi","fubuki_monogatari.txt","ありうることは予想しても、その実際を信ずることは為し得なかつた筈である。"
"6064","sakaguchi","fubuki_monogatari.txt",""
"6065","sakaguchi","fubuki_monogatari.txt","「なにものが卑小なひとりの人間をこんなに美しくするのだらう」卓一は心に溜息をもらすのだつた。"
"6066","sakaguchi","fubuki_monogatari.txt","「そして俺は？澄江の美しさにひきづられて、俺も今はいくらか美しく振舞つてゐるのであらうか。"
"6067","sakaguchi","fubuki_monogatari.txt","すくなくとも、美しく、そして高貴に、振舞はなければならないといふ責を感じる……」"
"6068","sakaguchi","fubuki_monogatari.txt","生れてはじめての経験だと卓一は心に叫んだ。"
"6069","sakaguchi","fubuki_monogatari.txt","凡そこの世にありうるところの最も美しいものを、はじめて認識したのである。"
"6070","sakaguchi","fubuki_monogatari.txt","最も美しいもの、最も高貴なもの。"
"6071","sakaguchi","fubuki_monogatari.txt","すべて絶巓に位するところの唯一にして絶対のものも、我々の頭は極めて容易にそれを予想し、描き、思量することができるのだ。"
"6072","sakaguchi","fubuki_monogatari.txt","然し我々の長からざる生涯に於て、すべて絶巓に位するところの唯一のものを、その色も香も手ざはりも声も具えた生々しい現実の姿で、掴みうることが、いくたびあらう。"
"6073","sakaguchi","fubuki_monogatari.txt","否。"
"6074","sakaguchi","fubuki_monogatari.txt","ひとたび有りえたことが、すでに奇蹟だと卓一は思つた。"
"6075","sakaguchi","fubuki_monogatari.txt","現に不思議な幸運のなかに坐してゐる歓喜を、彼は現実に意識したのだ。"
"6076","sakaguchi","fubuki_monogatari.txt",""
"6077","sakaguchi","fubuki_monogatari.txt","「俺はたうとう現実に勝つた。"
"6078","sakaguchi","fubuki_monogatari.txt","そして今俺は怖れげもなく現実の上に君臨してゐるらしい。"
"6079","sakaguchi","fubuki_monogatari.txt","奇蹟的なひとときである。"
"6080","sakaguchi","fubuki_monogatari.txt","現実が夢より美しいものだと誰が言ひ得たであらう！俺は今、億万の人に向つて、現実は夢よりもつと美しいと言ひきることができるのだ」"
"6081","sakaguchi","fubuki_monogatari.txt","卓一の眼は歓喜のためにかがやいた。"
"6082","sakaguchi","fubuki_monogatari.txt","然し美しさへの讃嘆のために、さらに清らかにかがやいてゐた。"
"6083","sakaguchi","fubuki_monogatari.txt",""
"6084","sakaguchi","fubuki_monogatari.txt","「私ね。"
"6085","sakaguchi","fubuki_monogatari.txt","今日あなたをお訪ねしたほんとの理由は……」と、澄江は言ひかけて、口をつぐんだ。"
"6086","sakaguchi","fubuki_monogatari.txt","然し顔に安らかな色が浮かんでゐた。"
"6087","sakaguchi","fubuki_monogatari.txt","「理由があつたの」"
"6088","sakaguchi","fubuki_monogatari.txt","「…………」"
"6089","sakaguchi","fubuki_monogatari.txt","「私ね。"
"6090","sakaguchi","fubuki_monogatari.txt","入口のところで、あなたの顔を一目みたら、ひとこと怒鳴つて、そしてさつさと帰へらうと思つてゐたのよ」"
"6091","sakaguchi","fubuki_monogatari.txt","「何を怒鳴らうと思つてゐたの」"
"6092","sakaguchi","fubuki_monogatari.txt","「愛してゐるのよつて。"
"6093","sakaguchi","fubuki_monogatari.txt","それだけ」"
"6094","sakaguchi","fubuki_monogatari.txt","澄江は自らを憐れむやうな、けれどもまた蔑むやうな、疲れたかすかな笑ひを浮かべた。"
"6095","sakaguchi","fubuki_monogatari.txt",""
"6096","sakaguchi","fubuki_monogatari.txt","「四年間。"
"6097","sakaguchi","fubuki_monogatari.txt","私あなたのことばかり考へつづけてゐたんだもの。"
"6098","sakaguchi","fubuki_monogatari.txt","いつもあなたが私のそばにゐるやうな気がしてゐたわ。"
"6099","sakaguchi","fubuki_monogatari.txt","いたずらをしても一々叱られるやうな気がしたの。"
"6100","sakaguchi","fubuki_monogatari.txt","夢でだつて、なんべんあなたを呼びつづけたか知れないのだもの」"
"6101","sakaguchi","fubuki_monogatari.txt","俺だつて、もとより同じことだつたと卓一は思ふのだつた。"
"6102","sakaguchi","fubuki_monogatari.txt","ただこの人ほど美しくそして立派な態度ではなかつた。"
"6103","sakaguchi","fubuki_monogatari.txt",""
"6104","sakaguchi","fubuki_monogatari.txt","「僕は」と卓一は感動に盲ひて言つた。"
"6105","sakaguchi","fubuki_monogatari.txt","「人間の現実は常に低俗をまぬかれないものだと思つてゐた。"
"6106","sakaguchi","fubuki_monogatari.txt","そして現実から遊離した抽象世界でどうにか低俗な現実を救ふことができるのだと思ひこんでゐたのだつた。"
"6107","sakaguchi","fubuki_monogatari.txt","そして現実を夢のもつ香気にまで高めやうとしてゐたのだ。"
"6108","sakaguchi","fubuki_monogatari.txt","見当違ひの話だつたね。"
"6109","sakaguchi","fubuki_monogatari.txt","怖れを知らない不遜な間違ひを犯してゐたのがやうやくはつきり分かつたのだ。"
"6110","sakaguchi","fubuki_monogatari.txt","僕は今まで卑小な一個の人間が、君が、こんなに美しくそして高貴なものだとは夢にも思ふことがなかつた。"
"6111","sakaguchi","fubuki_monogatari.txt","思ひうることすら諦らめてゐたほどだつた」"
"6112","sakaguchi","fubuki_monogatari.txt","そして卓一は我を忘れて叫ぶのだつた。"
"6113","sakaguchi","fubuki_monogatari.txt",""
"6114","sakaguchi","fubuki_monogatari.txt","「僕は君と二人なら、絶海の孤島に永住することも怖れない確信がついたやうな思ひがするのだ」"
"6115","sakaguchi","fubuki_monogatari.txt","なんといふ無茶な誇張を言ふのだらうと卓一は呆れもした。"
