"","auth","piece","line"
"0","sakaguchi","fubuki_monogatari.txt","吹雪物語"
"1","sakaguchi","fubuki_monogatari.txt","――夢と知性――"
"2","sakaguchi","fubuki_monogatari.txt","坂口安吾"
"3","sakaguchi","fubuki_monogatari.txt",""
"4","sakaguchi","fubuki_monogatari.txt","-------------------------------------------------------"
"5","sakaguchi","fubuki_monogatari.txt","【テキスト中に現れる記号について】"
"6","sakaguchi","fubuki_monogatari.txt",""
"7","sakaguchi","fubuki_monogatari.txt","《》：ルビ"
"8","sakaguchi","fubuki_monogatari.txt","（例）硝子"
"9","sakaguchi","fubuki_monogatari.txt",""
"10","sakaguchi","fubuki_monogatari.txt","｜：ルビの付く文字列の始まりを特定する記号"
"11","sakaguchi","fubuki_monogatari.txt","（例）着任｜匆々"
"12","sakaguchi","fubuki_monogatari.txt",""
"13","sakaguchi","fubuki_monogatari.txt","：入力者注主に外字の説明や、傍点の位置の指定"
"14","sakaguchi","fubuki_monogatari.txt","（数字は、JIS X 0213の面区点番号またはUnicode、底本のページと行数）"
"15","sakaguchi","fubuki_monogatari.txt","（例）※"
"16","sakaguchi","fubuki_monogatari.txt",""
"17","sakaguchi","fubuki_monogatari.txt","／＼：二倍の踊り字（「く」を縦に長くしたような形の繰り返し記号）"
"18","sakaguchi","fubuki_monogatari.txt","（例）ヂャラ／＼"
"19","sakaguchi","fubuki_monogatari.txt","-------------------------------------------------------"
"20","sakaguchi","fubuki_monogatari.txt",""
"21","sakaguchi","fubuki_monogatari.txt","一"
"22","sakaguchi","fubuki_monogatari.txt",""
"23","sakaguchi","fubuki_monogatari.txt","一九三×年のことである。"
"24","sakaguchi","fubuki_monogatari.txt","新潟も変つた。"
"25","sakaguchi","fubuki_monogatari.txt","雪国の気候の暗さは、真夏の明るい空の下でも、道路や、建築や、行き交ふ人々の表情の中に、なにがなし疲れの翳を澱ませて、ひそんでゐる。"
"26","sakaguchi","fubuki_monogatari.txt","さういふ特殊な気候の暗さや、疲れの翳が、もはや殆んど街の表情に見られないのだ。"
"27","sakaguchi","fubuki_monogatari.txt","まづ第一に鋪装道路。"
"28","sakaguchi","fubuki_monogatari.txt","表通りの商店街は、どの都市にもそつくり見かけるあたりまへの商店建築が立ちならび、壁面よりも硝子の多い軽快な洋風商店、ビルディング、ネオンサイン、酒場、同じことだ。"
"29","sakaguchi","fubuki_monogatari.txt","築港の完成。"
"30","sakaguchi","fubuki_monogatari.txt","満洲国との新航路開通といふこの市の特殊な事情もあるけれども、変つたのは、あながちこの市の話だけではないらしい。"
"31","sakaguchi","fubuki_monogatari.txt","欧洲で言へば、世界大戦を境にして、と言ふところだが、日本では、恐らく関東大震災を境にして、と言ふのであらう。"
"32","sakaguchi","fubuki_monogatari.txt","日本中の都会の顔が、例外なしに変つたらしい。"
"33","sakaguchi","fubuki_monogatari.txt",""
"34","sakaguchi","fubuki_monogatari.txt","青木卓一は久々に故郷へ戻りついた夜、叔父の田巻左門と大寺老人に案内されて、食事がてら街を歩いた。"
"35","sakaguchi","fubuki_monogatari.txt","遠来の客をもてなすためといふよりは、老来益々出不精で、夜街の賑ひを忘れてゐる左門叔父の好奇心が強かつた。"
"36","sakaguchi","fubuki_monogatari.txt","三人はダンスホールへもぐりこんだ。"
"37","sakaguchi","fubuki_monogatari.txt","これも亦東京と同じことだ。"
"38","sakaguchi","fubuki_monogatari.txt","廻転する光の色が踊りにつれて変化する。"
"39","sakaguchi","fubuki_monogatari.txt","違つてゐるのは踊りての数が少いだけのことである。"
"40","sakaguchi","fubuki_monogatari.txt","と、踊りに来合せてゐた幼馴染の一婦人が、卓一を認めて呼びかけた。"
"41","sakaguchi","fubuki_monogatari.txt","その顔は卓一の記憶の底をつきまくり、ひつくりかへしても、雲をつきまはすと同じやうに、手掛りのないものだつた。"
"42","sakaguchi","fubuki_monogatari.txt","え、俺の幼馴染といへば仔豚か鴉のやうな薄汚い餓鬼ばかりぢやないか。"
"43","sakaguchi","fubuki_monogatari.txt","誰がいつたいこんなバタ臭い麗人に変つたのだらう？卓一は呆れかへつて女の顔を視凝めつづけた。"
"44","sakaguchi","fubuki_monogatari.txt",""
"45","sakaguchi","fubuki_monogatari.txt","「私の顔、思ひだせないでせう」女は笑つた。"
"46","sakaguchi","fubuki_monogatari.txt","「あしたの今頃この場所でまた会ひませうね。"
"47","sakaguchi","fubuki_monogatari.txt","お待ちしてますわ」"
"48","sakaguchi","fubuki_monogatari.txt","女はくるりと振向いて行つてしまつた。"
"49","sakaguchi","fubuki_monogatari.txt",""
"50","sakaguchi","fubuki_monogatari.txt","「私はかういふ艶つぽい場所が好きだ。"
"51","sakaguchi","fubuki_monogatari.txt","芝居、ダンス、活動、待合。"
"52","sakaguchi","fubuki_monogatari.txt","総じて人だまりと女のゐる場所はみんないいね。"
"53","sakaguchi","fubuki_monogatari.txt","一晩に一場所づつ、粋な場所で遊んでくらして、それからゆつくり寝るのさ。"
"54","sakaguchi","fubuki_monogatari.txt","ほかに娯しみもないのでね」"
"55","sakaguchi","fubuki_monogatari.txt","と大寺老人は卓一にささやいた。"
"56","sakaguchi","fubuki_monogatari.txt","さうして二十数貫の巨躯をゆすぶり、笑ひだした。"
"57","sakaguchi","fubuki_monogatari.txt","左門も大寺老人ももはや七十を越えてゐた。"
"58","sakaguchi","fubuki_monogatari.txt","左門は痩せ衰へてゐたが、珍奇な国の魅力のために、眼は生き生きと輝き、軽い上気がやつれた顔を若返らせてゐるやうだつた。"
"59","sakaguchi","fubuki_monogatari.txt",""
"60","sakaguchi","fubuki_monogatari.txt","「え、誰だ。"
"61","sakaguchi","fubuki_monogatari.txt","さつきの婦人は。"
"62","sakaguchi","fubuki_monogatari.txt","あれも踊り子のひとりかね？」と左門がきいた。"
"63","sakaguchi","fubuki_monogatari.txt",""
"64","sakaguchi","fubuki_monogatari.txt","「僕も見当がつかないのです。"
"65","sakaguchi","fubuki_monogatari.txt","幼馴染だといふのですが……」"
"66","sakaguchi","fubuki_monogatari.txt","卓一は久々に故郷へ帰つた思ひよりも、見知らぬ土地へ突きはなされた旅人のむせるやうな異国情趣をむしろ感じた。"
"67","sakaguchi","fubuki_monogatari.txt",""
"68","sakaguchi","fubuki_monogatari.txt","「まるで変つたものでせうが……」と大寺老人が左門に言つた。"
"69","sakaguchi","fubuki_monogatari.txt",""
"70","sakaguchi","fubuki_monogatari.txt","「まるで変つたね。"
"71","sakaguchi","fubuki_monogatari.txt","然し、変るのがあたりまへだ」と左門は自分の老齢を蔑むやうな苦笑をうかべた。"
"72","sakaguchi","fubuki_monogatari.txt","「卓一お前も踊つたらどうだ」"
"73","sakaguchi","fubuki_monogatari.txt","「生憎踊りを知らないのです。"
"74","sakaguchi","fubuki_monogatari.txt","ダンスホールへ這入つたのが、生れてこのかたこれが始めての経験なんです」"
"75","sakaguchi","fubuki_monogatari.txt","「東京で何をして暮してきたのだ。"
"76","sakaguchi","fubuki_monogatari.txt","お前もやつぱり穴熊の一族か」"
"77","sakaguchi","fubuki_monogatari.txt","左門の眼は踊る人々を飽くこともなく追ひつづけた。"
"78","sakaguchi","fubuki_monogatari.txt","少年の好奇心に燃えた眼だ。"
"79","sakaguchi","fubuki_monogatari.txt","なんて新鮮な眼付だらう、と卓一は思つた。"
"80","sakaguchi","fubuki_monogatari.txt","東京へ脱ぎすててきた耽溺の日々もただ退屈でしかなかつた。"
"81","sakaguchi","fubuki_monogatari.txt","旅も、旅愁も、退屈つづきの重苦しさの底にあつた。"
"82","sakaguchi","fubuki_monogatari.txt","故郷も、然し新鮮ではない。"
"83","sakaguchi","fubuki_monogatari.txt","俺にはもはや少年がないのだ。"
"84","sakaguchi","fubuki_monogatari.txt",""
"85","sakaguchi","fubuki_monogatari.txt","――この老人にこんな新鮮な少年の眼がどうして残つてゐたのだらう……"
"86","sakaguchi","fubuki_monogatari.txt","それが再び彼に異国の思ひを強めた。"
"87","sakaguchi","fubuki_monogatari.txt",""
"88","sakaguchi","fubuki_monogatari.txt","「大寺老」と左門はよんだ。"
"89","sakaguchi","fubuki_monogatari.txt","「あなたは時々ここへ遊びにきて、踊つた例はないのかね？」"
"90","sakaguchi","fubuki_monogatari.txt","「さて、そこだね。"
"91","sakaguchi","fubuki_monogatari.txt","長生きの恥かきとはここの理窟だ。"
"92","sakaguchi","fubuki_monogatari.txt","いつぺんだけ踊つてみたことがありましたがね（と老人は急に当時を思ひだして、暫くは笑ひがだらしなく止まらなかつた）年寄りのくせに、豚のやうに太つてしまふと、赤んぼの足つきと同じやうにヨチヨチして、器用なうごきはできないものだ。"
"93","sakaguchi","fubuki_monogatari.txt","女の子が怒つたね。"
"94","sakaguchi","fubuki_monogatari.txt","あはは。"
"95","sakaguchi","fubuki_monogatari.txt","私はかうして見てゐるだけで、なんと言つたね。"
"96","sakaguchi","fubuki_monogatari.txt","卓一さん。"
"97","sakaguchi","fubuki_monogatari.txt","その、ホルモンといつたかね。"
"98","sakaguchi","fubuki_monogatari.txt","そのたしになりますからな」"
"99","sakaguchi","fubuki_monogatari.txt",""
"100","sakaguchi","fubuki_monogatari.txt","その翌日から卓一は越後新報へ出社した。"
"101","sakaguchi","fubuki_monogatari.txt","卓一はこの新聞の編輯長に招かれたのだ。"
"102","sakaguchi","fubuki_monogatari.txt","前編輯長の野々宮が事務を教えるために、出社してゐた。"
"103","sakaguchi","fubuki_monogatari.txt",""
"104","sakaguchi","fubuki_monogatari.txt","「僕は始め人並みの抱負をもつてゐたのです。"
"105","sakaguchi","fubuki_monogatari.txt","然し一年。"
"106","sakaguchi","fubuki_monogatari.txt","恐らく一ヶ月といふ方が、むしろ正しいかも知れません。"
"107","sakaguchi","fubuki_monogatari.txt","抱負は、すでに、なかつたのですね」野々宮は笑つた。"
"108","sakaguchi","fubuki_monogatari.txt","卓一と同じ年齢のころ、彼も招かれてきたのであつた。"
"109","sakaguchi","fubuki_monogatari.txt","「それからは、ニュースを編輯するだけの仕事でした。"
"110","sakaguchi","fubuki_monogatari.txt","地方新聞は、青年の野望と抱負を傾けても、歯の立ちがたい種類のものです。"
"111","sakaguchi","fubuki_monogatari.txt","抱負のうすれた毎日に、この土地の長い冬の暗らさほど、憂鬱なものはありません。"
"112","sakaguchi","fubuki_monogatari.txt","毎日低い灰色の空に押しつけられてゐると、気違ひにならないことが、不思議な気すら起るのですね。"
"113","sakaguchi","fubuki_monogatari.txt","この薄暗らい編輯室に一日坐つてゐるだけで、何か微塵に破壊したくなるやうな、苛立ちを覚えずにはゐられなくなつてくるのです」"
"114","sakaguchi","fubuki_monogatari.txt","野々宮は、やつれてゐた。"
"115","sakaguchi","fubuki_monogatari.txt","肉体も虚弱であつたが、神経衰弱の気味ださうな。"
"116","sakaguchi","fubuki_monogatari.txt","東京に彼の赴任を待つてゐる新らたな仕事があるのだが、恋のために、動けなかつた。"
"117","sakaguchi","fubuki_monogatari.txt","彼の妻君は、刃物を揮ひさうだつた。"
"118","sakaguchi","fubuki_monogatari.txt",""
"119","sakaguchi","fubuki_monogatari.txt","「むしろ抱負が、この土地では、無役な障碍にしかすぎないのです。"
"120","sakaguchi","fubuki_monogatari.txt","地方新聞が、地方的な啓蒙の役割をもつてゐたのは、明治中年の頃のことで、今日では、地方のニュースを伝えるだけが、精一杯の仕事ですね。"
"121","sakaguchi","fubuki_monogatari.txt","そのほかの大きな仕事は、東京の大新聞が、するのです。"
"122","sakaguchi","fubuki_monogatari.txt","東京の大新聞が地方に販路をひらいて以来、どれだけ仕事をしてみても、すでに、信用がないのです。"
"123","sakaguchi","fubuki_monogatari.txt","むしろ抱負が、誤解の理由になるだけでせう。"
"124","sakaguchi","fubuki_monogatari.txt","この仕事で生きるためには、自分を殺すことですね。"
"125","sakaguchi","fubuki_monogatari.txt","それだけが、自分を生かすことなのです」"
"126","sakaguchi","fubuki_monogatari.txt","野々宮の悲観的な述懐も、卓一の心を殆んど悲しませはしなかつた。"
"127","sakaguchi","fubuki_monogatari.txt","この仕事は、彼にとつて、もともと息ぬきの心算でしかなかつたのだ。"
"128","sakaguchi","fubuki_monogatari.txt","この仕事が、ずるずるべつたり、一生のものになるにしても、ままよ、一生が息ぬきだ。"
"129","sakaguchi","fubuki_monogatari.txt",""
"130","sakaguchi","fubuki_monogatari.txt","「僕に抱負はないのです。"
"131","sakaguchi","fubuki_monogatari.txt","生活が、ひとつの旅行にすぎないのですね。"
"132","sakaguchi","fubuki_monogatari.txt","生活の変化。"
"133","sakaguchi","fubuki_monogatari.txt","環境の変化。"
"134","sakaguchi","fubuki_monogatari.txt","それを一途に考へてゐたのです。"
"135","sakaguchi","fubuki_monogatari.txt","環境を変えさえすれば、すでに道がひらけてゐる理窟なのだ、と今も信じてゐるのです。"
"136","sakaguchi","fubuki_monogatari.txt","そして、流れてきたのです。"
"137","sakaguchi","fubuki_monogatari.txt","思ひ通りに仕事を運んだり、変化させやうといふのではなく、仕事の通りに自分を変え、順応しようといふのですね。"
"138","sakaguchi","fubuki_monogatari.txt","阿呆のやうに暮らすつもりにほかなりません」"
"139","sakaguchi","fubuki_monogatari.txt","と、卓一は笑つて言つた。"
"140","sakaguchi","fubuki_monogatari.txt",""
"141","sakaguchi","fubuki_monogatari.txt","然し希望の裏打ちのない若者の行為があり得ようか。"
"142","sakaguchi","fubuki_monogatari.txt","むろん有り得る筈はない。"
"143","sakaguchi","fubuki_monogatari.txt","そして卓一にも、やつぱり希望はあるのであらう。"
"144","sakaguchi","fubuki_monogatari.txt","然し絶望に変形しがちな、疲れきつた希望に就いて語ることは、人性と謎に就いて語ることにほかならないのだ。"
"145","sakaguchi","fubuki_monogatari.txt","この解きがたい人性に就いて。"
"146","sakaguchi","fubuki_monogatari.txt","自信の壊滅。"
"147","sakaguchi","fubuki_monogatari.txt","野望。"
"148","sakaguchi","fubuki_monogatari.txt","そして成功のあこがれ。"
"149","sakaguchi","fubuki_monogatari.txt","必死。"
"150","sakaguchi","fubuki_monogatari.txt","けれども安らかな時間。"
"151","sakaguchi","fubuki_monogatari.txt","第二の希望。"
"152","sakaguchi","fubuki_monogatari.txt","等々。"
"153","sakaguchi","fubuki_monogatari.txt","それはもう人性に訊ねるがいい。"
"154","sakaguchi","fubuki_monogatari.txt","個人の知つたことではないのだ。"
"155","sakaguchi","fubuki_monogatari.txt","卓一は心に叫ばずにゐられなかつた。"
"156","sakaguchi","fubuki_monogatari.txt","息ぬきだ。"
"157","sakaguchi","fubuki_monogatari.txt","もはや俺の一生が。"
"158","sakaguchi","fubuki_monogatari.txt",""
"159","sakaguchi","fubuki_monogatari.txt","然し卓一を故郷へ呼び寄せた心のひとつに、女の面影を消し去ることができなかつた。"
"160","sakaguchi","fubuki_monogatari.txt","彼はそれを意識したが、意識がそれにふれることを、余り好んでゐなかつた。"
"161","sakaguchi","fubuki_monogatari.txt",""
"162","sakaguchi","fubuki_monogatari.txt","田巻左門に一男と三女があつた。"
"163","sakaguchi","fubuki_monogatari.txt","三女はそれぞれ他家へかたづき、一男は、結婚まもなく夭折した。"
"164","sakaguchi","fubuki_monogatari.txt","子供はなかつた。"
"165","sakaguchi","fubuki_monogatari.txt","嫁の文子は、まだ若かつた。"
"166","sakaguchi","fubuki_monogatari.txt","恐らく三女のひとりから、養子をもらうべきだらう。"
"167","sakaguchi","fubuki_monogatari.txt","そして文子は実家へ帰へすべきだつた。"
"168","sakaguchi","fubuki_monogatari.txt","然し左門は文子を手離す勇気がなかつた。"
"169","sakaguchi","fubuki_monogatari.txt","俺は、いよいよ、ひとりになる。"
"170","sakaguchi","fubuki_monogatari.txt","……まるで棄てられてしまふやうな、切ない思ひがするのであつた。"
"171","sakaguchi","fubuki_monogatari.txt","そして文子の人柄に、手離しがたい愛着を覚えざるを得ないのだ。"
"172","sakaguchi","fubuki_monogatari.txt","むしろ文子に聟を探さう、左門は思つた。"
"173","sakaguchi","fubuki_monogatari.txt","そして甥の卓一をその候補者に選んだのだ。"
"174","sakaguchi","fubuki_monogatari.txt","それは左門の胸にかくした計画だつた。"
"175","sakaguchi","fubuki_monogatari.txt","卓一と文子はまつたく知らないことだつた。"
"176","sakaguchi","fubuki_monogatari.txt",""
"177","sakaguchi","fubuki_monogatari.txt","折から越後新報が野々宮の後任を物色中のことを知ると、彼にゆかりの新聞のこととて、難なく甥を後釜にすえることができたのだ。"
"178","sakaguchi","fubuki_monogatari.txt","そして卓一は帰郷した。"
"179","sakaguchi","fubuki_monogatari.txt","文子のことは知らないのだ。"
"180","sakaguchi","fubuki_monogatari.txt","これだけで、ひとつは済んだ。"
"181","sakaguchi","fubuki_monogatari.txt","次は自然にまかせることだ、と左門は肚に思つてゐた。"
"182","sakaguchi","fubuki_monogatari.txt","もし卓一が文子を好いたら、そして文子が卓一を好いたら、彼を養子に迎へよう。"
"183","sakaguchi","fubuki_monogatari.txt","万事は自然のなりゆき次第だ。"
"184","sakaguchi","fubuki_monogatari.txt","然し文子の温順な性質や、容貌の美しさを思ふにつけて、自然にまかせてをくことが、いつとなく二人を結ぶ同じ希望になることだと左門は思つた。"
"185","sakaguchi","fubuki_monogatari.txt","きつと自然にさうなるだらう。"
"186","sakaguchi","fubuki_monogatari.txt","さういふ安堵がわかるのである。"
"187","sakaguchi","fubuki_monogatari.txt","とくにひどく落付いた、まるで落胆であるかのやうな、安堵を感じる思ひがする。"
"188","sakaguchi","fubuki_monogatari.txt","俺が口をだすことはない。"
"189","sakaguchi","fubuki_monogatari.txt","誰が口をだしてもならぬ。"
"190","sakaguchi","fubuki_monogatari.txt","自然が二人を結んでくれるに相違ないと思ふのだつた。"
"191","sakaguchi","fubuki_monogatari.txt","いはば左門の胸底に、左門も知らない小さな嫉妬がかくされてゐるせゐかも知れない。"
"192","sakaguchi","fubuki_monogatari.txt","さうしてやりたい反面に、さうさせたくない悲しい思ひが、ひそかに燃えてゐることを想像してもいいのであつた。"
"193","sakaguchi","fubuki_monogatari.txt",""
"194","sakaguchi","fubuki_monogatari.txt","「え。"
"195","sakaguchi","fubuki_monogatari.txt","卓一さん」三人が夜の散歩にでかけるとき、大寺老人が卓一に言つた。"
"196","sakaguchi","fubuki_monogatari.txt","「あの若い後家さん綺麗だと思はないかね。"
"197","sakaguchi","fubuki_monogatari.txt","え。"
"198","sakaguchi","fubuki_monogatari.txt","つやつぽいね。"
"199","sakaguchi","fubuki_monogatari.txt","水々しいといふ奴だ。"
"200","sakaguchi","fubuki_monogatari.txt","俺が三十年若かつたら。"
"201","sakaguchi","fubuki_monogatari.txt","いや。"
"202","sakaguchi","fubuki_monogatari.txt","男子一生の大後悔さ。"
"203","sakaguchi","fubuki_monogatari.txt","さて、そこだ。"
"204","sakaguchi","fubuki_monogatari.txt","ここは一番、あんたひとつ口説くところだ。"
"205","sakaguchi","fubuki_monogatari.txt","誰に遠慮がゐるものか」"
"206","sakaguchi","fubuki_monogatari.txt","卓一は文子を見るのがその日はじめてのことだつた。"
"207","sakaguchi","fubuki_monogatari.txt","そして文子を見てゐるうちに、左門が自分を故郷へよんだ魂胆が、分りかけてきたのであつた。"
"208","sakaguchi","fubuki_monogatari.txt","この女と、やがて一緒になるだらう。"
"209","sakaguchi","fubuki_monogatari.txt","無気力な、ぬきさしならね予感のために暗らかつた。"
"210","sakaguchi","fubuki_monogatari.txt",""
"211","sakaguchi","fubuki_monogatari.txt","然し女。"
"212","sakaguchi","fubuki_monogatari.txt","卓一を故郷へよんだ面影は。"
"213","sakaguchi","fubuki_monogatari.txt","それは文子ではなかつたのだ。"
"214","sakaguchi","fubuki_monogatari.txt",""
"215","sakaguchi","fubuki_monogatari.txt","四年前のことだつた。"
"216","sakaguchi","fubuki_monogatari.txt",""
"217","sakaguchi","fubuki_monogatari.txt","卓一は古川澄江と知りあつた。"
"218","sakaguchi","fubuki_monogatari.txt","澄江も新潟をふるさとに持ち、ピアノの修業に没頭してゐた。"
"219","sakaguchi","fubuki_monogatari.txt","人々は、二人の結婚を、信じてゐた。"
"220","sakaguchi","fubuki_monogatari.txt","二人のひたむきな情熱によつて、結婚だけが、当然のことに思はれたのだ。"
"221","sakaguchi","fubuki_monogatari.txt",""
"222","sakaguchi","fubuki_monogatari.txt","卓一は、然し自然に澄江から離れていつた。"
"223","sakaguchi","fubuki_monogatari.txt","まるで澄江に裏切られ、棄てられたやうな、深い嘆きに沈むのだつた。"
"224","sakaguchi","fubuki_monogatari.txt","然し澄江から離れて行くのは、卓一なのだ。"
"225","sakaguchi","fubuki_monogatari.txt","澄江は愛しつづけてゐた。"
"226","sakaguchi","fubuki_monogatari.txt","卓一もそれを知つてゐた。"
"227","sakaguchi","fubuki_monogatari.txt","然し卓一の胸底を、常に裏切られた切なさが、去らなかつた。"
"228","sakaguchi","fubuki_monogatari.txt","その切なさを、どうすることもできないのだ。"
"229","sakaguchi","fubuki_monogatari.txt","次第に澄江から遠退くことに焦りだし、心は自然に荒みを深かめて、自暴自棄に落ちてゐた。"
"230","sakaguchi","fubuki_monogatari.txt",""
"231","sakaguchi","fubuki_monogatari.txt","スタンダアルは、メチルドに寄せる愛に就いて語ることを、かなり好んでゐたらしい。"
"232","sakaguchi","fubuki_monogatari.txt","二人に肉体の関係はなかつた。"
"233","sakaguchi","fubuki_monogatari.txt","彼がメチルドに会つたのは、その生涯の極めてわづかな時間のことだ。"
"234","sakaguchi","fubuki_monogatari.txt","特に深く立ち入つて、愛の告白を語り合つた仲でもない。"
"235","sakaguchi","fubuki_monogatari.txt","然し彼は失意のとき、また、そぞろ歩きのひととき、この恋を知りそめてのちの多くの時間は、メチルドの思ひ出によつて豊かになり、救はれもしたと言ふのであつた。"
"236","sakaguchi","fubuki_monogatari.txt","その恋は、人の世にいれられないが、神の前に許るされるであらう、と好みの誇大な表現で告白する。"
"237","sakaguchi","fubuki_monogatari.txt","この愛すべき恋愛道の大家は、それゆえ甚だ常識的でもあるのである。"
"238","sakaguchi","fubuki_monogatari.txt","彼は酔ふことが好きなのだ。"
"239","sakaguchi","fubuki_monogatari.txt","そして時代の精神が、恋の酔ひをさまさせるほど、苛酷でなかつた。"
"240","sakaguchi","fubuki_monogatari.txt",""
"241","sakaguchi","fubuki_monogatari.txt","まことの愛は、怖れのなかに、あるのだらうか。"
"242","sakaguchi","fubuki_monogatari.txt","これも奇矯だ。"
"243","sakaguchi","fubuki_monogatari.txt","然し愛情は甘くないのだ。"
"244","sakaguchi","fubuki_monogatari.txt","また愛情は、肉体を超えて、有りうるだらうか。"
"245","sakaguchi","fubuki_monogatari.txt","むしろまことの愛情は、肉体を怖れることがないだらうか。"
"246","sakaguchi","fubuki_monogatari.txt","これはどうも理解のできない節がある。"
"247","sakaguchi","fubuki_monogatari.txt","我々の精神内容には、あらゆる葛藤の歴史を賭けた複雑なからくりが隠されてゐるのだ。"
