"","auth","piece","line"
"3006","sakaguchi","fubuki_monogatari.txt",""
"3007","sakaguchi","fubuki_monogatari.txt","「貴様の髪の毛も切つてくれるぞ！踊る足も折つてくれるぞ！」"
"3008","sakaguchi","fubuki_monogatari.txt","なにはともあれ友愛が高処に於て変形したやみがたい怒りであつたに相違ない。"
"3009","sakaguchi","fubuki_monogatari.txt",""
"3010","sakaguchi","fubuki_monogatari.txt","他巳吉は襖をあけた。"
"3011","sakaguchi","fubuki_monogatari.txt","そして襖の間から剽軽な首だけ出して、二人を見た。"
"3012","sakaguchi","fubuki_monogatari.txt","突然彼は笑ひはじめた。"
"3013","sakaguchi","fubuki_monogatari.txt","そして襖を開け放すと、部屋の中央へのめるやうに転がりこんだ。"
"3014","sakaguchi","fubuki_monogatari.txt","彼は脾腹を両手で押へた。"
"3015","sakaguchi","fubuki_monogatari.txt","伸び、ちぢみ、ころげ、うつむき、あほむいた。"
"3016","sakaguchi","fubuki_monogatari.txt","笑ひは杜切れ、またつづいた。"
"3017","sakaguchi","fubuki_monogatari.txt","もはや悲鳴のやうだつた。"
"3018","sakaguchi","fubuki_monogatari.txt","然し笑ひは呼吸と呼吸の隙間を破つて溢れだしてくるのであつた。"
"3019","sakaguchi","fubuki_monogatari.txt","そして長い苦闘ののち、彼は最後に死の真似をして見せたのである。"
"3020","sakaguchi","fubuki_monogatari.txt","かうして、ひとつの年が終つた。"
"3021","sakaguchi","fubuki_monogatari.txt",""
"3022","sakaguchi","fubuki_monogatari.txt","新年がきた。"
"3023","sakaguchi","fubuki_monogatari.txt",""
"3024","sakaguchi","fubuki_monogatari.txt","世捨人さながらの左門であつたが、さすがに春の三ヶ日はいくらか邸内も賑ふのである。"
"3025","sakaguchi","fubuki_monogatari.txt","来客のひとりに野々宮がゐた。"
"3026","sakaguchi","fubuki_monogatari.txt",""
"3027","sakaguchi","fubuki_monogatari.txt","左門の頭を離れない言葉があつた。"
"3028","sakaguchi","fubuki_monogatari.txt","他巳吉の喚きなのである。"
"3029","sakaguchi","fubuki_monogatari.txt","どこかの嫁があひびきにお出かけだとさ。"
"3030","sakaguchi","fubuki_monogatari.txt","他巳吉はたしかにはつきりさう喚いたのだ。"
"3031","sakaguchi","fubuki_monogatari.txt","男はもぐりの医者だとさ。"
"3032","sakaguchi","fubuki_monogatari.txt","名題の女たらしだとさ。"
"3033","sakaguchi","fubuki_monogatari.txt","と。"
"3034","sakaguchi","fubuki_monogatari.txt","――かねて左門の心にも、それに類した憂ひの翳はうごいてゐた。"
"3035","sakaguchi","fubuki_monogatari.txt","まさかに、と、然し左門は打消さずにはゐられなかつた。"
"3036","sakaguchi","fubuki_monogatari.txt","他巳吉の言葉であるために、彼は一層反抗したいのであつた。"
"3037","sakaguchi","fubuki_monogatari.txt",""
"3038","sakaguchi","fubuki_monogatari.txt","他巳吉は出来た人ではあるが――左門は思つた。"
"3039","sakaguchi","fubuki_monogatari.txt","そして苦労人ではあるが、幼小からの辛苦のために、いくらか心もねぢくれてゐる。"
"3040","sakaguchi","fubuki_monogatari.txt","右と言へば左と言ひたい我儘な人だ。"
"3041","sakaguchi","fubuki_monogatari.txt","そして人をいやがらせるのも好物らしい。"
"3042","sakaguchi","fubuki_monogatari.txt","子供のやうな人でもあつた。"
"3043","sakaguchi","fubuki_monogatari.txt",""
"3044","sakaguchi","fubuki_monogatari.txt","あの放言は、秘策を凝らしたつくりごとに相違ないと左門は思つた。"
"3045","sakaguchi","fubuki_monogatari.txt","否。"
"3046","sakaguchi","fubuki_monogatari.txt","思はずにゐられないのだ。"
"3047","sakaguchi","fubuki_monogatari.txt","あの放言をどうして信じてゐられよう。"
"3048","sakaguchi","fubuki_monogatari.txt","余命いくばくもないこの老骨の残りの一滴の血潮にかけても。"
"3049","sakaguchi","fubuki_monogatari.txt",""
"3050","sakaguchi","fubuki_monogatari.txt","然し彼は他巳吉に一応訊きただしてみたいのだつた。"
"3051","sakaguchi","fubuki_monogatari.txt","そのどこまでが真実であるか、と。"
"3052","sakaguchi","fubuki_monogatari.txt","然しそれができないのだ。"
"3053","sakaguchi","fubuki_monogatari.txt","どのやうにしても、できないのだつた。"
"3054","sakaguchi","fubuki_monogatari.txt","やつぱり不安があるのであつた。"
"3055","sakaguchi","fubuki_monogatari.txt","一足すべりかけたら、どこへ行くのか分らない。"
"3056","sakaguchi","fubuki_monogatari.txt","巨大さのゆえに、その実体すら感じかねる不安であつた。"
"3057","sakaguchi","fubuki_monogatari.txt","然しやみがたい反抗もあつた。"
"3058","sakaguchi","fubuki_monogatari.txt",""
"3059","sakaguchi","fubuki_monogatari.txt","野々宮のやつれた姿を見ると、左門は一途に親しさのみを感じるのだつた。"
"3060","sakaguchi","fubuki_monogatari.txt","自分の影すら見出すのだ。"
"3061","sakaguchi","fubuki_monogatari.txt","眼高手低が、あの人の恐らく一生の癌だね、と左門は卓一に語つてゐた。"
"3062","sakaguchi","fubuki_monogatari.txt",""
"3063","sakaguchi","fubuki_monogatari.txt","「春がすぎたら、静かな日、私はあなたと語りたい」左門は野々宮に言つた。"
"3064","sakaguchi","fubuki_monogatari.txt","春の賑やかな人々の中に、野々宮のみが悄然としてゐた。"
"3065","sakaguchi","fubuki_monogatari.txt","「平日の静かさが戻つたら、ぜひとも訪ねて欲しいものだね。"
"3066","sakaguchi","fubuki_monogatari.txt","なにせ老人の無聊は涯のない砂径を歩くやうです。"
"3067","sakaguchi","fubuki_monogatari.txt","あなたの訪れを待ちかねてゐませう」"
"3068","sakaguchi","fubuki_monogatari.txt","七草がやうやく過ぎた。"
"3069","sakaguchi","fubuki_monogatari.txt","左門の正月はすでに一段落だつた。"
"3070","sakaguchi","fubuki_monogatari.txt","そして文子は久々に故郷の春へまぢるため、その朝実家へ出発した。"
"3071","sakaguchi","fubuki_monogatari.txt",""
"3072","sakaguchi","fubuki_monogatari.txt","ひとりの午後を迎えると、左門はふと野々宮を訪れる気持になつた。"
"3073","sakaguchi","fubuki_monogatari.txt","ひとたび野々宮のことを思ふと、百年の知己に寄せるかのやうな親しいものを抑へることができなかつた。"
"3074","sakaguchi","fubuki_monogatari.txt","野々宮が執筆中の伝記の主は、二人とも生前左門の親しかつた人々で、その出来栄えは彼に一入興深いものでもあつた。"
"3075","sakaguchi","fubuki_monogatari.txt","眼高手低。"
"3076","sakaguchi","fubuki_monogatari.txt","それはまた、左門の一生の癌でもあつた。"
"3077","sakaguchi","fubuki_monogatari.txt","老ひ、衰えたこの身は捨てて悔ひもないが、左門は思はずにゐられなかつた。"
"3078","sakaguchi","fubuki_monogatari.txt","あの年若い友達の多幸を祈らずにゐられない。"
"3079","sakaguchi","fubuki_monogatari.txt","然し左門が野々宮に寄せるこのやみがたい友情には、恐らくほかに理由もあつたに違ひない。"
"3080","sakaguchi","fubuki_monogatari.txt","それは他巳吉の喚きであつた。"
"3081","sakaguchi","fubuki_monogatari.txt",""
"3082","sakaguchi","fubuki_monogatari.txt","諦らめの極まるところに微した左門であつたけれども、他巳吉のあくどい喚きがもたらしたこの大いなる不安を支えて立つためには、ひとりは余りに弱かつた。"
"3083","sakaguchi","fubuki_monogatari.txt","そして他巳吉の友情も罅のはいつた感じであつた。"
"3084","sakaguchi","fubuki_monogatari.txt","親しすぎ、また狎れすぎた憾みもあらう。"
"3085","sakaguchi","fubuki_monogatari.txt","とにかく心はおのづと逆ふばかりであつた。"
"3086","sakaguchi","fubuki_monogatari.txt","そして不安を分ちあつて支えるためには――むしろ二人の友愛は、不安を深かめ、苛立つために役立つばかりにすぎなかつた。"
"3087","sakaguchi","fubuki_monogatari.txt","新らたな友をもとめずにゐられなかつたに違ひない。"
"3088","sakaguchi","fubuki_monogatari.txt",""
"3089","sakaguchi","fubuki_monogatari.txt","「わづか四五日のことですが、文子を里へ帰したので」左門は野々宮に言つた。"
"3090","sakaguchi","fubuki_monogatari.txt","「このやうに諦らめに慣れた老いぼれですら、身辺にひとつの気配が不足すると、ひとつの力を落したやうな思ひになる。"
"3091","sakaguchi","fubuki_monogatari.txt","幾たびか親しいものを失ふことに慣れてきて、昨今はすでにわが身を失ふことにも諦らめながら、人のみれんはこのやうなものかね」"
"3092","sakaguchi","fubuki_monogatari.txt","左門は遂に心を決して、その一週の不安をもらした。"
"3093","sakaguchi","fubuki_monogatari.txt",""
"3094","sakaguchi","fubuki_monogatari.txt","「うちの文子に男の噂があるさうだが」左門は静かに言つた。"
"3095","sakaguchi","fubuki_monogatari.txt","「もともと私の迂闊であつた。"
"3096","sakaguchi","fubuki_monogatari.txt","人の心は弱いものだね。"
"3097","sakaguchi","fubuki_monogatari.txt","別して女は。"
"3098","sakaguchi","fubuki_monogatari.txt","あやまつことが人の自然の状態なのだ。"
"3099","sakaguchi","fubuki_monogatari.txt","私は自然をいたはりたいが、人の世に生きるためには、不自然を敢てすることが必要なのだね。"
"3100","sakaguchi","fubuki_monogatari.txt","自然であつてならないことも人の世の自然なのだから。"
"3101","sakaguchi","fubuki_monogatari.txt","七十にもなりながら、人の笑ひを招くやうな不明を犯した私がせつない。"
"3102","sakaguchi","fubuki_monogatari.txt","親の慾目といふものもある。"
"3103","sakaguchi","fubuki_monogatari.txt","親の屡々陥り易い弱点に迂闊であつた私がなにより悪いわけだが、また人の世の体裁ぶつたまとまりに、腹も立てたい思ひもあるのだ。"
"3104","sakaguchi","fubuki_monogatari.txt","大寺老人の話によると、文子に男があるとかいふ噂が立つてゐるさうだが、あなたに御気付きのことはないかね。"
"3105","sakaguchi","fubuki_monogatari.txt","大寺老人の話の前から、同じ不安もあるにはあつたが――私は然し文子をとがめることはできない。"
"3106","sakaguchi","fubuki_monogatari.txt","弱い心をむしろ劬はる思ひが激しい」"
"3107","sakaguchi","fubuki_monogatari.txt","野々宮はその後文子と踊つたことが殆んどなかつた。"
"3108","sakaguchi","fubuki_monogatari.txt","文子は知りあひの踊子をたよつて金※舞踏場へでかけるらしい。"
"3109","sakaguchi","fubuki_monogatari.txt","ただ一回の踊りによつて文子は野々宮を嫌つてゐたし、その反撥が鋭く野々宮にひびいてもゐた。"
"3110","sakaguchi","fubuki_monogatari.txt","そして文子の平凡さを厭ふ思ひを強めるのだつた。"
"3111","sakaguchi","fubuki_monogatari.txt","あの女が男にもとめうるものは肉体だけにすぎないだらう。"
"3112","sakaguchi","fubuki_monogatari.txt","ただそれだけの能力が可能の女にすぎないのだ。"
"3113","sakaguchi","fubuki_monogatari.txt","機智もなく、その感情に閃く高いものもなく、そして高いあこがれもないのだ。"
"3114","sakaguchi","fubuki_monogatari.txt","まして愁ひにつながるものは翳もなかつた。"
"3115","sakaguchi","fubuki_monogatari.txt","低俗な男達の玩弄にしか価しない女であらう。"
"3116","sakaguchi","fubuki_monogatari.txt","その平凡さと、無気力すぎる素直さの裏に、男の低俗な意志と劣情によつてのみ歪められ育てられうる動物的な危なさが感じられ、野々宮に不潔の感をいだかせた。"
"3117","sakaguchi","fubuki_monogatari.txt",""
"3118","sakaguchi","fubuki_monogatari.txt","文子とはじめて踊つた夜。"
"3119","sakaguchi","fubuki_monogatari.txt","あれは苦痛な一夜であつたが、夢のやうな一夜でもあつた。"
"3120","sakaguchi","fubuki_monogatari.txt","そして野々宮はその翌日から殆んど文子を忘れてゐた。"
"3121","sakaguchi","fubuki_monogatari.txt","彼に新らたな夢の国がひらかれてゐたから。"
"3122","sakaguchi","fubuki_monogatari.txt","緑の幽かな光をみた深夜の酒場が、翌日の彼の頭に焼きついてゐたのだ。"
"3123","sakaguchi","fubuki_monogatari.txt",""
"3124","sakaguchi","fubuki_monogatari.txt","あのとき、扉を押して暗闇のなかへ這入つてきたのは、確か三人の女達であつたらしい。"
"3125","sakaguchi","fubuki_monogatari.txt","女達は野々宮を認め、たしか叫びをあげかけたやうだ。"
"3126","sakaguchi","fubuki_monogatari.txt","そして騒ぎが起きかけやうとしたらしい。"
"3127","sakaguchi","fubuki_monogatari.txt","然し彼女等は酔漢になれてもゐたし、時ならぬ深夜の酔漢の訪問にもなれてゐた。"
"3128","sakaguchi","fubuki_monogatari.txt","もともと鍵をかけ忘れて出掛けたことが間違ひだつた。"
"3129","sakaguchi","fubuki_monogatari.txt","なぢみの一人が酔ひどれて、迷ひこんで、ねたらしいと思つたのだらう。"
"3130","sakaguchi","fubuki_monogatari.txt",""
"3131","sakaguchi","fubuki_monogatari.txt","「誰よ。"
"3132","sakaguchi","fubuki_monogatari.txt","あんたは」さういふ声にも知り人を予期する心がこもつてゐたのだ。"
"3133","sakaguchi","fubuki_monogatari.txt","燈りがついた。"
"3134","sakaguchi","fubuki_monogatari.txt","そして野々宮は落付いてゐた。"
"3135","sakaguchi","fubuki_monogatari.txt",""
"3136","sakaguchi","fubuki_monogatari.txt","野々宮は静かな声で女達に語つた。"
"3137","sakaguchi","fubuki_monogatari.txt",""
"3138","sakaguchi","fubuki_monogatari.txt","「夜明しの酒店を探してゐたのです。"
"3139","sakaguchi","fubuki_monogatari.txt","ねむることができないから。"
"3140","sakaguchi","fubuki_monogatari.txt","さういふ店がどこかしらにある筈だと思ひこんでもゐたからです。"
"3141","sakaguchi","fubuki_monogatari.txt","街といふ街を歩いたやうな気がするのです」"
"3142","sakaguchi","fubuki_monogatari.txt","「そんな店がありますかつて！」と、洋装した女のひとりが怒つて叫んだ。"
"3143","sakaguchi","fubuki_monogatari.txt","三十前後の年配だつた。"
"3144","sakaguchi","fubuki_monogatari.txt","外套を羽織つてゐたが、腕を袖に通さないので、両袖はだらりと垂れてゆれてゐた。"
"3145","sakaguchi","fubuki_monogatari.txt","奇妙にそれが歴々と彼の印象に残つてゐたのだ。"
"3146","sakaguchi","fubuki_monogatari.txt","この女はいつぱし肩を怒らして、胸のあたりに両腕を組んでゐたやうだ。"
"3147","sakaguchi","fubuki_monogatari.txt","恐らく酒場のマダムであらう。"
"3148","sakaguchi","fubuki_monogatari.txt","怒気いつぱいの、その単純な腹立ちやうが可笑しいのだつた。"
"3149","sakaguchi","fubuki_monogatari.txt",""
"3150","sakaguchi","fubuki_monogatari.txt","「そんな変挺な店がどこの国にありますかつて！」と女は腹立ちまぎれに、もう一度くり返して叫んだ。"
"3151","sakaguchi","fubuki_monogatari.txt","「びつくりさせるぢやないの。"
"3152","sakaguchi","fubuki_monogatari.txt","心臓が破裂したかと思つたわ」"
"3153","sakaguchi","fubuki_monogatari.txt","「あるひは僕の方も」野々宮は笑つて答えた。"
"3154","sakaguchi","fubuki_monogatari.txt","「許しを受けた、静かな安息の場所のひとつに相違ないとうつかり思つてゐたのです。"
"3155","sakaguchi","fubuki_monogatari.txt","ひどく疲れてゐたのです。"
"3156","sakaguchi","fubuki_monogatari.txt","頭が痺れて、思念も杜絶えがちなのです。"
"3157","sakaguchi","fubuki_monogatari.txt","かういふ結果を予想してみた一秒の時間もなかつたのでした。"
"3158","sakaguchi","fubuki_monogatari.txt","この椅子に腰を下して以来、僕の頭を占めてゐた不思議な空虚は、説明の言葉がありません。"
"3159","sakaguchi","fubuki_monogatari.txt","ただ安らかであつたことは、言へるのですけど」"
"3160","sakaguchi","fubuki_monogatari.txt","そのときは長い夢から目覚めた思ひであつたけれども、翌日の心で思ふと、やつぱり夢の中だつた。"
"3161","sakaguchi","fubuki_monogatari.txt","不思議な落付きと安らかさは、あのときもまだ続いてゐたに相違ない。"
"3162","sakaguchi","fubuki_monogatari.txt","二言三言の説明で女達にあの安らかな空虚な憩ひが納得できる筈はない。"
"3163","sakaguchi","fubuki_monogatari.txt","否。"
"3164","sakaguchi","fubuki_monogatari.txt","恐らくすべての人達に。"
"3165","sakaguchi","fubuki_monogatari.txt","自分にすら、すべてが夢のやうなのだから。"
"3166","sakaguchi","fubuki_monogatari.txt",""
"3167","sakaguchi","fubuki_monogatari.txt","「私達が帰らなかつたら、あなたは朝までゐるつもり？」"
"3168","sakaguchi","fubuki_monogatari.txt","女も怪訝の面持だつた。"
"3169","sakaguchi","fubuki_monogatari.txt","然し野々宮の落付きが、危険のなさを女達に伝えることはできたらしい。"
"3170","sakaguchi","fubuki_monogatari.txt","怒気と敵意は、女達に、もはやなかつた。"
"3171","sakaguchi","fubuki_monogatari.txt",""
"3172","sakaguchi","fubuki_monogatari.txt","「まつすぐ帰つておやすみなさい。"
"3173","sakaguchi","fubuki_monogatari.txt","起きてる店はもうないから」女はもはやうるささうに言ふのであつた。"
"3174","sakaguchi","fubuki_monogatari.txt","「夜明しの店なんか、日本中に一軒もないよ」"
"3175","sakaguchi","fubuki_monogatari.txt","女の最後の皮肉な言葉を思ひだすと、野々宮は再び可笑しくなるのであつた。"
"3176","sakaguchi","fubuki_monogatari.txt","単純な、然し生き生きとした魂に、ふれた思ひがするのであつた。"
"3177","sakaguchi","fubuki_monogatari.txt",""
"3178","sakaguchi","fubuki_monogatari.txt","休む店は恐らく地上にないだらう。"
"3179","sakaguchi","fubuki_monogatari.txt","野々宮に安らかなものが流れてゐた。"
"3180","sakaguchi","fubuki_monogatari.txt","そして彼は呟いた。"
"3181","sakaguchi","fubuki_monogatari.txt","地上に休む所はない。"
"3182","sakaguchi","fubuki_monogatari.txt","恐らく単純な魂の宿る家をほかにしては。"
"3183","sakaguchi","fubuki_monogatari.txt","――あの酒場を探しださう。"
"3184","sakaguchi","fubuki_monogatari.txt","そして女に再び会はふ。"
"3185","sakaguchi","fubuki_monogatari.txt","あの単純な魂の女に。"
"3186","sakaguchi","fubuki_monogatari.txt",""
"3187","sakaguchi","fubuki_monogatari.txt","夜がきた。"
"3188","sakaguchi","fubuki_monogatari.txt","野々宮は酒場を探しはじめてゐた。"
"3189","sakaguchi","fubuki_monogatari.txt","そして探しはじめると、意外の困難が分るのだつた。"
"3190","sakaguchi","fubuki_monogatari.txt",""
"3191","sakaguchi","fubuki_monogatari.txt","心覚えの一劃を幾たび往復してみても、昨夜の酒場はないのであつた。"
"3192","sakaguchi","fubuki_monogatari.txt","心覚えの一劃が、すでに別の場所であらうか。"
"3193","sakaguchi","fubuki_monogatari.txt","そのとき雪が降りだしてゐた。"
"3194","sakaguchi","fubuki_monogatari.txt","牡丹雪だ。"
"3195","sakaguchi","fubuki_monogatari.txt","暮れかけた夜の街へ、ひどくのんびり落ちはじめてゐた。"
"3196","sakaguchi","fubuki_monogatari.txt","それからすでに四時間ちかく過ぎてゐたが、酒場は皆目見当らなかつた。"
"3197","sakaguchi","fubuki_monogatari.txt","野々宮は時々ほかの店で休んだ。"
"3198","sakaguchi","fubuki_monogatari.txt","そして思ひださうとした。"
"3199","sakaguchi","fubuki_monogatari.txt","昨夜のすべての歩いた道を。"
"3200","sakaguchi","fubuki_monogatari.txt","――西堀の柳の下の屋台店は、今宵もすでに燈りがはいつてゐるのである。"
"3201","sakaguchi","fubuki_monogatari.txt","してみれば、あながち夢ではないのであつた。"
"3202","sakaguchi","fubuki_monogatari.txt","雪がつもつてしまつてゐた。"
"3203","sakaguchi","fubuki_monogatari.txt",""
"3204","sakaguchi","fubuki_monogatari.txt","とにかく緑の窓掛だ。"
"3205","sakaguchi","fubuki_monogatari.txt","店の構えに心覚えはないのだから。"
"3206","sakaguchi","fubuki_monogatari.txt","そして窓に近い場所に、右か左か知らないが、とにかくひとつの街燈がなければならない筈だつた。"
"3207","sakaguchi","fubuki_monogatari.txt",""
"3208","sakaguchi","fubuki_monogatari.txt","然し野々宮の捜査の足は自然に小さな一劃へ限定されてしまふのだつた。"
"3209","sakaguchi","fubuki_monogatari.txt","そのどこに心覚えがあるのかと言はれてみると、分らなくなる。"
"3210","sakaguchi","fubuki_monogatari.txt","とにかくその一劃を歩いてゐると、前夜たしかに歩いたといふ親しさだけ分るのだつた。"
"3211","sakaguchi","fubuki_monogatari.txt","そして一劃を出外れると、知らない国へはいつたやうな何か白らける思ひがして、心が冷めたくなるのであつた。"
"3212","sakaguchi","fubuki_monogatari.txt","よりどころは、ただそれだけにすぎないのである。"
"3213","sakaguchi","fubuki_monogatari.txt","そして野々宮の捜査の足は、いくたび出発し直しても、結局ここへ戻つてくるのだ。"
"3214","sakaguchi","fubuki_monogatari.txt","同じ一劃をいくたび歩いてしまつたらう。"
"3215","sakaguchi","fubuki_monogatari.txt",""
"3216","sakaguchi","fubuki_monogatari.txt","その一劃に、漠然としたすべての記憶を綜合して、ここでなければならないといふ地点があつた。"
"3217","sakaguchi","fubuki_monogatari.txt","まさしくそこに一軒の酒場があるのだ。"
"3218","sakaguchi","fubuki_monogatari.txt","野々宮はすでに三度そこの客となつてゐた。"
"3219","sakaguchi","fubuki_monogatari.txt","女給達に昨夜のことを語つてみても、知らない、と言ふのみだつた。"
"3220","sakaguchi","fubuki_monogatari.txt",""
"3221","sakaguchi","fubuki_monogatari.txt","なるほど内部の様子が違ふ。"
"3222","sakaguchi","fubuki_monogatari.txt","内部こそ、まさしく彼に鮮明な記憶があるのだ。"
"3223","sakaguchi","fubuki_monogatari.txt","否。"
"3224","sakaguchi","fubuki_monogatari.txt","内部こそ記憶がなくて、なんとしよう。"
"3225","sakaguchi","fubuki_monogatari.txt","まづ何よりも植木であつた。"
"3226","sakaguchi","fubuki_monogatari.txt","そして緑の窓掛である。"
"3227","sakaguchi","fubuki_monogatari.txt","そして植木の陰にある椅子の位置が忘れられない。"
"3228","sakaguchi","fubuki_monogatari.txt","そしてこの酒場の内部は、まつたく記憶と異つてゐた。"
"3229","sakaguchi","fubuki_monogatari.txt",""
"3230","sakaguchi","fubuki_monogatari.txt","やつぱり違つてゐるらしい。"
"3231","sakaguchi","fubuki_monogatari.txt","彼は諦らめて立ち去るのである。"
"3232","sakaguchi","fubuki_monogatari.txt","然し再び探しあぐねてこの一劃へ戻つてくると、どうしても同じ店へ彼は這入らずにゐられなかつた。"
"3233","sakaguchi","fubuki_monogatari.txt","どうしても諦らめきれないのであつた。"
"3234","sakaguchi","fubuki_monogatari.txt","その執拗さが自分にはつきり分るたびに、彼は泣きたくなるほどだつた。"
"3235","sakaguchi","fubuki_monogatari.txt","同じ酒場へ再び這入つて行く足をとどめることができないのだから。"
"3236","sakaguchi","fubuki_monogatari.txt",""
"3237","sakaguchi","fubuki_monogatari.txt","すでに三たび目になつてゐた。"
"3238","sakaguchi","fubuki_monogatari.txt",""
"3239","sakaguchi","fubuki_monogatari.txt","女給達の呆気にとられた顔をみると、彼は絶望したやうな苦笑と放心を浮かべるのだつた。"
"3240","sakaguchi","fubuki_monogatari.txt","然し彼は素早く室内の模様をたしかめることを忘れなかつた。"
"3241","sakaguchi","fubuki_monogatari.txt","幾たびたしかめなほしてみても、結局同じことだつた。"
"3242","sakaguchi","fubuki_monogatari.txt","まつたく違つてゐるのである。"
"3243","sakaguchi","fubuki_monogatari.txt","降誕祭が近づいてゐるので、同じやうな植木はあつた。"
"3244","sakaguchi","fubuki_monogatari.txt","然し位置が違つてゐるし、窓掛が緑色ではないのである。"
