"","auth","piece","line"
"0","sakaguchi","keimano_genso.txt","桂馬の幻想"
"1","sakaguchi","keimano_genso.txt","坂口安吾"
"2","sakaguchi","keimano_genso.txt",""
"3","sakaguchi","keimano_genso.txt","-------------------------------------------------------"
"4","sakaguchi","keimano_genso.txt","【テキスト中に現れる記号について】"
"5","sakaguchi","keimano_genso.txt",""
"6","sakaguchi","keimano_genso.txt","《》：ルビ"
"7","sakaguchi","keimano_genso.txt","（例）紺絣"
"8","sakaguchi","keimano_genso.txt",""
"9","sakaguchi","keimano_genso.txt","／＼：二倍の踊り字（「く」を縦に長くしたような形の繰り返し記号）"
"10","sakaguchi","keimano_genso.txt","（例）プン／＼"
"11","sakaguchi","keimano_genso.txt","＊濁点付きの二倍の踊り字は「／″＼」"
"12","sakaguchi","keimano_genso.txt","-------------------------------------------------------"
"13","sakaguchi","keimano_genso.txt",""
"14","sakaguchi","keimano_genso.txt","木戸六段が中座したのは午後三時十一分であった。"
"15","sakaguchi","keimano_genso.txt","公式の対局だから記録係がタイムを記入している。"
"16","sakaguchi","keimano_genso.txt","津雲八段の指したあと、自分の手番になった瞬間に木戸は黙ってスッと立って部屋をでたのである。"
"17","sakaguchi","keimano_genso.txt",""
"18","sakaguchi","keimano_genso.txt","対局者の心理は案外共通しているらしく、パチリと自分でコマをおいて、失礼、と便所へ立つのはよく見かける風景であるが、相手がコマをおいた瞬間に黙ってプイと立って出て行くというのはあまり見かけないようだ。"
"19","sakaguchi","keimano_genso.txt","コマをおいた相手は小バカにされたような気がしないでもない。"
"20","sakaguchi","keimano_genso.txt","事実、津雲はいくらか気をわるくしたのであった。"
"21","sakaguchi","keimano_genso.txt","ところが木戸は立ったまま一時間すぎても戻らなかった。"
"22","sakaguchi","keimano_genso.txt","戻らないわけだ。"
"23","sakaguchi","keimano_genso.txt","木戸は用便をすましたあと、ふと庭ゲタをつッかけて宿をでてしまったのである。"
"24","sakaguchi","keimano_genso.txt","新聞社の係員も観戦の人々もそれに気づいたものがなかった。"
"25","sakaguchi","keimano_genso.txt","やがて旅館ではちょッとした騒ぎになったが、木戸は別段策したわけでもなく、ふとその気になって散歩にでただけのことであった。"
"26","sakaguchi","keimano_genso.txt",""
"27","sakaguchi","keimano_genso.txt","その日は対局の二日目で、まさに終盤にさしかかって激戦の火蓋がきられたところであった。"
"28","sakaguchi","keimano_genso.txt","まだ形勢はどちらのものとも判じがたいが、まさに息づまろうという瞬間だから、木戸はちょッと息をぬきたくなったのである。"
"29","sakaguchi","keimano_genso.txt","すこしだけ歩いてみたい気持であったが、宿をでて坂を降りると山陰をぬう静かな道がある。"
"30","sakaguchi","keimano_genso.txt","そこを歩いているうちに渓流の岸へでたのである。"
"31","sakaguchi","keimano_genso.txt","と、道の下の岩の上で魚釣りをしている野村の姿をみとめた。"
"32","sakaguchi","keimano_genso.txt","野村は文士でこの対局の観戦記者であった。"
"33","sakaguchi","keimano_genso.txt","対局をよそに魚釣りの観戦記者もないものだから、"
"34","sakaguchi","keimano_genso.txt","「なんだ。"
"35","sakaguchi","keimano_genso.txt","野村さんじゃありませんか。"
"36","sakaguchi","keimano_genso.txt","ノンキなものだなア」"
"37","sakaguchi","keimano_genso.txt","と道の上から声をかけて降りて行くと、野村は苦笑して、"
"38","sakaguchi","keimano_genso.txt","「しまッた！対局はすんだのかい」"
"39","sakaguchi","keimano_genso.txt","「いいえ」"
"40","sakaguchi","keimano_genso.txt","「じゃア、どうしたわけだ」"
"41","sakaguchi","keimano_genso.txt","「ちょッと息ぬきです」"
"42","sakaguchi","keimano_genso.txt","野村はあきれて木戸をみつめた。"
"43","sakaguchi","keimano_genso.txt","木戸はやっと二十の若者だ。"
"44","sakaguchi","keimano_genso.txt","Ｃ級の六段である。"
"45","sakaguchi","keimano_genso.txt","天才的な若者ではあるが、公式戦へでられるようになって三年足らず、駈けだしである。"
"46","sakaguchi","keimano_genso.txt","新聞社の勝ちぬき戦で強豪をなぎ倒して、名人候補と声の高い強豪津雲と顔があった。"
"47","sakaguchi","keimano_genso.txt","天才といえば相手も天才、クラスのちがう大強豪とはじめて公式に顔があって若い木戸の勝つはずもあるまいが、津雲が苦戦すればお慰みと、新聞社では特にこの一局をとりあげて好局ができれば記事にするつもりであった。"
"48","sakaguchi","keimano_genso.txt",""
"49","sakaguchi","keimano_genso.txt","紺絣の木戸は温泉旅館へ招かれて公式に手合するさえはじめてだ。"
"50","sakaguchi","keimano_genso.txt","そうでなくとも対局中に中座して散歩にでるなぞというのはあまり例のないことである。"
"51","sakaguchi","keimano_genso.txt","それに封建色の強いこの社会では大先輩を待たせておいて散歩は礼を失するも甚だしいというような考え方も濃厚だ。"
"52","sakaguchi","keimano_genso.txt","また対局中は神経が異常にたかぶるからノンビリ息ぬきの散歩なぞと余裕のある気持にはなれないのが普通でもある。"
"53","sakaguchi","keimano_genso.txt","それで野村は呆れたのである。"
"54","sakaguchi","keimano_genso.txt",""
"55","sakaguchi","keimano_genso.txt","「本当に対局中なのかい？」"
"56","sakaguchi","keimano_genso.txt","「ええ。"
"57","sakaguchi","keimano_genso.txt","夜中ぢかくまでかかりそうです」"
"58","sakaguchi","keimano_genso.txt","「そうだろうな。"
"59","sakaguchi","keimano_genso.txt","立会人の小川八段がそんなふうに教えてくれたから安心して釣りにきたわけだが、しかし、キミもずぶといもんだなア。"
"60","sakaguchi","keimano_genso.txt","もっとも釣りをしながら、観戦記事が歩いてきてくれるんだから、ボクの方はこれに越したことはないがね」"
"61","sakaguchi","keimano_genso.txt","「アレ。"
"62","sakaguchi","keimano_genso.txt","まだ一匹もつれてないや」"
"63","sakaguchi","keimano_genso.txt","「まだ糸をたれたばかりだよ」"
"64","sakaguchi","keimano_genso.txt","「ハッハ。"
"65","sakaguchi","keimano_genso.txt","腕前のせいでしょう」"
"66","sakaguchi","keimano_genso.txt","木戸は遠慮なく笑いたてた。"
"67","sakaguchi","keimano_genso.txt","社交的な冗談とちがって、まったく遠慮を知らないという感じであった。"
"68","sakaguchi","keimano_genso.txt","そのずぶとさに呆れたばかりのやさきであるし、腕前だけをたよりに生きている勝負師に腕前のせいでしょうと云われてみると、全然そうに違いないような情けない気持にさせられて、野村はちょッと気をわるくした。"
"69","sakaguchi","keimano_genso.txt","しかし木戸はそんなことにも気がつかぬふうで、「橋の向うの山は見晴らしがよさそうだなア。"
"70","sakaguchi","keimano_genso.txt","ちょッと行ってみよう」"
"71","sakaguchi","keimano_genso.txt","こう呟きを残して橋を渡って姿を消してしまったのである。"
"72","sakaguchi","keimano_genso.txt","向いの山は百五十メートルぐらいのものだが普通に歩いて二十分ぐらいはかかる道のりだ。"
"73","sakaguchi","keimano_genso.txt","木戸はそこへ登りつめた。"
"74","sakaguchi","keimano_genso.txt","まさに見晴らしがよい。"
"75","sakaguchi","keimano_genso.txt","ふりむけば海が見えるし、向うははるばると原野である。"
"76","sakaguchi","keimano_genso.txt","そこに一軒の茶店があった。"
"77","sakaguchi","keimano_genso.txt","農業のかたわら土間を茶店にしただけのもので、棚にはほとんど品物もなかったが、空ビンにまじって二三本のサイダーだけがあった。"
"78","sakaguchi","keimano_genso.txt","木戸はそれを一本のんだ。"
"79","sakaguchi","keimano_genso.txt","のみ終ってから、お金をもたないことに気がついたのである。"
"80","sakaguchi","keimano_genso.txt",""
"81","sakaguchi","keimano_genso.txt","「こまったなア。"
"82","sakaguchi","keimano_genso.txt","明日もってきますから貸して下さい」"
"83","sakaguchi","keimano_genso.txt","とたのむと、そのとき娘の様子のきびしさに彼は目をまるくしたのであった。"
"84","sakaguchi","keimano_genso.txt","そのきびしさは借金とりのきびしさとは様子がちがっているように見えた。"
"85","sakaguchi","keimano_genso.txt","将棋では、きびしい、という表現をよく用いる。"
"86","sakaguchi","keimano_genso.txt","この手がきびしいというように用いるのである。"
"87","sakaguchi","keimano_genso.txt","そのきびしさに似ていた。"
"88","sakaguchi","keimano_genso.txt","ミジンも隙のないきびしさである。"
"89","sakaguchi","keimano_genso.txt","いわば真剣勝負の剣術使いのきびしさのようなものだが、木戸には娘の様子が将棋のコマのように見えた。"
"90","sakaguchi","keimano_genso.txt","桂馬に似ていると思ったのである。"
"91","sakaguchi","keimano_genso.txt",""
"92","sakaguchi","keimano_genso.txt","彼がそのとき、次の手に考えていたのは、金と桂と歩であった。"
"93","sakaguchi","keimano_genso.txt","金をひいて守りをかためるか、歩をついて様子を見ればおだやかであるが、桂をはねだすと乱戦模様になる。"
"94","sakaguchi","keimano_genso.txt","その桂ハネが第一感で、それを予定していたのであったが、敵が指した瞬間に、イヤ、危いぞ、という思いがしていきなりプイと立ち上ってしまったのである。"
"95","sakaguchi","keimano_genso.txt","自分では一撃必殺のきびしい桂のつもりであるが、あべこべに自分の命とりになりかねない懸念もあった。"
"96","sakaguchi","keimano_genso.txt","しばしの息ぬきに無念無想の道をあるいていたつもりでも、その桂ハネが頭の底にからみついていたのだ。"
"97","sakaguchi","keimano_genso.txt","そのせいか、娘の顔が桂に見えた。"
"98","sakaguchi","keimano_genso.txt",""
"99","sakaguchi","keimano_genso.txt","彼と同年ぐらいの娘であった。"
"100","sakaguchi","keimano_genso.txt","野良の匂いのプンプンするような色の黒い田舎娘で、どこといって特にきびしさを感じさせて然るべきような要素があるとは見えないのであるが、しかし、とッさに彼は盤面の桂の鋭さきびしさを感じたのだから目をみはった。"
"101","sakaguchi","keimano_genso.txt","が、それはその瞬間だけのことであった。"
"102","sakaguchi","keimano_genso.txt","彼が目をみはったので、娘は彼以上に目をみはって、"
"103","sakaguchi","keimano_genso.txt","「ダメよ」"
"104","sakaguchi","keimano_genso.txt","と大声で叫んだが、そこにはありふれた怒気があるばかりで、むしろ彼をホッとさせたのである。"
"105","sakaguchi","keimano_genso.txt","娘は彼の袴姿をジロジロ見て、"
"106","sakaguchi","keimano_genso.txt","「変なカッコウしてるわね」"
"107","sakaguchi","keimano_genso.txt","と云ったので、彼も声をたてて笑いだしたが、そのハズミによいことに気がついた。"
"108","sakaguchi","keimano_genso.txt",""
"109","sakaguchi","keimano_genso.txt","「そうだ。"
"110","sakaguchi","keimano_genso.txt","下の谷川で知ってる人が魚を釣ってるから、一しょに橋まで来ておくれ。"
"111","sakaguchi","keimano_genso.txt","その人から借りて払うから」"
"112","sakaguchi","keimano_genso.txt","たった二十円のことだった。"
"113","sakaguchi","keimano_genso.txt","娘がついてきたので二人は釣りをしている野村のところまで降りて行って、"
"114","sakaguchi","keimano_genso.txt","「二十円かして下さい。"
"115","sakaguchi","keimano_genso.txt","実はお金をもたずにサイダーをのんじゃって」"
"116","sakaguchi","keimano_genso.txt","「そうかい。"
"117","sakaguchi","keimano_genso.txt","サイダーの附け馬というのは珍しいな」"
"118","sakaguchi","keimano_genso.txt","と野村は立ってズボンのポケットをさぐっていたが、"
"119","sakaguchi","keimano_genso.txt","「しまったな。"
"120","sakaguchi","keimano_genso.txt","ボクもお金をもたないよ。"
"121","sakaguchi","keimano_genso.txt","上衣を宿へ脱いできたもんでね」"
"122","sakaguchi","keimano_genso.txt","十月の始めであった。"
"123","sakaguchi","keimano_genso.txt","とかく気候の変り目にカゼをひきがちの野村はセーターを用意してきて、釣りにでるのにセーターに着かえてきたのである。"
"124","sakaguchi","keimano_genso.txt","どんより曇った日であったが、寒いという陽気でもなく、セーターでは暑すぎるような気持の折であったから、"
"125","sakaguchi","keimano_genso.txt","「明日二十円とどけるまでこのセーターをカタにおくことにしよう。"
"126","sakaguchi","keimano_genso.txt","女房の手編みで甚だくたびれたセーターだが、二十円なら安かろう」"
"127","sakaguchi","keimano_genso.txt","娘も承諾して、野村のぬいだセーターを片腕にくるくるまきつけて戻っていった。"
"128","sakaguchi","keimano_genso.txt",""
"129","sakaguchi","keimano_genso.txt","「あこぎな附け馬だね。"
"130","sakaguchi","keimano_genso.txt","本当にセーターを持ってっちゃったよ。"
"131","sakaguchi","keimano_genso.txt","サイダーなんてものには酒ほどの人情もないらしいな」"
"132","sakaguchi","keimano_genso.txt","「そうなんですよ。"
"133","sakaguchi","keimano_genso.txt","あの娘には、ちょッとフシギなところがあります」"
"134","sakaguchi","keimano_genso.txt","「そうかねえ。"
"135","sakaguchi","keimano_genso.txt","物を知らない田舎娘ッて、あんなものじゃないかね」"
"136","sakaguchi","keimano_genso.txt","「今の様子はそうですがね。"
"137","sakaguchi","keimano_genso.txt","一瞬間、ボクは幻を見ました。"
"138","sakaguchi","keimano_genso.txt","桂馬を見たんです。"
"139","sakaguchi","keimano_genso.txt","いえ、気のせいじゃない。"
"140","sakaguchi","keimano_genso.txt","ハッキリと見たんです。"
"141","sakaguchi","keimano_genso.txt","四五の桂です」"
"142","sakaguchi","keimano_genso.txt","野村は返答の仕様がなかった。"
"143","sakaguchi","keimano_genso.txt","対局中神経がたかぶっているのだろうと思ったから、わざと話しかけもせず、肩を並べて黙々と宿へ戻ったのである。"
"144","sakaguchi","keimano_genso.txt","五時であった。"
"145","sakaguchi","keimano_genso.txt","木戸が中座してから一時間四五十分すぎていたのである。"
"146","sakaguchi","keimano_genso.txt",""
"147","sakaguchi","keimano_genso.txt","木戸は座につくといきなり四五桂とはねた。"
"148","sakaguchi","keimano_genso.txt","ところが、これが悪手だったのである。"
"149","sakaguchi","keimano_genso.txt","彼の見落した妙手があったのだ。"
"150","sakaguchi","keimano_genso.txt","若輩に一時間四五十分も座を外されて津雲は立腹していたから、じっくり考えて妙手をあみだし形勢一変して有利となったが、これで若輩を仕止めたように気持がゆるんでしまったのである。"
"151","sakaguchi","keimano_genso.txt","夕食後は緩手を連発して自滅し、若輩に名をなさしめてしまったのである。"
"152","sakaguchi","keimano_genso.txt",""
"153","sakaguchi","keimano_genso.txt",""
"154","sakaguchi","keimano_genso.txt","★"
"155","sakaguchi","keimano_genso.txt",""
"156","sakaguchi","keimano_genso.txt","「娘の顔に四五桂を見たとたんに絶対だと思ったんです。"
"157","sakaguchi","keimano_genso.txt","読み切ったように錯覚しちゃってね。"
"158","sakaguchi","keimano_genso.txt","指してから全然考えずにやッちゃったのに気がついた始末ですよ。"
"159","sakaguchi","keimano_genso.txt","津雲さんの応手が妙手のわけじゃないんです。"
"160","sakaguchi","keimano_genso.txt","読めば気のつく当り前の手だったと思うんですが、あまりダラシない見落しですから津雲さんになめられちゃってね。"
"161","sakaguchi","keimano_genso.txt","で、まア、おかげで幸せしたらしいですよ。"
"162","sakaguchi","keimano_genso.txt","バカな将棋さしました」"
"163","sakaguchi","keimano_genso.txt","あとで木戸は苦笑してこう野村に語った。"
"164","sakaguchi","keimano_genso.txt","しかし、そのとき、野村にはまだ娘の顔に四五桂を見たという言葉の意味がわからなかったのである。"
"165","sakaguchi","keimano_genso.txt",""
"166","sakaguchi","keimano_genso.txt","津雲は翌日の早朝に宿を去り、おそくまで残ったのは野村と木戸だけであった。"
"167","sakaguchi","keimano_genso.txt","二人はそろって散歩にでた。"
"168","sakaguchi","keimano_genso.txt","例の借金を払ってセーターを取り戻すためである。"
"169","sakaguchi","keimano_genso.txt",""
"170","sakaguchi","keimano_genso.txt","ところが山上へあがってみると、茶店は戸を閉じている。"
"171","sakaguchi","keimano_genso.txt","裏へ廻ってみたが、ここにも戸締りがしてあって、おとなっても返事がない。"
"172","sakaguchi","keimano_genso.txt","裏の畑にも人影がないから、山を降りて野良の人にきいてみたが、"
"173","sakaguchi","keimano_genso.txt","「そうかい。"
"174","sakaguchi","keimano_genso.txt","戸締りがしてあるかい。"
"175","sakaguchi","keimano_genso.txt","それでは出かけたのだろうよ」"
"176","sakaguchi","keimano_genso.txt","という悠々たる御返事であった。"
"177","sakaguchi","keimano_genso.txt",""
"178","sakaguchi","keimano_genso.txt","「どこへ行ったかわかりませんか」"
"179","sakaguchi","keimano_genso.txt","「知んねえね」"
"180","sakaguchi","keimano_genso.txt","誰にきいてもわからない。"
"181","sakaguchi","keimano_genso.txt",""
"182","sakaguchi","keimano_genso.txt","「セーターはあきらめて、戻るとしようよ」"
"183","sakaguchi","keimano_genso.txt","と野村は木戸をうながしたが、彼は考えこんでいるばかりで返事をしない。"
"184","sakaguchi","keimano_genso.txt","やがて歩く足もとまってしまった。"
"185","sakaguchi","keimano_genso.txt",""
"186","sakaguchi","keimano_genso.txt","「どうしたんだい？娘の顔の四五桂のつづきを読んでるわけじゃアあるまいね」"
"187","sakaguchi","keimano_genso.txt","と冷やかすと、意外にも、木戸は真顔でそれに答えて、"
"188","sakaguchi","keimano_genso.txt","「えゝ。"
"189","sakaguchi","keimano_genso.txt","それなんです。"
"190","sakaguchi","keimano_genso.txt","その四五桂を読んでるのですよ。"
"191","sakaguchi","keimano_genso.txt","ボクがとッさに四五桂と読んだのは気のせいではありません。"
"192","sakaguchi","keimano_genso.txt","瞬間ですが、ボクはその顔を読み切ったのです。"
"193","sakaguchi","keimano_genso.txt","絶対なんです。"
"194","sakaguchi","keimano_genso.txt","盤面を読み切った感じ、それですよ。"
"195","sakaguchi","keimano_genso.txt","ボクの盤面の四五桂は錯覚でしたが、娘の顔に読み切った四五桂は錯覚ではありません」"
"196","sakaguchi","keimano_genso.txt","「すると娘は将棋の神様かね」"
"197","sakaguchi","keimano_genso.txt","「そういう意味じゃアないんです。"
"198","sakaguchi","keimano_genso.txt","将棋とは関係なしにですよ。"
"199","sakaguchi","keimano_genso.txt","ですから、あの四五桂が将棋以外の何を意味しているかと考えているのです」"
"200","sakaguchi","keimano_genso.txt","「キミの四五桂に当るものが娘の何に当るかという意味だね」"
"201","sakaguchi","keimano_genso.txt","「そうですね。"
"202","sakaguchi","keimano_genso.txt","ボクの四五桂は錯覚でしたが、錯覚でない四五桂の場合ですね。"
"203","sakaguchi","keimano_genso.txt","それと娘との関係です。"
"204","sakaguchi","keimano_genso.txt","感じというヤツですけど、きっと何かがあるのです。"
"205","sakaguchi","keimano_genso.txt","ね。"
"206","sakaguchi","keimano_genso.txt","戻ってみましょう。"
"207","sakaguchi","keimano_genso.txt","何か感じることがあるかも知れません」"
"208","sakaguchi","keimano_genso.txt","「対局中の異常心理のせいだよ」"
"209","sakaguchi","keimano_genso.txt","「いえ、それと関係ないですよ。"
"210","sakaguchi","keimano_genso.txt","それでしたら、今までに同じようなことがなければならないでしょう。"
"211","sakaguchi","keimano_genso.txt","あのときボクは対局を忘れきっていたんです。"
"212","sakaguchi","keimano_genso.txt","娘の顔が対局を思い出させたのではなくて、対局中であるために娘の感じ、瞬間的なある感じを読み切ることができたんだと思いますよ。"
"213","sakaguchi","keimano_genso.txt","錯覚でないことはたしかです」"
"214","sakaguchi","keimano_genso.txt","甚だしく確信的であった。"
"215","sakaguchi","keimano_genso.txt","娘の様子を思い返してみても、野村にはそれらしいものを感じとることができないので、バカらしいような気持が多分にあったが、木戸の対局中の異常心理の感じたものの正体を突きとめさせてみるのも一興だ。"
"216","sakaguchi","keimano_genso.txt","枯尾花のたぐいに終るにしても、その道順をたどるだけでも一興だ。"
"217","sakaguchi","keimano_genso.txt","たしかに何かがあったとしたら、それがどのように小さな何かであってもさらに興あることではないか。"
"218","sakaguchi","keimano_genso.txt","対局中のとぎすまされた神経は、あるいは神秘を見ることができたかも知れないのである。"
"219","sakaguchi","keimano_genso.txt",""
"220","sakaguchi","keimano_genso.txt","山上へ戻ってみると、例によって畑には人影がなく、家の戸は閉ざされたまま変りがなかったが、畑に人影がないことも、農家の戸が閉ざされたままであることも、特にフシギというわけには参らぬ。"
"221","sakaguchi","keimano_genso.txt","山上の農家の人が時に戸締りしてでかけることもありうるというだけのことである。"
"222","sakaguchi","keimano_genso.txt",""
"223","sakaguchi","keimano_genso.txt","「中へはいってみたいなア」"
"224","sakaguchi","keimano_genso.txt","と木戸は思いあまったような呟きをもらした。"
"225","sakaguchi","keimano_genso.txt",""
"226","sakaguchi","keimano_genso.txt","「何か変ったものを見たのかい」"
"227","sakaguchi","keimano_genso.txt","「いいえ。"
"228","sakaguchi","keimano_genso.txt","特に変ったこともありません。"
"229","sakaguchi","keimano_genso.txt","ですが、この家の内部はいわば盤面のようなものですからね。"
"230","sakaguchi","keimano_genso.txt","やはり盤面に向ってみないと。"
"231","sakaguchi","keimano_genso.txt","ボクら頭の中に自分の盤面はあるんですけど、勝負はやはり本物の盤面を睨んだ上でないとできないものです。"
"232","sakaguchi","keimano_genso.txt","そう云えば、土間をはいって右下隅に棚があって概ね何も乗っかっていないんですが、サイダーの空ビンだけが一隅にかたまっていて中味のつまってるのが中に二三本まじってたんです。"
"233","sakaguchi","keimano_genso.txt","そんなのが妙に印象にのこっているので、ジッと盤面を、つまり屋内を睨んでみると何か関聯がわかってくるかも知れないように思われるんですね。"
"234","sakaguchi","keimano_genso.txt","どこかしらに関聯がでているはずだと思うんです」"
"235","sakaguchi","keimano_genso.txt","「しかしキミが娘の顔に四五桂を見たのはサイダーをのみ終ってから金をもたないのに気がついて借金を申しいれた時だそうじゃないか。"
"236","sakaguchi","keimano_genso.txt","第一感が働くのは娘をはじめて見た瞬間でなければならないように思われるんだがね」"
