"","auth","piece","line"
"237","sakaguchi","keimano_genso.txt","「それもあるかも知れませんが、たとえば将棋の場合、序盤に第一感の働く余地がないようなことも思い合わせてみることができやしませんか。"
"238","sakaguchi","keimano_genso.txt","急所へきてはじめて第一感があるのでしょう」"
"239","sakaguchi","keimano_genso.txt","木戸は野村をほったらかして家のまわりを歩いてきたが、何の収穫もなかったらしい。"
"240","sakaguchi","keimano_genso.txt","ガッカリした色が見えた。"
"241","sakaguchi","keimano_genso.txt","あきらめて山を降りたが、道ばたに働く農夫を見ると、我慢ができなくなったらしく、"
"242","sakaguchi","keimano_genso.txt","「あの茶店に二十ぐらいの娘がいますね」"
"243","sakaguchi","keimano_genso.txt","「あの出戻りかい。"
"244","sakaguchi","keimano_genso.txt","もう二十四五だろう」"
"245","sakaguchi","keimano_genso.txt","「色の黒い、畑の匂いのプン／＼するような娘ですよ」"
"246","sakaguchi","keimano_genso.txt","「アヽ、色が大そう黒いな。"
"247","sakaguchi","keimano_genso.txt","畑の匂いだって？とんでもない。"
"248","sakaguchi","keimano_genso.txt","色の黒いのは地色だよ。"
"249","sakaguchi","keimano_genso.txt","あの出戻りは野良へでたことなんてありやしない。"
"250","sakaguchi","keimano_genso.txt","ヨメ入り先から逃げだしたのも野良仕事がキライだからだ」"
"251","sakaguchi","keimano_genso.txt","「茶店だけで暮しがたつんですか」"
"252","sakaguchi","keimano_genso.txt","「バカな」"
"253","sakaguchi","keimano_genso.txt","「お金持なんですか」"
"254","sakaguchi","keimano_genso.txt","「あれッぽちの畑じゃア食うや食わずだな。"
"255","sakaguchi","keimano_genso.txt","もっとも、出戻りはミコだ」"
"256","sakaguchi","keimano_genso.txt","「ミコとは？」"
"257","sakaguchi","keimano_genso.txt","「神社で踊る女だよ。"
"258","sakaguchi","keimano_genso.txt","占いも見るな。"
"259","sakaguchi","keimano_genso.txt","三年さきに死んだオフクロは占いをよく見たが、あの出戻りもマネゴトはしている」"
"260","sakaguchi","keimano_genso.txt","「家族はいないんですか」"
"261","sakaguchi","keimano_genso.txt","「父親は二人ぐらしだ。"
"262","sakaguchi","keimano_genso.txt","男の兄弟もいたのだが、あれッぽちの畑じゃア仕様がないから町へでて何かやってるようだ。"
"263","sakaguchi","keimano_genso.txt","山の上に離れていることだから、あのウチのことは村の者もよく知らないが、なんでも父親は四五日前から寝こんでいるということだった」"
"264","sakaguchi","keimano_genso.txt","「大病ですか」"
"265","sakaguchi","keimano_genso.txt","「知らねえ」"
"266","sakaguchi","keimano_genso.txt","木戸はまた考えこんで歩きだした。"
"267","sakaguchi","keimano_genso.txt","橋の上までくると立ち止って、"
"268","sakaguchi","keimano_genso.txt","「また戻ってみたくなりましたねえ」"
"269","sakaguchi","keimano_genso.txt","「病人のことでかい？」"
"270","sakaguchi","keimano_genso.txt","「それなんです。"
"271","sakaguchi","keimano_genso.txt","生きてる病人なら、どんどん戸を叩けば返事ぐらいするでしょう」"
"272","sakaguchi","keimano_genso.txt","「ずいぶん叩いたじゃないか」"
"273","sakaguchi","keimano_genso.txt","「だからですよ。"
"274","sakaguchi","keimano_genso.txt","あの戸締まりした家の中にたとえ重病人にしろ、生きた人間がいるのでしょうか」"
"275","sakaguchi","keimano_genso.txt","「死んでると云うのかい？」"
"276","sakaguchi","keimano_genso.txt","「まアね。"
"277","sakaguchi","keimano_genso.txt","死んでるというよりも、むしろ、殺されてやしませんか。"
"278","sakaguchi","keimano_genso.txt","四五桂は、それじゃないかと、いまひょッと、ね」"
"279","sakaguchi","keimano_genso.txt","「キミは踏みこんでみるつもりかい？よその土地からきた赤の他人のキミが」"
"280","sakaguchi","keimano_genso.txt","「二十円の借金返しに踏みこんじゃア変ですか。"
"281","sakaguchi","keimano_genso.txt","セーターを取り返すべく戸をこじあけて侵入せりは、たしかに名折れだなア。"
"282","sakaguchi","keimano_genso.txt","ハッハッハ」"
"283","sakaguchi","keimano_genso.txt","どうやら木戸の思考も世間なみのところへ戻ってきたらしく、神妙に橋を渡って宿へ戻ったのである。"
"284","sakaguchi","keimano_genso.txt","そして二人は東京へ戻って別れた。"
"285","sakaguchi","keimano_genso.txt",""
"286","sakaguchi","keimano_genso.txt","野村も、ひょッとするとそんなことがありうるかも知れないなと一度は思ってみたりした。"
"287","sakaguchi","keimano_genso.txt","木戸のカンが当っていれば絶好のニュースだから、新聞社を訪れて一応将棋記者の耳に入れておこうかと思ったのだが、まんまと外れていると天才児の将来のために良くない結果になるかも知れぬ。"
"288","sakaguchi","keimano_genso.txt","そう考えて、野村はこれを忘れることにしたのである。"
"289","sakaguchi","keimano_genso.txt",""
"290","sakaguchi","keimano_genso.txt",""
"291","sakaguchi","keimano_genso.txt","★"
"292","sakaguchi","keimano_genso.txt",""
"293","sakaguchi","keimano_genso.txt","観戦記の原稿を届けにでた野村は、木戸が新聞社から金を受けとってでたままずッと行方が知れないことを知った。"
"294","sakaguchi","keimano_genso.txt","彼の次の対局は二週間後に行われる予定で、彼も承知のことではあったが、その対局もまぢかに迫っていたので、新聞社でも多少は気をもんでいる様子であった。"
"295","sakaguchi","keimano_genso.txt","その行先はあるいは、と、野村は例の心当りを云いたくなったが待て待てと言葉をおさえたのである。"
"296","sakaguchi","keimano_genso.txt","若者の秘密の行先は天下に多い。"
"297","sakaguchi","keimano_genso.txt","うっかりバカな見込みを云いたてて、彼の恥も自分の恥も一しょにさらけだしては大変だ。"
"298","sakaguchi","keimano_genso.txt",""
"299","sakaguchi","keimano_genso.txt","幸い次の対局に彼は姿を現した。"
"300","sakaguchi","keimano_genso.txt","天下の強豪との対局中に二時間ちかくも行方をくらますほどのずぶとさだから、平時に十日やそこいら行方をくらましてもフシギはないわけで、取越苦労をする方がバカだったかと野村は思った。"
"301","sakaguchi","keimano_genso.txt",""
"302","sakaguchi","keimano_genso.txt","野村はこの対局には関係がなかったから出かけなかったが、木戸は自信満々の様子だったそうである。"
"303","sakaguchi","keimano_genso.txt","むろんこの相手もＡクラスの強豪だった。"
"304","sakaguchi","keimano_genso.txt",""
"305","sakaguchi","keimano_genso.txt","ところがこの一戦は木戸に良いところがまったくなかった。"
"306","sakaguchi","keimano_genso.txt","中盤すでに歴然たる敗勢で、押されに押されてずるずると押し切られた。"
"307","sakaguchi","keimano_genso.txt","木戸は喘ぐような悪戦苦闘のあげく、前局で散歩にでかけたと同じような時刻には脂汗でぬれたような悲愴な様で別室へ下って一時間ほど寝こんだそうだ。"
"308","sakaguchi","keimano_genso.txt","もっとも、こういう急場にフトンをひッかぶって寝るマネができるだけでも異常神経と云えそうだが、今回に限ってずぶとい余裕はみられなかった。"
"309","sakaguchi","keimano_genso.txt","疲れきったあげくだったそうである。"
"310","sakaguchi","keimano_genso.txt","夕食後まもなくずる／＼と良いところなく押し切られ、局後の検討もせずに座を立ってしまった。"
"311","sakaguchi","keimano_genso.txt","コマを投じて無言のまゝスッと立って再び姿を現さなかったそうだが、それは無礼にも、無慙にも受けとることができた。"
"312","sakaguchi","keimano_genso.txt","ともかく小僧いまだしの感、すべてに深かったそうである。"
"313","sakaguchi","keimano_genso.txt","しかし翌朝は平素の様子に戻って、"
"314","sakaguchi","keimano_genso.txt","「非常によい教訓でした。"
"315","sakaguchi","keimano_genso.txt","心を改めて出直します」"
"316","sakaguchi","keimano_genso.txt","としみ／″＼記者に語ったそうで、その一言を残して彼は再び行方不明となった。"
"317","sakaguchi","keimano_genso.txt","世間から消え去ってしまったのである。"
"318","sakaguchi","keimano_genso.txt",""
"319","sakaguchi","keimano_genso.txt","野村はそれを一月ほどすぎてきかされた。"
"320","sakaguchi","keimano_genso.txt","それからさらに三月ほど後のことである。"
"321","sakaguchi","keimano_genso.txt","春の気配が近づいた季節に、仕事の都合で彼は例の温泉に滞在した。"
"322","sakaguchi","keimano_genso.txt",""
"323","sakaguchi","keimano_genso.txt","彼は木戸の行方不明を思いだして、それがこの温泉に関係のあることだとは思わなかったが、すくなくとも初期の行方不明中のある日、彼が一度はこゝへ来ているはずだと考えた。"
"324","sakaguchi","keimano_genso.txt","茶店の娘の顔に見た四五桂の謎をとくためにである。"
"325","sakaguchi","keimano_genso.txt","勝負師の中でも彼は特に執念の強い方であるし、あの謎によせた彼の執着は一度は彼をこの地に再来せしめるに充分なものだと思われたからである。"
"326","sakaguchi","keimano_genso.txt",""
"327","sakaguchi","keimano_genso.txt","野村はある日の散歩に例の橋を渡って山上へ登ってみた。"
"328","sakaguchi","keimano_genso.txt","そして茶店に休息した。"
"329","sakaguchi","keimano_genso.txt","茶店は何事もなかったふうに思われた。"
"330","sakaguchi","keimano_genso.txt","土間をはいって盤面右下隅の位置にあるという茶店の棚も木戸が語ってきかせたとほぼ同じで、空ビンの代りに新しいサイダーだけが十本ほどあった。"
"331","sakaguchi","keimano_genso.txt","そして現れたのも例の娘であった。"
"332","sakaguchi","keimano_genso.txt","娘は彼が何者か気づかぬ様子であった。"
"333","sakaguchi","keimano_genso.txt","野村はむかし木戸が娘に話しかけたと同じように、サイダーをのみ終えてから、云った。"
"334","sakaguchi","keimano_genso.txt",""
"335","sakaguchi","keimano_genso.txt","「去年の十月はじめごろ、二十円のカタにセーターをぬいで渡した釣人を覚えていないかね」"
"336","sakaguchi","keimano_genso.txt","その瞬間にまさしく野村も見たのである。"
"337","sakaguchi","keimano_genso.txt","木戸の云った例の四五桂と同じものを見たと思った。"
"338","sakaguchi","keimano_genso.txt","むろんそれは野村にとっては四五桂ではない。"
"339","sakaguchi","keimano_genso.txt","また木戸があるいは真剣勝負の剣客のスキのないきびしさと云ったものともややちがう、それは世の常の人のものとはちがっていた。"
"340","sakaguchi","keimano_genso.txt","驚愕がないのだ。"
"341","sakaguchi","keimano_genso.txt","そして、怖れがないのだ。"
"342","sakaguchi","keimano_genso.txt","そこに溢れているものは怒りであり、逞しい闘志であった。"
"343","sakaguchi","keimano_genso.txt","いわば全てが一途にはりきったきびしい気魄のみであって、その裏側にあるべきはずの驚きや怖れが欠けているのだ。"
"344","sakaguchi","keimano_genso.txt","いわば無智の象徴と云うことができるかも知れぬ。"
"345","sakaguchi","keimano_genso.txt","敵のみを知りうる無智。"
"346","sakaguchi","keimano_genso.txt","闘うことを知るのみの無智。"
"347","sakaguchi","keimano_genso.txt","木戸がその顔に四五桂を見てそれが読み切られた四五桂であると確信したのは、極端に無智な闘魂に負けたからではあるまいかと野村は思った。"
"348","sakaguchi","keimano_genso.txt","この顔から急所の四五桂を見てとるのはむしろ無理だが、殺人を感じたことは肯きうるかも知れないと野村は思ったのである。"
"349","sakaguchi","keimano_genso.txt",""
"350","sakaguchi","keimano_genso.txt","「そのセーターを返してもらいにきたわけじゃアないがね」"
"351","sakaguchi","keimano_genso.txt","と野村は笑って云った。"
"352","sakaguchi","keimano_genso.txt",""
"353","sakaguchi","keimano_genso.txt","「実はね、おききしたいことがあるのだが、例の和服に袴をはいた若い先生がその後ここへ来なかったかね」"
"354","sakaguchi","keimano_genso.txt","「そんな奴は来ないよ」"
"355","sakaguchi","keimano_genso.txt","と娘はブッキラボーに答えた。"
"356","sakaguchi","keimano_genso.txt",""
"357","sakaguchi","keimano_genso.txt","「来たと思うんだが……」"
"358","sakaguchi","keimano_genso.txt","「来ないと云ったら来ないんだ。"
"359","sakaguchi","keimano_genso.txt","逆らうわけでもあるのかい。"
"360","sakaguchi","keimano_genso.txt","いまごろセーターをとりに来たってありやしないよ。"
"361","sakaguchi","keimano_genso.txt","あきらめて、早くおかえり。"
"362","sakaguchi","keimano_genso.txt","かえれよ」"
"363","sakaguchi","keimano_genso.txt","「それは失礼した。"
"364","sakaguchi","keimano_genso.txt","いくらだね」"
"365","sakaguchi","keimano_genso.txt","「茶代もいれて三十円」"
"366","sakaguchi","keimano_genso.txt","「十円の値上げだな」"
"367","sakaguchi","keimano_genso.txt","「二度とくるな」"
"368","sakaguchi","keimano_genso.txt","まるでもう丸太ン棒のような文句で叩き出されてしまったのである。"
"369","sakaguchi","keimano_genso.txt","ミコや占いという品格ある客商売もやってるそうだがそのときはどの種の言葉遣いを用いるのかと、野村はそぞろ興を催したほどであった。"
"370","sakaguchi","keimano_genso.txt",""
"371","sakaguchi","keimano_genso.txt","野村は娘に横溢している陰鬱な殺気が気がかりになった。"
"372","sakaguchi","keimano_genso.txt","もしも木戸が再びここを訪れてその第一感にからまる疑惑を明らかにした場合、そしてその疑惑が的を射たものであった場合、木戸の運命がどういうことになるかと考えてみたのである。"
"373","sakaguchi","keimano_genso.txt",""
"374","sakaguchi","keimano_genso.txt","そこで野村はその足で木戸の対局を主催した新聞社の支局を訪れ、その間の事情について心当りになるような出来事がなかったか尋ねてみた。"
"375","sakaguchi","keimano_genso.txt",""
"376","sakaguchi","keimano_genso.txt","「その対局はいつでしたか」"
"377","sakaguchi","keimano_genso.txt","「昨年十月の六七日です」"
"378","sakaguchi","keimano_genso.txt","「さっそく調査して御返事しましょう」"
"379","sakaguchi","keimano_genso.txt","翌日、電話で返事がとどいた。"
"380","sakaguchi","keimano_genso.txt",""
"381","sakaguchi","keimano_genso.txt","「茶店のオヤジサンは対局の翌日病死しておりますね」"
"382","sakaguchi","keimano_genso.txt","「他殺ではないのですか」"
"383","sakaguchi","keimano_genso.txt","「いえ、明らかに病死です。"
"384","sakaguchi","keimano_genso.txt","医者の証明がありますから。"
"385","sakaguchi","keimano_genso.txt","その医者は警察医でもありますから、まちがいはありません。"
"386","sakaguchi","keimano_genso.txt","娘が病気の父親を大八車につんで、まだ夜明け前に医者へ連れてきたそうです。"
"387","sakaguchi","keimano_genso.txt","そのときはまだ息があったそうですが、病院へかつぎこまれて五分か十分で死んだそうです。"
"388","sakaguchi","keimano_genso.txt","つまり、あなたが御覧になった戸締りの家は、その留守中に当るわけです。"
"389","sakaguchi","keimano_genso.txt","十月八日の出来事ですから。"
"390","sakaguchi","keimano_genso.txt","次に木戸六段の件ですが、茶店の娘は現在若い男と同棲しているそうです。"
"391","sakaguchi","keimano_genso.txt","この男の姓名はどこへ問い合わせても不明でしたが、この土地の者でないことは確実です。"
"392","sakaguchi","keimano_genso.txt","木戸六段と関係があるかどうかは知りませんが、同棲はオヤジサンの死後の出来事で、ちょッとインテリ風、都会風の二十一二の青年だというのです。"
"393","sakaguchi","keimano_genso.txt","もっとも、この人物が将棋をさしたかどうか誰も知っておりませんがともかく茶店の娘と若い男との交渉でいままでに私の方に判明したのは以上のことだけです」"
"394","sakaguchi","keimano_genso.txt","木戸が娘の顔に読んだ四五桂の謎は狂っていたのである。"
"395","sakaguchi","keimano_genso.txt","しかし、とにかくその日人が死んでいたことは当っていたのだ。"
"396","sakaguchi","keimano_genso.txt","野村はちょッと神秘的なものを感じて、木戸のために祝福したい気持になった。"
"397","sakaguchi","keimano_genso.txt",""
"398","sakaguchi","keimano_genso.txt","「娘と同棲している若い男は、木戸かも知れない」"
"399","sakaguchi","keimano_genso.txt","野村はそう考えた。"
"400","sakaguchi","keimano_genso.txt","木戸が再び茶店を訪れた際に、狙いの謎は外れていたが、人死にだけは当っていたと判った場合に、同棲というコースをたどると仮定するのはやや無理筋に類しているが、人生、意外はつきものだ。"
"401","sakaguchi","keimano_genso.txt","とにかくその男を一見してみなければ気持がおさまらなくなったのである。"
"402","sakaguchi","keimano_genso.txt","娘の荒々しいのにはヘキエキだが、オヤジの死が娘の手によるものでない限りはオレのイノチも無事だろうと野村は心をきめて出発した。"
"403","sakaguchi","keimano_genso.txt",""
"404","sakaguchi","keimano_genso.txt","山上へ登りきると、うまいぐあいに裏手の畑で働いている男の姿を認めた。"
"405","sakaguchi","keimano_genso.txt","彼のセーターをきて野良をたがやしているのである。"
"406","sakaguchi","keimano_genso.txt","茶店の前をよけて畑へまわり、男の前へ立ってみると、まさしく木戸ではないか。"
"407","sakaguchi","keimano_genso.txt","木戸は彼を認めると、落ちつきはらって、笑った。"
"408","sakaguchi","keimano_genso.txt","さすがに勝負師のずぶとさであった。"
"409","sakaguchi","keimano_genso.txt",""
"410","sakaguchi","keimano_genso.txt","「きのうお見えの噂をうけたまわっておりましたよ。"
"411","sakaguchi","keimano_genso.txt","よくわかりましたね」"
"412","sakaguchi","keimano_genso.txt","「キミの奥方のカンバセにボクも四五桂を読んだのでね。"
"413","sakaguchi","keimano_genso.txt","もしやという不安がわいたのさ。"
"414","sakaguchi","keimano_genso.txt","御達者で何よりだ」"
"415","sakaguchi","keimano_genso.txt","「もう世をすてました。"
"416","sakaguchi","keimano_genso.txt","お目にかかっても、何も申上げる言葉がないんですが」"
"417","sakaguchi","keimano_genso.txt","「しかし、四五桂から同棲のコースは、ありうるとは思ったが、意外であったね。"
"418","sakaguchi","keimano_genso.txt","文士にとっても、やや意外だね」"
"419","sakaguchi","keimano_genso.txt","「そうですか。"
"420","sakaguchi","keimano_genso.txt","ボクにはそれほどのこともないのですが。"
"421","sakaguchi","keimano_genso.txt","ボクは盤面の四五桂に錯覚し、次の対局ではペシャンコでしたが、ここの四五桂には錯覚がありませんでした。"
"422","sakaguchi","keimano_genso.txt","盤面に見切りをつけるのは当然じゃありませんか。"
"423","sakaguchi","keimano_genso.txt","ここに故郷を見出すのも当然なんです。"
"424","sakaguchi","keimano_genso.txt","むしろ宿命的ですよ。"
"425","sakaguchi","keimano_genso.txt","きわめて素直なコースです」"
"426","sakaguchi","keimano_genso.txt","「しかし、オヤジサンの死は病死だというじゃないか」"
"427","sakaguchi","keimano_genso.txt","「むろん、病死です。"
"428","sakaguchi","keimano_genso.txt","しかし、なんしろ、この山上から病人を大八車につんで降すんですから、病人をガンジガラメに車にしばりつけましてね。"
"429","sakaguchi","keimano_genso.txt","ガッタンゴットン荒れ放題にひきずり降すんでしょう。"
"430","sakaguchi","keimano_genso.txt","ま、手心次第というものですね。"
"431","sakaguchi","keimano_genso.txt","闇夜のことだし。"
"432","sakaguchi","keimano_genso.txt","病死は絶対なんですがね」"
"433","sakaguchi","keimano_genso.txt","「なるほど。"
"434","sakaguchi","keimano_genso.txt","で、怖くないのかね」"
"435","sakaguchi","keimano_genso.txt","「何がですか。"
"436","sakaguchi","keimano_genso.txt","人生は怖いものばかりですよ。"
"437","sakaguchi","keimano_genso.txt","こゝに限って何が怖いことがあるものですか。"
"438","sakaguchi","keimano_genso.txt","素直にかえった人間は子供なんです。"
"439","sakaguchi","keimano_genso.txt","彼の目に見えるものは全てが母親のやさしさだけです。"
"440","sakaguchi","keimano_genso.txt","ボクはふるさとに住んでるのです。"
"441","sakaguchi","keimano_genso.txt","ほら、母親がでてきました。"
"442","sakaguchi","keimano_genso.txt","母親は子供が心配なんです。"
"443","sakaguchi","keimano_genso.txt","叱りたくなるんですね。"
"444","sakaguchi","keimano_genso.txt","で、ボクは叱られないように沈黙しましょう」"
"445","sakaguchi","keimano_genso.txt","色のまッ黒い母親が二人の一間ほどの距離まで近づいて立ちどまった。"
"446","sakaguchi","keimano_genso.txt","野村をジッと見つめているだけで、今日は言葉の丸太ン棒をくりだそうとする様子がない。"
"447","sakaguchi","keimano_genso.txt","女占い師の無言の威勢を認めることができた。"
"448","sakaguchi","keimano_genso.txt","二十四五の出戻りだという村人の話であったが見たところは二十そこそこの田舎娘の稚さが骨格たくましい全身にただよっているようだ。"
"449","sakaguchi","keimano_genso.txt","もっとも面相もただ逞しく、胸にオッパイがもりあがってそれが女らしいというだけで、セメント細工の感じであった。"
"450","sakaguchi","keimano_genso.txt",""
"451","sakaguchi","keimano_genso.txt","長居は無用に見えたので、野村は最後にこうきいた。"
"452","sakaguchi","keimano_genso.txt",""
"453","sakaguchi","keimano_genso.txt","「将棋ファンの中にはキミの消息を知りたいと思っている人も少からぬ数だ。"
"454","sakaguchi","keimano_genso.txt","と思うが、いつか棋界に復活する気持はあるだろうか」"
"455","sakaguchi","keimano_genso.txt","「それについてお答えするよりも、ボクがこの地に生きながらえていることを忘れていただきたいということがボクの唯一の希望なんですがね」"
"456","sakaguchi","keimano_genso.txt","「その御希望にはそうつもりだが人の心は変りやすいものだから、心変りにも素直に順応したまえ。"
"457","sakaguchi","keimano_genso.txt","ふるさとが一ツとは限らないさ」"
"458","sakaguchi","keimano_genso.txt","野村はこう云いすてて別れをつげた。"
"459","sakaguchi","keimano_genso.txt","娘占い師はついに無言であった。"
"460","sakaguchi","keimano_genso.txt",""
"461","sakaguchi","keimano_genso.txt",""
"462","sakaguchi","keimano_genso.txt","★"
"463","sakaguchi","keimano_genso.txt",""
"464","sakaguchi","keimano_genso.txt","翌日、野村は娘占い師の訪問をうけた。"
"465","sakaguchi","keimano_genso.txt","部屋へ招じ入れてみると、彼女は丸太ン棒の言葉と発言とのほかに、やや適度な言葉づかいを心得ていることが判ったのである。"
"466","sakaguchi","keimano_genso.txt","三ツ指ついて挨拶することも知っていた。"
"467","sakaguchi","keimano_genso.txt",""
"468","sakaguchi","keimano_genso.txt","「ずいぶん礼儀の心得がおありですね。"
