"","auth","piece","line"
"469","sakaguchi","keimano_genso.txt","ふだんそれを用いているのですか」"
"470","sakaguchi","keimano_genso.txt","こうひやかしても悠々と動じる色もなく、うなずいて、"
"471","sakaguchi","keimano_genso.txt","「先祖代々の商売だから小さい時から仕込まれてね。"
"472","sakaguchi","keimano_genso.txt","三ツの時からミコの踊りも神前の礼儀も仕込まれたものさ。"
"473","sakaguchi","keimano_genso.txt","占いには威厳がいるし、ニワサの術も親代々。"
"474","sakaguchi","keimano_genso.txt","タダモノにはできないよ」"
"475","sakaguchi","keimano_genso.txt","「ニワサの術とは？」"
"476","sakaguchi","keimano_genso.txt","「いまの都会の者には云ってみても信用できまいよ。"
"477","sakaguchi","keimano_genso.txt","正しいことが田舎にはいくらか残っているものさ。"
"478","sakaguchi","keimano_genso.txt","いまどきの都会の人間は虫ケラにも劣っているね」"
"479","sakaguchi","keimano_genso.txt","踊る神様と似たような教儀をのべた。"
"480","sakaguchi","keimano_genso.txt","云われて見直すと、人相骨柄にも類似があった。"
"481","sakaguchi","keimano_genso.txt","たぶん最も共通しない点は、娘占い師の方が野良仕事が大のキライということかも知れない。"
"482","sakaguchi","keimano_genso.txt","彼女はその日、逞しい身体に振袖を着て来たのである。"
"483","sakaguchi","keimano_genso.txt","パーマネントもかけていた。"
"484","sakaguchi","keimano_genso.txt",""
"485","sakaguchi","keimano_genso.txt","「本日はほかでもないが、ウチへきていただきたいと思ってね。"
"486","sakaguchi","keimano_genso.txt","ウチの奴とお前とは、私というものに浅からぬ因縁があることだし、ウチの様子をお前には見せておきたいと思いたったのでね。"
"487","sakaguchi","keimano_genso.txt","よく見ておけば、お前も後日バカなことは云いふらすまい。"
"488","sakaguchi","keimano_genso.txt","山奥ずまいで、モテナシもできないが物を食うだけが、モテナシではあるまいし、お前のためにもなることだから、さて、仕度しなさい」"
"489","sakaguchi","keimano_genso.txt","山川草木の威厳と云うか、堂々たるものであった。"
"490","sakaguchi","keimano_genso.txt","否も応もない。"
"491","sakaguchi","keimano_genso.txt","野村はさっそく仕度に及んで同行した。"
"492","sakaguchi","keimano_genso.txt",""
"493","sakaguchi","keimano_genso.txt","あっぱれ娘教祖と云いたいところであるが、彼女は村人に人気がなかった。"
"494","sakaguchi","keimano_genso.txt","村の子供たちは彼女に石を投げた。"
"495","sakaguchi","keimano_genso.txt",""
"496","sakaguchi","keimano_genso.txt","「ヨー。"
"497","sakaguchi","keimano_genso.txt","ベッピン、牛のクソふむなア」"
"498","sakaguchi","keimano_genso.txt","とはやしたてる野良の年寄もいた。"
"499","sakaguchi","keimano_genso.txt","娘教祖はせせら笑って、"
"500","sakaguchi","keimano_genso.txt","「虫ケラどもが！」"
"501","sakaguchi","keimano_genso.txt","「田舎にも虫ケラが多いじゃないか」"
"502","sakaguchi","keimano_genso.txt","「日本中、虫ケラだらけさ」"
"503","sakaguchi","keimano_genso.txt","平然たるものであった。"
"504","sakaguchi","keimano_genso.txt","山上の茶店へ来てみると、表の茶店は戸締りが施されていて、接待のため予定の休業と見うけられた。"
"505","sakaguchi","keimano_genso.txt","裏のクグリから屋内へはいると、タタミ、否、ムシロをしいた部屋は一間しかない。"
"506","sakaguchi","keimano_genso.txt","その部屋の柱に、木戸が荒ナワでガンジガラメにいましめられている。"
"507","sakaguchi","keimano_genso.txt",""
"508","sakaguchi","keimano_genso.txt","「いま戻ったよ」"
"509","sakaguchi","keimano_genso.txt","と娘教祖は帰宅の挨拶に木戸の額に平手打をくらわせて、"
"510","sakaguchi","keimano_genso.txt","「さ、お前はこッちへおあがり。"
"511","sakaguchi","keimano_genso.txt","お前を煮て食うとは云わないよ。"
"512","sakaguchi","keimano_genso.txt","なーに。"
"513","sakaguchi","keimano_genso.txt","これは普通のことでね。"
"514","sakaguchi","keimano_genso.txt","毎日ではないが、よくやることさ。"
"515","sakaguchi","keimano_genso.txt","昨日はひどかった。"
"516","sakaguchi","keimano_genso.txt","お前が帰ったあとでさ。"
"517","sakaguchi","keimano_genso.txt","薪ザッポウくらわしてやったよ。"
"518","sakaguchi","keimano_genso.txt","顔にはケガはさせないがね。"
"519","sakaguchi","keimano_genso.txt","お前にくだらないことを喋りちらしやがったからさ。"
"520","sakaguchi","keimano_genso.txt","オレは見とおしさ。"
"521","sakaguchi","keimano_genso.txt","みんな耳にきこえてくる。"
"522","sakaguchi","keimano_genso.txt","顔にもちゃんと書いてあるのがお前たちには判らないだけさ。"
"523","sakaguchi","keimano_genso.txt","お前はそこに坐って見ていなさい」"
"524","sakaguchi","keimano_genso.txt","野村を指定席に坐らせておいて、娘教祖は木戸の前に立った。"
"525","sakaguchi","keimano_genso.txt",""
"526","sakaguchi","keimano_genso.txt","「ほら。"
"527","sakaguchi","keimano_genso.txt","ほら。"
"528","sakaguchi","keimano_genso.txt","ほら。"
"529","sakaguchi","keimano_genso.txt","ほらしょウ」"
"530","sakaguchi","keimano_genso.txt","木戸の頸に手を当てがって人形の首のように柱にがくがく叩きつけた。"
"531","sakaguchi","keimano_genso.txt",""
"532","sakaguchi","keimano_genso.txt","「ほらしょ。"
"533","sakaguchi","keimano_genso.txt","ほら。"
"534","sakaguchi","keimano_genso.txt","ほら」"
"535","sakaguchi","keimano_genso.txt","次に左右から両頬へ平手うち。"
"536","sakaguchi","keimano_genso.txt","木戸は目をとじて、歯をくいしばり、時々呻きをもらすだけ。"
"537","sakaguchi","keimano_genso.txt",""
"538","sakaguchi","keimano_genso.txt","「目をあいて、オレを見な。"
"539","sakaguchi","keimano_genso.txt","オレの目を見な。"
"540","sakaguchi","keimano_genso.txt","お前の性根はくさっているぞ。"
"541","sakaguchi","keimano_genso.txt","お前の魂はまだ将棋指しの泥沼からぬけていないよ。"
"542","sakaguchi","keimano_genso.txt","人間は自然の子だ。"
"543","sakaguchi","keimano_genso.txt","カボチャや大根と同じものだぞ。"
"544","sakaguchi","keimano_genso.txt","ちっとも偉いことない。"
"545","sakaguchi","keimano_genso.txt","まだ、わからないか。"
"546","sakaguchi","keimano_genso.txt","このガキ！」"
"547","sakaguchi","keimano_genso.txt","チョイとアゴを押して、ゴツンと頭を柱にぶつけさせた。"
"548","sakaguchi","keimano_genso.txt","なるほど、気のせいか、手荒という感じがしない。"
"549","sakaguchi","keimano_genso.txt","しかし、とにかく怪力である。"
"550","sakaguchi","keimano_genso.txt","チョイと押されてコツンと後頭をぶつだけでも痛そうであるが、いかにも愛情のこもった感じに見えてきたからフシギである。"
"551","sakaguchi","keimano_genso.txt","これが母親の愛情か、たしかに、どことなくなつかしいようなオモムキもあるなと野村は感心したのであった。"
"552","sakaguchi","keimano_genso.txt","娘教祖は木戸のいましめを解いてやって、"
"553","sakaguchi","keimano_genso.txt","「むかしの仲間だ。"
"554","sakaguchi","keimano_genso.txt","ゆっくり話し合うがよい。"
"555","sakaguchi","keimano_genso.txt","オレに気兼ね遠慮するな。"
"556","sakaguchi","keimano_genso.txt","ウソをつくのは、なお悪いぞ。"
"557","sakaguchi","keimano_genso.txt","思うように語りあうのが何よりだ。"
"558","sakaguchi","keimano_genso.txt","その間にオレがイモでも煮てやるからな」"
"559","sakaguchi","keimano_genso.txt","と土間へ降りてガチャ／＼やりはじめた。"
"560","sakaguchi","keimano_genso.txt",""
"561","sakaguchi","keimano_genso.txt","まことに自然で、人生の深処に達した風格が感ぜられる様であった。"
"562","sakaguchi","keimano_genso.txt",""
"563","sakaguchi","keimano_genso.txt","「よくできとるじゃないか。"
"564","sakaguchi","keimano_genso.txt","どうも、お見それしたな。"
"565","sakaguchi","keimano_genso.txt","オレも先祖の大婆サンに会ってるような気がしてきたよ」"
"566","sakaguchi","keimano_genso.txt","野村はシャッポをぬいだ気持であった。"
"567","sakaguchi","keimano_genso.txt",""
"568","sakaguchi","keimano_genso.txt","「まったくですよ。"
"569","sakaguchi","keimano_genso.txt","彼女は第一印象や尊大な外観とは反対に、凄みや妖怪的なところは実際はないのですよ。"
"570","sakaguchi","keimano_genso.txt","彼女が病気のオヤジサンを大八車に荒ナワでしばりつけて坂道を大いに荒っぽく手心しながらガッタンゴットンひきずり降したことだって、要するにただ運動ですね。"
"571","sakaguchi","keimano_genso.txt","たとえばアリが物を運ぶ運動。"
"572","sakaguchi","keimano_genso.txt","そして病人は居ない方がよいという、これも単に精神上の運動ですよ、女王蜂がオス蜂を殺すような運動です。"
"573","sakaguchi","keimano_genso.txt","そこに罪悪はありませんが、翳はあります。"
"574","sakaguchi","keimano_genso.txt","人間が見れば女王蜂の殺人運動にも翳は見るものなんですね。"
"575","sakaguchi","keimano_genso.txt","ボクはその翳を見たのです。"
"576","sakaguchi","keimano_genso.txt","それが四五桂だったんですね。"
"577","sakaguchi","keimano_genso.txt","この四五桂に錯覚しなかったのは、せめてもボクの誇りなんです。"
"578","sakaguchi","keimano_genso.txt","ボクが盤の生活よりもこの生活に真実を見出していることを察していただけるでしょう。"
"579","sakaguchi","keimano_genso.txt","もっとも彼女の目から見れば、ボクの見出した真実がまだ何程のものでもないことは、これも当然ですがね」"
"580","sakaguchi","keimano_genso.txt","「キミは彼女、彼女ッて、そんな云い方をしていいのかい」"
"581","sakaguchi","keimano_genso.txt","「それはいいですとも。"
"582","sakaguchi","keimano_genso.txt","表現は何ほどのものでもありません。"
"583","sakaguchi","keimano_genso.txt","ボクにふさわしい表現しかできないのは当然ですから」"
"584","sakaguchi","keimano_genso.txt","「つまり実体は女房なんだろうね」"
"585","sakaguchi","keimano_genso.txt","「肉体は何ほどでもないですよ。"
"586","sakaguchi","keimano_genso.txt","肉体的に女房であることは確かですが、ボクにはむしろ母親であり、祖母ですね。"
"587","sakaguchi","keimano_genso.txt","母親であり、女房であり、また処女ですよ」"
"588","sakaguchi","keimano_genso.txt","「しかし、キミは肉体的にはハッキリ亭主なんだろうね。"
"589","sakaguchi","keimano_genso.txt","くどいようだが、ハッキリ云っておくれ。"
"590","sakaguchi","keimano_genso.txt","オレは都会の虫ケラだから、こういうことはハッキリ云ってもらわないと迷うんだよ」"
"591","sakaguchi","keimano_genso.txt","「それはハッキリ亭主ですとも。"
"592","sakaguchi","keimano_genso.txt","しかし、肉体上の関係は、精神的な関係とはツナガリがないものですよ」"
"593","sakaguchi","keimano_genso.txt","「そういうものかね」"
"594","sakaguchi","keimano_genso.txt","「そういうものです」"
"595","sakaguchi","keimano_genso.txt","「彼女だけについてはね。"
"596","sakaguchi","keimano_genso.txt","オレもそんな気がしてきたからね。"
"597","sakaguchi","keimano_genso.txt","まったく先祖の大婆サンに会ってるような気がしてきたからさ。"
"598","sakaguchi","keimano_genso.txt","しかしどうも、変な世界があるものだね。"
"599","sakaguchi","keimano_genso.txt","あの振袖まで先祖の大婆サンの衣裳のように見えてきたから奇妙じゃないか」"
"600","sakaguchi","keimano_genso.txt","「あなたはさすがに物分りがよろしいです」"
"601","sakaguchi","keimano_genso.txt","そこへ振袖の大婆サンがイモのふかしたのを運んできてくれた。"
"602","sakaguchi","keimano_genso.txt","彼女はすでに物分りがよかった。"
"603","sakaguchi","keimano_genso.txt","今日は客人をもてなす日なのだ。"
"604","sakaguchi","keimano_genso.txt","都会の虫ケラをも亭主の昔の仲間として、いたわってくれるつもりなのである。"
"605","sakaguchi","keimano_genso.txt",""
"606","sakaguchi","keimano_genso.txt","「たんとおあがり」"
"607","sakaguchi","keimano_genso.txt","「うむ、これはうまい！」"
"608","sakaguchi","keimano_genso.txt","野村はつかえがおりたような気持になった。"
"609","sakaguchi","keimano_genso.txt","遠慮というものを忘れたような解放された気持になったのである。"
"610","sakaguchi","keimano_genso.txt","くさりかけたイモであったが、食慾はフシギに衰えなかったほどである。"
"611","sakaguchi","keimano_genso.txt",""
"612","sakaguchi","keimano_genso.txt","「しかし、もう再び来るところではないな」"
"613","sakaguchi","keimano_genso.txt","とイモを食いあいた時に思ったのである。"
"614","sakaguchi","keimano_genso.txt","虫ケラの生活にもさしたる魅力があるわけではないが、先祖の大婆サンと好んで共同生活をいとなむことがより良い生活とも思われない。"
"615","sakaguchi","keimano_genso.txt",""
"616","sakaguchi","keimano_genso.txt","「キミは適所を得たらしいが、オレは再びキミを訪ねないぜ」"
"617","sakaguchi","keimano_genso.txt","と野村は念を押して別れを告げたのである。"
"618","sakaguchi","keimano_genso.txt","念を押さずにいられないような妙な不安におそわれたからである。"
"619","sakaguchi","keimano_genso.txt",""
"620","sakaguchi","keimano_genso.txt",""
"621","sakaguchi","keimano_genso.txt",""
"622","sakaguchi","keimano_genso.txt",""
"623","sakaguchi","keimano_genso.txt","底本：「坂口安吾全集15」筑摩書房"
"624","sakaguchi","keimano_genso.txt","1999（平成11）年10月20日初版第1刷発行"
"625","sakaguchi","keimano_genso.txt","底本の親本：「小説新潮第八巻第一六号」"
"626","sakaguchi","keimano_genso.txt","1954（昭和29）年12月1日発行"
"627","sakaguchi","keimano_genso.txt","初出：「小説新潮第八巻第一六号」"
"628","sakaguchi","keimano_genso.txt","1954（昭和29）年12月1日発行"
"629","sakaguchi","keimano_genso.txt","入力：tatsuki"
"630","sakaguchi","keimano_genso.txt","校正：小林繁雄"
"631","sakaguchi","keimano_genso.txt","2006年9月22日作成"
"632","sakaguchi","keimano_genso.txt","青空文庫作成ファイル："
"633","sakaguchi","keimano_genso.txt","このファイルは、インターネットの図書館、青空文庫（http://www.aozora.gr.jp/）で作られました。"
"634","sakaguchi","keimano_genso.txt","入力、校正、制作にあたったのは、ボランティアの皆さんです。"
"635","sakaguchi","keimano_genso.txt",""
