"","auth","piece","line"
"0","sakaguchi","mo_gunbiwa_iranai.txt","もう軍備はいらない"
"1","sakaguchi","mo_gunbiwa_iranai.txt","坂口安吾"
"2","sakaguchi","mo_gunbiwa_iranai.txt",""
"3","sakaguchi","mo_gunbiwa_iranai.txt","-------------------------------------------------------"
"4","sakaguchi","mo_gunbiwa_iranai.txt","【テキスト中に現れる記号について】"
"5","sakaguchi","mo_gunbiwa_iranai.txt",""
"6","sakaguchi","mo_gunbiwa_iranai.txt","：入力者注主に外字の説明や、傍点の位置の指定"
"7","sakaguchi","mo_gunbiwa_iranai.txt","（数字は、JIS X 0213の面区点番号、または底本のページと行数）"
"8","sakaguchi","mo_gunbiwa_iranai.txt","（例）益※"
"9","sakaguchi","mo_gunbiwa_iranai.txt","-------------------------------------------------------"
"10","sakaguchi","mo_gunbiwa_iranai.txt",""
"11","sakaguchi","mo_gunbiwa_iranai.txt","原子バクダンの被害写真が流行しているので、私も買った。"
"12","sakaguchi","mo_gunbiwa_iranai.txt","ひどいと思った。"
"13","sakaguchi","mo_gunbiwa_iranai.txt",""
"14","sakaguchi","mo_gunbiwa_iranai.txt","しかし、戦争なら、どんな武器を用いたって仕様がないじゃないか、なぜヒロシマやナガサキだけがいけないのだ。"
"15","sakaguchi","mo_gunbiwa_iranai.txt","いけないのは、原子バクダンじゃなくて、戦争なんだ。"
"16","sakaguchi","mo_gunbiwa_iranai.txt",""
"17","sakaguchi","mo_gunbiwa_iranai.txt","東京だってヒドかったね。"
"18","sakaguchi","mo_gunbiwa_iranai.txt","ショーバイ柄もあったが、空襲のたび、まだ燃えている焼跡を歩きまわるのがあのころの私の日課のようなものであった。"
"19","sakaguchi","mo_gunbiwa_iranai.txt","公園の大きな空壕の中や、劇場や地下室の中で、何千という人たちが一かたまり折り重なって私の目の前でまだいぶっていたね。"
"20","sakaguchi","mo_gunbiwa_iranai.txt",""
"21","sakaguchi","mo_gunbiwa_iranai.txt","サイパンだのオキナワだのイオー島などで、まるで島の害虫をボクメツするようにして人間が一かたまりに吹きとばされても、それが戦争なんだ。"
"22","sakaguchi","mo_gunbiwa_iranai.txt",""
"23","sakaguchi","mo_gunbiwa_iranai.txt",""
"24","sakaguchi","mo_gunbiwa_iranai.txt","私もあのころは生きて再び平和の日をむかえる希望の半分を失っていた。"
"25","sakaguchi","mo_gunbiwa_iranai.txt","日本という国と一しょにオレも亡びることになるだろうとバクゼンと思いふけりながら、終戦ちかいころの焼野原にかこまれた乞食小屋のような防空壕の中でその時間を待つ以外に手がなかったものだ。"
"26","sakaguchi","mo_gunbiwa_iranai.txt","三発目の原子バクダンがいつオレの頭上にサクレツするかと怯えつづけていたが、原子バクダンを呪う気持などはサラサラなかったね。"
"27","sakaguchi","mo_gunbiwa_iranai.txt","オレの手に原子バクダンがあれば、むろん敵の頭の上でそれをいきなりバクハツさせてやったろう。"
"28","sakaguchi","mo_gunbiwa_iranai.txt","何千という一かたまりの焼死体や、コンクリのカケラと一しょにねじきれた血まみれのクビが路にころがっているのを見ても、あのころは全然不感症だった。"
"29","sakaguchi","mo_gunbiwa_iranai.txt","美も醜もない。"
"30","sakaguchi","mo_gunbiwa_iranai.txt","死臭すら存在しない。"
"31","sakaguchi","mo_gunbiwa_iranai.txt","屍体のかたわらで平然とベントーも食えたであろう。"
"32","sakaguchi","mo_gunbiwa_iranai.txt","一分後には自分の運命がそうなるかも知れないというのが毎日のさしせまった思いの全部だから、散らばってる人々の屍体が変テツもない自然の風景にすぎなかった。"
"33","sakaguchi","mo_gunbiwa_iranai.txt",""
"34","sakaguchi","mo_gunbiwa_iranai.txt","二月十五日だかの銀座のバクゲキ、三月十日の下町の熱地獄以来、四月と五月には私自身の頭上や身辺に落ちてきた焼夷ダンやバクダンだけでも何百発もあった。"
"35","sakaguchi","mo_gunbiwa_iranai.txt","豪雨の夜中に近所の工場の上に照明ダンをたらして二百機が入れ代り立ち代り二時間にわたってバクゲキし、その半分がそれダマになって何百匹のカミナリが私の周囲をかけめぐるようなバクゲキがつづいた晩は息がつまったね。"
"36","sakaguchi","mo_gunbiwa_iranai.txt","けれどもバクゲキが終ると、まず穴から首をだして形勢を眺め、つづいて隣りの被害を見物し、規則正しい大きな波のウネリのようなバクダンの穴ボコの行列と、その四周の吹きとばされ、なぎ倒された家々のウネリと、壁や柱や屋根やハメ板のゴチャマゼの中の首や足などを見て歩く。"
"37","sakaguchi","mo_gunbiwa_iranai.txt","なんの感情もない。"
"38","sakaguchi","mo_gunbiwa_iranai.txt","その首や足が私でなかったというだけのことだ。"
"39","sakaguchi","mo_gunbiwa_iranai.txt","はるかなキリもない旅をしているような虚脱の日々があるだけのことだった。"
"40","sakaguchi","mo_gunbiwa_iranai.txt",""
"41","sakaguchi","mo_gunbiwa_iranai.txt","焼夷ダンに追いまくられたのは、夜三度、昼三度。"
"42","sakaguchi","mo_gunbiwa_iranai.txt","昼のうち二度は焼け残りの隣りの区のバクゲキを見物に行って、第二波にこッちがまきこまれ、目の前たッた四五間のところに五六十本の焼夷ダンが落ちてきて、いきなり路上に五六十本のタケノコが生えて火をふきだしたから、ふりむいて戻ろうと思ったら、どッこい、うしろの道にもいきなり足もとに五六十本のタケノコが生えやがった。"
"43","sakaguchi","mo_gunbiwa_iranai.txt","仕方がないから火勢の衰えるのを待ってタケノコの間を縫いながら渡っていると、十字路の右と左に、また五六十本のタケノコがいきなり生えた。"
"44","sakaguchi","mo_gunbiwa_iranai.txt","見まわすと、百米ぐらいまでの彼方此方の屋根にバラバラ、ガラガラとタケノコがふりこめており、たまにはそれを抑えたり投げたりして別世界の人のように格闘している人の姿も見えはしたが、通行人たちはニワカ雨のハレマを見て歩いているという様子でしかなかった。"
"45","sakaguchi","mo_gunbiwa_iranai.txt","頭の真上に焼夷ダンが落ちて大の字になって威張って死んでる男がいた。"
"46","sakaguchi","mo_gunbiwa_iranai.txt","通行人の一人が死人の腰にくくりつけた弁当包みを手にのせてみて、"
"47","sakaguchi","mo_gunbiwa_iranai.txt","「まだ弁当食ってねえや」"
"48","sakaguchi","mo_gunbiwa_iranai.txt","ほかの通行人たちの顔を見まわしてニヤリと笑って言やアがった。"
"49","sakaguchi","mo_gunbiwa_iranai.txt","この時は薄気味わるかったね。"
"50","sakaguchi","mo_gunbiwa_iranai.txt","オレがまだこの通行人ほど正直でないような気がして、そこまで正直にさせないと気がすまないような戦争という飛んでもないデカダン野郎に重ね重ねのウラミツラミがよみがえったようだった。"
"51","sakaguchi","mo_gunbiwa_iranai.txt","しかし、そういうことにシゲキされていくらか理性だか正気のようなものの影がさしてハッとすることがあったけれども、すぐ目の前で小さなバクダンの筒に頭を砕かれて大の字にひッくり返って死んだ人間については全然無感動であったと云ってよい。"
"52","sakaguchi","mo_gunbiwa_iranai.txt","雨に打たれて誰かが死んだ。"
"53","sakaguchi","mo_gunbiwa_iranai.txt","それがオレでなかっただけの話にすぎないのである。"
"54","sakaguchi","mo_gunbiwa_iranai.txt",""
"55","sakaguchi","mo_gunbiwa_iranai.txt","小平某という奴があの最中に女の子を強姦しては殺していたという。"
"56","sakaguchi","mo_gunbiwa_iranai.txt","あの最中に人を殺すとは妙な奴だ。"
"57","sakaguchi","mo_gunbiwa_iranai.txt","つまり、人を殺すという良心――人を殺して自分の生きのびる手段にしようという尋常な良心が、まだ麻痺しないでノルマルに動いていたらしいや。"
"58","sakaguchi","mo_gunbiwa_iranai.txt",""
"59","sakaguchi","mo_gunbiwa_iranai.txt","一時間後には自分がどうなるか分りやしないということが唯一の人生の信条となりきっていた筈のあの最中に、自分の罪を隠すために人を殺すというような平常の心がチャンと時計のように動いているのは異常なことさね、あの場合に於てはまさに驚くべき良心だね。"
"60","sakaguchi","mo_gunbiwa_iranai.txt",""
"61","sakaguchi","mo_gunbiwa_iranai.txt","あの時の大半の人間というものは自分の手で人を殺すことも忘れていたようなものだ。"
"62","sakaguchi","mo_gunbiwa_iranai.txt","どうせみんな死んじまい、焼けちまい、バラバラになっちまうんだ。"
"63","sakaguchi","mo_gunbiwa_iranai.txt","我々の理性も感情も躾けもみんな失われ一変して、戦争という大きさのケタの違うデカダンが心や習性の全部にとって代っていたのだ。"
"64","sakaguchi","mo_gunbiwa_iranai.txt","それに比べると、小平某はあの最中に良心もタシナミも失わず、はるかにデカダンではなかったのさ。"
"65","sakaguchi","mo_gunbiwa_iranai.txt","あの野郎はフテエ野郎だというのは戦争がすんでからの話さ。"
"66","sakaguchi","mo_gunbiwa_iranai.txt",""
"67","sakaguchi","mo_gunbiwa_iranai.txt","いったん戦争になッちまえば、健全なのは小平君ぐらいのもので、人間は地獄の人たちよりもはるかに無感動、無意志の冷血ムザンな虫になるだけのことだ。"
"68","sakaguchi","mo_gunbiwa_iranai.txt","おそらくそのとき何が美しいと云ったってサクレツする原子バクダンぐらい素敵な美はないだろう。"
"69","sakaguchi","mo_gunbiwa_iranai.txt","あの頃でも自分をバクゲキにくる敵の飛行機が一番美しく見えた。"
"70","sakaguchi","mo_gunbiwa_iranai.txt","そして、その美を見ることができた代りに死ななければならないということは、たいしたことじゃアないのさ。"
"71","sakaguchi","mo_gunbiwa_iranai.txt","人を殺すのが戦争じゃないか。"
"72","sakaguchi","mo_gunbiwa_iranai.txt","戦争とは人を殺すことなんだ。"
"73","sakaguchi","mo_gunbiwa_iranai.txt",""
"74","sakaguchi","mo_gunbiwa_iranai.txt",""
"75","sakaguchi","mo_gunbiwa_iranai.txt","こんな戦争をさせるヤツは何ヤツなのだろう？勝たずば生きて帰らじと……というような歌を戦争の時もオリンピックの時もとかく歌いたがる日本人だが、戦争が好きだという日本人が決してタクサンいるわけではなかろう。"
"76","sakaguchi","mo_gunbiwa_iranai.txt","けれども権力に無抵抗主義の日本人は近づく戦争にも無抵抗で、戦争も一ツの天災だというようにバクゼンと諦めきっているのかも知れない。"
"77","sakaguchi","mo_gunbiwa_iranai.txt","そして、天災に襲われ叩きのめされてもたじろがず、ツルハシやクワを握って立ち上り立ち向う根気をこの上もない美徳と考えているのかも知れないな。"
"78","sakaguchi","mo_gunbiwa_iranai.txt","また、天災にそなえて非常米を備蓄するのと同じように軍備というものを考えているのかも知れない。"
"79","sakaguchi","mo_gunbiwa_iranai.txt","しかし戦争は天災ではないのだから、努力や工夫や良識によってそれを避けることもできるし、非常米のように軍隊をたくわえておく必要が不可欠のものでは決してない。"
"80","sakaguchi","mo_gunbiwa_iranai.txt",""
"81","sakaguchi","mo_gunbiwa_iranai.txt","＊"
"82","sakaguchi","mo_gunbiwa_iranai.txt","自分が国防のない国へ攻めこんだあげくに負けて無腰にされながら、今や国防と軍隊の必要を説き、どこかに攻めこんでくる兇悪犯人が居るような云い方はヨタモンのチンピラどもの言いぐさに似てるな。"
"83","sakaguchi","mo_gunbiwa_iranai.txt","ブタ箱から出てきた足でさッそくドスをのむ奴の云いぐさだ。"
"84","sakaguchi","mo_gunbiwa_iranai.txt",""
"85","sakaguchi","mo_gunbiwa_iranai.txt","冷い戦争という地球をおおう妖雲をとりのぞけば、軍備を背負った日本の姿は殺人強盗的であろう。"
"86","sakaguchi","mo_gunbiwa_iranai.txt",""
"87","sakaguchi","mo_gunbiwa_iranai.txt","貧乏者の子沢山というが、五反百姓に十八人も子供がいるような日本。"
"88","sakaguchi","mo_gunbiwa_iranai.txt","天然資源的に見れば取り代えるオシメにも事欠く程度の素寒貧だし、持てる五反の畑も人里はなれて山のテッペンに近いような、もしくは湖水の中の小島のような不便なところに孤立して細々と貧乏ぐらしを立てている。"
"89","sakaguchi","mo_gunbiwa_iranai.txt",""
"90","sakaguchi","mo_gunbiwa_iranai.txt","気のきいた泥棒も、気のきかない泥棒も、そんなところへ物を盗みに行くはずがないじゃないか。"
"91","sakaguchi","mo_gunbiwa_iranai.txt","しかるにそこの貧乏オヤジは泥棒きたるべしとダンビラを買いこみ朝な夕なネタバをあわせ、そのために十八人の子供のオマンマは益※半減し、豊富なのは天井のクモの巣だけ、そのクモの巣をすかして屋根の諸方の孔から東西南北の空が見えるという小屋の中でダンビラだけ光ってやがる。"
"92","sakaguchi","mo_gunbiwa_iranai.txt",""
"93","sakaguchi","mo_gunbiwa_iranai.txt","ここのウチへ間抜け泥棒が忍びこむよりも、このオヤジが殺人強盗に転ずる率が多いのは分りきった話じゃないか。"
"94","sakaguchi","mo_gunbiwa_iranai.txt","十八人の子供に武術を仕込んでめいめいにダンビラを握らせて荒稼ぎするうちに天晴れ野武士海賊の頭となりついに大名となってメデタシメデタシということは、個人的にも国家的にもない話ではなかった。"
"95","sakaguchi","mo_gunbiwa_iranai.txt","今日の紳士や紳士国の中の少からぬ数が、こういう風にして成り上った旦那かその子孫かであることも確かである。"
"96","sakaguchi","mo_gunbiwa_iranai.txt","しかし、今後に於てはその可能性はなくなる一方であるし、その代りには、もっと安定した稼ぎ方で着実に富貴に至る道がありうる時代にもなっている。"
"97","sakaguchi","mo_gunbiwa_iranai.txt",""
"98","sakaguchi","mo_gunbiwa_iranai.txt","ピストルやダンビラを枕もとに並べ、用心棒や猛犬を飼って国防を厳にする必要があるのは金持のことである。"
"99","sakaguchi","mo_gunbiwa_iranai.txt","今の日本が金持と同じように持つことができるものは、そして失う心配があるものは、自由とイノチぐらいのものじゃないか。"
"100","sakaguchi","mo_gunbiwa_iranai.txt","ところが、戦争ぐらいその自由もイノチも奪うものは有りやしない。"
"101","sakaguchi","mo_gunbiwa_iranai.txt",""
"102","sakaguchi","mo_gunbiwa_iranai.txt","あまり結構な身分じゃないけれども、泥棒に狙われる心配がない身分になってみると、ピストルだ用心棒だと備えを立てて睡眠不足になっている金持どものバカさ加減が分るものだ。"
"103","sakaguchi","mo_gunbiwa_iranai.txt","すくなくとも自分が殺人強盗になろうという気持がなければ、泥棒の備えを立てるに汲々たる金持どもが利巧に見える筈はありっこない。"
"104","sakaguchi","mo_gunbiwa_iranai.txt",""
"105","sakaguchi","mo_gunbiwa_iranai.txt","泥棒の心配で夜もオチオチ眠れないような身分になってみたいもんだというのは重々ゴモットモではあるが、金持は泥棒の心配をしなければならないものだという天の定めがあるわけではない。"
"106","sakaguchi","mo_gunbiwa_iranai.txt","金持になって、おまけに泥棒の心配をせずにすむなら、これに越したことはないさ。"
"107","sakaguchi","mo_gunbiwa_iranai.txt",""
"108","sakaguchi","mo_gunbiwa_iranai.txt","国防は武力に限るときめてかかっているのは軽率であろう。"
"109","sakaguchi","mo_gunbiwa_iranai.txt",""
"110","sakaguchi","mo_gunbiwa_iranai.txt","＊"
"111","sakaguchi","mo_gunbiwa_iranai.txt","今日までの金持というものは、だいたいにねかせた財産をもち、その大小によって金持の番附がつくられるような富の在り方であった。"
"112","sakaguchi","mo_gunbiwa_iranai.txt","莫大な預金、広大な所有地。"
"113","sakaguchi","mo_gunbiwa_iranai.txt","そしてそれは泥棒が主として狙う富でもあった。"
"114","sakaguchi","mo_gunbiwa_iranai.txt","だが、財産とか富貴というものがそれだけだとは限らない。"
"115","sakaguchi","mo_gunbiwa_iranai.txt","泥棒がどうすることもできないような財産もありうるであろう。"
"116","sakaguchi","mo_gunbiwa_iranai.txt",""
"117","sakaguchi","mo_gunbiwa_iranai.txt","高い工業技術とか優秀な製品というものは、その技能を身につけた人間を盗まぬ限りは盗むわけにはゆかない。"
"118","sakaguchi","mo_gunbiwa_iranai.txt","そしてそれが特定の少数の人に属するものではなく国民全部に行きたわっている場合には盗みようがない。"
"119","sakaguchi","mo_gunbiwa_iranai.txt",""
"120","sakaguchi","mo_gunbiwa_iranai.txt","美しい芸術を創ったり、うまい食べ物を造ったり、便利な生活を考案したりして、またそれを味うことが行きわたっているような生活自体を誰も盗むことができないだろう。"
"121","sakaguchi","mo_gunbiwa_iranai.txt","すくなくとも、その国が自ら戦争さえしなければ、それがこわされる筈はあるまい。"
"122","sakaguchi","mo_gunbiwa_iranai.txt",""
"123","sakaguchi","mo_gunbiwa_iranai.txt","このような生活自体の高さや豊かさというものは、それを守るために戦争することも必要ではなくなる性質のものだ。"
"124","sakaguchi","mo_gunbiwa_iranai.txt","有りあまる金だの土地だのは持たないし、むしろ有りあまる物を持たずにモウケをそッくり生活を豊かにするためにつぎこんでいる国からは、国民の生活以外に盗むものがない。"
"125","sakaguchi","mo_gunbiwa_iranai.txt","そしてその国民が自ら戦争さえしなければ、その生活は盗まれることがなかろう。"
"126","sakaguchi","mo_gunbiwa_iranai.txt",""
"127","sakaguchi","mo_gunbiwa_iranai.txt","けれどもこんな国へもガムシャラに盗みを働きにくるキ印がいないとは限らないが、キ印を相手に戦争してよけいなケガを求めるのはバカバカしいから、さっさと手をあげて降参して相手にならずにいれば、それでも手当り次第ぶっこわすようなことはさすがにキ印でもできないし、さて腕力でおどしつけて家来にしたつもりでいたものの、生活万般にわたって家来の方がはるかに高くて豊かなことが分ってくるにしたがってさすがのキ印もだんだん気が弱くなり、結構ダンビラふりかざしてあばれこんできたキ印の方が居候のような手下のようなヒケメを持つようになってしまう。"
"128","sakaguchi","mo_gunbiwa_iranai.txt","昔からキ印やバカは腕ッ節が強くてイノチ知らずだからケンカや戦争には勝つ率が多くて文化の発達した国の方が降参する例が少くなかったけれども、結局ダンビラふりまわして睨めまわしているうちにキ印やバカの方がだんだん居候になり、手下になって、やがて腑ぬけになってダンビラを忘れた頃を見すまされて逆に追ンだされたり完全な家来にしてもらって隅の方に居ついたりしてしまう。"
"129","sakaguchi","mo_gunbiwa_iranai.txt",""
"130","sakaguchi","mo_gunbiwa_iranai.txt","もっともキ印がダンビラふりまわして威勢よく乗りこんできた当座はいくら利巧者が相手にならなくとも、相当の被害はまぬがれない。"
"131","sakaguchi","mo_gunbiwa_iranai.txt","女の子が暴行されたり、男の子が頭のハチを割られ片腕をヘシ折られキンタマを蹴りつぶされるようなことが相当ヒンピンと起ることはキ印相手のことでどうにも仕方がないが、それにしてもキ印相手にまともに戦争して殺されぶッこわされるのに比べれば被害は何万億分の一の軽さだか知れやしない。"
"132","sakaguchi","mo_gunbiwa_iranai.txt","その国の文化水準や豊かな生活がシッカリした土台や支柱で支えられていさえすれば、結局キ印が居候になり家来になって隅ッこへひッこむことに相場がきまっているのである。"
"133","sakaguchi","mo_gunbiwa_iranai.txt",""
"134","sakaguchi","mo_gunbiwa_iranai.txt","腕力と文明を混同するのがマチガイのもとである。"
"135","sakaguchi","mo_gunbiwa_iranai.txt","原子バクダンだって鬼がふりまわすカナ棒の程度のもので、本当の文明文化はそれとはまるで違う。"
"136","sakaguchi","mo_gunbiwa_iranai.txt","めいめいの豊かな生活だけが本当の文明文化というものである。"
"137","sakaguchi","mo_gunbiwa_iranai.txt",""
"138","sakaguchi","mo_gunbiwa_iranai.txt","国防のためには原子バクダンだって本当はいらない筈のものだ。"
"139","sakaguchi","mo_gunbiwa_iranai.txt","攻めこんでくるキ印がみんな自然に居候になって隅ッこへひっこむような文明文化の生活を確立するに限るのである。"
"140","sakaguchi","mo_gunbiwa_iranai.txt","五反百姓の子沢山という日本がこのままマトモに働いて金持になれないというのは妄想である。"
"141","sakaguchi","mo_gunbiwa_iranai.txt","有り余るお金や耕しきれない広大な土地は財産じゃない、それを羨む必要はないのである。"
"142","sakaguchi","mo_gunbiwa_iranai.txt","そして国民全体が優秀な技術家になることや、国そのものが優秀な工場になることは不可能ではなかろう。"
"143","sakaguchi","mo_gunbiwa_iranai.txt",""
"144","sakaguchi","mo_gunbiwa_iranai.txt","我々の未来が過去の歴史や過去の英雄から抜けだすことはありうるものだ。"
"145","sakaguchi","mo_gunbiwa_iranai.txt","食うものを食わずにダンビラを買い集めて朝夕せッせととぎすましたり原子バクダンを穴倉にためこむような人々を羨む必要はないじゃないか。"
"146","sakaguchi","mo_gunbiwa_iranai.txt","何百万何千万人の兄弟を殺したあげくにようやく戦争に勝ったというようなことが本当の勝利であろうか。"
"147","sakaguchi","mo_gunbiwa_iranai.txt",""
"148","sakaguchi","mo_gunbiwa_iranai.txt","泥棒や人殺しは割が合わないと云うが、戦争というものも勝っても割が合わないものだ。"
"149","sakaguchi","mo_gunbiwa_iranai.txt","かりに一ツの国が全世界を征服しても、全世界を征服することによってはじめて得られるという特別の個人生活は有りやしない。"
"150","sakaguchi","mo_gunbiwa_iranai.txt","そんなバカバカしく大ゲサなことをしたって有り余るものを持ちすぎるだけのことで、人を征服することによって自分たちの生活が多少でも豊かになるような国はもともとよッぽど文化文明の生活程度が低かっただけの話、つまり彼は単に腕ッ節の強いキ印であるにすぎず、即ち彼はやがて居候になるべき人物であるにすぎないのである。"
"151","sakaguchi","mo_gunbiwa_iranai.txt","文化文明の生活程度を高めるためには、戦争することも、人を征服することも不要である。"
"152","sakaguchi","mo_gunbiwa_iranai.txt","そこにはおのずから限度があって、戦争に引き合うような途方もない国民生活水準が有るべきものではないのである。"
"153","sakaguchi","mo_gunbiwa_iranai.txt",""
"154","sakaguchi","mo_gunbiwa_iranai.txt","日本という国も泥棒の心配がいらない身分におちぶれてみて、いろいろのことが分らなければならない道理であったろう。"
"155","sakaguchi","mo_gunbiwa_iranai.txt",""
