"","auth","piece","line"
"156","sakaguchi","mo_gunbiwa_iranai.txt","昔は三大強国と自称し、一等国の中のそのまたＡクラスから負けて四等国に落ッこッたと本人は云ってるけれども、その四等国のしかも散々叩きつぶされ焼きはらわれ手足をもがれて丸ハダカになってからやッと七年目にすぎないというのに、もうそろそろ昔の自称一等国時代の生活水準と変りがないじゃないか。"
"157","sakaguchi","mo_gunbiwa_iranai.txt","足りないものは軍艦や戦車や飛行機だけ。"
"158","sakaguchi","mo_gunbiwa_iranai.txt","つまり負けるまでは四等国の生活水準を国防するために超Ａクラスのダンビラをそろえて磨きあげて目玉をギョロつかせていただけのことではないか。"
"159","sakaguchi","mo_gunbiwa_iranai.txt",""
"160","sakaguchi","mo_gunbiwa_iranai.txt","人に無理強いされた憲法だと云うが、拙者は戦争はいたしません、というのはこの一条に限って全く世界一の憲法さ。"
"161","sakaguchi","mo_gunbiwa_iranai.txt","戦争はキ印かバカがするものにきまっているのだ。"
"162","sakaguchi","mo_gunbiwa_iranai.txt","四等国が超Ａクラスの軍備をととのえて目の玉だけギョロつかせて威張り返って睨めまわしているのも滑稽だが、四等国が四等国なみの軍備をととのえそれで一人前の体裁がととのったつもりでいるのも同じように滑稽である。"
"163","sakaguchi","mo_gunbiwa_iranai.txt","日本ばかりではないのだ。"
"164","sakaguchi","mo_gunbiwa_iranai.txt","軍備をととのえ、敵なる者と一戦を辞せずの考えに憑かれている国という国がみんな滑稽なのさ。"
"165","sakaguchi","mo_gunbiwa_iranai.txt","彼らはみんなキツネ憑きなのさ。"
"166","sakaguchi","mo_gunbiwa_iranai.txt","本性はまだ居候の域を卒業しておらず、要するに地球上には本当の一等国も二等国もまだ存在せず、ようやく三等国ぐらいがそれもチラホラ、そんなものだ。"
"167","sakaguchi","mo_gunbiwa_iranai.txt","大軍備、原子バクダンのたぐいは三好清海入道の鉄の棒に類するもので、それをぶらさげて歩くだけ腹がへるにすぎない。"
"168","sakaguchi","mo_gunbiwa_iranai.txt",""
"169","sakaguchi","mo_gunbiwa_iranai.txt","戦争や軍備は割に合わないにきまっているが、そのために大いに割が合う少数の実業家や、そのために職にありつける失業者や、今度という今度はギャバ族のアラモード、南京虫、電蓄、ピアノはおろか銀座をそッくりぶッたくッてやろうと考えながらサツマイモの畑を耕している百姓などがあちこちにいて軍備や戦争熱を支持し、国論も次第にそれにひきずられて傾き易いということは悲しむべきことではあるが、世界中がキツネ憑きであってみれば日本だけキツネを落すということも容易でないのはやむを得ない。"
"170","sakaguchi","mo_gunbiwa_iranai.txt","けれども、ともかく憲法によって軍備も戦争も捨てたというのは日本だけだということ、そしてその憲法が人から与えられ強いられたものであるという面子に拘泥さえしなければどの国よりも先にキツネを落す機会にめぐまれているのも日本だけだということは確かであろう。"
"171","sakaguchi","mo_gunbiwa_iranai.txt",""
"172","sakaguchi","mo_gunbiwa_iranai.txt","軍備や戦争をすてたって、にわかに一等国にも、二等国にも、三等国にも立身する筈はないけれども、軍備や戦争をすてない国は永久に一等国にも二等国にもなる筈ないさ。"
"173","sakaguchi","mo_gunbiwa_iranai.txt",""
"174","sakaguchi","mo_gunbiwa_iranai.txt","この地上に本当に戦争をしたがっている誰かがいるのであろうか。"
"175","sakaguchi","mo_gunbiwa_iranai.txt",""
"176","sakaguchi","mo_gunbiwa_iranai.txt","まるで焼鳥のように折り重なってる黒コゲの屍体の上を吹きまくってくる砂塵にまみれて道を歩きながらイナゴのまじった赤黒いパンをかじっていたころを思いだすよ。"
"177","sakaguchi","mo_gunbiwa_iranai.txt","近所の防空壕で五人の屈強な工員が窒息で死んだ。"
"178","sakaguchi","mo_gunbiwa_iranai.txt","うららかな白昼、そこを通りかかったら、三人のこれも工員らしいのが火葬にするため材木をつみあげ、その材木よりも邪魔で無意味でしかない屍体をその上に順に投げ落して、屍体の一つがまだ真新しい戦闘帽をかぶっているのに気がついて一人がヒョイとつまみとって火のかからない方へ投げた。"
"179","sakaguchi","mo_gunbiwa_iranai.txt","※屋のオヤジがガラを投げこむ石油カンの中に肉の小片を見つけてヒョイとつまんで肉のザルの方へ投げる時でも、この火葬係りほど大らかに自分の所有権を信じこんでいるかどうか疑わしいほどだった。"
"180","sakaguchi","mo_gunbiwa_iranai.txt","しかし、それを目にとめた私も無感動であった。"
"181","sakaguchi","mo_gunbiwa_iranai.txt",""
"182","sakaguchi","mo_gunbiwa_iranai.txt","あんな時代に平時の冷静と良心を失わない殺人鬼がいて、完全犯罪を行うため人を殺しては痕跡をくらます作業にメンミツに従事していたとすれば不気味な話である。"
"183","sakaguchi","mo_gunbiwa_iranai.txt",""
"184","sakaguchi","mo_gunbiwa_iranai.txt","けれども、現在どこかに本当に戦争したがっている総理大臣のような人物がいるとすれば、その存在は不気味というような感情を全く通りこしている存在だ。"
"185","sakaguchi","mo_gunbiwa_iranai.txt","同類の人間だとは思われない。"
"186","sakaguchi","mo_gunbiwa_iranai.txt","理性も感情も手がとどかない何かのような気がするだけだ。"
"187","sakaguchi","mo_gunbiwa_iranai.txt","しかし私はその実在を信じているわけではない。"
"188","sakaguchi","mo_gunbiwa_iranai.txt","むしろ、そういう誰かは存在しないのじゃないかと考える。"
"189","sakaguchi","mo_gunbiwa_iranai.txt","それほどのバカやキ印は考えられない気になるからだ。"
"190","sakaguchi","mo_gunbiwa_iranai.txt",""
"191","sakaguchi","mo_gunbiwa_iranai.txt","けれども、日本の再軍備は国際情勢や関係からの避けがたいものだと信じて説をなす人は、こういう奇怪な実力をもった誰かの存在を確信しているのだろうか。"
"192","sakaguchi","mo_gunbiwa_iranai.txt","そんな考えの人も不気味だね。"
"193","sakaguchi","mo_gunbiwa_iranai.txt","同じ不気味にしても、完全犯罪狂の殺人鬼よりもそそっかしくてメンミツでないらしいので、ソラ怖しいよ。"
"194","sakaguchi","mo_gunbiwa_iranai.txt",""
"195","sakaguchi","mo_gunbiwa_iranai.txt","屍体から戦闘帽をもらった火葬係りなどは、明日は自分がその戦闘帽と一しょに吹きとばされてバラバラになるかも知れない無数の迷い子の一人にすぎないのである。"
"196","sakaguchi","mo_gunbiwa_iranai.txt","彼はまだ生きてたから屍体の戦闘帽をもらっただけのことであろう。"
"197","sakaguchi","mo_gunbiwa_iranai.txt","戦争とはそういうものなんだ。"
"198","sakaguchi","mo_gunbiwa_iranai.txt","戦争になってしまえば、そうあるだけのことだ。"
"199","sakaguchi","mo_gunbiwa_iranai.txt",""
"200","sakaguchi","mo_gunbiwa_iranai.txt","戦争にも正義があるし、大義名分があるというようなことは大ウソである。"
"201","sakaguchi","mo_gunbiwa_iranai.txt","戦争とは人を殺すだけのことでしかないのである。"
"202","sakaguchi","mo_gunbiwa_iranai.txt","その人殺しは全然ムダで損だらけの手間にすぎない。"
"203","sakaguchi","mo_gunbiwa_iranai.txt",""
"204","sakaguchi","mo_gunbiwa_iranai.txt","『文学界』昭27・10"
"205","sakaguchi","mo_gunbiwa_iranai.txt",""
"206","sakaguchi","mo_gunbiwa_iranai.txt",""
"207","sakaguchi","mo_gunbiwa_iranai.txt",""
"208","sakaguchi","mo_gunbiwa_iranai.txt","底本：「坂口安吾選集第十巻エッセイ1」講談社"
"209","sakaguchi","mo_gunbiwa_iranai.txt","1982（昭和57）年8月12日第1刷発行"
"210","sakaguchi","mo_gunbiwa_iranai.txt","初出：「文学界」"
"211","sakaguchi","mo_gunbiwa_iranai.txt","1952（昭和27）年10月号"
"212","sakaguchi","mo_gunbiwa_iranai.txt","入力：高田農業高校生産技術科流通経済コース"
"213","sakaguchi","mo_gunbiwa_iranai.txt","校正：小林繁雄"
"214","sakaguchi","mo_gunbiwa_iranai.txt","2006年9月16日作成"
"215","sakaguchi","mo_gunbiwa_iranai.txt","青空文庫作成ファイル："
"216","sakaguchi","mo_gunbiwa_iranai.txt","このファイルは、インターネットの図書館、青空文庫（http://www.aozora.gr.jp/）で作られました。"
"217","sakaguchi","mo_gunbiwa_iranai.txt","入力、校正、制作にあたったのは、ボランティアの皆さんです。"
"218","sakaguchi","mo_gunbiwa_iranai.txt",""
