"","auth","piece","line"
"641","sakaguchi","nomenno_himitsu.txt","要するにあらゆる物的証拠が失われているわけです」"
"642","sakaguchi","nomenno_himitsu.txt","辻はここまで聞いて益※ガッカリしてしまった。"
"643","sakaguchi","nomenno_himitsu.txt","これを記事にしても物的証拠がなければ金的を射とめることができない。"
"644","sakaguchi","nomenno_himitsu.txt","すべてが九太夫の単なる推理にすぎないのである。"
"645","sakaguchi","nomenno_himitsu.txt","実にどうも残念だ。"
"646","sakaguchi","nomenno_himitsu.txt","彼は腕をこまねいて考えに沈んでいたが、"
"647","sakaguchi","nomenno_himitsu.txt","「しかし、これを記事にしないわけにはいきませんよ。"
"648","sakaguchi","nomenno_himitsu.txt","爺さんに白状させても記事にしてみせますよ」九太夫は静かに制した。"
"649","sakaguchi","nomenno_himitsu.txt",""
"650","sakaguchi","nomenno_himitsu.txt","「天下の大新聞がカラ振りはつつしんだ方がいいようですよ。"
"651","sakaguchi","nomenno_himitsu.txt","あの爺さんは白状することがありますまい。"
"652","sakaguchi","nomenno_himitsu.txt","しかしいまに天罰が自然に犯人の頭上に訪れると思いますよ。"
"653","sakaguchi","nomenno_himitsu.txt","なぜならですね。"
"654","sakaguchi","nomenno_himitsu.txt","奥さんにはもう残った金がありません。"
"655","sakaguchi","nomenno_himitsu.txt","これからも益※株に手をだすことでしょうが、二人の味方の一人は自分が殺し、一人は背いて去りました。"
"656","sakaguchi","nomenno_himitsu.txt","あの人の金は砂にまくようなものです。"
"657","sakaguchi","nomenno_himitsu.txt","自然に破滅が訪れますよ。"
"658","sakaguchi","nomenno_himitsu.txt","老醜の極に達して恥を天下にさらすのです。"
"659","sakaguchi","nomenno_himitsu.txt","乞食になって野たれ死ぬかも知れませんよ」"
"660","sakaguchi","nomenno_himitsu.txt","この予言は実に近いうちに実現したのである。"
"661","sakaguchi","nomenno_himitsu.txt","浩之介が有金さらって逃げたのである。"
"662","sakaguchi","nomenno_himitsu.txt","これを警察へ訴えでれば大川殺しの真相をあばいてやるという置き手紙があった。"
"663","sakaguchi","nomenno_himitsu.txt","浩之介は家の内情について明るいし、探偵小説にもくわしいから、九太夫と同じ推理に達することができた。"
"664","sakaguchi","nomenno_himitsu.txt","二百万円に代えられたものが能面であることも悟ったのである。"
"665","sakaguchi","nomenno_himitsu.txt",""
"666","sakaguchi","nomenno_himitsu.txt","奥さんはヤケを起して残りの全財産を短日月で株に使い果してしまい、クビをくくって死んでしまった。"
"667","sakaguchi","nomenno_himitsu.txt",""
"668","sakaguchi","nomenno_himitsu.txt",""
"669","sakaguchi","nomenno_himitsu.txt",""
"670","sakaguchi","nomenno_himitsu.txt",""
"671","sakaguchi","nomenno_himitsu.txt","底本：「坂口安吾選集第八巻小説8」講談社"
"672","sakaguchi","nomenno_himitsu.txt","1982（昭和57）年11月12日第1刷発行"
"673","sakaguchi","nomenno_himitsu.txt","初出：「小説新潮第九巻第三号」新潮社"
"674","sakaguchi","nomenno_himitsu.txt","1955（昭和30）年2月1日号"
"675","sakaguchi","nomenno_himitsu.txt","入力：高田農業高校生産技術科流通経済コース"
"676","sakaguchi","nomenno_himitsu.txt","校正：小林繁雄"
"677","sakaguchi","nomenno_himitsu.txt","2006年9月16日作成"
"678","sakaguchi","nomenno_himitsu.txt","青空文庫作成ファイル："
"679","sakaguchi","nomenno_himitsu.txt","このファイルは、インターネットの図書館、青空文庫（http://www.aozora.gr.jp/）で作られました。"
"680","sakaguchi","nomenno_himitsu.txt","入力、校正、制作にあたったのは、ボランティアの皆さんです。"
"681","sakaguchi","nomenno_himitsu.txt",""
