"","auth","piece","line"
"0","sakaguchi","nomenno_himitsu.txt","能面の秘密"
"1","sakaguchi","nomenno_himitsu.txt","坂口安吾"
"2","sakaguchi","nomenno_himitsu.txt",""
"3","sakaguchi","nomenno_himitsu.txt","-------------------------------------------------------"
"4","sakaguchi","nomenno_himitsu.txt","【テキスト中に現れる記号について】"
"5","sakaguchi","nomenno_himitsu.txt",""
"6","sakaguchi","nomenno_himitsu.txt","：入力者注主に外字の説明や、傍点の位置の指定"
"7","sakaguchi","nomenno_himitsu.txt","（数字は、JIS X 0213の面区点番号、または底本のページと行数）"
"8","sakaguchi","nomenno_himitsu.txt","（例）益※"
"9","sakaguchi","nomenno_himitsu.txt","-------------------------------------------------------"
"10","sakaguchi","nomenno_himitsu.txt",""
"11","sakaguchi","nomenno_himitsu.txt","オツネはメクラのアンマだ。"
"12","sakaguchi","nomenno_himitsu.txt","チビで不美人だが朗らかな気質でお喋り好きでアンマの腕も確かだから旅館なぞもヒイキにしてくれる。"
"13","sakaguchi","nomenno_himitsu.txt","その日は朝のうちから予約があってかねてこれもオトクイの乃田家から夜の九時ごろ来るようにと話があった。"
"14","sakaguchi","nomenno_himitsu.txt",""
"15","sakaguchi","nomenno_himitsu.txt","乃田家へよばれるのは奥さまの御用の時とお客さまの御用の時があって、お客さまは大川さんの場合が多い。"
"16","sakaguchi","nomenno_himitsu.txt","この日も大川さん。"
"17","sakaguchi","nomenno_himitsu.txt","オツネが九時十五分ごろ行ったときには食事の終るところで、九時半ごろからもみはじめた。"
"18","sakaguchi","nomenno_himitsu.txt",""
"19","sakaguchi","nomenno_himitsu.txt","食事は本邸だが大川さんの寝るのは別館で本館にくらべればよほど小ヂンマリした洋館であった。"
"20","sakaguchi","nomenno_himitsu.txt","乃田といえば昔は大金持だったそうで本邸なぞはどんな旅館も及ばないぐらい豪奢なものだそうだ。"
"21","sakaguchi","nomenno_himitsu.txt","茶室と能舞台なぞ国宝級のものを買いとって運ばせたもので、五千坪ほどの庭園もあった。"
"22","sakaguchi","nomenno_himitsu.txt","熱海で今もこれほどの邸宅を旅館にもせず持ちこたえていられたというのは莫大な土地や山林を所有していたからで、少しずつそれを売って非常にゼイタクな生活をしていた。"
"23","sakaguchi","nomenno_himitsu.txt","そういう用で時々見えるのが大川と今井という二人の人。"
"24","sakaguchi","nomenno_himitsu.txt","たいがい二人一しょに来ることが多いようだ。"
"25","sakaguchi","nomenno_himitsu.txt","二人はここの旦那の生前に秘書をしていたそうで、この日は大川さん一人のようであった。"
"26","sakaguchi","nomenno_himitsu.txt","オツネが別館へもみに行くとき、"
"27","sakaguchi","nomenno_himitsu.txt","「あとで奥さまもお願いなさるそうですからすみ次第来て下さい」"
"28","sakaguchi","nomenno_himitsu.txt","と女中さんから話があった。"
"29","sakaguchi","nomenno_himitsu.txt","これもいつもの習慣だ。"
"30","sakaguchi","nomenno_himitsu.txt","今井さんはまだ若いからアンマをとらなかった。"
"31","sakaguchi","nomenno_himitsu.txt",""
"32","sakaguchi","nomenno_himitsu.txt","大川さんは少量の酒で気持よく酔う人だった。"
"33","sakaguchi","nomenno_himitsu.txt","しかし寝る前に催眠薬をのむので四五十分もむうちに大イビキで眠りこんでしまう。"
"34","sakaguchi","nomenno_himitsu.txt","この日もそうだった。"
"35","sakaguchi","nomenno_himitsu.txt","この人は変った人で、"
"36","sakaguchi","nomenno_himitsu.txt","「お前のようなまずい顔のメクラでも酔ってアンマをとるうちにはとかく変な心も起きやすいものだから、その壁にかかった鬼女の面をかぶってもんでもらうことにしよう」"
"37","sakaguchi","nomenno_himitsu.txt","こういう妙な習慣になっていた。"
"38","sakaguchi","nomenno_himitsu.txt","小心で用心深い人なのだろう。"
"39","sakaguchi","nomenno_himitsu.txt","そのくせアンマは強くて、もっときつく、もっと力いっぱいと催促されるので、こういう人をもむと何人前も疲れるからアンマには苦手の客だ。"
"40","sakaguchi","nomenno_himitsu.txt","オツネは大川がねこんだのにホッと一安心、鬼女の能面を外して卓上へおいて部屋をでた。"
"41","sakaguchi","nomenno_himitsu.txt",""
"42","sakaguchi","nomenno_himitsu.txt","オツネはメクラながらもカンのよいのが自慢だから、行きつけの家や旅館に行ったときには女中たちに案内されるのが何よりキライだ。"
"43","sakaguchi","nomenno_himitsu.txt",""
"44","sakaguchi","nomenno_himitsu.txt","「私はカンがいいのよ。"
"45","sakaguchi","nomenno_himitsu.txt","一人で大丈夫」"
"46","sakaguchi","nomenno_himitsu.txt","どこへ行ってもこう云わないと気がすまない。"
"47","sakaguchi","nomenno_himitsu.txt","もちろんどこの女中もそれがキマリになっているから案内に立とうとする者もいなくなっていた。"
"48","sakaguchi","nomenno_himitsu.txt","乃田家でもそうだ。"
"49","sakaguchi","nomenno_himitsu.txt","壁に手さぐりで進むから跫音もなく唐紙をあける。"
"50","sakaguchi","nomenno_himitsu.txt","すると奥の部屋から奥さんの声で、"
"51","sakaguchi","nomenno_himitsu.txt","「オツネサンかい」"
"52","sakaguchi","nomenno_himitsu.txt","「そうです」"
"53","sakaguchi","nomenno_himitsu.txt","「ちょっとそこで待っててね」"
"54","sakaguchi","nomenno_himitsu.txt","「ハイ」"
"55","sakaguchi","nomenno_himitsu.txt","誰か人がいるらしい。"
"56","sakaguchi","nomenno_himitsu.txt","奥さんはあまり人にきこえないように声を低くしかし力をこめ、"
"57","sakaguchi","nomenno_himitsu.txt","「あなたのあつかましさにはもう我慢できなくなりました。"
"58","sakaguchi","nomenno_himitsu.txt","今までに一千万円はゆすっているのですよ。"
"59","sakaguchi","nomenno_himitsu.txt","私ももう六十七にもなりましたから名誉ぐらいどうなってもかまいません。"
"60","sakaguchi","nomenno_himitsu.txt","もう絶対にお金はあげませんから私の秘密をふれまわったがいいでしょう。"
"61","sakaguchi","nomenno_himitsu.txt","第一、窓の外から夜中に戸を叩いてゆするなぞとは何事ですか。"
"62","sakaguchi","nomenno_himitsu.txt","さっさと行きなさい」"
"63","sakaguchi","nomenno_himitsu.txt","「あとで後悔しますよ」"
"64","sakaguchi","nomenno_himitsu.txt","窓の外でふくみ笑いしてこう捨てゼリフを云う男の声がきこえた。"
"65","sakaguchi","nomenno_himitsu.txt","奥さんが窓の戸をしめたので男は立ち去ったらしい。"
"66","sakaguchi","nomenno_himitsu.txt",""
"67","sakaguchi","nomenno_himitsu.txt","――大川さんではないようだ、とオツネは思った。"
"68","sakaguchi","nomenno_himitsu.txt","彼は熟睡しているし、男の声は低くてよくも聞きとれないぐらいだったが、大川の声とは違っていたようだ。"
"69","sakaguchi","nomenno_himitsu.txt","来客は一人の様子であったが、この邸内にいる他の男と云えば、それは息子の浩之介か庭番の爺やだけだ。"
"70","sakaguchi","nomenno_himitsu.txt","浩之介は南方の戦場から足に負傷して戻ってきてビッコであった。"
"71","sakaguchi","nomenno_himitsu.txt","この二人にはオツネはほとんどナジミがなかった。"
"72","sakaguchi","nomenno_himitsu.txt","奥さんはオツネを奥の部屋へよびいれて、"
"73","sakaguchi","nomenno_himitsu.txt","「とんだところを聞かれましたね。"
"74","sakaguchi","nomenno_himitsu.txt","このことはくれぐれも人に話してはいけませんよ」"
"75","sakaguchi","nomenno_himitsu.txt","「ハイ。"
"76","sakaguchi","nomenno_himitsu.txt","決して云いません」"
"77","sakaguchi","nomenno_himitsu.txt","「大川さんはおやすみですか」"
"78","sakaguchi","nomenno_himitsu.txt","「ハイ。"
"79","sakaguchi","nomenno_himitsu.txt","高イビキでおやすみでした」"
"80","sakaguchi","nomenno_himitsu.txt","「そう」"
"81","sakaguchi","nomenno_himitsu.txt","それからオツネは奥さんをもんで出たのは十一時半ごろであった。"
"82","sakaguchi","nomenno_himitsu.txt","いつもならその時刻だとまた行きつけの旅館へ顔を出してみるところだが、この日は大川をもんで疲れたので師匠の家へ戻って、"
"83","sakaguchi","nomenno_himitsu.txt","「今夜の乃田さんは鬼女の面の旦那だからとても疲れたんです。"
"84","sakaguchi","nomenno_himitsu.txt","やすませて下さい」"
"85","sakaguchi","nomenno_himitsu.txt","客の席ではさすがにこんな話まではしないのだが、師匠の家ではずいぶんひどい話もうちあけて茶のみ話にしあっている。"
"86","sakaguchi","nomenno_himitsu.txt","そこでこう云って休ませてもらい、疲れた晩の例によって五勺ほどの酒をのみ、"
"87","sakaguchi","nomenno_himitsu.txt","「乃田の奥さんは誰かにゆすられているんだよ。"
"88","sakaguchi","nomenno_himitsu.txt","もう一千万円もゆすられたらしいよ。"
"89","sakaguchi","nomenno_himitsu.txt","鬼女の面の旦那じゃないけどね」"
"90","sakaguchi","nomenno_himitsu.txt","と今しがた人に云ってくれるなと頼まれたばかりのことまでお喋りしてしまった。"
"91","sakaguchi","nomenno_himitsu.txt","そして五勺の酒によい気持になってグッスリねたから、オツネはその晩の火事を知らなかった。"
"92","sakaguchi","nomenno_himitsu.txt",""
"93","sakaguchi","nomenno_himitsu.txt",""
"94","sakaguchi","nomenno_himitsu.txt","＊"
"95","sakaguchi","nomenno_himitsu.txt",""
"96","sakaguchi","nomenno_himitsu.txt","火事のあったのは乃田家の別館であった。"
"97","sakaguchi","nomenno_himitsu.txt","山の手の水利の悪いところだし広い庭の中でホースがとどいて水がでるまでにもずいぶん手間どってしまった。"
"98","sakaguchi","nomenno_himitsu.txt","それで別館一棟だけがキレイに焼け落ちてしまったが、焼けた中に一人の男の死体が発見された。"
"99","sakaguchi","nomenno_himitsu.txt","二部屋にフトンがしかれていて死体の方は一ツである。"
"100","sakaguchi","nomenno_himitsu.txt","死体の部屋が火元らしく、この部屋の二ツのドアには鍵がかかっていたことが焼跡の調査の結果確定した。"
"101","sakaguchi","nomenno_himitsu.txt","廊下に面したドアには内側から、隣りの部屋に通じるドアには外側から。"
"102","sakaguchi","nomenno_himitsu.txt","そしてその隣室にもフトンがしかれていたのである。"
"103","sakaguchi","nomenno_himitsu.txt","死体は大川であった。"
"104","sakaguchi","nomenno_himitsu.txt","密室の死体であるから煙草の火の不始末か自殺かと一応結論がでかかっていたのであったが、たまたまオツネのアンマ宿の向いに新聞記者が住まっていた。"
"105","sakaguchi","nomenno_himitsu.txt","そしてこの記者が現場の取材から戻ったとたんに女のアンマと近所の人の立話をきいてしまったのである。"
"106","sakaguchi","nomenno_himitsu.txt",""
"107","sakaguchi","nomenno_himitsu.txt","「あのウチにはオツネサンがゆうべもみに行ったんですよ。"
"108","sakaguchi","nomenno_himitsu.txt","その人が妙な人でね、オツネサンのような年増の不美人でも酔っぱらってアンマをとると乙な気持になって困ることもあるからと顔に鬼女の面をつけさせてアンマをとる例なんですッてね。"
"109","sakaguchi","nomenno_himitsu.txt","ところがまたオツネサンはあすこの奥さんがゆすられてるのを聞いたんですッて。"
"110","sakaguchi","nomenno_himitsu.txt","今までに一千万もゆすられてるからもうイヤです。"
"111","sakaguchi","nomenno_himitsu.txt","秘密を方々で云いふらしなさいッてね。"
"112","sakaguchi","nomenno_himitsu.txt","すると男がいまに後悔しますよと怖しい声で云ってたそうですよ」"
"113","sakaguchi","nomenno_himitsu.txt","この記者は東京のさる新聞の支社員だ。"
"114","sakaguchi","nomenno_himitsu.txt","今しも現場から戻ってきて本社へ平凡な過失死らしいと電話したばかりである。"
"115","sakaguchi","nomenno_himitsu.txt","殺人なら大記事になる。"
"116","sakaguchi","nomenno_himitsu.txt","温泉町ではこうした記事が大いに話題になるから、その方面に敏腕なのがそろっているものだ。"
"117","sakaguchi","nomenno_himitsu.txt","近いころ関東の農家で似たような八人殺しがあって全国的な話題となったばかりであるから、これこそ特ダネとよろこんだ。"
"118","sakaguchi","nomenno_himitsu.txt",""
"119","sakaguchi","nomenno_himitsu.txt","「そのオツネサンは今どこにいますか」"
"120","sakaguchi","nomenno_himitsu.txt","「まだグーグーねてますよ」"
"121","sakaguchi","nomenno_himitsu.txt","「もう十時をまわったじゃないか」"
"122","sakaguchi","nomenno_himitsu.txt","「アンマはそれぐらい寝ても毎日毎日疲れきってる商売よ」"
"123","sakaguchi","nomenno_himitsu.txt","そこで、記者はオツネに面会を申しこんで叩き起してもらった。"
"124","sakaguchi","nomenno_himitsu.txt","そんな大事件が起ったと知るとオツネは顔の色を失ってしまった。"
"125","sakaguchi","nomenno_himitsu.txt",""
"126","sakaguchi","nomenno_himitsu.txt","「そんなこと新聞に書かれちゃ大変だよ。"
"127","sakaguchi","nomenno_himitsu.txt","まさかそんなことが起るとは知らないからウカツに喋っちゃッたけどさ。"
"128","sakaguchi","nomenno_himitsu.txt","もう何を訊かれても答えないわよ」"
"129","sakaguchi","nomenno_himitsu.txt","「答えてくれなきゃ尾ヒレをつけて書くだけさ。"
"130","sakaguchi","nomenno_himitsu.txt","君が悪事をしたわけじゃアあるまいし、むしろ君は一躍有名になって日本中に名を知られるぜ。"
"131","sakaguchi","nomenno_himitsu.txt","君を悪く云うどころか、すごい名探偵だなぞと人々がもてはやしてくれるぜ」"
"132","sakaguchi","nomenno_himitsu.txt","「どうしても書くつもり」"
"133","sakaguchi","nomenno_himitsu.txt","「それがぼくの商売だもの、これが書かずにいられるものかい」"
"134","sakaguchi","nomenno_himitsu.txt","「それじゃア仕方がないわね」"
"135","sakaguchi","nomenno_himitsu.txt","とオツネは昨夜聞いたこと経験したことを辻記者に語ったが、なにぶんにも目の見えない人間の話であるからカンジンなところが一本釘がぬけてるようなアンバイだ。"
"136","sakaguchi","nomenno_himitsu.txt",""
"137","sakaguchi","nomenno_himitsu.txt","「大川という人、君にゆすりらしい話をしたことがあったかい」"
"138","sakaguchi","nomenno_himitsu.txt","「まさか自分はゆすりですッて云う人ないと思うわよ」"
"139","sakaguchi","nomenno_himitsu.txt","「すると君は大川が眠ると部屋をでたんだね。"
"140","sakaguchi","nomenno_himitsu.txt","そのとき鍵をかけずにでたわけだろう」"
"141","sakaguchi","nomenno_himitsu.txt","「あたりまえさ」"
"142","sakaguchi","nomenno_himitsu.txt","「大川の隣の部屋には誰が泊っていた？」"
"143","sakaguchi","nomenno_himitsu.txt","「誰も泊ってる様子はなかったけどね」"
"144","sakaguchi","nomenno_himitsu.txt","「ところが隣室と同じようにフトンがしいてあったらしいのだがね」"
"145","sakaguchi","nomenno_himitsu.txt","「それじゃア今井さんかな。"
"146","sakaguchi","nomenno_himitsu.txt","大川さんと今井さんはお揃いで東京から来て泊ることが多いんだがね。"
"147","sakaguchi","nomenno_himitsu.txt","私はしかしゆすりの男が今井さんだったと云うつもりはないんだよ」"
"148","sakaguchi","nomenno_himitsu.txt","「大川は君に鬼女の面をつけさせてアンマをとるぐらいだから時々みだらな素振りを見せたかい」"
"149","sakaguchi","nomenno_himitsu.txt","「それぐらい用心深い人だから、そんなことしたことないにきまってるよ。"
"150","sakaguchi","nomenno_himitsu.txt","そんなことまで尾ヒレをつけられちゃアこまるじゃないか。"
"151","sakaguchi","nomenno_himitsu.txt","注意しておくれ」"
"152","sakaguchi","nomenno_himitsu.txt","「ヤ、すまん。"
"153","sakaguchi","nomenno_himitsu.txt","君に変な素振りをするようじゃア乃田の奥さんと何かがあっても不思議じゃないと思ったからだよ。"
"154","sakaguchi","nomenno_himitsu.txt","つまり隣室のフトンが奥さん用かという意味さ」"
"155","sakaguchi","nomenno_himitsu.txt","「バカバカしい」"
"156","sakaguchi","nomenno_himitsu.txt","辻はその他多くのことを聞きだしたが、アンマの観察だから確実と見てよいものは少かった。"
"157","sakaguchi","nomenno_himitsu.txt","やや確実なのは次のことだ。"
"158","sakaguchi","nomenno_himitsu.txt",""
"159","sakaguchi","nomenno_himitsu.txt","オツネは九時半ごろから十時半ごろまで大川をもんだ。"
"160","sakaguchi","nomenno_himitsu.txt","大川は酒と催眠薬をのんだと語っておりアンマの途中に大イビキで眠った。"
"161","sakaguchi","nomenno_himitsu.txt","オツネはフトンを直してやり面を卓上において鍵をかけずに部屋をでたが、煙草の吸ガラがどうなっていたかは分らない。"
"162","sakaguchi","nomenno_himitsu.txt","大川はアンマの最中煙草に火をつけたことは確かだがそれが何かに燃えうつった気配は感じられなかった。"
"163","sakaguchi","nomenno_himitsu.txt","（オツネは鼻の感覚が敏感だと自称している）大川の部屋をでるとオツネは本邸の奥さんの部屋へ行った。"
"164","sakaguchi","nomenno_himitsu.txt","そのとき奥さんが窓の外の男にゆすりを拒絶していたが、相手の男は誰か分らない。"
"165","sakaguchi","nomenno_himitsu.txt","十一時半ごろオツネは退去したが、火事が発見されたのは一時四十七分である。"
"166","sakaguchi","nomenno_himitsu.txt","消火後の調査では大川の部屋のドアの鍵が全部かけられていた。"
"167","sakaguchi","nomenno_himitsu.txt","大川は窒息後に焼死したらしく他殺をうけたような外傷も毒殺された疑いも発見されていない。"
"168","sakaguchi","nomenno_himitsu.txt",""
"169","sakaguchi","nomenno_himitsu.txt","辻はその足で再び現場へ急行してみると、今しもその後の発表が行われたところで、大川のボストンバッグの焼けたのが発見されその中に約百万円ぐらいと推定される千円札束の燃え屑があったそうだ。"
"170","sakaguchi","nomenno_himitsu.txt","当局ではそれをもって逆に外来者の兇行の疑いは失われたものと見きわめかけた様子であった。"
"171","sakaguchi","nomenno_himitsu.txt",""
"172","sakaguchi","nomenno_himitsu.txt","辻は当局の発表なぞはもう問題にはしていない。"
"173","sakaguchi","nomenno_himitsu.txt","直接邸内の人々に対決するのだ。"
"174","sakaguchi","nomenno_himitsu.txt","まず女中からというのが記者常識の第一課だから、三人の女中に個別対面してみたが、"
"175","sakaguchi","nomenno_himitsu.txt","「ゆうべのお客さんは大川さんお一人ですよ。"
"176","sakaguchi","nomenno_himitsu.txt","たいがい今井という方と一しょに見えるものですから昼のうちにお掃除して――拭き掃除は庭番の爺さんですが、お二人ぶんの寝床の用意しておいたのですが、夜八時ごろお着きになったのは大川さんお一人でした。"
"177","sakaguchi","nomenno_himitsu.txt","その後どなたもお見えにはなりません」"
"178","sakaguchi","nomenno_himitsu.txt","三人の女中の答えは同じであった。"
"179","sakaguchi","nomenno_himitsu.txt","オツネが立ち去るまで起きていたのは若い女中一人で、奥さんの部屋と女中部屋は大そう距離があるから何の物音もきこえなかったと云う。"
"180","sakaguchi","nomenno_himitsu.txt",""
"181","sakaguchi","nomenno_himitsu.txt","「隣室との間のドアの鍵はふだんかけておくのですか」"
"182","sakaguchi","nomenno_himitsu.txt","「いいえ、私たち洋館のドアの鍵はかけない習慣でした」"
"183","sakaguchi","nomenno_himitsu.txt","これは女中たちが断言したので他殺の見透しがでてきたのだ。"
"184","sakaguchi","nomenno_himitsu.txt",""
"185","sakaguchi","nomenno_himitsu.txt","そこで奥方に対面をねがった。"
"186","sakaguchi","nomenno_himitsu.txt","案外にも面倒なく対面してくれたが、ゆすりのことをきくと激怒してしまった。"
"187","sakaguchi","nomenno_himitsu.txt",""
"188","sakaguchi","nomenno_himitsu.txt","「私は誰にゆすられた覚えもありません。"
"189","sakaguchi","nomenno_himitsu.txt","ゆうべ人にゆすられたなんて、そんなことはありません。"
"190","sakaguchi","nomenno_himitsu.txt","その時刻には誰に会った覚えもありません。"
"191","sakaguchi","nomenno_himitsu.txt","ましてそんなことを云った覚えは断じてないのです。"
"192","sakaguchi","nomenno_himitsu.txt","おひきとり下さい」"
"193","sakaguchi","nomenno_himitsu.txt","プイと立って出てしまった。"
"194","sakaguchi","nomenno_himitsu.txt","大川のカバンの中の百万円については聞くヒマがなかったので慌てて警官のところへ行って問うてみると、株を買ってもらうために依頼した百万円だということが分った。"
"195","sakaguchi","nomenno_himitsu.txt","オツネの言葉によっても奥さんがゆすりにお金をやった様子はなく、そのアベコベに拒絶したのだから、おそらくそういう性質の金なのだろう。"
"196","sakaguchi","nomenno_himitsu.txt",""
"197","sakaguchi","nomenno_himitsu.txt","あとの家族は息子の浩之介だが、彼は門に接続した門番小屋のようなところを事務所兼用にして寝泊りしているのである。"
"198","sakaguchi","nomenno_himitsu.txt","彼の営業は高利貸しであった。"
"199","sakaguchi","nomenno_himitsu.txt","熱海の大火の折に母からもらっていた山林を売って高利貸しをはじめ、その当時はかなりの好調であったらしいが、今では成績不振らしくビッコひきひき駈けずり廻っているだけで落ち目になると焦りがでて借り手にしてやられるようなことになりがちでいけなくなる一方であるらしい。"
"200","sakaguchi","nomenno_himitsu.txt","使用人も居つかなくなり、中学をでて夜学へ通っている小僧が一人いるだけだった。"
"201","sakaguchi","nomenno_himitsu.txt","事務所を訪ねてみると、帳簿のほかには探偵小説ばかりが並んでいる。"
"202","sakaguchi","nomenno_himitsu.txt","ビッコのせいかブルジョアの息子のようなオットリしたところもない。"
"203","sakaguchi","nomenno_himitsu.txt",""
"204","sakaguchi","nomenno_himitsu.txt","「ずいぶん探偵小説をお持ちですね」"
"205","sakaguchi","nomenno_himitsu.txt","「愛読書です」"
"206","sakaguchi","nomenno_himitsu.txt","「昨夜の十時半ごろですが、ある男が母堂を窓の外からゆすっていたというのですよ。"
"207","sakaguchi","nomenno_himitsu.txt","母堂が答えて云われるにはもう一千万円もゆすったあげくまだゆするとはあつかましい。"
"208","sakaguchi","nomenno_himitsu.txt","もう名誉もいらないのだからみんなに秘密を云いたてるがよい。"
"209","sakaguchi","nomenno_himitsu.txt","ビタ一文もだしませんとね。"
"210","sakaguchi","nomenno_himitsu.txt","すると窓の外の男がいまに後悔しますよと云って立ち去ったそうです」"
"211","sakaguchi","nomenno_himitsu.txt","「そんなことを母が云ったんですか」"
"212","sakaguchi","nomenno_himitsu.txt","「いいえ、偶然きいた人がいるのです」"
"213","sakaguchi","nomenno_himitsu.txt","「そうでしょうな。"
"214","sakaguchi","nomenno_himitsu.txt","人が邸内で変死した当日にそんなことがあったと自分で云う人間がいたらおかしいです。"
"215","sakaguchi","nomenno_himitsu.txt","またそんなことのあった直後に人を殺すのもおかしいでしょう。"
"216","sakaguchi","nomenno_himitsu.txt","ましてゆすられてるのを人にきかれているのにね」"
