"","auth","piece","line"
"143","sakaguchi","omochabako.txt","彼は高風気品ある人だから、妹の寝床を襲撃に及んでも女房は宿六の犯しがたい品位になお評価を失ったわけではないのに、作中人物に納得させる現実の根柢裏づけが欠け、一人よがりいい気にオモチャ箱をひっくりかえしオモチャの人格をのさばらせるから、むしろそこからヒビがはいった。"
"144","sakaguchi","omochabako.txt","宿六の愛読者ではなくなったから、作中人物を疑り蔑むことによって、現実の宿六をも蔑み、その犯しがたい品位まで嘘っパチいい加減のまやかし物だというように見る目が曲ってしまったのである。"
"145","sakaguchi","omochabako.txt",""
"146","sakaguchi","omochabako.txt","庄吉はもう四十になった。"
"147","sakaguchi","omochabako.txt","彼は女房を信じ愛しまかせきっていた。"
"148","sakaguchi","omochabako.txt","気の毒な彼はその作品の根柢が現実の根から遊離し冷厳なる鬼の目を封じ去り締めだすことに馴れるにつれて、彼は然しあべこべに彼の現実の表面だけを彼の夢幻の作品に似せて行き、夢と現実が分かち難くなってきた。"
"149","sakaguchi","omochabako.txt",""
"150","sakaguchi","omochabako.txt","彼は雑誌社で稿料を貰う。"
"151","sakaguchi","omochabako.txt","借金とりにせめられ、子供の月謝や弁当代に事欠き、女房は彼の帰宅を待ちわびている。"
"152","sakaguchi","omochabako.txt","その借金や子供の学費が気にかかることに於て彼は決して女房以下ではないのだけれども、友だちに会う、懐中の原稿料は無事女房に渡してやりたいけれども、先刻も話した通りこのお金には脚があって慌てて走って行きたがっているのだから、せつない。"
"153","sakaguchi","omochabako.txt","まア一杯だけと思う、よく酔える、二杯、三杯、十杯、さア、景気よく騒ごう、あれも呼べ、これも呼べ、八方に電話をかける、後輩どもをよびあつめ、大威張り、陸上競技の投げ槍などを買いもとめてバルヂンという彼の作中人物の愛吟を高らかに誦しつつアテナイの市民、アテナイの選手を気どって我が家に帰る。"
"154","sakaguchi","omochabako.txt","もはや一文の金も懐中にはない。"
"155","sakaguchi","omochabako.txt","女房はくるりとふりむき別室へ駈け去って泣く、泣きながら翌朝のオミオツケのタマネギをきり又なく。"
"156","sakaguchi","omochabako.txt","宿六がこれ女房よと呼びかけても返事をしない。"
"157","sakaguchi","omochabako.txt",""
"158","sakaguchi","omochabako.txt","この悲痛をもとより彼は見逃がしていない。"
"159","sakaguchi","omochabako.txt","彼はむしろ女房よりも貧苦がせつなく、借金が悲しく、子供の学費が心にかかっているのだ。"
"160","sakaguchi","omochabako.txt","けれども彼の作品が根柢的にその現実と絶縁に成功すると同様に、彼の現実に於ても、その絶縁に成功しなければ彼はもう身の置き場もない。"
"161","sakaguchi","omochabako.txt","彼は借金とりをラ・マンチャの紳士の水車の化け物に見たてて戦い、女房の妹を口説いてもトボソのダルシニヤ姫になぞらえる。"
"162","sakaguchi","omochabako.txt","孤高の文学だの、遊吟詩人の異色文学だの、彼の作品の広告のきまり文句を全然信じていないくせに、俺はそういうものだと胸をそらして思いこむことに成功する。"
"163","sakaguchi","omochabako.txt",""
"164","sakaguchi","omochabako.txt","根柢に現実の根とまったく遊離した作品世界に遊びながら、その偽瞞に気づかぬどころか、現実のうわべだけを作中世界に似せ合わせることに成功することによって、彼は益々自作の熱愛読者となり、自作に酔っぱらい、わが現身の卑小俗悪を軽蔑黙殺することに成功した。"
"165","sakaguchi","omochabako.txt","彼はもうイヤでも自分の作品に酔っぱらわなければ、この現身の息苦しさに堪え生きていられないのだ。"
"166","sakaguchi","omochabako.txt",""
"167","sakaguchi","omochabako.txt","同業者や批評家はいまだに孤高の文学、異色の文学、きまり文句でお座なりの五、六行文芸時評の片すみへこれも稼ぎのためだからと筆まめにいい加減あてずっぽうに書いてくれるのが時々いたりするけれども、もう女房だけは騙すことができない。"
"168","sakaguchi","omochabako.txt","作品と現実との根柢的のバラバラ事件をこれは頭脳が読むのでなしに骨身に徹して、骨身によって、判定しているのだ。"
"169","sakaguchi","omochabako.txt",""
"170","sakaguchi","omochabako.txt","そこへもう女房の我慢のならないことができた。"
"171","sakaguchi","omochabako.txt",""
"172","sakaguchi","omochabako.txt","★"
"173","sakaguchi","omochabako.txt","彼等は疑雨荘というちょっと小綺麗なアパートに住むことになった。"
"174","sakaguchi","omochabako.txt","このアパートのマダムはオメカケで、お小遣いかせぎに旦那にせがんでアパートをこしらえて貰ったのだが、内々は浮気のためで、旦那は晩酌が一升ずつという酒豪で不能者だから、芸者育ちのマダムは小さな環境にあきたらない、まことに多淫な女で、アパートの誰彼とたくみに遊びたわむれている。"
"175","sakaguchi","omochabako.txt",""
"176","sakaguchi","omochabako.txt","旦那がきて晩酌がはじまると、今日はあの方をおよびしましょうというわけで、庄吉も招かれる。"
"177","sakaguchi","omochabako.txt","マダムは二十七、八の美人で芸者あがりだから世帯じみたところがなく、濃厚な色気そのもの、豊艶で色ッぽい。"
"178","sakaguchi","omochabako.txt","三枝先生と言ってチヤホヤもてなしてくれるから庄吉は有頂天になって、それからというもの酔余の女人夢遊訪問はアパートのマダムの部屋となった。"
"179","sakaguchi","omochabako.txt","酔っ払うと大はしゃぎで、ふだんは蚊のなくような細い声しかでないくせに、こんなチッポケな痩身のどこからでると思うような破れ鐘の声で応援団のように熱狂乱舞して合いの手に胴間声にメッキのようなツヤをかぶせて御婦人を讃美礼讃したり口説いたりする。"
"180","sakaguchi","omochabako.txt","小さなアパートにこれが筒ぬけに響くから、"
"181","sakaguchi","omochabako.txt","「アラ先生、奥様にきこえてよ」"
"182","sakaguchi","omochabako.txt","などと言うが、これが又わざときこえよがしの声でナガシメを送るのだから、庄吉は益々有頂天で、"
"183","sakaguchi","omochabako.txt","「僕は女房はきれえなんだ。"
"184","sakaguchi","omochabako.txt","年ガラ年中｜筍の皮をむいたり玉ネギをコマ切れにして泣いたり、朝から晩までいつだってそうなんだから毎日何百本も筍を食ってるわけじゃアないんだから、アイツは一本の筍を五時間もむく妖術使いなんだなア。"
"185","sakaguchi","omochabako.txt","その妖術のほかに人生の心得は何一つないんだから」"
"186","sakaguchi","omochabako.txt","これがきこえてくるからカンベンができない。"
"187","sakaguchi","omochabako.txt","日本の女房は概ね女中兼業で、兼業の方に主力が置かれている状況であるが、当人が好んで兼業に精をだしているわけではなくて、亭主が無力で女房と亭主友だちづきあいというわけに行かないシクミだから涙をのんで筍の皮をむいている。"
"188","sakaguchi","omochabako.txt","しかるに何ぞや。"
"189","sakaguchi","omochabako.txt","自分の無力無能をタナにあげて、女房は世帯じみて筍の妖術使いだと言う。"
"190","sakaguchi","omochabako.txt","どこの宿六でも自分の無力無能のせいで女房をヤリクリ妖術使いにしておきながら、ヤリクリなしの遊び女にひそかにアコガレをよせているいずれも不届きの曲者ぞろいで、さてこそ女房がこぞって遊女芸者オメカケを敵性国家と見なすのは重々｜左もあるべきところである。"
"191","sakaguchi","omochabako.txt","見えも聴えもしなければ我慢のしどころもあるけれども、目に見え耳に聴えては痛憤やるかたないのは御尤も、それでも胸をさすっていると、一緒に芝居見物に行って酔っ払っておそろいで賑々しく帰ってきて女房の部屋へは顔もださず、マダムの部屋で馬鹿笑いをしながら飲ませて貰っている。"
"192","sakaguchi","omochabako.txt","〆切に追いまくられ女房が鍋の音をガチャリとさせてもギラギラした目を三角にしてジロリと睨むくせに、マダムが先生チョットと呼びにくると困りきった顔半分｜相好くずしていそいそと出たまま夜更けまで帰らずベロベロになって戻って小説は間に合わず、貧窮身にせまる。"
"193","sakaguchi","omochabako.txt",""
"194","sakaguchi","omochabako.txt","然し宿六の心事は複雑奇怪で、彼は決して女にもててはいなかった。"
"195","sakaguchi","omochabako.txt","彼はていよくマダムにあやつられ、それというのが、彼がその道にまったく稚拙で単なるダダッ子にすぎないのだから旦那の信用を博している、そこでマダムは彼をつれだし、ついでに男をつれだして、彼を気持よく酔わせておいて、アラ、チョット先生忘れた用があるからとか、買物をしてくるから、とか、人に会ってくるとか呼んでくるとかぬけだして、彼にはオデン屋の安酒をあてがって二時間ほど遊んでくる。"
"196","sakaguchi","omochabako.txt","しょっちゅう男が変っているが事情に全然変化のないのは庄吉で、ちかごろでは卑屈になって、アラ、そう、忘れた、先生、と二人の男女が立ち上ると、皆まできかずエヘヘ行ってらっしゃいなどと、あさましい。"
"197","sakaguchi","omochabako.txt","そのあさましさは骨身に徹して彼には分るが、浮気女の豊艶な魔力におさえられて一言二言うまいことを言われるとグニャグニャ相好をくずすだけが能だという、思えばかえすがえすもあさましい限りであった。"
"198","sakaguchi","omochabako.txt","こんなことは女房に言えた義理ではないから、いかにも彼が大もてで、マダム意中の人の如くに威張りかえっているけれども、女房よゆるせ、そぞろ悲しく、ここが芸術の有難さだと、わが本性に根の一つもない夢幻の物語に浮身をやつし、作中人物になりすまし、朗吟の果には涙をながして自分一人感動している。"
"199","sakaguchi","omochabako.txt","女房にこれぐらい馬鹿馬鹿しく見えるものはない。"
"200","sakaguchi","omochabako.txt","彼女は亭主の小説などもはや三文の値もつけられない。"
"201","sakaguchi","omochabako.txt","ロクデナシメ、覚えていやがれ、と失踪してしまった。"
"202","sakaguchi","omochabako.txt",""
"203","sakaguchi","omochabako.txt","然し彼が柄にもなくマダムに熱をあげるのは恋路のせい浮気のせいでなく、むしろ文学に行きづまったためだ。"
"204","sakaguchi","omochabako.txt","なぜと云って、彼は全然女にもてておらず、女の浮気のダシに使われ、なめられ、ふみつけられ、そのあさましさを知りぬいて、見えすいた甘い言葉に相好くずして悦に入る、バカげたこと、悲しいばかり面白おかしくもないのだけれども、芸術に自信を失っては、芸術家はもう人生まっくらだ。"
"205","sakaguchi","omochabako.txt","面白おかしくもないこと、やりたくもないことに結構フラフラ打ちこむとはこれ即ちデカダンで、自信喪失というものの宿命的な成行きなのである。"
"206","sakaguchi","omochabako.txt",""
"207","sakaguchi","omochabako.txt","数日失踪したまま女房が帰らない。"
"208","sakaguchi","omochabako.txt","気もテンドウせんばかり苦痛だけれども、マダムが冷然と、アラ奥さん浮気？お見それしたわね、先生もだらしがない方ね、あんな奥さんにミレンがあるのかしら、と毒の針をふくんだような言葉を浴せる、底意は侮蔑しきっているのが分っており目の色にも半分｜嘲笑がにじみでているのだけれども、先生も浮気なさらないの、などと冷やかされると、彼はもうヤケになって、"
"209","sakaguchi","omochabako.txt","「奥さん、泊りに行こうよ。"
"210","sakaguchi","omochabako.txt","ね、いいだろう、行こうよ」"
"211","sakaguchi","omochabako.txt","マダムは苦笑して"
"212","sakaguchi","omochabako.txt","「先生、泊りに行くお金あるの？」"
"213","sakaguchi","omochabako.txt","グサリと斬る。"
"214","sakaguchi","omochabako.txt",""
"215","sakaguchi","omochabako.txt","庄吉は一刀両断、水もたまらず、首はとび甚だ意地の悪いもので地べたへ落ちてもぐりこんでしまえばいいのにフワリフワリと宙に浮いて壁につき当り唐紙にはじかれ柱の角で鼻をこすってシカメッ面を一ひねり五へん六ぺん旋回する。"
"216","sakaguchi","omochabako.txt","目をとじ耳をふさいで一目散に逃げ去りたいのに、その心をさておいて何物かネチネチ尻をまくる妖怪じみた奴がおり、"
"217","sakaguchi","omochabako.txt","「僕ァ貧乏なんだ。"
"218","sakaguchi","omochabako.txt","貧乏は天下に隠れもない三枝さんだからな。"
"219","sakaguchi","omochabako.txt","僕ァ芸術家なんだ。"
"220","sakaguchi","omochabako.txt","僕はエレエんだ。"
"221","sakaguchi","omochabako.txt","痩せても枯れても貧乏は仕方がねえ」"
"222","sakaguchi","omochabako.txt","何のことだか、わけが分らない。"
"223","sakaguchi","omochabako.txt","けれども腰がぬけ、すくんだ感じで逃げるに逃げられず、やぶれかぶれ意外千万なことを喚きたてる。"
"224","sakaguchi","omochabako.txt",""
"225","sakaguchi","omochabako.txt","「そうね、死ななきゃ分らないわね」"
"226","sakaguchi","omochabako.txt","マダムは入口の扉にもたれる。"
"227","sakaguchi","omochabako.txt","ちょうど廊下へ一人の男がタオルと石鹸もって出てくる、この男も例の男の一人で、"
"228","sakaguchi","omochabako.txt","「え？死ぬ？」"
"229","sakaguchi","omochabako.txt","「死ななきゃ治らないと言うのよ」"
"230","sakaguchi","omochabako.txt","「ああ、バの字ですか」"
"231","sakaguchi","omochabako.txt","「そう」"
"232","sakaguchi","omochabako.txt","マダムは頷き"
"233","sakaguchi","omochabako.txt","「死ななきゃ分らない、か。"
"234","sakaguchi","omochabako.txt","梶さん、今晩、のみに連れてってくれない？」"
"235","sakaguchi","omochabako.txt","男と肩を並べて行ってしまった。"
"236","sakaguchi","omochabako.txt",""
"237","sakaguchi","omochabako.txt","数日すぎて女房は戻った。"
"238","sakaguchi","omochabako.txt",""
"239","sakaguchi","omochabako.txt","何よりも仕事をしていないのが、せつないのだ。"
"240","sakaguchi","omochabako.txt","それがもとで、こういうことにもなる。"
"241","sakaguchi","omochabako.txt","ただ仕事あるのみ。"
"242","sakaguchi","omochabako.txt","だが、どうして仕事ができないのか。"
"243","sakaguchi","omochabako.txt","女も酒も、夢の夢、幻の幻、何物でもない。"
"244","sakaguchi","omochabako.txt",""
"245","sakaguchi","omochabako.txt","そこで彼は後輩の栗栖按吉に手紙を書いて、当分女房子供と別居して創作に没頭したいから君の下宿に恰好な部屋はないか、至急返事まつ、あいにく部屋がなかったから、そのむね返事を送ると、もとより庄吉は一時その気になっただけ、女房と別れて一時も暮せる男ではない。"
"246","sakaguchi","omochabako.txt","按吉から返事がくると、ホッとして、"
"247","sakaguchi","omochabako.txt","「オイ、部屋がないってさ。"
"248","sakaguchi","omochabako.txt","じゃア、仕方がねえや。"
"249","sakaguchi","omochabako.txt","ともかく、ここにア居たくないから、小田原へ行こうよ。"
"250","sakaguchi","omochabako.txt","これから新規まき直しだ」"
"251","sakaguchi","omochabako.txt","「私は小田原はイヤよ。"
"252","sakaguchi","omochabako.txt","お母さんと一緒じゃ居られないわ」"
"253","sakaguchi","omochabako.txt","「だって仕方がねえもの。"
"254","sakaguchi","omochabako.txt","原稿が書けなかったから外に当もねえから、ともかく小田原で創作｜三昧没頭して、傑作を書くんだ」"
"255","sakaguchi","omochabako.txt","「どうして荷物を運ぶのよ」"
"256","sakaguchi","omochabako.txt","「たのめば、ここで預ってくれるだろう」"
"257","sakaguchi","omochabako.txt","「家賃は払ったの」"
"258","sakaguchi","omochabako.txt","「原稿も書けなかったし、前借りがあるから、もう貸してくれねえだろう。"
"259","sakaguchi","omochabako.txt","小田原へ行きゃ、ともかく、この部屋でなきゃア、書けるんだ。"
"260","sakaguchi","omochabako.txt","書きさえすりゃア部屋代ぐらい」"
"261","sakaguchi","omochabako.txt","「だって、今払わなきゃ、どうなるの。"
"262","sakaguchi","omochabako.txt","夜逃げなの。"
"263","sakaguchi","omochabako.txt","荷物があるわよ」"
"264","sakaguchi","omochabako.txt","「だからよ。"
"265","sakaguchi","omochabako.txt","マダムのところへ頼みに行ってきてくれ。"
"266","sakaguchi","omochabako.txt","事情を言や分ってくれるんだ」"
"267","sakaguchi","omochabako.txt","「あなた行ってらっしゃい」"
"268","sakaguchi","omochabako.txt","「オレはいけねえや」"
"269","sakaguchi","omochabako.txt","「だって親友じゃないの」"
"270","sakaguchi","omochabako.txt","庄吉が暗然腕をくんで黙りこんでしまうと、さすがに自分も失踪から戻ったばかり、宿六の古傷もいたわってやりたい気持で、"
"271","sakaguchi","omochabako.txt","「じゃア、行ってくるわ。"
"272","sakaguchi","omochabako.txt","部屋代ぐらい文句言われたって構やしないわよ。"
"273","sakaguchi","omochabako.txt","堂々と出て行きましょうよ」"
"274","sakaguchi","omochabako.txt","「うん、荷物のことも、たのむ」"
"275","sakaguchi","omochabako.txt","ところがマダムは話をきくと打って変って、好機嫌、二つ返事、折かえし挨拶にきて、"
"276","sakaguchi","omochabako.txt","「おくにへ御かえりですってね。"
"277","sakaguchi","omochabako.txt","お名残おしいわ。"
"278","sakaguchi","omochabako.txt","御上京の折は忘れず寄ってちょうだい。"
"279","sakaguchi","omochabako.txt","銀座へんから電話で誘って下すっても、駈けつけるわ。"
"280","sakaguchi","omochabako.txt","真夜中に叩き起して下すってもよろしいわ。"
"281","sakaguchi","omochabako.txt","今日はお名残りの宴会やりましょう」"
"282","sakaguchi","omochabako.txt","「でも、もう、汽車にのらなきゃいけないから」"
"283","sakaguchi","omochabako.txt","「あら、小田原ぐらい、何時の汽車でもよろしいじゃないの。"
"284","sakaguchi","omochabako.txt","じゃア先生お料理はありませんけどお酒はありますから、ちょっと飲んでらして」"
"285","sakaguchi","omochabako.txt","「暗くならないうちに着かなきゃいけないから」"
"286","sakaguchi","omochabako.txt","「あら御自分のうちのくせに。"
"287","sakaguchi","omochabako.txt","ねえ奥様。"
"288","sakaguchi","omochabako.txt","そんなに邪険になさるなんて、ひどいわ。"
"289","sakaguchi","omochabako.txt","奥様、一時間ぐらい、よろしいでしょう。"
"290","sakaguchi","omochabako.txt","先生をおかりしてよ。"
"291","sakaguchi","omochabako.txt","奥様は荷物の整理やらなさるのでしょう。"
"292","sakaguchi","omochabako.txt","ほんとに先生たら、水くさい方ね」"
"293","sakaguchi","omochabako.txt","庄吉はマダムの部屋へ招じられて、もてなしをうける。"
"294","sakaguchi","omochabako.txt","荷物の整理などもうできてるから残念無念の一時間、"
"295","sakaguchi","omochabako.txt","「もう時間だわ、行きましょう」"
"296","sakaguchi","omochabako.txt","「あら、今、料理がとどいたばかりよ、これからよ、ねえ、先生」"
"297","sakaguchi","omochabako.txt","その言葉に目もくれず、もうマッカ、酔眼モーローたる宿六の腕をつかんで、"
"298","sakaguchi","omochabako.txt","「さ、行きましょうよ」"
"299","sakaguchi","omochabako.txt","「お前も一パイのめ」"
"300","sakaguchi","omochabako.txt","「ほら、ごらんなさい。"
"301","sakaguchi","omochabako.txt","そんなになさると嫌われてよ。"
"302","sakaguchi","omochabako.txt","ヤボテンねえ、先生」"
"303","sakaguchi","omochabako.txt","「ヤボテンだって、オセッカイよ。"
"304","sakaguchi","omochabako.txt","あなたは何よ、芸者あがりのオメカケじゃないの。"
"305","sakaguchi","omochabako.txt","私は女房よ」"
"306","sakaguchi","omochabako.txt","変ったところで気焔をあげる。"
"307","sakaguchi","omochabako.txt","庄吉もまだ限度のわかる酔態で、都落ちの悲惨まだ胸につかえて残っているから、案外おとなしく立ちあがる。"
"308","sakaguchi","omochabako.txt","マダムがスッと立ちあがり庄吉のうしろへ廻って二重トンビをかけてやろうとすると、女房は物も言わず、ひったくり、小さな庄吉を抱きだすようにグイグイ押して廊下へでる。"
"309","sakaguchi","omochabako.txt",""
"310","sakaguchi","omochabako.txt","「先生、御上京待っててよ。"
"311","sakaguchi","omochabako.txt","すぐ電話で知らせてね」"
"312","sakaguchi","omochabako.txt","庄吉がふりむいて挨拶しようとすると、女房は首筋へ手をかけ捩じむけて出口へ向けて突きとばし、庄吉はヨロヨロヒョイヒョイ突かれ押されて往来へとびだし、天下晴れて振りむいたら、もうマダムの姿はなかった。"
"313","sakaguchi","omochabako.txt",""
"314","sakaguchi","omochabako.txt","「チェッ、ざまみろ、いいきみだ」"
"315","sakaguchi","omochabako.txt","女房はプンプン怒っているが、マダムはたぶん部屋の中で笑いころげているだろう。"
"316","sakaguchi","omochabako.txt","女房よりも、然し庄吉がもっとからかわれ侮辱され弄ばれ嘲笑されている、それが庄吉には腹にしみて分るのだ。"
"317","sakaguchi","omochabako.txt","然し、己れのほかの何人も呪うべきものはない。"
"318","sakaguchi","omochabako.txt","仕事、仕事、ただ仕事あるのみ、こうして庄吉は都を落ちた。"
"319","sakaguchi","omochabako.txt",""
"320","sakaguchi","omochabako.txt","★"
"321","sakaguchi","omochabako.txt","小田原の生家には亡夫のあとを守って彼の母が孤独な生活をつづけている。"
"322","sakaguchi","omochabako.txt","まことに気丈な孤独生活で、長年小学校の訓導、男まさりの生活、そのうえ亡夫と一緒のころから孤独には馴れていた。"
"323","sakaguchi","omochabako.txt","なぜなら亡夫は外国航路の船長で、大部分は海で暮して、たまに帰ると家よりも青楼で深酌高唱、時にはまだ学生の庄吉をつれて出たまま倅まで青楼へ泊めてしまうていたらくで、亭主と顔を合せるたびに剣客が他流試合をするような長々の生活に馴れてきたのだ。"
"324","sakaguchi","omochabako.txt",""
"325","sakaguchi","omochabako.txt","亡夫の遺産は年端もゆかぬ庄吉がみるみる使い果し家屋敷は借金のカタにとりたてられ、執達吏はくる、御当人は逃げだして文学少女とママゴトみたいな生活して、原稿は売れず、酒屋米屋家賃に追われて、逃げ廻り、居候、転々八方うろつき廻り、子供が病気だのと金をせびりにくる、彼女は長年の訓導生活で万金のヘソクリがあるからそれを見こんで庄吉が騙しにくるのだけれども、もう鐚一文やらないことにしている。"
