"","auth","piece","line"
"326","sakaguchi","omochabako.txt","下宿を追われ、どこかの居候もいにくくなると、小田原へ逃げのびてきて糊口をしのぎ、原稿をかいてどこかの部屋をかりる当がつくとサッサと飛びだすという習慣、恩愛の情など微塵もなく、ただもうヤッカイ千万な奴だと思っている。"
"327","sakaguchi","omochabako.txt",""
"328","sakaguchi","omochabako.txt","然しそのとき庄吉には都落ちを慰めてくれる非常に大きな希望があった。"
"329","sakaguchi","omochabako.txt","それは東都の第一流の大新聞が連載小説を依頼してくれたからで、近頃では新聞の連載などではカストリもろくに飲めないけれども、そのころの新聞連載、それも彼の依頼を受けた第一流の新聞ともなれば、生活は一気に楽になる。"
"330","sakaguchi","omochabako.txt",""
"331","sakaguchi","omochabako.txt","庄吉は孤高の文学だのストア派などと言われ当人もその気になっていたが、実際の心事はそうではなくて、何よりも金が欲しい。"
"332","sakaguchi","omochabako.txt","貧乏はつらいのだ。"
"333","sakaguchi","omochabako.txt","そのくせ武士は食わねど高楊子、金なんか何だい、ただ仕事さえすりゃいいんだ、静かな部屋、女房子供に患わされぬ閑居があれば忽ち傑作が出来あがるような妄想的な説を持している。"
"334","sakaguchi","omochabako.txt",""
"335","sakaguchi","omochabako.txt","彼は然し実際は最も冷酷な鬼の目をもち、文学などはタカの知れたもの、芸術などというと何か妖怪じみた純粋の神秘神品の如くに言われるけれども、ゲーテがたまたまシェクスピアを読み感動してオレも一つマネをしてと慌てて書きだしたのが彼の代表的な傑作であったというぐあいのもの、古来傑作の多くはお金が欲しくてお金のために書きなぐって出来あがったものだ、バルザックは遊興費のために書き、チェホフは劇場主の無理な日限に渋面つくって取りかかり、ドストエフスキーは読者の好みに応じて人物の性格まで変え、あらゆる俗悪な取引に応じて、その俗悪な取引を天来のインスピレーションと化し自家薬籠の大活動の源と化す才能をめぐまれていたにすぎない。"
"336","sakaguchi","omochabako.txt","通俗雑誌の最も俗悪な注文に応じても、傑作は書きうるもの、そういうことを彼は内実は知っていた。"
"337","sakaguchi","omochabako.txt",""
"338","sakaguchi","omochabako.txt","事実に於て文学はそういうものだ。"
"339","sakaguchi","omochabako.txt","自由というものは重荷なもので、お前の自由に存分の力作をたのむ、と言われると却って困却することが多い。"
"340","sakaguchi","omochabako.txt","本当に書きたいもの、書かずにいられぬものはそう幾つもあるものではないからだ。"
"341","sakaguchi","omochabako.txt","だから、通俗雑誌などから注文をつけられたり、こんなことを書いてくれと言われると、却ってそれをキッカケに独自な作家活動が起り易いもの、なぜなら、作家は自分一人であれこれ考えている時は自分の既成の限界に縛られそこから出にくいものであり、他から思いも寄らない糸口を与えられると、自分の既成の限界をはみだして予測し得ざる活動を起し新らたな自我を発見し加えることができ易いからだ。"
"342","sakaguchi","omochabako.txt","だから、誰からもうるさいことを言われず、家庭のキズナを離れ、思う存分に傑作を書きたいなどとは空疎な念仏にすぎず、傑作は鼻唄まじりでも喧噪の巷に於ても書きうるもの、閑静な部屋でジックリ腰でもすえればそれで傑作が書けるというような考えは悲惨な迷信だ。"
"343","sakaguchi","omochabako.txt",""
"344","sakaguchi","omochabako.txt","同様に亦、名も金もいらない、ただ存分に、良心的な仕事を、などという精神主義も最も文学を誤るもので、作家が持てる才能を全的に発揮するには心の励みが必要で、名や金は要するに心の励みだ。"
"345","sakaguchi","omochabako.txt","心に励みがなければ、いかほど大才能に恵まれていても、それを全的に発揮することはできない。"
"346","sakaguchi","omochabako.txt","ドストエフスキーほどの大天才でも、いったん世間の黙殺にあうと二十年近く、まったく愚作の連続、いたずらに人を模倣し、右コ左ベン、全然自分の力量を現し得ない。"
"347","sakaguchi","omochabako.txt","落伍者ほどウヌボレの強いものはないが、ウヌボレと自信は違って、自信は人が与えてくれるもの、つまり人が自分の才能を認めてくれることによって当人が実際の自信を持ち得るもので、ドストエフスキーほどの大天才でも人々に才能を認められ名と金を与えられて、はじめて全才能を発揮しうる自信に恵まれることができた。"
"348","sakaguchi","omochabako.txt",""
"349","sakaguchi","omochabako.txt","無名作家が未来の希望に燃えて精進没入するのと違って、庄吉の如くにいったん一応の文名を得ながら、いつまでたってもウダツがあがらず、書く物は概ね金にならず、雑誌社へ持ちこんでも返されてしまう。"
"350","sakaguchi","omochabako.txt","そういう生活がつづいては自信を失い、迷うばかりで、ウヌボレばかり先に立ち徒らに力みかえって精進潔斎、創作三昧、力めば力むほど空疎な駄文、自我から遊離した小手先だけ複雑な細工物ができあがるばかり、苦心のあげくにこしらえものの小説ばかりが生まれてくる。"
"351","sakaguchi","omochabako.txt",""
"352","sakaguchi","omochabako.txt","庄吉は近代作家の鬼の目、即物性、現実的な眼識があるから、もとより這般の真相は感じもし、知ってもいた。"
"353","sakaguchi","omochabako.txt","そのくせ時代の通念がその自覚に信念を与えてくれず、自信がなくて、彼は徒らに趣味的な文人墨客的気質の方に偏執し、真実の自我、文学の真相を自信をもって知り得ない。"
"354","sakaguchi","omochabako.txt",""
"355","sakaguchi","omochabako.txt","だから金が欲しくてたまらなくとも、通俗雑誌には書かないとか、雑文を書いちゃいけないとか、注文をつけてきたからイヤだとか、まことの思いとウラハラなことを言って、徒らに空虚に純粋ぶる。"
"356","sakaguchi","omochabako.txt",""
"357","sakaguchi","omochabako.txt","東都第一流の大新聞から連載小説の依頼を受けて、燃え上るごとくに心が励んだけれども、子供の学校のこと、女房のこと、オフクロの顔を見てたんじゃ心が落付かないんだ、下らぬ文人気風の幻影的習性に身を入れて下らなく消耗し、ともかく小田原の待合の一室を借りて日本流行大作家御執筆の体裁だけととのえたが、この小説が新聞にのり金がはいるのが四、五ヶ月さきのこと、出来が悪くて掲載できないなどと云ったらこの待合の支払いを如何にせん、そんなことばかり考えて、実際の小説の方はただ徒らに苦吟、遅々として進まない。"
"358","sakaguchi","omochabako.txt",""
"359","sakaguchi","omochabako.txt","せっかく燃えひらめいた心の励みも何の役にも立たなくなり、いったん心が閃いただけ、遅々として進まなくなり、わが才能を疑りだすと、始めに気負った高さだけ、落胆を深め、自信喪失の深度を深かめる。"
"360","sakaguchi","omochabako.txt","徒らに焦り、ただもう、もがきのたうつ如く心は迷路をさまよい曠野をうろつく。"
"361","sakaguchi","omochabako.txt",""
"362","sakaguchi","omochabako.txt","元々彼の近作はその根柢に於て自我の本性、現実と遊離し苦吟の果の細工物となり、すでにリミットに達していた。"
"363","sakaguchi","omochabako.txt","このリミット、この殻を突き破り一挙にくずして自我本来の作品に立ち戻るにはキッカケが必要で、それには心の励みが何よりの条件になるものであるのに、天来の福音をむざむざ逃して、今では福音のために却って焦りを深め、落胆をひろげ、心を虚しくしてしまった。"
"364","sakaguchi","omochabako.txt",""
"365","sakaguchi","omochabako.txt","待合の一室に無役に紙を睨んで、然しうわべは大新聞御連載の大作家、膝下に参ずる郷里の後輩共を引見して酒、酔っ払ってむやみに威張って、おい大金がはいるんだから心配するな、むかしの三枝さんと違うんだからな、酒はどうも胃にもたれていけねえ、ウイスキーはねえか、オールドパアがいいんだ、などと泥酔して家へ帰る。"
"366","sakaguchi","omochabako.txt","女房｜柳眉を逆立てて、"
"367","sakaguchi","omochabako.txt","「どこをノタクッて飲んでくるのよ。"
"368","sakaguchi","omochabako.txt","お米やお魚を買うお金をどうしてくれるの。"
"369","sakaguchi","omochabako.txt","それを一々おッ母さんに泣きついて貰ってこなきゃアいけないの。"
"370","sakaguchi","omochabako.txt","おッ母さんから貰ってくるなら、あなたが貰ってきてちょうだい。"
"371","sakaguchi","omochabako.txt","さもなきゃ、私はもう小田原にはいないから」"
"372","sakaguchi","omochabako.txt","「何言ってやあんだ。"
"373","sakaguchi","omochabako.txt","行くところがあったらどこへでも行きやがれッてんだ」"
"374","sakaguchi","omochabako.txt","然し胸の底では彼の心は一筋の糸の如くに痩せるばかり、小説を如何にせん、もはや書きつづける自信もない、待合の支払い、連日の酒代を如何にせん、この機会にして書き得なければもはや文学的生命の見込みもない、この切なさを何処に向ってもらすべき。"
"375","sakaguchi","omochabako.txt",""
"376","sakaguchi","omochabako.txt","酔いからさめれば、女房のくりごとも胸にくいこむ。"
"377","sakaguchi","omochabako.txt","いくらでもないお魚の代金まで母に泣きつく女房のせつなさ、もとより彼自身のせつなさなのだ。"
"378","sakaguchi","omochabako.txt","心配するな、金策してくる。"
"379","sakaguchi","omochabako.txt","そこで雑文を書き上京して雑誌社をまわり、三拝九拝ねばりぬいて何がしの金を手に入れる、友だちとお茶をのんで、なんしろ一枚のヒモノを買う金もないてんで女房の奴怒り心頭に発して、などと白昼は大いにケンソンしてお茶をなめているけれども、夕頃に近づくと、どうも飲まずに汽車にのるのはテレちゃうな、ちょっとだけ飲もう、そこでちょっと飲む、まアいいや、今の汽車は通勤の帰りの人でこんでるからなどと、終列車で深夜に帰る。"
"380","sakaguchi","omochabako.txt","泥酔して、よろめき、ころがり、泥にまみれて、無一文、おまけに襟のあたりに口紅がついている。"
"381","sakaguchi","omochabako.txt",""
"382","sakaguchi","omochabako.txt","「この口紅は何よ」"
"383","sakaguchi","omochabako.txt","「アハハハ。"
"384","sakaguchi","omochabako.txt","バレたか。"
"385","sakaguchi","omochabako.txt","アハハハ。"
"386","sakaguchi","omochabako.txt","それは疑雨荘のマダムに可愛がられちゃったんだ。"
"387","sakaguchi","omochabako.txt","アハハ」"
"388","sakaguchi","omochabako.txt","本当は新橋の片隅の横丁のインチキバアで人喰人種の口のような女にかじりついて貰ったのだが、貧し貪すれば残るものは弱い者いじめの加虐癖ぐらいのもの、しすましたりと嬉しそうにダラシなく笑って、こう言う。"
"389","sakaguchi","omochabako.txt","女房は烈火の如く憤り、気も顛倒した。"
"390","sakaguchi","omochabako.txt","彼女は宿六とマダムの交際の真相については露いささかも知らないのだから、貧苦に追われて流浪十幾年、積年の怨み、重なる無礼、軽蔑、カンニンブクロの緒が切れた。"
"391","sakaguchi","omochabako.txt",""
"392","sakaguchi","omochabako.txt","翌日早朝、手廻りのものを包みに人気のない小田原の街を蹴るが如くに停車場へ、上京して、宿六の弟子の大学生浮田信之を訪ねてワッと泣いた。"
"393","sakaguchi","omochabako.txt",""
"394","sakaguchi","omochabako.txt","この大学生はこの前の失踪中もちょっと泣きに行って色々といたわられ、失踪からの帰りには一緒についてきてくれて宿六にあやまってくれたのである。"
"395","sakaguchi","omochabako.txt","ところがまだ大学生のことだから、一番ありふれた俗世の実相がわからない。"
"396","sakaguchi","omochabako.txt","夫婦喧嘩は犬も食わないと云って、昔から当事者以外は引込んでいるべき性質のものだが、彼はすっかり女房の言うことをマに受けて、失踪帰りの女房について送ってきたとき、先生、変な女にひっかかるの言語道断などと一人前に口上をのべて先生を怒らせてしまったものだ。"
"397","sakaguchi","omochabako.txt",""
"398","sakaguchi","omochabako.txt","そこで鬱憤もあるところへ、再び女房がワッと泣きこんできたから、大いに同情し、行くところがないから泊めて、と言うが、脛カジリの大学生では両親の手前も女は泊められない、そんなら一緒に旅館へ泊りに行きましょうと、元々その気があってのことで、手に手をとって失踪してしまった。"
"399","sakaguchi","omochabako.txt",""
"400","sakaguchi","omochabako.txt","一週間すぎても帰らない。"
"401","sakaguchi","omochabako.txt","庄吉もまったく狼狽して実家へ問い合せたがそこにも居らず、探してみると浮田信之と失踪していることが分った。"
"402","sakaguchi","omochabako.txt","浮田の父親は仰天して庄吉の前に平伏し、倅めを見つけ次第刀にかけても成敗してお詫び致します、マアマア、そんな手荒なことはなさってはいけません、と彼もその時は大人らしく応待したが、さてその日から、彼は一時に懊悩狂乱、神経衰弱となり、にわかに顔までゲッソリやつれ、癈人の如くに病み衰えてしまった。"
"403","sakaguchi","omochabako.txt",""
"404","sakaguchi","omochabako.txt","★"
"405","sakaguchi","omochabako.txt","庄吉は後輩の栗栖按吉に当てて手紙の筆を走らせた。"
"406","sakaguchi","omochabako.txt","こういう時に思いだすのは、この憎むべき奴一人なのである。"
"407","sakaguchi","omochabako.txt","疑雨荘で女房が失踪したあとでも、女房子供と別居して彼の下宿へ一室をかりて共に勉強しようかと思いつき、その一室がなくて小田原へ落ちのびたが、落ちのびる前日風の如くに訪ねてきて、荷物を片づけてくれたのもあの憎むべき奴であった。"
"408","sakaguchi","omochabako.txt",""
"409","sakaguchi","omochabako.txt","そこで庄吉は按吉に当てて、この手紙見次第小田原へ駈けつけてくれ、君の顔を見ること以外に外の何も考えることができない、という速達をだした。"
"410","sakaguchi","omochabako.txt",""
"411","sakaguchi","omochabako.txt","然し彼はこの三年来、按吉ぐらい憎むべき奴はいないのだった。"
"412","sakaguchi","omochabako.txt","憎むべく、呪うべき奴なのである。"
"413","sakaguchi","omochabako.txt","もっとも、親切な奴ではあった。"
"414","sakaguchi","omochabako.txt","夜逃げの家も探してくれる、借金の算段もしてくれる、夜逃げごとに変る倅の小学校の不便を按じて私立の小学校へ入学させてくれる、そういう時は親身であった。"
"415","sakaguchi","omochabako.txt","然し彼は先輩に対する後輩の礼儀というものを知らないのである。"
"416","sakaguchi","omochabako.txt",""
"417","sakaguchi","omochabako.txt","会えば必ず先輩庄吉の近作をヤッツケる。"
"418","sakaguchi","omochabako.txt","庄吉は酔っ払うと自分で自分にさんをつけて三枝さんと自称したり三枝先生と自称する。"
"419","sakaguchi","omochabako.txt","すると按吉は、うぬぼれるな、と言う。"
"420","sakaguchi","omochabako.txt","なんだい、近ごろ書くものは。"
"421","sakaguchi","omochabako.txt","先生ヅラが呆れらア、てんで小手先のコシラエ物じゃないか、殻を背負って身動きもできないじゃないか、第一なんだい、自分の小説を朝昼晩朗読するなんて、あさましいことはやめなさい。"
"422","sakaguchi","omochabako.txt","こういうことを言う。"
"423","sakaguchi","omochabako.txt","必ず言う。"
"424","sakaguchi","omochabako.txt",""
"425","sakaguchi","omochabako.txt","三枝庄吉は怒り心頭に発し、彼を知る共同の知友に手紙を書いてアイツはウヌボレ増長慢の気違い、礼儀を知らず、文学者の風上に置けぬ奴と宣言を発し、忿怒、憎悪、三ヶ年、憎さも憎し、然し、ふと、苦悩の度に奴を思う。"
"426","sakaguchi","omochabako.txt","そして速達を書いてしまう。"
"427","sakaguchi","omochabako.txt","親友の大門次郎に絶交されたときも、やにわに奴めに速達をだして来てもらったし、然し又、すぐ腹も立つ。"
"428","sakaguchi","omochabako.txt",""
"429","sakaguchi","omochabako.txt","按吉は速達を見るとすぐ来たが、あんまり庄吉がやつれ果ててしまったので呆気にとられた。"
"430","sakaguchi","omochabako.txt","額の肉までゲッソリ落ちて、顔がひどく小さくなり、按吉の片手の握り拳におさまるぐらい小さくなって、その中に目と鼻と口だけは元の大きさにチャンとあるから、ミイラのように黒ずんで、喋るとまるで口だけが妖怪じみて動きだす。"
"431","sakaguchi","omochabako.txt","目と鼻と口をのぞくと、あとは黄濁した皺と毛髪だけであった。"
"432","sakaguchi","omochabako.txt",""
"433","sakaguchi","omochabako.txt","「ああ、よく来てくれたな。"
"434","sakaguchi","omochabako.txt","会いたかったな。"
"435","sakaguchi","omochabako.txt","会えてよかった。"
"436","sakaguchi","omochabako.txt","あれから君はどんなに暮していた。"
"437","sakaguchi","omochabako.txt","君の部屋は静かなのか。"
"438","sakaguchi","omochabako.txt","勉強はできたか。"
"439","sakaguchi","omochabako.txt","ああ、今日はオレは幸せだ。"
"440","sakaguchi","omochabako.txt","ようやく君に会えたのか」"
"441","sakaguchi","omochabako.txt","按吉は又呆気にとられた。"
"442","sakaguchi","omochabako.txt","酒に酔った場合の外は、陰鬱無言、極度に慎しみ深くハニカミ屋で、およそ感情を露出することのない庄吉であったから。"
"443","sakaguchi","omochabako.txt",""
"444","sakaguchi","omochabako.txt","庄吉は頻りに泊ることをすすめたけれども按吉は〆切ちかい仕事があるからと言って強いてことわった。"
"445","sakaguchi","omochabako.txt","それというのが、病みやつれた庄吉と話しているのが苦痛で堪えられなかったからで、一向にはやらない三文文士の栗栖按吉に〆切に追われる仕事もないものだが、それをきくと庄吉は全然すまながって、そうだったか、無理にきてくれたのか、かんべんしてくれ、小さくちぢんだ顔はそれだけでもう元々涙をためているように見えるのであった。"
"446","sakaguchi","omochabako.txt",""
"447","sakaguchi","omochabako.txt","それでも按吉は色々と言葉をつくして、たとえ女房が浮田と失踪しても必ずしも肉体の関係があるとは限らない。"
"448","sakaguchi","omochabako.txt","元々｜痴情の家出ならともかく、亭主と喧嘩して飛びだす、そういう場合は別で、自分はさる娘と十日あまりも恋愛旅行をしたことがあるが娘は身をまかせなかった、女房も今度の場合のような家出はそんなようなもので、一応は必ず肉体的なことはイヤだと言うにきまっているのだから、相手がまだ学生で坊ちゃんの浮田のことだからそれを押してどうすることになる筈がなく、極めて感傷的な旅行にくたびれているぐらいのところだろう。"
"449","sakaguchi","omochabako.txt","むしろ機会を失し、帰るに帰られず煩悶しているのかも知れず、それやこれやで御両名｜遂に心中というようなことになってもなお肉体の関係はないかも知れぬ。"
"450","sakaguchi","omochabako.txt","世上の俗事は、案外そんなもので、一向人目につかず亭主に知られぬような浮気に限って深間へ行っているもの、こういう派手な奴は見かけ倒しで、両名｜却ってただ苦しんでいるぐらいのところだ、などと慰めた。"
"451","sakaguchi","omochabako.txt","そしてまだ陽のあるうちに、さっさと帰ってきてしまったのだ。"
"452","sakaguchi","omochabako.txt",""
"453","sakaguchi","omochabako.txt","按吉に慰められているうちは庄吉も力強いような気持で、すっかり相手にまかせきり安心しきってウンウンきいていたが、按吉がさっさと帰ってしまう、待ちかねたものを待つうちはまだよかったが、すでに来り、すでに去った、按吉の居るうちこそはそこに何がしの説得力もあったにしても、按吉去る、その残された慰めの言葉は何物ぞ、ただ空虚なる冗言のみ、女房はおらぬ、男と共に失踪している、この事実を如何にすべき。"
"454","sakaguchi","omochabako.txt",""
"455","sakaguchi","omochabako.txt","庄吉の消耗衰弱は更に又、急速度に悪化した。"
"456","sakaguchi","omochabako.txt",""
"457","sakaguchi","omochabako.txt","庄吉の小学校時代からの後輩で文学青年の戸波五郎が、ちょうど彼の家と露路をへだてて真向いに住み、縁先からオーイとよぶと向うの家から彼の返事をきくことができる。"
"458","sakaguchi","omochabako.txt","戸波は庄吉の東京にいる頃、東京にすみ、本屋の番頭で、殆ど三日にあげず遊びにきていた仲よしで、一緒に方々借金をつくって飲み歩いた仲間であるが、この一年来小田原へ戻って駅前に雑文堂という書物の売店をひらき、毎日出かけて行く。"
"459","sakaguchi","omochabako.txt","尤も、小僧に店をまかせて、時にはオトクイ廻りもやるが、自分は昼から酒をのんでいるようなことも少くはなく、売上げをその一夜に飲みあげて足をだして、もう夜逃げも間近かなところに迫ってもいた。"
"460","sakaguchi","omochabako.txt",""
"461","sakaguchi","omochabako.txt","心配ごとで消耗する、何よりも友達が恋しい。"
"462","sakaguchi","omochabako.txt","友達がきて一緒にいてくれると、時には苛々何かと腹が立つこともあっても、どこか充ち足り、安心していられる。"
"463","sakaguchi","omochabako.txt",""
"464","sakaguchi","omochabako.txt","戸波は大飲み助で、宿酔の不安苦痛、そういうものは良く分り、そういう時には極度に友達が恋しいもので、その覚えが自ら常にナジミの深いことだから、庄吉の友恋しさに同情して、オーイと庄吉が向うの家で呼んでいると、出かけて行って、無理して相手になってやる。"
"465","sakaguchi","omochabako.txt","尤も彼自身宿酔とか夜逃げ以上の悩みはなくて自分にないことは敢て想像に及んでまで同情してやる余地はない。"
"466","sakaguchi","omochabako.txt","これは誰しもそういうもので、だから庄吉が話の途中に急にイライラとシゴキを握ってピンポン台の足にからみつけて、輪をつくり、輪に首を突ッこんでグイグイひいて、これじゃア死ねねえかな、イライラとシゴキを握って又首をつッこみギュウギュウ腕でひっぱりあげる。"
"467","sakaguchi","omochabako.txt","まるでもう気違いの目で、濁って青くて、暗くギラギラしている。"
"468","sakaguchi","omochabako.txt","それでも、まさかに自殺というようなことを、想像してみなかった。"
"469","sakaguchi","omochabako.txt",""
