"","auth","piece","line"
"0","sakaguchi","oshaberi_kyoso.txt","お喋り競争"
"1","sakaguchi","oshaberi_kyoso.txt","坂口安吾"
"2","sakaguchi","oshaberi_kyoso.txt",""
"3","sakaguchi","oshaberi_kyoso.txt","-------------------------------------------------------"
"4","sakaguchi","oshaberi_kyoso.txt","【テキスト中に現れる記号について】"
"5","sakaguchi","oshaberi_kyoso.txt",""
"6","sakaguchi","oshaberi_kyoso.txt","《》：ルビ"
"7","sakaguchi","oshaberi_kyoso.txt","（例）恰も"
"8","sakaguchi","oshaberi_kyoso.txt",""
"9","sakaguchi","oshaberi_kyoso.txt","／＼：二倍の踊り字（「く」を縦に長くしたような形の繰り返し記号）"
"10","sakaguchi","oshaberi_kyoso.txt","（例）ペラ／＼"
"11","sakaguchi","oshaberi_kyoso.txt","-------------------------------------------------------"
"12","sakaguchi","oshaberi_kyoso.txt",""
"13","sakaguchi","oshaberi_kyoso.txt","一"
"14","sakaguchi","oshaberi_kyoso.txt",""
"15","sakaguchi","oshaberi_kyoso.txt","この九月末宇野浩二氏から電話がきた。"
"16","sakaguchi","oshaberi_kyoso.txt","私は生憎不在だつたが、至急の話があるから今夜か明朝会ひたい、訪れてほしいといふのであつた。"
"17","sakaguchi","oshaberi_kyoso.txt","なんの話か見当がつかなかつたが、私はその月の文芸通信に、牧野信一の自殺にやゝあてはまることを題材にした小説を書いた。"
"18","sakaguchi","oshaberi_kyoso.txt","見やうによつては確にさしさはりのある題材だから、その話かも知れないと思つた。"
"19","sakaguchi","oshaberi_kyoso.txt","尤も其小説は急所のところがひどい伏字で、私の方では伏字の部分を書くために他の五十枚を書いたやうなものであるから、落胆が大きかつた。"
"20","sakaguchi","oshaberi_kyoso.txt","私の想念がその小説に向いただけでも気持がくさるやうであつた。"
"21","sakaguchi","oshaberi_kyoso.txt","宇野さんからの電話ときくと、なんの根拠があつてその用件をいきなりこの小説にむすびつけてしまつたのかどうもハッキリ分らないが、私はてつきり宇野さんからこの小説の題材に対して文句がでるやうな気になつた。"
"22","sakaguchi","oshaberi_kyoso.txt","なにぶん私は伏字に対する落胆がまだ生々しい時であるから、気持がなんとなく激昂して、用件がそのことだとも分らぬうちに、すつかり宇野さんに反撥する気持をつくりあげてしまつたのである。"
"23","sakaguchi","oshaberi_kyoso.txt","翌朝はドシャ降りだつたが、私は本郷から上野桜木町の宇野さん宅までボロ傘さして歩いて行つた。"
"24","sakaguchi","oshaberi_kyoso.txt",""
"25","sakaguchi","oshaberi_kyoso.txt","私の知人関係では宇野浩二氏をお喋りの王座にすゑなければならない。"
"26","sakaguchi","oshaberi_kyoso.txt","相手に喋る隙を与へず自分ひとりのべつ幕なしに喋りまくるのである。"
"27","sakaguchi","oshaberi_kyoso.txt","恐らく黙つてゐるのが気づまりで、沈黙が恰も心中にうごめく醜悪な怪獣であるかのやうに不快であるのかも知れない。"
"28","sakaguchi","oshaberi_kyoso.txt",""
"29","sakaguchi","oshaberi_kyoso.txt","宇野さんは喋るといふより言葉に憑かれたといふ感じである。"
"30","sakaguchi","oshaberi_kyoso.txt","ひとこと喋る。"
"31","sakaguchi","oshaberi_kyoso.txt","すると宇野さんの頭の中には忽ちその言葉をめぐつてひどく虚無的な嵐が吹きはじめるものらしい。"
"32","sakaguchi","oshaberi_kyoso.txt","慌てふためいてまた喋る。"
"33","sakaguchi","oshaberi_kyoso.txt","また虚無的な苦痛を重ねる。"
"34","sakaguchi","oshaberi_kyoso.txt","とまるところもなく喋りつづけてしまふらしい。"
"35","sakaguchi","oshaberi_kyoso.txt","非常に疲れるだらうと思ふのである。"
"36","sakaguchi","oshaberi_kyoso.txt","聞いてゐる私の方がひどく疲れてしまふのだ。"
"37","sakaguchi","oshaberi_kyoso.txt",""
"38","sakaguchi","oshaberi_kyoso.txt","宇野さんは人に会ふのが嫌ひらしい。"
"39","sakaguchi","oshaberi_kyoso.txt","こんなに神経を使つて喋り、喋つて虚無感を深めるのでは、人に会ふのが苦痛なのは極めて当然だと思ふのである。"
"40","sakaguchi","oshaberi_kyoso.txt","宇野家の門にはいつも錠がおりてゐる。"
"41","sakaguchi","oshaberi_kyoso.txt","呼鈴を鳴らすと、女中部屋の格子窓が半分開いて、まるで河向うの女のやうに女中が首をだすのである。"
"42","sakaguchi","oshaberi_kyoso.txt","名前と用件をきいて引込み、やがて漸く門があくが、なるべく会はずにすましたい方寸らしい。"
"43","sakaguchi","oshaberi_kyoso.txt","文学界の随筆に、雑誌の用で小林秀雄が訪ねると云つてきた、訪ねてくれるには及ばないから手紙ですましてくれと云つてやつたのに、たうとう訪ねてきてしまつた、といふことをひどくいまいましさうに書いてゐるのを読んで可笑しくて堪まらなかつた。"
"44","sakaguchi","oshaberi_kyoso.txt","あんな風に喋らなければならないのでは、人に会ふのも並たいていの苦業ではないと察しがつく。"
"45","sakaguchi","oshaberi_kyoso.txt",""
"46","sakaguchi","oshaberi_kyoso.txt","宇野さんも人に会ふのが苦手だらうが、私も宇野さんと向ひあふのは苦手である。"
"47","sakaguchi","oshaberi_kyoso.txt","疲れるのだ。"
"48","sakaguchi","oshaberi_kyoso.txt","自分ひとり喋りまくつて一人相撲に疲れてしまふ宇野さんは自業自得で是非もないが、人のお喋りをきいて虚無的な疲れ方をしなければならないのは、並たいていな馬鹿な話ではないのである。"
"49","sakaguchi","oshaberi_kyoso.txt",""
"50","sakaguchi","oshaberi_kyoso.txt",""
"51","sakaguchi","oshaberi_kyoso.txt",""
"52","sakaguchi","oshaberi_kyoso.txt","二"
"53","sakaguchi","oshaberi_kyoso.txt",""
"54","sakaguchi","oshaberi_kyoso.txt","私は上野の杜を歩きながら、宇野さんの間断ない饒舌から生ずるところの疲労と虚無感をどういふ方法で撃退してやらうかと考へつづけた。"
"55","sakaguchi","oshaberi_kyoso.txt","虚しく手をつかねて彼の饒舌の俘虜となり、このドシャ降りの雨の日に更に憂鬱このうへもない数十分をもつことは、どうにも我慢がならなかつた。"
"56","sakaguchi","oshaberi_kyoso.txt","そこであれかれと考へてみたが、方法はたつた一つしかない。"
"57","sakaguchi","oshaberi_kyoso.txt","先方に喋る隙を与へず、いきなりこつちで喋りまくつてしまふのである。"
"58","sakaguchi","oshaberi_kyoso.txt",""
"59","sakaguchi","oshaberi_kyoso.txt","借金にでむく初心者はとかく一人相撲にいらざることをペラ／＼喋りまくつてしまふらしい。"
"60","sakaguchi","oshaberi_kyoso.txt","刻下の形勢に縁遠い昔の話に偏執したり、先方に諾否の返答をする隙がないほどせきこんでゐたりする。"
"61","sakaguchi","oshaberi_kyoso.txt","あんまり口数をきかずに借金の口上が言へる人はややその道の大家であらう。"
"62","sakaguchi","oshaberi_kyoso.txt","私はまだ初心者の域をでない。"
"63","sakaguchi","oshaberi_kyoso.txt","従而泡をくつて喋ることには案外馴れてゐるのである。"
"64","sakaguchi","oshaberi_kyoso.txt","いづれ近いうちには、貸す方がすつかり慌ててしまふほど落付払つて殆ど喋らずに金を借りてみようと考へてゐる。"
"65","sakaguchi","oshaberi_kyoso.txt",""
"66","sakaguchi","oshaberi_kyoso.txt","とある黄昏のことであつたが、小金を握つて賑やかな通りを歩いてゐると、悟りをひらいたことがあつた。"
"67","sakaguchi","oshaberi_kyoso.txt","芸術家としては唖のやうに寡黙であつても一面社会人として生きるからには大いにお世辞も言はねばならぬ。"
"68","sakaguchi","oshaberi_kyoso.txt","むしろ大いに幇間的である方がいい。"
"69","sakaguchi","oshaberi_kyoso.txt","人と会つてゐる時間といふのはすでに浪費しつつある時間であるから、滑稽なことを喋りまくつて人を娯しませてももと／＼損はしてゐない。"
"70","sakaguchi","oshaberi_kyoso.txt","犠牲的精神を感じて気をよくすることもできるのである。"
"71","sakaguchi","oshaberi_kyoso.txt","そこで私はかねがねむつつり酒をのむ習慣のおでん屋へとびこみ、そこの女将をつかまへて出鱈目な旅行談を喋りつづけたことがある。"
"72","sakaguchi","oshaberi_kyoso.txt","私の方が面白くないのはかねて予定のことであつたが、先方も面白くないらしく、相槌打つのに当惑してゐた。"
"73","sakaguchi","oshaberi_kyoso.txt","それ以来、意識的なお喋りをしたことはなかつた。"
"74","sakaguchi","oshaberi_kyoso.txt",""
"75","sakaguchi","oshaberi_kyoso.txt","私は宇野さんが一言喋つたら十言喋り返してやらうと決意した。"
"76","sakaguchi","oshaberi_kyoso.txt","元来大概の用は手紙ですむ。"
"77","sakaguchi","oshaberi_kyoso.txt","会談を極度に避け、万事手紙で弁じようとする精神は、宇野浩二の誕生によつて完成したやうなものであるのに、わざ／＼会見を申込んでくることが妖怪じみた不気味さである。"
"78","sakaguchi","oshaberi_kyoso.txt","私は用談ありの電話を受けると、それだけでもう圧倒されたやうなものであるから、一大決意を胸にかためて堂々と乗りこまないことには気持の収まりがつかないやうな状態でもあつた。"
"79","sakaguchi","oshaberi_kyoso.txt",""
"80","sakaguchi","oshaberi_kyoso.txt","この前宇野さんに会つたのは私の出版記念会の席だつた。"
"81","sakaguchi","oshaberi_kyoso.txt","私と宇野さんはあいにく隣合せに並ぶ宿命となり、宇野さんは芥川龍之介の自殺のことを喋りとほしに喋りまくつた。"
"82","sakaguchi","oshaberi_kyoso.txt","自殺の原因が十ばかり心当りがあるといふのである。"
"83","sakaguchi","oshaberi_kyoso.txt","偏執の形で、不気味であつた。"
"84","sakaguchi","oshaberi_kyoso.txt","この時やつぱり宇野さんと話を交した河上徹太郎が、どうも宇野さんは又狂つたんぢやないかなと言ひだした。"
"85","sakaguchi","oshaberi_kyoso.txt","とにかく作家はたとひ狂つても小説だけ狂はなければ、狂つてゐないと言はなければならないだらう。"
"86","sakaguchi","oshaberi_kyoso.txt","ある意味で、狂はなければ、小説は書けない。"
"87","sakaguchi","oshaberi_kyoso.txt",""
"88","sakaguchi","oshaberi_kyoso.txt",""
"89","sakaguchi","oshaberi_kyoso.txt",""
"90","sakaguchi","oshaberi_kyoso.txt","三"
"91","sakaguchi","oshaberi_kyoso.txt",""
"92","sakaguchi","oshaberi_kyoso.txt","宇野さんの家へ行くと、例の格子窓から河向うの女のやうに女中が首をだして引込んだ。"
"93","sakaguchi","oshaberi_kyoso.txt","宇野さんは全身に白なまずができてゐる様子であつた。"
"94","sakaguchi","oshaberi_kyoso.txt","私の顔を見るやいなや、いきなり「実はね、ゆうべ電話をかけてからたいへん後悔したのですよ。"
"95","sakaguchi","oshaberi_kyoso.txt","牧野信一の自殺に就てあなたの感想をききたいと思つたのですが、然し電話をかけてから、急にしまつたと思つたのですよ。"
"96","sakaguchi","oshaberi_kyoso.txt","きいてはいけないと思つたのですな。"
"97","sakaguchi","oshaberi_kyoso.txt","この前に芥川の自殺のことを書かうとしたことがあるのですが、事実を知りすぎるために書くと死んでしまふですな。"
"98","sakaguchi","oshaberi_kyoso.txt","あなたもその傾向があるでせうが、どうもなんですな、私は事実を知らない方が却つて生き生きと書けるですな。"
"99","sakaguchi","oshaberi_kyoso.txt","それであなたの話を伺はない方がいいのではないかと、実はゆうべからたいへん迷ひだして……」"
"100","sakaguchi","oshaberi_kyoso.txt","明らかに私の話をききたくない様子であつた。"
"101","sakaguchi","oshaberi_kyoso.txt","だいいち私を室内へ上げたくないと見え、玄関の上り框へ座蒲団をもつてきた。"
"102","sakaguchi","oshaberi_kyoso.txt","その座蒲団へ腰をおろさず、いきなりサヨナラと言つてクルリと振向いてしまふ方が、宇野さんのためにはいいのだらうとちよつと思つた。"
"103","sakaguchi","oshaberi_kyoso.txt","然し私の喋りまくつてやらうといふ牢固たる決意が、反撥的にグイと前面へのりだしてしまつたのである。"
"104","sakaguchi","oshaberi_kyoso.txt",""
"105","sakaguchi","oshaberi_kyoso.txt","私は上り框の座蒲団へ腰を下した。"
"106","sakaguchi","oshaberi_kyoso.txt","牧野信一の自殺に就て微に入り細にわたり、あることないこと取りまぜて立板に水を流すやうにまくしたてた。"
"107","sakaguchi","oshaberi_kyoso.txt","自分乍らよく喋るなと思つた。"
"108","sakaguchi","oshaberi_kyoso.txt","だいたい上り框へどつかと腰を下して、雨にぬれた裾を片手にまくりあげ膝小僧を露出させたりしたら、これはもう芝居のゆすりか借金取りの構へで、ちやんと喋るやうにできてゐるのである。"
"109","sakaguchi","oshaberi_kyoso.txt","私はたうとう喋り勝つてしまつた。"
"110","sakaguchi","oshaberi_kyoso.txt",""
"111","sakaguchi","oshaberi_kyoso.txt","自殺に関する話だから、話は勢ひ最も露骨な性生活に及んだりする。"
"112","sakaguchi","oshaberi_kyoso.txt","私は図に乗つてそんな余計なことまで勢ひこんでまくしたてた。"
"113","sakaguchi","oshaberi_kyoso.txt",""
"114","sakaguchi","oshaberi_kyoso.txt","台所の方に奥さんの気配があるので、その話になると、宇野さんは突然声を細くする。"
"115","sakaguchi","oshaberi_kyoso.txt","私もつりこまれて声を細くすると、いや、あなたは大きな声で、といふ目配せを慌てふためいてするのである。"
"116","sakaguchi","oshaberi_kyoso.txt",""
"117","sakaguchi","oshaberi_kyoso.txt","三四十分で話をきりあげ、私が立ち上ると、宇野さんはホッとした顔をした。"
"118","sakaguchi","oshaberi_kyoso.txt","外へでると雨は小降りになつてゐたが、まるでそれが人生の真相であるかのやうに額を集めて自殺の話なんかしてきたことが、私は急に癪にさはつた。"
"119","sakaguchi","oshaberi_kyoso.txt","私は腹を立てて立ち止つた。"
"120","sakaguchi","oshaberi_kyoso.txt","「宇野さん。"
"121","sakaguchi","oshaberi_kyoso.txt","自殺の話はつまらないよ」私はさう怒鳴るために戻らうと思つた。"
"122","sakaguchi","oshaberi_kyoso.txt","当りちらすといふよりも、宇野さんの冷然たる芸術家根性にちよつと甘えてみる気もあつた。"
"123","sakaguchi","oshaberi_kyoso.txt","然し諦めて歩きだすと、音楽学校の稽古の音が怒りを和らげる目的のやうに甘つたるく流れかかつてくる。"
"124","sakaguchi","oshaberi_kyoso.txt","さういふものに甘やかされるほど俺の根性は甘くないぞと、私は益々腹を立てて帰つたやうに覚えてゐる。"
"125","sakaguchi","oshaberi_kyoso.txt",""
"126","sakaguchi","oshaberi_kyoso.txt",""
"127","sakaguchi","oshaberi_kyoso.txt",""
"128","sakaguchi","oshaberi_kyoso.txt",""
"129","sakaguchi","oshaberi_kyoso.txt","底本：「坂口安吾全集02」筑摩書房"
"130","sakaguchi","oshaberi_kyoso.txt","1999（平成11）年4月20日初版第1刷発行"
"131","sakaguchi","oshaberi_kyoso.txt","底本の親本：「時事新報」"
"132","sakaguchi","oshaberi_kyoso.txt","1936（昭和11）年12月16日〜18日"
"133","sakaguchi","oshaberi_kyoso.txt","初出：「時事新報」"
"134","sakaguchi","oshaberi_kyoso.txt","1936（昭和11）年12月16日〜18日"
"135","sakaguchi","oshaberi_kyoso.txt","入力：tatsuki"
"136","sakaguchi","oshaberi_kyoso.txt","校正：今井忠夫"
"137","sakaguchi","oshaberi_kyoso.txt","2005年12月10日作成"
"138","sakaguchi","oshaberi_kyoso.txt","青空文庫作成ファイル："
"139","sakaguchi","oshaberi_kyoso.txt","このファイルは、インターネットの図書館、青空文庫（http://www.aozora.gr.jp/）で作られました。"
"140","sakaguchi","oshaberi_kyoso.txt","入力、校正、制作にあたったのは、ボランティアの皆さんです。"
"141","sakaguchi","oshaberi_kyoso.txt",""
