"","auth","piece","line"
"0","sakaguchi","shimabaranoran_zakki.txt","島原の乱雑記"
"1","sakaguchi","shimabaranoran_zakki.txt","坂口安吾"
"2","sakaguchi","shimabaranoran_zakki.txt",""
"3","sakaguchi","shimabaranoran_zakki.txt","-------------------------------------------------------"
"4","sakaguchi","shimabaranoran_zakki.txt","【テキスト中に現れる記号について】"
"5","sakaguchi","shimabaranoran_zakki.txt",""
"6","sakaguchi","shimabaranoran_zakki.txt","《》：ルビ"
"7","sakaguchi","shimabaranoran_zakki.txt","（例）甲斐守輝綱"
"8","sakaguchi","shimabaranoran_zakki.txt",""
"9","sakaguchi","shimabaranoran_zakki.txt","｜：ルビの付く文字列の始まりを特定する記号"
"10","sakaguchi","shimabaranoran_zakki.txt","（例）松平｜伊豆守"
"11","sakaguchi","shimabaranoran_zakki.txt",""
"12","sakaguchi","shimabaranoran_zakki.txt","／＼：二倍の踊り字（「く」を縦に長くしたような形の繰り返し記号）"
"13","sakaguchi","shimabaranoran_zakki.txt","（例）ころ／＼と"
"14","sakaguchi","shimabaranoran_zakki.txt","＊濁点付きの二倍の踊り字は「／″＼」"
"15","sakaguchi","shimabaranoran_zakki.txt","-------------------------------------------------------"
"16","sakaguchi","shimabaranoran_zakki.txt",""
"17","sakaguchi","shimabaranoran_zakki.txt","一三万七千人"
"18","sakaguchi","shimabaranoran_zakki.txt",""
"19","sakaguchi","shimabaranoran_zakki.txt","島原の乱で三万七千の農民が死んだ。"
"20","sakaguchi","shimabaranoran_zakki.txt","三万四千は戦死し、生き残つた三千名の女と子供が、落城の翌日から三日間にわたつて斬首された。"
"21","sakaguchi","shimabaranoran_zakki.txt","みんな喜んで死んだ。"
"22","sakaguchi","shimabaranoran_zakki.txt","喜んで死ぬとは異様であるが、討伐の上使、松平｜伊豆守の息子、甲斐守輝綱（当時十八歳）の日記に、さう書いてあるのである。"
"23","sakaguchi","shimabaranoran_zakki.txt","「剰至童女之輩喜死蒙斬罪是非平生人心之所致所以浸々彼宗門也」と。"
"24","sakaguchi","shimabaranoran_zakki.txt",""
"25","sakaguchi","shimabaranoran_zakki.txt","三千人の女子供がひそんでゐたといふ空濠は、今も尚、当時のまゝ残つてゐる。"
"26","sakaguchi","shimabaranoran_zakki.txt","丁度、原城趾の中央あたり、本丸と二の丸のあひだ、百五十坪ぐらゐの穴で、深さは二丈余。"
"27","sakaguchi","shimabaranoran_zakki.txt","今、空濠の底いちめん、麦がみのつてゐた。"
"28","sakaguchi","shimabaranoran_zakki.txt","又、本丸や二の丸には、ぢやが芋と麦が。"
"29","sakaguchi","shimabaranoran_zakki.txt",""
"30","sakaguchi","shimabaranoran_zakki.txt","原城趾は、往昔の原形を殆どくづしてゐない。"
"31","sakaguchi","shimabaranoran_zakki.txt","有明の海を背に、海に吃立した百尺の丘、前面右方に温泉岳を望んでゐる。"
"32","sakaguchi","shimabaranoran_zakki.txt","三万七千人戦死の時、このあたりの数里四方は住民が全滅した。"
"33","sakaguchi","shimabaranoran_zakki.txt","布津、堂崎、有馬、有家、口之津、加津佐、串山の諸村は全滅。"
"34","sakaguchi","shimabaranoran_zakki.txt","深江、安徳、小浜、中木場、三会等々は村民の半数が一揆に加担して死んだ。"
"35","sakaguchi","shimabaranoran_zakki.txt","だから、落城後、三万七千の屍体をとりかたづける人足もなく、まして、あとを耕す一人の村民の姿もなかつた。"
"36","sakaguchi","shimabaranoran_zakki.txt","白骨の隙間に雑草が繁り、なまぐさい風に頭をふり、島原半島は無人のまゝ、十年すぎた。"
"37","sakaguchi","shimabaranoran_zakki.txt","十年目に骨を集め、九州諸国の僧をよびよせ、数夜にわたつて懇に供養し、他国から農民を移住せしめた。"
"38","sakaguchi","shimabaranoran_zakki.txt","だから、今の村民は、まつたく切支丹に縁がない。"
"39","sakaguchi","shimabaranoran_zakki.txt","移住者達は三万七千の霊を怖れ、その原形をくづすことを慎んだのかも知れぬ。"
"40","sakaguchi","shimabaranoran_zakki.txt","原形のまゝ、畑になつてゐるのである。"
"41","sakaguchi","shimabaranoran_zakki.txt",""
"42","sakaguchi","shimabaranoran_zakki.txt","私は城趾の入口を探して道にまよひ、昔は天草丸といつた砦の下にあたる浜辺の松林で、漁夫らしい人に道をきいた。"
"43","sakaguchi","shimabaranoran_zakki.txt","返事をしてくれなかつた。"
"44","sakaguchi","shimabaranoran_zakki.txt","重ねてきいたら、突然ぢやけんに、歩きだして行つてしまつた。"
"45","sakaguchi","shimabaranoran_zakki.txt","子供達をつかまへてきいたが、これも逃げて行つてしまつた。"
"46","sakaguchi","shimabaranoran_zakki.txt","すると、十四五間も離れた屋根の下から、思ひもよらぬ女の人が走りでゝ来て、ていねいに教へてくれた。"
"47","sakaguchi","shimabaranoran_zakki.txt","宿屋で、何か切支丹のことを聞きださうとしたが、主婦は、私の言葉が理解できないらしく、やゝあつてのち、このあたりではキリスト教を憎んでゐます、と言つた。"
"48","sakaguchi","shimabaranoran_zakki.txt",""
"49","sakaguchi","shimabaranoran_zakki.txt",""
"50","sakaguchi","shimabaranoran_zakki.txt","二原因"
"51","sakaguchi","shimabaranoran_zakki.txt",""
"52","sakaguchi","shimabaranoran_zakki.txt","島原の乱の原因は、俗説では切支丹の反乱と言はれてきたが、今日、一般の定説では、領主の苛斂誅求による農民一揆と言はれてゐる。"
"53","sakaguchi","shimabaranoran_zakki.txt","天草四郎が松平伊豆守に当てた陣中の矢文にも、領主松倉長門守の重税を訴へ「近代、長門守殿内検地詰存外の上、剰へ高免の仰付けられ、四五年の間、牛馬書子令文状、他を恨み身を恨み、落涙袖を漫し、納所仕ると雖も、早勘定切果て――」と書いてゐる。"
"54","sakaguchi","shimabaranoran_zakki.txt",""
"55","sakaguchi","shimabaranoran_zakki.txt","然し、重税の内容がどのやうなものであつたか、この文章からは分らない。"
"56","sakaguchi","shimabaranoran_zakki.txt","牛馬書子令文状といふものがどのやうなものであるか、それすらも分らないのだ。"
"57","sakaguchi","shimabaranoran_zakki.txt","又、日本に残る記録には、之に就て語るものが、まつたくない。"
"58","sakaguchi","shimabaranoran_zakki.txt","たゞ、教会側に、ポルトガルの船長ヂュアルテ・コレアの手記があり、これによつて、推察しうるにすぎない。"
"59","sakaguchi","shimabaranoran_zakki.txt","コレアは、一揆の当時、大村の牢屋にゐたのである。"
"60","sakaguchi","shimabaranoran_zakki.txt",""
"61","sakaguchi","shimabaranoran_zakki.txt","コレアの手記によれば、農民は米、大麦、小麦で一般租税を払ひ、更に Nono と Canga のいづれかを収めなければならなかつた。"
"62","sakaguchi","shimabaranoran_zakki.txt","そのうへ、煙草一株につき冥加として葉の極上の部分を選んで半分とられ、又、それらの物品が揃はぬときは、茄子一本につき何個といふ割当の賦課か、或ひは、何物かの年貢を納めねばならなかつた。"
"63","sakaguchi","shimabaranoran_zakki.txt","（パジェスの鮮血遺書では、物品の代りに女をとられたと言ひ、これが島原の乱の直接の原因となつたと述べてゐる）"
"64","sakaguchi","shimabaranoran_zakki.txt","ノノ及びカンガとは何物か。"
"65","sakaguchi","shimabaranoran_zakki.txt","パジェスによれば、ノノは九分の一税、カンガはポルトガル語で牛の軛を意味するが、然し、多分日本語の何かではあるまいか、と言つてゐる。"
"66","sakaguchi","shimabaranoran_zakki.txt","日本語であるとすれば、ノノは恐らく「布」であらうが、カンガとは？布に相応するカンガとして、これをカイコ（島原地方ではカイゴといふ）であらうといふ説が妥当のやうである。"
"67","sakaguchi","shimabaranoran_zakki.txt","カイゴは繭の意である。"
"68","sakaguchi","shimabaranoran_zakki.txt",""
"69","sakaguchi","shimabaranoran_zakki.txt","現に、島原地方は養蚕の甚だ盛大な土地で、温泉岳の山麓は見はるかす桑の葉の波であつた。"
"70","sakaguchi","shimabaranoran_zakki.txt","然し、そのやうな事実に就て手掛りをもとめるとすれば、他面、この地方は牛の甚だ多い所で、現在、牛を飼はぬといふ農家が殆どない。"
"71","sakaguchi","shimabaranoran_zakki.txt","私は朝の眠りを牛の声に妨げられ、旅行のバスも屡々牛のために妨げられた。"
"72","sakaguchi","shimabaranoran_zakki.txt","一概に断定はできない。"
"73","sakaguchi","shimabaranoran_zakki.txt",""
"74","sakaguchi","shimabaranoran_zakki.txt","そこで、純然たる農民一揆であるかと言へば、これが又、決して、さうは断定できぬ。"
"75","sakaguchi","shimabaranoran_zakki.txt","明らかに、切支丹の陰謀もあつた。"
"76","sakaguchi","shimabaranoran_zakki.txt",""
"77","sakaguchi","shimabaranoran_zakki.txt","切支丹の陰謀は、主として、天草に行はれてゐた。"
"78","sakaguchi","shimabaranoran_zakki.txt","小西の旧臣、天草甚兵衛を中心に、浪人どもを謀主とし、甚兵衛の子、四郎を天人に祭りあげて事を起さうといふのである。"
"79","sakaguchi","shimabaranoran_zakki.txt","彼等はまづひとつの伝説をつくりあげて愚民の間に流布させた。"
"80","sakaguchi","shimabaranoran_zakki.txt","それは、今から二十六年前（といへば、家康の切支丹禁令のことであらう）天草郡三津浦に居住の伴天連を追放のとき、末鑑といふ一巻の書物を残して行つた。"
"81","sakaguchi","shimabaranoran_zakki.txt","時節到来の時、取出して世に広めよ、と言ふのである。"
"82","sakaguchi","shimabaranoran_zakki.txt","その書物によると「向年より五々の暦数に及んで日域に一人の善童出生し不習に諸道に達し顕然たるべし、然に東西雲焼し枯木不時の花｜咲諸人の頭にクルスを立海へ野山に白旗たなびき天地震動せば万民天主を尊時至るべきや」云々。"
"83","sakaguchi","shimabaranoran_zakki.txt","丁度、源右衛門といふ村民の庭に紫藤の枯木から花が咲き、それも紫の咲くべき木に白が咲いた、さういふ事実にあてはまるやうに作つた伝説であつた。"
"84","sakaguchi","shimabaranoran_zakki.txt",""
"85","sakaguchi","shimabaranoran_zakki.txt","この地下運動はその年（一六三七年）の旧六月から表面に現れ、彼等は天草一円に切支丹の説教をはじめ、又、島原半島へも、及んだ。"
"86","sakaguchi","shimabaranoran_zakki.txt","天使と担がれた天草四郎は、伝説の中の生き神様になるだけの天質があつたのだ。"
"87","sakaguchi","shimabaranoran_zakki.txt","美貌と、神童の叡智であつた。"
"88","sakaguchi","shimabaranoran_zakki.txt","彼は自ら、壇上に立つて説教し、諸方に信者ができた。"
"89","sakaguchi","shimabaranoran_zakki.txt",""
"90","sakaguchi","shimabaranoran_zakki.txt","十月二十五日、島原領有馬村を発火点として一揆が起きた。"
"91","sakaguchi","shimabaranoran_zakki.txt","その十日前、十月十五日に、天草の方では次のやうな廻文が廻つてゐるのである。"
"92","sakaguchi","shimabaranoran_zakki.txt",""
"93","sakaguchi","shimabaranoran_zakki.txt",""
"94","sakaguchi","shimabaranoran_zakki.txt","態と申進候天人天降り被成供せんちよふむていは天主様より火のすいちよ被成候間何者なりとも吉利支丹に成候はゞ爰許へ早々可有御越候村々庄野乙名草々御越可有候島中に此状御廻可有候せんちよ坊にてもきりしたんに成候はゞ被成御免候恐惶謹言。"
"95","sakaguchi","shimabaranoran_zakki.txt",""
"96","sakaguchi","shimabaranoran_zakki.txt","丑十月十五日寿庵"
"97","sakaguchi","shimabaranoran_zakki.txt","右早々村々へ御廻し可被成候天人の御使に遣申候間村中の者に御中付可被成候吉利支丹に成不申候はゞ日本六十六ヶ国共に天主様より御足にていんへるのに踏込なされ候間其分御心得なさるべく候天草の内大矢野に此中被成御座候四郎様と申は天人にて御座候其分可有御心得候"
"98","sakaguchi","shimabaranoran_zakki.txt","一加津佐村の寿庵と申人も則天人の御供なされ候間寿庵手前より先々へ遣申候"
"99","sakaguchi","shimabaranoran_zakki.txt",""
"100","sakaguchi","shimabaranoran_zakki.txt","つまり、島原半島には農民一揆の気運がたかまり、天草島では切支丹反乱の準備がすゝんでゐた。"
"101","sakaguchi","shimabaranoran_zakki.txt","一揆は島原半島で爆発したが、農民だけでは収まりがつかなくなつて、天草の切支丹組に助勢をもとめ四郎を大将として原の廃城にたてこもることゝなり、一揆は、切支丹の色が濃くなつた。"
"102","sakaguchi","shimabaranoran_zakki.txt","結局、最後には、切支丹反乱の形態になつたのである。"
"103","sakaguchi","shimabaranoran_zakki.txt",""
"104","sakaguchi","shimabaranoran_zakki.txt","徳川時代には、島原の乱といへば、切支丹騒動と一口に言つた。"
"105","sakaguchi","shimabaranoran_zakki.txt","ところが、明治以後には、農民一揆と訂正され、切支丹の陰謀が不当に忘れられようとしたのである。"
"106","sakaguchi","shimabaranoran_zakki.txt","これは一に教会側の宣伝と、切支丹学者の多くがキリスト教徒であるため、切支丹に有利な解釈をとりがちであつた為である。"
"107","sakaguchi","shimabaranoran_zakki.txt","コレアの手記に拠る限り、島原の乱は純然たる農民一揆の如くであるが、コレアの手記に偏して日本の記録を無視することは不当である。"
"108","sakaguchi","shimabaranoran_zakki.txt","コレアの手記はむしろ、参考にとゞまるものでしかあるまい。"
"109","sakaguchi","shimabaranoran_zakki.txt",""
"110","sakaguchi","shimabaranoran_zakki.txt","私が長崎図書館を訪れたとき、館長は、貴重な資料の蒐集をとりだして説明してくれたが、そのなかに、これは教会側の記録ですが、と言つて、取出したものに、小さなパンフレットがあつた。"
"111","sakaguchi","shimabaranoran_zakki.txt","裏を返すと昭和四年発行、大浦天主堂とあり、一部五銭であつた。"
"112","sakaguchi","shimabaranoran_zakki.txt","今も教会に売つてゐるから、もとめて御帰りなさいと言はれた。"
"113","sakaguchi","shimabaranoran_zakki.txt",""
"114","sakaguchi","shimabaranoran_zakki.txt","私が泊つてゐたイーグルホテルは、丁度、大浦天主堂の真下なのだ。"
"115","sakaguchi","shimabaranoran_zakki.txt","ホテルをでゝ、坂道を四五十秒も歩くと、もう、天主堂の前である。"
"116","sakaguchi","shimabaranoran_zakki.txt","翌日、私は天主堂へ登つて行つた。"
"117","sakaguchi","shimabaranoran_zakki.txt",""
"118","sakaguchi","shimabaranoran_zakki.txt","私は門番にパンフレットのことをきいた。"
"119","sakaguchi","shimabaranoran_zakki.txt","あゝ、その本はね、昔はこゝでも売つてゐたが、今は本の係りの佐々木といふ人が取扱つてゐますから、上の入口でその人を呼出してきゝなさい、と教へてくれた。"
"120","sakaguchi","shimabaranoran_zakki.txt","私は石段を登り、中段の入口でその人を呼出した。"
"121","sakaguchi","shimabaranoran_zakki.txt",""
"122","sakaguchi","shimabaranoran_zakki.txt","私が来意をつげると、その人の眼に狼狽の色が走つた。"
"123","sakaguchi","shimabaranoran_zakki.txt","「そんな本は出版したことがありません」彼は言つた。"
"124","sakaguchi","shimabaranoran_zakki.txt",""
"125","sakaguchi","shimabaranoran_zakki.txt","「いゝえ。"
"126","sakaguchi","shimabaranoran_zakki.txt","出版されてゐます。"
"127","sakaguchi","shimabaranoran_zakki.txt","私は昨日図書館で見てきたのです。"
"128","sakaguchi","shimabaranoran_zakki.txt","図書館長が現に売つてゐるからと言つてゐます。"
"129","sakaguchi","shimabaranoran_zakki.txt","私は怪しいものではありません」"
"130","sakaguchi","shimabaranoran_zakki.txt","私は自分が小説家であること、又、この旅行の目的が島原の乱を小説にするためであることを説明して、名刺をだした。"
"131","sakaguchi","shimabaranoran_zakki.txt","私の名刺に、彼は顔をそむけた。"
"132","sakaguchi","shimabaranoran_zakki.txt","まるで、それが悪魔の護符であるやうな、愚昧な人の怖れであつた。"
"133","sakaguchi","shimabaranoran_zakki.txt","さうして、名刺を受取るために、一本の指を差出さうとすらしなかつた。"
"134","sakaguchi","shimabaranoran_zakki.txt","「では、ちよつと、調べてきます」彼は思ひきつて、言ひ、僧房の奥へ消えた。"
"135","sakaguchi","shimabaranoran_zakki.txt",""
"136","sakaguchi","shimabaranoran_zakki.txt","まもなく彼は出てきたが、やつぱり、ないと言つた。"
"137","sakaguchi","shimabaranoran_zakki.txt",""
"138","sakaguchi","shimabaranoran_zakki.txt","「明治時代にそんなものを出版したこともあつたさうですけど」"
"139","sakaguchi","shimabaranoran_zakki.txt","「いゝえ、昭和四年です。"
"140","sakaguchi","shimabaranoran_zakki.txt","現に、下の門番も知つてゐますよ」"
"141","sakaguchi","shimabaranoran_zakki.txt","「それは何かの間違ひでせう」"
"142","sakaguchi","shimabaranoran_zakki.txt","私はあきらめた。"
"143","sakaguchi","shimabaranoran_zakki.txt","さうして、上の天主堂へ登つてもいいかときいた。"
"144","sakaguchi","shimabaranoran_zakki.txt","どうぞ、御自由に、と彼は答へた。"
"145","sakaguchi","shimabaranoran_zakki.txt","私は彼に別れて天主堂へ登る。"
"146","sakaguchi","shimabaranoran_zakki.txt","現存する日本最古の天主堂。"
"147","sakaguchi","shimabaranoran_zakki.txt","国宝建造物である。"
"148","sakaguchi","shimabaranoran_zakki.txt","疑ひは神の子にあり、私は呟きながら、天主堂の扉をくゞつた。"
"149","sakaguchi","shimabaranoran_zakki.txt",""
"150","sakaguchi","shimabaranoran_zakki.txt","この天主堂は千八百六十五年（慶応元年）二月十九日落成した。"
"151","sakaguchi","shimabaranoran_zakki.txt","その年の三月十七日のことであつた。"
"152","sakaguchi","shimabaranoran_zakki.txt","正午頃十四五人の男女が訪ねてきたが、常の見物人とは何やら様子が変つてゐるので、プチジャン神父は彼等を堂内へ伴ひ入れ、ひそかに彼等の様子を見てゐると、彼等はマリヤの像を認め、あゝ、サンタマリヤと口々に叫ぶや跪いて祈念の姿勢をするではないか。"
"153","sakaguchi","shimabaranoran_zakki.txt","さてこそ三百年の禁令をくゞりぬけた切支丹の子孫であつたかとプチジャンは狂喜し、いづこの人々であるかと問へば、長崎郊外浦上の者で、浦上村は村民すべてが三百年今尚ひそかに切支丹を奉じてゐると答へた。"
"154","sakaguchi","shimabaranoran_zakki.txt","折から、他の見物の人がやつて来たので、彼等はつと神父の旁を離れ、見物人のやうな顔して彼方此方を眺めはじめた。"
"155","sakaguchi","shimabaranoran_zakki.txt","――これが、日本に於ける切支丹復活の日であつたのである。"
"156","sakaguchi","shimabaranoran_zakki.txt","その後、天草に、五島に、切支丹の子孫は続々と現れてきた。"
"157","sakaguchi","shimabaranoran_zakki.txt",""
"158","sakaguchi","shimabaranoran_zakki.txt","この大浦の天主堂で、日本の切支丹が復活した。"
"159","sakaguchi","shimabaranoran_zakki.txt","その建物は、今も尚、往昔のまゝ、こゝにある。"
"160","sakaguchi","shimabaranoran_zakki.txt","彼等はどの柱に、どの祭壇に、マリヤの像を認めたか。"
"161","sakaguchi","shimabaranoran_zakki.txt","さうして、見物の人がやつてきたとき、彼等は神父の旁をつと離れて、どの柱の下を、そ知らぬ風で歩いたであらうか。"
"162","sakaguchi","shimabaranoran_zakki.txt","その復活の当日から、この神の子達は、宿命の疑惑を宿してゐた。"
"163","sakaguchi","shimabaranoran_zakki.txt","禁令三百年、無数の鮮血をくゞりぬけて伝承した信仰に、悲しむべき疑ひが凍りついてゐたことも又やむを得ない。"
"164","sakaguchi","shimabaranoran_zakki.txt","さう思へば、私の癇癪もいくらか和いでよかつた。"
"165","sakaguchi","shimabaranoran_zakki.txt","とは言へ、何か割切れない不快が残り、釈然とはできなかつた。"
"166","sakaguchi","shimabaranoran_zakki.txt","疑ひは神の子にあり、私は祭壇に向つてわざと呟いたが、何よりも困つたことには、さつき彼が受取らなかつたので、行先を失つた名刺が私の指にぶらさがつてゐることだつた。"
"167","sakaguchi","shimabaranoran_zakki.txt","仕方がないので、それを千切つて、掃き清められた床の上へバラまいて、帰つてきた。"
"168","sakaguchi","shimabaranoran_zakki.txt",""
"169","sakaguchi","shimabaranoran_zakki.txt",""
"170","sakaguchi","shimabaranoran_zakki.txt","三科学戦"
"171","sakaguchi","shimabaranoran_zakki.txt",""
"172","sakaguchi","shimabaranoran_zakki.txt","一揆軍は原の廃城にこもつて、十二月｜朔日から籠城にかゝり、八日には小屋掛を終り、十二月廿日に第一回目の戦争。"
"173","sakaguchi","shimabaranoran_zakki.txt","落城は翌年二月二十八日であつた。"
"174","sakaguchi","shimabaranoran_zakki.txt",""
"175","sakaguchi","shimabaranoran_zakki.txt","始めは一揆軍有勢で、正月朔日には幕府方の総大将板倉重昌が鉄砲に乳下を射抜かれて戦死した。"
"176","sakaguchi","shimabaranoran_zakki.txt","幕府方の戦死は莫大であつたが、一揆軍は極めて少数の犠牲者しか出さなかつた。"
"177","sakaguchi","shimabaranoran_zakki.txt","後者には鉄砲が整備してゐたからである。"
"178","sakaguchi","shimabaranoran_zakki.txt","又、棒火矢といふものを用ひた。"
"179","sakaguchi","shimabaranoran_zakki.txt","筒に矢をこめて打つたのである。"
"180","sakaguchi","shimabaranoran_zakki.txt","当時の鉄砲は十匁玉とか廿匁玉とか言ひ、今のラムネ玉よりもよつぽど大きな玉であつた。"
"181","sakaguchi","shimabaranoran_zakki.txt",""
"182","sakaguchi","shimabaranoran_zakki.txt","幕府方は鉄砲に辟易し、石火矢（大砲のこと）で対抗したが、当時の大砲は実戦の役に立たなかつた。"
"183","sakaguchi","shimabaranoran_zakki.txt","板倉重昌に代つた松平伊豆守は石火矢台といふものを築かせて大砲をすゑ、井楼をつくつて、こゝから敵状を偵察して大砲を打たせたが、駄目だつた。"
"184","sakaguchi","shimabaranoran_zakki.txt","石火矢台も現存してゐるが、城との距離は二百｜米ぐらゐしかない。"
"185","sakaguchi","shimabaranoran_zakki.txt","それでも、とゞかなかつたのである。"
"186","sakaguchi","shimabaranoran_zakki.txt","なぜ、とゞかなかつたかと言ふと、当時大砲といふものは、敵に実害を与へるよりも、その大仰な形や音響によつて、敵を畏れしめ、戦はずして降服せしめる戦法から製作されたからである。"
"187","sakaguchi","shimabaranoran_zakki.txt","だから、弾丸は徒に大きく、一丁も飛びはしなかつた。"
"188","sakaguchi","shimabaranoran_zakki.txt","今、長崎の大波止に、この時用ひたといふ砲丸がある。"
"189","sakaguchi","shimabaranoran_zakki.txt","重さ千三十二斤、玉の廻り五尺八寸。"
"190","sakaguchi","shimabaranoran_zakki.txt","これを実際使用するには長さ九間口径三尺の筒と三千斤の火薬がいるといふが、それでも一間とは飛ばず、多分、筒の中をころ／＼ところがつて、筒の口からいきなり地面へドシンと落ちるだけだといふ。"
"191","sakaguchi","shimabaranoran_zakki.txt",""
"192","sakaguchi","shimabaranoran_zakki.txt","正月十日、オランダ船をつれてきて、海上から砲撃させた。"
"193","sakaguchi","shimabaranoran_zakki.txt","この弾丸はとゞいた。"
"194","sakaguchi","shimabaranoran_zakki.txt","この時から、幕府方は有勢になつたのである。"
