"","auth","piece","line"
"452","sakaguchi","sobomu.txt","疲れきつた当太郎も部屋の光の中へはいると急に生き生きとした色を浮べた。"
"453","sakaguchi","sobomu.txt","さうして屈託のない少年のやうな饒舌になつた。"
"454","sakaguchi","sobomu.txt",""
"455","sakaguchi","sobomu.txt","「この部屋が好きなのだ」と彼は愉しげな微笑を浮べながら、人々を見廻して言つた。"
"456","sakaguchi","sobomu.txt",""
"457","sakaguchi","sobomu.txt","「旅さきでもこの部屋を思ひだすときが愉しい時間の一つだつたよ。"
"458","sakaguchi","sobomu.txt","昨日も今日もこの部屋を考へるときが休息の時間なのだ。"
"459","sakaguchi","sobomu.txt","今夜呼びだしに来てくれないと、やりきれない夜になるところだつたよ」"
"460","sakaguchi","sobomu.txt","「冗談ぢやないわよ！」と忍は癇癪の色をあり／＼と現はして真剣に叫んだ。"
"461","sakaguchi","sobomu.txt",""
"462","sakaguchi","sobomu.txt","「この部屋で首でもくくられたら、こつちがやりきれやしないよ！うちぢや暫く藪さんを泊めませんからね！真夜中でも嵐の晩でも帰しちやうよ」"
"463","sakaguchi","sobomu.txt","「そんなに度々やれるもんぢやないよ。"
"464","sakaguchi","sobomu.txt","もう死ねないんだ。"
"465","sakaguchi","sobomu.txt","俺の自殺なんて全くだらしがないことなんだ。"
"466","sakaguchi","sobomu.txt","俺は意気地がないのだよ」"
"467","sakaguchi","sobomu.txt","と当太郎は少年の無邪気な哄笑に破顔しながら言つた。"
"468","sakaguchi","sobomu.txt",""
"469","sakaguchi","sobomu.txt","「自殺する藪さんつて、ほんとの藪さんぢやないのよ。"
"470","sakaguchi","sobomu.txt","ほんとの藪さんは単純で無邪気よ。"
"471","sakaguchi","sobomu.txt","単純な人が人真似に勿体ぶつて複雑さうな顔をすると、死ぬよりほかに恰好がつかなくなつてくるのよ。"
"472","sakaguchi","sobomu.txt","あたしがさうよ」"
"473","sakaguchi","sobomu.txt","と、弥生は急に甲高い声で喋りはじめた。"
"474","sakaguchi","sobomu.txt",""
"475","sakaguchi","sobomu.txt","「ほんとに藪さんに会ひたかつたわ！今くるか、今くるかと待つてゐたのよ。"
"476","sakaguchi","sobomu.txt","たうとう泣いちやつたわ」"
"477","sakaguchi","sobomu.txt","「ところが俺の方ぢや、君の倍くらゐ会ひたいと思つてゐたのだ」"
"478","sakaguchi","sobomu.txt","「ぢや、なぜ一人でこなかつたの？」"
"479","sakaguchi","sobomu.txt","「会ひたいことと、会ひに行くことは、まるつきり別のことだよ。"
"480","sakaguchi","sobomu.txt","ほんとに会ひたいと思ふ人には、会はなくとも会つてゐるのだ。"
"481","sakaguchi","sobomu.txt","いや、会はない方が、その人のほんとの姿に会つてゐることになるんだよ。"
"482","sakaguchi","sobomu.txt","顔を見なけりや会つたことにならない人は、心から欲しかつた人ぢやないのだ」"
"483","sakaguchi","sobomu.txt","「だつて、あたしの方ぢや藪さんの顔を見なけりや会つた気持になれないわ」"
"484","sakaguchi","sobomu.txt","「さうなんだ。"
"485","sakaguchi","sobomu.txt","だから俺がこうしてのこ／＼やつてくる。"
"486","sakaguchi","sobomu.txt","さうすると――さうだ、会つてみたつて君はたいして面白くもなんともないぢやないか。"
"487","sakaguchi","sobomu.txt","君は俺を好いてるわけでもなんでもないんだ。"
"488","sakaguchi","sobomu.txt","それでいいんだよ。"
"489","sakaguchi","sobomu.txt","だけど、俺がここへ来たのは、君の顔を見たい気持が多かつたのさ」"
"490","sakaguchi","sobomu.txt","「さうよ、さうよ。"
"491","sakaguchi","sobomu.txt","あたしは藪さんが好きなわけぢやないのよ。"
"492","sakaguchi","sobomu.txt","だけど――藪さんはよく分つてゐるわ！さうよ。"
"493","sakaguchi","sobomu.txt","ほんとに完全に好きぢやないわ。"
"494","sakaguchi","sobomu.txt","藪さんがあたしのハズだなんて、考へただけでも笑ひたいことなんだわ」"
"495","sakaguchi","sobomu.txt","弥生は白痴のやうな単純そのものの喜悦を眼にみなぎらし、情熱のこもつた甲高い声で叫びつづけた。"
"496","sakaguchi","sobomu.txt",""
"497","sakaguchi","sobomu.txt","「でも、ほんとに藪さんはよく分つてゐるわ！あたしね、藪さんが来てくれないつて、わあん／＼泣きだしちやつたのよ。"
"498","sakaguchi","sobomu.txt","そりや、ほんとよ！藪さんの来てくれないのが確かに淋しかつたのよ。"
"499","sakaguchi","sobomu.txt","だけど藪さんが好きなわけぢやなかつたの。"
"500","sakaguchi","sobomu.txt","でも藪さんがやつてきたら、しよつちうあたしを好いてるやうに仕向けやうと考へてゐたわ。"
"501","sakaguchi","sobomu.txt","相当のことを考へてゐたのよ」"
"502","sakaguchi","sobomu.txt","「さうさ。"
"503","sakaguchi","sobomu.txt","そんなことは白状しなくつたつて分つてゐますよ。"
"504","sakaguchi","sobomu.txt","子供のくせに一人前の女ぶつて、今からそんな風ぢや、困りもんですよ。"
"505","sakaguchi","sobomu.txt","だけどすつかり白状するところは、あんたもすこし可笑しいよ」"
"506","sakaguchi","sobomu.txt","「さうなのよ……」"
"507","sakaguchi","sobomu.txt","弥生は袂に口を押へて高い叫びをあげながら笑ひだした。"
"508","sakaguchi","sobomu.txt","ところが笑ひの途中から、急に顔を掩ひ隠して、絹をさくやうに泣きだしてしまつたのだ。"
"509","sakaguchi","sobomu.txt",""
"510","sakaguchi","sobomu.txt","「あたしはとても不幸だわ」"
"511","sakaguchi","sobomu.txt","と、弥生は欷泣きながら言つた。"
"512","sakaguchi","sobomu.txt",""
"513","sakaguchi","sobomu.txt","「あたしのほんとの悲しい気持は誰にも分つてもらへないわ……」"
"514","sakaguchi","sobomu.txt","ところがまもなく泣きやんでしまふと、忽ち浮き浮きと笑ひはじめ、「ふん、ヒステリーだよ」と何の翳もない無邪気な両眼を輝やかせながら呟いてゐるのだ。"
"515","sakaguchi","sobomu.txt",""
"516","sakaguchi","sobomu.txt","「さうだ！俺が考へてきたとほりだよ。"
"517","sakaguchi","sobomu.txt","全くそつくりそのままなんだ！」"
"518","sakaguchi","sobomu.txt","と当太郎は喜悦にみちた声で叫んだ。"
"519","sakaguchi","sobomu.txt",""
"520","sakaguchi","sobomu.txt","「ちやうどこんな愉快な会話、たのしい一夜を想像しながら遊びに来たのだよ。"
"521","sakaguchi","sobomu.txt","すると、そつくり想像のとほりなのだ。"
"522","sakaguchi","sobomu.txt","まるで思ひのこすことがないくらゐ、気持がはればれしてしまつたのだ。"
"523","sakaguchi","sobomu.txt","これで気持よく家へ帰つて休むことができるんだよ」"
"524","sakaguchi","sobomu.txt","「藪さん、泊つてもいいわよ。"
"525","sakaguchi","sobomu.txt","さつきはちよつとおどかしただけよ」"
"526","sakaguchi","sobomu.txt","と忍が言つたが、うちでも心配してゐるからと言つて、やがて当太郎は立上つた。"
"527","sakaguchi","sobomu.txt",""
"528","sakaguchi","sobomu.txt","「俺もすこし歩いてみやう……」"
"529","sakaguchi","sobomu.txt","草吉は朦朧と立上つた。"
"530","sakaguchi","sobomu.txt",""
"531","sakaguchi","sobomu.txt","なにか虚しい霧雨のやうな屈託が降りしきつてゐて、それまでは物を言ふ気持も浮かばなかつたし、人々の話も夢の彼方のやうにしか聞えてこないのであつた。"
"532","sakaguchi","sobomu.txt",""
"533","sakaguchi","sobomu.txt","草吉は大森海岸の方へ歩きだした。"
"534","sakaguchi","sobomu.txt","風の死んだ、然し冷えきつた冬空に、月が上つてゐるのだつた。"
"535","sakaguchi","sobomu.txt","当太郎は草吉の歩く方についてきた。"
"536","sakaguchi","sobomu.txt","海は満潮であつた。"
"537","sakaguchi","sobomu.txt","荒いうねりが岩壁にくだけてゐたが、沖は暗く、静かだつた。"
"538","sakaguchi","sobomu.txt","堪えがたく冷めたい巨大な潮風が吹き渡り、澄みきつた月光が、静かに流れてゐるのだつた。"
"539","sakaguchi","sobomu.txt",""
"540","sakaguchi","sobomu.txt","「みんなくされ縁なんだ」"
"541","sakaguchi","sobomu.txt","当太郎は突然小さく呟いた。"
"542","sakaguchi","sobomu.txt",""
"543","sakaguchi","sobomu.txt","「俺が生きてゐることまで、くされ縁だつたのだ……」"
"544","sakaguchi","sobomu.txt","彼は凍つた甃の上へ坐るやうに腰をおろした。"
"545","sakaguchi","sobomu.txt","さうしてそこへうづくまつた。"
"546","sakaguchi","sobomu.txt","泣いてゐたのかも知れなかつた。"
"547","sakaguchi","sobomu.txt","長いあひだ、微動する気配もなかつた。"
"548","sakaguchi","sobomu.txt",""
"549","sakaguchi","sobomu.txt",""
"550","sakaguchi","sobomu.txt","三"
"551","sakaguchi","sobomu.txt",""
"552","sakaguchi","sobomu.txt","それから数日の後だつた。"
"553","sakaguchi","sobomu.txt","当太郎の家族から、草吉へ宛てて、長文の電報がきた。"
"554","sakaguchi","sobomu.txt","当太郎のことで尽力願ひたいことがあるから御足労乞ふといふやうなものだつた。"
"555","sakaguchi","sobomu.txt",""
"556","sakaguchi","sobomu.txt","出向いてみると、母親ではなく、妹のまさ子が応待にあらはれた。"
"557","sakaguchi","sobomu.txt","まさ子は静かな微笑を浮かべつづけてゐた。"
"558","sakaguchi","sobomu.txt","まるで長閑な世間話を語りだすときのやうな、暗影のない顔付だつた。"
"559","sakaguchi","sobomu.txt","まさ子の話はかうであつた。"
"560","sakaguchi","sobomu.txt",""
"561","sakaguchi","sobomu.txt","あの翌日当太郎は旅にでた。"
"562","sakaguchi","sobomu.txt","こんどは北国の旅だつた。"
"563","sakaguchi","sobomu.txt","越後の鯨波といふ、日本海に面した名もない町へでかけたのだ。"
"564","sakaguchi","sobomu.txt","着いた日は海も見えない吹雪だつたといふ。"
"565","sakaguchi","sobomu.txt","便りの冒頭にそんなことが書いてあるのだ。"
"566","sakaguchi","sobomu.txt","ところがその便りを読むと、遺書としか思へぬところがあるのだつた。"
"567","sakaguchi","sobomu.txt","さういふわけで、その晩の夜行列車でまさ子が鯨波へでかけることにきまつたが、当太郎の自殺に限つて家族の手にあはないので、草吉にも同道して欲しいと言ふのであつた。"
"568","sakaguchi","sobomu.txt","その話のあひだも、まさ子は静かな微笑を浮べつづけてゐた。"
"569","sakaguchi","sobomu.txt",""
"570","sakaguchi","sobomu.txt","「どうせ一度はやりとげてしまふんですわ。"
"571","sakaguchi","sobomu.txt","度々のことですもの。"
"572","sakaguchi","sobomu.txt","あきらめてゐるんですけど、できるだけはとめたいんです。"
"573","sakaguchi","sobomu.txt","とめてみてもはじまらないと思ふことも度々だわ。"
"574","sakaguchi","sobomu.txt","こんども、はつきり遺書つてほどぢやないんですけど、文面の感じで言ふと、落付いてのんびり温泉にでもつかつて、そのうち気がむいたとき死んでみやうかといつたやうな、そんな感じなんですの。"
"575","sakaguchi","sobomu.txt","のつぴきならない暗さなんです。"
"576","sakaguchi","sobomu.txt","莫迦々々しいやうなものですけど、一応はでかけてみずにゐられませんもの」"
"577","sakaguchi","sobomu.txt","とまさ子は言つた。"
"578","sakaguchi","sobomu.txt","こんな話のあひだも、うすい静かな微笑を浮かべつづけてゐるのだつた。"
"579","sakaguchi","sobomu.txt","その微笑のものうさに激しい遠さへ運ばれたやうな草吉は、話の方は殆んどうはのそらに聞きながら、暗い庭の片隅にガサ／＼とゆらめいてゐる竹藪のひからびた繁みの音を心にはつきり聞いてゐたのだ。"
"580","sakaguchi","sobomu.txt",""
"581","sakaguchi","sobomu.txt","その夜の十一時、深夜の列車に身を託して二人は上野を出発した。"
"582","sakaguchi","sobomu.txt","上野駅には一冬のあひだ雪が訪れてくるのだつた。"
"583","sakaguchi","sobomu.txt","北国の吹雪の中を走つてきた数々の列車が、屋根に窓にかたまりついた雪をつけて並んでゐるのだ。"
"584","sakaguchi","sobomu.txt","二人をのせた深夜の車は、赤城の麓を通るころから雪の上を走りはじめ、上越連峰の真下をくぐり、土合や土樽や石打や積雪量の最も深い雪の下をくぐりつづけて行く車だつた。"
"585","sakaguchi","sobomu.txt","深夜のために、その雪も見えなかつた。"
"586","sakaguchi","sobomu.txt",""
"587","sakaguchi","sobomu.txt","「あたしのお友達で、うちへ遊びに来てゐるうちに、お兄さんに強姦された人が三四人はあるんですわ。"
"588","sakaguchi","sobomu.txt","べつに強姦しなくつたつて、うちあければ恋人ぐらゐにはなつてくれる人達なんですわ。"
"589","sakaguchi","sobomu.txt","お兄さんは女と無駄話をするのが巧いから、あたしのお友達が、あたしよりもお兄さんの仲良しになつてしまふんです。"
"590","sakaguchi","sobomu.txt","すつかり仲良しになつちやつておいて、順調に話をつけずに、暴力をふるつちやうのよ。"
"591","sakaguchi","sobomu.txt","女中の被害者も相当あつたわ」"
"592","sakaguchi","sobomu.txt","列車のなかで、まさ子は疲れきつた微笑を浮かべながら、そんな話もした。"
"593","sakaguchi","sobomu.txt",""
"594","sakaguchi","sobomu.txt","「親父が悪いのよ。"
"595","sakaguchi","sobomu.txt","助平根性と梅毒はうちの血筋なんですわ」"
"596","sakaguchi","sobomu.txt","さういふ話をききながら、草吉の眠つたやうな頭には、堪えがたい想念が蠢めきまはるのであつた。"
"597","sakaguchi","sobomu.txt","まさ子の肉体は、彼の想念の中に於て、もはや着衣をまとうてはゐなかつた。"
"598","sakaguchi","sobomu.txt","厳烈な北風が鳴り狂ふ屋根の下、さうしてうねりの高い暗い海の波浪の音にとりまかれながら、肉と肉のもつれ、あるひは憎しみと獣心のもつれるであらう暗い夜の寂寥がせまつてくるのだ。"
"599","sakaguchi","sobomu.txt","俺はけだものになるのだらうと草吉は思ふのだつた。"
"600","sakaguchi","sobomu.txt",""
"601","sakaguchi","sobomu.txt","――他人の自殺…………なんといふ虚しく遠い、殆んど信じることができないやうな、まるで了解もできない空虚な事実がほかにあらうか、と草吉は思ひつづけた。"
"602","sakaguchi","sobomu.txt","それに比べて蠢めきまはる肉慾の熾烈さは、容積ある熱量となつて、彼の全ての血管をそのとき満してゐることが激しく解るのであつた。"
"603","sakaguchi","sobomu.txt","日本海岸の侘びしい温泉へ急ぐことが、まさ子の青ざめた傷心を包んだ悲劇的な肉体を、ひときれの思ひやりだにない野獣となつてただ抱きしめるためにのみ、陰惨なる悲願を抱いて急ぐものとしか思はれなかつた。"
"604","sakaguchi","sobomu.txt",""
"605","sakaguchi","sobomu.txt","さめてゐるのか、眠つてゐるのか、朦朧として分ちがたいやうな大いなる虚しさもあつて、そこには旅愁がひろびろと漂ふてゐた。"
"606","sakaguchi","sobomu.txt","肉慾とは違つた場所に、裏日本の潮風につながるやうな暗愁が、暗く、うねりの高い海のやうにひろがり、狂ほしく疼く肉慾を悲しいものに思はせたりした。"
"607","sakaguchi","sobomu.txt",""
"608","sakaguchi","sobomu.txt","――それもくされ縁だらう…………"
"609","sakaguchi","sobomu.txt","草吉は全てを憎み咒ふやうに、また、切に軽蔑するもののやうに、心に荒々しく叫んだりした。"
"610","sakaguchi","sobomu.txt",""
"611","sakaguchi","sobomu.txt","翌日の早朝、宮内で乗換え、まぢかに海の見える停車場で降りた。"
"612","sakaguchi","sobomu.txt","そこが鯨波だつた。"
"613","sakaguchi","sobomu.txt","宮内あたりまでは目覚ましい積雪が視界を掩ふてゐたのだが、海へ近づくにつれて雪は次第にすくなくなり、鯨波では殆んど雪を見ることができなくなつた。"
"614","sakaguchi","sobomu.txt","荒れ走る狂暴な海風のために、雪は海に近いところへ余り積もることができない。"
"615","sakaguchi","sobomu.txt","山間地方へ運ばれて丈余の積雪となるのであつた。"
"616","sakaguchi","sobomu.txt","「荒海や佐渡に横たふ天の河」の句は、ちやうどこの海に近いあたりで芭蕉の詠んだものであつた。"
"617","sakaguchi","sobomu.txt",""
"618","sakaguchi","sobomu.txt","宿へ着いてきてみると、ちやうど当太郎は朝食を終つて、海辺へ散歩にでかけたあとと分つた。"
"619","sakaguchi","sobomu.txt","二人も直ちに海へでた。"
"620","sakaguchi","sobomu.txt",""
"621","sakaguchi","sobomu.txt","苦るしいやうな曇天だつた。"
"622","sakaguchi","sobomu.txt","どすぐろい雲が海へ低く落ちてゐるのだ。"
"623","sakaguchi","sobomu.txt","もちろん佐渡は見えないし、落ちこめた雲にせばめられて、余りにも小さい荒海だつた。"
"624","sakaguchi","sobomu.txt","まるで絶望の苦痛をみせた小さなどす黒い海、暗い沖にも高いうねりがつづいてゐるし、白い牙がそんな奥手の暗い沖にもちらめくのだつた。"
"625","sakaguchi","sobomu.txt","磯を歩くたつた一つの人影があつた。"
"626","sakaguchi","sobomu.txt","それが当太郎であることは、四五町の距離があつたが、すぐに分つた。"
"627","sakaguchi","sobomu.txt",""
"628","sakaguchi","sobomu.txt","怒濤の音が間断なしに地響きをうつて鳴りつづくので、恐らく狂人の絶叫も一町の遠さまではとどくまいと思はれた。"
"629","sakaguchi","sobomu.txt","二人は自然に足並を速めたが、絶えず叫びたいとする衝動のせつなさのために、まさ子の足は次第に早さが加はるのだつた。"
"630","sakaguchi","sobomu.txt","足の速まるにつれて、まさ子の瞼には涙が滲んできた。"
"631","sakaguchi","sobomu.txt","たうとう堪まらなくなつて、まさ子はひとり駈けだした。"
"632","sakaguchi","sobomu.txt","お兄さんといふ小さな必死の呟きが、顔ごと吹きちぎつてしまふやうな荒々しい潮風に鋭くさらはれたのを境ひにして、跳ねかへつて砂上に置き残された足駄には見向かうともせず、一方の足駄は夢中のうちに激しくあとへ脱ぎのこしておいて、跣足となつてせつなげに走りはじめていつた。"
"633","sakaguchi","sobomu.txt","まだ充分に三四町の距離はあつたのだ。"
"634","sakaguchi","sobomu.txt",""
"635","sakaguchi","sobomu.txt","草吉はちらかつたまさ子の足駄を拾ひあつめ、これを片手にぶらさげて、逆にゆつくり歩きはじめた。"
"636","sakaguchi","sobomu.txt","この機会に改めて海の四方をはるばると眺めやると、苦悶のみなぎつた海の姿も、狂ひたつうねりのままに大いなる不動の静寂を宿してゐることが分るのだつた。"
"637","sakaguchi","sobomu.txt","草吉の心にも、その荒涼とした休息が、言語を絶した物憂さとなつて、静かに流れてくるのであつた。"
"638","sakaguchi","sobomu.txt",""
"639","sakaguchi","sobomu.txt","当太郎は草吉と別れた夜の疲労困憊した顔色よりも、むしろ血色がよかつた。"
"640","sakaguchi","sobomu.txt",""
"641","sakaguchi","sobomu.txt","「生れて始めて日本海を眺めてゐたところなのだ」"
"642","sakaguchi","sobomu.txt","と、当太郎は侘びしげな微笑を浮べて、近づく草吉に言つた。"
"643","sakaguchi","sobomu.txt",""
"644","sakaguchi","sobomu.txt","「一昨日までは吹雪がつづいたのだ。"
"645","sakaguchi","sobomu.txt","昨日一日雨が降りつづいて雪が消え、どうやら今日がはじめて何も降らない空模様なんだよ。"
"646","sakaguchi","sobomu.txt","吹雪の日もちよつと海の出口まで出掛けてみたが、吹き倒されるかと思はれたほどだつた。"
"647","sakaguchi","sobomu.txt","呼吸もできなくなるし、だいいち凄い海鳴りが耳もとに唸りまはつてゐるくせに、てんで海なんて見えやしないよ」"
"648","sakaguchi","sobomu.txt","宿へ帰つて湯槽からあがると、当太郎は別人のやうに活気づいた。"
"649","sakaguchi","sobomu.txt",""
"650","sakaguchi","sobomu.txt","「こんな強烈な自然に直面すると、人為的な工作が凡そみすぼらしくなるものだね。"
"651","sakaguchi","sobomu.txt","一人の人間が生きるも死ぬもあるもんぢやないよ。"
"652","sakaguchi","sobomu.txt","人間もここの浜では砂粒とおんなじことだ。"
"653","sakaguchi","sobomu.txt","息の根をとめてみたつて、もと／＼たかがこんな屑みたいな小粒かと思ふと、いい加減がつかりして、却つてほつとするんだ。"
"654","sakaguchi","sobomu.txt","とにかく自然もこれくらゐ荒々しくなると、せつないやうな救ひがあるよ」"
"655","sakaguchi","sobomu.txt","と、当太郎は微塵も陰の感じられない哄笑を高らかに鳴らしながら、そんな述懐もしたのだつた。"
"656","sakaguchi","sobomu.txt",""
"657","sakaguchi","sobomu.txt","ところが翌朝になつてみると、当太郎の姿が見えないのだ。"
"658","sakaguchi","sobomu.txt","散歩の風をして宿をでかけたことまでは分つた。"
"659","sakaguchi","sobomu.txt","方々手を廻して調べてみると柏崎から汽車に乗込んだ形跡までは辿ることができたのだ。"
"660","sakaguchi","sobomu.txt","磯づたひに柏崎まで彷徨ふていつたらしかつた。"
"661","sakaguchi","sobomu.txt","なんとなく落付のない一日が暮れて暗澹たる夜が落ちたが、当太郎の消息はさらになかつた。"
"662","sakaguchi","sobomu.txt","夜が落ちると、北風の悲鳴と海鳴りが、急にいちぢるしく唸りはじめてくるのだつた。"
"663","sakaguchi","sobomu.txt",""
"664","sakaguchi","sobomu.txt","当太郎の失踪が確定してしまふと、まさ子は却つて物憂いやうな落付をとりもどしてきた。"
"665","sakaguchi","sobomu.txt","時間の経過につれて悲観的な気分が部屋のどんな気配の中にも深まりはじめ、淵へ突落されてゆくやうな手触りのない不安がせまりはじめてくるうちに、夜がとつぷり落ちきつてしまふと、まさ子の物憂い落付は一層病的な青白さを漂はしてきた。"
"666","sakaguchi","sobomu.txt",""
"667","sakaguchi","sobomu.txt","「今頃はどこかで冷めたくなつてゐるかも知れないわ」"
"668","sakaguchi","sobomu.txt","と、まさ子は再び物憂げな静かな微笑を浮かべはじめて言つた。"
"669","sakaguchi","sobomu.txt",""
"670","sakaguchi","sobomu.txt","「どうせ一度はやつちやうのよ。"
"671","sakaguchi","sobomu.txt","今日は死なずにゐたところで、近いうちに同じことがあるんだもの、心配するだけばか／＼しいわ。"
"672","sakaguchi","sobomu.txt","つくづく飽いちやつたわ！でも、どこで死んでゐるのかしら？浪打際や雪の下ぢや、冷めたくつて可哀想だわ。"
"673","sakaguchi","sobomu.txt","意気地がないんだから、大概温い部屋の中だと思ふんだけど……」"
"674","sakaguchi","sobomu.txt","まさ子は炬燵にあたり、本をひろげてぼんやり頁をめくつてゐたが、時々思ひだしたやうに顔をあげ、物憂い微笑をつづけながら、こんなことをまとまりなくボツ／＼と言ひだすのだつた。"
"675","sakaguchi","sobomu.txt",""
"676","sakaguchi","sobomu.txt","「棺桶のままぢや汽車につめないかしら？焼いてもつてつたんぢや、母アさんが可哀想だわ。"
"677","sakaguchi","sobomu.txt","お兄さんはなんのために生れてきたのかしら？まるで自殺するためだわ。"
"678","sakaguchi","sobomu.txt","もがきつづけるためだわ。"
"679","sakaguchi","sobomu.txt","それに、女に惚れるためよ。"
"680","sakaguchi","sobomu.txt","浮気だわ。"
