"","auth","piece","line"
"0","sakaguchi","sobomu.txt","蒼茫夢"
"1","sakaguchi","sobomu.txt","坂口安吾"
"2","sakaguchi","sobomu.txt",""
"3","sakaguchi","sobomu.txt","-------------------------------------------------------"
"4","sakaguchi","sobomu.txt","【テキスト中に現れる記号について】"
"5","sakaguchi","sobomu.txt",""
"6","sakaguchi","sobomu.txt","《》：ルビ"
"7","sakaguchi","sobomu.txt","（例）瞶めて"
"8","sakaguchi","sobomu.txt",""
"9","sakaguchi","sobomu.txt","：入力者注主に外字の説明や、傍点の位置の指定"
"10","sakaguchi","sobomu.txt","（数字は、JIS X 0213の面区点番号またはUnicode、底本のページと行数）"
"11","sakaguchi","sobomu.txt","（例）※"
"12","sakaguchi","sobomu.txt",""
"13","sakaguchi","sobomu.txt","／＼：二倍の踊り字（「く」を縦に長くしたような形の繰り返し記号）"
"14","sakaguchi","sobomu.txt","（例）バタ／＼"
"15","sakaguchi","sobomu.txt","-------------------------------------------------------"
"16","sakaguchi","sobomu.txt",""
"17","sakaguchi","sobomu.txt","一"
"18","sakaguchi","sobomu.txt",""
"19","sakaguchi","sobomu.txt","冬の明方のことだつた。"
"20","sakaguchi","sobomu.txt","夜はまだ明けない。"
"21","sakaguchi","sobomu.txt","然し夜明けが近づかうとしてゐるのだ。"
"22","sakaguchi","sobomu.txt","夜の不気味な妖しさが衰へて、巨大な虚しい悲しさが闇の全てに漲りはじめてゐる。"
"23","sakaguchi","sobomu.txt","草吉はそのとき自然に目を覚した。"
"24","sakaguchi","sobomu.txt",""
"25","sakaguchi","sobomu.txt","室内も窓の彼方も一色の深い暗闇ではあつたが、重量の加はりはじめた寒気と、胸苦しい悲しみの気配によつて、もはや夜明けに近いことを推定することができた。"
"26","sakaguchi","sobomu.txt","四時半前後であらうと思つた。"
"27","sakaguchi","sobomu.txt",""
"28","sakaguchi","sobomu.txt","草吉の日毎の目覚めは衰亡の中へ滑りこむやうに展らかれてくるので、殆んど愉しいものではなかつた。"
"29","sakaguchi","sobomu.txt","それに目覚めた数分のあひだ、奇妙に不吉なことばかり頭に浮んでくるのであつた。"
"30","sakaguchi","sobomu.txt","ひとつには理性の失はれた時間のせゐであつたらうか。"
"31","sakaguchi","sobomu.txt","たとへば肉体を腐せてゆく悪疾の気色の悪い映像であつた。"
"32","sakaguchi","sobomu.txt","病魔は肉体を黒色にむしくひ、汚水のたまつた脳漿の中を蛆虫のやうに蠢めきまはつてゆくのである。"
"33","sakaguchi","sobomu.txt","目覚めにそれを瞶めてゐる数分のあひだ、然し草吉の心に湧き起るものは不快でもなければ恐怖でもなかつた。"
"34","sakaguchi","sobomu.txt","全てがひとえに静寂であつた。"
"35","sakaguchi","sobomu.txt","それを包む全ての心が無のやうであつた。"
"36","sakaguchi","sobomu.txt","生あるものは不吉な映像それのみであり、それは遥かな虚無の中に生れ出で、虚無を観客にちらめきうつり、さうして冬空の星の如くにそれ自らも凍りついてゐるのであつた。"
"37","sakaguchi","sobomu.txt","全てが凍るといふ冷静な感じであり、草吉の苦痛も悲しみも、在るといへばそれは確かに凍りついて在るのであつた。"
"38","sakaguchi","sobomu.txt",""
"39","sakaguchi","sobomu.txt","その悪疾は、今は草吉の妻であり、以前は港の売春婦であつた忍が彼にうつしたものであつた。"
"40","sakaguchi","sobomu.txt","夫にうつした悪疾のことを思ひだすとき、世間なみの感情を忘れた冷涙の女が、顔をうつむけて涙を流す。"
"41","sakaguchi","sobomu.txt",""
"42","sakaguchi","sobomu.txt","とりわけ不快とよぶほどの映像ではなかつたのだが、然し草吉はそれらのものを考へまいとして、目覚めた瞬間の心の中で美くしい風景を思ひださうとすることもあつた。"
"43","sakaguchi","sobomu.txt","ひろい海原もみえるのだつた。"
"44","sakaguchi","sobomu.txt","はるかな山岳も映るのだ。"
"45","sakaguchi","sobomu.txt","雲も、曠野も、異国の街も、押しつけがましく入れ換り立ち換りに現れてくるが、悲しさを脱ぎすてたやうな気持にはならない。"
"46","sakaguchi","sobomu.txt",""
"47","sakaguchi","sobomu.txt","その未明おのづと草吉が目を覚して暫くの時がすぎたとき、ほのかな一ときれの白が空の奥手に浮かびでたやうな気配がした。"
"48","sakaguchi","sobomu.txt","気配はしたがそれは草吉の気のせゐであつた。"
"49","sakaguchi","sobomu.txt","実際は明るくなつてゐなかつた。"
"50","sakaguchi","sobomu.txt","然し夜明けが近づいたと彼は改めて明確に意識したのだ。"
"51","sakaguchi","sobomu.txt","さうして起きて机に向はうと考へた。"
"52","sakaguchi","sobomu.txt","そこで起きる動作にとりかからうとする身構えの途中で、彼の意識は始めて藪小路当太郎の存在にひつかかつたのであつた。"
"53","sakaguchi","sobomu.txt","当太郎はゆふべから草吉の家へ遊びにきて、彼の隣席にねむつてゐる筈であつた。"
"54","sakaguchi","sobomu.txt",""
"55","sakaguchi","sobomu.txt","客のねむりを妨げはしないかといふ思ひつきから、草吉は立ち上る姿勢の途中で電燈をつけることに躊躇を覚え、そこで暫く身動きを失つた。"
"56","sakaguchi","sobomu.txt","ところが立ち上つてしまつたときには、投げやりなくらゐアッサリと電燈をつけてしまつてゐた。"
"57","sakaguchi","sobomu.txt","なるほど、当太郎を思ひだすことが遅れたのは、その場所に音がなかつたからであつた。"
"58","sakaguchi","sobomu.txt","見れば当太郎はゐないのだ。"
"59","sakaguchi","sobomu.txt","寝床はもぬけのからであつた。"
"60","sakaguchi","sobomu.txt",""
"61","sakaguchi","sobomu.txt","藪小路当太郎は忍が港の曖昧屋でカクテルシェーカを振つてゐた頃、繁々とその店を訪れた常連の一人であつた。"
"62","sakaguchi","sobomu.txt","草吉も亦さうだつた。"
"63","sakaguchi","sobomu.txt","二人はその店で知りあつたのだ。"
"64","sakaguchi","sobomu.txt","当太郎は草吉よりも五つ年少の二十五歳といふ若者だつた。"
"65","sakaguchi","sobomu.txt",""
"66","sakaguchi","sobomu.txt","「いすらえる」といふその酒場は毛唐と日本人と半々ぐらゐの常客があつたが、港でも場末の店の通例で、毛唐の質は至つてよろしくない。"
"67","sakaguchi","sobomu.txt","その大部分は印度、露西亜、ヒリッピン、支那人なぞの行商人や下級社員で、白人の方は飛入りの船員は別として、露店商人とか自称音楽教師、乃至は外国語個人教授なぞといふ看板をぶらさげた怪しげな裏道商売のてあひであつたが、然しこのてあひに限つて、目と鼻のどんな近い四ツ角からでも必ず自動車をのりつけてくる、「こんばんは、お花しやん」なぞと呟きながら、いやに重つ苦しい面魂に、むつとする安香水の匂ひをプンプン発散させながら這入つてくるのが普通であつた。"
"68","sakaguchi","sobomu.txt",""
"69","sakaguchi","sobomu.txt","かういふ店へ、藪小路当太郎は誰に誘はれもせず、一人ぼつちで舞ひこんできた。"
"70","sakaguchi","sobomu.txt","それから何んべん訪れてきても、地上に友達を持たないやうに必ず一人きりだつた。"
"71","sakaguchi","sobomu.txt","これは草吉がまたさうだつたのだ。"
"72","sakaguchi","sobomu.txt","さうして二人は友達になつた。"
"73","sakaguchi","sobomu.txt",""
"74","sakaguchi","sobomu.txt","当太郎が好きな女は忍と同じ年輩の、店の名前をマリヤといふ当時二十三歳の文学少女くづれだつた。"
"75","sakaguchi","sobomu.txt","骨のやうに瘠せてはゐたが病的に旺盛な性慾をもてあましてゐる女で、その女の一切の悲願が性慾の二字に尽くされてゐることを、黒くよごれた眼のまわりと猛禽の鋭い眼付によつて、隠すことなくむきだしてゐた。"
"76","sakaguchi","sobomu.txt","マリヤも自らの言葉によつて、それを言ひきつてゐたのだ。"
"77","sakaguchi","sobomu.txt","客の間に誰言ふとなく彼女を山猫と称ぶ習慣がついてゐたが、これは極めて適切にマリヤの内外全ての実相を言ひ当ててゐた。"
"78","sakaguchi","sobomu.txt",""
"79","sakaguchi","sobomu.txt","こんな処に働いてゐる女達は、我々が卑小な現実をより以上に高めやうとあせるところの多くは空しい企てにとつて、全く縁がないのだつた。"
"80","sakaguchi","sobomu.txt","建設的な労力、無窮の精神史が探究に疲れてきた貴重な真理、さういふものは彼女等に全く無用なのだ。"
"81","sakaguchi","sobomu.txt","彼女等はそんなものに見向きもしないし何も知らない。"
"82","sakaguchi","sobomu.txt","然し我々の実相を、その最も肉体的な、原始的な、本能的な角度から眺める限りに於て、余言をさしはさむ余地のない適切を洞破するものも彼女等だつた。"
"83","sakaguchi","sobomu.txt",""
"84","sakaguchi","sobomu.txt","肉体を超えたところに自らの真実の根をおろしたいと焦せるところの若々しい真剣な懊悩、さうしてその懊悩に青ざめきつた若者の不羈独立の魂は、肉体に全てを賭けて身ぢろぎもしない彼女等の前に現れるとき、往々全ての理想を地に砕かれ、絶望の安息を感じることがある。"
"85","sakaguchi","sobomu.txt","当太郎がさうだつた。"
"86","sakaguchi","sobomu.txt",""
"87","sakaguchi","sobomu.txt","彼は山猫に一種の救ひを感じたのだらう。"
"88","sakaguchi","sobomu.txt","さうして、その山猫と二本の材木のやうに重なりあひ絡みあつて沈湎するところの暗黒の行に一層の救ひを空想した。"
"89","sakaguchi","sobomu.txt","ところが山猫に惚れてしまふと、相手は肉を売る商売女に拘らず、当太郎は女に言ひよる大事な度胸がなくなつたのだ。"
"90","sakaguchi","sobomu.txt","これは奇妙な話だつた。"
"91","sakaguchi","sobomu.txt",""
"92","sakaguchi","sobomu.txt","山猫に惚れてしまつた当太郎は、どういふ複雑な思ひつきからきたものか、身体の八方に繃帯をまき、重病人の風態をして通ひはじめた。"
"93","sakaguchi","sobomu.txt","左腕は首につるし、右足は仰山にびつこをひき、竹の杖に縋りながら奇妙奇天烈な腰つきをして、ひどい渋面をつくりながら街を通つてくるのである。"
"94","sakaguchi","sobomu.txt","それが毎日のことだつた。"
"95","sakaguchi","sobomu.txt","あとで判つたところによると、当太郎は微塵も怪我をしてゐないのだ。"
"96","sakaguchi","sobomu.txt",""
"97","sakaguchi","sobomu.txt","酒場へくると山猫には見向きもしないで、他の女と凄く真面目に話しこんだ。"
"98","sakaguchi","sobomu.txt","その女と毎晩泊つて、たうとうしまひに同棲してしまつた。"
"99","sakaguchi","sobomu.txt","山猫には始めから言ひ寄りもしないし、山猫の方でも贋病人を眼中に入れてゐなかつた。"
"100","sakaguchi","sobomu.txt",""
"101","sakaguchi","sobomu.txt","好きでもない女と同棲して二月すぎると、自分でもわけが分らず這々の体で逐電した。"
"102","sakaguchi","sobomu.txt","女から逃れたといふよりも、もつと大きな異体の知れない圧迫に脅やかされて、夢中に逃げだしたといふ形だつた。"
"103","sakaguchi","sobomu.txt","何物かに追はれる思ひで、人気離れた山奥を八方に逃げまはつたあげく、信濃の宿で自殺を企て、生き返つたのを機会にして舞ひ戻つてきた。"
"104","sakaguchi","sobomu.txt","そのときから一ヶ年半すぎてゐた。"
"105","sakaguchi","sobomu.txt",""
"106","sakaguchi","sobomu.txt","舞ひ戻つてのち、草吉の新居を始めて訪れたのは五ヶ月ばかり前のことで、深夜の街をうろついてゐたばつかりに留置場へ投りこまれた帰りだと言ひながら、南京虫に食はれた傷を痛がつてゐたが、すこし休ませてくれと言つて白昼午睡して帰つていつた。"
"107","sakaguchi","sobomu.txt","すると翌日手みやげを持つてすぐやつてきた。"
"108","sakaguchi","sobomu.txt","それから繁々と訪れはじめた。"
"109","sakaguchi","sobomu.txt",""
"110","sakaguchi","sobomu.txt","その様子をみてゐると、忍の異母妹で弥生といふ十九の娘が草吉の住居に同居してゐるのであつたが、当太郎はその娘に気があるのだといふことが人々に判つた。"
"111","sakaguchi","sobomu.txt",""
"112","sakaguchi","sobomu.txt","さういふことが判つて一月ほど経過した一日のこと、彼は突然羽織袴といふ見慣れぬ風体で現れた。"
"113","sakaguchi","sobomu.txt","部屋へ通ると、特に弥生に同席を願つておいて、改めてキチンと坐り直したかと思ふと、却々しつかりした口調で幾分早口に求婚の言葉を述べた。"
"114","sakaguchi","sobomu.txt","それから誰一人挨拶のできないうちに、こんどはひどく落付払つて、一段と声を改めたうへ、自己の懐く人生観といふものを諄々と説き明しはじめたのだ。"
"115","sakaguchi","sobomu.txt","これが朗誦とか演説とでも言ひたいやうな代物で、まづ立板に水を流すが如しといふか、三十分あまりのべつ口きらずに喋べりまくつたのであつた。"
"116","sakaguchi","sobomu.txt",""
"117","sakaguchi","sobomu.txt","呆気にとられて控えてゐた一座の面々、漸く話に一段落がついたときには、当太郎の落付払つた一瞥をくらつて矢庭に我に返つたとはいふものの、単に甚しくホッと一息ついた形で、さて改まつて返答を探し直すには充分骨の折れる状態だつた。"
"118","sakaguchi","sobomu.txt","この様子を見てとると、当太郎はまるで待ち構えてゐたやうに更に一段と声を改め、今度は何やら一層うねうねした高遠な心境を弁じはじめたのであつた。"
"119","sakaguchi","sobomu.txt","これは正味一時間たつぷりのものだつた。"
"120","sakaguchi","sobomu.txt","草吉の耳にはプラトンだとかエピキュロス、フッサル乃至はボードレエル、パスカルなぞといふ聞き覚えの名前が、あちらで一つこちらで一つ飛びこんでくるぐらゐのもので、まして二人の女には徹頭徹尾わけの分らない寝言だつた。"
"121","sakaguchi","sobomu.txt",""
"122","sakaguchi","sobomu.txt","長談義が終りさうな気配になつたところで急に又舌に油がのりはじめ、何度となくさういふことを繰返して一座の人々を散々悩ましてゐたが、突然話にバタ／＼と結論をつけてしまふと、まるつきり今迄と違つた顔付をして一息入れた。"
"123","sakaguchi","sobomu.txt","それから結婚の話とはまるで別な、とんちんかんな世間話を然し甚だ落付いて二言三言交しておいて、それで何一つ思ひ残すことはないといふやうなサバ／＼した様子で帰つていつた。"
"124","sakaguchi","sobomu.txt","勿論弥生の返答は皆目きかずじまひであつた。"
"125","sakaguchi","sobomu.txt","返答の隙さへなかつたのであつた。"
"126","sakaguchi","sobomu.txt","それから二ヶ月あまり音沙汰がなかつた。"
"127","sakaguchi","sobomu.txt",""
"128","sakaguchi","sobomu.txt","十日ほどまへ二ヶ月ぶりで訪れたときには、遠い旅をしてきたと言つて、南国のピカピカ光る海の話や鱧漁の模様などを図解入りで話してゐたが、縁談のことには頭から足の爪まで無関心の様子であつた。"
"129","sakaguchi","sobomu.txt","その後もさういふ同じ様子で二三度訪れ、ゆふべは晩くまで話しこんだあげく、泊ることになつたのである。"
"130","sakaguchi","sobomu.txt","その当太郎が寝床の中に見えないのだつた。"
"131","sakaguchi","sobomu.txt",""
"132","sakaguchi","sobomu.txt","――気まぐれに帰つてしまつたのだらうか？それも珍らしいことではない、と草吉は心に思つた。"
"133","sakaguchi","sobomu.txt",""
"134","sakaguchi","sobomu.txt","然し気にかかることは、階下にねてゐる女の寝床へ忍びこんでゐないかといふことだつた。"
"135","sakaguchi","sobomu.txt","草吉の頭は思ひだす、当太郎のゆふべの話は、南国の漁村で、飽くことを知らない海女の寝床へ忍びこむ話が大部分であつたのだ。"
"136","sakaguchi","sobomu.txt","そのときの思ひありげな話振りを考へてみると、夜這ひの目的をもつて泊りこみ、のみならずそれをほのめかすことによつて変態的な満足を感じてゐたと思はれる節が充分にあつた。"
"137","sakaguchi","sobomu.txt",""
"138","sakaguchi","sobomu.txt","――降りてみやう……"
"139","sakaguchi","sobomu.txt","然し草吉はまた躊躇した。"
"140","sakaguchi","sobomu.txt","疲れに似た放心が、こんな時に遠い涯から流れかかつてくるのだつた。"
"141","sakaguchi","sobomu.txt","階下へ向けて耳を澄ましてみることが、このとき可能な全てであつた。"
"142","sakaguchi","sobomu.txt","まさかに殺しはしないだらう？草吉の心に猥褻な嫉妬が沸きおこり、それが再び複雑な放心に還つてくるのだ。"
"143","sakaguchi","sobomu.txt","冷静な彼の心が、冷えた興奮のあまりであることが分るのだつた。"
"144","sakaguchi","sobomu.txt",""
"145","sakaguchi","sobomu.txt","そのとき階下に一つの小さな物音がおこつた。"
"146","sakaguchi","sobomu.txt","人の立ち上る気配であつた。"
"147","sakaguchi","sobomu.txt","誰といふことが分らない、障子を開けて歩きだす様子だつた。"
"148","sakaguchi","sobomu.txt","さうするうちに、わあッといふ塊まりのやうな叫びが起つた。"
"149","sakaguchi","sobomu.txt","それから確かとききとれない叫喚が原因不明のけたたましい物音と前後して響いてきた。"
"150","sakaguchi","sobomu.txt","それは弥生の声であつた。"
"151","sakaguchi","sobomu.txt","改めて草吉を呼んだ声もきこえた。"
"152","sakaguchi","sobomu.txt",""
"153","sakaguchi","sobomu.txt","草吉は立ち上つてゐた。"
"154","sakaguchi","sobomu.txt","自分では強ひて落付いたつもりであつたが、たしかに急いで階段を降りた。"
"155","sakaguchi","sobomu.txt","階段を降りたところに廊下があつて便所があり、廊下の隣は二人の女が寝んでゐる六畳であつた。"
"156","sakaguchi","sobomu.txt","部屋はこのほかに入口の二畳が一間あるばかりである。"
"157","sakaguchi","sobomu.txt",""
"158","sakaguchi","sobomu.txt","廊下へ降りついてみると、廊下に人影はない。"
"159","sakaguchi","sobomu.txt","六畳と境ひの障子もしめられてある。"
"160","sakaguchi","sobomu.txt","どうした、と、草吉が障子の外から声をかけると、自分の部屋へ跳び戻つて頭から蒲団を被つてゐると覚しい弥生の掠れた声がして、「便所の中よ」と言つた。"
"161","sakaguchi","sobomu.txt",""
"162","sakaguchi","sobomu.txt","便所には燈火がついてゐた。"
"163","sakaguchi","sobomu.txt","戸を開いてみると、当太郎が下一杯にうづくまつてゐた。"
"164","sakaguchi","sobomu.txt","首をくくつたのであつた。"
"165","sakaguchi","sobomu.txt","その縄が斬れて、落ちたのだ。"
"166","sakaguchi","sobomu.txt","草吉の目の先に一本の縄がだらりと吊り残りぶらついてゐたのだ。"
"167","sakaguchi","sobomu.txt",""
"168","sakaguchi","sobomu.txt","二人の女は漸く怖々起き上つて細目に障子を開けたが、障子の奥から現れて来やうとはしない。"
"169","sakaguchi","sobomu.txt","草吉が屍体の上にかがみこんで、下一杯にひろがつた形の中から当太郎の顔の部分を探してゐると、"
"170","sakaguchi","sobomu.txt","「とても医者へ行けないわ……」"
"171","sakaguchi","sobomu.txt","と、ふるへる声で、弥生はもう懇願するやうに呟いてゐた。"
"172","sakaguchi","sobomu.txt",""
"173","sakaguchi","sobomu.txt","顔をみつけて少し光の方へ壊してみると、口からか鼻からか流れ出たものが下の方にたまつてゐて、涙も流れてゐたし、顔は一面によごれてゐた。"
"174","sakaguchi","sobomu.txt","血のやうな黒いものも流れてゐた。"
"175","sakaguchi","sobomu.txt","ことぎれてゐるのだらうか？とにかく医者をよばう。"
"176","sakaguchi","sobomu.txt","……その考へが草吉の心に蘇みがへつたとき、同じ思ひを更に激しい恐怖と共に思ひだした二人の女は、両の眼をまとまりなく光らしてゐるばかりで、化石してゐるのだ。"
"177","sakaguchi","sobomu.txt","暫時さういふ沈黙がつづいたとき、下一杯にひろがつた形が、ねぢまげた顔のあたりから動きはじめたのであつた。"
"178","sakaguchi","sobomu.txt",""
"179","sakaguchi","sobomu.txt","当太郎は生き返つた。"
"180","sakaguchi","sobomu.txt","意識を失つてゐたのだつた。"
"181","sakaguchi","sobomu.txt",""
"182","sakaguchi","sobomu.txt","「生きてゐるんだよ」"
"183","sakaguchi","sobomu.txt","と、自分を看まもる人々に教へるやうに、彼は嗄れた声で呻いた。"
"184","sakaguchi","sobomu.txt","然しいくらか動かしかけた頭も元の場所へ再びぐつたりもぐしてしまつて、一杯ひろがつた形のまま、また動かなくなつてしまつた。"
"185","sakaguchi","sobomu.txt",""
"186","sakaguchi","sobomu.txt","「しくじつた！もう死ねない！」"
"187","sakaguchi","sobomu.txt","と、彼はつづけさまに呻いた。"
"188","sakaguchi","sobomu.txt",""
"189","sakaguchi","sobomu.txt","「君達が起きる前から正気づいてゐたのだ。"
"190","sakaguchi","sobomu.txt","君達が来てからのことも、みんな分つてゐたのだ。"
"191","sakaguchi","sobomu.txt","すこし睡むいのだ。"
"192","sakaguchi","sobomu.txt","いろ／＼のことが分りかけたやうな気がしたんだよ。"
"193","sakaguchi","sobomu.txt","それももう分らなくなつてしまつたやうだ。"
"194","sakaguchi","sobomu.txt","とにかく、もう大丈夫なんだ。"
"195","sakaguchi","sobomu.txt","心配せずに寝床へひきとつてくれ。"
"196","sakaguchi","sobomu.txt","俺もすこし睡むりたいのだ」"
"197","sakaguchi","sobomu.txt","然し三尺四方の床の上へ一杯ひろがつた形は、依然微動もしなかつた。"
"198","sakaguchi","sobomu.txt","そのまま数秒の時が流れた。"
"199","sakaguchi","sobomu.txt","彼は突然もく／＼と起きあがりはじめた。"
"200","sakaguchi","sobomu.txt","起きあがつてしまふと、羽目板に両手を支え、暫く俯向いて目をつぶつてゐたが、"
"201","sakaguchi","sobomu.txt","「お午までねむらせてくれ」"
"202","sakaguchi","sobomu.txt","と独話のやうに呟いておいて、急に振向いて、手探りでもするやうな恰好で動きはじめた。"
"203","sakaguchi","sobomu.txt","人々の顔は目につかないのか、その方には目をくれず、二階の寝床へあがつて行かうとした。"
"204","sakaguchi","sobomu.txt",""
"205","sakaguchi","sobomu.txt","「顔を拭いて――」"
"206","sakaguchi","sobomu.txt","と忍の叫ぶ声なぞも耳にはいらぬのであらう、ただ夕空の蟇のやうに階段を這ひ登つていつた。"
"207","sakaguchi","sobomu.txt","草吉はその後ろからついていつたが、汚いものをつけたのか、汚物を漏らしたのか、とにかく悪臭の堪えがたいものがあり、それが草吉の朦朧と痺れた頭に、人の死生喜怒哀楽は汚物の悪臭芬々たるが如く卑小にして醜しといふ感を与へた。"
"208","sakaguchi","sobomu.txt",""
"209","sakaguchi","sobomu.txt","当太郎は二階へ登ると、いきなり寝床へころがりこみ、頭からすつぽり蒲団を被つた。"
"210","sakaguchi","sobomu.txt","然し草吉が一緒に登つてきたことを知ると、"
"211","sakaguchi","sobomu.txt","「しくじつたよ。"
"212","sakaguchi","sobomu.txt","もうだめだ。"
"213","sakaguchi","sobomu.txt","もう死ねないよ……」"
"214","sakaguchi","sobomu.txt","と蒲団の下から先刻と同じ言葉をもらした。"
