"","auth","piece","line"
"0","sakaguchi","wagachio_ou_hitobito.txt","わが血を追ふ人々"
"1","sakaguchi","wagachio_ou_hitobito.txt","坂口安吾"
"2","sakaguchi","wagachio_ou_hitobito.txt",""
"3","sakaguchi","wagachio_ou_hitobito.txt","-------------------------------------------------------"
"4","sakaguchi","wagachio_ou_hitobito.txt","【テキスト中に現れる記号について】"
"5","sakaguchi","wagachio_ou_hitobito.txt",""
"6","sakaguchi","wagachio_ou_hitobito.txt","《》：ルビ"
"7","sakaguchi","wagachio_ou_hitobito.txt","（例）松明"
"8","sakaguchi","wagachio_ou_hitobito.txt",""
"9","sakaguchi","wagachio_ou_hitobito.txt","｜：ルビの付く文字列の始まりを特定する記号"
"10","sakaguchi","wagachio_ou_hitobito.txt","（例）竹中｜采女"
"11","sakaguchi","wagachio_ou_hitobito.txt",""
"12","sakaguchi","wagachio_ou_hitobito.txt","／＼：二倍の踊り字（「く」を縦に長くしたような形の繰り返し記号）"
"13","sakaguchi","wagachio_ou_hitobito.txt","（例）足がふらのそ／＼"
"14","sakaguchi","wagachio_ou_hitobito.txt","-------------------------------------------------------"
"15","sakaguchi","wagachio_ou_hitobito.txt",""
"16","sakaguchi","wagachio_ou_hitobito.txt","その一"
"17","sakaguchi","wagachio_ou_hitobito.txt",""
"18","sakaguchi","wagachio_ou_hitobito.txt","渡辺小左衛門は鳥銃をぶらさげて冬山をのそ／＼とぶらついてゐる男のことを考へると、ちようど蛇の嫌ひな者が蛇を見たときと同じ嫌悪を感じた。"
"19","sakaguchi","wagachio_ou_hitobito.txt","この男が鳥銃をぶらさげて歩くには理由があるので、人に怪しまれず毎日野山を歩き廻るには猟人の風をするに限る。"
"20","sakaguchi","wagachio_ou_hitobito.txt","この男は最近この村へ越してきて、それも渡辺小左衛門を頼つて、彼の地所を借りうけた。"
"21","sakaguchi","wagachio_ou_hitobito.txt","名目は小左衛門の小作であるが、畑などは耕さぬ。"
"22","sakaguchi","wagachio_ou_hitobito.txt","毎日鳥銃をぶらさげて諸々方々、天草一円から長崎島原にわたつて歩き廻り、どこに寝てゐるのやら、小屋はあるが、自分の小屋に眠ることなどはめつたにない。"
"23","sakaguchi","wagachio_ou_hitobito.txt","ところが一度、小左衛門はこの男の眠るところを見たのである。"
"24","sakaguchi","wagachio_ou_hitobito.txt","彼の嫌悪が決定的になつたのは、その時からのことであつた。"
"25","sakaguchi","wagachio_ou_hitobito.txt",""
"26","sakaguchi","wagachio_ou_hitobito.txt","この男が水練が達者なぐらゐは驚くに当らぬが、この男は真冬の満潮の海を泳いで上つてきた。"
"27","sakaguchi","wagachio_ou_hitobito.txt","鉢巻をしめて頭上に松明をさしこみ、これに火をともして荒れ模様の夜の海を半刻あまりも泳いできたのである。"
"28","sakaguchi","wagachio_ou_hitobito.txt","神火が荒れ海に燃えてゐるといふので村の人々は驚愕して海辺に坐つて火を拝む始末であつたが、男は水中で松明を消して小左衛門の裏庭の浜へ上つてきた。"
"29","sakaguchi","wagachio_ou_hitobito.txt","こゝならば村の者には見つからない。"
"30","sakaguchi","wagachio_ou_hitobito.txt","あいにく小左衛門はたつた一人裏庭へでゝ神火を見てゐた。"
"31","sakaguchi","wagachio_ou_hitobito.txt","海から上つてくる男に向つて誰かと叫ぶと、あゝ、あんたか、と、男はすり切れたやうな声で答へたゞけだつた。"
"32","sakaguchi","wagachio_ou_hitobito.txt","さすがにこの男も冬の荒れ海の水練に疲労困憊してゐたのである。"
"33","sakaguchi","wagachio_ou_hitobito.txt","男は暫く汀にうづくまつてゐたが、やがて起き上つて腰に巻きつけてゐたヂシビリナ（鞭）をほどくと、力一ぱい自分の身体を殴りはじめた。"
"34","sakaguchi","wagachio_ou_hitobito.txt","散々に殴り、血にまみれ、喘ぎながら小左衛門の牛小屋に辿りつくと、へたばるやうにもぐりこんで藁をかぶつて寝てしまつた。"
"35","sakaguchi","wagachio_ou_hitobito.txt",""
"36","sakaguchi","wagachio_ou_hitobito.txt","この男が何のためにこの島へきて小左衛門の地所を借りたか、だんだん意味が分つてきた。"
"37","sakaguchi","wagachio_ou_hitobito.txt","この男は、先づ一冊の本をたづさへてきたのである。"
"38","sakaguchi","wagachio_ou_hitobito.txt","この本は二十五年前上津浦に布教してゐたマヽコスといふ外人神父の書き残した予言書で、マヽコスは之を残して追放されたと言ふのであるが、五々の年、日域に善童が現れるであらう、善童は習はざる諸道に通達してゐる、東西の空が焼け、枯木に花が咲き、天地震動し、そのとき人々がクルス（十字架）をかゞげて野山をはせめぐり切支丹の世となるであらう、といふ意味のことが書いてある。"
"39","sakaguchi","wagachio_ou_hitobito.txt",""
"40","sakaguchi","wagachio_ou_hitobito.txt","ちようどその年には東西の空が一時に焼けるといふ現象が起つて村人達を驚かし、又、源左衛門の庭の枯木の藤の木に花が咲き、それも以前は白の咲いた木であるのに紫の花が咲いた。"
"41","sakaguchi","wagachio_ou_hitobito.txt","又、外のところでは秋の季節に桜の花が咲いたし、温泉岳の麓であるから天地鳴動に不足はない。"
"42","sakaguchi","wagachio_ou_hitobito.txt","万事その年に行はれた不思議な事どもにかこつけたもので、善童とあるのは言ふまでもなく益田甚兵衛の子、ヒエロニモ四郎のことであつた。"
"43","sakaguchi","wagachio_ou_hitobito.txt",""
"44","sakaguchi","wagachio_ou_hitobito.txt","男には五名の配下があつた。"
"45","sakaguchi","wagachio_ou_hitobito.txt","医者の森宗意軒、松右衛門、善右衛門、源右衛門、源左衛門で、いづれも六十前後の老人、天草の諸方に住む切支丹の世話役であつた。"
"46","sakaguchi","wagachio_ou_hitobito.txt","五名の老人はマヽコスの予言書を持ち廻つて四郎の奇蹟を宣伝しはじめたのである。"
"47","sakaguchi","wagachio_ou_hitobito.txt",""
"48","sakaguchi","wagachio_ou_hitobito.txt","下津浦の浜では漁師が網をひくと貝殻が一つはいつてきた。"
"49","sakaguchi","wagachio_ou_hitobito.txt","貝殻の中には紙片があり、表に十字架が描かれ、裏には天の子四郎と書かれてゐた。"
"50","sakaguchi","wagachio_ou_hitobito.txt",""
"51","sakaguchi","wagachio_ou_hitobito.txt","小左衛門が一番はつきりと忘れることが出来ないのは、この男が彼の地所を借りるために始めて訪ねてきた時のことで、そのとき男は呆れるぐらゐ陽気であつた。"
"52","sakaguchi","wagachio_ou_hitobito.txt","開放的で豪快で何一つ心に隠しておくことの出来ないお喋りといふ風であり、彼の経てきた色々の不思議なこと愉快なことを語つてきかせるのであるが、たつた一度ジロリとレシイナを見た男の眼を小左衛門は忘れることが出来ないのだ。"
"53","sakaguchi","wagachio_ou_hitobito.txt","レシイナは彼の妻でありヒエロニモ四郎の姉であつた。"
"54","sakaguchi","wagachio_ou_hitobito.txt",""
"55","sakaguchi","wagachio_ou_hitobito.txt","その瞬時の眼は最も陰惨な心の窓だ。"
"56","sakaguchi","wagachio_ou_hitobito.txt","尊貴なる福音の使者たる人にこのやうな眼が有りうるものかと小左衛門は我目を疑る始末であつたが、思へば男の魂は二元で、この陰惨な眼が彼の偽らぬ本性である。"
"57","sakaguchi","wagachio_ou_hitobito.txt","この男は悪魔なのだ。"
"58","sakaguchi","wagachio_ou_hitobito.txt","彼は神の福音を説いてゐる。"
"59","sakaguchi","wagachio_ou_hitobito.txt","けれども、彼の魂は人間の沈み得るどん底に落ち、石よりも重く沈黙し、あらゆる物の破壊を待つてゐるだけだ。"
"60","sakaguchi","wagachio_ou_hitobito.txt","レシイナを見たこの男の眼は、幸福又は平和に対する敵意であつた。"
"61","sakaguchi","wagachio_ou_hitobito.txt","野卑や好色の翳がないのは、その魂が破壊といふ最後の崖しか見つめることがなくなつてゐる証拠であつた。"
"62","sakaguchi","wagachio_ou_hitobito.txt",""
"63","sakaguchi","wagachio_ou_hitobito.txt","男の名は金鍔次兵衛の通り名で日本全土に知られてゐたが、その本名は誰も知らない。"
"64","sakaguchi","wagachio_ou_hitobito.txt","大村の生れで、父はレオ落合小左衛門、母はクラヽ、貧乏な武士で、両親共に殉教者であつたといふが、彼は少年時代から有馬の神学校で育ち、欧羅巴人と同じぐらゐラテン語を達者に話した。"
"65","sakaguchi","wagachio_ou_hitobito.txt","一六二二年、宗教的地位を得るためにマニラに渡り、二三年十一月二十六日管区長フライ・アロンゾ・メンチエダ神父によつて修道服を受け、ドン・フライ・ペトロ・デ・アルセによつて司祭に補せられた。"
"66","sakaguchi","wagachio_ou_hitobito.txt","教会に残る彼の名はフライ・トマス・デ・サン・アウグスチノ神父といふ。"
"67","sakaguchi","wagachio_ou_hitobito.txt","日本潜入を願ひでゝ、一六三〇年二月二日乗船、マリベレス島で難船したが助かり、日本逆潜入に成功した。"
"68","sakaguchi","wagachio_ou_hitobito.txt",""
"69","sakaguchi","wagachio_ou_hitobito.txt","当時アウグスチノ会の代理管区長グチエレスは大村に入牢中であつたから、次兵衛は長崎奉行竹中｜采女の別当の中間に住込んで牢舎に通ひ、グチエレスの指図を受けて伝道に奔走したが、彼の名が知れ渡りお尋者になりながら、当の長崎奉行の別当の中間に身をやつしてゐるといふことは約二年間気付かれなかつた。"
"70","sakaguchi","wagachio_ou_hitobito.txt","露顕して大村の山中に逃げ込み、このとき次兵衛一人を捕へるために大村藩は十六歳以上六十歳まで領内の男子総動員、唐津藩や長崎奉行、佐賀藩などから応援をもとめて総勢は数万に達し、全員を以て山全体をとりまいて、一人一尺の間隔で山林から海岸まで一足づゝ追ひつめて行つた。"
"71","sakaguchi","wagachio_ou_hitobito.txt","夜になると各自立止つた地点を動かず篝をたいて不寝番を立て、三十五日を費して、遂に海まで突きぬけた。"
"72","sakaguchi","wagachio_ou_hitobito.txt","海上には数千の小舟を敷きつめて待ちぶせてゐたから漏れる隙間はなかつた筈だが、次兵衛の姿はなかつた。"
"73","sakaguchi","wagachio_ou_hitobito.txt","彼はすでに江戸へ逐電、信徒の旗本の手引で江戸城の大奥へまで乗込んで小姓の間を伝道して歩いてゐたが、江戸の生活が約二年、露顕の気配が近づくと風の如くに飄然長崎へ舞ひ戻つてきた。"
"74","sakaguchi","wagachio_ou_hitobito.txt",""
"75","sakaguchi","wagachio_ou_hitobito.txt","彼は危急の迫るたびに刀の鍔に手を当てゝ祈念するので、刀の鍔に切支丹妖術の鍵が秘められてゐるのだらうと取沙汰せられて、金鍔次兵衛（又は次太夫）の渾名となつたが、多分彼の刀の鍔に十字架がはめこまれてゐたのであらうと今日想像せられてゐる。"
"76","sakaguchi","wagachio_ou_hitobito.txt","刀の鍔に十字架を用ひた例は切支丹遺物の中にも現存してゐる。"
"77","sakaguchi","wagachio_ou_hitobito.txt","カトリック教徒が胸に切る十字は、あれが多分後世忍術使ひの真言九字の原形であつたに相違ない。"
"78","sakaguchi","wagachio_ou_hitobito.txt","切支丹と言へばバテレンの妖術使ひと一口に言ふが、真に妖術使ひの足跡を正史にとゞめてゐる者は金鍔次兵衛の外にはない。"
"79","sakaguchi","wagachio_ou_hitobito.txt",""
"80","sakaguchi","wagachio_ou_hitobito.txt","ポルトガルの商船はまた長崎に入港したが、乗員達はもはや上陸を許されず、早晩貿易禁止は必然で、日本潜入の神父も後を絶たうとし、信徒と教団の連絡は絶望的になつてゐた。"
"81","sakaguchi","wagachio_ou_hitobito.txt","潜入の神父はあらかた刑死し、フェレイラは棄教、残存するのは金鍔次兵衛ぐらゐのもので、あとは消息も分らない。"
"82","sakaguchi","wagachio_ou_hitobito.txt",""
"83","sakaguchi","wagachio_ou_hitobito.txt","その年の長崎及びその近郊に行はれた降誕祭のミサは無茶苦茶だつた。"
"84","sakaguchi","wagachio_ou_hitobito.txt","信徒達は殺気立ち、捕吏が来たら捕へて殺してしまふ覚悟で、各々の秘密集会所で祈り泣き歌ひ、牛小屋を清めて水をはり、彼らはもう死の狂躁と遊んでゐた。"
"85","sakaguchi","wagachio_ou_hitobito.txt","それは神父金鍔次兵衛の指図であり、絶望と破壊の遊戯は彼の姿の影であつた。"
"86","sakaguchi","wagachio_ou_hitobito.txt","逃亡潜伏に熟達した次兵衛はとにかく、信徒達の狂躁が捕吏に分らぬ筈はない。"
"87","sakaguchi","wagachio_ou_hitobito.txt","彼によつて修道服を受けた数人を始め七百名余りの信徒達が一網打尽となり、刑場に送られて焼き殺されてしまつたが、次兵衛のみは風であつた。"
"88","sakaguchi","wagachio_ou_hitobito.txt","彼は天草へ舞ひ戻り、鳥銃をぶらさげて冬山の雑木林をぶら／＼歩いてゐたのである。"
"89","sakaguchi","wagachio_ou_hitobito.txt",""
"90","sakaguchi","wagachio_ou_hitobito.txt","あの男は平和な人々を破壊と死滅へ追ひ立てる気だ、と渡辺小左衛門は悟つた。"
"91","sakaguchi","wagachio_ou_hitobito.txt","彼は天草最大の富豪であり、和漢を始め洋学にも通じたディレッタントで引込思案の男であつたが、レシイナに向けられた陰惨な眼を思ひだすと渾身の勇気がわいてきた。"
"92","sakaguchi","wagachio_ou_hitobito.txt","それは彼が安穏を欲するからであつたけれども、又、レシイナを熱愛してゐたせゐだつた。"
"93","sakaguchi","wagachio_ou_hitobito.txt","あの陰惨な魂の破壊の影が自分とレシイナの平和にまで及ぶだらうと考へると、曾ては最大の敬意を以て迎へた神父であつたけれども、秘密に殺したくなつてきた。"
"94","sakaguchi","wagachio_ou_hitobito.txt","気違ひめ。"
"95","sakaguchi","wagachio_ou_hitobito.txt","俺は気違ひは嫌ひなのだ。"
"96","sakaguchi","wagachio_ou_hitobito.txt","そして天草の人間は、今はもう、一人残らずみんな気違ひにならうとしてゐる。"
"97","sakaguchi","wagachio_ou_hitobito.txt","あゝレシイナお前まで、お前はまさか弟の四郎が天人だと思ふ筈はないだらう。"
"98","sakaguchi","wagachio_ou_hitobito.txt","いゝえ、とレシイナは答へた。"
"99","sakaguchi","wagachio_ou_hitobito.txt","気の毒な農民達は畑の物を根こそぎ税に納めねばならず、食べる物もありませぬ。"
"100","sakaguchi","wagachio_ou_hitobito.txt","ゼスヽ様の御名を唱へても殺されます。"
"101","sakaguchi","wagachio_ou_hitobito.txt","世の中がこのまゝのやうで宜しい筈はございませぬ。"
"102","sakaguchi","wagachio_ou_hitobito.txt","あゝ、小左衛門は絶望した。"
"103","sakaguchi","wagachio_ou_hitobito.txt","だが、何といふ女であらうか。"
"104","sakaguchi","wagachio_ou_hitobito.txt","彼は異様に新鮮な色情すらも見たのであつた。"
"105","sakaguchi","wagachio_ou_hitobito.txt","全てが分らなくなつてきた。"
"106","sakaguchi","wagachio_ou_hitobito.txt","神とは何者であるか。"
"107","sakaguchi","wagachio_ou_hitobito.txt","四郎は何者であるか。"
"108","sakaguchi","wagachio_ou_hitobito.txt","そしてレシイナよ、お前まで俺の分らぬところへ飛び立つてしまひさうな気がする。"
"109","sakaguchi","wagachio_ou_hitobito.txt",""
"110","sakaguchi","wagachio_ou_hitobito.txt","金鍔次兵衛は長崎の二官の店でヒエロニモ四郎に洗礼を授けた当の神父であつた。"
"111","sakaguchi","wagachio_ou_hitobito.txt",""
"112","sakaguchi","wagachio_ou_hitobito.txt","四郎は八ツの年に二官の店に丁稚奉公にあがつたが、彼はいはゆる神童で、この界隈では四五歳の四郎の筆蹟を額におさめて珍蔵する家もすくなからぬ程だつた。"
"113","sakaguchi","wagachio_ou_hitobito.txt",""
"114","sakaguchi","wagachio_ou_hitobito.txt","十三の年に独立して、二官の店の商品、舶来の小間物類を船につみこみ、京、大坂、江戸で売りさばくために父親の甚兵衛と共に出発したが用心棒といふ以外に父親の同伴の意味はなかつた。"
"115","sakaguchi","wagachio_ou_hitobito.txt","大人よりも利巧であつたし、商才に富んでゐた。"
"116","sakaguchi","wagachio_ou_hitobito.txt",""
"117","sakaguchi","wagachio_ou_hitobito.txt","二官の義弟の陳景は長崎の市長であつたが、四郎は当然王侯たるべき人ではあるが、世を危くする気質まで蔵してゐる、と予言した。"
"118","sakaguchi","wagachio_ou_hitobito.txt","二官は四郎先生とよんで自慢のあまり過当に四郎を代理に立てゝ一人前に振舞はせて喜びまはつてゐたのであつたが、応対の礼儀などでも大人以上の落付と余裕があつたし、思慮分別にも富んでゐた。"
"119","sakaguchi","wagachio_ou_hitobito.txt","四周にたゞ賞讃の言葉だけしか聞き知ることのなかつた四郎は、何が賞讃の要件であるか、更に賞讃せられるために如何にすべきか、本能的に会得してをり、常に効果を測定してゐた。"
"120","sakaguchi","wagachio_ou_hitobito.txt","けれども彼は十三であり、そしてあらゆる少年よりも更に空想的な少年だつた。"
"121","sakaguchi","wagachio_ou_hitobito.txt","彼は自在の力を信じ、自己の万能を空想したが、常に賞讃にみたされた通路に狎れて、野放図な子供の空想がそつくり大人の現実的な野心と計画に育つてゐた。"
"122","sakaguchi","wagachio_ou_hitobito.txt",""
"123","sakaguchi","wagachio_ou_hitobito.txt","元々大人の年齢は多くは蛇足で、経験といふ不手際なツギハギによつて、要するにその人間の器量に相応したツギの当て方をしてゐるといふだけのことだ。"
"124","sakaguchi","wagachio_ou_hitobito.txt","子供の着物はまだツギが当つてゐない。"
"125","sakaguchi","wagachio_ou_hitobito.txt","彼らは空想的で大人達が器量相応のこと以上に踏みだす力を失つてゐるのに、彼らは思ひのまゝの何事もできると考へてゐる。"
"126","sakaguchi","wagachio_ou_hitobito.txt","だから彼らは利巧のやうでも子供だと言はれ、まだツギの当らぬ着物が、要するに之からの一足毎に破れて、ツギハギだらけになつたときに一人前になるだらうと考へられてゐるのである。"
"127","sakaguchi","wagachio_ou_hitobito.txt",""
"128","sakaguchi","wagachio_ou_hitobito.txt","けれども経験といふ不手際なツギハギが叡智の栄光でないことは大人達も認めてをり、彼らはツギの当らない着物の美しさを忘れてゐないばかりでなく、眩惑されたり、時に本能的な喝采を送りたがる愚昧な感動を忍ばせてゐる。"
"129","sakaguchi","wagachio_ou_hitobito.txt","それはもう愚昧の外の言葉はない。"
"130","sakaguchi","wagachio_ou_hitobito.txt","このツギハギを取り除けば大人は子供に附け加へた何の値打も持つてはをらず、分別の殻を負ふてゐるだけ始末の悪い気違ひだつた。"
"131","sakaguchi","wagachio_ou_hitobito.txt","彼らは間違ひを合理化し益々愚昧に落込むことを急ぐのだ。"
"132","sakaguchi","wagachio_ou_hitobito.txt",""
"133","sakaguchi","wagachio_ou_hitobito.txt","すべてそれらの大人達の愚かさを四郎は別の角度から見抜いてゐた。"
"134","sakaguchi","wagachio_ou_hitobito.txt","彼らは正直で狡猾で一定の複雑な内容を持つてゐるが、発育の止つた身長と同じやうに全てがすでに限定せられて、要するに使役に馴らされてゐるといふことだつた。"
"135","sakaguchi","wagachio_ou_hitobito.txt","自分を常に大人達のその上に置いて、彼は絶対の王者を夢み、やがて確信しはじめた。"
"136","sakaguchi","wagachio_ou_hitobito.txt",""
"137","sakaguchi","wagachio_ou_hitobito.txt","彼らが商品を船に積みこみ明朝出発するといふ前夜のことだが、その晩長崎の二官の店では四郎父子を主賓に小さな饗宴がひらかれてゐた。"
"138","sakaguchi","wagachio_ou_hitobito.txt","そのとき飄然訪れたのが金鍔次兵衛で、彼は江戸から逃げ戻つて、長崎の二官の店へ辿りついたところであつた。"
"139","sakaguchi","wagachio_ou_hitobito.txt",""
"140","sakaguchi","wagachio_ou_hitobito.txt","逃亡と潜伏、死の戯れの半生に次兵衛の魂は孤絶したが、孤絶せる魂には死生も亦たゞ退屈にすぎず、魂の結び目をとく何物もなかつたけれども、たゞ人間の肉体、容貌の美といふことが異常な刺戟になるのであつた。"
"141","sakaguchi","wagachio_ou_hitobito.txt","彼は九ツのそして十のヒエロニモの目覚めるやうな可憐さを忘れる筈はなかつたが、今眼前に再会した十三のヒエロニモは処女よりも清く美姫よりもなまめかしく、そして全ての効果を意識した利巧さが娼婦の本能であることをどうして次兵衛が見逃さう。"
"142","sakaguchi","wagachio_ou_hitobito.txt","彼は美なる肉体の猟犬であり、悪魔の臭覚をもつてゐた。"
"143","sakaguchi","wagachio_ou_hitobito.txt","彼の魂は昏酔し、恍惚として肉体の上を遊楽した。"
"144","sakaguchi","wagachio_ou_hitobito.txt","孤絶せる魂に恋はない。"
"145","sakaguchi","wagachio_ou_hitobito.txt","毒血の麻薬的な明滅だつたが、この少年を自己の運命の圏外へ手放すことに異常な恐怖に襲はれた。"
"146","sakaguchi","wagachio_ou_hitobito.txt",""
"147","sakaguchi","wagachio_ou_hitobito.txt","四郎はかゝる不自由な身動き、否、全然予期せざる身動きが自然に流れでゝ行くことを曾て記憶にとゞめてゐなかつた。"
"148","sakaguchi","wagachio_ou_hitobito.txt","それは娼婦がその正体を見抜いた人に接した時に自然に動く媚態であるといふことに気付く筈はなかつたが、彼はいくらか困惑し、意識の底では訝しげに眉をひそめてみるのであつたが、その顔色は益々冴えるばかりであつた。"
"149","sakaguchi","wagachio_ou_hitobito.txt","彼は次兵衛が怖かつた。"
"150","sakaguchi","wagachio_ou_hitobito.txt","そして次兵衛に傾倒した。"
"151","sakaguchi","wagachio_ou_hitobito.txt",""
"152","sakaguchi","wagachio_ou_hitobito.txt","翌朝、次兵衛はまだ夜の明けぬうちに目が覚めた。"
"153","sakaguchi","wagachio_ou_hitobito.txt","朝ごとに訪れる怒りと悔恨が、その日は特別ひどかつた。"
"154","sakaguchi","wagachio_ou_hitobito.txt","彼は不快な夢を見た。"
"155","sakaguchi","wagachio_ou_hitobito.txt","夢の中では捕吏や役人と談合し、その歓心を得るために卑屈に振舞ひ、数々の卑劣なことをするのであつた。"
"156","sakaguchi","wagachio_ou_hitobito.txt","この安らかな蒲団の奴が、と彼は蒲団をはねのけて腰のヂシビリナ（鞭）を握りしめたが、わけの分らぬ絶望のために放心し、両手に顔を掩ふてゐた。"
"157","sakaguchi","wagachio_ou_hitobito.txt","まだ街はねむつてゐたが、二官の家では四郎父子の出発のために立働く音がしてゐる。"
"158","sakaguchi","wagachio_ou_hitobito.txt","彼らはこの蒲団を、そして寝室を、さらに広大にするために働いてゐるのであらう。"
"159","sakaguchi","wagachio_ou_hitobito.txt","あのヒエロニモまで。"
"160","sakaguchi","wagachio_ou_hitobito.txt","彼はなぜ京や大坂や江戸の町へ異国の小間物を商ひに行くか。"
"161","sakaguchi","wagachio_ou_hitobito.txt","次兵衛は唐突な怒りのために狂乱した。"
"162","sakaguchi","wagachio_ou_hitobito.txt",""
"163","sakaguchi","wagachio_ou_hitobito.txt","彼は直ちに着物をつけて四郎の部屋をたゝき、彼をよびだして、まだ明けきらぬ丘へ登つた。"
"164","sakaguchi","wagachio_ou_hitobito.txt",""
"165","sakaguchi","wagachio_ou_hitobito.txt","「ヒエロニモよ。"
