"","auth","piece","line"
"199","sakaguchi","zenso.txt",""
"200","sakaguchi","zenso.txt","「あの女は金のいらないだるまですぜ。"
"201","sakaguchi","zenso.txt","あの女がたつた一人ゐるおかげで、この村の若者や親爺どもは、だいぶ不自由もしのぎいいし金もかからないと喜んでゐますよ。"
"202","sakaguchi","zenso.txt","あの女の不身持が普通のものぢやないことは、お分りだらうと思ひますよ。"
"203","sakaguchi","zenso.txt","結婚といふ名目であの身体が独占できると思ひますか？況んやあいつの精神が？野獣にも精神があるといふならあの女にも精神はあるでせうが、仏力で野獣が済度できますかな。"
"204","sakaguchi","zenso.txt","五十円の結納金。"
"205","sakaguchi","zenso.txt","十円の扶助料。"
"206","sakaguchi","zenso.txt","きいただけでも莫迦々々しい！」"
"207","sakaguchi","zenso.txt","「獣が獣に惚れたんですよ。"
"208","sakaguchi","zenso.txt","私だつて貴方の想像もつかない獣ですよ。"
"209","sakaguchi","zenso.txt","とにかく獣の方式でここをひとつやりとげてみやうと思つたわけですな。"
"210","sakaguchi","zenso.txt","やらない先に後悔してはいけなからうと思ふのですよ」"
"211","sakaguchi","zenso.txt","「禅問答のやうに仰有らないで下さいよ！五十円の結納金なら明らかに人間の方式ですぜ。"
"212","sakaguchi","zenso.txt","獣の方式なら今迄通り山の畑でお綱とねる方がいいでせう。"
"213","sakaguchi","zenso.txt","さうして、それ以上の名案は絶対にみつかりつこありませんや。"
"214","sakaguchi","zenso.txt","全くですよ！仰有る通り獣になりなさい、獣に。"
"215","sakaguchi","zenso.txt","人間にならうなんて飛んでもない考へ違ひだ！さうして今迄通りの交渉で満足することが第一です」"
"216","sakaguchi","zenso.txt","禅僧が自ら獣と言つた言葉を医者は面白いと思つた。"
"217","sakaguchi","zenso.txt","お綱の畑は村の西と北角の山ふところに十数町の距離をおいて散在したが、お綱の姿を探して段々畑をうろ／＼と距離一杯にうろついてゐる坊主の姿を山の人々は見馴れてゐた。"
"218","sakaguchi","zenso.txt","言はれた言葉で思ひだすと、飢えた狼のやうに見えた。"
"219","sakaguchi","zenso.txt","あまりに生々しく醜怪だと医者は舌打したのであつた。"
"220","sakaguchi","zenso.txt",""
"221","sakaguchi","zenso.txt",""
"222","sakaguchi","zenso.txt","然し坊主が自ら獣と言つた言葉は、医者が単純に肯定した程度の生やさしい内省から生れたものではなかつたのである。"
"223","sakaguchi","zenso.txt",""
"224","sakaguchi","zenso.txt","或る黄昏禅僧はお綱と二人でどんよりと澱んだ古沼のふちを通つてゐた。"
"225","sakaguchi","zenso.txt","突然お綱の手が彼の腰へ触つたやうな気がすると（実際は触らなかつたらしい）彼はもう古沼の中へ突き落されるのだと思つた。"
"226","sakaguchi","zenso.txt","悲鳴をあげるにも喉がつまつて叫びがでなかつた。"
"227","sakaguchi","zenso.txt","苦悶のために表情は歪み、足は竦んで動けなかつた。"
"228","sakaguchi","zenso.txt","ヒイ／＼といふ掠れた悲鳴が喉にうなつた。"
"229","sakaguchi","zenso.txt","これだけの物々しい前奏曲があつたために、お綱もつひ突き落す気持になつたのである。"
"230","sakaguchi","zenso.txt","それほどの力をいれて突いたわけでもなかつたのに、坊主はあつけなく古沼へ落ちた。"
"231","sakaguchi","zenso.txt","水の中での死にものぐるひの騒ぎといつたらなかつたのである。"
"232","sakaguchi","zenso.txt","死を怖れる最も大きな苦悶と醜体がかたどられてゐた。"
"233","sakaguchi","zenso.txt","坊主のもがいてゐた場所は岸から三尺ばかりのところで、落付いて腕をのばせば子供でも溺れる心配のない場所である。"
"234","sakaguchi","zenso.txt","彼が恐らく全身のエネルギーを使ひきつた証拠には、漸く岸へ這ひあがると、這ひあがつたなりの腹這ひの恰好のまま、だらしなくのびてしまつて這ひづることもできなかつた。"
"235","sakaguchi","zenso.txt","それを見ると、お綱の眼の光が全く変つた。"
"236","sakaguchi","zenso.txt","真剣なものが全身にみなぎり、亢奮のために胸がふくれ、急に顔に紅味がさした。"
"237","sakaguchi","zenso.txt","お綱は猿臂をのばして禅僧の襟首をとらへ、ずる／＼とひきづつて今度は真剣に古沼の中へ頭の方から押し込んでしまほふとしたのである。"
"238","sakaguchi","zenso.txt","禅僧はギャッといふ悲鳴をあげてお綱の片足にかぢりついた。"
"239","sakaguchi","zenso.txt","お綱よ、命だけは助けてくれ！死ぬのは怖い！禅僧の声は遠雷のやうに喉の奥でゴロゴロ鳴り、くひついた蠑※のやうにお綱の脛にぶらさがつて恐怖のあまり泣きだしてゐた。"
"240","sakaguchi","zenso.txt",""
"241","sakaguchi","zenso.txt","かういふ話もある。"
"242","sakaguchi","zenso.txt",""
"243","sakaguchi","zenso.txt","これは寺院の中で行はれた出来事。"
"244","sakaguchi","zenso.txt","お綱が眠りからさめて帰らうとするとホーゼがなかつた。"
"245","sakaguchi","zenso.txt","お綱のホーゼのことだから赤い色もさめはて、肉臭もしみ、よれ／＼の汚いものに相違ない。"
"246","sakaguchi","zenso.txt","禅僧をゆり起して出せと言つたが、彼は返事をしなかつた。"
"247","sakaguchi","zenso.txt",""
"248","sakaguchi","zenso.txt","お綱は突然激怒して禅僧を組敷き、後手にいましめた。"
"249","sakaguchi","zenso.txt","本堂へひきづりこみ、これを柱にくくしつけて、着物をビリ／＼ひき裂いて裸にしてしまつた。"
"250","sakaguchi","zenso.txt","仏壇から大きな蝋燭をとりおろして火を点けると、坊主の睾丸にいきなりこれを差しつけたといふ。"
"251","sakaguchi","zenso.txt","坊主の身体がいきなりはぢきあがつたのは申すまでもない話で、百本の足があるかのやうにバタ／＼ガタ／＼とやつた。"
"252","sakaguchi","zenso.txt","柱の廻りを腰から下の部分だけで必死に逃げまはりながら、ワア／＼ギャア／＼喚きたてたといつたらない。"
"253","sakaguchi","zenso.txt","喚きがどんなにひどかつたか、到頭一人の村人がききつけて寺の本堂へかけこんできた。"
"254","sakaguchi","zenso.txt","もがき、喚いてゐるのは裸体のまま柱にいましめられた坊主ひとり、大きな暗闇の中に蝋燭を握り、坊主の鼻先に小腰をかがめてゐるお綱の姿は微動もしてゐなかつた。"
"255","sakaguchi","zenso.txt","キラ／＼と光る眼付で坊主の顔をむしろボンヤリ視凝めてゐたさうである。"
"256","sakaguchi","zenso.txt",""
"257","sakaguchi","zenso.txt","結局坊主はホーゼを渡したかどうか？そのことは村人も各々の想像を働かすだけで区々である。"
"258","sakaguchi","zenso.txt",""
"259","sakaguchi","zenso.txt","然しかういふ話もあるのだ。"
"260","sakaguchi","zenso.txt",""
"261","sakaguchi","zenso.txt","ある年の暮れ村の青年が景気よく忘年会をやつた。"
"262","sakaguchi","zenso.txt","尤も雪の降る季節になると、若者と若い女は大概都会へその季節だけ出稼ぎに行く。"
"263","sakaguchi","zenso.txt","然しお綱は残つてゐた。"
"264","sakaguchi","zenso.txt","忘年会の会場は小学校の裁縫室、青年会と処女会の合流で、宴たけなはとなり余興がはじまつた。"
"265","sakaguchi","zenso.txt",""
"266","sakaguchi","zenso.txt","舞台ではにわかぢみた芝居が行はれ、お綱がこれに登場して妻君の役をやつてゐる。"
"267","sakaguchi","zenso.txt","芝居が一向につまらなくて皆々だれ気味になつてしまふと、一人の若者がいたづらを考へついた。"
"268","sakaguchi","zenso.txt","手拭ひを三宝にのせ、これに「よだれふき」と麗々しく認めた奴を敬々しく禅僧の前へ運んでいつたものである。"
"269","sakaguchi","zenso.txt","舞台ではお綱が人の妻君になつてせいぜい甘つたれてゐる芝居だから、さだめしよだれも流れませうといふあくどい洒落であつた。"
"270","sakaguchi","zenso.txt",""
"271","sakaguchi","zenso.txt","山奥の若者のことで咄嗟に洒落ものみこめない。"
"272","sakaguchi","zenso.txt","てんでんばらばらに漸くああさうかと分つて、あつちでクスリ、こつちでクスリ、一度にどつとはこなかつた。"
"273","sakaguchi","zenso.txt","そこであくどい男がもう一人、今度は洗面器を持つてきて、禅僧の膝の前へ置いたものだ。"
"274","sakaguchi","zenso.txt","さうして人々はどつと一時に笑ひころげた。"
"275","sakaguchi","zenso.txt",""
"276","sakaguchi","zenso.txt","禅僧は蒼白になつた。"
"277","sakaguchi","zenso.txt","全身がぶるぶるふるえた。"
"278","sakaguchi","zenso.txt","洗面器を掴んで投げつけやうとする気配が動きかけたほどであつたが、黙然と考へこんでしまつたのである。"
"279","sakaguchi","zenso.txt","然し急に立ち上つた。"
"280","sakaguchi","zenso.txt","さうして舞台へ歩いて行つた。"
"281","sakaguchi","zenso.txt","舞台では夫婦の二人が芝居を中止して下の騒ぎを呆気にとられて見てゐたのだが、舞台へ片足をかけると禅僧の全身に獣的な殺気が走つたのだつた。"
"282","sakaguchi","zenso.txt","彼はいきなり芝居の中の夫なる人物を舞台の下へ蹴倒した。"
"283","sakaguchi","zenso.txt","それからお綱の背中にまはり、お綱を羽掻ひじめにしてよろ／＼とうしろへ倒れ、腰に両足をまきつけてお綱を身動きもさせなかつた。"
"284","sakaguchi","zenso.txt",""
"285","sakaguchi","zenso.txt","一座はシンと静まつたが、禅僧は何事も叫ばなかつた。"
"286","sakaguchi","zenso.txt","叫ばないも道理、彼のくぼんだ眼玉は死人のやうに虚しく見開き、口はあんぐりとあけられたまま息も絶えたやうであつた。"
"287","sakaguchi","zenso.txt","暫く経て数名の人が舞台へ上つてみると、禅僧は折れ釘のやうなたど／＼しさでお綱にまきつけた身体をほぐし、ぼんやり立ちあがると、黙つて外へでてしまつた。"
"288","sakaguchi","zenso.txt",""
"289","sakaguchi","zenso.txt","禅僧はその夜も勿論、べつに自殺をするやうなことはなかつた。"
"290","sakaguchi","zenso.txt","翌日はけろりとして今迄通りの生活をつづけてゐたのだ。"
"291","sakaguchi","zenso.txt","かういふ姿が獣であるのは他人も無論、彼自らも先刻医者に述べてるやうに知らない筈はなかつたのである。"
"292","sakaguchi","zenso.txt","然しながらさういふ自分を意識すること、意識しながら生きつづけるといふことは、恐らく獣にはないことであらう。"
"293","sakaguchi","zenso.txt","もとよりそれがどうしたといふたいした理窟ではないのだ。"
"294","sakaguchi","zenso.txt",""
"295","sakaguchi","zenso.txt",""
"296","sakaguchi","zenso.txt","話を深刻めかしてはいけない。"
"297","sakaguchi","zenso.txt","北方の山国に雪が降ると、毎日々々同じ炉端に集まる人達が、よもやまの話をするさういふ話題のひとつである。"
"298","sakaguchi","zenso.txt",""
"299","sakaguchi","zenso.txt",""
"300","sakaguchi","zenso.txt",""
"301","sakaguchi","zenso.txt",""
"302","sakaguchi","zenso.txt","底本：「坂口安吾全集02」筑摩書房"
"303","sakaguchi","zenso.txt","1999（平成11）年4月20日初版第1刷発行"
"304","sakaguchi","zenso.txt","底本の親本：「作品第七巻第三号」"
"305","sakaguchi","zenso.txt","1936（昭和11）年3月1日発行"
"306","sakaguchi","zenso.txt","初出：「作品第七巻第三号」"
"307","sakaguchi","zenso.txt","1936（昭和11）年3月1日発行"
"308","sakaguchi","zenso.txt","入力：tatsuki"
"309","sakaguchi","zenso.txt","校正：今井忠夫"
"310","sakaguchi","zenso.txt","2005年12月10日作成"
"311","sakaguchi","zenso.txt","青空文庫作成ファイル："
"312","sakaguchi","zenso.txt","このファイルは、インターネットの図書館、青空文庫（http://www.aozora.gr.jp/）で作られました。"
"313","sakaguchi","zenso.txt","入力、校正、制作にあたったのは、ボランティアの皆さんです。"
"314","sakaguchi","zenso.txt",""
