"","auth","piece","line"
"987","mori","karafuto_datsugokuki.txt",""
"988","mori","karafuto_datsugokuki.txt","又少し歩くと、ヲロヂカがわたくしをこづいて、「どうも間違つてゐるね」と云ひました。"
"989","mori","karafuto_datsugokuki.txt",""
"990","mori","karafuto_datsugokuki.txt","「なぜ。"
"991","mori","karafuto_datsugokuki.txt","」"
"992","mori","karafuto_datsugokuki.txt","「ワルキまでは二十ヱルストだといふ事を聞いてゐた。"
"993","mori","karafuto_datsugokuki.txt","もうたしかに十八ヱルストは歩いてゐる。"
"994","mori","karafuto_datsugokuki.txt","うつかりしてゐると警戒線に打つ付かるぞ。"
"995","mori","karafuto_datsugokuki.txt","」"
"996","mori","karafuto_datsugokuki.txt","そこでわたくし共は爺いさんに声を掛けました。"
"997","mori","karafuto_datsugokuki.txt","「おい。"
"998","mori","karafuto_datsugokuki.txt","ブラン。"
"999","mori","karafuto_datsugokuki.txt","」"
"1000","mori","karafuto_datsugokuki.txt","「なんだい。"
"1001","mori","karafuto_datsugokuki.txt","」"
"1002","mori","karafuto_datsugokuki.txt","「もう追つ付けワルキに来るだらう。"
"1003","mori","karafuto_datsugokuki.txt","」"
"1004","mori","karafuto_datsugokuki.txt","「まだまだ。"
"1005","mori","karafuto_datsugokuki.txt","」"
"1006","mori","karafuto_datsugokuki.txt","かう云つて爺いさんは、ずん／＼歩くのです。"
"1007","mori","karafuto_datsugokuki.txt","実はこの時今少しで、大変な目に逢ふところでした。"
"1008","mori","karafuto_datsugokuki.txt","為合せな事には、わたくし共がふいと崖の所にボオトが一艘繋いであるのに気が付きました。"
"1009","mori","karafuto_datsugokuki.txt","そこで皆言ひ合せたやうに足を駐めたのです。"
"1010","mori","karafuto_datsugokuki.txt",""
"1011","mori","karafuto_datsugokuki.txt","マカロフが行きなりブランを掴まへて引き戻しました。"
"1012","mori","karafuto_datsugokuki.txt",""
"1013","mori","karafuto_datsugokuki.txt","どうも船があるからには、近所に人間がゐなくてはならないと思つたものですから、みんなで言ひ合せて、こつそり横道へ這入つて、森の中へ隠れました。"
"1014","mori","karafuto_datsugokuki.txt","これまで歩いて来た所は、河の縁で、河の両方の岸は茂つた森になつてゐるのです。"
"1015","mori","karafuto_datsugokuki.txt",""
"1016","mori","karafuto_datsugokuki.txt","一体樺太といふ所は、春の間いつも霧が立つてゐる所です。"
"1017","mori","karafuto_datsugokuki.txt","その日にも一面の霧が掛かつてゐました。"
"1018","mori","karafuto_datsugokuki.txt",""
"1019","mori","karafuto_datsugokuki.txt","丁度わたくし共が森の中の山道を登つて行つて、絶頂に近い所まで行つた時、風が出て谷の霧を海の方へ吹き払つたのです。"
"1020","mori","karafuto_datsugokuki.txt","その時警戒線の全体が、手の平へ乗せて見るやうに、目の前に見えたぢやありませんか。"
"1021","mori","karafuto_datsugokuki.txt",""
"1022","mori","karafuto_datsugokuki.txt","兵隊共は営庭でぶら／＼歩いてゐる。"
"1023","mori","karafuto_datsugokuki.txt","犬が何疋もそこらを嗅ぎ廻つてゐる。"
"1024","mori","karafuto_datsugokuki.txt","番兵は寝てゐるといふわけです。"
"1025","mori","karafuto_datsugokuki.txt",""
"1026","mori","karafuto_datsugokuki.txt","わたくし共は、ほつと息を衝きました。"
"1027","mori","karafuto_datsugokuki.txt","も少しでうつかりと狼の口の中へ駈け込むところだつたのですね。"
"1028","mori","karafuto_datsugokuki.txt",""
"1029","mori","karafuto_datsugokuki.txt","「おい。"
"1030","mori","karafuto_datsugokuki.txt","ブラン。"
"1031","mori","karafuto_datsugokuki.txt","どうしたのだい。"
"1032","mori","karafuto_datsugokuki.txt","あれは警戒線ぢやないか。"
"1033","mori","karafuto_datsugokuki.txt","」"
"1034","mori","karafuto_datsugokuki.txt","「さうさ。"
"1035","mori","karafuto_datsugokuki.txt","あれがワルキだ。"
"1036","mori","karafuto_datsugokuki.txt","」"
"1037","mori","karafuto_datsugokuki.txt","「お前おこつては行けないよ。"
"1038","mori","karafuto_datsugokuki.txt","お前は同志の内で一番年上だから、今まで皆がお前の指図を受ける積りでゐたのだが、どうもこれからは己達が自分で手筈をしなくてはなるまい。"
"1039","mori","karafuto_datsugokuki.txt","お前に任せてゐた日には、どこへ連れて行かれるか分からないからな。"
"1040","mori","karafuto_datsugokuki.txt","」"
"1041","mori","karafuto_datsugokuki.txt","「どうぞみんな勘忍してくれ。"
"1042","mori","karafuto_datsugokuki.txt","己は年を取つた。"
"1043","mori","karafuto_datsugokuki.txt","己は四十年この方流浪してゐる。"
"1044","mori","karafuto_datsugokuki.txt","もう駄目だ。"
"1045","mori","karafuto_datsugokuki.txt","己は時々物忘れをしてならない。"
"1046","mori","karafuto_datsugokuki.txt","物に依つては好く覚えてゐる事もあるが、外の事はまるで忘れてしまつてゐる。"
"1047","mori","karafuto_datsugokuki.txt","どうぞ勘忍してくれ。"
"1048","mori","karafuto_datsugokuki.txt","こゝは落ち着いてゐられる所ではない。"
"1049","mori","karafuto_datsugokuki.txt","早く逃げなくては駄目だ。"
"1050","mori","karafuto_datsugokuki.txt","あの警戒線の奴が誰か森の中へ這入つて来るか、犬が一疋嗅ぎ出して近寄つて来たら、この世はお暇乞だ。"
"1051","mori","karafuto_datsugokuki.txt","」"
"1052","mori","karafuto_datsugokuki.txt","そこでわたくし共は歩き出して、途中でブランに気を付けるやうに相談しました。"
"1053","mori","karafuto_datsugokuki.txt","わたくしはみんなに選ばれて案内者になりました。"
"1054","mori","karafuto_datsugokuki.txt","休む時の指図や、その外号令をしなくてはならないのです。"
"1055","mori","karafuto_datsugokuki.txt","尤も道はブランが知つて居る筈だといふので、先に立つて歩かせる事にしました。"
"1056","mori","karafuto_datsugokuki.txt","流浪人をしたものは皆足が丈夫で、体が一体に弱くなつても、足だけは利くものです。"
"1057","mori","karafuto_datsugokuki.txt","だからブランなんぞも、死ぬるまで歩く事だけは達者でした。"
"1058","mori","karafuto_datsugokuki.txt",""
"1059","mori","karafuto_datsugokuki.txt","大抵わたくし共は山道を選つて歩きました。"
"1060","mori","karafuto_datsugokuki.txt","足元の悪い代りに、危険が少ないのですね。"
"1061","mori","karafuto_datsugokuki.txt","山の中では木がざわざわ云つて、小河がちよろちよろ石の上を飛び越えて流れてゐるばかりで、人に逢はないから難有いのです。"
"1062","mori","karafuto_datsugokuki.txt","移住民も土人も大抵谷の方で、河や海の近い所に住んで、肴を取つて食つてゐます。"
"1063","mori","karafuto_datsugokuki.txt","殊に海は肴が沢山取れるのです。"
"1064","mori","karafuto_datsugokuki.txt","わたくし共も肴を手掴みにして取つた事がある位です。"
"1065","mori","karafuto_datsugokuki.txt",""
"1066","mori","karafuto_datsugokuki.txt","そんな風にして、どこまでも海岸を遠く放れないやうに気を付けて、ずん／＼逃げたのです。"
"1067","mori","karafuto_datsugokuki.txt","余り危険がないと思つて、じりじり海の方へ寄つて、とうとう岸を歩き出す。"
"1068","mori","karafuto_datsugokuki.txt","それから少し危険だと思ふと、又山の上に這ひ登るといふわけです。"
"1069","mori","karafuto_datsugokuki.txt","警戒線は、用心して遠廻りに除けて通りました。"
"1070","mori","karafuto_datsugokuki.txt","配り方はそれそれ違つてゐて、二十ヱルストを隔てて布いてあつたり、五十ヱルストを隔てて布いてあつたりするから、いつ出食はすか分からないのですね。"
"1071","mori","karafuto_datsugokuki.txt","為合せな事には、どれも旨く除けて通つて、とう／＼最後の警戒線まで来たのです。"
"1072","mori","karafuto_datsugokuki.txt","」"
"1073","mori","karafuto_datsugokuki.txt","――――――――――――"
"1074","mori","karafuto_datsugokuki.txt","ワシリはこゝまで話して間を置いた。"
"1075","mori","karafuto_datsugokuki.txt","それから暫くしてから、立ち上がつた。"
"1076","mori","karafuto_datsugokuki.txt",""
"1077","mori","karafuto_datsugokuki.txt","己は「なぜ跡を話さないのか」と云つた。"
"1078","mori","karafuto_datsugokuki.txt",""
"1079","mori","karafuto_datsugokuki.txt","「馬の世話をして遣らなくてはなりません。"
"1080","mori","karafuto_datsugokuki.txt","もう丁度好い時分でせう。"
"1081","mori","karafuto_datsugokuki.txt","行つてほどいて遣らうかと思ひます。"
"1082","mori","karafuto_datsugokuki.txt","」"
"1083","mori","karafuto_datsugokuki.txt","ワシリが中庭へ出るので、己も付いて出た。"
"1084","mori","karafuto_datsugokuki.txt",""
"1085","mori","karafuto_datsugokuki.txt","寒さが少しゆるんで、霧が低くなつた。"
"1086","mori","karafuto_datsugokuki.txt",""
"1087","mori","karafuto_datsugokuki.txt","ワシリは空を仰いで見た。"
"1088","mori","karafuto_datsugokuki.txt","「大ぶ星が高いやうです。"
"1089","mori","karafuto_datsugokuki.txt","もう夜中を過ぎたのでせう。"
"1090","mori","karafuto_datsugokuki.txt","」"
"1091","mori","karafuto_datsugokuki.txt","もう霧が遠い所を遮つてゐないので、今は近い部落の天幕がはつきり見える。"
"1092","mori","karafuto_datsugokuki.txt","部落は皆寝静まつてゐる。"
"1093","mori","karafuto_datsugokuki.txt","どの内の煙突からも白い煙が立つてゐる。"
"1094","mori","karafuto_datsugokuki.txt","稀には火の子が出て、寒空で消えるのもある。"
"1095","mori","karafuto_datsugokuki.txt","ヤクツク人は夜通し煖炉を焚いてゐるが、それでも温りは長くは持たない。"
"1096","mori","karafuto_datsugokuki.txt","だから夜中に寒くなると、誰か早く目の醒めたものが薪をくべ足すのである。"
"1097","mori","karafuto_datsugokuki.txt",""
"1098","mori","karafuto_datsugokuki.txt","ワシリは暫く黙つて立つて、部落の方を見てゐたが、溜息を衝いた。"
"1099","mori","karafuto_datsugokuki.txt","「久し振りで部落といふものを見ますね。"
"1100","mori","karafuto_datsugokuki.txt","もう大ぶ久しい間見ずにゐたのです。"
"1101","mori","karafuto_datsugokuki.txt","ヤクツク人は大抵固まつて住はないで、一人一人別な所に住ひますからね。"
"1102","mori","karafuto_datsugokuki.txt","わたくしもこつちの方へ越して来ませうか。"
"1103","mori","karafuto_datsugokuki.txt","こゝいらなら住み付かれるかも知れませんね。"
"1104","mori","karafuto_datsugokuki.txt","」"
"1105","mori","karafuto_datsugokuki.txt","「ふん。"
"1106","mori","karafuto_datsugokuki.txt","今お前さんのゐる所には住み付かれないのかね。"
"1107","mori","karafuto_datsugokuki.txt","田地を持つてゐるぢやないか。"
"1108","mori","karafuto_datsugokuki.txt","それにさつきも今の境遇に安んじてゐるやうに云つてゐたぢやないか。"
"1109","mori","karafuto_datsugokuki.txt","」"
"1110","mori","karafuto_datsugokuki.txt","ワシリは直ぐには答へなかつた。"
"1111","mori","karafuto_datsugokuki.txt","「どうも行けませんね。"
"1112","mori","karafuto_datsugokuki.txt","この辺の様子を見なければ好かつた。"
"1113","mori","karafuto_datsugokuki.txt","」"
"1114","mori","karafuto_datsugokuki.txt","ワシリは馬の側へ寄つて顔を見て、撫でて遣つた。"
"1115","mori","karafuto_datsugokuki.txt","賢い馬は顔を見返して嘶いた。"
"1116","mori","karafuto_datsugokuki.txt","ワシリは、さすりながらかう云つた。"
"1117","mori","karafuto_datsugokuki.txt","「よしよし。"
"1118","mori","karafuto_datsugokuki.txt","待つてゐろ。"
"1119","mori","karafuto_datsugokuki.txt","今に外して遣る。"
"1120","mori","karafuto_datsugokuki.txt","あした又働いてくれなくてはならないぞ。"
"1121","mori","karafuto_datsugokuki.txt","あしたは韃靼の馬と駈競をするのだ。"
"1122","mori","karafuto_datsugokuki.txt","」"
"1123","mori","karafuto_datsugokuki.txt","それから己の方に向いて云つた。"
"1124","mori","karafuto_datsugokuki.txt","「好い馬ですよ。"
"1125","mori","karafuto_datsugokuki.txt","わたくしが乗り馴らしました。"
"1126","mori","karafuto_datsugokuki.txt","どんな競馬馬と駈競をさせても好いのです。"
"1127","mori","karafuto_datsugokuki.txt","旋風のやうに走りますよ。"
"1128","mori","karafuto_datsugokuki.txt","」"
"1129","mori","karafuto_datsugokuki.txt","ワシリは繩を解いて枯草のある方へ馬を遣つた。"
"1130","mori","karafuto_datsugokuki.txt","己はワシリと一しよに天幕の内へ這入つた。"
"1131","mori","karafuto_datsugokuki.txt",""
"1132","mori","karafuto_datsugokuki.txt",""
"1133","mori","karafuto_datsugokuki.txt","七"
"1134","mori","karafuto_datsugokuki.txt",""
"1135","mori","karafuto_datsugokuki.txt","ワシリの顔は天幕に帰つてからも矢張不機嫌らしく見えた。"
"1136","mori","karafuto_datsugokuki.txt","そして話を為掛けてあるのを忘れたか、それとも跡を話したくなくなつたかと思はれる様子をしてゐる。"
"1137","mori","karafuto_datsugokuki.txt","そこで話の結末が聞きたいと云つて催促して見た。"
"1138","mori","karafuto_datsugokuki.txt",""
"1139","mori","karafuto_datsugokuki.txt","ワシリは機嫌を直さずに答へた。"
"1140","mori","karafuto_datsugokuki.txt","「なんの話す程の事があるものですか。"
"1141","mori","karafuto_datsugokuki.txt","どんな事を云つて好いか、分からなくなつてしまひました。"
"1142","mori","karafuto_datsugokuki.txt","兎に角随分ひどい目に逢つたのですよ。"
"1143","mori","karafuto_datsugokuki.txt","ああ。"
"1144","mori","karafuto_datsugokuki.txt","併し話し出したものですから話してしまはなくてはなりますまいなあ。"
"1145","mori","karafuto_datsugokuki.txt","」"
"1146","mori","karafuto_datsugokuki.txt","「それから十二日の間歩きましたが、まだ島の果までは行き付かなかつたのです。"
"1147","mori","karafuto_datsugokuki.txt","一体なら八日で、向岸へ越される筈なのですが、用心をしなくてはならないのと、案内者の好いのがないのとで、無駄をしたのです。"
"1148","mori","karafuto_datsugokuki.txt","海岸を歩けば平地であるのに、岩山に登つたり、谷合の沼を渡つたりして時間を費したのです。"
"1149","mori","karafuto_datsugokuki.txt","最初出立する時、十二日分の食物を用意したのですから、それもそろそろ無くなり掛かつて来ました。"
"1150","mori","karafuto_datsugokuki.txt","そこで一度分の分量を減らしました。"
"1151","mori","karafuto_datsugokuki.txt","堅パンの残つてゐるのを、成るたけ食べてしまはないやうにして、てんでに食物を捜して、それで飢を凌いだのです。"
"1152","mori","karafuto_datsugokuki.txt","森の中には木の実が沢山あるものですから、成るたけそれを取つて食べるやうにしました。"
"1153","mori","karafuto_datsugokuki.txt",""
"1154","mori","karafuto_datsugokuki.txt","そんな風にしてリマンといふ湾のある所へ出ました。"
"1155","mori","karafuto_datsugokuki.txt","この湾の水は常に鹹いのですが、時々黒竜江の水が押して来ると、淡水になつて、飲む事が出来るのです。"
"1156","mori","karafuto_datsugokuki.txt","こゝからボオトに乗つて出れば、黒竜江へ這入られるのです。"
"1157","mori","karafuto_datsugokuki.txt",""
"1158","mori","karafuto_datsugokuki.txt","どうしてボオトを手に入れようかと相談したところが、老人はもう疲れ果てゝ、目がどんよりしてゐて、なんの智慧も出ないのです。"
"1159","mori","karafuto_datsugokuki.txt","それでもとうとうかう云ひました。"
"1160","mori","karafuto_datsugokuki.txt",""
"1161","mori","karafuto_datsugokuki.txt","「どうせボオトは土人の持つてゐるのを手に入れるのだ。"
"1162","mori","karafuto_datsugokuki.txt","」"
"1163","mori","karafuto_datsugokuki.txt","これだけの事は云ひましたが、その土人をどこへ捜しに行つたら好いか、又土人の手から船を得るには、どういふ手段を取つたら好いかといふ事は、老人が教へてくれません。"
"1164","mori","karafuto_datsugokuki.txt",""
"1165","mori","karafuto_datsugokuki.txt","そこでヲロヂカとマカロフとわたくしとで、同志の者にかう云ひました。"
"1166","mori","karafuto_datsugokuki.txt",""
"1167","mori","karafuto_datsugokuki.txt","「おい。"
"1168","mori","karafuto_datsugokuki.txt","皆の者はこゝで待つてゐてくれ。"
"1169","mori","karafuto_datsugokuki.txt","己達はこの岸に沿うて歩いて見る。"
"1170","mori","karafuto_datsugokuki.txt","為合せが好かつたら、土人を見付けて、どうにかしてボオトを手に入れようと思ふ。"
"1171","mori","karafuto_datsugokuki.txt","二三艘もあれば結構だがさう行かなければ、一艘でも手に入れるやうにしよう。"
"1172","mori","karafuto_datsugokuki.txt","みんな用心してゐるのだぜ。"
"1173","mori","karafuto_datsugokuki.txt","この辺にも警戒線が布いてあるかも知れないから。"
"1174","mori","karafuto_datsugokuki.txt","」"
"1175","mori","karafuto_datsugokuki.txt","かう云つてみんなを残して置いて、わたくし共三人は岸を歩き出しました。"
"1176","mori","karafuto_datsugokuki.txt","少し歩いて岩のある所へ来ると、そこに網を繕つてゐる男がゐるのです。"
"1177","mori","karafuto_datsugokuki.txt","このオルクン奴をわたくし共に逢はせて下さつたのは、実に神のお恵みだと思ひます。"
"1178","mori","karafuto_datsugokuki.txt","」"
"1179","mori","karafuto_datsugokuki.txt","「なんだい。"
"1180","mori","karafuto_datsugokuki.txt","そのオルクンといふのは。"
"1181","mori","karafuto_datsugokuki.txt","その男の名かい。"
"1182","mori","karafuto_datsugokuki.txt","」"
"1183","mori","karafuto_datsugokuki.txt","「どうですかねえ。"
"1184","mori","karafuto_datsugokuki.txt","さういふ名だつたかも知れません。"
"1185","mori","karafuto_datsugokuki.txt","併しわたくしの察したところでは、どうもオルクンといふのは酋長といふ事らしかつたのです。"
"1186","mori","karafuto_datsugokuki.txt","兎に角何がなんだか分からなかつたのですけれども。"
"1187","mori","karafuto_datsugokuki.txt","わたくし共は、そいつを驚かして、逃がしてはならないと思つて、用心してそろそろ側へ寄りました。"
"1188","mori","karafuto_datsugokuki.txt","それから間が近くなつた時、突然側へ駈け付けて、その男を取り巻きました。"
"1189","mori","karafuto_datsugokuki.txt","その時そいつが指で自分の顔をさしてオルクン、オルクンといふのです。"
"1190","mori","karafuto_datsugokuki.txt",""
"1191","mori","karafuto_datsugokuki.txt","わたくし共はなんの事だか分かりませんが、こつちもどうかして用事を向うへ知らせて遣らうと思つて工夫をしました。"
"1192","mori","karafuto_datsugokuki.txt","とうとうヲロヂカが杖で砂の上へ、舶の形をかいて見せました。"
"1193","mori","karafuto_datsugokuki.txt","こんな物がいるといふ積りですね。"
"1194","mori","karafuto_datsugokuki.txt",""
"1195","mori","karafuto_datsugokuki.txt","さうすると、その男がちよつと考へてゐたが、直ぐに呑み込んで合点合点をしました。"
"1196","mori","karafuto_datsugokuki.txt","それから手の指を出して二本見せたり、五本見せたり、又十本皆見せたりしたのです。"
"1197","mori","karafuto_datsugokuki.txt","なんの積りだらうと、三人で相談しましたが、とうとうマカロフが暁りました。"
"1198","mori","karafuto_datsugokuki.txt",""
"1199","mori","karafuto_datsugokuki.txt","「おい。"
"1200","mori","karafuto_datsugokuki.txt","これは己達の仲間が何人ゐるかと問ふのだぜ。"
"1201","mori","karafuto_datsugokuki.txt","人数次第で、ボオトが幾ついるといふ事になるのだらう。"
"1202","mori","karafuto_datsugokuki.txt","」"
"1203","mori","karafuto_datsugokuki.txt","成程といふので、わたくし共は、そいつに十二といふ数を知らせました。"
"1204","mori","karafuto_datsugokuki.txt","それは直ぐに呑み込んでくれました。"
"1205","mori","karafuto_datsugokuki.txt",""
"1206","mori","karafuto_datsugokuki.txt","それからそいつが、こつちの仲間の所へ連れて行けと、手真似でいふのです。"
"1207","mori","karafuto_datsugokuki.txt","最初はどうしようかと思つて考へましたが、外にしやうがないので、連れて行く事にしました。"
"1208","mori","karafuto_datsugokuki.txt","どうも歩いて海は越されませんから、そいつに手伝つて、船を拵へて貰ふ外、為方がなかつたものですからね。"
"1209","mori","karafuto_datsugokuki.txt",""
"1210","mori","karafuto_datsugokuki.txt","同志の者も、わたくし共がその男を連れて来たのを見て、最初は不平らしい顔をしました。"
"1211","mori","karafuto_datsugokuki.txt",""
"1212","mori","karafuto_datsugokuki.txt","「なんだつてそんなものを引つ張つて来たのだい。"
"1213","mori","karafuto_datsugokuki.txt","それでは己達の隠家が知れてしまふぢやないか。"
"1214","mori","karafuto_datsugokuki.txt","」"
"1215","mori","karafuto_datsugokuki.txt","「黙つてゐろ。"
"1216","mori","karafuto_datsugokuki.txt","連れて来なくつてはならないから連れて来たのだ。"
"1217","mori","karafuto_datsugokuki.txt","」"
"1218","mori","karafuto_datsugokuki.txt","こんな事を言ひ合つてゐるのに、例の男は平気で同志の者の中に交つて、みんなの着てゐる上着を手で障つてゐるのです。"
"1219","mori","karafuto_datsugokuki.txt",""
"1220","mori","karafuto_datsugokuki.txt","そこでみんなで二重に持つてゐる上着を脱いで遣ると、男はそれを受け取つて、肩に掛けて、山道を下りて行くのです。"
"1221","mori","karafuto_datsugokuki.txt","わたくし共は跡から付いて行きました。"
"1222","mori","karafuto_datsugokuki.txt",""
"1223","mori","karafuto_datsugokuki.txt","少し行くと下の方に土人の天幕が並んでゐるのが見えました。"
"1224","mori","karafuto_datsugokuki.txt","小さな村なのです。"
"1225","mori","karafuto_datsugokuki.txt",""
"1226","mori","karafuto_datsugokuki.txt","同志の者はちよつと足を留めて心配し出しました。"
"1227","mori","karafuto_datsugokuki.txt","「どうしよう。"
"1228","mori","karafuto_datsugokuki.txt","あいつが村へ帰つて行くと村の者を呼び集めるかも知れないぜ。"
"1229","mori","karafuto_datsugokuki.txt","」"
"1230","mori","karafuto_datsugokuki.txt","わたくし共はかう云ひました。"
"1231","mori","karafuto_datsugokuki.txt","「構ふものか。"
"1232","mori","karafuto_datsugokuki.txt","あの天幕は四つある。"
"1233","mori","karafuto_datsugokuki.txt","中に何人づゝゐるとしても知れたものだ。"
"1234","mori","karafuto_datsugokuki.txt","こつちは同勢十二人、一人一人長さが四分の三アルシン位ある、立派なナイフを持つてゐるぢやないか。"
"1235","mori","karafuto_datsugokuki.txt","それにあいつらの体と、己達のやうな大男の体とは、比べものにならない。"
"1236","mori","karafuto_datsugokuki.txt","第一ロシア人は牛肉を食ふのに、あいつらは肴ばかり食つてゐやがる。"
"1237","mori","karafuto_datsugokuki.txt","どうする事が出来るものか。"
"1238","mori","karafuto_datsugokuki.txt","」"
"1239","mori","karafuto_datsugokuki.txt","かうは云つたものの、わたくし共は余り好い気持はしませんでした。"
"1240","mori","karafuto_datsugokuki.txt",""
"1241","mori","karafuto_datsugokuki.txt","兎に角島の果まで、漕ぎ付けて来た。"
"1242","mori","karafuto_datsugokuki.txt","併しあの向うの地平線に、青い帯のやうに見えてゐる、黒竜江の岸に渡つて、ほつと息を衝く事が出来るだらうか。"
"1243","mori","karafuto_datsugokuki.txt","鳥のやうに羽でも生えてくれれば好いと思つたのですね。"
"1244","mori","karafuto_datsugokuki.txt",""
"1245","mori","karafuto_datsugokuki.txt","暫く待つてゐると、大勢の土人が、オルクンを先に立てゝ、遣つて来ます。"
