"","auth","piece","line"
"1487","mori","karafuto_datsugokuki.txt","同志の者は漁をしてゐる二三の土人に出逢つて、その口からこの話を聞いた時、土人等は首を振つて、変な顔附をしました。"
"1488","mori","karafuto_datsugokuki.txt","その顔附は内々喜んでゐるといふ風に見えました。"
"1489","mori","karafuto_datsugokuki.txt","わたくし共は腹の内で思ひました。"
"1490","mori","karafuto_datsugokuki.txt","沢山笑ふが好い。"
"1491","mori","karafuto_datsugokuki.txt","己達はどうなるか分からない。"
"1492","mori","karafuto_datsugokuki.txt","事に依るとサルタノフの首の代りに、この首を取られるかも知れないと思ひました。"
"1493","mori","karafuto_datsugokuki.txt",""
"1494","mori","karafuto_datsugokuki.txt","土人はわたくし共に肴をくれて、こんな道もある、こんな道もあると逃道を教へてくれました。"
"1495","mori","karafuto_datsugokuki.txt","それを聞いてわたくし共は歩き出しました。"
"1496","mori","karafuto_datsugokuki.txt","なんだかおこつてゐる炭火の上を踏んで行くやうでした。"
"1497","mori","karafuto_datsugokuki.txt","物音がすると、一同びつくりする。"
"1498","mori","karafuto_datsugokuki.txt","人家があると、避けて通る。"
"1499","mori","karafuto_datsugokuki.txt","ロシア人に逢はないやうにする。"
"1500","mori","karafuto_datsugokuki.txt","自分の歩いて来た足跡を消して置く。"
"1501","mori","karafuto_datsugokuki.txt","実に大変な気苦労をしたものです。"
"1502","mori","karafuto_datsugokuki.txt",""
"1503","mori","karafuto_datsugokuki.txt","昼間は大抵森の中で寝て、夜になつてから歩き出します。"
"1504","mori","karafuto_datsugokuki.txt","そんな風にして歩いて、とう／＼、タルハノフの家のある所に、或る朝夜の明け切らない内に着きました。"
"1505","mori","karafuto_datsugokuki.txt",""
"1506","mori","karafuto_datsugokuki.txt","タルハノフの住ひは森の中にあつて、周囲には丈夫な垣が結つてあります。"
"1507","mori","karafuto_datsugokuki.txt","門は締めてありました。"
"1508","mori","karafuto_datsugokuki.txt","ブランの話したのは、これに相違ないと思ひましたから、門の側へ寄つて扉を叩きました。"
"1509","mori","karafuto_datsugokuki.txt",""
"1510","mori","karafuto_datsugokuki.txt","門の中では明りを点けて、それから「誰だ」と云ひました。"
"1511","mori","karafuto_datsugokuki.txt",""
"1512","mori","karafuto_datsugokuki.txt","「わたくし共は流浪人で、ブランといふ男からこちらのスタヘイ・ミトリツチユさんに言伝があつて来ました。"
"1513","mori","karafuto_datsugokuki.txt","」"
"1514","mori","karafuto_datsugokuki.txt","丁度その時支配人は留守で手助けをする男が留守番をしてゐました。"
"1515","mori","karafuto_datsugokuki.txt","支配人は出て行く時留守番にかういふ事を云ひ付けたさうです。"
"1516","mori","karafuto_datsugokuki.txt","「樺太から逃げて来たものがあつたら、一人に五ルウベルの金と靴を一足、毛皮を一枚、その外着物と食料とを望むだけ遣つてくれ。"
"1517","mori","karafuto_datsugokuki.txt","逃げて来たものは何人であつても、これだけの事は一人残らずして遣つてくれ。"
"1518","mori","karafuto_datsugokuki.txt","金や品物を渡す時には、雇つてある百姓共を呼び集めて、その目の前で渡して貰ひたい。"
"1519","mori","karafuto_datsugokuki.txt","さうすれば己が帰つた時、百姓共が証人になつて、己に安心させてくれる事が出来るのだ」と云つたさうです。"
"1520","mori","karafuto_datsugokuki.txt",""
"1521","mori","karafuto_datsugokuki.txt","この土地へもサルタノフが殺された話は、もう聞えてゐました。"
"1522","mori","karafuto_datsugokuki.txt","それですから留守番はわたくし共の顔を見て、気味を悪がつたやうでした。"
"1523","mori","karafuto_datsugokuki.txt","「サルタノフを遣つ付けたのはお前さん達だね。"
"1524","mori","karafuto_datsugokuki.txt","用心しないと危ないよ。"
"1525","mori","karafuto_datsugokuki.txt","」"
"1526","mori","karafuto_datsugokuki.txt","「そんな事をしたのが、わたくし共だらうと、さうでなからうと、それはどうでも好いでせう。"
"1527","mori","karafuto_datsugokuki.txt","兎に角あなたは、わたくし共に補助でもしてくれるのですか、どうですか。"
"1528","mori","karafuto_datsugokuki.txt","ブランがスタヘイ・ミトリツチユさんに宜しくと云ひましたよ。"
"1529","mori","karafuto_datsugokuki.txt","」"
"1530","mori","karafuto_datsugokuki.txt","「ブランはどこにゐるのだね。"
"1531","mori","karafuto_datsugokuki.txt","又樺太に遣られてゐるのですか。"
"1532","mori","karafuto_datsugokuki.txt","」"
"1533","mori","karafuto_datsugokuki.txt","「えゝ。"
"1534","mori","karafuto_datsugokuki.txt","樺太に葬られてゐるのです。"
"1535","mori","karafuto_datsugokuki.txt","」"
"1536","mori","karafuto_datsugokuki.txt","「おや／＼。"
"1537","mori","karafuto_datsugokuki.txt","あの男は正直な、善い男でしたよ。"
"1538","mori","karafuto_datsugokuki.txt","今でもスタヘイ・ミトリツチユさんが折々噂をしてゐます。"
"1539","mori","karafuto_datsugokuki.txt","きつと亡くなつた事を聞かれたら、ミサの供養でもして遣られる事でせう。"
"1540","mori","karafuto_datsugokuki.txt","一体あの男の本当の名はなんと云つたか、お前さん達は知つてゐますかね。"
"1541","mori","karafuto_datsugokuki.txt","」"
"1542","mori","karafuto_datsugokuki.txt","「いや。"
"1543","mori","karafuto_datsugokuki.txt","それは知りません。"
"1544","mori","karafuto_datsugokuki.txt","わたくし共は只ブランとばかり呼んでゐました。"
"1545","mori","karafuto_datsugokuki.txt","事に依ると、自分も本当の名を忘れてゐたかも知れません。"
"1546","mori","karafuto_datsugokuki.txt","流浪人にむづかしい名はいらないのですからね。"
"1547","mori","karafuto_datsugokuki.txt","」"
"1548","mori","karafuto_datsugokuki.txt","「それはさうだね。"
"1549","mori","karafuto_datsugokuki.txt","お前さん達の世渡は随分心細いわけだ。"
"1550","mori","karafuto_datsugokuki.txt","牧師さんが神様にお祈をして上げようと思つたつて、本当の名を知らないから、なんと云つて好いか分からない。"
"1551","mori","karafuto_datsugokuki.txt","ブランだつて、故郷もあつただらうし、親類もあつただらう。"
"1552","mori","karafuto_datsugokuki.txt","兄弟や姉妹があつたか。"
"1553","mori","karafuto_datsugokuki.txt","それとも可哀らしい子供もあつたかも知れない。"
"1554","mori","karafuto_datsugokuki.txt","」"
"1555","mori","karafuto_datsugokuki.txt","「それはあつたかも知れません。"
"1556","mori","karafuto_datsugokuki.txt","流浪人といふものは、洗礼の時に貰つた名を棄ててしまふ事はあるが、それだつて、外の人間と同じやうに母親が生んだには違ひないのですから。"
"1557","mori","karafuto_datsugokuki.txt","」"
"1558","mori","karafuto_datsugokuki.txt","「ほんにお前さん達は気の毒な世渡をしてゐるのですね。"
"1559","mori","karafuto_datsugokuki.txt","」"
"1560","mori","karafuto_datsugokuki.txt","「さやうさ。"
"1561","mori","karafuto_datsugokuki.txt","わたくし共のしてゐるより、みじめな世渡はありますまい。"
"1562","mori","karafuto_datsugokuki.txt","乞食をして、人に物を貰つて食べてゐる。"
"1563","mori","karafuto_datsugokuki.txt","着物だつて同じ事だ。"
"1564","mori","karafuto_datsugokuki.txt","それから死んだところで、墓一つ立てて貰ふ事は出来ない。"
"1565","mori","karafuto_datsugokuki.txt","森の中で死ねば、体は獣に食はれてしまふ。"
"1566","mori","karafuto_datsugokuki.txt","跡には日に曝されて、骨が残るばかりです。"
"1567","mori","karafuto_datsugokuki.txt","無論みじめな世渡と云はなくてはなりますまいよ。"
"1568","mori","karafuto_datsugokuki.txt","」"
"1569","mori","karafuto_datsugokuki.txt","わたくし共の話を聞いて、留守番は余程気の毒に思つたものと見えます。"
"1570","mori","karafuto_datsugokuki.txt","シベリア人は気の毒にさへ思ひ始めれば、物惜しみはしなくなります。"
"1571","mori","karafuto_datsugokuki.txt","わたくし共も、自分で自分の事を話しながら、感動して来ました。"
"1572","mori","karafuto_datsugokuki.txt","この留守番なんぞは、今こつちに同情してゐてくれても、直ぐに欠伸をして寝に這入つてしまふだらう。"
"1573","mori","karafuto_datsugokuki.txt","食べたい程物を食べて、暖かい床に這入つて寝るだらう。"
"1574","mori","karafuto_datsugokuki.txt","こつちはこれから踏み出して、人に隠れて悪病に罹かつた獣か、夜明方の幽霊のやうに、暗い森の中を迷ひ歩かなくてはならないのだと思つたのです。"
"1575","mori","karafuto_datsugokuki.txt",""
"1576","mori","karafuto_datsugokuki.txt","留守番はかう云ひました。"
"1577","mori","karafuto_datsugokuki.txt","「そこでわたしはもう寝なくてはならん。"
"1578","mori","karafuto_datsugokuki.txt","こゝの支配人の言ひ置かれただけのものは、相違なくお前さん達に上げる。"
"1579","mori","karafuto_datsugokuki.txt","それからわたしの手から、一人前二十銭づつ添へて上げる。"
"1580","mori","karafuto_datsugokuki.txt","どうぞそれで帰つて下さい。"
"1581","mori","karafuto_datsugokuki.txt","今頃百姓共を皆起す事は止めにしよう。"
"1582","mori","karafuto_datsugokuki.txt","こゝに三人だけは起きてゐて、それが正直な人達だから、跡で証人にするには十分だらう。"
"1583","mori","karafuto_datsugokuki.txt","お前さん達に、長く足を留めてゐられると、こつちも一しよに迷惑をする事になるかも知れない。"
"1584","mori","karafuto_datsugokuki.txt","悪い事は云はないから、ニコラエウスクへは寄らないが好い。"
"1585","mori","karafuto_datsugokuki.txt","あそこには厳しい裁判所長がゐる。"
"1586","mori","karafuto_datsugokuki.txt","通り抜ける旅人を一々調べる。"
"1587","mori","karafuto_datsugokuki.txt","鵲一羽でも、兎一疋でも、己の前は素通りはさせない。"
"1588","mori","karafuto_datsugokuki.txt","樺太から来た奴なんぞを見※してなるものかと、不断言つてゐるさうだ。"
"1589","mori","karafuto_datsugokuki.txt","あの辺を旨く通り抜ける事が出来たら、運が好かつたのだと思ひなさい。"
"1590","mori","karafuto_datsugokuki.txt","市中なんぞへ鼻を突つ込んではなりませんよ。"
"1591","mori","karafuto_datsugokuki.txt","」"
"1592","mori","karafuto_datsugokuki.txt","留守番は主人の云ひ付けた通りの金や品物を出して、それに自分の手から二十銭づつ出して添へてくれました。"
"1593","mori","karafuto_datsugokuki.txt","それから肴をくれました。"
"1594","mori","karafuto_datsugokuki.txt","そして十字を切つて、自分の部屋へ引つ込んで戸を締めてしまひました。"
"1595","mori","karafuto_datsugokuki.txt","その内一度｜点けた明りを消した様子で、構内は又ひつそりと寝鎮まりました。"
"1596","mori","karafuto_datsugokuki.txt","まだ夜の明け切るには間があつたのです。"
"1597","mori","karafuto_datsugokuki.txt","わたくし共は、そこを出掛けましたが、一同なんとなく物悲しいやうな心持がしてゐました。"
"1598","mori","karafuto_datsugokuki.txt",""
"1599","mori","karafuto_datsugokuki.txt","一体流浪人の心の内には、折々深い悲哀が起るものです。"
"1600","mori","karafuto_datsugokuki.txt","闇の夜や、茂つた森が周囲を包む。"
"1601","mori","karafuto_datsugokuki.txt","雨が濡れ通る。"
"1602","mori","karafuto_datsugokuki.txt","それを風が吹いたり、日が当つたりして、又乾かす。"
"1603","mori","karafuto_datsugokuki.txt","広い世界にどこと云つて、自分の安心して休む所はない。"
"1604","mori","karafuto_datsugokuki.txt","故郷の事は始終恋しく思つてゐるが、さて色々な難儀をしたり危険を冒したりして、そこへ帰つて見れば、犬でさへ直ぐに流浪人だといふ事を見て取るのです。"
"1605","mori","karafuto_datsugokuki.txt","それにお役所は厳しい。"
"1606","mori","karafuto_datsugokuki.txt","やつと故郷へ帰つたと思ふと、又牢屋に入れられてしまふのですね。"
"1607","mori","karafuto_datsugokuki.txt",""
"1608","mori","karafuto_datsugokuki.txt","それでもどうかするとその牢屋の中が、今ゐる所に比べれば、却て天国のやうだと思ふ事があります。"
"1609","mori","karafuto_datsugokuki.txt","タルハノフの家を出て、夜道を歩いた時なんぞが、丁度さういふ場合でした。"
"1610","mori","karafuto_datsugokuki.txt",""
"1611","mori","karafuto_datsugokuki.txt","わたくし共は皆黙つて歩いてゐました。"
"1612","mori","karafuto_datsugokuki.txt","その時、ヲロヂカがふいとかう云ひました。"
"1613","mori","karafuto_datsugokuki.txt","「どうだい。"
"1614","mori","karafuto_datsugokuki.txt","今時分仲間はどうしてゐるだらう。"
"1615","mori","karafuto_datsugokuki.txt","」"
"1616","mori","karafuto_datsugokuki.txt","「仲間とは誰の事だい。"
"1617","mori","karafuto_datsugokuki.txt","」"
"1618","mori","karafuto_datsugokuki.txt","「あの樺太の第七号舎に残して置いた仲間さ。"
"1619","mori","karafuto_datsugokuki.txt","あいつらは今時分安心して寝てゐるだらう。"
"1620","mori","karafuto_datsugokuki.txt","それにこつちとらは、こんなに迷ひ歩くのだ。"
"1621","mori","karafuto_datsugokuki.txt","逃げなければ好かつたになあ。"
"1622","mori","karafuto_datsugokuki.txt","」"
"1623","mori","karafuto_datsugokuki.txt","あんまり下らない事を言ふと思つて、わたくしはヲロヂカを叱つて遣りました。"
"1624","mori","karafuto_datsugokuki.txt","「そんな婆あさんか何かのいふやうな事を言つて恥かしくはないかい。"
"1625","mori","karafuto_datsugokuki.txt","お前そんなに意気地がなくて、外の人をまで臆病仲間に引き入れさうにするなら、己達と一しよに出て来なければ好かつたのだ。"
"1626","mori","karafuto_datsugokuki.txt","」"
"1627","mori","karafuto_datsugokuki.txt","かうは云つたものゝ、わたくしも気は引き立ちませんでした。"
"1628","mori","karafuto_datsugokuki.txt","一同疲れ切つてゐます。"
"1629","mori","karafuto_datsugokuki.txt","半分眠りながら歩いてゐるのです。"
"1630","mori","karafuto_datsugokuki.txt","流浪人になると、眠りながら歩く事を覚えます。"
"1631","mori","karafuto_datsugokuki.txt","不思議な事には、こんな時にちよいとでも眠ると、直ぐに牢屋にゐる夢を見るものです。"
"1632","mori","karafuto_datsugokuki.txt","月が差し込んで、壁を薄白く照らしてゐると、格子窓の奥の寝台の上に、囚人が寝てゐるのが見える。"
"1633","mori","karafuto_datsugokuki.txt","その内自分もその囚人の一人のやうに思つて、寝台の上で伸びをする。"
"1634","mori","karafuto_datsugokuki.txt","それで夢が醒めるのです。"
"1635","mori","karafuto_datsugokuki.txt",""
"1636","mori","karafuto_datsugokuki.txt","そんな夢ならまだ好いが、夢の中で親父や母親に出て来られては溜まりません。"
"1637","mori","karafuto_datsugokuki.txt","そんな時はわたくしの身の上には、まだ何事もなく、牢に這入つた事もなく、樺太に行つた事もなく、警戒線の兵隊と戦つた事もないのです。"
"1638","mori","karafuto_datsugokuki.txt","わたくしは親の家にゐて、母が髪を撫で付けてくれてゐます。"
"1639","mori","karafuto_datsugokuki.txt","卓の上にはランプが点いてゐる。"
"1640","mori","karafuto_datsugokuki.txt","親父は鼻の上に目金を引つ掛けて、難有さうな本を読んでゐます。"
"1641","mori","karafuto_datsugokuki.txt","わたくしの親父は、人に本を読んで聞かせる男でした。"
"1642","mori","karafuto_datsugokuki.txt","母が小歌を歌ひ出します。"
"1643","mori","karafuto_datsugokuki.txt",""
"1644","mori","karafuto_datsugokuki.txt","こんな夢を見て目の醒めた時は溜まりません。"
"1645","mori","karafuto_datsugokuki.txt","なんだか胸に小刀が刺してあるやうな気がします。"
"1646","mori","karafuto_datsugokuki.txt","そんなしんみりした、気楽な部屋の中から、突然真つ暗な森の中へ出たやうに思ふのですからね。"
"1647","mori","karafuto_datsugokuki.txt",""
"1648","mori","karafuto_datsugokuki.txt","真つ先をマカロフが歩いてゐます。"
"1649","mori","karafuto_datsugokuki.txt","その跡へ一同続いて、丁度村の子供の跡に付いて、鶩が行列をして行くやうに、一人一人跡先に並んで行くのですね。"
"1650","mori","karafuto_datsugokuki.txt","折々風が吹いて来て、森の木の葉が囁くやうな音を立てゝ、直ぐに又ひつそりします。"
"1651","mori","karafuto_datsugokuki.txt","遠い所に、木の葉の間から海が見えます。"
"1652","mori","karafuto_datsugokuki.txt","その上には空が広がつてゐます。"
"1653","mori","karafuto_datsugokuki.txt","その空のずつと先の地平線の所が、ぼんやり赤くなつてゐる。"
"1654","mori","karafuto_datsugokuki.txt","今少しすると日が出るといふ印ですね。"
"1655","mori","karafuto_datsugokuki.txt","海の見えるやうな所では、波の音が聞え止む事はありません。"
"1656","mori","karafuto_datsugokuki.txt","どこかの余所の国の歌を歌ふやうな時もあり、又腹を立てゝどなつてゐるやうな時もあります。"
"1657","mori","karafuto_datsugokuki.txt","海の歌を歌ふ声は、よく夢にも聞えます。"
"1658","mori","karafuto_datsugokuki.txt","流浪人は海を見ると、胸に係恋を覚えます。"
"1659","mori","karafuto_datsugokuki.txt","大抵海には縁の遠い世渡をしてゐますからね。"
"1660","mori","karafuto_datsugokuki.txt",""
"1661","mori","karafuto_datsugokuki.txt","わたくし共は段々ニコラエウスクに近づいて来ました。"
"1662","mori","karafuto_datsugokuki.txt","次第に人家や部落が多くなります。"
"1663","mori","karafuto_datsugokuki.txt","随つて次第に危険になつて来るのです。"
"1664","mori","karafuto_datsugokuki.txt","わたくし共は用心してそろ／＼町の方へ忍び寄ります。"
"1665","mori","karafuto_datsugokuki.txt","夜になると歩いて、昼間は、人間どころではない、獣もゐないやうな森の茂みに隠れてゐるのです。"
"1666","mori","karafuto_datsugokuki.txt",""
"1667","mori","karafuto_datsugokuki.txt","一体わたくし共はずつと大きい輪をかいて、ニコラエウスクの側へ寄らないやうにする積りでした。"
"1668","mori","karafuto_datsugokuki.txt","ところが体が疲れてゐて、遠道が歩きたくないのと、食料が段々乏しくなつたのとで、どうもさうしてはゐられなくなつたのです。"
"1669","mori","karafuto_datsugokuki.txt",""
"1670","mori","karafuto_datsugokuki.txt","或る日の夕方河の岸に出ました。"
"1671","mori","karafuto_datsugokuki.txt","そこに人が集つてゐます。"
"1672","mori","karafuto_datsugokuki.txt","何ものだらうと思つて、好く見ると監視中の囚人です。"
"1673","mori","karafuto_datsugokuki.txt","（ロシアでは懲役になつて、刑期が過ぎ去ると、それそれの村に返して監視して置く。"
"1674","mori","karafuto_datsugokuki.txt","併し労働は監視を受けて規則通りにしてゐる。"
"1675","mori","karafuto_datsugokuki.txt","）それが肴を取つてゐます。"
"1676","mori","karafuto_datsugokuki.txt","わたくし共はその様子を見定めてから側へ寄つて行きました。"
"1677","mori","karafuto_datsugokuki.txt","「おい、どうだね。"
"1678","mori","karafuto_datsugokuki.txt","」"
"1679","mori","karafuto_datsugokuki.txt","「うん、どこから来たのだい。"
"1680","mori","karafuto_datsugokuki.txt","」"
"1681","mori","karafuto_datsugokuki.txt","こんな風に詞を交して、いろんな事を話す内に、その仲間の一番年上の奴が、わたくしを側へ呼んでかう云ふのです。"
"1682","mori","karafuto_datsugokuki.txt","「お前、樺太を脱けて来たのだらう。"
"1683","mori","karafuto_datsugokuki.txt","あのサルタノフを遣つ付けた連中だらう。"
"1684","mori","karafuto_datsugokuki.txt","」"
"1685","mori","karafuto_datsugokuki.txt","正直を云へば、この時わたくしは本当の事を直ぐに云ひにくいやうに思つたのです。"
"1686","mori","karafuto_datsugokuki.txt","勿論相手も同じ罪人ではあるが、物に依つては打ち明けにくい事もあります。"
"1687","mori","karafuto_datsugokuki.txt","殊に監視中の人間は、本当の囚人仲間とは違ひます。"
"1688","mori","karafuto_datsugokuki.txt","この年上の男にしろ、その外の男にしろ、役人の機嫌が取りたいと思へば、直ぐに行つてわたくし共の事を密告する事が出来ます。"
"1689","mori","karafuto_datsugokuki.txt","自分達は兎に角或る自由を得てゐるのですからね。"
"1690","mori","karafuto_datsugokuki.txt","同じ牢屋の中に這入つてゐれば、密告をした奴は分かるから、そんな事は出来ない。"
"1691","mori","karafuto_datsugokuki.txt","こんな手放しにしてある人間は、さういふわけには行きません。"
"1692","mori","karafuto_datsugokuki.txt",""
"1693","mori","karafuto_datsugokuki.txt","わたくしが少し詞を控へてゐるのを見て、相手は直ぐにわたくしの腹の中を見透かしてしまひました。"
"1694","mori","karafuto_datsugokuki.txt",""
"1695","mori","karafuto_datsugokuki.txt","「己をこはがるのぢやないぞ。"
"1696","mori","karafuto_datsugokuki.txt","己は仲間の告口をするやうな人間ではない。"
"1697","mori","karafuto_datsugokuki.txt","それに何も己の関係した事ぢやあるまいし。"
"1698","mori","karafuto_datsugokuki.txt","町ではもうあの一件を知らないものはない。"
"1699","mori","karafuto_datsugokuki.txt","それにお前方を見れば、丁度同勢十一人だ。"
"1700","mori","karafuto_datsugokuki.txt","余り智恵がなくつても、その連中だらうといふ事は分かつてしまふ。"
"1701","mori","karafuto_datsugokuki.txt","その辺にうろ付いてゐると、ひどく危ないぜ。"
"1702","mori","karafuto_datsugokuki.txt","あの事件は大騒ぎになつてゐる。"
"1703","mori","karafuto_datsugokuki.txt","こゝの裁判所長は恐ろしく厳しいのだ。"
"1704","mori","karafuto_datsugokuki.txt","まあ、どうしてこゝを切り抜けるか、それはお前方の事だが、旨く行つたら大したものだ。"
"1705","mori","karafuto_datsugokuki.txt","幸ひ己達は少し食料も余計に持つてゐるから、町へ帰つたら、パンや肴を少し位、お前方に分けて遣らう。"
"1706","mori","karafuto_datsugokuki.txt","鍋なんぞもいりはしないか。"
"1707","mori","karafuto_datsugokuki.txt","」"
"1708","mori","karafuto_datsugokuki.txt","「さうだね。"
"1709","mori","karafuto_datsugokuki.txt","若しお前の方で不用な鍋でもあれば難有いが。"
"1710","mori","karafuto_datsugokuki.txt","」"
"1711","mori","karafuto_datsugokuki.txt","「好い。"
"1712","mori","karafuto_datsugokuki.txt","遣るとしよう。"
"1713","mori","karafuto_datsugokuki.txt","まだ何か思付いたものがあつたら、一しよに纏めて、晩に持ち出して遣る。"
"1714","mori","karafuto_datsugokuki.txt","仲間は助けて遣らなくてはならないからな。"
"1715","mori","karafuto_datsugokuki.txt","」"
"1716","mori","karafuto_datsugokuki.txt","わたくし共はこの話をしてから、重荷を卸したやうな気がしました。"
"1717","mori","karafuto_datsugokuki.txt","そこで帽を脱いで、その男に礼を言ふと、同志の者も皆帽を脱ぎました。"
"1718","mori","karafuto_datsugokuki.txt","段々乏しくなつて来た食料をくれるといふのも難有いが、それよりはこの男の親切な詞が嬉しかつたのです。"
"1719","mori","karafuto_datsugokuki.txt","どの人間もどの人間も、わたくし共に対しては禍の種で、悪くすると命まで取り兼ねないから、わたくし共は避けるやうにしてゐる。"
