"","auth","piece","line"
"190","mori","maihime.txt","彼は幼き時より物読むことをば流石に好みしかど、手に入るは卑しき「コルポルタアジユ」と唱ふる貸本屋の小説のみなりしを、余と相識る頃より、余が借しつる書を読みならひて、漸く趣味をも知り、言葉の訛をも正し、いくほどもなく余に寄するふみにも誤字少なくなりぬ。"
"191","mori","maihime.txt","かゝれば余等二人の間には先づ師弟の交りを生じたるなりき。"
"192","mori","maihime.txt","我が不時の免官を聞きしときに、彼は色を失ひつ。"
"193","mori","maihime.txt","余は彼が身の事に関りしを包み隠しぬれど、彼は余に向ひて母にはこれを秘め玉へと云ひぬ。"
"194","mori","maihime.txt","こは母の余が学資を失ひしを知りて余を疎んぜんを恐れてなり。"
"195","mori","maihime.txt",""
"196","mori","maihime.txt","嗚呼、委くこゝに写さんも要なけれど、余が彼を愛づる心の俄に強くなりて、遂に離れ難き中となりしは此折なりき。"
"197","mori","maihime.txt","我一身の大事は前に横りて、洵に危急存亡の秋なるに、この行ありしをあやしみ、又た誹る人もあるべけれど、余がエリスを愛する情は、始めて相見し時よりあさくはあらぬに、いま我｜数奇を憐み、又別離を悲みて伏し沈みたる面に、鬢の毛の解けてかゝりたる、その美しき、いぢらしき姿は、余が悲痛感慨の刺激によりて常ならずなりたる脳髄を射て、恍惚の間にこゝに及びしを奈何にせむ。"
"198","mori","maihime.txt",""
"199","mori","maihime.txt","公使に約せし日も近づき、我｜命はせまりぬ。"
"200","mori","maihime.txt","このまゝにて郷にかへらば、学成らずして汚名を負ひたる身の浮ぶ瀬あらじ。"
"201","mori","maihime.txt","さればとて留まらんには、学資を得べき手だてなし。"
"202","mori","maihime.txt",""
"203","mori","maihime.txt","此時余を助けしは今我同行の一人なる相沢謙吉なり。"
"204","mori","maihime.txt","彼は東京に在りて、既に天方伯の秘書官たりしが、余が免官の官報に出でしを見て、某新聞紙の編輯長に説きて、余を社の通信員となし、伯林に留まりて政治学芸の事などを報道せしむることとなしつ。"
"205","mori","maihime.txt",""
"206","mori","maihime.txt","社の報酬はいふに足らぬほどなれど、棲家をもうつし、午餐に往く食店をもかへたらんには、微なる暮しは立つべし。"
"207","mori","maihime.txt","兎角思案する程に、心の誠を顕はして、助の綱をわれに投げ掛けしはエリスなりき。"
"208","mori","maihime.txt","かれはいかに母を説き動かしけん、余は彼等親子の家に寄寓することゝなり、エリスと余とはいつよりとはなしに、有るか無きかの収入を合せて、憂きがなかにも楽しき月日を送りぬ。"
"209","mori","maihime.txt",""
"210","mori","maihime.txt","朝の※※果つれば、彼は温習に往き、さらぬ日には家に留まりて、余はキヨオニヒ街の間口せまく奥行のみいと長き休息所に赴き、あらゆる新聞を読み、鉛筆取り出でゝ彼此と材料を集む。"
"211","mori","maihime.txt","この截り開きたる引※より光を取れる室にて、定りたる業なき若人、多くもあらぬ金を人に借して己れは遊び暮す老人、取引所の業の隙を偸みて足を休むる商人などと臂を並べ、冷なる石卓の上にて、忙はしげに筆を走らせ、小をんなが持て来る一盞の※※の冷むるをも顧みず、明きたる新聞の細長き板ぎれに※みたるを、幾種となく掛け聯ねたるかたへの壁に、いく度となく往来する日本人を、知らぬ人は何とか見けん。"
"212","mori","maihime.txt","又一時近くなるほどに、温習に往きたる日には返り路によぎりて、余と倶に店を立出づるこの常ならず軽き、掌上の舞をもなしえつべき少女を、怪み見送る人もありしなるべし。"
"213","mori","maihime.txt",""
"214","mori","maihime.txt","我学問は荒みぬ。"
"215","mori","maihime.txt","屋根裏の一燈微に燃えて、エリスが劇場よりかへりて、椅に寄りて縫ものなどする側の机にて、余は新聞の原稿を書けり。"
"216","mori","maihime.txt","昔しの法令条目の枯葉を紙上に掻寄せしとは殊にて、今は活溌々たる政界の運動、文学美術に係る新現象の批評など、彼此と結びあはせて、力の及ばん限り、ビヨルネよりは寧ろハイネを学びて思を構へ、様々の文を作りし中にも、引続きて維廉一世と仏得力三世との崩※ありて、新帝の即位、ビスマルク侯の進退｜如何などの事に就ては、故らに詳かなる報告をなしき。"
"217","mori","maihime.txt","さればこの頃よりは思ひしよりも忙はしくして、多くもあらぬ蔵書を繙き、旧業をたづぬることも難く、大学の籍はまだ刪られねど、謝金を収むることの難ければ、唯だ一つにしたる講筵だに往きて聴くことは稀なりき。"
"218","mori","maihime.txt",""
"219","mori","maihime.txt","我学問は荒みぬ。"
"220","mori","maihime.txt","されど余は別に一種の見識を長じき。"
"221","mori","maihime.txt","そをいかにといふに、凡そ民間学の流布したることは、欧洲諸国の間にて独逸に若くはなからん。"
"222","mori","maihime.txt","幾百種の新聞雑誌に散見する議論には頗る高尚なるもの多きを、余は通信員となりし日より、曾て大学に繁く通ひし折、養ひ得たる一隻の眼孔もて、読みては又読み、写しては又写す程に、今まで一筋の道をのみ走りし知識は、自ら綜括的になりて、同郷の留学生などの大かたは、夢にも知らぬ境地に到りぬ。"
"223","mori","maihime.txt","彼等の仲間には独逸新聞の社説をだに善くはえ読まぬがあるに。"
"224","mori","maihime.txt",""
"225","mori","maihime.txt","明治廿一年の冬は来にけり。"
"226","mori","maihime.txt","表街の人道にてこそ沙をも蒔け、※のつくり」、161-下-29］をも揮へ、クロステル街のあたりは凸凹坎※の処は見ゆめれど、表のみは一面に氷りて、朝に戸を開けば飢ゑ凍えし雀の落ちて死にたるも哀れなり。"
"227","mori","maihime.txt","室を温め、竈に火を焚きつけても、壁の石を徹し、衣の綿を穿つ北欧羅巴の寒さは、なか／＼に堪へがたかり。"
"228","mori","maihime.txt","エリスは二三日前の夜、舞台にて卒倒しつとて、人に扶けられて帰り来しが、それより心地あしとて休み、もの食ふごとに吐くを、悪阻といふものならんと始めて心づきしは母なりき。"
"229","mori","maihime.txt","嗚呼、さらぬだに覚束なきは我身の行末なるに、若し真なりせばいかにせまし。"
"230","mori","maihime.txt",""
"231","mori","maihime.txt","今朝は日曜なれば家に在れど、心は楽しからず。"
"232","mori","maihime.txt","エリスは床に臥すほどにはあらねど、小き鉄炉の畔に椅子さし寄せて言葉｜寡し。"
"233","mori","maihime.txt","この時戸口に人の声して、程なく庖厨にありしエリスが母は、郵便の書状を持て来て余にわたしつ。"
"234","mori","maihime.txt","見れば見覚えある相沢が手なるに、郵便切手は普魯西のものにて、消印には伯林とあり。"
"235","mori","maihime.txt","訝りつゝも披きて読めば、とみの事にて預め知らするに由なかりしが、昨夜こゝに着せられし天方大臣に附きてわれも来たり。"
"236","mori","maihime.txt","伯の汝を見まほしとのたまふに疾く来よ。"
"237","mori","maihime.txt","汝が名誉を恢復するも此時にあるべきぞ。"
"238","mori","maihime.txt","心のみ急がれて用事をのみいひ遣るとなり。"
"239","mori","maihime.txt","読み畢りて茫然たる面もちを見て、エリス云ふ。"
"240","mori","maihime.txt","「故郷よりの文なりや。"
"241","mori","maihime.txt","悪しき便にてはよも。"
"242","mori","maihime.txt","」彼は例の新聞社の報酬に関する書状と思ひしならん。"
"243","mori","maihime.txt","「否、心にな掛けそ。"
"244","mori","maihime.txt","おん身も名を知る相沢が、大臣と倶にこゝに来てわれを呼ぶなり。"
"245","mori","maihime.txt","急ぐといへば今よりこそ。"
"246","mori","maihime.txt","」"
"247","mori","maihime.txt","かはゆき独り子を出し遣る母もかくは心を用ゐじ。"
"248","mori","maihime.txt","大臣にまみえもやせんと思へばならん、エリスは病をつとめて起ち、上襦袢も極めて白きを撰び、丁寧にしまひ置きし「ゲエロツク」といふ二列ぼたんの服を出して着せ、襟飾りさへ余が為めに手づから結びつ。"
"249","mori","maihime.txt",""
"250","mori","maihime.txt","「これにて見苦しとは誰れも得言はじ。"
"251","mori","maihime.txt","我鏡に向きて見玉へ。"
"252","mori","maihime.txt","何故にかく不興なる面もちを見せ玉ふか。"
"253","mori","maihime.txt","われも諸共に行かまほしきを。"
"254","mori","maihime.txt","」少し容をあらためて。"
"255","mori","maihime.txt","「否、かく衣を更め玉ふを見れば、何となくわが豊太郎の君とは見えず。"
"256","mori","maihime.txt","」又た少し考へて。"
"257","mori","maihime.txt","「縦令富貴になり玉ふ日はありとも、われをば見棄て玉はじ。"
"258","mori","maihime.txt","我病は母の宣ふ如くならずとも。"
"259","mori","maihime.txt","」"
"260","mori","maihime.txt","「何、富貴。"
"261","mori","maihime.txt","」余は微笑しつ。"
"262","mori","maihime.txt","「政治社会などに出でんの望みは絶ちしより幾年をか経ぬるを。"
"263","mori","maihime.txt","大臣は見たくもなし。"
"264","mori","maihime.txt","唯年久しく別れたりし友にこそ逢ひには行け。"
"265","mori","maihime.txt","」エリスが母の呼びし一等「ドロシユケ」は、輪下にきしる雪道を※の下まで来ぬ。"
"266","mori","maihime.txt","余は手袋をはめ、少し汚れたる外套を背に被ひて手をば通さず帽を取りてエリスに接吻して楼を下りつ。"
"267","mori","maihime.txt","彼は凍れる※を明け、乱れし髪を朔風に吹かせて余が乗りし車を見送りぬ。"
"268","mori","maihime.txt",""
"269","mori","maihime.txt","余が車を下りしは「カイゼルホオフ」の入口なり。"
"270","mori","maihime.txt","門者に秘書官相沢が室の番号を問ひて、久しく踏み慣れぬ大理石の階を登り、中央の柱に「プリユツシユ」を被へる「ゾフア」を据ゑつけ、正面には鏡を立てたる前房に入りぬ。"
"271","mori","maihime.txt","外套をばこゝにて脱ぎ、廊をつたひて室の前まで往きしが、余は少し踟※したり。"
"272","mori","maihime.txt","同じく大学に在りし日に、余が品行の方正なるを激賞したる相沢が、けふは怎なる面もちして出迎ふらん。"
"273","mori","maihime.txt","室に入りて相対して見れば、形こそ旧に比ぶれば肥えて逞ましくなりたれ、依然たる快活の気象、我失行をもさまで意に介せざりきと見ゆ。"
"274","mori","maihime.txt","別後の情を細叙するにも遑あらず、引かれて大臣に謁し、委托せられしは独逸語にて記せる文書の急を要するを飜訳せよとの事なり。"
"275","mori","maihime.txt","余が文書を受領して大臣の室を出でし時、相沢は跡より来て余と午餐を共にせんといひぬ。"
"276","mori","maihime.txt",""
"277","mori","maihime.txt","食卓にては彼多く問ひて、我多く答へき。"
"278","mori","maihime.txt","彼が生路は概ね平滑なりしに、轗軻数奇なるは我身の上なりければなり。"
"279","mori","maihime.txt",""
"280","mori","maihime.txt","余が胸臆を開いて物語りし不幸なる閲歴を聞きて、かれは屡※驚きしが、なか／＼に余を譴めんとはせず、却りて他の凡庸なる諸生輩を罵りき。"
"281","mori","maihime.txt","されど物語の畢りしとき、彼は色を正して諫むるやう、この一段のことは素と生れながらなる弱き心より出でしなれば、今更に言はんも甲斐なし。"
"282","mori","maihime.txt","とはいへ、学識あり、才能あるものが、いつまでか一少女の情にかゝづらひて、目的なき生活をなすべき。"
"283","mori","maihime.txt","今は天方伯も唯だ独逸語を利用せんの心のみなり。"
"284","mori","maihime.txt","おのれも亦伯が当時の免官の理由を知れるが故に、強て其成心を動かさんとはせず、伯が心中にて曲庇者なりなんど思はれんは、朋友に利なく、おのれに損あればなり。"
"285","mori","maihime.txt","人を薦むるは先づ其能を示すに若かず。"
"286","mori","maihime.txt","これを示して伯の信用を求めよ。"
"287","mori","maihime.txt","又彼少女との関係は、縦令彼に誠ありとも、縦令情交は深くなりぬとも、人材を知りてのこひにあらず、慣習といふ一種の惰性より生じたる交なり。"
"288","mori","maihime.txt","意を決して断てと。"
"289","mori","maihime.txt","是れその言のおほむねなりき。"
"290","mori","maihime.txt",""
"291","mori","maihime.txt","大洋に舵を失ひしふな人が、遙なる山を望む如きは、相沢が余に示したる前途の方鍼なり。"
"292","mori","maihime.txt","されどこの山は猶ほ重霧の間に在りて、いつ往きつかんも、否、果して往きつきぬとも、我中心に満足を与へんも定かならず。"
"293","mori","maihime.txt","貧きが中にも楽しきは今の生活、棄て難きはエリスが愛。"
"294","mori","maihime.txt","わが弱き心には思ひ定めんよしなかりしが、姑く友の言に従ひて、この情縁を断たんと約しき。"
"295","mori","maihime.txt","余は守る所を失はじと思ひて、おのれに敵するものには抗抵すれども、友に対して否とはえ対へぬが常なり。"
"296","mori","maihime.txt",""
"297","mori","maihime.txt","別れて出づれば風｜面を撲てり。"
"298","mori","maihime.txt","二重の玻璃※を緊しく鎖して、大いなる陶炉に火を焚きたる「ホテル」の食堂を出でしなれば、薄き外套を透る午後四時の寒さは殊さらに堪へ難く、膚粟立つと共に、余は心の中に一種の寒さを覚えき。"
"299","mori","maihime.txt",""
"300","mori","maihime.txt","飜訳は一夜になし果てつ。"
"301","mori","maihime.txt","「カイゼルホオフ」へ通ふことはこれより漸く繁くなりもて行く程に、初めは伯の言葉も用事のみなりしが、後には近比故郷にてありしことなどを挙げて余が意見を問ひ、折に触れては道中にて人々の失錯ありしことどもを告げて打笑ひ玉ひき。"
"302","mori","maihime.txt",""
"303","mori","maihime.txt","一月ばかり過ぎて、或る日伯は突然われに向ひて、「余は明旦、魯西亜に向ひて出発すべし。"
"304","mori","maihime.txt","随ひて来べきか、」と問ふ。"
"305","mori","maihime.txt","余は数日間、かの公務に遑なき相沢を見ざりしかば、此問は不意に余を驚かしつ。"
"306","mori","maihime.txt","「いかで命に従はざらむ。"
"307","mori","maihime.txt","」余は我恥を表はさん。"
"308","mori","maihime.txt","此答はいち早く決断して言ひしにあらず。"
"309","mori","maihime.txt","余はおのれが信じて頼む心を生じたる人に、卒然ものを問はれたるときは、咄嗟の間、その答の範囲を善くも量らず、直ちにうべなふことあり。"
"310","mori","maihime.txt","さてうべなひし上にて、その為し難きに心づきても、強て当時の心虚なりしを掩ひ隠し、耐忍してこれを実行すること屡々なり。"
"311","mori","maihime.txt",""
"312","mori","maihime.txt","此日は飜訳の代に、旅費さへ添へて賜はりしを持て帰りて、飜訳の代をばエリスに預けつ。"
"313","mori","maihime.txt","これにて魯西亜より帰り来んまでの費をば支へつべし。"
"314","mori","maihime.txt","彼は医者に見せしに常ならぬ身なりといふ。"
"315","mori","maihime.txt","貧血の性なりしゆゑ、幾月か心づかでありけん。"
"316","mori","maihime.txt","座頭よりは休むことのあまりに久しければ籍を除きぬと言ひおこせつ。"
"317","mori","maihime.txt","まだ一月ばかりなるに、かく厳しきは故あればなるべし。"
"318","mori","maihime.txt","旅立の事にはいたく心を悩ますとも見えず。"
"319","mori","maihime.txt","偽りなき我心を厚く信じたれば。"
"320","mori","maihime.txt",""
"321","mori","maihime.txt","鉄路にては遠くもあらぬ旅なれば、用意とてもなし。"
"322","mori","maihime.txt","身に合せて借りたる黒き礼服、新に買求めたるゴタ板の魯廷の貴族譜、二三種の辞書などを、小「カバン」に入れたるのみ。"
"323","mori","maihime.txt","流石に心細きことのみ多きこの程なれば、出で行く跡に残らんも物憂かるべく、又停車場にて涙こぼしなどしたらんには影護かるべければとて、翌朝早くエリスをば母につけて知る人がり出しやりつ。"
"324","mori","maihime.txt","余は旅装整へて戸を鎖し、鍵をば入口に住む靴屋の主人に預けて出でぬ。"
"325","mori","maihime.txt",""
"326","mori","maihime.txt","魯国行につきては、何事をか叙すべき。"
"327","mori","maihime.txt","わが舌人たる任務は忽地に余を拉し去りて、青雲の上に堕したり。"
"328","mori","maihime.txt","余が大臣の一行に随ひて、ペエテルブルクに在りし間に余を囲繞せしは、巴里絶頂の驕奢を、氷雪の裡に移したる王城の粧飾、故らに黄蝋の燭を幾つ共なく点したるに、幾星の勲章、幾枝の「エポレツト」が映射する光、彫鏤の工を尽したる「カミン」の火に寒さを忘れて使ふ宮女の扇の閃きなどにて、この間仏蘭西語を最も円滑に使ふものはわれなるがゆゑに、賓主の間に周旋して事を弁ずるものもまた多くは余なりき。"
"329","mori","maihime.txt",""
"330","mori","maihime.txt","この間余はエリスを忘れざりき、否、彼は日毎に書を寄せしかばえ忘れざりき。"
"331","mori","maihime.txt","余が立ちし日には、いつになく独りにて燈火に向はん事の心憂さに、知る人の許にて夜に入るまでもの語りし、疲るゝを待ちて家に還り、直ちにいねつ。"
"332","mori","maihime.txt","次の朝目醒めし時は、猶独り跡に残りしことを夢にはあらずやと思ひぬ。"
"333","mori","maihime.txt","起き出でし時の心細さ、かゝる思ひをば、生計に苦みて、けふの日の食なかりし折にもせざりき。"
"334","mori","maihime.txt","これ彼が第一の書の略なり。"
"335","mori","maihime.txt",""
"336","mori","maihime.txt","又程経てのふみは頗る思ひせまりて書きたる如くなりき。"
"337","mori","maihime.txt","文をば否といふ字にて起したり。"
"338","mori","maihime.txt","否、君を思ふ心の深き底をば今ぞ知りぬる。"
"339","mori","maihime.txt","君は故里に頼もしき族なしとのたまへば、此地に善き世渡のたつきあらば、留り玉はぬことやはある。"
"340","mori","maihime.txt","又我愛もて繋ぎ留めでは止まじ。"
"341","mori","maihime.txt","それも※はで東に還り玉はんとならば、親と共に往かんは易けれど、か程に多き路用を何処よりか得ん。"
"342","mori","maihime.txt","怎なる業をなしても此地に留りて、君が世に出で玉はん日をこそ待ためと常には思ひしが、暫しの旅とて立出で玉ひしより此二十日ばかり、別離の思は日にけに茂りゆくのみ。"
"343","mori","maihime.txt","袂を分つはたゞ一瞬の苦艱なりと思ひしは迷なりけり。"
"344","mori","maihime.txt","我身の常ならぬが漸くにしるくなれる、それさへあるに、縦令いかなることありとも、我をば努な棄て玉ひそ。"
"345","mori","maihime.txt","母とはいたく争ひぬ。"
"346","mori","maihime.txt","されど我身の過ぎし頃には似で思ひ定めたるを見て心折れぬ。"
"347","mori","maihime.txt","わが東に往かん日には、ステツチンわたりの農家に、遠き縁者あるに、身を寄せんとぞいふなる。"
"348","mori","maihime.txt","書きおくり玉ひし如く、大臣の君に重く用ゐられ玉はゞ、我路用の金は兎も角もなりなん。"
"349","mori","maihime.txt","今は只管君がベルリンにかへり玉はん日を待つのみ。"
"350","mori","maihime.txt",""
"351","mori","maihime.txt","嗚呼、余は此書を見て始めて我地位を明視し得たり。"
"352","mori","maihime.txt","恥かしきはわが鈍き心なり。"
"353","mori","maihime.txt","余は我身一つの進退につきても、また我身に係らぬ他人の事につきても、決断ありと自ら心に誇りしが、此決断は順境にのみありて、逆境にはあらず。"
"354","mori","maihime.txt","我と人との関係を照さんとするときは、頼みし胸中の鏡は曇りたり。"
"355","mori","maihime.txt",""
"356","mori","maihime.txt","大臣は既に我に厚し。"
"357","mori","maihime.txt","されどわが近眼は唯だおのれが尽したる職分をのみ見き。"
"358","mori","maihime.txt","余はこれに未来の望を繋ぐことには、神も知るらむ、絶えて想到らざりき。"
"359","mori","maihime.txt","されど今こゝに心づきて、我心は猶ほ冷然たりし歟。"
"360","mori","maihime.txt","先に友の勧めしときは、大臣の信用は屋上の禽の如くなりしが、今は稍※これを得たるかと思はるゝに、相沢がこの頃の言葉の端に、本国に帰りて後も倶にかくてあらば云々といひしは、大臣のかく宣ひしを、友ながらも公事なれば明には告げざりし歟。"
"361","mori","maihime.txt","今更おもへば、余が軽卒にも彼に向ひてエリスとの関係を絶たんといひしを、早く大臣に告げやしけん。"
"362","mori","maihime.txt",""
"363","mori","maihime.txt","嗚呼、独逸に来し初に、自ら我本領を悟りきと思ひて、また器械的人物とはならじと誓ひしが、こは足を縛して放たれし鳥の暫し羽を動かして自由を得たりと誇りしにはあらずや。"
"364","mori","maihime.txt","足の糸は解くに由なし。"
"365","mori","maihime.txt","曩にこれを繰つりしは、我某省の官長にて、今はこの糸、あなあはれ、天方伯の手中に在り。"
"366","mori","maihime.txt","余が大臣の一行と倶にベルリンに帰りしは、恰も是れ新年の旦なりき。"
"367","mori","maihime.txt","停車場に別を告げて、我家をさして車を駆りつ。"
"368","mori","maihime.txt","こゝにては今も除夜に眠らず、元旦に眠るが習なれば、万戸寂然たり。"
"369","mori","maihime.txt","寒さは強く、路上の雪は稜角ある氷片となりて、晴れたる日に映じ、きら／＼と輝けり。"
"370","mori","maihime.txt","車はクロステル街に曲りて、家の入口に駐まりぬ。"
"371","mori","maihime.txt","この時窓を開く音せしが、車よりは見えず。"
"372","mori","maihime.txt","馭丁に「カバン」持たせて梯を登らんとする程に、エリスの梯を駈け下るに逢ひぬ。"
"373","mori","maihime.txt","彼が一声叫びて我｜頸を抱きしを見て馭丁は呆れたる面もちにて、何やらむ髭の内にて云ひしが聞えず。"
"374","mori","maihime.txt","「善くぞ帰り来玉ひし。"
"375","mori","maihime.txt","帰り来玉はずば我命は絶えなんを。"
"376","mori","maihime.txt","」"
"377","mori","maihime.txt","我心はこの時までも定まらず、故郷を憶ふ念と栄達を求むる心とは、時として愛情を圧せんとせしが、唯だ此一｜刹那、低徊踟※の思は去りて、余は彼を抱き、彼の頭は我肩に倚りて、彼が喜びの涙ははら／＼と肩の上に落ちぬ。"
"378","mori","maihime.txt",""
"379","mori","maihime.txt","「幾階か持ちて行くべき。"
"380","mori","maihime.txt","」と鑼の如く叫びし馭丁は、いち早く登りて梯の上に立てり。"
"381","mori","maihime.txt",""
"382","mori","maihime.txt","戸の外に出迎へしエリスが母に、馭丁を労ひ玉へと銀貨をわたして、余は手を取りて引くエリスに伴はれ、急ぎて室に入りぬ。"
