"","auth","piece","line"
"0","mori","maihime.txt","舞姫"
"1","mori","maihime.txt","森鴎外"
"2","mori","maihime.txt",""
"3","mori","maihime.txt","-------------------------------------------------------"
"4","mori","maihime.txt","【テキスト中に現れる記号について】"
"5","mori","maihime.txt",""
"6","mori","maihime.txt","《》：ルビ"
"7","mori","maihime.txt","（例）早や"
"8","mori","maihime.txt",""
"9","mori","maihime.txt","｜：ルビの付く文字列の始まりを特定する記号"
"10","mori","maihime.txt","（例）余｜一人"
"11","mori","maihime.txt",""
"12","mori","maihime.txt","：入力者注主に外字の説明や、傍点の位置の指定"
"13","mori","maihime.txt","（数字は、JIS X 0213の面区点番号、または底本のページと行数）"
"14","mori","maihime.txt","（例）※に"
"15","mori","maihime.txt",""
"16","mori","maihime.txt","／＼：二倍の踊り字（「く」を縦に長くしたような形の繰り返し記号）"
"17","mori","maihime.txt","（例）すが／＼しく"
"18","mori","maihime.txt","＊濁点付きの二倍の踊り字は「／″＼」"
"19","mori","maihime.txt","-------------------------------------------------------"
"20","mori","maihime.txt",""
"21","mori","maihime.txt","石炭をば早や積み果てつ。"
"22","mori","maihime.txt","中等室の卓のほとりはいと静にて、熾熱燈の光の晴れがましきも徒なり。"
"23","mori","maihime.txt","今宵は夜毎にこゝに集ひ来る骨牌仲間も「ホテル」に宿りて、舟に残れるは余｜一人のみなれば。"
"24","mori","maihime.txt",""
"25","mori","maihime.txt","五年前の事なりしが、平生の望足りて、洋行の官命を蒙り、このセイゴンの港まで来し頃は、目に見るもの、耳に聞くもの、一つとして新ならぬはなく、筆に任せて書き記しつる紀行文日ごとに幾千言をかなしけむ、当時の新聞に載せられて、世の人にもてはやされしかど、今日になりておもへば、穉き思想、身の程知らぬ放言、さらぬも尋常の動植金石、さては風俗などをさへ珍しげにしるしゝを、心ある人はいかにか見けむ。"
"26","mori","maihime.txt","こたびは途に上りしとき、日記ものせむとて買ひし冊子もまだ白紙のまゝなるは、独逸にて物学びせし間に、一種の「ニル、アドミラリイ」の気象をや養ひ得たりけむ、あらず、これには別に故あり。"
"27","mori","maihime.txt",""
"28","mori","maihime.txt","げに東に還る今の我は、西に航せし昔の我ならず、学問こそ猶心に飽き足らぬところも多かれ、浮世のうきふしをも知りたり、人の心の頼みがたきは言ふも更なり、われとわが心さへ変り易きをも悟り得たり。"
"29","mori","maihime.txt","きのふの是はけふの非なるわが瞬間の感触を、筆に写して誰にか見せむ。"
"30","mori","maihime.txt","これや日記の成らぬ縁故なる、あらず、これには別に故あり。"
"31","mori","maihime.txt",""
"32","mori","maihime.txt","嗚呼、ブリンヂイシイの港を出でゝより、早や二十日あまりを経ぬ。"
"33","mori","maihime.txt","世の常ならば生面の客にさへ交を結びて、旅の憂さを慰めあふが航海の習なるに、微恙にことよせて房の裡にのみ籠りて、同行の人々にも物言ふことの少きは、人知らぬ恨に頭のみ悩ましたればなり。"
"34","mori","maihime.txt","此恨は初め一抹の雲の如く我心を掠めて、瑞西の山色をも見せず、伊太利の古蹟にも心を留めさせず、中頃は世を厭ひ、身をはかなみて、腸日ごとに九廻すともいふべき惨痛をわれに負はせ、今は心の奥に凝り固まりて、一点の翳とのみなりたれど、文読むごとに、物見るごとに、鏡に映る影、声に応ずる響の如く、限なき懐旧の情を喚び起して、幾度となく我心を苦む。"
"35","mori","maihime.txt","嗚呼、いかにしてか此恨を銷せむ。"
"36","mori","maihime.txt","若し外の恨なりせば、詩に詠じ歌によめる後は心地すが／＼しくもなりなむ。"
"37","mori","maihime.txt","これのみは余りに深く我心に彫りつけられたればさはあらじと思へど、今宵はあたりに人も無し、房奴の来て電気線の鍵を捩るには猶程もあるべければ、いで、その概略を文に綴りて見む。"
"38","mori","maihime.txt",""
"39","mori","maihime.txt","余は幼き比より厳しき庭の訓を受けし甲斐に、父をば早く喪ひつれど、学問の荒み衰ふることなく、旧藩の学館にありし日も、東京に出でゝ予備黌に通ひしときも、大学法学部に入りし後も、太田｜豊太郎といふ名はいつも一級の首にしるされたりしに、一人子の我を力になして世を渡る母の心は慰みけらし。"
"40","mori","maihime.txt","十九の歳には学士の称を受けて、大学の立ちてよりその頃までにまたなき名誉なりと人にも言はれ、某省に出仕して、故郷なる母を都に呼び迎へ、楽しき年を送ること三とせばかり、官長の覚え殊なりしかば、洋行して一課の事務を取り調べよとの命を受け、我名を成さむも、我家を興さむも、今ぞとおもふ心の勇み立ちて、五十を踰えし母に別るゝをもさまで悲しとは思はず、遙々と家を離れてベルリンの都に来ぬ。"
"41","mori","maihime.txt",""
"42","mori","maihime.txt","余は模糊たる功名の念と、検束に慣れたる勉強力とを持ちて、忽ちこの欧羅巴の新大都の中央に立てり。"
"43","mori","maihime.txt","何等の光彩ぞ、我目を射むとするは。"
"44","mori","maihime.txt","何等の色沢ぞ、我心を迷はさむとするは。"
"45","mori","maihime.txt","菩提樹下と訳するときは、幽静なる境なるべく思はるれど、この大道｜髪の如きウンテル、デン、リンデンに来て両辺なる石だゝみの人道を行く隊々の士女を見よ。"
"46","mori","maihime.txt","胸張り肩｜聳えたる士官の、まだ維廉一世の街に臨める※に倚り玉ふ頃なりければ、様々の色に飾り成したる礼装をなしたる、妍き少女の巴里まねびの粧したる、彼も此も目を驚かさぬはなきに、車道の土瀝青の上を音もせで走るいろ／＼の馬車、雲に聳ゆる楼閣の少しとぎれたる処には、晴れたる空に夕立の音を聞かせて漲り落つる噴井の水、遠く望めばブランデンブルク門を隔てゝ緑樹枝をさし交はしたる中より、半天に浮び出でたる凱旋塔の神女の像、この許多の景物｜目睫の間に聚まりたれば、始めてこゝに来しものゝ応接に遑なきも宜なり。"
"47","mori","maihime.txt","されど我胸には縦ひいかなる境に遊びても、あだなる美観に心をば動さじの誓ありて、つねに我を襲ふ外物を遮り留めたりき。"
"48","mori","maihime.txt",""
"49","mori","maihime.txt","余が鈴索を引き鳴らして謁を通じ、おほやけの紹介状を出だして東来の意を告げし普魯西の官員は、皆快く余を迎へ、公使館よりの手つゞきだに事なく済みたらましかば、何事にもあれ、教へもし伝へもせむと約しき。"
"50","mori","maihime.txt","喜ばしきは、わが故里にて、独逸、仏蘭西の語を学びしことなり。"
"51","mori","maihime.txt","彼等は始めて余を見しとき、いづくにていつの間にかくは学び得つると問はぬことなかりき。"
"52","mori","maihime.txt",""
"53","mori","maihime.txt","さて官事の暇あるごとに、かねておほやけの許をば得たりければ、ところの大学に入りて政治学を修めむと、名を簿冊に記させつ。"
"54","mori","maihime.txt",""
"55","mori","maihime.txt","ひと月ふた月と過す程に、おほやけの打合せも済みて、取調も次第に捗り行けば、急ぐことをば報告書に作りて送り、さらぬをば写し留めて、つひには幾巻をかなしけむ。"
"56","mori","maihime.txt","大学のかたにては、穉き心に思ひ計りしが如く、政治家になるべき特科のあるべうもあらず、此か彼かと心迷ひながらも、二三の法家の講筵に列ることにおもひ定めて、謝金を収め、往きて聴きつ。"
"57","mori","maihime.txt",""
"58","mori","maihime.txt","かくて三年ばかりは夢の如くにたちしが、時来れば包みても包みがたきは人の好尚なるらむ、余は父の遺言を守り、母の教に従ひ、人の神童なりなど褒むるが嬉しさに怠らず学びし時より、官長の善き働き手を得たりと奨ますが喜ばしさにたゆみなく勤めし時まで、たゞ所動的、器械的の人物になりて自ら悟らざりしが、今二十五歳になりて、既に久しくこの自由なる大学の風に当りたればにや、心の中なにとなく妥ならず、奥深く潜みたりしまことの我は、やうやう表にあらはれて、きのふまでの我ならぬ我を攻むるに似たり。"
"59","mori","maihime.txt","余は我身の今の世に雄飛すべき政治家になるにも宜しからず、また善く法典を諳じて獄を断ずる法律家になるにもふさはしからざるを悟りたりと思ひぬ。"
"60","mori","maihime.txt",""
"61","mori","maihime.txt","余は私に思ふやう、我母は余を活きたる辞書となさんとし、我官長は余を活きたる法律となさんとやしけん。"
"62","mori","maihime.txt","辞書たらむは猶ほ堪ふべけれど、法律たらんは忍ぶべからず。"
"63","mori","maihime.txt","今までは瑣々たる問題にも、極めて丁寧にいらへしつる余が、この頃より官長に寄する書には連りに法制の細目に拘ふべきにあらぬを論じて、一たび法の精神をだに得たらんには、紛々たる万事は破竹の如くなるべしなどゝ広言しつ。"
"64","mori","maihime.txt","又大学にては法科の講筵を余所にして、歴史文学に心を寄せ、漸く蔗を嚼む境に入りぬ。"
"65","mori","maihime.txt",""
"66","mori","maihime.txt","官長はもと心のまゝに用ゐるべき器械をこそ作らんとしたりけめ。"
"67","mori","maihime.txt","独立の思想を懐きて、人なみならぬ面もちしたる男をいかでか喜ぶべき。"
"68","mori","maihime.txt","危きは余が当時の地位なりけり。"
"69","mori","maihime.txt","されどこれのみにては、なほ我地位を覆へすに足らざりけんを、日比伯林の留学生の中にて、或る勢力ある一群と余との間に、面白からぬ関係ありて、彼人々は余を猜疑し、又｜遂に余を讒誣するに至りぬ。"
"70","mori","maihime.txt","されどこれとても其故なくてやは。"
"71","mori","maihime.txt",""
"72","mori","maihime.txt","彼人々は余が倶に麦酒の杯をも挙げず、球突きの棒をも取らぬを、かたくななる心と慾を制する力とに帰して、且は嘲り且は嫉みたりけん。"
"73","mori","maihime.txt","されどこは余を知らねばなり。"
"74","mori","maihime.txt","嗚呼、此故よしは、我身だに知らざりしを、怎でか人に知らるべき。"
"75","mori","maihime.txt","わが心はかの合歓といふ木の葉に似て、物｜触れば縮みて避けんとす。"
"76","mori","maihime.txt","我心は処女に似たり。"
"77","mori","maihime.txt","余が幼き頃より長者の教を守りて、学の道をたどりしも、仕の道をあゆみしも、皆な勇気ありて能くしたるにあらず、耐忍勉強の力と見えしも、皆な自ら欺き、人をさへ欺きつるにて、人のたどらせたる道を、唯だ一条にたどりしのみ。"
"78","mori","maihime.txt","余所に心の乱れざりしは、外物を棄てゝ顧みぬ程の勇気ありしにあらず、唯外物に恐れて自らわが手足を縛せしのみ。"
"79","mori","maihime.txt","故郷を立ちいづる前にも、我が有為の人物なることを疑はず、又我心の能く耐へんことをも深く信じたりき。"
"80","mori","maihime.txt","嗚呼、彼も一時。"
"81","mori","maihime.txt","舟の横浜を離るるまでは、天晴豪傑と思ひし身も、せきあへぬ涙に手巾を濡らしつるを我れ乍ら怪しと思ひしが、これぞなか／＼に我本性なりける。"
"82","mori","maihime.txt","此心は生れながらにやありけん、又早く父を失ひて母の手に育てられしによりてや生じけん。"
"83","mori","maihime.txt",""
"84","mori","maihime.txt","彼人々の嘲るはさることなり。"
"85","mori","maihime.txt","されど嫉むはおろかならずや。"
"86","mori","maihime.txt","この弱くふびんなる心を。"
"87","mori","maihime.txt",""
"88","mori","maihime.txt","赤く白く面を塗りて、赫然たる色の衣を纏ひ、珈琲店に坐して客を延く女を見ては、往きてこれに就かん勇気なく、高き帽を戴き、眼鏡に鼻を挾ませて、普魯西にては貴族めきたる鼻音にて物言ふ「レエベマン」を見ては、往きてこれと遊ばん勇気なし。"
"89","mori","maihime.txt","此等の勇気なければ、彼活溌なる同郷の人々と交らんやうもなし。"
"90","mori","maihime.txt","この交際の疎きがために、彼人々は唯余を嘲り、余を嫉むのみならで、又余を猜疑することゝなりぬ。"
"91","mori","maihime.txt","これぞ余が冤罪を身に負ひて、暫時の間に無量の艱難を閲し尽す媒なりける。"
"92","mori","maihime.txt",""
"93","mori","maihime.txt","或る日の夕暮なりしが、余は獣苑を漫歩して、ウンテル、デン、リンデンを過ぎ、我がモンビシユウ街の僑居に帰らんと、クロステル巷の古寺の前に来ぬ。"
"94","mori","maihime.txt","余は彼の燈火の海を渡り来て、この狭く薄暗き巷に入り、楼上の木欄に干したる敷布、襦袢などまだ取入れぬ人家、頬髭長き猶太教徒の翁が戸前に佇みたる居酒屋、一つの梯は直ちに楼に達し、他の梯は窖住まひの鍛冶が家に通じたる貸家などに向ひて、凹字の形に引籠みて立てられたる、此三百年前の遺跡を望む毎に、心の恍惚となりて暫し佇みしこと幾度なるを知らず。"
"95","mori","maihime.txt",""
"96","mori","maihime.txt","今この処を過ぎんとするとき、鎖したる寺門の扉に倚りて、声を呑みつゝ泣くひとりの少女あるを見たり。"
"97","mori","maihime.txt","年は十六七なるべし。"
"98","mori","maihime.txt","被りし巾を洩れたる髪の色は、薄きこがね色にて、着たる衣は垢つき汚れたりとも見えず。"
"99","mori","maihime.txt","我足音に驚かされてかへりみたる面、余に詩人の筆なければこれを写すべくもあらず。"
"100","mori","maihime.txt","この青く清らにて物問ひたげに愁を含める目の、半ば露を宿せる長き睫毛に掩はれたるは、何故に一顧したるのみにて、用心深き我心の底までは徹したるか。"
"101","mori","maihime.txt",""
"102","mori","maihime.txt","彼は料らぬ深き歎きに遭ひて、前後を顧みる遑なく、こゝに立ちて泣くにや。"
"103","mori","maihime.txt","わが臆病なる心は憐憫の情に打ち勝たれて、余は覚えず側に倚り、「何故に泣き玉ふか。"
"104","mori","maihime.txt","ところに繋累なき外人は、却りて力を借し易きこともあらん。"
"105","mori","maihime.txt","」といひ掛けたるが、我ながらわが大胆なるに呆れたり。"
"106","mori","maihime.txt",""
"107","mori","maihime.txt","彼は驚きてわが黄なる面を打守りしが、我が真率なる心や色に形はれたりけん。"
"108","mori","maihime.txt","「君は善き人なりと見ゆ。"
"109","mori","maihime.txt","彼の如く酷くはあらじ。"
"110","mori","maihime.txt","又た我母の如く。"
"111","mori","maihime.txt","」暫し涸れたる涙の泉は又溢れて愛らしき頬を流れ落つ。"
"112","mori","maihime.txt",""
"113","mori","maihime.txt","「我を救ひ玉へ、君。"
"114","mori","maihime.txt","わが恥なき人とならんを。"
"115","mori","maihime.txt","母はわが彼の言葉に従はねばとて、我を打ちき。"
"116","mori","maihime.txt","父は死にたり。"
"117","mori","maihime.txt","明日は葬らでは※はぬに、家に一銭の貯だになし。"
"118","mori","maihime.txt","」"
"119","mori","maihime.txt","跡は欷歔の声のみ。"
"120","mori","maihime.txt","我｜眼はこのうつむきたる少女の顫ふ項にのみ注がれたり。"
"121","mori","maihime.txt",""
"122","mori","maihime.txt","「君が家に送り行かんに、先づ心を鎮め玉へ。"
"123","mori","maihime.txt","声をな人に聞かせ玉ひそ。"
"124","mori","maihime.txt","こゝは往来なるに。"
"125","mori","maihime.txt","」彼は物語するうちに、覚えず我肩に倚りしが、この時ふと頭を擡げ、又始てわれを見たるが如く、恥ぢて我側を飛びのきつ。"
"126","mori","maihime.txt",""
"127","mori","maihime.txt","人の見るが厭はしさに、早足に行く少女の跡に附きて、寺の筋向ひなる大戸を入れば、欠け損じたる石の梯あり。"
"128","mori","maihime.txt","これを上ぼりて、四階目に腰を折りて潜るべき程の戸あり。"
"129","mori","maihime.txt","少女は※びたる針金の先きを捩ぢ曲げたるに、手を掛けて強く引きしに、中には咳枯れたる老媼の声して、「誰ぞ」と問ふ。"
"130","mori","maihime.txt","エリス帰りぬと答ふる間もなく、戸をあらゝかに引開けしは、半ば白みたる髪、悪しき相にはあらねど、貧苦の痕を額に印せし面の老媼にて、古き獣綿の衣を着、汚れたる上靴を穿きたり。"
"131","mori","maihime.txt","エリスの余に会釈して入るを、かれは待ち兼ねし如く、戸を劇しくたて切りつ。"
"132","mori","maihime.txt",""
"133","mori","maihime.txt","余は暫し茫然として立ちたりしが、ふと油燈の光に透して戸を見れば、エルンスト、ワイゲルトと漆もて書き、下に仕立物師と注したり。"
"134","mori","maihime.txt","これすぎぬといふ少女が父の名なるべし。"
"135","mori","maihime.txt","内には言ひ争ふごとき声聞えしが、又静になりて戸は再び明きぬ。"
"136","mori","maihime.txt","さきの老媼は慇懃におのが無礼の振舞せしを詫びて、余を迎へ入れつ。"
"137","mori","maihime.txt","戸の内は厨にて、右手の低き※に、真白に洗ひたる麻布を懸けたり。"
"138","mori","maihime.txt","左手には粗末に積上げたる煉瓦の竈あり。"
"139","mori","maihime.txt","正面の一室の戸は半ば開きたるが、内には白布を掩へる臥床あり。"
"140","mori","maihime.txt","伏したるはなき人なるべし。"
"141","mori","maihime.txt","竈の側なる戸を開きて余を導きつ。"
"142","mori","maihime.txt","この処は所謂「マンサルド」の街に面したる一間なれば、天井もなし。"
"143","mori","maihime.txt","隅の屋根裏より※に向ひて斜に下れる梁を、紙にて張りたる下の、立たば頭の支ふべき処に臥床あり。"
"144","mori","maihime.txt","中央なる机には美しき氈を掛けて、上には書物一二巻と写真帖とを列べ、陶瓶にはこゝに似合はしからぬ価高き花束を生けたり。"
"145","mori","maihime.txt","そが傍に少女は羞を帯びて立てり。"
"146","mori","maihime.txt",""
"147","mori","maihime.txt","彼は優れて美なり。"
"148","mori","maihime.txt","乳の如き色の顔は燈火に映じて微紅を潮したり。"
"149","mori","maihime.txt","手足の繊く※なるは、貧家の女に似ず。"
"150","mori","maihime.txt","老媼の室を出でし跡にて、少女は少し訛りたる言葉にて云ふ。"
"151","mori","maihime.txt","「許し玉へ。"
"152","mori","maihime.txt","君をこゝまで導きし心なさを。"
"153","mori","maihime.txt","君は善き人なるべし。"
"154","mori","maihime.txt","我をばよも憎み玉はじ。"
"155","mori","maihime.txt","明日に迫るは父の葬、たのみに思ひしシヤウムベルヒ、君は彼を知らでやおはさん。"
"156","mori","maihime.txt","彼は「ヰクトリア」座の座頭なり。"
"157","mori","maihime.txt","彼が抱へとなりしより、早や二年なれば、事なく我等を助けんと思ひしに、人の憂に附けこみて、身勝手なるいひ掛けせんとは。"
"158","mori","maihime.txt","我を救ひ玉へ、君。"
"159","mori","maihime.txt","金をば薄き給金を析きて還し参らせん。"
"160","mori","maihime.txt","縦令我身は食はずとも。"
"161","mori","maihime.txt","それもならずば母の言葉に。"
"162","mori","maihime.txt","」彼は涙ぐみて身をふるはせたり。"
"163","mori","maihime.txt","その見上げたる目には、人に否とはいはせぬ媚態あり。"
"164","mori","maihime.txt","この目の働きは知りてするにや、又自らは知らぬにや。"
"165","mori","maihime.txt",""
"166","mori","maihime.txt","我が隠しには二三「マルク」の銀貨あれど、それにて足るべくもあらねば、余は時計をはづして机の上に置きぬ。"
"167","mori","maihime.txt","「これにて一時の急を凌ぎ玉へ。"
"168","mori","maihime.txt","質屋の使のモンビシユウ街三番地にて太田と尋ね来ん折には価を取らすべきに。"
"169","mori","maihime.txt","」"
"170","mori","maihime.txt","少女は驚き感ぜしさま見えて、余が辞別のために出したる手を唇にあてたるが、はら／＼と落つる熱き涙を我手の背に濺ぎつ。"
"171","mori","maihime.txt",""
"172","mori","maihime.txt","嗚呼、何等の悪因ぞ。"
"173","mori","maihime.txt","この恩を謝せんとて、自ら我｜僑居に来し少女は、シヨオペンハウエルを右にし、シルレルを左にして、終日兀坐する我読書の※下に、一輪の名花を咲かせてけり。"
"174","mori","maihime.txt","この時を始として、余と少女との交漸く繁くなりもて行きて、同郷人にさへ知られぬれば、彼等は速了にも、余を以て色を舞姫の群に漁するものとしたり。"
"175","mori","maihime.txt","われ等｜二人の間にはまだ痴※なる歓楽のみ存したりしを。"
"176","mori","maihime.txt",""
"177","mori","maihime.txt","その名を斥さんは憚あれど、同郷人の中に事を好む人ありて、余が屡※芝居に出入して、女優と交るといふことを、官長の許に報じつ。"
"178","mori","maihime.txt","さらぬだに余が頗る学問の岐路に走るを知りて憎み思ひし官長は、遂に旨を公使館に伝へて、我官を免じ、我職を解いたり。"
"179","mori","maihime.txt","公使がこの命を伝ふる時余に謂ひしは、御身若し即時に郷に帰らば、路用を給すべけれど、若し猶こゝに在らんには、公の助をば仰ぐべからずとのことなりき。"
"180","mori","maihime.txt","余は一週日の猶予を請ひて、とやかうと思ひ煩ふうち、我生涯にて尤も悲痛を覚えさせたる二通の書状に接しぬ。"
"181","mori","maihime.txt","この二通は殆ど同時にいだしゝものなれど、一は母の自筆、一は親族なる某が、母の死を、我がまたなく慕ふ母の死を報じたる書なりき。"
"182","mori","maihime.txt","余は母の書中の言をこゝに反覆するに堪へず、涙の迫り来て筆の運を妨ぐればなり。"
"183","mori","maihime.txt",""
"184","mori","maihime.txt","余とエリスとの交際は、この時までは余所目に見るより清白なりき。"
"185","mori","maihime.txt","彼は父の貧きがために、充分なる教育を受けず、十五の時舞の師のつのりに応じて、この恥づかしき業を教へられ、「クルズス」果てゝ後、「ヰクトリア」座に出でゝ、今は場中第二の地位を占めたり。"
"186","mori","maihime.txt","されど詩人ハツクレンデルが当世の奴隷といひし如く、はかなきは舞姫の身の上なり。"
"187","mori","maihime.txt","薄き給金にて繋がれ、昼の温習、夜の舞台と緊しく使はれ、芝居の化粧部屋に入りてこそ紅粉をも粧ひ、美しき衣をも纏へ、場外にてはひとり身の衣食も足らず勝なれば、親腹からを養ふものはその辛苦｜奈何ぞや。"
"188","mori","maihime.txt","されば彼等の仲間にて、賤しき限りなる業に堕ちぬは稀なりとぞいふなる。"
"189","mori","maihime.txt","エリスがこれを※れしは、おとなしき性質と、剛気ある父の守護とに依りてなり。"
