"","auth","piece","line"
"251","mori","moso.txt","日本に長くゐて日本を底から知り抜いたと云はれてゐる独逸人某は、此要約は今｜闕けてゐるばかりでなくて、永遠に東洋の天地には生じて来ないと宜告した。"
"252","mori","moso.txt","東洋には自然科学を育てて行く雰囲気は無いのだと宣告した。"
"253","mori","moso.txt","果してさうなら、帝国大学も、伝染病研究所も、永遠に欧羅巴の学術の結論丈を取り続ぐ場所たるに過ぎない筈である。"
"254","mori","moso.txt","かう云ふ判断は、ロシアとの戦争の後に、欧羅巴の当り狂言になつてゐた Taifun なんぞに現れてゐる。"
"255","mori","moso.txt","併し自分は日本人を、さう絶望しなくてはならない程、無能な種族だとも思はないから、敢て「まだ」と云ふ。"
"256","mori","moso.txt","自分は日本で結んだ学術の果実を欧羅巴へ輸出する時もいつかは来るだらうと、其時から思つてゐたのである。"
"257","mori","moso.txt",""
"258","mori","moso.txt","自分はこの自然科学を育てる雰囲気のある、便利な国を跡に見て、夢の故郷へ旅立つた。"
"259","mori","moso.txt","それは勿論立たなくてはならなかつたのではあるが、立たなくてはならないといふ義務の為めに立つたのでは無い。"
"260","mori","moso.txt","自分の願望の秤も、一方の皿に便利な国を載せて、一方の皿に夢の故郷を載せたとき、便利の皿を弔つた緒をそつと引く、白い、優しい手があつたにも拘らず、慥かに夢の方へ傾いたのである。"
"261","mori","moso.txt",""
"262","mori","moso.txt","シベリア鉄道はまだ全通してゐなかつたので、印度洋を経て帰るのであつた。"
"263","mori","moso.txt","一日行程の道を往復しても、往きは長く、復りは短く思はれるものであるが、四五十日の旅行をしても、さういふ感じがある。"
"264","mori","moso.txt","未知の世界へ希望を懐いて旅立つた昔に比べて寂しく又早く思はれた航海中、籐の寝椅子に身を横へながら、自分は行李にどんなお土産を持つて帰るかといふことを考へた。"
"265","mori","moso.txt",""
"266","mori","moso.txt","自然科学の分科の上では、自分は結論丈を持つて帰るのではない。"
"267","mori","moso.txt","将来発展すべき萌芽をも持つてゐる積りである。"
"268","mori","moso.txt","併し帰つて行く故郷には、その萌芽を育てる雰囲気が無い。"
"269","mori","moso.txt","少くも「まだ」無い。"
"270","mori","moso.txt","その萌芽も徒らに枯れてしまひはすまいかと気遣はれる。"
"271","mori","moso.txt","そして自分は fatalistisch な、鈍い、陰気な感じに襲はれた。"
"272","mori","moso.txt",""
"273","mori","moso.txt","そしてこの陰気な闇を照破する光明のある哲学は、我行李の中には無かつた。"
"274","mori","moso.txt","その中に有るのは、ショオペンハウエル、ハルトマン系の厭世哲学である。"
"275","mori","moso.txt","現象世界を有るよりは無い方が好いとしてゐる哲学である。"
"276","mori","moso.txt","進化を認めないではない。"
"277","mori","moso.txt","併しそれは無に醒覚せんが為めの進化である。"
"278","mori","moso.txt",""
"279","mori","moso.txt","自分は錫蘭で、赤い格子縞の布を、頭と腰とに巻き附けた男に、美しい、青い翼の鳥を買はせられた。"
"280","mori","moso.txt","籠を提げて舟に帰ると、フランス舟の乗組貝が妙な手附きをして、「Il ne vivra pas !」と云つた。"
"281","mori","moso.txt","美しい、青い鳥は、果して舟の横浜に着くまでに死んでしまつた。"
"282","mori","moso.txt","それも果敢ない土産であつた。"
"283","mori","moso.txt",""
"284","mori","moso.txt",""
"285","mori","moso.txt","＊＊＊"
"286","mori","moso.txt",""
"287","mori","moso.txt","自分は失望を以て故郷の人に迎へられた。"
"288","mori","moso.txt","それは無埋もない。"
"289","mori","moso.txt","自分のやうな洋行帰りはこれまで例の無い事であつたからである。"
"290","mori","moso.txt","これまでの洋行帰りは、希望に輝く顔をして、行李の中から道具を出して、何か新しい手品を取り立てて御覧に入れることになつてゐた。"
"291","mori","moso.txt","自分は丁度その反対の事をしたのである。"
"292","mori","moso.txt",""
"293","mori","moso.txt","東京では都会改造の議論が盛んになつてゐて、アメリカのＡとかＢとかの何号町かにある、独逸人の謂ふ Wolkenkratzer のやうな家を建てたいと、ハイカラア連が云つてゐた。"
"294","mori","moso.txt","その時自分は「都会といふものは、狭い地面に多く人が住むだけ人死が多い、殊に子供が多く死ぬる、今まで横に並んでゐた家を、竪に積み畳ねるよりは、上水や下水でも改良するが好からう」と云つた。"
"295","mori","moso.txt","又建築に制裁を加へようとする委員が出来てゐて、東京の家の軒の高さを一定して、整然たる外観の美を成さうと云つてゐた。"
"296","mori","moso.txt","その時自分は「そんな兵隊の並んだやうな町は美しくは無い、強ひて西洋風にしたいなら、寧ろ反対に軒の高さどころか、あらゆる建築の様式を一軒づつ別にさせて、ヱネチアの町のやうに参差錯落たる美観を造るやうにでも心掛けたら好からう」と云つた。"
"297","mori","moso.txt",""
"298","mori","moso.txt","食物改良の議論もあつた。"
"299","mori","moso.txt","米を食ふことを廃めて、沢山牛肉を食はせたいと云ふのであつた。"
"300","mori","moso.txt","その時自分は「米も魚もひどく消化の好いものだから、日本人の食物は昔の儘が好からう、尤も牧畜を盛んにして、牛肉も食べるやうにするのは勝手だ」と云つた。"
"301","mori","moso.txt",""
"302","mori","moso.txt","仮名遣改良の議論もあつて、コイスチヨーワガナワといふやうな事を書かせようとしてゐると、「いやいや、Orthographie はどこの国にもある、矢張コヒステフワガナハの方が宜しからう」と云つた。"
"303","mori","moso.txt",""
"304","mori","moso.txt","そんな風に、人の改良しようとしてゐる、あらゆる方面に向つて、自分は本の杢阿弥説を唱へた。"
"305","mori","moso.txt","そして保守党の仲間に逐ひ込まれた。"
"306","mori","moso.txt","洋行帰りの保守主義者は、後には別な動機で流行し出したが、元祖は自分であつたかも知れない。"
"307","mori","moso.txt",""
"308","mori","moso.txt","そこで学んで来た自然科学はどうしたか。"
"309","mori","moso.txt","帰つた当座一年か二年は Laboratorium に這人つてゐて、ごつごつと馬鹿正直に働いて、本の杢阿弥説に根拠を与へてゐた。"
"310","mori","moso.txt","正直に試験して見れば、何千年といふ間満足に発展して来た日本人が、そんなに反理性的生活をしてゐよう筈はない。"
"311","mori","moso.txt","初から知れ切つた事である。"
"312","mori","moso.txt",""
"313","mori","moso.txt","さてそれから一歩進んで、新しい地盤の上に新しい Forschung を企てようといふ段になると、地位と境遇とが自分を為事場から撥ね出した。"
"314","mori","moso.txt","自然科学よ、さらばである。"
"315","mori","moso.txt",""
"316","mori","moso.txt","勿論自然科学の方面では、自分なんぞより有力な友達が大勢あつて、跡に残つて奮闘してゐてくれるから、自分の撥ね出されたのは、国家の為めにも、人類の為めにもなんの損失にもならない。"
"317","mori","moso.txt",""
"318","mori","moso.txt","只奮闘してゐる友達には気の毒である。"
"319","mori","moso.txt","依然として雰囲気の無い処で、高圧の下に働く潜水夫のやうに喘ぎ苦んでゐる。"
"320","mori","moso.txt","雰囲気の無い証拠には、まだ Forschung といふ日本語も出来てゐない。"
"321","mori","moso.txt","そんな概念を明確に言ひ現す必要をば、社会が感じてゐないのである。"
"322","mori","moso.txt","自慢でもなんでもないが、「業績」とか「学問の推挽」とか云ふやうな造語を、自分が自然科学界に置土産にして来たが、まだ Forschung といふ意味の簡短で明確な日本語は無い。"
"323","mori","moso.txt","研究なんといふぼんやりした語は、実際役に立たない。"
"324","mori","moso.txt","載籍調べも研究ではないか。"
"325","mori","moso.txt",""
"326","mori","moso.txt",""
"327","mori","moso.txt","＊＊＊"
"328","mori","moso.txt",""
"329","mori","moso.txt","かう云ふ閲歴をして来ても、未来の幻影を逐うて、現在の事実を蔑にする自分の心は、まだ元の儘である。"
"330","mori","moso.txt","人の生涯はもう下り坂になつて行くのに、逐うてゐるのはなんの影やら。"
"331","mori","moso.txt",""
"332","mori","moso.txt","「奈何にして人は己を知ることを得べきか。"
"333","mori","moso.txt","省察を以てしては決して能はざらん。"
"334","mori","moso.txt","されど行為を以てしては或は能くせむ。"
"335","mori","moso.txt","汝の義務を果さんと試みよ。"
"336","mori","moso.txt","やがて汝の価値を知らむ。"
"337","mori","moso.txt","汝の義務とは何ぞ。"
"338","mori","moso.txt","日の要求なり。"
"339","mori","moso.txt","」これは Goethe の詞である。"
"340","mori","moso.txt",""
"341","mori","moso.txt","日の要求を義務として、それを果して行く。"
"342","mori","moso.txt","これは丁度現在の事実を蔑にする反対である。"
"343","mori","moso.txt","自分はどうしてさう云ふ境地に身を置くことが出来ないだらう。"
"344","mori","moso.txt",""
"345","mori","moso.txt","日の要求に応じて能事畢るとするには足ることを知らなくてはならない。"
"346","mori","moso.txt","足ることを知るといふことが、自分には出来ない。"
"347","mori","moso.txt","自分は永遠なる不平家である。"
"348","mori","moso.txt","どうしても自分のゐない筈の所に自分がゐるやうである。"
"349","mori","moso.txt","どうしても灰色の鳥を青い鳥に見ることが出来ないのである。"
"350","mori","moso.txt","道に迷つてゐるのである。"
"351","mori","moso.txt","夢を見てゐるのである。"
"352","mori","moso.txt","夢を見てゐて、青い鳥を夢の中に尋ねてゐるのである。"
"353","mori","moso.txt","なぜだと問うたところで、それに答へることは出来ない。"
"354","mori","moso.txt","これは只単純なる事実である。"
"355","mori","moso.txt","自分の意識の上の事実である。"
"356","mori","moso.txt",""
"357","mori","moso.txt","自分は此儘で人生の下り坂を下つて行く。"
"358","mori","moso.txt","そしてその下り果てた所が死だといふことを知つて居る。"
"359","mori","moso.txt",""
"360","mori","moso.txt","併しその死はこはくはない。"
"361","mori","moso.txt","人の説に、老年になるに従つて増長するといふ「死の恐怖」が、自分には無い。"
"362","mori","moso.txt",""
"363","mori","moso.txt","若い時には、この死といふ目的地に達するまでに、自分の眼前に横はつてゐる謎を解きたいと、痛切に感じたことがある。"
"364","mori","moso.txt","その感じが次第に痛切でなくなつた。"
"365","mori","moso.txt","次第に薄らいだ。"
"366","mori","moso.txt","解けずに横はつてゐる謎が見えないのではない。"
"367","mori","moso.txt","見えてゐる謎を解くべきものだと思はないのでもない。"
"368","mori","moso.txt","それを解かうとしてあせらなくなつたのである。"
"369","mori","moso.txt",""
"370","mori","moso.txt","この頃自分は Philipp Mainlaender が事を聞いて、その男の書いた救抜の哲学を読んで見た。"
"371","mori","moso.txt",""
"372","mori","moso.txt","此男は Hartmann の迷の三期を承認してゐる。"
"373","mori","moso.txt","ところであらゆる錯迷を打ち破つて置いて、生を肯定しろと云ふのは無理だと云ふのである。"
"374","mori","moso.txt","これは皆迷だが、死んだつて駄目だから、迷を追つ掛けて行けとは云はれない筈だと云ふのである。"
"375","mori","moso.txt","人は最初に遠く死を望み見て、恐怖して面を背ける。"
"376","mori","moso.txt","次いで死の廻りに大きい圏を画いて、震慄しながら歩いてゐる。"
"377","mori","moso.txt","その圏が漸く小くなつて、とうとう疲れた腕を死の項に投げ掛けて、死と目と目を見合はす。"
"378","mori","moso.txt","そして死の目の中に平和を見出すのだと、マインレンデルは云つてゐる。"
"379","mori","moso.txt",""
"380","mori","moso.txt","さう云つて置いて、マインレンデルは三十五歳で自殺したのである。"
"381","mori","moso.txt",""
"382","mori","moso.txt","自分には死の恐怖が無いと同時にマインレンデルの「死の憧憬」も無い。"
"383","mori","moso.txt",""
"384","mori","moso.txt","死を怖れもせず、死にあこがれもせずに、自分は人生の下り坂を下つて行く。"
"385","mori","moso.txt",""
"386","mori","moso.txt",""
"387","mori","moso.txt","＊＊＊"
"388","mori","moso.txt",""
"389","mori","moso.txt","謎は解けないと知つて、解かうとしてあせらないやうにはなつたが、自分はそれを打ち棄てて顧みずにはゐられない。"
"390","mori","moso.txt","宴会嫌ひで世に謂ふ道楽といふものがなく、碁も打たず、象棋も差さず、球も撞かない自分は、自然科学の為事場を出て、手に試験管を持たなくなつてから、稀に画や彫刻を見たり、音楽を聴いたりする外には、境遇の与へる日の要求を果した間々に、本を読むことを余儀なくせられた。"
"391","mori","moso.txt",""
"392","mori","moso.txt","ハルトマンは人間のあらゆる福を錯迷として打破して行く間に、こんな意味の事を言つてゐた。"
"393","mori","moso.txt","大抵人の福と思つてゐる物に、酒の二日酔をさせるやうに跡腹の病めないものは無い。"
"394","mori","moso.txt","それの無いのは、只芸術と学問との二つ丈だと云ふのである。"
"395","mori","moso.txt","自分は丁度此二つの外にはする事がなくなつた。"
"396","mori","moso.txt","それは利害上に打算して、跡腹の病めない事をするのではない。"
"397","mori","moso.txt","跡腹の病める、あらゆる福を生得好かないのである。"
"398","mori","moso.txt",""
"399","mori","moso.txt","本は随分読んだ。"
"400","mori","moso.txt","そしてその読む本の種類は、為事場を出てから、必然の結果でがらりと変つた。"
"401","mori","moso.txt",""
"402","mori","moso.txt","西洋にゐた時から、Archive とか Jahresberichte とか云ふやうな、専門の学術雑誌を初巻から揃へて十五六種も取つてゐたところが、為事場に出ないことになつて見れば、実験の細かい記録なんぞを調べる必要がなくなつた。"
"403","mori","moso.txt","元来かう云ふ雑誌は学校や図書館で買ふもので、個人の買ふものではなかつたのを、政府がどれ丈雑誌に金を出してくれるやら分からないと思ふのと、自分がどこで為事をするやうになるやら分からないと思ふのとで、数千巻買つて持つてゐたが、自分は其中で専門学科の沿革と進歩とを見るに最も便利な年報二三種を残して置いて、跡は悉く官の学校に寄附してしまつた。"
"404","mori","moso.txt",""
"405","mori","moso.txt","そしてその代りに哲学や文学の書物を買ふことにした。"
"406","mori","moso.txt","それを時間の得られる限り読んだのである。"
"407","mori","moso.txt",""
"408","mori","moso.txt","只その読み方が、初めハルトマンを読んだ時のやうに、饑ゑて食を貪るやうな読み方ではなくなつた。"
"409","mori","moso.txt","昔世にもてはやされてゐた人、今世にもてはやされてゐる人は、どんな事を言つてゐるかと、譬へば道を行く人の顔を辻に立つて冷澹に見るやうに見たのである。"
"410","mori","moso.txt",""
"411","mori","moso.txt","冷澹には見てゐたが、自分は辻に立つてゐて、度々帽を脱いだ。"
"412","mori","moso.txt","昔の人にも今の人にも、敬意を表すべき人が大勢あつたのである。"
"413","mori","moso.txt",""
"414","mori","moso.txt","帽は脱いだが、辻を離れてどの人かの跡に附いて行かうとは思はなかつた。"
"415","mori","moso.txt","多くの師には逢つたが、一人の主には逢はなかつたのである。"
"416","mori","moso.txt",""
"417","mori","moso.txt","自分は度々此脱帽によつて誤解せられた。"
"418","mori","moso.txt","自然科学を修めて帰つた当座、食物の議論が出たので、当時の権威者たる Voit の標準で駁撃した時も、或る先輩が「そんならフォイトを信仰してゐるか」と云ふと、自分はそれに答へて、「必ずしもさうでは無い、姑くフォイトの塁に拠つて敵に当るのだ」と云つて、ひどく先輩に冷かされた。"
"419","mori","moso.txt","自分は一時の権威者としてフォイトに脱帽したに過ぎないのである。"
"420","mori","moso.txt","それと丁度同じ事で、一頃芸術の批評に口を出して、ハルトマンの美学を根拠にして論じてゐると、或る後進の英雄が云つた。"
"421","mori","moso.txt","「ハルトマンの美学はハルトマンの無意識哲学から出てゐる。"
"422","mori","moso.txt","あの美学を根拠にして論ずるには、先づ無意識哲学を信仰してゐなくてはならない」と云つた。"
"423","mori","moso.txt","なる程ハルトマンは自家の美学を自家の世界観に結び附けてはゐたが、姑くその連鎖を断つてしまつたとして見ても、彼の美学は当時最も完備したものであつて、而も創見に富んでゐた。"
"424","mori","moso.txt","自分は美学の上で、矢張一時の権威者としてハルトマンに脱帽したに過ぎないのである。"
"425","mori","moso.txt","ずつと後になつてから、ハルトマンの世界観を離れて、彼の美学の存立してゐられる、立派な証拠が提供せられた。"
"426","mori","moso.txt","ハルトマン以後に出た美学者の本をどれでも開けて見るが好い。"
"427","mori","moso.txt","きつと美の Modification と云ふものを説いてゐる。"
"428","mori","moso.txt","あれはハルトマンが剏めたのでハルトマンの前には無かつた。"
"429","mori","moso.txt","それを誰も彼も説いてゐて、ハルトマンのハの字も言はずにゐる。"
"430","mori","moso.txt","黙殺してゐるのである。"
"431","mori","moso.txt",""
"432","mori","moso.txt","それは兎に角、辻に立つ人は多くの師に逢つて、一人の主にも逢はなかつた。"
"433","mori","moso.txt","そしてどんなに巧みに組み立てた形而上学でも、一篇の抒情詩に等しいものだと云ふことを知つた。"
"434","mori","moso.txt",""
"435","mori","moso.txt",""
"436","mori","moso.txt","＊＊＊"
"437","mori","moso.txt",""
"438","mori","moso.txt","形而上学と云ふ、和蘭寺院楽の諧律のやうな組立てに倦んだ自分の耳に、或時ちぎれちぎれの Aphorismen の旋律が聞えて来た。"
"439","mori","moso.txt",""
"440","mori","moso.txt","生の意志を挫いて無に入らせようとする、ショオペンハウエルの Quietive に服従し兼ねてゐた自分の意識は、或時｜懶眠の中から鞭うち起された。"
"441","mori","moso.txt",""
"442","mori","moso.txt","それは Nietzsche の超人哲学であつた。"
"443","mori","moso.txt",""
"444","mori","moso.txt","併しこれも自分を養つてくれる食餌ではなくて、自分を酔はせる酒であつた。"
"445","mori","moso.txt",""
"446","mori","moso.txt","過去の消極的な、利他的な道徳を家畜の群の道徳としたのは痛快である。"
"447","mori","moso.txt","同時に社会主義者の四海同胞観を、あらゆる特権を排斥する、愚な、とんまな群の道徳としたのも、無政府主義者の跋扈を、欧羅巴の街に犬が吠えてゐると罵つたのも面白い。"
"448","mori","moso.txt","併し理性の約束を棄てて、権威に向ふ意志を文化の根本に置いて、門閥の為め、自我の為めに、毒薬と匕首とを用ゐることを憚らない Cesare Borgia を、君主の道徳の典型としたのなんぞを、真面目に受け取るわけには行かない。"
"449","mori","moso.txt","その上ハルトマンの細かい倫理説を見た目には、所謂評価の革新さへ幾分の新しみを殺がれてしまつたのである。"
"450","mori","moso.txt",""
"451","mori","moso.txt","そこで死はどうであるか。"
"452","mori","moso.txt","「永遠なる再来」は慰藉にはならない。"
"453","mori","moso.txt","Zarathustra の末期に筆を下し兼ねた作者の情を、自分は憐んだ。"
"454","mori","moso.txt",""
"455","mori","moso.txt","それから後にも Paulsen の流行などと云ふことも閲して来たが、自分は一切の折衷主義に同情を有せないので、そんな思潮には触れずにしまつた。"
"456","mori","moso.txt",""
"457","mori","moso.txt",""
"458","mori","moso.txt","＊＊＊"
"459","mori","moso.txt",""
"460","mori","moso.txt","昔別荘の真似事に立てた、膝を容れるばかりの小家には、仏者の百一物のやうになんの道具も只一つしか無い。"
"461","mori","moso.txt",""
"462","mori","moso.txt","それに主人の翁は壁といふ壁を皆棚にして、棚といふ棚を皆書物にしてゐる。"
"463","mori","moso.txt",""
"464","mori","moso.txt","そして世間と一切の交通を絶つてゐるらしい主人の許に、西洋から書物の小包が来る。"
"465","mori","moso.txt","彼が生きてゐる間は、小さいながら財産の全部を保菅してゐる Notar の手で、利足の大部分が西洋の某｜書肆へ送られるのである。"
"466","mori","moso.txt",""
"467","mori","moso.txt","主人は老いても黒人種のやうな視力を持つてゐて、世間の人が懐かしくなつた故人を訪ふやうに、古い本を読む。"
"468","mori","moso.txt","世間の人が市に出て、新しい人を見るやうに新しい本を読む。"
"469","mori","moso.txt",""
"470","mori","moso.txt","倦めば砂の山を歩いて松の木立を見る。"
"471","mori","moso.txt","砂の浜に下りて海の波瀾を見る。"
"472","mori","moso.txt",""
"473","mori","moso.txt","僕八十八の薦める野菜の膳に向つて、飢を凌ぐ。"
"474","mori","moso.txt",""
"475","mori","moso.txt","書物の外で、主人の翁の翫んでゐるのは、小さい Loupe である。"
"476","mori","moso.txt","砂の山から摘んで来た小さい草の花などを見る。"
"477","mori","moso.txt","その外 Zeiss の顕微鏡がある。"
"478","mori","moso.txt","海の雫の中にゐる小さい動物などを見る Merz の望遠鏡がある。"
"479","mori","moso.txt","晴れた夜の空の星を見る。"
"480","mori","moso.txt","これは翁が自然科学の記憶を呼び返す、折々のすさびである。"
"481","mori","moso.txt",""
"482","mori","moso.txt","主人の翁はこの小家に来てからも幻影を追ふやうな昔の心持を無くしてしまふことは出来ない。"
"483","mori","moso.txt","そして既往を回顧してこんな事を思ふ。"
"484","mori","moso.txt","日の要求に安んぜない権利を持つてゐるものは、恐らくは只天才ばかりであらう。"
"485","mori","moso.txt","自然科学で大発明をするとか、哲学や芸術で大きい思想、大きい作品を生み出すとか云ふ境地に立つたら、自分も現在に満足したのではあるまいか。"
"486","mori","moso.txt","自分にはそれが出来なかつた。"
"487","mori","moso.txt","それでかう云ふ心持が附き纏つてゐるのだらうと思ふのである。"
"488","mori","moso.txt",""
"489","mori","moso.txt","少壮時代に心の田地に卸された種子は、容易に根を断つことの出来ないものである。"
"490","mori","moso.txt","冷眼に哲学や文学の上の動揺を見てゐる主人の翁は、同時に重い石を一つ一つ積み畳ねて行くやうな科学者の労作にも、余所ながら目を附けてゐるのである。"
"491","mori","moso.txt",""
