"","auth","piece","line"
"7031","mori","sokkyo_shijin.txt","ララは我に對ひて起ち、聲振り絞りて、我に光明を授け給へ、我に神の造り給ひし世界の美しさを見ることを得させたまへと祈願したり。"
"7032","mori","sokkyo_shijin.txt","その聲音は尋常ならず、譬へば泉下の人の假に形を現して物言ふが如くなりき。"
"7033","mori","sokkyo_shijin.txt","我即興詩は漫りに混沌の竅を穿ちて、少女に宇宙の美を教へき。"
"7034","mori","sokkyo_shijin.txt","今や少女は期せずして我前に來り、我に眼を開かんことを請へり。"
"7035","mori","sokkyo_shijin.txt","われは少女の聲の我心魂に徹するを覺えて、口一語を出すこと能はず、只だ手を少女の方にさし伸べたるのみ。"
"7036","mori","sokkyo_shijin.txt","少女は再び身を起して、我に光明を授け給へと唱へかけしが、張り詰めし氣や弛みけん、小舟の中にはたと伏し、舷側なる水ははら／＼と火花を飛しつ。"
"7037","mori","sokkyo_shijin.txt",""
"7038","mori","sokkyo_shijin.txt","翁は暫く身を屈して、少女のさまを覗ひ居たるが、やをら岸に登りて、きと眼を我姿に注ぎ、空中に十字を書し、彼｜大銅鉢を抱いて舟中に移し、己も續いて乘りうつれり。"
"7039","mori","sokkyo_shijin.txt","われは思慮するに遑あらずして、同じく舟に上りしに、翁は我を迎へんともせず、さればとて又我を拒まんともせず、只だ目を※りて我を視るのみ。"
"7040","mori","sokkyo_shijin.txt","翁は又｜※を握りて、彼青き星に向ひて漕ぎ行けり。"
"7041","mori","sokkyo_shijin.txt","冷なる風は舟に向ひて吹き來れり。"
"7042","mori","sokkyo_shijin.txt","舟は巖窟の中に進み入りて、我等の頭は巖に觸んとす。"
"7043","mori","sokkyo_shijin.txt","われは身をララの上に俯したり。"
"7044","mori","sokkyo_shijin.txt","忽にして舟は杳茫として涯なき大海の上に出でぬ。"
"7045","mori","sokkyo_shijin.txt","頭を囘せば、斷崖千尺、斧もて削り成せる如くにして、乘る所の舟は崖下の小洞穴より濳り出でしなり。"
"7046","mori","sokkyo_shijin.txt",""
"7047","mori","sokkyo_shijin.txt","新月の光は怪しきまでに清澄なりき。"
"7048","mori","sokkyo_shijin.txt","斷崖の一隅に龕の形をなしたる低き岸あり。"
"7049","mori","sokkyo_shijin.txt","灌木｜疎に生じて、深紅の花を開ける草之に雜れり。"
"7050","mori","sokkyo_shijin.txt","岸邊には一隻の帆船を繋げるを見る。"
"7051","mori","sokkyo_shijin.txt","翁は小舟を其側に留めしに、少女は期する所ある如く、身を起して我に向へり。"
"7052","mori","sokkyo_shijin.txt","われはその手に觸るゝことをだに敢てせずして、心の裡に我が遇ふ所の夢に非ず幻に非ず、さればとて又｜現にも非ず、人も我も遊魂の陰界に相見るものなるべきを思ひぬ。"
"7053","mori","sokkyo_shijin.txt","少女は、いざ藥草を采りて給へと云ひて、右手を我にさし着けたり。"
"7054","mori","sokkyo_shijin.txt","われは鬼に役せらるるものゝ如く、岸に登りて彼｜香しき花を摘み、束ねて少女に遞與しつ。"
"7055","mori","sokkyo_shijin.txt","この時われは堪へ難き疲を覺えて、そのまゝ地上に僵れ臥したり。"
"7056","mori","sokkyo_shijin.txt","われは猶首を擡げて、翁が手快くララを彼帆船に抱き上げ、わが摘みし花束をも移し載せて、自らこれに乘りうつり、小舟を艫に結び付けて、帆を揚げて去るを見たり。"
"7057","mori","sokkyo_shijin.txt","されど我は身を起すこと能はず、又聲を出すこと能はずして、徒らに身を悶え手を振るのみ。"
"7058","mori","sokkyo_shijin.txt","我は死の我心に迫りて、心の裂けんと欲するを覺えたり。"
"7059","mori","sokkyo_shijin.txt",""
"7060","mori","sokkyo_shijin.txt",""
"7061","mori","sokkyo_shijin.txt","蘇生"
"7062","mori","sokkyo_shijin.txt",""
"7063","mori","sokkyo_shijin.txt","かくては性命の虞はあらじとは、始て我耳に入りし詞なりき。"
"7064","mori","sokkyo_shijin.txt","われは眼を開いてフアビアニ公子と夫人フランチエスカとを見たり。"
"7065","mori","sokkyo_shijin.txt","されど彼語を出しゝは、我手を握りて、眞面目なる思慮ありげなる目を我面に注ぎたる未知の男なりき。"
"7066","mori","sokkyo_shijin.txt","我は廣闊にして敞明なる一室に臥せり。"
"7067","mori","sokkyo_shijin.txt","時は白晝なりき。"
"7068","mori","sokkyo_shijin.txt","われは身の何の處にあるを知らずして、只だ熱の脈絡の内に發りたるを覺えき。"
"7069","mori","sokkyo_shijin.txt","わがいかにして救はれ、いかにしてこゝに來しを審にすることを得しは、時を經ての後なりき。"
"7070","mori","sokkyo_shijin.txt",""
"7071","mori","sokkyo_shijin.txt","きのふジエンナロとわれとの歸り來ざりしとき、人々はいたく心を苦め給ひぬ。"
"7072","mori","sokkyo_shijin.txt","我等を載せて出でし舟人を尋ぬるに、こも行方知れずとの事なりき。"
"7073","mori","sokkyo_shijin.txt","さて島の南岸に沿ひて、龍卷ありしを聞き給ひしより、人々は早や我等の生きて還らざるべきを思ひ給ひぬ。"
"7074","mori","sokkyo_shijin.txt","搜索の爲めに出し遣られし二艘の舟は、一はこなたより漕ぎ往き、一はかなたより漕ぎ戻りて、末遂に一つところに落ち合ふやうに掟てられしに、その舟皆歸り來て、舟も人もその踪跡を見ずといふ。"
"7075","mori","sokkyo_shijin.txt","フランチエスカの君は我がために涙を墮し給ひ、又ジエンナロと舟人との上をも惜み給ひぬと聞えぬ。"
"7076","mori","sokkyo_shijin.txt",""
"7077","mori","sokkyo_shijin.txt","その時公子の宣給ふやう。"
"7078","mori","sokkyo_shijin.txt","かくて思ひ棄てんは、猶そのてだてを盡したりといふべからず。"
"7079","mori","sokkyo_shijin.txt","若し舟中の人にして、或は浪に打ち揚げられ、或は自ら泅ぎ着きて、巖のはざまなどにあらんには、人に知られで飢渇の苦艱を受けもやせん。"
"7080","mori","sokkyo_shijin.txt","いでわれ親ら往いて求めんとて、朝まだきに力強き漕手四人を倩ひ、湊を舟出して、こゝかしこの洞窟より巖のはざまゝで、名殘なく尋ね給ひぬ。"
"7081","mori","sokkyo_shijin.txt","されど彼魔窟といふところには、舟人｜辭みて行かじといふを、公子強ひて説き勸め、草木生ひたりと見ゆる岸邊をさして漕ぎ近づかせしに、程近くなるに從ひて、人の僵れ臥したりと覺しきを認め、さてこそ我を救ひ取り給ひしなれ。"
"7082","mori","sokkyo_shijin.txt","われは緑なる灌木の間に横はり、我衣は濱風に吹かれて半ば乾きたりしなり。"
"7083","mori","sokkyo_shijin.txt","公子は舟人して我を舟に扶け載せしめ、おのれの外套もて被ひ、手の尖胸のあたりなど擦り温めつゝ、早く我呼吸の未だ絶え果てぬを見給ひぬといふ。"
"7084","mori","sokkyo_shijin.txt","われはかくてこゝに伴はれ、醫師の治療を受けつるなりけり。"
"7085","mori","sokkyo_shijin.txt",""
"7086","mori","sokkyo_shijin.txt","さればジエンナロと二人の舟人とは魚腹に葬られて、われのみ一人再び天日を見ることゝなりしなり。"
"7087","mori","sokkyo_shijin.txt","人々は我に當時の事を語らしめたり。"
"7088","mori","sokkyo_shijin.txt","われは光まばゆき洞窟の中に醒めしを姶とし、目しひたる少女を載せ來し翁に遭へるに至るまで、そのおほよそを語りしに、人々笑ひて、そは熱ある人の寒き夜風に觸れ、半醒半夢の間にありて妄想せるならんといへり。"
"7089","mori","sokkyo_shijin.txt","げにわれさへ事の餘りに怪しければ、夢かと疑ふ心なきにしもあらねど、また熟※思へばしかはあらじと思ひ返さざることを得ず。"
"7090","mori","sokkyo_shijin.txt","かへす／″＼も奇しく怪しきは、彼洞天の光景と舟中の人物となり。"
"7091","mori","sokkyo_shijin.txt",""
"7092","mori","sokkyo_shijin.txt","我物語を傍聽せし醫師は公子に向ひ頭を傾けて、さては君の此人を搜し得給ひしは彼魔窟の畔なりけるよといひぬ。"
"7093","mori","sokkyo_shijin.txt","公子。"
"7094","mori","sokkyo_shijin.txt","さなり。"
"7095","mori","sokkyo_shijin.txt","さりとて君は世俗のいふ魔窟に、まことに魔ありとは、よも思ひ給はじ。"
"7096","mori","sokkyo_shijin.txt","醫師。"
"7097","mori","sokkyo_shijin.txt","そは輒く答へまつるべうもあらぬ御尋なり。"
"7098","mori","sokkyo_shijin.txt","自然は謎語の鉤鎖にして吾人は今その幾節をか解き得たる。"
"7099","mori","sokkyo_shijin.txt",""
"7100","mori","sokkyo_shijin.txt","我心は次第に爽かになりぬ。"
"7101","mori","sokkyo_shijin.txt","抑※わが見し洞窟はいかなる處なりしぞ。"
"7102","mori","sokkyo_shijin.txt","舟人の物語に、この石門の奧に光りかゞやくところありといひしは、わが漂ひ着きし別天地を斥して言へるにはあらざるか。"
"7103","mori","sokkyo_shijin.txt","かの怪しき翁の舟の、狹き穴より濳り出しをば、われ明かに記憶せり。"
"7104","mori","sokkyo_shijin.txt","夢まぼろしにてはよもあらじ。"
"7105","mori","sokkyo_shijin.txt","さらば彼洞窟は幽魂の往來するところにして、我は一たび其境に陷り、聖母の惠によりて又｜現世に歸りしにや。"
"7106","mori","sokkyo_shijin.txt","われはかく思ひ惑ひつゝも、わが掌を組み合せて彼舟中の少女の上を懷ひぬ。"
"7107","mori","sokkyo_shijin.txt","まことに彼少女は我を救へる天使なりき。"
"7108","mori","sokkyo_shijin.txt",""
"7109","mori","sokkyo_shijin.txt","年經て我夢の夢に非ざることは明かになりぬ。"
"7110","mori","sokkyo_shijin.txt","彼洞窟は今カプリ島の第一勝、否伊太利國の第一勝たる琅※洞（グロツタ、アツウラ）にして、舟中の少女も亦實にかのペスツムの瞽女ララなりしなり。"
"7111","mori","sokkyo_shijin.txt",""
"7112","mori","sokkyo_shijin.txt",""
"7113","mori","sokkyo_shijin.txt","歸途"
"7114","mori","sokkyo_shijin.txt",""
"7115","mori","sokkyo_shijin.txt","公子夫婦は我を率て拿破里に歸らんために、猶カプリに留まること二日なりき。"
"7116","mori","sokkyo_shijin.txt","二人の我を待つ言動は、始の程こそ屡※我感情を傷ふこともありつれ、遭難の後病弱の身となりては、親族にも稀なるべき人々の看護の難有さ身にしみて、羅馬へ伴ひ行かんと云はるゝが嬉しとおもはるゝやうになりぬ。"
"7117","mori","sokkyo_shijin.txt","そが上かの洞窟の内に遭遇せし怪異と、萬死を出でゝ一生を獲たる幸とは、いたくわが興奮したる腦髓を刺戟して、我をして無形の威力の人の運命を左右することの復た疑ふべからざるを思はしめぬれば、我は公子夫婦の羅馬へ往けと勸め給ふを聞きても、又直ちにその聲を以て運命の聲となさんとしたり。"
"7118","mori","sokkyo_shijin.txt","わが健康の漸く故に復らんとする頃、公子夫婦は又我床頭にありて、何くれとなく語り慰め給ひき。"
"7119","mori","sokkyo_shijin.txt","夫人。"
"7120","mori","sokkyo_shijin.txt","アントニオよ。"
"7121","mori","sokkyo_shijin.txt","おん身の往方まだ知れざりし程は、我等は屡※おん身の爲めに泣きぬ。"
"7122","mori","sokkyo_shijin.txt","おん身の不思議に性命を全うせしは、聖母の御惠なりしならん。"
"7123","mori","sokkyo_shijin.txt","今はおん身情｜強きも、よも再び拿破里に住みて、ベルナルドオと面をあはせんとは云はぬならん。"
"7124","mori","sokkyo_shijin.txt","公子。"
"7125","mori","sokkyo_shijin.txt","そは勿論なるべし。"
"7126","mori","sokkyo_shijin.txt","われ等は只だ羅馬に伴ひ歸りて、曾て過ありしアントニオは地中海の底の藻屑となりぬ、今こゝに來たるはその昔幼く可哀ゆかりしアントニオなりと云はん。"
"7127","mori","sokkyo_shijin.txt","夫人。"
"7128","mori","sokkyo_shijin.txt","さるにても便なきはジエンナロなり。"
"7129","mori","sokkyo_shijin.txt","才も人に優れ情も深かりしものを、いかなれば神は末猶遠き此人の命を助けんとはし給はざりけん。"
"7130","mori","sokkyo_shijin.txt","惜みても餘あることならずやなど宣給へり。"
"7131","mori","sokkyo_shijin.txt",""
"7132","mori","sokkyo_shijin.txt","醫師は屡※病牀をおとづれて、數時間を我室に送れり。"
"7133","mori","sokkyo_shijin.txt","この人は拿破里に住みて、いまは用事ありて此カプリに來居たるなりといふ。"
"7134","mori","sokkyo_shijin.txt","第三日に至りて、醫師我を診して健康の全く故に復りたるを告げ、己れも我等の一行と共に歸途に就きぬ。"
"7135","mori","sokkyo_shijin.txt","醫師の我を健全なりといふは、形體上より言へるにて、若し精神上より言はゞ、われは自ら我心の健全ならざるを覺えき。"
"7136","mori","sokkyo_shijin.txt","わが少壯の心は、かの含羞草といふものゝ葉と同じく萎み卷きて、曩に一たび死の境界に臨みてよりこのかた、死の天使の接吻の痕は、猶明かに我額の上に存せり。"
"7137","mori","sokkyo_shijin.txt","公子夫婦の我と醫師とを引き連れて舟に上り給ふとき、我は澄み渡れる海水を見下して、忽ち前日の事を憶ひ起し、激しく心を動したり。"
"7138","mori","sokkyo_shijin.txt","今日影のうらゝかに此積水の緑を照すを見るにつけても、我は永く此底に眠るべき身の、恙なくて又此天日の光に浴するを思ひ、涙の頬に流るゝを禁ずること能はざりき。"
"7139","mori","sokkyo_shijin.txt","人々は皆優しく我を慰めたり。"
"7140","mori","sokkyo_shijin.txt","フランチエスカの君は我才を稱へ、我を呼びて詩人となし、醫師に我が拿破里の劇場に上りて、即興詩を歌ひしことを語り給ひしに、醫師驚きたる面持して、さてはかの謳者は此人なりしか、公衆の稱歎は尋常ならざりき、重ねて技を演じ給はゞ、世に名高き人ともなり給はんものをなどいへり。"
"7141","mori","sokkyo_shijin.txt","風の餘り好かりければ、初めソレントオより陸に上るべかりし航路を改め、直ちに拿破里の入江を指して進むことゝなりぬ。"
"7142","mori","sokkyo_shijin.txt",""
"7143","mori","sokkyo_shijin.txt","われは拿破里の旅寓に入りて、三通の書信に接したり。"
"7144","mori","sokkyo_shijin.txt","その一は友人フエデリゴが手書なり。"
"7145","mori","sokkyo_shijin.txt","フエデリゴはきのふイスキアの島に遊び、三日の後ならでは還らずとの事なりき。"
"7146","mori","sokkyo_shijin.txt","明日の午頃には人々こゝを立たんと宣給へば、われはこの唯だ一人なる友にだに、暇乞することを得ざらんとす。"
"7147","mori","sokkyo_shijin.txt","その二はわが宿を出でし次の日に來しものなる由、房奴われに語りぬ。"
"7148","mori","sokkyo_shijin.txt","これを讀むに唯だ二三行の文あり。"
"7149","mori","sokkyo_shijin.txt","心誠なるものゝおん身の爲め好かれとおもへるありて、今宵おん身の來まさんことを願ふとのみ書きて、末に昔の友なる女と署し、會合の家を指し示せり。"
"7150","mori","sokkyo_shijin.txt","其三はこれと同じ手して書けるものなり。"
"7151","mori","sokkyo_shijin.txt","その文左の如くなりき。"
"7152","mori","sokkyo_shijin.txt",""
"7153","mori","sokkyo_shijin.txt",""
"7154","mori","sokkyo_shijin.txt","よしなき御疑念など起し給はで、御出下されかしと、ひたすら御待申上候。"
"7155","mori","sokkyo_shijin.txt","御別申上候節は、實に思ひ掛けぬ事にて、胸騷ぎ魂消えて、申上ぐべき詞をもえ辨へ侍らざりしかど、今は御許にても、あわたゞしかりし當時の事を思ひ棄て給ひつらんと存じ候。"
"7156","mori","sokkyo_shijin.txt","御許にて思ひ違へ給ひしにはあらずやと思はるゝ節も候へども、そはすべて御目にかゝりたる上にて申解くべく候。"
"7157","mori","sokkyo_shijin.txt","只だ一刻も早く御目にかゝり度御待申上ぐるより外無御座候。"
"7158","mori","sokkyo_shijin.txt","かしこ。"
"7159","mori","sokkyo_shijin.txt",""
"7160","mori","sokkyo_shijin.txt",""
"7161","mori","sokkyo_shijin.txt","末には又昔の友なる女と署したり。"
"7162","mori","sokkyo_shijin.txt","會合の家は知らぬ巷に在れど、サンタならではかゝる文書くべき婦人あるべうもあらず。"
"7163","mori","sokkyo_shijin.txt","われは今更彼婦人に逢ひて何とかすべきと思ひぬれば、御返事もやあると促しに來し男を呼び入れて、詞短かにいひぬ。"
"7164","mori","sokkyo_shijin.txt","われは遽かに思ひ定むる事ありて、拿破里を去らんとす。"
"7165","mori","sokkyo_shijin.txt","今までの厚き御惠は誓ひて忘れ侍らじ。"
"7166","mori","sokkyo_shijin.txt","御目に掛かりて御暇乞すべきなれど、あわたゞしき折なれば、唯だこの由御使に申すなりといひぬ。"
"7167","mori","sokkyo_shijin.txt","フエデリゴには數行の書を作りて遺し置きつ。"
"7168","mori","sokkyo_shijin.txt","その概略は今物書くべき心地もせねば、精しき事の顛末をば、羅馬に到り着きて後にこそ告ぐべけれ、手を握らで別れ去ることの心苦しさを察せよといふ程の意なりき。"
"7169","mori","sokkyo_shijin.txt",""
"7170","mori","sokkyo_shijin.txt","暇乞にとては、何處へも往かざりき。"
"7171","mori","sokkyo_shijin.txt","街上にてベルナルドオの面を見んことの影護く、又此地に來てより交を結びし人には、相見んことの願はしくもあらねば、われは旅寓の一室にたれこめて此日を暮さんとおもひ居たり。"
"7172","mori","sokkyo_shijin.txt","さるを公子の車を誂へ置きたれば、共に醫師の家訪はずやと宣給ふがことわりなれば、隨ひて行きぬ。"
"7173","mori","sokkyo_shijin.txt","小く心安げなる家にて、年｜長けたる姉の家政を掌れるあり。"
"7174","mori","sokkyo_shijin.txt","質直なる性質眉目の間に現はれて、むかしカムパニアの野邊にありける時、鞠育の恩を受けしドメニカに似たるところあり。"
"7175","mori","sokkyo_shijin.txt","されど此は教育ある人なれば、起居振舞のみやびやかなる、いろ／＼なる藝能ある抔、日を同じうして語るべくもあらざるなるべし。"
"7176","mori","sokkyo_shijin.txt",""
"7177","mori","sokkyo_shijin.txt","翌朝われは先づヱズヰオの山を仰ぎ見て別を告げたり。"
"7178","mori","sokkyo_shijin.txt","嶺は深く烟霧の裏に隱れて、われに送別の意を表せんともせざる如し。"
"7179","mori","sokkyo_shijin.txt","是日海原はいと靜にして、又我をして洞窟と瞽女との夢を想はしむ。"
"7180","mori","sokkyo_shijin.txt","嗚呼、此拿破里の市も、今よりは同じ夢中の物となり了るならん。"
"7181","mori","sokkyo_shijin.txt",""
"7182","mori","sokkyo_shijin.txt","房奴はけふの拿破里日報（ヂアリオ、ヂナポリ）を持ち來りぬ。"
"7183","mori","sokkyo_shijin.txt","披きて見れば、我假名あり。"
"7184","mori","sokkyo_shijin.txt","さきの日の初舞臺の批評なりき。"
"7185","mori","sokkyo_shijin.txt","いかなる事を書けるにかと、心｜忙しく讀みもて行くに、先づ空想の贍にして、章句の美しかりしを稱へ、恐らくは是れパンジエツチイの流を酌めるものにて、摸倣の稍※甚しきを嫌ふと斷ぜり。"
"7186","mori","sokkyo_shijin.txt","パンジエツチイといふ人はわれ夢にだに見しことあらず。"
"7187","mori","sokkyo_shijin.txt","われは唯だ我天賦の情に本づきて歌ひしなり。"
"7188","mori","sokkyo_shijin.txt","想ふに彼批評家といふものは、おのれ常に摸擬の筆を用ゐるより、人の藝術も亦｜然ならんと思へるにやあらん。"
"7189","mori","sokkyo_shijin.txt","末の方には例に依りて、奬勵の語を添へたり。"
"7190","mori","sokkyo_shijin.txt","いはく。"
"7191","mori","sokkyo_shijin.txt","此人終に名を成すべき望なきにあらず、今の見る所を以てするも、猶非凡なる材能たることを失はざるべし、空想感情靈應の諸性具備したりと見ゆればなりとあり。"
"7192","mori","sokkyo_shijin.txt","此評は惡しき方にはあらねど、當日の公衆の喝采に比ぶるときは、その冷かなること著しとおもはる。"
"7193","mori","sokkyo_shijin.txt","われは此新聞紙を疊みて行李の中に藏めたり。"
"7194","mori","sokkyo_shijin.txt","そは他年わが拿破里の遭遇の悉く夢ならぬを證せん料にもとてなり。"
"7195","mori","sokkyo_shijin.txt","嗚呼、われ拿破里を見たり、拿破里の市を彷徨せり。"
"7196","mori","sokkyo_shijin.txt","わが得しところそも幾何ぞ、わが失ひしところはたそも幾何ぞ。"
"7197","mori","sokkyo_shijin.txt","知らず、フルヰアの預言は既に實現し盡せりや否や。"
"7198","mori","sokkyo_shijin.txt",""
"7199","mori","sokkyo_shijin.txt","われ等は拿破里を出立ちたり。"
"7200","mori","sokkyo_shijin.txt","葡萄栽ゑたる丘陵は見る／＼烟雲の間に沒せり。"
"7201","mori","sokkyo_shijin.txt","一行は羅馬に向ひて行くこと四日なりき。"
"7202","mori","sokkyo_shijin.txt","わが行くところの道は、二月の前にフエデリゴ、サンタの二人と與に行きし道なりき。"
"7203","mori","sokkyo_shijin.txt","モラの旅亭に來て見れば、柑子の林は今花の眞盛なり。"
"7204","mori","sokkyo_shijin.txt","われは再び我祕言をサンタに偸み聽かれし木蔭に立寄りたり。"
"7205","mori","sokkyo_shijin.txt","人の離合聚散の測り難きこと、また今更に驚かれぬ。"
"7206","mori","sokkyo_shijin.txt","イトリの狹隘を過ぐる時、われはフエデリゴが上を憶ひ起しつ。"
"7207","mori","sokkyo_shijin.txt","旅劵を閲する國境には、けふも洞穴の中に山羊の群をなせるあり。"
"7208","mori","sokkyo_shijin.txt","されどフエデリゴが筆に上りし當時の牧童は見えざりき。"
"7209","mori","sokkyo_shijin.txt",""
"7210","mori","sokkyo_shijin.txt","一行はテルラチナに宿りぬ。"
"7211","mori","sokkyo_shijin.txt","夜明くれば天氣晴朗なりき。"
"7212","mori","sokkyo_shijin.txt","あはれ、美しき海原よ。"
"7213","mori","sokkyo_shijin.txt","汝は我を懷抱し我をゆり動かして、我にめでたき夢を見させ、我をかう／″＼しきララに逢はせき。"
"7214","mori","sokkyo_shijin.txt","今はわれ汝に別れんとぞすなる。"
"7215","mori","sokkyo_shijin.txt","水の天に接する處には、猶エズヰオの山の雄々しき姿見えて、立昇る烟の色は淡き藍色を成し、そのさま清明にして而も幽微に、譬へば霞を以て顏料となし、かゞやく空の面に畫ける如し。"
"7216","mori","sokkyo_shijin.txt","われは大息して呼べり。"
"7217","mori","sokkyo_shijin.txt","さらば／＼、いで我は羅馬に入らん。"
"7218","mori","sokkyo_shijin.txt","我墓穴は我を待つこと久し。"
"7219","mori","sokkyo_shijin.txt",""
"7220","mori","sokkyo_shijin.txt","われは曾て怪しき媼フルヰアとさまよひありきし山を望みき。"
"7221","mori","sokkyo_shijin.txt","われはジエンツアノ市を過ぎて、我母の車に觸れてみまかり給ひし廣こうぢを見き。"
"7222","mori","sokkyo_shijin.txt","路の傍なる乞兒は我衣服の卑しからぬを見て、われを殿樣と呼べり。"
"7223","mori","sokkyo_shijin.txt","むかし母に手を拉かれて祭を見し貧家の子幸ありといはんか、今ボルゲエゼ家の賓客となりて歸れる紳士幸ありといはんか、そは輒く答へ難き問なるべし。"
"7224","mori","sokkyo_shijin.txt",""
"7225","mori","sokkyo_shijin.txt","一行はアルバノの山を踰えたり。"
"7226","mori","sokkyo_shijin.txt","カムパニアの曠野は我前に横れり。"
"7227","mori","sokkyo_shijin.txt","道の傍なる、蔦蘿深く鎖せるアスカニウスの墳は先づ我眼に映ぜり。"
