"","auth","piece","line"
"2418","mori","sokkyo_shijin.txt","されど此手段を行はんには、決して時機を失ふべからず。"
"2419","mori","sokkyo_shijin.txt","駈足にせよ歩度を伸べたる驅足にせよ。"
"2420","mori","sokkyo_shijin.txt","燃ゆる毒は我脈を循れり。"
"2421","mori","sokkyo_shijin.txt","そは世におそろしき戀の毒なり。"
"2422","mori","sokkyo_shijin.txt","異議なくば、あすをも待たで猶太の翁を訪へ。"
"2423","mori","sokkyo_shijin.txt","われ。"
"2424","mori","sokkyo_shijin.txt","そは餘りに無理なる囑なり。"
"2425","mori","sokkyo_shijin.txt","我が爲すべきことの面正しからぬはいふも更なり、汝が志すところも卑しき限ならずや。"
"2426","mori","sokkyo_shijin.txt","その少女｜縱令美しといふとも、猶太の翁が子なりといへば。"
"2427","mori","sokkyo_shijin.txt","士官。"
"2428","mori","sokkyo_shijin.txt","それ等は汝が解し得ざる事なり。"
"2429","mori","sokkyo_shijin.txt","貨だに善くば、その産地を問ふことを須ゐず。"
"2430","mori","sokkyo_shijin.txt","友よ、善き子よ。"
"2431","mori","sokkyo_shijin.txt","我がためにヘブライオスの語を學べ。"
"2432","mori","sokkyo_shijin.txt","我も諸共に學ばんとす。"
"2433","mori","sokkyo_shijin.txt","たゞその學びさまを殊にせんのみ。"
"2434","mori","sokkyo_shijin.txt","想へ、我がいかに幸ある人となるべきかを。"
"2435","mori","sokkyo_shijin.txt","我。"
"2436","mori","sokkyo_shijin.txt","わが心を傾けて汝に交るをば、汝知りたるべし。"
"2437","mori","sokkyo_shijin.txt","汝が意志、汝が勢力のおほいなる、常に我心を左右するをも、汝知りたるべし。"
"2438","mori","sokkyo_shijin.txt","汝若し惡人とならば、我おそらくは善人たることを得じ。"
"2439","mori","sokkyo_shijin.txt","そは怪しき力我を引きて汝が圈の中に入るればなり。"
"2440","mori","sokkyo_shijin.txt","我は素より我心を以て汝が行を匡さんとせず。"
"2441","mori","sokkyo_shijin.txt","人皆天賦の性あり。"
"2442","mori","sokkyo_shijin.txt","そが上に我は必ずしも汝が將に行はんとする所を以て罪なりとせず。"
"2443","mori","sokkyo_shijin.txt","汝が性然らしむればなり。"
"2444","mori","sokkyo_shijin.txt","されど此事は、縱令成りたらんも、汝が上にまことの福を降すべきものにあらずとおもへり。"
"2445","mori","sokkyo_shijin.txt","士官。"
"2446","mori","sokkyo_shijin.txt","善し／＼。"
"2447","mori","sokkyo_shijin.txt","我はたゞ汝に戲れたるのみ。"
"2448","mori","sokkyo_shijin.txt","我がために汝を驅りて懺悔の榻に就かしめんは、初より我願にあらず。"
"2449","mori","sokkyo_shijin.txt","たゞ汝がヘブライオスの語を學ばんに、いかなる障あるべきか、そは我に解せられず。"
"2450","mori","sokkyo_shijin.txt","況んやそを猶太の翁に學ぶことをや。"
"2451","mori","sokkyo_shijin.txt","されどこの事に就きては、我等また詞を費さゞるべし。"
"2452","mori","sokkyo_shijin.txt","今日は善くこそ我を訪ねつれ。"
"2453","mori","sokkyo_shijin.txt","物欲しからずや。"
"2454","mori","sokkyo_shijin.txt","酒飮まずや。"
"2455","mori","sokkyo_shijin.txt",""
"2456","mori","sokkyo_shijin.txt","友なる士官がかく話頭を轉じたるとき、我はその特なる目なざしを見き。"
"2457","mori","sokkyo_shijin.txt","こはベルナルドオが學校にありしとき屡※ハツバス・ダアダアに對してなしたる目なざしなりき。"
"2458","mori","sokkyo_shijin.txt","友の擧動、その言語、一つとして不興のしるしならぬはなし。"
"2459","mori","sokkyo_shijin.txt","我も快からねば程なく暇乞して還りぬ。"
"2460","mori","sokkyo_shijin.txt","別るゝときは友の恭しさ常に倍して、その冷なる手は我が温なる手を握りぬ。"
"2461","mori","sokkyo_shijin.txt","我はわが辭退の理に※へる、友の腹立ちしことの我儘に過ぎざるを信じたりき。"
"2462","mori","sokkyo_shijin.txt","されど或時は無聊に堪へずしてベルナルドオなつかしく、我詞の猶｜穩ならざるところありしを悔みぬ。"
"2463","mori","sokkyo_shijin.txt","一日散歩のついで、吾友の上をおもひつゝ、かの猶太廓に入りぬ。"
"2464","mori","sokkyo_shijin.txt","若し期せずして其人に逢はゞ、我友の怒を霽す便にもならんとおもひき。"
"2465","mori","sokkyo_shijin.txt","されど我は彼翁をだに見ざりき。"
"2466","mori","sokkyo_shijin.txt","門よりも窓よりも、知らぬ人面を出せり。"
"2467","mori","sokkyo_shijin.txt","街の兩側なる敷石の上には、例の古衣、古かねなど陳べたるその間には見苦き子供遊べり。"
"2468","mori","sokkyo_shijin.txt","物買はずや、物賣らずやと呼ぶ聲は、我を聾にせんとする如し。"
"2469","mori","sokkyo_shijin.txt","少女あり。"
"2470","mori","sokkyo_shijin.txt","向ひの家なる友と、窓より窓へ毬投げつゝ戲れ居たり。"
"2471","mori","sokkyo_shijin.txt","そが一人は頗美しと覺えき。"
"2472","mori","sokkyo_shijin.txt","吾友の戀人はもしこれにはあらずや。"
"2473","mori","sokkyo_shijin.txt","我は圖らず帽を脱したり。"
"2474","mori","sokkyo_shijin.txt","嗚呼、おろかなる振舞せしことよ。"
"2475","mori","sokkyo_shijin.txt","我は人の思はん程も影護くて、手もて額を拭ひつ。"
"2476","mori","sokkyo_shijin.txt","こは帽を脱したるは、少女のためならで、暑に堪へねばぞと、見る人におもはしめんとてなりき。"
"2477","mori","sokkyo_shijin.txt",""
"2478","mori","sokkyo_shijin.txt","一とせの月日は事なくして過ぎぬ。"
"2479","mori","sokkyo_shijin.txt","稀にベルナルドオに逢ふことありても、交情昔のごとくならず。"
"2480","mori","sokkyo_shijin.txt","我はそのやさしき假面の背後に、人に※る貴人の色あるを見て、友の無情なるを恨むのみにて、かの猶太廓の戀のなりゆきを問ふに遑あらざりき。"
"2481","mori","sokkyo_shijin.txt","ボルゲエゼの館をば頻におとづれて、主人の君、フアビアニ、フランチエスカの人々のやさしさに、故郷にある如き思をなしつ。"
"2482","mori","sokkyo_shijin.txt","されどそれさへ時としては胸を痛むる媒となることありき。"
"2483","mori","sokkyo_shijin.txt","我胸には慈愛に感ずる情みち／＼たれば、彼人々の一たび顰めることあるときは、徑に我世の光を蔽はるゝ如く思ひなりぬ。"
"2484","mori","sokkyo_shijin.txt","フランチエスカの我性を譽めつゝも、強ひて備はらんことを我に求めて、わが立居振舞、わが詞遣の疵を指すことの苛酷なる、主人の君のわが獨り物思ふことの人に踰えたるを戒めて、わが草木などの細かなる區別に心入れぬを咎め、我を自ら卷きて終には萎るゝ葉に比べたる、皆我心を苦むるものなりき。"
"2485","mori","sokkyo_shijin.txt","我齡は早く十六になりぬ。"
"2486","mori","sokkyo_shijin.txt","さるを斯ばかりの事に逢ひて、必ず涙を墮すは何故ぞや。"
"2487","mori","sokkyo_shijin.txt","主人の君は我が憂はしげなるさまを見るときは、又我頬を撫でゝ、聖母の善き人を得給はんためには、美しき花の壓さるゝ如く、人も壓されではかなはぬが浮世の習ぞと慰め給ひぬ。"
"2488","mori","sokkyo_shijin.txt","獨りフアビアニの君のみは、何事をもをかしき方に取りなして、岳翁と夫人との教の嚴なることよと打笑ひ、さて我に向ひてのたまふやう。"
"2489","mori","sokkyo_shijin.txt","君は父上の如き學者とはならざるべし。"
"2490","mori","sokkyo_shijin.txt","はた妻のやうに怜悧なる人ともならざるならん。"
"2491","mori","sokkyo_shijin.txt","されど君が如き性もまた世の中になくて協はぬものぞと宣ふ。"
"2492","mori","sokkyo_shijin.txt","斯く裁判し畢りて、小尼公を召し給へば、我はその遊び戲れ給ふさまのめでたきを見て、身の憂きことを忘れ果てつ。"
"2493","mori","sokkyo_shijin.txt","人々は來ん年を北伊太利にて暮さんとその心構し給へり。"
"2494","mori","sokkyo_shijin.txt","夏はジエノワにとゞまり、冬はミラノに往き給ふなるべし。"
"2495","mori","sokkyo_shijin.txt","我は來ん年の試驗にて、「アバテ」の位を受けんとす。"
"2496","mori","sokkyo_shijin.txt","人々は首途に先だちて、大いなる舞踏會を催し、我をも招き給ひぬ。"
"2497","mori","sokkyo_shijin.txt","門前には大篝を焚かせたり。"
"2498","mori","sokkyo_shijin.txt","賓客の車には皆｜松明とりたる先供あるが、おの／＼其火を石垣に設けたる鐵の柄に※したれば、火の子｜迸り落ちて赤き瀑布を見る心地す。"
"2499","mori","sokkyo_shijin.txt","法皇の兵は騎馬にて門の傍に控へたり。"
"2500","mori","sokkyo_shijin.txt","門の内なる小き園には五色の紙燈を弔り、正面なる大理石階には萬點の燭を點せり。"
"2501","mori","sokkyo_shijin.txt","階を升るときは奇香衣を襲ふ。"
"2502","mori","sokkyo_shijin.txt","こは級ごとに瓶花、盆栽の檸檬樹を据ゑたればなり。"
"2503","mori","sokkyo_shijin.txt","階の際なる兵は肩銃の禮を施しつ。"
"2504","mori","sokkyo_shijin.txt","「リフレア」着飾りたる僕は堂に滿ちたり。"
"2505","mori","sokkyo_shijin.txt","フランチエスカの君は眩きまで美かりき。"
"2506","mori","sokkyo_shijin.txt","珍らしき樂土鳥の羽、組緒多くつけたる白き「アトラス」の衣はこれに一層の美しさを添へたり。"
"2507","mori","sokkyo_shijin.txt","そのやさしき指に觸れたるときの我喜はいかなりし。"
"2508","mori","sokkyo_shijin.txt","廣間二つに樂の群を居らせて、客の舞踏の場としたり。"
"2509","mori","sokkyo_shijin.txt","舞ふ人の中にベルナルドオありき。"
"2510","mori","sokkyo_shijin.txt","金絲もて飾りたる緋｜羅紗の上衣、白き細袴、皆發育好き身形に適ひたり。"
"2511","mori","sokkyo_shijin.txt","その舞の敵手はこよひ集ひし少女の中にて、すぐれて美しき一人なるべし。"
"2512","mori","sokkyo_shijin.txt","纖き手をベルナルドオが肩に打ち掛けて秋波を送れり。"
"2513","mori","sokkyo_shijin.txt","我が舞を知らざることの可悔かりしことよ。"
"2514","mori","sokkyo_shijin.txt","客に相識る人少ければ、我を顧みるものなし。"
"2515","mori","sokkyo_shijin.txt","ベルナルドオが舞果てゝ我傍に來りしとき、我憂は忽ち散じたり。"
"2516","mori","sokkyo_shijin.txt","紅なる帷の長く垂れたる背後にて、我等二人は「シヤムパニエ」酒の杯を傾け、別後の情を語りぬ。"
"2517","mori","sokkyo_shijin.txt","面白き樂の調は耳より入りて胸に達し、昔日の不興をば少しも殘さず打ち消しつ。"
"2518","mori","sokkyo_shijin.txt","われ遠慮せで猶太少女の事を語り出でしに、友は唯だ高く笑ひぬ。"
"2519","mori","sokkyo_shijin.txt","その胸の内なる痍は早くも愈えて跡なきに至りしものなるべし。"
"2520","mori","sokkyo_shijin.txt","友のいはく。"
"2521","mori","sokkyo_shijin.txt","われはその後聲めでたき小鳥を捕へたり。"
"2522","mori","sokkyo_shijin.txt","この鳥我戀の病を歌ひ治しき。"
"2523","mori","sokkyo_shijin.txt","これある間は、よその鳥はその飛ぶに任せんのみ。"
"2524","mori","sokkyo_shijin.txt","その猶太廓より飛び去りしは事實なり。"
"2525","mori","sokkyo_shijin.txt","人の傳ふるが信ならば、今は羅馬にさへ居らぬやうなり。"
"2526","mori","sokkyo_shijin.txt","友と我とは又杯を擧げたり。"
"2527","mori","sokkyo_shijin.txt","泡立てる酒、賑はしき樂は我等が血を湧しつ。"
"2528","mori","sokkyo_shijin.txt","ベルナルドオは又舞踏の群に投ぜり。"
"2529","mori","sokkyo_shijin.txt","我は獨り殘りたれど、心の中には前に似ぬ樂しさを覺えき。"
"2530","mori","sokkyo_shijin.txt","街のかたを見おろせば、貧人の兒ども簇りて、松明より散る火の子を眺め、手を打ちて歡び呼べり。"
"2531","mori","sokkyo_shijin.txt","われも昔はかゝる兒どもの夥伴なりしに、今堂上にありて羅馬の貴族に交るやうになりたるは、いかなる神のみ惠ぞ。"
"2532","mori","sokkyo_shijin.txt","われは帷の蔭に跪きて神に謝したり。"
"2533","mori","sokkyo_shijin.txt",""
"2534","mori","sokkyo_shijin.txt",""
"2535","mori","sokkyo_shijin.txt","謝肉祭"
"2536","mori","sokkyo_shijin.txt",""
"2537","mori","sokkyo_shijin.txt","その夜は曉近くなりて歸りぬ。"
"2538","mori","sokkyo_shijin.txt","二日たちて人々は羅馬を立ち給ひぬ。"
"2539","mori","sokkyo_shijin.txt","ハツバス・ダアダアは日ごとに我を顧みて、ことしは「アバテ」の位受くべき歳ぞと、いましめ顏にいふ。"
"2540","mori","sokkyo_shijin.txt","されば此頃は文よむ窓を離れずして、ベルナルドオをも外の友をも尋ぬることなかりき。"
"2541","mori","sokkyo_shijin.txt","週を累ね月を積みて、試驗｜畢る日とはなりぬ。"
"2542","mori","sokkyo_shijin.txt",""
"2543","mori","sokkyo_shijin.txt","黒き衣、短き絹の外套。"
"2544","mori","sokkyo_shijin.txt","是れ久しく夢みし「アバテ」の服ならずや。"
"2545","mori","sokkyo_shijin.txt","目に觸るゝもの一つとして我を祝せざるなし。"
"2546","mori","sokkyo_shijin.txt","街を走る吹聽人はいふも更なり、今咲き出づる「アネモオネ」の花、高く聳ゆる松の末より空飛ぶ雲にいたるまで、皆我を祝する如し。"
"2547","mori","sokkyo_shijin.txt","恰も好しフランチエスカの君は、臨時の費もあるべく又日ごろの勞をも忘れしめんとて、百「スクヂイ」の爲換を送り給ひぬ。"
"2548","mori","sokkyo_shijin.txt","我はあまりの嬉さに、西班牙磴を驅け上りて、ペツポのをぢに光ある「スクウド」一つ抛げ與へ、そのアントニオの主公と呼ぶ聲を後に聞きて馳せ去りぬ。"
"2549","mori","sokkyo_shijin.txt",""
"2550","mori","sokkyo_shijin.txt","頃は二月の初なりき。"
"2551","mori","sokkyo_shijin.txt","杏花は盛に開きたり。"
"2552","mori","sokkyo_shijin.txt","柑子の木日を逐ひて黄ばめり。"
"2553","mori","sokkyo_shijin.txt","謝肉祭は既に戸外に來りぬ。"
"2554","mori","sokkyo_shijin.txt","馬に跨り天鵞絨の幟を建て、喇叭を吹きて、祭の前觸する男も、ことしは我がためにかく晴々しくいでたちしかと疑はる。"
"2555","mori","sokkyo_shijin.txt","ことしまでは我この祭のまことの樂しさを知らざりき。"
"2556","mori","sokkyo_shijin.txt","穉かりし程は、母上我に怪我せさせじとて、とある街の角に佇みて祭の盛を見せ給ひしのみ。"
"2557","mori","sokkyo_shijin.txt","學校に入りてよりは、「パラツツオオ、デル、ドリア」の廡作りの平屋根より笑ひ戲るゝ群を見ることを許されしのみ。"
"2558","mori","sokkyo_shijin.txt","すべて街のこなたよりかなたへ行くことだに自由ならず。"
"2559","mori","sokkyo_shijin.txt","矧や「カピトリウム」に登り、「トラステヱエル」（河東の地なり、テヱエル河の東岸に當れる羅馬の一部を謂ふ）に渡らんこと思ひも掛けざりき。"
"2560","mori","sokkyo_shijin.txt","かゝれば我がことしの祭に身を委ねて、兒どもの樣なる物狂ほしき振舞せしも、無理ならぬ事ならん。"
"2561","mori","sokkyo_shijin.txt","唯だ怪しきは此祭我生涯の境遇を一變するに至りしことなり。"
"2562","mori","sokkyo_shijin.txt","されどこれも我がむかし蒔きて、久しく忘れ居たりし種の、今緑なる蔓草となりて、わが命の木に纏へるなるべし。"
"2563","mori","sokkyo_shijin.txt",""
"2564","mori","sokkyo_shijin.txt","祭は全く我心を奪ひき。"
"2565","mori","sokkyo_shijin.txt","朝にはポヽロの廣こうぢに出でゝ、競馬の準備を觀、夕にはコルソオの大道をゆきかへりて、店々の窓に曝せる假粧の衣類を閲しつ。"
"2566","mori","sokkyo_shijin.txt","我は可笑しき振舞せんに宜しからんとおもへば、状師の服を借りて歸りぬ。"
"2567","mori","sokkyo_shijin.txt","これを衣て云ふべきこと爲すべきことの心にかゝりて、其夜は殆と眠らざりき。"
"2568","mori","sokkyo_shijin.txt",""
"2569","mori","sokkyo_shijin.txt","明日の祭は特に尊きものゝ如く思はれぬ。"
"2570","mori","sokkyo_shijin.txt","我喜は兒童の喜に遜らざりき。"
"2571","mori","sokkyo_shijin.txt","横街といふ横街には「コンフエツチイ」の丸賣る浮鋪簷を列べて、その卓の上には美しき貨物を盛り上げたり。"
"2572","mori","sokkyo_shijin.txt","（「コンフエツチイ」の丸は石灰を豌豆豆」］の大さに煉りたるなり。"
"2573","mori","sokkyo_shijin.txt","白きと赤きと雜りたり。"
"2574","mori","sokkyo_shijin.txt","中には穀物の粒を石膏泥中に轉して作れるあり。"
"2575","mori","sokkyo_shijin.txt","謝肉祭の間は人々互に此丸を擲ちて戲るゝを習とす。"
"2576","mori","sokkyo_shijin.txt","）コルソオの街を灑掃する役夫は夙に業を始めつ。"
"2577","mori","sokkyo_shijin.txt","家々の窓よりは彩氈を垂れたり。"
"2578","mori","sokkyo_shijin.txt","佛蘭西時刻の三點に我は「カピトリウム」に出でゝ祭の始を待ち居たり。"
"2579","mori","sokkyo_shijin.txt","（伊太利時刻は日沒を起點とす。"
"2580","mori","sokkyo_shijin.txt","かの「アヱ、マリア」の鐘鳴るは一時なり。"
"2581","mori","sokkyo_shijin.txt","これより進みて二十四時を數ふ。"
"2582","mori","sokkyo_shijin.txt","毎週一度｜日景を瞻て、※を進退すること四分一時。"
"2583","mori","sokkyo_shijin.txt","所謂佛蘭西時刻は羅馬の人常の歐羅巴時刻を指してしかいふなり。"
"2584","mori","sokkyo_shijin.txt","）出窓には貴き外國人多く並みゐたり。"
"2585","mori","sokkyo_shijin.txt","議官は紫衣を纏ひて天鵞絨の椅子に坐せり。"
"2586","mori","sokkyo_shijin.txt","法皇の禁軍なる瑞西兵整列したる左翼の方には、天鵞絨の帽を戴ける可愛らしき舍人ども群居たり。"
"2587","mori","sokkyo_shijin.txt","少焉ありて猶太宗徒の宿老の一行進み來て、頭を露して議官の前に跪きぬ。"
"2588","mori","sokkyo_shijin.txt","その眞中なるを見れば、美しき娘持てりといふ彼ハノホにぞありける。"
"2589","mori","sokkyo_shijin.txt","式の辭をばハノホ陳べたり。"
"2590","mori","sokkyo_shijin.txt","我宗徒のこの神聖なる羅馬の市の一廓に栖まんことをば、今一とせ許させ給へ。"
"2591","mori","sokkyo_shijin.txt","歳に一たびは加特力の御寺に詣でゝ、尊き説法を承り候はん。"
"2592","mori","sokkyo_shijin.txt","又昔の例に沿ひて、羅馬人の見る前にて、コルソオを奔らんことをば、今年も免ぜられんことを願ふなり。"
"2593","mori","sokkyo_shijin.txt","若しこの願かなはゞ、競馬の費、これに勝ちたるものに與ふる賞、天鵞絨の幟の代、皆｜法の如く辨へ候はんといふ。"
"2594","mori","sokkyo_shijin.txt","議官は頷きぬ。"
"2595","mori","sokkyo_shijin.txt","（古例に依れば、この時議官足もておも立ちたる猶太の宿老の肩を踏むことありき。"
"2596","mori","sokkyo_shijin.txt","今は廢れたり。"
"2597","mori","sokkyo_shijin.txt","）事果つれば、議官の一列樂聲と倶に階を下り、舍人等を隨へて、美しき車に乘り遷れり。"
"2598","mori","sokkyo_shijin.txt","是を祭の始とす。"
"2599","mori","sokkyo_shijin.txt","「カピトリウム」の巨鐘は響き渡りて、全都の民を呼び出せり。"
"2600","mori","sokkyo_shijin.txt","我は急ぎ歸りて、かの状師の服に着換へ、再び街に出でしに、假裝の群は早く我を邀へて目禮す。"
"2601","mori","sokkyo_shijin.txt","この群は祭の間のみ王侯に同じき權利を得たる工人と見えたり。"
"2602","mori","sokkyo_shijin.txt","その假裝には價極めて卑きものを揀びたれど、その特色は奪ふべからず。"
"2603","mori","sokkyo_shijin.txt","常の衣の上に粗※の汗衫を被りたるが、その衫の上に縫附けたる檸檬の殼は大いなる鈕に擬へたるなり。"
"2604","mori","sokkyo_shijin.txt","肩と※とには青菜を結びつけたり。"
"2605","mori","sokkyo_shijin.txt","頭に戴けるは「フイノツキイ」（俗曲中にて無遠慮なる公民を代表したる役なり）の假髮にて、目に懸けたるは柚子の皮を刳りぬきて作りし眼鏡なり。"
"2606","mori","sokkyo_shijin.txt","我は彼等に對ひて立ち、手に持ちたる刑法の卷を開きてさし示し、見よ、分を踰えたる衣服の奢は國法の許さゞるところなるぞ、我が告發せん折に臍を噬む悔あらんと喝したり。"
"2607","mori","sokkyo_shijin.txt","工人は拍手せり。"
"2608","mori","sokkyo_shijin.txt","我は進みてコルソオに出でたるに、こゝは早や變じて假裝舞の廣間となりたり。"
"2609","mori","sokkyo_shijin.txt","四方の窓より垂れたる彩氈は、唯だおほいなる欄の如く見ゆ。"
"2610","mori","sokkyo_shijin.txt","家々の簷端には、無數の椅子を並べて、善き場所はこゝぞと叫ぶ際物師あり。"
"2611","mori","sokkyo_shijin.txt","街を行く車は皆正しき往還の二列をなしたるが、これに乘れる人多くは假裝したり。"
"2612","mori","sokkyo_shijin.txt","中にも月桂の枝もて車輪を賁りたるあり。"
"2613","mori","sokkyo_shijin.txt","そのさま四阿屋の行くが如し。"
"2614","mori","sokkyo_shijin.txt","家と車との隙間をば樂しげなる人｜填めたり。"
"2615","mori","sokkyo_shijin.txt","窓には見物の人々充ちたり。"
"2616","mori","sokkyo_shijin.txt","そが間には軍服に假髭したる羅馬美人ありて、街上なる知人に「コンフエツチイ」の丸を擲てり。"
"2617","mori","sokkyo_shijin.txt","我これに向ひて、「コンフエツチイ」もて人の面を撃つは、國法の問ふところにあらねど、美しき目より火箭を放ちて人の胸を射るは、容易ならぬ事なれば許し難しと論告せしに、喝采の聲と倶に、花の雨は我頭上に降り灑ぎぬ。"
"2618","mori","sokkyo_shijin.txt","公民の妻と覺しき婦人の際立ちて飾り衒へるあり。"
"2619","mori","sokkyo_shijin.txt","權夫（夫に代りて婦人に仕ふる者、「チチスベオ」）と覺しき男これに扈從したり。"
"2620","mori","sokkyo_shijin.txt","この時我はぬけ道の前に立ちたるが、道化役に打扮ちたる一群｜戲に相鬪へるがために、しばし往還の便を失ひて、かの婦人と向きあひゐたり。"
"2621","mori","sokkyo_shijin.txt","我は廼ちこれに對して論じていはく。"
"2622","mori","sokkyo_shijin.txt","君よ。"
"2623","mori","sokkyo_shijin.txt","かくても誓に負かざることを得るか。"
"2624","mori","sokkyo_shijin.txt","かくても羅馬の俗、加特力の教に背かざることを得るか。"
"2625","mori","sokkyo_shijin.txt","嗚呼、タルクヰニウス・コルラチニウスが妻なるルクレチア（辱を受けて自殺す、事は羅馬王代の末、紀元前五百九年に在り）は今｜安にか在る。"
"2626","mori","sokkyo_shijin.txt","君は今の女子の爲すところに倣ひて、謝肉祭の間、夫を河東に遣りて、僧と倶に精進せしめ給ふならん。"
"2627","mori","sokkyo_shijin.txt","君が良人は寺院の垣の内に籠りて日夜苦行し、復た滿城の士女狂せるが如きを顧みず、其心には、あはれ我最愛の妻も家に籠りて齋戒するよとおもふならん。"
"2628","mori","sokkyo_shijin.txt","さるを君は何の心ぞ。"
"2629","mori","sokkyo_shijin.txt","この時に乘じて自在に翼を振ひ、權夫に引かれてコルソオをそゞろありきし給ふ。"
"2630","mori","sokkyo_shijin.txt","君よ。"
"2631","mori","sokkyo_shijin.txt","我は刑法第十六章第二十七條に依りて、君が罪を糺さんとす。"
"2632","mori","sokkyo_shijin.txt","語未だ畢らざるに、婦人は手中の扇をあげてしたゝかに我面を撃ちたり。"
"2633","mori","sokkyo_shijin.txt","その撃ちかたの強さより推すに、我は偶※女の身上を占ひて善く中てたるものならん。"
