"","auth","piece","line"
"0","akutagawa","chokoyuki.txt","長江游記"
"1","akutagawa","chokoyuki.txt","芥川龍之介"
"2","akutagawa","chokoyuki.txt",""
"3","akutagawa","chokoyuki.txt","-------------------------------------------------------"
"4","akutagawa","chokoyuki.txt","【テキスト中に現れる記号について】"
"5","akutagawa","chokoyuki.txt",""
"6","akutagawa","chokoyuki.txt","《》：ルビ"
"7","akutagawa","chokoyuki.txt","（例）長江"
"8","akutagawa","chokoyuki.txt",""
"9","akutagawa","chokoyuki.txt","｜：ルビの付く文字列の始まりを特定する記号"
"10","akutagawa","chokoyuki.txt","（例）一名｜大花園"
"11","akutagawa","chokoyuki.txt",""
"12","akutagawa","chokoyuki.txt","：入力者注主に外字の説明や、傍点の位置の指定"
"13","akutagawa","chokoyuki.txt","（数字は、JIS_X_0213の面区点番号またはUnicode、底本のページと行数）"
"14","akutagawa","chokoyuki.txt","（例）※"
"15","akutagawa","chokoyuki.txt","-------------------------------------------------------"
"16","akutagawa","chokoyuki.txt",""
"17","akutagawa","chokoyuki.txt","前置き"
"18","akutagawa","chokoyuki.txt",""
"19","akutagawa","chokoyuki.txt","これは三年前支那に遊び、長江を溯った時の紀行である。"
"20","akutagawa","chokoyuki.txt","こう云う目まぐるしい世の中に、三年前の紀行なぞは誰にも興味を与えないかも知れない。"
"21","akutagawa","chokoyuki.txt","が、人生を行旅とすれば、畢竟あらゆる追憶は数年前の紀行である。"
"22","akutagawa","chokoyuki.txt","私の文章の愛読者諸君は「堀川保吉」に対するように、この「長江」の一篇にもちらりと目をやってくれないであろうか？"
"23","akutagawa","chokoyuki.txt","私は長江を溯った時、絶えず日本を懐しがっていた。"
"24","akutagawa","chokoyuki.txt","しかし今は日本に、――炎暑の甚しい東京に汪洋たる長江を懐しがっている。"
"25","akutagawa","chokoyuki.txt","長江を？――いや、長江ばかりではない、蕪湖を、漢口を、廬山の松を、洞庭の波を懐しがっている。"
"26","akutagawa","chokoyuki.txt","私の文章の愛読者諸君は「堀川保吉」に対するように、この私の追憶癖にもちらりと目をやってはくれないであろうか？"
"27","akutagawa","chokoyuki.txt",""
"28","akutagawa","chokoyuki.txt",""
"29","akutagawa","chokoyuki.txt","一蕪湖"
"30","akutagawa","chokoyuki.txt",""
"31","akutagawa","chokoyuki.txt","私は西村貞吉と一しょに蕪湖の往来を歩いていた。"
"32","akutagawa","chokoyuki.txt","往来は此処も例の通り、日さえ当らない敷石道である。"
"33","akutagawa","chokoyuki.txt","両側には銀楼だの酒桟だの、見慣れた看板がぶら下っているが、一月半も支那にいた今では、勿論珍しくも何ともない。"
"34","akutagawa","chokoyuki.txt","おまけに一輪車の通る度に、きいきい心棒を軋ませるのは、頭痛さえしかねない騒々しさである。"
"35","akutagawa","chokoyuki.txt","私は暗澹たる顔をしながら、何と西村に話しかけられても、好い加減な返事をするばかりだった。"
"36","akutagawa","chokoyuki.txt",""
"37","akutagawa","chokoyuki.txt","西村は私を招く為に、何度も上海へ手紙を出している。"
"38","akutagawa","chokoyuki.txt","殊に蕪湖へ着いた夜なぞはわざわざ迎えの小蒸気を出したり、歓迎の宴を催したり、いろいろ深切を尽してくれた。"
"39","akutagawa","chokoyuki.txt","（しかもわたしの乗った鳳陽丸は浦口を発するのが遅かった為に、こう云う彼の心尽しも悉水泡に帰したのである。"
"40","akutagawa","chokoyuki.txt","）のみならず彼の社宅たる唐家花園に落ち着いた後も、食事とか着物とか寝具とか、万事に気を配ってくれるのには、実際恐れ入るより外はなかった。"
"41","akutagawa","chokoyuki.txt","して見ればこの東道の主人の前へも、二日間の蕪湖滞在は愉快に過さねばならぬ筈である。"
"42","akutagawa","chokoyuki.txt","しかし私の紳士的礼譲も、蝉に似た西村の顔を見ると、忽何処かに消滅してしまう。"
"43","akutagawa","chokoyuki.txt","これは西村の罪ではない。"
"44","akutagawa","chokoyuki.txt","君僕の代りにお前おれを使う、我々の親みの罪である。"
"45","akutagawa","chokoyuki.txt","さもなければ往来の真ん中に、尿をする豚と向い合った時も、あんなに不快を公表する事は、当分差控える気になったかも知れない。"
"46","akutagawa","chokoyuki.txt",""
"47","akutagawa","chokoyuki.txt","「つまらない所だな、蕪湖と云うのは。"
"48","akutagawa","chokoyuki.txt","――いや一蕪湖ばかりじゃないね。"
"49","akutagawa","chokoyuki.txt","おれはもう支那には飽き厭きしてしまった。"
"50","akutagawa","chokoyuki.txt","」"
"51","akutagawa","chokoyuki.txt","「お前は一体コシャマクレテいるからな。"
"52","akutagawa","chokoyuki.txt","支那は性に合わないのかも知れない。"
"53","akutagawa","chokoyuki.txt","」"
"54","akutagawa","chokoyuki.txt","西村は横文字は知っていても、日本語は甚未熟である。"
"55","akutagawa","chokoyuki.txt","「こましゃくれる」を「コシャマクレル」、鶏冠を「トカサ」、懐を「フトロコ」、「がむしゃら」を「ガラムシャ」――その外日本語を間違える事は殆挙げて数えるのに堪えない。"
"56","akutagawa","chokoyuki.txt","私は西村に日本語を教えにわざわざ渡来した次第でもないから、仏頂面をして見せたぎり、何とも答えず歩き続けた。"
"57","akutagawa","chokoyuki.txt",""
"58","akutagawa","chokoyuki.txt","すると稍幅の広い往来に、女の写真を並べた家があった。"
"59","akutagawa","chokoyuki.txt","その前に閑人が五六人、つらつら写真の顔を見ては、何か静に話している。"
"60","akutagawa","chokoyuki.txt","これは何だと聞いて見たら、済良所だと云う答があった。"
"61","akutagawa","chokoyuki.txt","済良所と云うのは養育院じゃない。"
"62","akutagawa","chokoyuki.txt","自由廃業の女を保護する所である。"
"63","akutagawa","chokoyuki.txt",""
"64","akutagawa","chokoyuki.txt","一通り町を遍歴した後、西村は私を倚陶軒、一名｜大花園と云う料理屋へつれて行った。"
"65","akutagawa","chokoyuki.txt","此処は何でも李鴻章の別荘だったとか云う事である。"
"66","akutagawa","chokoyuki.txt","が、園へはいった時の感じは、洪水後の向島あたりと違いはない。"
"67","akutagawa","chokoyuki.txt","花木は少いし、土は荒れているし、「陶塘」の水も濁っているし、家の中はがらんとしているし、殆御茶屋と云う物とは、最も縁の遠い光景である。"
"68","akutagawa","chokoyuki.txt","我々は軒の鸚鵡の籠を見ながら、さすがに味だけはうまい支那料理を食った。"
"69","akutagawa","chokoyuki.txt","が、この御馳走になっている頃から、支那に対する私の嫌悪はだんだん逆上の気味を帯び始めた。"
"70","akutagawa","chokoyuki.txt",""
"71","akutagawa","chokoyuki.txt","その夜唐家花園のバルコンに、西村と籐椅子を並べていた時、私は莫迦莫迦しい程熱心に現代の支那の悪口を云った。"
"72","akutagawa","chokoyuki.txt","現代の支那に何があるか？政治、学問、経済、芸術、悉堕落しているではないか？殊に芸術となった日には、嘉慶道光の間以来、一つでも自慢になる作品があるか？しかも国民は老若を問わず、太平楽ばかり唱えている。"
"73","akutagawa","chokoyuki.txt","成程若い国民の中には、多少の活力も見えるかも知れない。"
"74","akutagawa","chokoyuki.txt","しかし彼等の声と雖も、全国民の胸に響くべき、大いなる情熱のないのは事実である。"
"75","akutagawa","chokoyuki.txt","私は支那を愛さない。"
"76","akutagawa","chokoyuki.txt","愛したいにしても愛し得ない。"
"77","akutagawa","chokoyuki.txt","この国民的腐敗を目撃した後も、なお且支那を愛し得るものは、頽唐を極めたセンジュアリストか、浅薄なる支那趣味の※※者であろう。"
"78","akutagawa","chokoyuki.txt","いや、支那人自身にしても、心さえ昏んでいないとすれば、我々一介の旅客よりも、もっと嫌悪に堪えない筈である。"
"79","akutagawa","chokoyuki.txt","……"
"80","akutagawa","chokoyuki.txt","私は盛に弁じ立てた。"
"81","akutagawa","chokoyuki.txt","バルコンの外の槐の梢は、ひっそりと月光に涵されている。"
"82","akutagawa","chokoyuki.txt","この槐の梢の向う、――幾つかの古池を抱えこんだ、白壁の市街の尽きる所は揚子江の水に違いない。"
"83","akutagawa","chokoyuki.txt","その水の汪々と流れる涯には、ヘルンの夢みた蓬莱のように懐しい日本の島山がある。"
"84","akutagawa","chokoyuki.txt","ああ、日本へ帰りたい。"
"85","akutagawa","chokoyuki.txt",""
"86","akutagawa","chokoyuki.txt","「お前なんぞは何時でも帰れるじゃないか？」"
"87","akutagawa","chokoyuki.txt","ノスタルジアに感染した西村は月明りの中に去来する、大きい蛾の姿を眺めながら、殆独語のようにこう云った。"
"88","akutagawa","chokoyuki.txt","私の滞在はどう考えても、西村には為にならなかったらしい。"
"89","akutagawa","chokoyuki.txt",""
"90","akutagawa","chokoyuki.txt",""
"91","akutagawa","chokoyuki.txt","二溯江"
"92","akutagawa","chokoyuki.txt",""
"93","akutagawa","chokoyuki.txt","私は溯江の汽船へ三艘乗った。"
"94","akutagawa","chokoyuki.txt","上海から蕪湖までは鳳陽丸、蕪湖から九江までは南陽丸、九江から漢口までは大安丸である。"
"95","akutagawa","chokoyuki.txt",""
"96","akutagawa","chokoyuki.txt","鳳陽丸に乗った時は、偉い丁抹人と一しょになった。"
"97","akutagawa","chokoyuki.txt","客の名は盧糸、横文字に書けば Roose である。"
"98","akutagawa","chokoyuki.txt","何でも支那を縦横する事、二十何年と云うのだから、当世のマルコ・ポオロと思えば間違いない。"
"99","akutagawa","chokoyuki.txt","この豪傑が暇さえあると、私だの同船の田中君だのを捉えては、三十｜何呎の蟒蛇を退治した話や、広東の盗侠ランクワイセン（漢字ではどんな字に当るのだか、ルウズ氏自身も知らなかった。"
"100","akutagawa","chokoyuki.txt","）の話や、河南直隷の飢饉の話や、虎狩豹狩の話なぞを滔々と弁じ来り弁じ去ってくれた。"
"101","akutagawa","chokoyuki.txt","その中でも面白かったのは、食卓を共にした亜米利加人の夫婦と、東西両洋の愛を論じた時である。"
"102","akutagawa","chokoyuki.txt","この亜米利加人の夫婦、――殊に細君に至っては、東洋に対する西洋の侮蔑に踵の高い靴をはかせた如き、甚横柄な女人だった。"
"103","akutagawa","chokoyuki.txt","彼女の見る所に従えば、支那人は勿論日本人も、ラヴと云う事を知っていない。"
"104","akutagawa","chokoyuki.txt","彼等の曚昧は憐むべしである。"
"105","akutagawa","chokoyuki.txt","これを聞いたルウズ氏は、カリイの皿に向いながら、忽異議を唱え出した。"
"106","akutagawa","chokoyuki.txt","いや、愛の何たるかは東洋人と雖も心得ている。"
"107","akutagawa","chokoyuki.txt","たとえば或四川の少女は、――と得意の見聞を吹聴すると、細君はバナナの皮を剥きかけた儘、いや、それは愛ではない、単なる憐憫に過ぎぬと云う。"
"108","akutagawa","chokoyuki.txt","するとルウズ氏は頑強に、では或日本東京の少女は、――と又実例をつきつけ始める。"
"109","akutagawa","chokoyuki.txt","とうとうしまいには相手の細君も、怒火心頭に発したのであろう、突然食卓を離れると、御亭主と一しょに出て行ってしまった。"
"110","akutagawa","chokoyuki.txt","私はその時のルウズ氏の顔を未にはっきり覚えている。"
"111","akutagawa","chokoyuki.txt","先生は我々黄色い仲間へ、人の悪い微笑を送るが早いか、人さし指に額を叩きながら、「ナロウ・マインデット」とか何とか云った。"
"112","akutagawa","chokoyuki.txt","生憎この夫婦の亜米利加人は、南京で船を下りてしまったが、ずっと溯江を続けたとすれば、もっといろいろ面白い波瀾を巻き起していたのに相違ない。"
"113","akutagawa","chokoyuki.txt",""
"114","akutagawa","chokoyuki.txt","蕪湖から乗った南陽丸では、竹内栖鳳氏の一行と一しょだった。"
"115","akutagawa","chokoyuki.txt","栖鳳氏も九江に下船の上、廬山に登る事になっていたから、私は令息、――どうも可笑しい。"
"116","akutagawa","chokoyuki.txt","令息には正に違いないが、余り懇意に話をしたせいか、令息と呼ぶのは空々しい気がする。"
"117","akutagawa","chokoyuki.txt","が、兎に角その令息の逸氏なぞと愉快に溯江を続ける事が出来た。"
"118","akutagawa","chokoyuki.txt","何しろ長江は大きいと云っても、結局海ではないのだから、ロオリングも来なければピッチングも来ない。"
"119","akutagawa","chokoyuki.txt","船は唯機械のベルトのようにひた流れに流れる水を裂きながら、悠々と西へ進むのである。"
"120","akutagawa","chokoyuki.txt","この点だけでも長江の旅は船に弱い私には愉快だった。"
"121","akutagawa","chokoyuki.txt",""
"122","akutagawa","chokoyuki.txt","水は前にも云った通り、金※に近い代赭である。"
"123","akutagawa","chokoyuki.txt","が、遠い川の涯は青空の反射も加わるから、大体｜刃金色に見えぬ事はない。"
"124","akutagawa","chokoyuki.txt","其処を名高い大筏が二艘も三艘も下って来る。"
"125","akutagawa","chokoyuki.txt","現に私の実見した中にも、豚を飼っている筏があったから、成程飛び切りの大筏になると、一村落を載せたものもあるかも知れない。"
"126","akutagawa","chokoyuki.txt","又筏とは云うものの、屋根もあるし壁もあるし、実は水に浮んだ家屋である。"
"127","akutagawa","chokoyuki.txt","南陽丸の船長竹下氏の話では、これらの筏に乗っているのは雲南貴州等の土人だと云う。"
"128","akutagawa","chokoyuki.txt","彼等はそう云う山の中から、万里の濁流の押し流す儘に、悠々と江を下って来る。"
"129","akutagawa","chokoyuki.txt","そうして浙江安徽等の町々へ無事に流れついた時、筏に組んで来た木材を金に換える。"
"130","akutagawa","chokoyuki.txt","その道中短きものは五六箇月、長きものは殆一箇年、家を出る時は妻だった女も、家へ帰る時は母になるそうである。"
"131","akutagawa","chokoyuki.txt","しかし長江を去来するのは、勿論この筏のように、原始時代の遺物に限った訣じゃない。"
"132","akutagawa","chokoyuki.txt","一度は亜米利加の砲艦が一艘、小蒸気に標的を牽かせながら、実弾射撃なぞをしていた事もある。"
"133","akutagawa","chokoyuki.txt",""
"134","akutagawa","chokoyuki.txt","江の広い事も前に書いた。"
"135","akutagawa","chokoyuki.txt","が、これも三角洲があるから、一方の岸には遠い時でも、必一方には草色が見える。"
"136","akutagawa","chokoyuki.txt","いや、草色ばかりじゃない。"
"137","akutagawa","chokoyuki.txt","水田の稲の戦ぎも見える。"
"138","akutagawa","chokoyuki.txt","楊柳の水に生え入ったのも見える。"
"139","akutagawa","chokoyuki.txt","水牛がぼんやり立ったのも見える。"
"140","akutagawa","chokoyuki.txt","青い山は勿論幾つも見える。"
"141","akutagawa","chokoyuki.txt","私は支那へ出かける前、小杉未醒氏と話していたら、氏は旅先の注意の中にこう云う事をつけ加えた。"
"142","akutagawa","chokoyuki.txt",""
"143","akutagawa","chokoyuki.txt","「長江は水が低くってね、両岸がずっと高いから、船の高い所へ上るんですね。"
"144","akutagawa","chokoyuki.txt","船長のいる、――何と云うかな、あの高い所があるでしょう。"
"145","akutagawa","chokoyuki.txt","あすこへ上らねえと、眺望が利きませんよ。"
"146","akutagawa","chokoyuki.txt","あすこは普通の客はのせねえから、何とか船長を護摩かすんですね。"
"147","akutagawa","chokoyuki.txt","……」"
"148","akutagawa","chokoyuki.txt","私は先輩の云う事だから、鳳陽丸でも南陽丸でも、江上の眺望を恣にする為に、始終船長を護摩かそうとしていた。"
"149","akutagawa","chokoyuki.txt","処が南陽丸の竹下船長はまだ護摩かしにかからない内からサロンの屋根にある船長室へ、深切にも私を招待してくれた。"
"150","akutagawa","chokoyuki.txt","しかし此処へ上って見ても、格別風景には変りもない。"
"151","akutagawa","chokoyuki.txt","実際又甲板にいても、ちゃんと陸地は見渡せたのである。"
"152","akutagawa","chokoyuki.txt","私は妙に思ったから、護摩かそうとした意志を白状した上、船長にその訣を尋ねて見た。"
"153","akutagawa","chokoyuki.txt","すると船長は笑い出した。"
"154","akutagawa","chokoyuki.txt",""
"155","akutagawa","chokoyuki.txt","「それは小杉さんの来られた時はまだ水が少かったのでしょう。"
"156","akutagawa","chokoyuki.txt","漢口あたりの水面の高低は、夏冬に四十五六｜呎も違いますよ。"
"157","akutagawa","chokoyuki.txt","」"
"158","akutagawa","chokoyuki.txt",""
"159","akutagawa","chokoyuki.txt","三廬山（上）"
"160","akutagawa","chokoyuki.txt",""
"161","akutagawa","chokoyuki.txt","若葉を吐いた立ち木の枝に豚の死骸がぶら下っている。"
"162","akutagawa","chokoyuki.txt","それも皮を剥いだ儘、後足を上にぶら下っている。"
"163","akutagawa","chokoyuki.txt","脂肪に蔽われた豚の体は気味の悪い程まっ白である。"
"164","akutagawa","chokoyuki.txt","私はそれを眺めながら、一体豚を逆吊りにして、何が面白いのだろうと考えた。"
"165","akutagawa","chokoyuki.txt","吊下げる支那人も悪趣味なら、吊下げられる豚も間が抜けている。"
"166","akutagawa","chokoyuki.txt","所詮支那程下らない国は何処にもあるまいと考えた。"
"167","akutagawa","chokoyuki.txt",""
"168","akutagawa","chokoyuki.txt","その間に大勢の苦力どもは我々の駕籠の支度をするのに、腹の立つ程騒いでいる。"
"169","akutagawa","chokoyuki.txt","勿論苦力に碌な人相はない。"
"170","akutagawa","chokoyuki.txt","しかし殊に獰猛なのは苦力の大将の顔である。"
"171","akutagawa","chokoyuki.txt","この大将の麦藁帽は Kuling Estate Head Coolie No* とか横文字を抜いた、黒いリボンを巻きつけている。"
"172","akutagawa","chokoyuki.txt","昔 Marius the Epicurean は、蛇使いが使う蛇の顔に、人間じみた何かを感じたと云う。"
"173","akutagawa","chokoyuki.txt","私は又この苦力の顔に蛇らしい何かを感じたのである。"
"174","akutagawa","chokoyuki.txt","愈支那は気に食わない。"
"175","akutagawa","chokoyuki.txt",""
"176","akutagawa","chokoyuki.txt","十分の後、我々一行八人は籐椅子の駕籠に揺られながら、石だらけの路を登り出した。"
"177","akutagawa","chokoyuki.txt","一行とは竹内栖鳳氏の一族郎党、並に大元洋行のお上さんである。"
"178","akutagawa","chokoyuki.txt","駕籠の乗り心地は思ったよりも好い。"
"179","akutagawa","chokoyuki.txt","私はその駕籠の棒に長々と両足を伸ばしながら、廬山の風光を楽んで行った。"
"180","akutagawa","chokoyuki.txt","と云うと如何にも体裁が好いが、風光は奇絶でも何でもない。"
"181","akutagawa","chokoyuki.txt","唯雑木の茂った間に、山空木が咲いているだけである。"
"182","akutagawa","chokoyuki.txt","廬山らしい気などは少しもしない。"
"183","akutagawa","chokoyuki.txt","これならば、支那へ渡らずとも、箱根の旧道を登れば沢山である。"
"184","akutagawa","chokoyuki.txt",""
"185","akutagawa","chokoyuki.txt","前の晩私は九江にとまった。"
"186","akutagawa","chokoyuki.txt","ホテルは即ち大元洋行である。"
"187","akutagawa","chokoyuki.txt","その二階に寝ころびながら、康白情氏の詩を読んでいると、潯陽江に泊した支那の船から、蛇皮線だか何かの音がして来る。"
"188","akutagawa","chokoyuki.txt","それは兎に角風流な気がした。"
"189","akutagawa","chokoyuki.txt","が、翌朝になって見ると、潯陽江に候と威張っていても、やはり赤濁りの溝川だった。"
"190","akutagawa","chokoyuki.txt","楓葉荻花秋瑟瑟などと云う、洒落れた趣は何処にもない。"
"191","akutagawa","chokoyuki.txt","川には木造の軍艦が一艘、西郷征伐に用いたかの如き、怪しげな大砲の口を出しながら、琵琶亭のほとりに繋っている。"
"192","akutagawa","chokoyuki.txt","では猩猩は少時措き、浪裡白跳張順か黒旋風李逵でもいるかと思えば、眼前の船の篷の中からは、醜悪恐るべき尻が出ている。"
"193","akutagawa","chokoyuki.txt","その尻が又大胆にも、――甚尾籠な申し条ながら、悠々と川に糞をしている。"
"194","akutagawa","chokoyuki.txt","……"
"195","akutagawa","chokoyuki.txt","私はそんな事を考えながら、何時かうとうと眠ってしまった。"
"196","akutagawa","chokoyuki.txt","何十分か過ぎた後、駕籠の止まったのに眼をさますと、我々のつい鼻の先には、出たらめに石段を積み上げた、嶮しい坂が突き立っている。"
"197","akutagawa","chokoyuki.txt","大元洋行のお上さんは、此処は駕籠が上らないから、歩いて頂きたいと説明した。"
"198","akutagawa","chokoyuki.txt","私はやむを得ず竹内逸氏と、胸突き八町を登り出した。"
"199","akutagawa","chokoyuki.txt","風景は不相変平凡である。"
"200","akutagawa","chokoyuki.txt","唯坂の右や左に、炎天の埃を浴びながら、野薔薇の花が見えるのに過ぎない。"
"201","akutagawa","chokoyuki.txt",""
"202","akutagawa","chokoyuki.txt","駕籠に乗ったり、歩かせられたり、いずれにもせよ骨の折れる、忌々しい目を繰返した後、やっとクウリンの避暑地へ来たのは彼是午後の一時頃だった。"
"203","akutagawa","chokoyuki.txt","この又避暑地の一角なるものが軽井沢の場末と選ぶ所はない。"
"204","akutagawa","chokoyuki.txt","いや、赤禿の山の裾に支那のランプ屋だの酒桟だのがごみごみ店を出した景色は軽井沢よりも一層下等である。"
"205","akutagawa","chokoyuki.txt","西洋人の別荘も見渡した所、気の利いた構えは一軒も見えない。"
"206","akutagawa","chokoyuki.txt","皆烈しい日の光に、赤や青のペンキを塗った、卑しい亜鉛屋根を火照らせている。"
"207","akutagawa","chokoyuki.txt","私は汗を拭いながら、このクウリンの租界を拓いた牧師エドワアド・リットル先生も永年支那にいたものだから、とんと美醜の判断がつかなくなったのだろうと想像した。"
"208","akutagawa","chokoyuki.txt",""
"209","akutagawa","chokoyuki.txt","しかし其処を通り抜けると、薊や除虫菊の咲いた中に、うつ木も水々しい花をつけた、広い草原が展開した。"
"210","akutagawa","chokoyuki.txt","その草原が尽きるあたりに、石の垣をめぐらせた、小さい赤塗りの家が一軒、岩だらけの山を後にしながら、翩々と日章旗を翻している。"
"211","akutagawa","chokoyuki.txt","私はこの旗を見た時に、祖国を思った、――と云うよりは、祖国の米の飯を思った。"
"212","akutagawa","chokoyuki.txt","なぜと云えばその家こそ、我々の空腹を満たすべき大元洋行の支店だったからである。"
"213","akutagawa","chokoyuki.txt",""
"214","akutagawa","chokoyuki.txt",""
"215","akutagawa","chokoyuki.txt","四廬山（下）"
"216","akutagawa","chokoyuki.txt",""
"217","akutagawa","chokoyuki.txt","飯を食ってしまったら、急に冷気を感じ出したのはさすがに海抜三千尺である。"
"218","akutagawa","chokoyuki.txt","成程廬山はつまらないにもしろ、この五月の寒さだけは珍重に値するのに違いない。"
"219","akutagawa","chokoyuki.txt","私は窓側の長椅子に岩山の松を眺めながら、兎に角廬山の避暑地的価値には敬意を表したいと考えた。"
"220","akutagawa","chokoyuki.txt",""
