"","auth","piece","line"
"221","akutagawa","chokoyuki.txt","其処へ姿を現したのは大元洋行の主人である。"
"222","akutagawa","chokoyuki.txt","主人はもう五十を越しているのであろう。"
"223","akutagawa","chokoyuki.txt","しかし赤みのさした顔はまだエネルギイに充ち満ちた、逞しい活動家を示している。"
"224","akutagawa","chokoyuki.txt","我々はこの主人を相手にいろいろ廬山の話をした。"
"225","akutagawa","chokoyuki.txt","主人は頗る雄弁である。"
"226","akutagawa","chokoyuki.txt","或は雄弁過ぎるのかも知れない。"
"227","akutagawa","chokoyuki.txt","何しろ一たび興到ると、白楽天と云う名前をハクラクと縮めてしまうのだから、それだけでも豪快や思うべしである。"
"228","akutagawa","chokoyuki.txt",""
"229","akutagawa","chokoyuki.txt","「香炉峰と云うのも二つありますがね。"
"230","akutagawa","chokoyuki.txt","こっちのは李白の香炉峰、あっちのは白楽天の香炉峰――このハクラクの香炉峰ってやつは松一本ない禿山でがす。"
"231","akutagawa","chokoyuki.txt","……」"
"232","akutagawa","chokoyuki.txt","大体こう云う調子である。"
"233","akutagawa","chokoyuki.txt","が、それはまだしも好い。"
"234","akutagawa","chokoyuki.txt","いや、香炉峰の二つあるのなどは寧ろ我々には便利である。"
"235","akutagawa","chokoyuki.txt","一つしかないものを二つにするのは特許権を無視した罪悪かも知れない。"
"236","akutagawa","chokoyuki.txt","しかし既に二つあるものは、たとい三つにしたにもせよ、不法行為にはならない筈である。"
"237","akutagawa","chokoyuki.txt","だから私は向うに見える山を忽「私の香炉峰」にした。"
"238","akutagawa","chokoyuki.txt","けれども主人は雄弁以外に、廬山を見ること恋人の如き、熱烈なる愛着を蓄えている。"
"239","akutagawa","chokoyuki.txt",""
"240","akutagawa","chokoyuki.txt","「この廬山って山はですね。"
"241","akutagawa","chokoyuki.txt","五老峰とか、三畳泉とか、古来名所の多い山でがす。"
"242","akutagawa","chokoyuki.txt","まあ、御見物なさるんなら、いくら短くっても一週間、それから十日って所でがしょう。"
"243","akutagawa","chokoyuki.txt","その先は一月でも半年でも、――尤も冬は虎も出ますが……」"
"244","akutagawa","chokoyuki.txt","こう云う「第二の愛郷心」はこの主人に限ったことじゃない。"
"245","akutagawa","chokoyuki.txt","支那に在留する日本人は悉ふんだんに持ち合わせている。"
"246","akutagawa","chokoyuki.txt","苟も支那を旅行するのに愉快ならんことを期する士人は土匪に遇う危険は犯すにしても、彼等の「第二の愛郷心」だけは尊重するように努めなければならぬ。"
"247","akutagawa","chokoyuki.txt","上海の大馬路はパリのようである。"
"248","akutagawa","chokoyuki.txt","北京の文華殿にもルウブルのように、贋物の画などは一枚もない。"
"249","akutagawa","chokoyuki.txt","――と云うように感服していなければならぬ。"
"250","akutagawa","chokoyuki.txt","しかし廬山に一週間いるのは単に感服しているのよりも、遥に骨の折れる仕事である。"
"251","akutagawa","chokoyuki.txt","私はまず恐る恐る、主人に私の病弱を訴え、相成るべくは明日の朝下山したいと云う希望を述べた。"
"252","akutagawa","chokoyuki.txt",""
"253","akutagawa","chokoyuki.txt","「明日もうお帰りですか？じゃ何処も見られませんぜ。"
"254","akutagawa","chokoyuki.txt","」"
"255","akutagawa","chokoyuki.txt","主人は半ば憐むように、又半ば嘲るようにこう私の言葉に答えた。"
"256","akutagawa","chokoyuki.txt","が、それきりあきらめるかと思うと、今度はもう一層熱心に、「じゃ今の内にこの近所を御見物なさい。"
"257","akutagawa","chokoyuki.txt","」と勧め出した。"
"258","akutagawa","chokoyuki.txt","これも断ってしまうのは虎退治に出かけるよりも危険である。"
"259","akutagawa","chokoyuki.txt","私はやむを得ず竹内氏の一行と、見たくもない風景を見物に出かけた。"
"260","akutagawa","chokoyuki.txt",""
"261","akutagawa","chokoyuki.txt","主人の言葉に従えば、クウリンの町は此処を距ること、ほんの一跨ぎだと云うことである。"
"262","akutagawa","chokoyuki.txt","しかし実際歩いて見ると、一跨ぎや二跨ぎどころの騒ぎではない。"
"263","akutagawa","chokoyuki.txt","路は山笹の茂った中に何処までもうねうね登っている。"
"264","akutagawa","chokoyuki.txt","私はいつかヘルメットの下に汗の滴るのを感じながら、愈天下の名山に対する憤慨の念を新にし出した。"
"265","akutagawa","chokoyuki.txt","名山、名画、名人、名文――あらゆる「名」の字のついたものは、自我を重んずる我々を、伝統の奴隷にするものである。"
"266","akutagawa","chokoyuki.txt","未来派の画家は大胆にも、古典的作品を破壊せよと云った。"
"267","akutagawa","chokoyuki.txt","古典的作品を破壊する次手に、廬山もダイナマイトの火に吹き飛ばすが好い。"
"268","akutagawa","chokoyuki.txt","……"
"269","akutagawa","chokoyuki.txt","しかしやっと辿り着いて見ると、山風に鳴っている松の間、岩山を繞らせた目の下の谷に、赤い屋根だの黒い屋根だの、無数の屋根が並んでいるのは、思ったよりも快い眺めである。"
"270","akutagawa","chokoyuki.txt","私は道ばたに腰を下し、大事にポケットに蓄えて来た日本の「敷島」へ火を移した。"
"271","akutagawa","chokoyuki.txt","レエスを下げた窓も見える。"
"272","akutagawa","chokoyuki.txt","草花の鉢を置いたバルコンも見える。"
"273","akutagawa","chokoyuki.txt","青芝を劃ったテニス・コオトも見える。"
"274","akutagawa","chokoyuki.txt","ハクラクの香炉峰は姑く問わず、兎に角避暑地たるクウリンは一夏を消するのに足る処らしい。"
"275","akutagawa","chokoyuki.txt","私は竹内氏の一行のずんずん先へ行った後も、ぼんやり巻煙草を御えた儘、かすかに人影の透いて見える家々の窓を見下していた、いつか東京に残して来た子供の顔などを思い出しながら。"
"276","akutagawa","chokoyuki.txt",""
"277","akutagawa","chokoyuki.txt",""
"278","akutagawa","chokoyuki.txt",""
"279","akutagawa","chokoyuki.txt",""
"280","akutagawa","chokoyuki.txt","底本：「上海游記・江南游記」講談社文芸文庫、講談社"
"281","akutagawa","chokoyuki.txt","2001（平成13）年10月10日第1刷発行"
"282","akutagawa","chokoyuki.txt","底本の親本：「芥川龍之介全集第十一巻」岩波書店"
"283","akutagawa","chokoyuki.txt","1996（平成8）年9月9日発行"
"284","akutagawa","chokoyuki.txt","※（）内の編者による注記は省略しました。"
"285","akutagawa","chokoyuki.txt",""
"286","akutagawa","chokoyuki.txt","入力：門田裕志"
"287","akutagawa","chokoyuki.txt","校正：岡山勝美"
"288","akutagawa","chokoyuki.txt","2015年2月28日作成"
"289","akutagawa","chokoyuki.txt","青空文庫作成ファイル："
"290","akutagawa","chokoyuki.txt","このファイルは、インターネットの図書館、青空文庫（http://www.aozora.gr.jp/）で作られました。"
"291","akutagawa","chokoyuki.txt","入力、校正、制作にあたったのは、ボランティアの皆さんです。"
"292","akutagawa","chokoyuki.txt",""
