"","auth","piece","line"
"0","akutagawa","giwaku.txt","疑惑"
"1","akutagawa","giwaku.txt","芥川龍之介"
"2","akutagawa","giwaku.txt",""
"3","akutagawa","giwaku.txt","-------------------------------------------------------"
"4","akutagawa","giwaku.txt","【テキスト中に現れる記号について】"
"5","akutagawa","giwaku.txt",""
"6","akutagawa","giwaku.txt","《》：ルビ"
"7","akutagawa","giwaku.txt","（例）実践倫理学"
"8","akutagawa","giwaku.txt",""
"9","akutagawa","giwaku.txt","｜：ルビの付く文字列の始まりを特定する記号"
"10","akutagawa","giwaku.txt","（例）ある年の春｜私は"
"11","akutagawa","giwaku.txt",""
"12","akutagawa","giwaku.txt","：入力者注主に外字の説明や、傍点の位置の指定"
"13","akutagawa","giwaku.txt","（数字は、JIS X 0213の面区点番号、または底本のページと行数）"
"14","akutagawa","giwaku.txt","（例）※"
"15","akutagawa","giwaku.txt","-------------------------------------------------------"
"16","akutagawa","giwaku.txt",""
"17","akutagawa","giwaku.txt","今ではもう十年あまり以前になるが、ある年の春｜私は実践倫理学の講義を依頼されて、その間かれこれ一週間ばかり、岐阜県下の大垣町へ滞在する事になった。"
"18","akutagawa","giwaku.txt","元来地方有志なるものの難有迷惑な厚遇に辟易していた私は、私を請待してくれたある教育家の団体へ予め断りの手紙を出して、送迎とか宴会とかあるいはまた名所の案内とか、そのほかいろいろ講演に附随する一切の無用な暇つぶしを拒絶したい旨希望して置いた。"
"19","akutagawa","giwaku.txt","すると幸私の変人だと云う風評は夙にこの地方にも伝えられていたものと見えて、やがて私が向うへ行くと、その団体の会長たる大垣町長の斡旋によって、万事がこの我儘な希望通り取計らわれたばかりでなく、宿も特に普通の旅館を避けて、町内の素封家Ｎ氏の別荘とかになっている閑静な住居を周旋された。"
"20","akutagawa","giwaku.txt","私がこれから話そうと思うのは、その滞在中その別荘で偶然私が耳にしたある悲惨な出来事の顛末である。"
"21","akutagawa","giwaku.txt",""
"22","akutagawa","giwaku.txt","その住居のある所は、巨鹿城に近い廓町の最も俗塵に遠い一区劃だった。"
"23","akutagawa","giwaku.txt","殊に私の起臥していた書院造りの八畳は、日当りこそ悪い憾はあったが、障子襖もほどよく寂びのついた、いかにも落着きのある座敷だった。"
"24","akutagawa","giwaku.txt","私の世話を焼いてくれる別荘番の夫婦者は、格別用のない限り、いつも勝手に下っていたから、このうす暗い八畳の間は大抵森閑として人気がなかった。"
"25","akutagawa","giwaku.txt","それは御影の手水鉢の上に枝を延ばしている木蓮が、時々白い花を落すのでさえ、明に聞き取れるような静かさだった。"
"26","akutagawa","giwaku.txt","毎日午前だけ講演に行った私は、午後と夜とをこの座敷で、はなはだ泰平に暮す事が出来た。"
"27","akutagawa","giwaku.txt","が、同時にまた、参考書と着換えとを入れた鞄のほかに何一つない私自身を、春寒く思う事も度々あった。"
"28","akutagawa","giwaku.txt",""
"29","akutagawa","giwaku.txt","もっとも午後は時折来る訪問客に気が紛れて、さほど寂しいとは思わなかった。"
"30","akutagawa","giwaku.txt","が、やがて竹の筒を台にした古風なランプに火が燈ると、人間らしい気息の通う世界は、たちまちそのかすかな光に照される私の周囲だけに縮まってしまった。"
"31","akutagawa","giwaku.txt","しかも私にはその周囲さえ、決して頼もしい気は起させなかった。"
"32","akutagawa","giwaku.txt","私の後にある床の間には、花も活けてない青銅の瓶が一つ、威かつくどっしりと据えてあった。"
"33","akutagawa","giwaku.txt","そうしてその上には怪しげな楊柳観音の軸が、煤けた錦襴の表装の中に朦朧と墨色を弁じていた。"
"34","akutagawa","giwaku.txt","私は折々書見の眼をあげて、この古ぼけた仏画をふり返ると、必ず※きもしない線香がどこかで※っているような心もちがした。"
"35","akutagawa","giwaku.txt","それほど座敷の中には寺らしい閑寂の気が罩っていた。"
"36","akutagawa","giwaku.txt","だから私はよく早寝をした。"
"37","akutagawa","giwaku.txt","が、床にはいっても容易に眠くはならなかった。"
"38","akutagawa","giwaku.txt","雨戸の外では夜鳥の声が、遠近を定めず私を驚かした。"
"39","akutagawa","giwaku.txt","その声はこの住居の上にある天主閣を心に描かせた。"
"40","akutagawa","giwaku.txt","昼見るといつも天主閣は、蓊鬱とした松の間に三層の白壁を畳みながら、その反り返った家根の空へ無数の鴉をばら撒いている。"
"41","akutagawa","giwaku.txt","――私はいつかうとうとと浅い眠に沈みながら、それでもまだ腹の底には水のような春寒が漂っているのを意識した。"
"42","akutagawa","giwaku.txt",""
"43","akutagawa","giwaku.txt","するとある夜の事――それは予定の講演日数が将に終ろうとしている頃であった。"
"44","akutagawa","giwaku.txt","私はいつもの通りランプの前にあぐらをかいて、漫然と書見に耽っていると、突然次の間との境の襖が無気味なほど静に明いた。"
"45","akutagawa","giwaku.txt","その明いたのに気がついた時、無意識にあの別荘番を予期していた私は、折よく先刻書いて置いた端書の投函を頼もうと思って、何気なくその方を一瞥した。"
"46","akutagawa","giwaku.txt","するとその襖側のうす暗がりには、私の全く見知らない四十恰好の男が一人、端然として坐っていた。"
"47","akutagawa","giwaku.txt","実を云えばその瞬間、私は驚愕――と云うよりもむしろ迷信的な恐怖に近い一種の感情に脅かされた。"
"48","akutagawa","giwaku.txt","また実際その男は、それだけのショックに価すべく、ぼんやりしたランプの光を浴びて、妙に幽霊じみた姿を具えていた。"
"49","akutagawa","giwaku.txt","が、彼は私と顔を合わすと、昔風に両肱を高く張って恭しく頭を下げながら、思ったよりも若い声で、ほとんど機械的にこんな挨拶の言を述べた。"
"50","akutagawa","giwaku.txt",""
"51","akutagawa","giwaku.txt","「夜中、殊に御忙しい所を御邪魔に上りまして、何とも申し訳の致しようはございませんが、ちと折入って先生に御願い申したい儀がございまして、失礼をも顧ず、参上致したような次第でございます。"
"52","akutagawa","giwaku.txt","」"
"53","akutagawa","giwaku.txt","ようやく最初のショックから恢復した私は、その男がこう弁じ立てている間に、始めて落着いて相手を観察した。"
"54","akutagawa","giwaku.txt","彼は額の広い、頬のこけた、年にも似合わず眼に働きのある、品の好い半白の人物だった。"
"55","akutagawa","giwaku.txt","それが紋附でこそなかったが、見苦しからぬ羽織袴で、しかも膝のあたりにはちゃんと扇面を控えていた。"
"56","akutagawa","giwaku.txt","ただ、咄嗟の際にも私の神経を刺戟したのは、彼の左の手の指が一本欠けている事だった。"
"57","akutagawa","giwaku.txt","私はふとそれに気がつくと、我知らず眼をその手から外らさないではいられなかった。"
"58","akutagawa","giwaku.txt",""
"59","akutagawa","giwaku.txt","「何か御用ですか。"
"60","akutagawa","giwaku.txt","」"
"61","akutagawa","giwaku.txt","私は読みかけた書物を閉じながら、無愛想にこう問いかけた。"
"62","akutagawa","giwaku.txt","云うまでもなく私には、彼の唐突な訪問が意外であると共に腹立しかった。"
"63","akutagawa","giwaku.txt","と同時にまた別荘番が一言もこの客来を取次がないのも不審だった。"
"64","akutagawa","giwaku.txt","しかしその男は私の冷淡な言葉にもめげないで、もう一度額を畳につけると、相不変朗読でもしそうな調子で、"
"65","akutagawa","giwaku.txt","「申し遅れましたが、私は中村玄道と申しますもので、やはり毎日先生の御講演を伺いに出て居りますが、勿論多数の中でございますから、御見覚えもございますまい。"
"66","akutagawa","giwaku.txt","どうかこれを御縁にして、今後はまた何分ともよろしく御指導のほどを御願い致します。"
"67","akutagawa","giwaku.txt","」"
"68","akutagawa","giwaku.txt","私はここに至って、ようやくこの男の来意が呑みこめたような心もちがした。"
"69","akutagawa","giwaku.txt","が、夜中書見の清興を破られた事は、依然として不快に違いなかった。"
"70","akutagawa","giwaku.txt",""
"71","akutagawa","giwaku.txt","「すると――何か私の講演に質疑でもあると仰有るのですか。"
"72","akutagawa","giwaku.txt","」"
"73","akutagawa","giwaku.txt","こう尋ねた私は内心ひそかに、「質疑なら明日講演場で伺いましょう。"
"74","akutagawa","giwaku.txt","」と云う体の善い撃退の文句を用意していた。"
"75","akutagawa","giwaku.txt","しかし相手はやはり顔の筋肉一つ動かさないで、じっと袴の膝の上に視線を落しながら、"
"76","akutagawa","giwaku.txt","「いえ、質疑ではございません。"
"77","akutagawa","giwaku.txt","ございませんが、実は私一身のふり方につきまして、善悪とも先生の御意見を承りたいのでございます。"
"78","akutagawa","giwaku.txt","と申しますのは、唯今からざっと二十年ばかり以前、私はある思いもよらない出来事に出合いまして、その結果とんと私にも私自身がわからなくなってしまいました。"
"79","akutagawa","giwaku.txt","つきましては、先生のような倫理学界の大家の御説を伺いましたら、自然分別もつこうと存じまして、今晩はわざわざ推参致したのでございます。"
"80","akutagawa","giwaku.txt","いかがでございましょう。"
"81","akutagawa","giwaku.txt","御退屈でも私の身の上話を一通り御聴き取り下さる訳には参りますまいか。"
"82","akutagawa","giwaku.txt","」"
"83","akutagawa","giwaku.txt","私は答に躊躇した。"
"84","akutagawa","giwaku.txt","成程専門の上から云えば倫理学者には相違ないが、そうかと云ってまた私は、その専門の知識を運転させてすぐに当面の実際問題への霊活な解決を与え得るほど、融通の利く頭脳の持ち主だとは遺憾ながら己惚れる事が出来なかった。"
"85","akutagawa","giwaku.txt","すると彼は私の逡巡に早くも気がついたと見えて、今まで袴の膝の上に伏せていた視線をあげると、半ば歎願するように、怯ず怯ず私の顔色を窺いながら、前よりやや自然な声で、慇懃にこう言葉を継いだ。"
"86","akutagawa","giwaku.txt",""
"87","akutagawa","giwaku.txt","「いえ、それも勿論強いて先生から、是非の御判断を伺わなくてはならないと申す訳ではございません。"
"88","akutagawa","giwaku.txt","ただ、私がこの年になりますまで、始終頭を悩まさずにはいられなかった問題でございますから、せめてその間の苦しみだけでも先生のような方の御耳に入れて、多少にもせよ私自身の心やりに致したいと思うのでございます。"
"89","akutagawa","giwaku.txt","」"
"90","akutagawa","giwaku.txt","こう云われて見ると私は、義理にもこの見知らない男の話を聞かないと云う訳には行かなかった。"
"91","akutagawa","giwaku.txt","が、同時にまた不吉な予感と茫漠とした一種の責任感とが、重苦しく私の心の上にのしかかって来るような心もちもした。"
"92","akutagawa","giwaku.txt","私はそれらの不安な感じを払い除けたい一心から、わざと気軽らしい態度を装って、うすぼんやりしたランプの向うに近々と相手を招じながら、"
"93","akutagawa","giwaku.txt","「ではとにかく御話だけ伺いましょう。"
"94","akutagawa","giwaku.txt","もっともそれを伺ったからと云って、格別御参考になるような意見などは申し上げられるかどうかわかりませんが。"
"95","akutagawa","giwaku.txt","」"
"96","akutagawa","giwaku.txt","「いえ、ただ、御聞きになってさえ下されば、それでもう私には本望すぎるくらいでございます。"
"97","akutagawa","giwaku.txt","」"
"98","akutagawa","giwaku.txt","中村玄道と名のった人物は、指の一本足りない手に畳の上の扇子をとり上げると、時々そっと眼をあげて私よりもむしろ床の間の楊柳観音を偸み見ながら、やはり抑揚に乏しい陰気な調子で、とぎれ勝ちにこう話し始めた。"
"99","akutagawa","giwaku.txt",""
"100","akutagawa","giwaku.txt",""
"101","akutagawa","giwaku.txt","―――――――――――――――――――――――――"
"102","akutagawa","giwaku.txt",""
"103","akutagawa","giwaku.txt","ちょうど明治二十四年の事でございます。"
"104","akutagawa","giwaku.txt","御承知の通り二十四年と申しますと、あの濃尾の大地震がございました年で、あれ以来この大垣もがらりと容子が違ってしまいましたが、その頃町には小学校がちょうど二つございまして、一つは藩侯の御建てになったもの、一つは町方の建てたものと、こう分れて居ったものでございます。"
"105","akutagawa","giwaku.txt","私はその藩侯の御建てになったＫ小学校へ奉職して居りましたが、二三年｜前に県の師範学校を首席で卒業致しましたのと、その後また引き続いて校長などの信用も相当にございましたのとで、年輩にしては高級な十五円と云う月俸を頂戴致して居りました。"
"106","akutagawa","giwaku.txt","唯今でこそ十五円の月給取は露命も繋げないぐらいでございましょうが、何分二十年も以前の事で、十分とは参りませんまでも、暮しに不自由はございませんでしたから、同僚の中でも私などは、どちらかと申すと羨望の的になったほどでございました。"
"107","akutagawa","giwaku.txt",""
"108","akutagawa","giwaku.txt","家族は天にも地にも妻一人で、それもまだ結婚してから、ようやく二年ばかりしか経たない頃でございました。"
"109","akutagawa","giwaku.txt","妻は校長の遠縁のもので、幼い時に両親に別れてから私の所へ片づくまで、ずっと校長夫婦が娘のように面倒を見てくれた女でございます。"
"110","akutagawa","giwaku.txt","名は小夜と申しまして、私の口から申し上げますのも、異なものでございますが、至って素直な、はにかみ易い――その代りまた無口過ぎて、どこか影の薄いような、寂しい生れつきでございました。"
"111","akutagawa","giwaku.txt","が、私には似たもの夫婦で、たといこれと申すほどの花々しい楽しさはございませんでも、まず安らかなその日その日を、送る事が出来たのでございます。"
"112","akutagawa","giwaku.txt",""
"113","akutagawa","giwaku.txt","するとあの大地震で、――忘れも致しません十月の二十八日、かれこれ午前七時頃でございましょうか。"
"114","akutagawa","giwaku.txt","私が井戸｜端で楊枝を使っていると、妻は台所で釜の飯を移している。"
"115","akutagawa","giwaku.txt","――その上へ家がつぶれました。"
"116","akutagawa","giwaku.txt","それがほんの一二分の間の事で、まるで大風のような凄まじい地鳴りが襲いかかったと思いますと、たちまちめきめきと家が傾いで、後はただ瓦の飛ぶのが見えたばかりでございます。"
"117","akutagawa","giwaku.txt","私はあっと云う暇もなく、やにわに落ちて来た庇に敷かれて、しばらくは無我無中のまま、どこからともなく寄せて来る大震動の波に揺られて居りましたが、やっとその庇の下から土煙の中へ這い出して見ますと、目の前にあるのは私の家の屋根で、しかも瓦の間に草の生えたのが、そっくり地の上へひしゃげて居りました。"
"118","akutagawa","giwaku.txt",""
"119","akutagawa","giwaku.txt","その時の私の心もちは、驚いたと申しましょうか。"
"120","akutagawa","giwaku.txt","慌てたと申しましょうか。"
"121","akutagawa","giwaku.txt","まるで放心したのも同前で、べったりそこへ腰を抜いたなり、ちょうど嵐の海のように右にも左にも屋根を落した家々の上へ眼をやって、地鳴りの音、梁の落ちる音、樹木の折れる音、壁の崩れる音、それから幾千人もの人々が逃げ惑うのでございましょう、声とも音ともつかない響が騒然と煮えくり返るのをぼんやり聞いて居りました。"
"122","akutagawa","giwaku.txt","が、それはほんの刹那の間で、やがて向うの庇の下に動いているものを見つけますと、私は急に飛び上って、凶い夢からでも覚めたように意味のない大声を挙げながら、いきなりそこへ駈けつけました。"
"123","akutagawa","giwaku.txt","庇の下には妻の小夜が、下半身を梁に圧されながら、悶え苦しんで居ったのでございます。"
"124","akutagawa","giwaku.txt",""
"125","akutagawa","giwaku.txt","私は妻の手を執って引張りました。"
"126","akutagawa","giwaku.txt","妻の肩を押して起そうとしました。"
"127","akutagawa","giwaku.txt","が、圧しにかかった梁は、虫の這い出すほども動きません。"
"128","akutagawa","giwaku.txt","私はうろたえながら、庇の板を一枚一枚むしり取りました。"
"129","akutagawa","giwaku.txt","取りながら、何度も妻に向って「しっかりしろ。"
"130","akutagawa","giwaku.txt","」と喚きました。"
"131","akutagawa","giwaku.txt","妻を？いやあるいは私自身を励ましていたのかも存じません。"
"132","akutagawa","giwaku.txt","小夜は「苦しい。"
"133","akutagawa","giwaku.txt","」と申しました。"
"134","akutagawa","giwaku.txt","「どうかして下さいまし。"
"135","akutagawa","giwaku.txt","」とも申しました。"
"136","akutagawa","giwaku.txt","が、私に励まされるまでもなく、別人のように血相を変えて、必死に梁を擡げようと致して居りましたから、私はその時妻の両手が、爪も見えないほど血にまみれて、震えながら梁をさぐって居ったのが、今でもまざまざと苦しい記憶に残っているのでございます。"
"137","akutagawa","giwaku.txt",""
"138","akutagawa","giwaku.txt","それが長い長い間の事でございました。"
"139","akutagawa","giwaku.txt","――その内にふと気がつきますと、どこからか濛々とした黒煙が一なだれに屋根を渡って、むっと私の顔へ吹きつけました。"
"140","akutagawa","giwaku.txt","と思うと、その煙の向うにけたたましく何か爆ぜる音がして、金粉のような火粉がばらばらと疎らに空へ舞い上りました。"
"141","akutagawa","giwaku.txt","私は気の違ったように妻へ獅噛みつきました。"
"142","akutagawa","giwaku.txt","そうしてもう一度｜無二無三に、妻の体を梁の下から引きずり出そうと致しました。"
"143","akutagawa","giwaku.txt","が、やはり妻の下半身は一寸も動かす事は出来ません。"
"144","akutagawa","giwaku.txt","私はまた吹きつけて来る煙を浴びて、庇に片膝つきながら、噛みつくように妻へ申しました。"
"145","akutagawa","giwaku.txt","何を？と御尋ねになるかも存じません、いや、必ず御尋ねになりましょう。"
"146","akutagawa","giwaku.txt","しかし私も何を申したか、とんと覚えていないのでございます。"
"147","akutagawa","giwaku.txt","ただ私はその時妻が、血にまみれた手で私の腕をつかみながら、「あなた。"
"148","akutagawa","giwaku.txt","」と一言申したのを覚えて居ります。"
"149","akutagawa","giwaku.txt","私は妻の顔を見つめました。"
"150","akutagawa","giwaku.txt","あらゆる表情を失った、眼ばかり徒に大きく見開いている、気味の悪い顔でございます。"
"151","akutagawa","giwaku.txt","すると今度は煙ばかりか、火の粉を煽った一陣の火気が、眼も眩むほど私を襲って来ました。"
"152","akutagawa","giwaku.txt","私はもう駄目だと思いました。"
"153","akutagawa","giwaku.txt","妻は生きながら火に焼かれて、死ぬのだと思いました。"
"154","akutagawa","giwaku.txt","生きながら？私は血だらけな妻の手を握ったまま、また何か喚きました。"
"155","akutagawa","giwaku.txt","と、妻もまた繰返して、「あなた。"
"156","akutagawa","giwaku.txt","」と一言申しました。"
"157","akutagawa","giwaku.txt","私はその時その「あなた。"
"158","akutagawa","giwaku.txt","」と云う言葉の中に、無数の意味、無数の感情を感じたのでございます。"
"159","akutagawa","giwaku.txt","生きながら？生きながら？私は三度何か叫びました。"
"160","akutagawa","giwaku.txt","それは「死ね。"
"161","akutagawa","giwaku.txt","」と云ったようにも覚えて居ります。"
"162","akutagawa","giwaku.txt","「己も死ぬ。"
"163","akutagawa","giwaku.txt","」と云ったようにも覚えて居ります。"
"164","akutagawa","giwaku.txt","が、何と云ったかわからない内に、私は手当り次第、落ちている瓦を取り上げて、続けさまに妻の頭へ打ち下しました。"
"165","akutagawa","giwaku.txt",""
"166","akutagawa","giwaku.txt","それから後の事は、先生の御察しにまかせるほかはございません。"
"167","akutagawa","giwaku.txt","私は独り生き残りました。"
"168","akutagawa","giwaku.txt","ほとんど町中を焼きつくした火と煙とに追われながら、小山のように路を塞いだ家々の屋根の間をくぐって、ようやく危い一命を拾ったのでございます。"
"169","akutagawa","giwaku.txt","幸か、それともまた不幸か、私には何にもわかりませんでした。"
"170","akutagawa","giwaku.txt","ただその夜、まだ燃えている火事の光を暗い空に望みながら、同僚の一人二人と一しょに、やはり一ひしぎにつぶされた学校の外の仮小屋で、炊き出しの握り飯を手にとった時とめどなく涙が流れた事は、未だにどうしても忘れられません。"
"171","akutagawa","giwaku.txt",""
"172","akutagawa","giwaku.txt",""
"173","akutagawa","giwaku.txt","―――――――――――――――――――――――――"
"174","akutagawa","giwaku.txt",""
"175","akutagawa","giwaku.txt","中村玄道はしばらく言葉を切って、臆病らしい眼を畳へ落した。"
"176","akutagawa","giwaku.txt","突然こんな話を聞かされた私も、いよいよ広い座敷の春寒が襟元まで押寄せたような心もちがして、「成程」と云う元気さえ起らなかった。"
"177","akutagawa","giwaku.txt",""
"178","akutagawa","giwaku.txt","部屋の中には、ただ、ランプの油を吸い上げる音がした。"
"179","akutagawa","giwaku.txt","それから机の上に載せた私の懐中時計が、細かく時を刻む音がした。"
"180","akutagawa","giwaku.txt","と思うとまたその中で、床の間の楊柳観音が身動きをしたかと思うほど、かすかな吐息をつく音がした。"
"181","akutagawa","giwaku.txt",""
"182","akutagawa","giwaku.txt","私は悸えた眼を挙げて、悄然と坐っている相手の姿を見守った。"
"183","akutagawa","giwaku.txt","吐息をしたのは彼だろうか。"
"184","akutagawa","giwaku.txt","それとも私自身だろうか。"
"185","akutagawa","giwaku.txt","――が、その疑問が解けない内に、中村玄道はやはり低い声で、徐に話を続け出した。"
"186","akutagawa","giwaku.txt",""
"187","akutagawa","giwaku.txt",""
"188","akutagawa","giwaku.txt","―――――――――――――――――――――――――"
"189","akutagawa","giwaku.txt",""
"190","akutagawa","giwaku.txt","申すまでもなく私は、妻の最期を悲しみました。"
"191","akutagawa","giwaku.txt","そればかりか、時としては、校長始め同僚から、親切な同情の言葉を受けて、人前も恥じず涙さえ流した事がございました。"
