"","auth","piece","line"
"192","akutagawa","giwaku.txt","が、私があの地震の中で、妻を殺したと云う事だけは、妙に口へ出して云う事が出来なかったのでございます。"
"193","akutagawa","giwaku.txt",""
"194","akutagawa","giwaku.txt","「生きながら火に焼かれるよりはと思って、私が手にかけて殺して来ました。"
"195","akutagawa","giwaku.txt","」――これだけの事を口外したからと云って、何も私が監獄へ送られる次第でもございますまい。"
"196","akutagawa","giwaku.txt","いや、むしろそのために世間は一層私に同情してくれたのに相違ございません。"
"197","akutagawa","giwaku.txt","それがどう云うものか、云おうとするとたちまち喉元にこびりついて、一言も舌が動かなくなってしまうのでございます。"
"198","akutagawa","giwaku.txt",""
"199","akutagawa","giwaku.txt","当時の私はその原因が、全く私の臆病に根ざしているのだと思いました。"
"200","akutagawa","giwaku.txt","が、実は単に臆病と云うよりも、もっと深い所に潜んでいる原因があったのでございます。"
"201","akutagawa","giwaku.txt","しかしその原因は、私に再婚の話が起って、いよいよもう一度新生涯へはいろうと云う間際までは、私自身にもわかりませんでした。"
"202","akutagawa","giwaku.txt","そうしてそれがわかった時、私はもう二度と人並の生活を送る資格のない、憐むべき精神上の敗残者になるよりほかはなかったのでございます。"
"203","akutagawa","giwaku.txt",""
"204","akutagawa","giwaku.txt","再婚の話を私に持ち出したのは、小夜の親許になっていた校長で、これが純粋に私のためを計った結果だと申す事は私にもよく呑み込めました。"
"205","akutagawa","giwaku.txt","また実際その頃はもうあの大地震があってから、かれこれ一年あまり経った時分で、校長がこの問題を切り出した以前にも、内々同じような相談を持ちかけて私の口裏を引いて見るものが一度ならずあったのでございます。"
"206","akutagawa","giwaku.txt","所が校長の話を聞いて見ますと、意外な事にはその縁談の相手と云うのが、唯今先生のいらっしゃる、このＮ家の二番娘で、当時私が学校以外にも、時々｜出稽古の面倒を見てやった尋常四年生の長男の姉だったろうではございませんか。"
"207","akutagawa","giwaku.txt","勿論私は一応辞退しました。"
"208","akutagawa","giwaku.txt","第一教員の私と資産家のＮ家とでは格段に身分も違いますし、家庭教師と云う関係上、結婚までには何か曰くがあったろうなどと、痛くない腹を探られるのも面白くないと思ったからでございます。"
"209","akutagawa","giwaku.txt","同時にまた私の進まなかった理由の後には、去る者は日に疎しで、以前ほど悲しい記憶はなかったまでも、私自身打ち殺した小夜の面影が、箒星の尾のようにぼんやり纏わっていたのに相違ございません。"
"210","akutagawa","giwaku.txt",""
"211","akutagawa","giwaku.txt","が、校長は十分私の心もちを汲んでくれた上で、私くらいの年輩の者が今後独身生活を続けるのは困難だと云う事、しかも今度の縁談は先方から達っての所望だと云う事、校長自身が進んで媒酌の労を執る以上、悪評などが立つ謂われのないと云う事、そのほか日頃私の希望している東京遊学のごときも、結婚した暁には大いに便宜があるだろうと云う事――そう事をいろいろ並べ立てて、根気よく私を説きました。"
"212","akutagawa","giwaku.txt","こう云われて見ますと、私も無下には断ってしまう訳には参りません。"
"213","akutagawa","giwaku.txt","そこへ相手の娘と申しますのは、評判の美人でございましたし、その上御恥しい次第ではございますが、Ｎ家の資産にも目がくれましたので、校長に勧められるのも度重なって参りますと、いつか「熟考して見ましょう。"
"214","akutagawa","giwaku.txt","」が「いずれ年でも変りましたら。"
"215","akutagawa","giwaku.txt","」などと、だんだん軟化致し始めました。"
"216","akutagawa","giwaku.txt","そうしてその年の変った明治二十六年の初夏には、いよいよ秋になったら式を挙げると云う運びさえついてしまったのでございます。"
"217","akutagawa","giwaku.txt",""
"218","akutagawa","giwaku.txt","するとその話がきまった頃から、妙に私は気が鬱して、自分ながら不思議に思うほど、何をするにも昔のような元気がなくなってしまいました。"
"219","akutagawa","giwaku.txt","たとえば学校へ参りましても、教員室の机に倚り懸りながら、ぼんやり何かに思い耽って、授業の開始を知らせる板木の音さえ、聞き落してしまうような事が度々あるのでございます。"
"220","akutagawa","giwaku.txt","その癖何が気になるのかと申しますと、それは私にもはっきりとは見極めをつける事が出来ません。"
"221","akutagawa","giwaku.txt","ただ、頭の中の歯車がどこかしっくり合わないような――しかもそのしっくり合わない向うには、私の自覚を超越した秘密が蟠っているような、気味の悪い心もちがするのでございます。"
"222","akutagawa","giwaku.txt",""
"223","akutagawa","giwaku.txt","それがざっと二月ばかり続いてからの事でございましたろう。"
"224","akutagawa","giwaku.txt","ちょうど暑中休暇になった当座で、ある夕方私が散歩かたがた、本願寺別院の裏手にある本屋の店先を覗いて見ますと、その頃評判の高かった風俗画報と申す雑誌が五六冊、夜窓鬼談や月耕漫画などと一しょに、石版刷の表紙を並べて居りました。"
"225","akutagawa","giwaku.txt","そこで店先に佇みながら、何気なくその風俗画報を一冊手にとって見ますと、表紙に家が倒れたり火事が始ったりしている画があって、そこへ二行に「明治廿四年十一月三十日発行、十月廿八日震災記聞」と大きく刷ってあるのでございます。"
"226","akutagawa","giwaku.txt","それを見た時、私は急に胸がはずみ出しました。"
"227","akutagawa","giwaku.txt","私の耳もとでは誰かが嬉しそうに嘲笑いながら、「それだ。"
"228","akutagawa","giwaku.txt","それだ。"
"229","akutagawa","giwaku.txt","」と囁くような心もちさえ致します。"
"230","akutagawa","giwaku.txt","私はまだ火をともさない店先の薄明りで、慌しく表紙をはぐって見ました。"
"231","akutagawa","giwaku.txt","するとまっ先に一家の老若が、落ちて来た梁に打ちひしがれて惨死を遂げる画が出て居ります。"
"232","akutagawa","giwaku.txt","それから土地が二つに裂けて、足を過った女子供を呑んでいる画が出て居ります。"
"233","akutagawa","giwaku.txt","それから――一々数え立てるまでもございませんが、その時その風俗画報は、二年以前の大地震の光景を再び私の眼の前へ展開してくれたのでございます。"
"234","akutagawa","giwaku.txt","長良川鉄橋陥落の図、尾張紡績会社破壊の図、第三師団兵士｜屍体発掘の図、愛知病院負傷者救護の図――そう云う凄惨な画は次から次と、あの呪わしい当時の記憶の中へ私を引きこんで参りました。"
"235","akutagawa","giwaku.txt","私は眼がうるみました。"
"236","akutagawa","giwaku.txt","体も震え始めました。"
"237","akutagawa","giwaku.txt","苦痛とも歓喜ともつかない感情は、用捨なく私の精神を蕩漾させてしまいます。"
"238","akutagawa","giwaku.txt","そうして最後の一枚の画が私の眼の前に開かれた時――私は今でもその時の驚愕がありあり心に残って居ります。"
"239","akutagawa","giwaku.txt","それは落ちて来た梁に腰を打たれて、一人の女が無惨にも悶え苦しんでいる画でございました。"
"240","akutagawa","giwaku.txt","その梁の横わった向うには、黒煙が濛々と巻き上って、朱を撥いた火の粉さえ乱れ飛んでいるではございませんか。"
"241","akutagawa","giwaku.txt","これが私の妻でなくて誰でしょう。"
"242","akutagawa","giwaku.txt","妻の最期でなくて何でしょう。"
"243","akutagawa","giwaku.txt","私は危く風俗画報を手から落そうと致しました。"
"244","akutagawa","giwaku.txt","危く声を挙げて叫ぼうと致しました。"
"245","akutagawa","giwaku.txt","しかもその途端に一層私を悸えさせたのは、突然あたりが赤々と明くなって、火事を想わせるような煙の※がぷんと鼻を打った事でございます。"
"246","akutagawa","giwaku.txt","私は強いて心を押し鎮めながら、風俗画報を下へ置いて、きょろきょろ店先を見廻しました。"
"247","akutagawa","giwaku.txt","店先ではちょうど小僧が吊ランプへ火をとぼして、夕暗の流れている往来へ、まだ煙の立つ燐寸殻を捨てている所だったのでございます。"
"248","akutagawa","giwaku.txt",""
"249","akutagawa","giwaku.txt","それ以来、私は、前よりもさらに幽鬱な人間になってしまいました。"
"250","akutagawa","giwaku.txt","今まで私を脅したのはただ何とも知れない不安な心もちでございましたが、その後はある疑惑が私の頭の中に蟠って、日夜を問わず私を責め虐むのでございます。"
"251","akutagawa","giwaku.txt","と申しますのは、あの大地震の時私が妻を殺したのは、果して已むを得なかったのだろうか。"
"252","akutagawa","giwaku.txt","――もう一層露骨に申しますと、私は妻を殺したのは、始から殺したい心があって殺したのではなかったろうか。"
"253","akutagawa","giwaku.txt","大地震はただ私のために機会を与えたのではなかったろうか、――こう云う疑惑でございました。"
"254","akutagawa","giwaku.txt","私は勿論この疑惑の前に、何度思い切って「否、否。"
"255","akutagawa","giwaku.txt","」と答えた事だかわかりません。"
"256","akutagawa","giwaku.txt","が、本屋の店先で私の耳に「それだ。"
"257","akutagawa","giwaku.txt","それだ。"
"258","akutagawa","giwaku.txt","」と囁いた何物かは、その度にまた嘲笑って、「では何故お前は妻を殺した事を口外する事が出来なかったのだ。"
"259","akutagawa","giwaku.txt","」と、問い詰るのでございます。"
"260","akutagawa","giwaku.txt","私はその事実に思い当ると、必ずぎくりと致しました。"
"261","akutagawa","giwaku.txt","ああ、何故私は妻を殺したなら殺したと云い放てなかったのでございましょう。"
"262","akutagawa","giwaku.txt","何故｜今日までひた隠しに、それほどの恐しい経験を隠して居ったのでございましょう。"
"263","akutagawa","giwaku.txt",""
"264","akutagawa","giwaku.txt","しかもその際私の記憶へ鮮に生き返って来たものは、当時の私が妻の小夜を内心憎んでいたと云う、忌わしい事実でございます。"
"265","akutagawa","giwaku.txt","これは恥を御話しなければ、ちと御会得が参らないかも存じませんが、妻は不幸にも肉体的に欠陥のある女でございました。"
"266","akutagawa","giwaku.txt","（以下八十二行省略）………そこで私はその時までは、覚束ないながら私の道徳感情がともかくも勝利を博したものと信じて居ったのでございます。"
"267","akutagawa","giwaku.txt","が、あの大地震のような凶変が起って、一切の社会的束縛が地上から姿を隠した時、どうしてそれと共に私の道徳感情も亀裂を生じなかったと申せましょう。"
"268","akutagawa","giwaku.txt","どうして私の利己心も火の手を揚げなかったと申せましょう。"
"269","akutagawa","giwaku.txt","私はここに立ち至ってやはり妻を殺したのは、殺すために殺したのではなかったろうかと云う、疑惑を認めずには居られませんでした。"
"270","akutagawa","giwaku.txt","私がいよいよ幽鬱になったのは、むしろ自然の数とでも申すべきものだったのでございます。"
"271","akutagawa","giwaku.txt",""
"272","akutagawa","giwaku.txt","しかしまだ私には、「あの場合妻を殺さなかったにしても、妻は必ず火事のために焼け死んだのに相違ない。"
"273","akutagawa","giwaku.txt","そうすれば何も妻を殺したのが、特に自分の罪悪だとは云われない筈だ。"
"274","akutagawa","giwaku.txt","」と云う一条の血路がございました。"
"275","akutagawa","giwaku.txt","所がある日、もう季節が真夏から残暑へ振り変って、学校が始まって居た頃でございますが、私ども教員が一同教員室の卓子を囲んで、番茶を飲みながら、他曖もない雑談を交して居りますと、どう云う時の拍子だったか、話題がまたあの二年以前の大地震に落ちた事がございます。"
"276","akutagawa","giwaku.txt","私はその時も独り口を噤んだぎりで、同僚の話を聞くともなく聞き流して居りましたが、本願寺の別院の屋根が落ちた話、船町の堤防が崩れた話、俵町の往来の土が裂けた話――とそれからそれへ話がはずみましたが、やがて一人の教員が申しますには、中町とかの備後屋と云う酒屋の女房は、一旦｜梁の下敷になって、身動きも碌に出来なかったのが、その内に火事が始って、梁も幸焼け折れたものだから、やっと命だけは拾ったと、こう云うのでございます。"
"277","akutagawa","giwaku.txt","私はそれを聞いた時に、俄に目の前が暗くなって、そのまましばらくは呼吸さえも止るような心地が致しました。"
"278","akutagawa","giwaku.txt","また実際その間は、失心したも同様な姿だったのでございましょう。"
"279","akutagawa","giwaku.txt","ようやく我に返って見ますと、同僚は急に私の顔色が変って、椅子ごと倒れそうになったのに驚きながら、皆私のまわりへ集って、水を飲ませるやら薬をくれるやら、大騒ぎを致して居りました。"
"280","akutagawa","giwaku.txt","が、私はその同僚に礼を云う余裕もないほど、頭の中はあの恐しい疑惑の塊で一ぱいになっていたのでございます。"
"281","akutagawa","giwaku.txt","私はやはり妻を殺すために殺したのではなかったろうか。"
"282","akutagawa","giwaku.txt","たとい梁に圧されていても、万一命が助かるのを恐れて、打ち殺したのではなかったろうか。"
"283","akutagawa","giwaku.txt","もしあのまま殺さないで置いたなら今の備後屋の女房の話のように、私の妻もどんな機会で九死に一生を得たかも知れない。"
"284","akutagawa","giwaku.txt","それを私は情無く、瓦の一撃で殺してしまった――そう思った時の私の苦しさは、ひとえに先生の御推察を仰ぐほかはございません。"
"285","akutagawa","giwaku.txt","私はその苦しみの中で、せめてはＮ家との縁談を断ってでも、幾分一身を潔くしようと決心したのでございます。"
"286","akutagawa","giwaku.txt",""
"287","akutagawa","giwaku.txt","ところがいよいよその運びをつけると云う段になりますと、折角の私の決心は未練にもまた鈍り出しました。"
"288","akutagawa","giwaku.txt","何しろ近々結婚式を挙げようと云う間際になって、突然破談にしたいと申すのでございますから、あの大地震の時に私が妻を殺害した顛末は元より、これまでの私の苦しい心中も一切打ち明けなければなりますまい。"
"289","akutagawa","giwaku.txt","それが小心な私には、いざと云う場合に立ち至ると、いかに自ら鞭撻しても、断行する勇気が出なかったのでございます。"
"290","akutagawa","giwaku.txt","私は何度となく腑甲斐ない私自身を責めました。"
"291","akutagawa","giwaku.txt","が、徒に責めるばかりで、何一つ然るべき処置も取らない内に、残暑はまた朝寒に移り変って、とうとう所謂華燭の典を挙げる日も、目前に迫ったではございませんか。"
"292","akutagawa","giwaku.txt",""
"293","akutagawa","giwaku.txt","私はもうその頃には、だれとも滅多に口を利かないほど、沈み切った人間になって居りました。"
"294","akutagawa","giwaku.txt","結婚を延期したらと注意した同僚も、一人や二人ではございません。"
"295","akutagawa","giwaku.txt","医者に見て貰ったらと云う忠告も、三度まで校長から受けました。"
"296","akutagawa","giwaku.txt","が、当時の私にはそう云う親切な言葉の手前、外見だけでも健康を顧慮しようと云う気力さえすでになかったのでございます。"
"297","akutagawa","giwaku.txt","と同時にまたその連中の心配を利用して、病気を口実に結婚を延期するのも、今となっては意気地のない姑息手段としか思われませんでした。"
"298","akutagawa","giwaku.txt","しかも一方ではＮ家の主人などが、私の気鬱の原因を独身生活の影響だとでも感違いをしたのでございましょう。"
"299","akutagawa","giwaku.txt","一日も早く結婚しろと頻に主張しますので、日こそ違いますが二年｜前にあの大地震のあった十月、いよいよ私はＮ家の本邸で結婚式を挙げる事になりました。"
"300","akutagawa","giwaku.txt","連日の心労に憔悴し切った私が、花婿らしい紋服を着用して、いかめしく金屏風を立てめぐらした広間へ案内された時、どれほど私は今日の私を恥しく思ったでございましょう。"
"301","akutagawa","giwaku.txt","私はまるで人目を偸んで、大罪悪を働こうとしている悪漢のような気が致しました。"
"302","akutagawa","giwaku.txt","いや、ような気ではございません。"
"303","akutagawa","giwaku.txt","実際私は殺人の罪悪をぬり隠して、Ｎ家の娘と資産とを一時盗もうと企てている人非人なのでございます。"
"304","akutagawa","giwaku.txt","私は顔が熱くなって参りました。"
"305","akutagawa","giwaku.txt","胸が苦しくなって参りました。"
"306","akutagawa","giwaku.txt","出来るならこの場で、私が妻を殺した一条を逐一白状してしまいたい。"
"307","akutagawa","giwaku.txt","――そんな気がまるで嵐のように、烈しく私の頭の中を駈けめぐり始めました。"
"308","akutagawa","giwaku.txt","するとその時、私の着座している前の畳へ、夢のように白羽二重の足袋が現れました。"
"309","akutagawa","giwaku.txt","続いて仄かな波の空に松と鶴とが霞んでいる裾模様が見えました。"
"310","akutagawa","giwaku.txt","それから錦襴の帯、はこせこの銀鎖、白襟と順を追って、鼈甲の櫛笄が重そうに光っている高島田が眼にはいった時、私はほとんど息がつまるほど、絶対絶命な恐怖に圧倒されて、思わず両手を畳へつくと、『私は人殺しです。"
"311","akutagawa","giwaku.txt","極重悪の罪人です』と、必死な声を挙げてしまいました。"
"312","akutagawa","giwaku.txt","………"
"313","akutagawa","giwaku.txt",""
"314","akutagawa","giwaku.txt","―――――――――――――――――――――――――"
"315","akutagawa","giwaku.txt",""
"316","akutagawa","giwaku.txt","中村玄道はこう語り終ると、しばらくじっと私の顔を見つめていたが、やがて口もとに無理な微笑を浮べながら、"
"317","akutagawa","giwaku.txt","「その以後の事は申し上げるまでもございますまい。"
"318","akutagawa","giwaku.txt","が、ただ一つ御耳に入れて置きたいのは、当日限り私は狂人と云う名前を負わされて、憐むべき余生を送らなければならなくなった事でございます。"
"319","akutagawa","giwaku.txt","果して私が狂人かどうか、そのような事は一切先生の御判断に御任かせ致しましょう。"
"320","akutagawa","giwaku.txt","しかしたとい狂人でございましても、私を狂人に致したものは、やはり我々人間の心の底に潜んでいる怪物のせいではございますまいか。"
"321","akutagawa","giwaku.txt","その怪物が居ります限り、今日私を狂人と嘲笑っている連中でさえ、明日はまた私と同様な狂人にならないものでもございません。"
"322","akutagawa","giwaku.txt","――とまあ私は考えて居るのでございますが、いかがなものでございましょう。"
"323","akutagawa","giwaku.txt","」"
"324","akutagawa","giwaku.txt","ランプは相不変私とこの無気味な客との間に、春寒い焔を動かしていた。"
"325","akutagawa","giwaku.txt","私は楊柳観音を後にしたまま、相手の指の一本ないのさえ問い質して見る気力もなく、黙然と坐っているよりほかはなかった。"
"326","akutagawa","giwaku.txt",""
"327","akutagawa","giwaku.txt","（大正八年六月）"
"328","akutagawa","giwaku.txt",""
"329","akutagawa","giwaku.txt",""
"330","akutagawa","giwaku.txt",""
"331","akutagawa","giwaku.txt","底本：「芥川龍之介全集3」ちくま文庫、筑摩書房"
"332","akutagawa","giwaku.txt","1986（昭和61）年12月1日第1刷発行"
"333","akutagawa","giwaku.txt","1996（平成8）年4月1日第8刷発行"
"334","akutagawa","giwaku.txt","底本の親本：「筑摩全集類聚版芥川龍之介全集」筑摩書房"
"335","akutagawa","giwaku.txt","1971（昭和46）年3月〜1971（昭和46）年11月"
"336","akutagawa","giwaku.txt","入力：j.utiyama"
"337","akutagawa","giwaku.txt","校正：かとうかおり"
"338","akutagawa","giwaku.txt","1998年12月8日公開"
"339","akutagawa","giwaku.txt","2004年3月7日修正"
"340","akutagawa","giwaku.txt","青空文庫作成ファイル："
"341","akutagawa","giwaku.txt","このファイルは、インターネットの図書館、青空文庫（http://www.aozora.gr.jp/）で作られました。"
"342","akutagawa","giwaku.txt","入力、校正、制作にあたったのは、ボランティアの皆さんです。"
"343","akutagawa","giwaku.txt",""
