"","auth","piece","line"
"0","akutagawa","zoku_yajinseikeino_koto.txt","続野人生計事"
"1","akutagawa","zoku_yajinseikeino_koto.txt","芥川龍之介"
"2","akutagawa","zoku_yajinseikeino_koto.txt",""
"3","akutagawa","zoku_yajinseikeino_koto.txt","-------------------------------------------------------"
"4","akutagawa","zoku_yajinseikeino_koto.txt","【テキスト中に現れる記号について】"
"5","akutagawa","zoku_yajinseikeino_koto.txt",""
"6","akutagawa","zoku_yajinseikeino_koto.txt","《》：ルビ"
"7","akutagawa","zoku_yajinseikeino_koto.txt","（例）鼻糞"
"8","akutagawa","zoku_yajinseikeino_koto.txt",""
"9","akutagawa","zoku_yajinseikeino_koto.txt","｜：ルビの付く文字列の始まりを特定する記号"
"10","akutagawa","zoku_yajinseikeino_koto.txt","（例）全然｜面白味の"
"11","akutagawa","zoku_yajinseikeino_koto.txt",""
"12","akutagawa","zoku_yajinseikeino_koto.txt","：入力者注主に外字の説明や、傍点の位置の指定"
"13","akutagawa","zoku_yajinseikeino_koto.txt","（数字は、JIS X 0213の面区点番号、または底本のページと行数）"
"14","akutagawa","zoku_yajinseikeino_koto.txt","（例）※"
"15","akutagawa","zoku_yajinseikeino_koto.txt","-------------------------------------------------------"
"16","akutagawa","zoku_yajinseikeino_koto.txt",""
"17","akutagawa","zoku_yajinseikeino_koto.txt","一放屁"
"18","akutagawa","zoku_yajinseikeino_koto.txt",""
"19","akutagawa","zoku_yajinseikeino_koto.txt","アンドレエフに百姓が鼻糞をほじる描写がある。"
"20","akutagawa","zoku_yajinseikeino_koto.txt","フランスに婆さんが小便をする描写がある。"
"21","akutagawa","zoku_yajinseikeino_koto.txt","しかし屁をする描写のある小説にはまだ一度も出あつたことはない。"
"22","akutagawa","zoku_yajinseikeino_koto.txt",""
"23","akutagawa","zoku_yajinseikeino_koto.txt","出あつたことのないといふのは、西洋の小説にはと云ふ意味である。"
"24","akutagawa","zoku_yajinseikeino_koto.txt","日本の小説にはない訣ではない。"
"25","akutagawa","zoku_yajinseikeino_koto.txt","その一つは青木健作氏の何とかいふ女工の小説である。"
"26","akutagawa","zoku_yajinseikeino_koto.txt","駈落ちをした女工が二人、干藁か何かの中に野宿する。"
"27","akutagawa","zoku_yajinseikeino_koto.txt","夜明に二人とも目がさめる。"
"28","akutagawa","zoku_yajinseikeino_koto.txt","一人がぷうとおならをする。"
"29","akutagawa","zoku_yajinseikeino_koto.txt","もう一人がくすくす笑ひ出す――たしかそんな筋だつたと思ふ。"
"30","akutagawa","zoku_yajinseikeino_koto.txt","その女工の屁をする描写は予の記憶に誤りがなければ、甚だ上品に出来上つてゐた。"
"31","akutagawa","zoku_yajinseikeino_koto.txt","予は此の一段を読んだ為に、今日もなほ青木氏の手腕に敬意を感じてゐる位なものである。"
"32","akutagawa","zoku_yajinseikeino_koto.txt",""
"33","akutagawa","zoku_yajinseikeino_koto.txt","もう一つは中戸川吉二氏の何とか云ふ不良少年の小説である。"
"34","akutagawa","zoku_yajinseikeino_koto.txt","これはつい三四箇月以前、サンデイ毎日に出てゐたのだから、知つてゐる読者も多いかも知れない。"
"35","akutagawa","zoku_yajinseikeino_koto.txt","不良少年に口説かれた女が際どい瞬間におならをする、その為に折角醸されたエロチツクな空気が消滅する、女は妙につんとしてしまふ、不良少年も手が出せなくなる――大体かう云ふ小説だつた。"
"36","akutagawa","zoku_yajinseikeino_koto.txt","この小説も巧みに書きこなしてある。"
"37","akutagawa","zoku_yajinseikeino_koto.txt",""
"38","akutagawa","zoku_yajinseikeino_koto.txt","青木氏の小説に出て来る女工は必しもおならをしないでも好い。"
"39","akutagawa","zoku_yajinseikeino_koto.txt","しかし中戸川氏の小説に出て来る女は嫌でもおならをする必要がある。"
"40","akutagawa","zoku_yajinseikeino_koto.txt","しなければ成り立たない。"
"41","akutagawa","zoku_yajinseikeino_koto.txt","だから屁は中戸川氏を得た後始めて或重大な役目を勤めるやうになつたと云ふべきである。"
"42","akutagawa","zoku_yajinseikeino_koto.txt",""
"43","akutagawa","zoku_yajinseikeino_koto.txt","しかしこれは近世のことである。"
"44","akutagawa","zoku_yajinseikeino_koto.txt","宇治拾遺物語によれば、藤大納言忠家も、「いまだ殿上人におはしける時、びびしき色好みなりける女房ともの云ひて、夜更くるほどに月は昼よりもあかかりけるに」たへ兼ねてひき寄せたら、女は「あなあさまし」と云ふ拍子に大きいおならを一つした。"
"45","akutagawa","zoku_yajinseikeino_koto.txt","忠家はこの屁を聞いた時に「心うきことにも逢ひぬるかな。"
"46","akutagawa","zoku_yajinseikeino_koto.txt","世にありて何かはせん。"
"47","akutagawa","zoku_yajinseikeino_koto.txt","出家せん」と思ひ立つた。"
"48","akutagawa","zoku_yajinseikeino_koto.txt","けれども、つらつら考へて見れば、何も女が屁をしたからと云つて、坊主にまでなるには当りさうもない。"
"49","akutagawa","zoku_yajinseikeino_koto.txt","忠家は其処に気がついたから、出家することだけは見合せたが、※※その場は逃げ出したさうである。"
"50","akutagawa","zoku_yajinseikeino_koto.txt","すると中戸川氏の小説も文学史的に批評すれば、前人未発と云ふことは出来ない。"
"51","akutagawa","zoku_yajinseikeino_koto.txt","しかし断えたるを継いだ功は当然同氏に属すべきである。"
"52","akutagawa","zoku_yajinseikeino_koto.txt","この功は多分中戸川氏自身の予想しなかつたところであらう。"
"53","akutagawa","zoku_yajinseikeino_koto.txt","しかし功には違ひないから、序に此処に吹聴することにした。"
"54","akutagawa","zoku_yajinseikeino_koto.txt",""
"55","akutagawa","zoku_yajinseikeino_koto.txt",""
"56","akutagawa","zoku_yajinseikeino_koto.txt","二女と影"
"57","akutagawa","zoku_yajinseikeino_koto.txt",""
"58","akutagawa","zoku_yajinseikeino_koto.txt","紋服を着た西洋人は滑稽に見えるものである。"
"59","akutagawa","zoku_yajinseikeino_koto.txt","或は滑稽に見える余り、西洋人自身の男振などは滅多に問題にならないものである。"
"60","akutagawa","zoku_yajinseikeino_koto.txt","クロオデル大使の「女と影」も、云はば紋服を着た西洋人だつたから、一笑に付せられてしまつたのであらう。"
"61","akutagawa","zoku_yajinseikeino_koto.txt","しかし当人の男ぶりは紋服たると燕尾服たるとを問はず独立に美醜を論ぜらるべきである。"
"62","akutagawa","zoku_yajinseikeino_koto.txt","「女と影」に対する世評は存外この点に無頓着だつたらしい。"
"63","akutagawa","zoku_yajinseikeino_koto.txt","さう男ぶりを閑却するのは仏蘭西人たる大使にも気の毒である。"
"64","akutagawa","zoku_yajinseikeino_koto.txt",""
"65","akutagawa","zoku_yajinseikeino_koto.txt","試みにあの作品の舞台をペルシアか印度かへ移して見るが好い。"
"66","akutagawa","zoku_yajinseikeino_koto.txt","桃の花の代りに蓮の花を咲かせ、古風な侍の女房の代りに王女か何か舞はせたとすれば、毒舌に富んだ批評家と雖も、今日のやうに敢然とは鼎の軽重を問はなかつたであらう。"
"67","akutagawa","zoku_yajinseikeino_koto.txt","況やあの作品にさへ三歎の声を惜まなかつた鑑賞上の神秘主義者などは勿論無上の法悦の為に即死を遂げたのに相違あるまい。"
"68","akutagawa","zoku_yajinseikeino_koto.txt","クロオデル大使は紋服の為にこの位損な目を見てゐるのである。"
"69","akutagawa","zoku_yajinseikeino_koto.txt",""
"70","akutagawa","zoku_yajinseikeino_koto.txt","しかし男ぶりは姑く問はず、紋服そのものの感じにしても、全然｜面白味のない訣ではない。"
"71","akutagawa","zoku_yajinseikeino_koto.txt","成程「女と影」なるものは日本のやうな西洋のやうな、妙にとんちんかんな作品である。"
"72","akutagawa","zoku_yajinseikeino_koto.txt","けれどもあのとんちんかんのところは手腕の鈍い為に起つたものではない。"
"73","akutagawa","zoku_yajinseikeino_koto.txt","日本とか我我日本人の芸術とかに理解のない為に起つたものである。"
"74","akutagawa","zoku_yajinseikeino_koto.txt","虎を描かうと思つたのが猫になつてしまつたのではない。"
"75","akutagawa","zoku_yajinseikeino_koto.txt","猫も虎も見わけられないから、同じやうに描いてすましてゐるのである。"
"76","akutagawa","zoku_yajinseikeino_koto.txt","思ふに虎になり損なつた彼は小説家になり損なつた批評家のやうに、義理にも面白いとは云はれたものではない。"
"77","akutagawa","zoku_yajinseikeino_koto.txt","けれども猫とも虎ともつかない、何か怪しげな動物になれば、古来｜野師の儲けたのはかう云ふ動物恩恵である。"
"78","akutagawa","zoku_yajinseikeino_koto.txt","我我は面白いと思はないものに一銭の木戸銭をも抛つ筈はない。"
"79","akutagawa","zoku_yajinseikeino_koto.txt",""
"80","akutagawa","zoku_yajinseikeino_koto.txt","これは「女と影」ばかりではない。"
"81","akutagawa","zoku_yajinseikeino_koto.txt","「サムラヒ」とか「ダイミヤウ」とか云ふエレデイアの詩でも同じことである。"
"82","akutagawa","zoku_yajinseikeino_koto.txt","ああ云ふ作品は可笑しいかも知れない。"
"83","akutagawa","zoku_yajinseikeino_koto.txt","しかしその可笑しいところに、善く云へば阿蘭陀の花瓶に似た、悪く云へばサムラヒ商会の輸出品に似た一種のシヤルムがひそんでゐる。"
"84","akutagawa","zoku_yajinseikeino_koto.txt","このシヤルムさへ認めないのは偏狭の譏を免れないであらう。"
"85","akutagawa","zoku_yajinseikeino_koto.txt","予は野口米次郎氏の如き、或は郡虎彦氏の如き、西洋に名を馳せた日本人の作品も、その名を馳せた一半の理由はこのシヤルムにあつたことを信じてゐる。"
"86","akutagawa","zoku_yajinseikeino_koto.txt","と云ふのは勿論両氏の作品に非難を加へようと云ふのではない。"
"87","akutagawa","zoku_yajinseikeino_koto.txt","寛大な西洋人に迎へられたことを両氏の為に欣幸とし、偏狭な日本人に却けられたことをクロオデル大使の為に遺憾とするのである。"
"88","akutagawa","zoku_yajinseikeino_koto.txt",""
"89","akutagawa","zoku_yajinseikeino_koto.txt","仄聞するところによれば、クロオデル大使はどう云ふ訣か、西洋｜輓近の芸術に対する日本人の鑑賞力に疑惑を抱いてゐるさうである。"
"90","akutagawa","zoku_yajinseikeino_koto.txt","まことに「女と影」の如きも、予などの批評を許さないかも知れない。"
"91","akutagawa","zoku_yajinseikeino_koto.txt","しかし時の古今を問はず、わが日本の芸術に対する西洋人の鑑賞力は――予は先夜｜細川侯の舞台に桜間金太郎氏の「すみだ川」を見ながら欠伸をしてゐたクロオデル大使に同情の微笑を禁じ得なかつた。"
"92","akutagawa","zoku_yajinseikeino_koto.txt","すると半可通をふりまはすことは大使も予もお互ひ様である。"
"93","akutagawa","zoku_yajinseikeino_koto.txt","仏蘭西の大使クロオデル閣下、どうか悪しからずお読み下さい。"
"94","akutagawa","zoku_yajinseikeino_koto.txt",""
"95","akutagawa","zoku_yajinseikeino_koto.txt",""
"96","akutagawa","zoku_yajinseikeino_koto.txt","三ピエル・ロテイの死"
"97","akutagawa","zoku_yajinseikeino_koto.txt",""
"98","akutagawa","zoku_yajinseikeino_koto.txt","ピエル・ロテイが死んださうである。"
"99","akutagawa","zoku_yajinseikeino_koto.txt","ロテイが「お菊夫人」「日本の秋」等の作者たることは今更辯じ立てる必要はあるまい。"
"100","akutagawa","zoku_yajinseikeino_koto.txt","小泉八雲一人を除けば、兎に角ロテイは不二山や椿やベベ・ニツポンを着た女と最も因縁の深い西洋人である。"
"101","akutagawa","zoku_yajinseikeino_koto.txt","そのロテイを失つたことは我我日本人の身になるとまんざら人ごとのやうに思はれない。"
"102","akutagawa","zoku_yajinseikeino_koto.txt",""
"103","akutagawa","zoku_yajinseikeino_koto.txt","ロテイは偉い作家ではない。"
"104","akutagawa","zoku_yajinseikeino_koto.txt","同時代の作家と比べたところが、余り背の高い方ではなささうである。"
"105","akutagawa","zoku_yajinseikeino_koto.txt","ロテイは新らしい感覚描写を与へた。"
"106","akutagawa","zoku_yajinseikeino_koto.txt","或は新らしい抒情詩を与へた。"
"107","akutagawa","zoku_yajinseikeino_koto.txt","しかし新らしい人生の見かたや新らしい道徳は与へなかつた。"
"108","akutagawa","zoku_yajinseikeino_koto.txt","勿論これは芸術家たるロテイには致命傷でも何でもないのに違ひない。"
"109","akutagawa","zoku_yajinseikeino_koto.txt","提燈は火さへともせれば、敬意を表して然るべきである。"
"110","akutagawa","zoku_yajinseikeino_koto.txt","合羽のやうに雨が凌げぬにしろ、軽蔑して好いと云ふものではない。"
"111","akutagawa","zoku_yajinseikeino_koto.txt","しかし雨が降つてゐるから、まづ提燈は持たずとも合羽の御厄介にならうと云ふのはもとより人情の自然である。"
"112","akutagawa","zoku_yajinseikeino_koto.txt","かう云ふ人情の矢面には如何なる芸術至上主義も、提燈におしなさいと云ふ忠告と同様、利き目のないものと覚悟せねばならぬ。"
"113","akutagawa","zoku_yajinseikeino_koto.txt","我我は土砂降りの往来に似た人生を辿る人足である。"
"114","akutagawa","zoku_yajinseikeino_koto.txt","けれどもロテイは我我に一枚の合羽をも与へなかつた。"
"115","akutagawa","zoku_yajinseikeino_koto.txt","だから我我はロテイの上に「偉い」と云ふ言葉を加へないのである。"
"116","akutagawa","zoku_yajinseikeino_koto.txt","古来偉い芸術家と云ふのは、――勿論合羽の施行をする人に過ぎない。"
"117","akutagawa","zoku_yajinseikeino_koto.txt",""
"118","akutagawa","zoku_yajinseikeino_koto.txt","又ロテイはこの数年間、仏蘭西文壇の「人物」だつたにせよ、仏蘭西文壇の「力」ではなかつた。"
"119","akutagawa","zoku_yajinseikeino_koto.txt","だから彼の死も実際的には格別影響を及ぼさないであらう。"
"120","akutagawa","zoku_yajinseikeino_koto.txt","唯我我日本人は前にもちよいと云つた通り、美しい日本の小説を書いた、当年の仏蘭西の海軍将校ジユリアン・ヴイオオの長逝に哀悼の念を抱いてゐる。"
"121","akutagawa","zoku_yajinseikeino_koto.txt","ロテイの描いた日本はヘルンの描いた日本よりも、真を伝へない画図かも知れない。"
"122","akutagawa","zoku_yajinseikeino_koto.txt","しかし兎に角好画図たることは異論を許さない事実である。"
"123","akutagawa","zoku_yajinseikeino_koto.txt","我我の姉妹たるお菊さんだの或は又お梅さんだのは、ロテイの小説を待つた後、巴里の敷石の上をも歩むやうになつた。"
"124","akutagawa","zoku_yajinseikeino_koto.txt","我我は其処にロテイに対する日本の感謝を捧げたいと思ふ。"
"125","akutagawa","zoku_yajinseikeino_koto.txt","なほロテイの生涯は大体左に示す通りである。"
"126","akutagawa","zoku_yajinseikeino_koto.txt",""
"127","akutagawa","zoku_yajinseikeino_koto.txt","千八百五十年一月十四日、ロテイはロシユフオオルで生れ、十七歳の時、海軍に入り、千九百六年大佐になつた。"
"128","akutagawa","zoku_yajinseikeino_koto.txt","大佐になつたのは数へ年で五十七の時である。"
"129","akutagawa","zoku_yajinseikeino_koto.txt",""
"130","akutagawa","zoku_yajinseikeino_koto.txt","最初の作は千八百七十九年、即三十歳の時｜公にした 〔Aziyade'〕 である。"
"131","akutagawa","zoku_yajinseikeino_koto.txt","後ち一年、千八百八十年に Rarahu を出して一躍流行児になつた。"
"132","akutagawa","zoku_yajinseikeino_koto.txt","これは二年の後「ロテイの結婚」と改題再刊されたものである。"
"133","akutagawa","zoku_yajinseikeino_koto.txt",""
"134","akutagawa","zoku_yajinseikeino_koto.txt","かの「お菊さん」は千八百八十七年に、「日本の秋」は八十九年に公にされた。"
"135","akutagawa","zoku_yajinseikeino_koto.txt",""
"136","akutagawa","zoku_yajinseikeino_koto.txt","アカデミイの会員に選まれたのは九十一年、数へて四十二歳の時である。"
"137","akutagawa","zoku_yajinseikeino_koto.txt",""
"138","akutagawa","zoku_yajinseikeino_koto.txt","彼は、国際電報の伝ふるところによると、十日アンダイエで死んだのである。"
"139","akutagawa","zoku_yajinseikeino_koto.txt","時に歳七十三。"
"140","akutagawa","zoku_yajinseikeino_koto.txt",""
"141","akutagawa","zoku_yajinseikeino_koto.txt",""
"142","akutagawa","zoku_yajinseikeino_koto.txt","四新緑の庭"
"143","akutagawa","zoku_yajinseikeino_koto.txt",""
"144","akutagawa","zoku_yajinseikeino_koto.txt","桜さつぱりした雨上りです。"
"145","akutagawa","zoku_yajinseikeino_koto.txt","尤も花の萼は赤いなりについてゐますが。"
"146","akutagawa","zoku_yajinseikeino_koto.txt",""
"147","akutagawa","zoku_yajinseikeino_koto.txt",""
"148","akutagawa","zoku_yajinseikeino_koto.txt","椎わたしもそろそろ芽をほごしませう。"
"149","akutagawa","zoku_yajinseikeino_koto.txt","このちよいと鼠がかつた芽をね。"
"150","akutagawa","zoku_yajinseikeino_koto.txt",""
"151","akutagawa","zoku_yajinseikeino_koto.txt",""
"152","akutagawa","zoku_yajinseikeino_koto.txt","竹わたしは未だに黄疸ですよ。"
"153","akutagawa","zoku_yajinseikeino_koto.txt","……"
"154","akutagawa","zoku_yajinseikeino_koto.txt",""
"155","akutagawa","zoku_yajinseikeino_koto.txt","芭蕉おつと、この緑のランプの火屋を風に吹き折られる所だつた。"
"156","akutagawa","zoku_yajinseikeino_koto.txt",""
"157","akutagawa","zoku_yajinseikeino_koto.txt",""
"158","akutagawa","zoku_yajinseikeino_koto.txt","梅何だか寒気がすると思つたら、もう毛虫がたかつてゐるんだよ。"
"159","akutagawa","zoku_yajinseikeino_koto.txt",""
"160","akutagawa","zoku_yajinseikeino_koto.txt",""
"161","akutagawa","zoku_yajinseikeino_koto.txt","八つ手痒いなあ、この茶色の産毛のあるうちは。"
"162","akutagawa","zoku_yajinseikeino_koto.txt",""
"163","akutagawa","zoku_yajinseikeino_koto.txt",""
"164","akutagawa","zoku_yajinseikeino_koto.txt","百日紅何、まだ早うござんさあね。"
"165","akutagawa","zoku_yajinseikeino_koto.txt","わたしなどは御覧の通り枯枝ばかりさ。"
"166","akutagawa","zoku_yajinseikeino_koto.txt",""
"167","akutagawa","zoku_yajinseikeino_koto.txt",""
"168","akutagawa","zoku_yajinseikeino_koto.txt","霧島躑躅常――常談云つちやいけない。"
"169","akutagawa","zoku_yajinseikeino_koto.txt","わたしなどはあまり忙しいものだから、今年だけはつい何時にもない薄紫に咲いてしまつた。"
"170","akutagawa","zoku_yajinseikeino_koto.txt",""
"171","akutagawa","zoku_yajinseikeino_koto.txt",""
"172","akutagawa","zoku_yajinseikeino_koto.txt","覇王樹どうでも勝手にするが好いや。"
"173","akutagawa","zoku_yajinseikeino_koto.txt","おれの知つたことぢやなし。"
"174","akutagawa","zoku_yajinseikeino_koto.txt",""
"175","akutagawa","zoku_yajinseikeino_koto.txt",""
"176","akutagawa","zoku_yajinseikeino_koto.txt","石榴ちよいと枝一面に蚤のたかつたやうでせう。"
"177","akutagawa","zoku_yajinseikeino_koto.txt",""
"178","akutagawa","zoku_yajinseikeino_koto.txt",""
"179","akutagawa","zoku_yajinseikeino_koto.txt","苔起きないこと？"
"180","akutagawa","zoku_yajinseikeino_koto.txt","石うんもう少し。"
"181","akutagawa","zoku_yajinseikeino_koto.txt",""
"182","akutagawa","zoku_yajinseikeino_koto.txt",""
"183","akutagawa","zoku_yajinseikeino_koto.txt","楓「若楓茶色になるも一盛り」――ほんたうにひと盛りですね。"
"184","akutagawa","zoku_yajinseikeino_koto.txt","もう今は世間並みに唯水水しい鶸色です。"
"185","akutagawa","zoku_yajinseikeino_koto.txt","おや、障子に灯がともりました。"
"186","akutagawa","zoku_yajinseikeino_koto.txt",""
"187","akutagawa","zoku_yajinseikeino_koto.txt",""
"188","akutagawa","zoku_yajinseikeino_koto.txt","五春の日のさした往来をぶらぶら一人歩いてゐる"
"189","akutagawa","zoku_yajinseikeino_koto.txt",""
"190","akutagawa","zoku_yajinseikeino_koto.txt","春の日のさした往来をぶらぶら一人歩いてゐる。"
"191","akutagawa","zoku_yajinseikeino_koto.txt","向うから来るのは屋根屋の親かた。"
"192","akutagawa","zoku_yajinseikeino_koto.txt","屋根屋の親かたもこの節は紺の背広に中折帽をかぶり、ゴムか何かの長靴をはいてゐる。"
"193","akutagawa","zoku_yajinseikeino_koto.txt","それにしても大きい長靴だなあ。"
"194","akutagawa","zoku_yajinseikeino_koto.txt","膝――どころではない。"
"195","akutagawa","zoku_yajinseikeino_koto.txt","腿も半分がたは隠れてゐる。"
"196","akutagawa","zoku_yajinseikeino_koto.txt","ああ云ふ長靴をはいた時には、長靴をはいたと云ふよりも、何かの拍子に長靴の中へ落つこつたやうな気がするだらうなあ。"
"197","akutagawa","zoku_yajinseikeino_koto.txt",""
"198","akutagawa","zoku_yajinseikeino_koto.txt","顔馴染の道具屋を覗いて見る。"
"199","akutagawa","zoku_yajinseikeino_koto.txt","正面の紅木の棚の上に虫明けらしい徳利が一本。"
"200","akutagawa","zoku_yajinseikeino_koto.txt","あの徳利の口などは妙に猥褻に出来上つてゐる。"
"201","akutagawa","zoku_yajinseikeino_koto.txt","さうさう、いつか見た古備前の徳利の口もちよいと接吻位したかつたつけ。"
"202","akutagawa","zoku_yajinseikeino_koto.txt","鼻の先に染めつけの皿が一枚。"
"203","akutagawa","zoku_yajinseikeino_koto.txt","藍色の柳の枝垂れた下にやはり藍色の人が一人、莫迦に長い釣竿を伸ばしてゐる。"
"204","akutagawa","zoku_yajinseikeino_koto.txt","誰かと思つて覗きこんで見たら、金沢にゐる室生犀星！"
"205","akutagawa","zoku_yajinseikeino_koto.txt","又ぶらぶら歩きはじめる。"
"206","akutagawa","zoku_yajinseikeino_koto.txt","八百屋の店に慈姑がすこし。"
"207","akutagawa","zoku_yajinseikeino_koto.txt","慈姑の皮の色は上品だなあ。"
"208","akutagawa","zoku_yajinseikeino_koto.txt","古い泥七宝の青に似てゐる。"
"209","akutagawa","zoku_yajinseikeino_koto.txt","あの慈姑を買はうかしら。"
"210","akutagawa","zoku_yajinseikeino_koto.txt","※をつけ。"
"211","akutagawa","zoku_yajinseikeino_koto.txt","買ふ気のないことは知つてゐる癖に。"
"212","akutagawa","zoku_yajinseikeino_koto.txt","だが一体どう云ふものだらう、自分にも※をつきたい気のするのは。"
"213","akutagawa","zoku_yajinseikeino_koto.txt","今度は小鳥屋。"
"214","akutagawa","zoku_yajinseikeino_koto.txt","どこもかしこも鳥籠だらけだなあ。"
"215","akutagawa","zoku_yajinseikeino_koto.txt","おや、御亭主も気楽さうに山雀の籠の中に坐つてゐる！"
"216","akutagawa","zoku_yajinseikeino_koto.txt","「つまり馬に乗つた時と同じなのさ。"
"217","akutagawa","zoku_yajinseikeino_koto.txt","」"
"218","akutagawa","zoku_yajinseikeino_koto.txt","「カントの論文に崇られたんだね。"
"219","akutagawa","zoku_yajinseikeino_koto.txt","」"
"220","akutagawa","zoku_yajinseikeino_koto.txt","後ろからさつさと通りぬける制服制帽の大学生が二人。"
"221","akutagawa","zoku_yajinseikeino_koto.txt","ちよいと聞いた他人の会話と云ふものは気違ひの会話に似てゐるなあ。"
"222","akutagawa","zoku_yajinseikeino_koto.txt","この辺そろそろ上り坂。"
"223","akutagawa","zoku_yajinseikeino_koto.txt","もうあの家の椿などは落ちて茶色に変つてゐる。"
"224","akutagawa","zoku_yajinseikeino_koto.txt","尤も崖側の竹藪は不相変黄ばんだままなのだが……おつと向うから馬が来たぞ。"
"225","akutagawa","zoku_yajinseikeino_koto.txt","馬の目玉は大きいなあ。"
"226","akutagawa","zoku_yajinseikeino_koto.txt","竹藪も椿も己の顔もみんな目玉の中に映つてゐる。"
"227","akutagawa","zoku_yajinseikeino_koto.txt","馬のあとからはモンシロ蝶。"
"228","akutagawa","zoku_yajinseikeino_koto.txt",""
"229","akutagawa","zoku_yajinseikeino_koto.txt","「生ミタテ玉子アリマス。"
"230","akutagawa","zoku_yajinseikeino_koto.txt","」"
