"","auth","piece","line"
"231","akutagawa","zoku_yajinseikeino_koto.txt","アア、サウデスカ？ワタシハ玉子ハ入リマセン。"
"232","akutagawa","zoku_yajinseikeino_koto.txt","――春の日のさした往来をぶらぶら一人歩いてゐる。"
"233","akutagawa","zoku_yajinseikeino_koto.txt",""
"234","akutagawa","zoku_yajinseikeino_koto.txt",""
"235","akutagawa","zoku_yajinseikeino_koto.txt","六霜夜"
"236","akutagawa","zoku_yajinseikeino_koto.txt",""
"237","akutagawa","zoku_yajinseikeino_koto.txt","霜夜の記憶の一つ。"
"238","akutagawa","zoku_yajinseikeino_koto.txt",""
"239","akutagawa","zoku_yajinseikeino_koto.txt","いつものやうに机に向つてゐると、いつか十二時を打つ音がする。"
"240","akutagawa","zoku_yajinseikeino_koto.txt","十二時には必ず寝ることにしてゐる。"
"241","akutagawa","zoku_yajinseikeino_koto.txt","今夜もまづ本を閉じ、それからあした坐り次第、直に仕事にかかれるやうに机の上を片づける。"
"242","akutagawa","zoku_yajinseikeino_koto.txt","片づけると云つても大したことはない。"
"243","akutagawa","zoku_yajinseikeino_koto.txt","原稿用紙と入用の書物とを一まとめに重ねるばかりである。"
"244","akutagawa","zoku_yajinseikeino_koto.txt","最後に火鉢の火の始末をする。"
"245","akutagawa","zoku_yajinseikeino_koto.txt","はんねらの瓶に鉄瓶の湯をつぎ、その中へ火を一つづつ入れる。"
"246","akutagawa","zoku_yajinseikeino_koto.txt","火は見る見る黒くなる。"
"247","akutagawa","zoku_yajinseikeino_koto.txt","炭の鳴る音も盛んにする。"
"248","akutagawa","zoku_yajinseikeino_koto.txt","水蒸気ももやもや立ち昇る。"
"249","akutagawa","zoku_yajinseikeino_koto.txt","何か楽しい心もちがする。"
"250","akutagawa","zoku_yajinseikeino_koto.txt","何か又はかない心もちもする。"
"251","akutagawa","zoku_yajinseikeino_koto.txt","床は次の間にとつてある。"
"252","akutagawa","zoku_yajinseikeino_koto.txt","次の間も書斎も二階である。"
"253","akutagawa","zoku_yajinseikeino_koto.txt","寝る前には必ず下へおり、のびのびと一人小便をする。"
"254","akutagawa","zoku_yajinseikeino_koto.txt","今夜もそつと二階を下りる。"
"255","akutagawa","zoku_yajinseikeino_koto.txt","家族の眼をさまさせないやうに、出来るだけそつと二階を下りる。"
"256","akutagawa","zoku_yajinseikeino_koto.txt","座敷の次の間に電燈がついてゐる。"
"257","akutagawa","zoku_yajinseikeino_koto.txt","まだ誰か起きてゐるなと思ふ。"
"258","akutagawa","zoku_yajinseikeino_koto.txt","誰が起きてゐるのかしらとも思ふ。"
"259","akutagawa","zoku_yajinseikeino_koto.txt","その部屋の外を通りかかると、六十八になる伯母が一人、古い綿をのばしてゐる。"
"260","akutagawa","zoku_yajinseikeino_koto.txt","かすかに光る絹の綿である。"
"261","akutagawa","zoku_yajinseikeino_koto.txt",""
"262","akutagawa","zoku_yajinseikeino_koto.txt","「伯母さん」と云ふ。"
"263","akutagawa","zoku_yajinseikeino_koto.txt","「まだ起きてゐたの？」と云ふ。"
"264","akutagawa","zoku_yajinseikeino_koto.txt","「ああ、今これだけしてしまはうと思つて。"
"265","akutagawa","zoku_yajinseikeino_koto.txt","お前ももう寝るのだらう？」と云ふ。"
"266","akutagawa","zoku_yajinseikeino_koto.txt","後架の電燈はどうしてもつかない。"
"267","akutagawa","zoku_yajinseikeino_koto.txt","やむを得ず暗いまま小便をする。"
"268","akutagawa","zoku_yajinseikeino_koto.txt","後架の窓の外には竹が生えてゐる、風のある晩は葉のすれる音がする。"
"269","akutagawa","zoku_yajinseikeino_koto.txt","今夜は音も何もしない。"
"270","akutagawa","zoku_yajinseikeino_koto.txt","唯寒い夜に封じられてゐる。"
"271","akutagawa","zoku_yajinseikeino_koto.txt",""
"272","akutagawa","zoku_yajinseikeino_koto.txt",""
"273","akutagawa","zoku_yajinseikeino_koto.txt","薄綿はのばし兼ねたる霜夜かな"
"274","akutagawa","zoku_yajinseikeino_koto.txt",""
"275","akutagawa","zoku_yajinseikeino_koto.txt","七蒐集"
"276","akutagawa","zoku_yajinseikeino_koto.txt",""
"277","akutagawa","zoku_yajinseikeino_koto.txt","僕は如何なる時代でも、蒐集癖と云ふものを持つたことはない。"
"278","akutagawa","zoku_yajinseikeino_koto.txt","もし持つたことがあるとすれば、年少時代に昆虫類の標本を集めたこと位であらう。"
"279","akutagawa","zoku_yajinseikeino_koto.txt","現在は成程書物だけは幾らか集まつてゐるかも知れない。"
"280","akutagawa","zoku_yajinseikeino_koto.txt","しかしそれも集まつたのである。"
"281","akutagawa","zoku_yajinseikeino_koto.txt","落葉の風だまりへ集まるやうに自然と書棚へ集まつたのである。"
"282","akutagawa","zoku_yajinseikeino_koto.txt","何も苦心して集めた訣ではない。"
"283","akutagawa","zoku_yajinseikeino_koto.txt",""
"284","akutagawa","zoku_yajinseikeino_koto.txt","書物さへ既にさうである。"
"285","akutagawa","zoku_yajinseikeino_koto.txt","況や書画とか骨董とかは一度も集めたいと思つたことはない。"
"286","akutagawa","zoku_yajinseikeino_koto.txt","尤もこれはと思つたにしろ、到底我我売文の徒には手の出ぬせゐでもありさうである。"
"287","akutagawa","zoku_yajinseikeino_koto.txt","しかし僕の集めたがらぬのは必しもその為ばかりではない。"
"288","akutagawa","zoku_yajinseikeino_koto.txt","寧ろ集めたいと云ふ気持に余り快哉を感ぜぬのである。"
"289","akutagawa","zoku_yajinseikeino_koto.txt","或は集めんとする気組みに倦怠を感じてしまふのである。"
"290","akutagawa","zoku_yajinseikeino_koto.txt",""
"291","akutagawa","zoku_yajinseikeino_koto.txt","これは智識も同じことである。"
"292","akutagawa","zoku_yajinseikeino_koto.txt","僕はまだ如何なる智識も集めようと思つて集めたことはない。"
"293","akutagawa","zoku_yajinseikeino_koto.txt","尤も集めたと思はれるほど、智識のないことも事実である。"
"294","akutagawa","zoku_yajinseikeino_koto.txt","しかし多少でもあるとすれば、兎に角集まつたと云はなければならぬ。"
"295","akutagawa","zoku_yajinseikeino_koto.txt",""
"296","akutagawa","zoku_yajinseikeino_koto.txt","蒐集家は情熱に富んだものである。"
"297","akutagawa","zoku_yajinseikeino_koto.txt","殊にたつた一枚のマツチの商標を手に入れる為に、世界を周遊する蒐集家などは殆ど情熱そのものである。"
"298","akutagawa","zoku_yajinseikeino_koto.txt","だから情熱を軽蔑しない限り、蒐集家も一笑に付することは出来ない。"
"299","akutagawa","zoku_yajinseikeino_koto.txt","しかし僕は蒐集家とは別の鋳型に属してゐる。"
"300","akutagawa","zoku_yajinseikeino_koto.txt","同時に又革命家や予言者とも別の鋳型に属してゐる。"
"301","akutagawa","zoku_yajinseikeino_koto.txt",""
"302","akutagawa","zoku_yajinseikeino_koto.txt","僕はマツチの商標に対する情熱にも同情を感じてゐる。"
"303","akutagawa","zoku_yajinseikeino_koto.txt","いや、同情と云ふ代りに敬意と云つても差支へない。"
"304","akutagawa","zoku_yajinseikeino_koto.txt","しかしマツチの商標の価値にはどちらかと云へば懐疑的である。"
"305","akutagawa","zoku_yajinseikeino_koto.txt","僕は以前かう云ふ気質を羞づかしいと思つたことがあつた。"
"306","akutagawa","zoku_yajinseikeino_koto.txt","けれども面皮の厚くなつた今はさほど卑下する気もちにもなれない。"
"307","akutagawa","zoku_yajinseikeino_koto.txt","――"
"308","akutagawa","zoku_yajinseikeino_koto.txt",""
"309","akutagawa","zoku_yajinseikeino_koto.txt","八知己料"
"310","akutagawa","zoku_yajinseikeino_koto.txt",""
"311","akutagawa","zoku_yajinseikeino_koto.txt","僕等は当時「新思潮」といふ同人雑誌に楯こもつてゐた。"
"312","akutagawa","zoku_yajinseikeino_koto.txt","「新思潮」以外の雑誌にも時時作品を発表するのは久米正雄一人ぎりだつた。"
"313","akutagawa","zoku_yajinseikeino_koto.txt","そこへ「希望」といふ雑誌社から、突然僕へ宛てた手紙が来た。"
"314","akutagawa","zoku_yajinseikeino_koto.txt","手紙には、五月号に間に合ふやうに短篇を一つお願ひしたい。"
"315","akutagawa","zoku_yajinseikeino_koto.txt","御都合は如何と書いてあつた。"
"316","akutagawa","zoku_yajinseikeino_koto.txt","僕は勿論｜快諾した。"
"317","akutagawa","zoku_yajinseikeino_koto.txt",""
"318","akutagawa","zoku_yajinseikeino_koto.txt","僕は一週間たたない内に、「虱」といふ短篇を希望社へおくつた。"
"319","akutagawa","zoku_yajinseikeino_koto.txt","それから――原稿料の届くのを待つた。"
"320","akutagawa","zoku_yajinseikeino_koto.txt","最初の原稿料を待つ気もちは売文の経験のない人には、ちよいと想像が出来ないかも知れない。"
"321","akutagawa","zoku_yajinseikeino_koto.txt","僕も少し誇張すれば、直侍を待つ三千歳のやうに、振替の来る日を待ちくらしたのである。"
"322","akutagawa","zoku_yajinseikeino_koto.txt",""
"323","akutagawa","zoku_yajinseikeino_koto.txt","原稿料は容易に届かなかつた。"
"324","akutagawa","zoku_yajinseikeino_koto.txt","僕はたびたび久米正雄と、希望社は僕の短篇にいくら払ふかを論じ合つた。"
"325","akutagawa","zoku_yajinseikeino_koto.txt",""
"326","akutagawa","zoku_yajinseikeino_koto.txt","「一円は払ふね。"
"327","akutagawa","zoku_yajinseikeino_koto.txt","一円ならば十二枚十二円か。"
"328","akutagawa","zoku_yajinseikeino_koto.txt","そんなことはない。"
"329","akutagawa","zoku_yajinseikeino_koto.txt","一円五十銭は大丈夫払ふよ。"
"330","akutagawa","zoku_yajinseikeino_koto.txt","」"
"331","akutagawa","zoku_yajinseikeino_koto.txt","久米はかういふ予測を下した。"
"332","akutagawa","zoku_yajinseikeino_koto.txt","何だかさう云はれて見れば、僕も一円五十銭は払つてもらはれさうな心もちになつた。"
"333","akutagawa","zoku_yajinseikeino_koto.txt",""
"334","akutagawa","zoku_yajinseikeino_koto.txt","「一円五十銭払つたら、八円だけおごれよ。"
"335","akutagawa","zoku_yajinseikeino_koto.txt","」"
"336","akutagawa","zoku_yajinseikeino_koto.txt","僕はおごると約束した。"
"337","akutagawa","zoku_yajinseikeino_koto.txt",""
"338","akutagawa","zoku_yajinseikeino_koto.txt","「一円でも、五円はおごる義務があるな。"
"339","akutagawa","zoku_yajinseikeino_koto.txt","」"
"340","akutagawa","zoku_yajinseikeino_koto.txt","久米はまたかういつた。"
"341","akutagawa","zoku_yajinseikeino_koto.txt","僕はその義務を認めなかつた。"
"342","akutagawa","zoku_yajinseikeino_koto.txt","しかし五円だけ割愛することには、格別異存も持たなかつた。"
"343","akutagawa","zoku_yajinseikeino_koto.txt",""
"344","akutagawa","zoku_yajinseikeino_koto.txt","その内に「希望」の五月号が出、同時に原稿料も手にはひつた。"
"345","akutagawa","zoku_yajinseikeino_koto.txt","僕はそれをふところにしたまま、久米の下宿へ出かけて行つた。"
"346","akutagawa","zoku_yajinseikeino_koto.txt",""
"347","akutagawa","zoku_yajinseikeino_koto.txt","「いくら来た？一円か？一円五十銭か？」"
"348","akutagawa","zoku_yajinseikeino_koto.txt","久米は僕の顔を見ると、彼自身のことのやうに熱心にたづねた。"
"349","akutagawa","zoku_yajinseikeino_koto.txt","僕は何ともこたへずに、振替の紙を出して見せた。"
"350","akutagawa","zoku_yajinseikeino_koto.txt","振替の紙には残酷にも三円六十銭と書いてあつた。"
"351","akutagawa","zoku_yajinseikeino_koto.txt",""
"352","akutagawa","zoku_yajinseikeino_koto.txt","「三十銭か。"
"353","akutagawa","zoku_yajinseikeino_koto.txt","三十銭はひどいな。"
"354","akutagawa","zoku_yajinseikeino_koto.txt","」"
"355","akutagawa","zoku_yajinseikeino_koto.txt","久米もさすがになさけない顔をした。"
"356","akutagawa","zoku_yajinseikeino_koto.txt","僕はなほ更｜仏頂づらをしてゐた。"
"357","akutagawa","zoku_yajinseikeino_koto.txt","が、僕等はしばらくすると、同時ににやにや笑ひ出した。"
"358","akutagawa","zoku_yajinseikeino_koto.txt","久米はいはゆる微苦笑をうかべ、僕は手がるに苦笑したのである。"
"359","akutagawa","zoku_yajinseikeino_koto.txt",""
"360","akutagawa","zoku_yajinseikeino_koto.txt","「三十銭は知己料をさしひいたんだらう。"
"361","akutagawa","zoku_yajinseikeino_koto.txt","一円五十銭マイナス三十銭――一円二十銭の知己料は高いな。"
"362","akutagawa","zoku_yajinseikeino_koto.txt","」"
"363","akutagawa","zoku_yajinseikeino_koto.txt","久米はこんなことをいひながら、振替の紙を僕にかへした。"
"364","akutagawa","zoku_yajinseikeino_koto.txt","しかしもうこの間のやうに、おごれとか何とかはいはなかつた。"
"365","akutagawa","zoku_yajinseikeino_koto.txt",""
"366","akutagawa","zoku_yajinseikeino_koto.txt",""
"367","akutagawa","zoku_yajinseikeino_koto.txt","九妄問妄答"
"368","akutagawa","zoku_yajinseikeino_koto.txt",""
"369","akutagawa","zoku_yajinseikeino_koto.txt","客菊池寛氏の説によると、我我は今度の大地震のやうに命も危いと云ふ場合は芸術も何もあつたものぢやない。"
"370","akutagawa","zoku_yajinseikeino_koto.txt","まづ命あつての物種と尻端折りをするのに忙しさうだ。"
"371","akutagawa","zoku_yajinseikeino_koto.txt","しかし実際さう云ふものだらうか？"
"372","akutagawa","zoku_yajinseikeino_koto.txt","主人そりや実際さう云ふものだよ。"
"373","akutagawa","zoku_yajinseikeino_koto.txt",""
"374","akutagawa","zoku_yajinseikeino_koto.txt","客芸術上の玄人もかね？たとへば小説家とか、画家とか云ふ、――"
"375","akutagawa","zoku_yajinseikeino_koto.txt","主人玄人はまあ素人より芸術のことを考へさうだね。"
"376","akutagawa","zoku_yajinseikeino_koto.txt","しかしそれも考へて見れば、実は五十歩百歩なんだらう。"
"377","akutagawa","zoku_yajinseikeino_koto.txt","現在頭に火がついてゐるのに、この火焔をどう描写しようなどと考へる豪傑はゐまいからね。"
"378","akutagawa","zoku_yajinseikeino_koto.txt",""
"379","akutagawa","zoku_yajinseikeino_koto.txt","客しかし昔の侍などは横腹を槍に貫かれながら、辞世の歌を咏んでゐるからね。"
"380","akutagawa","zoku_yajinseikeino_koto.txt",""
"381","akutagawa","zoku_yajinseikeino_koto.txt","主人あれは唯名誉の為だね。"
"382","akutagawa","zoku_yajinseikeino_koto.txt","意識した芸術的衝動などは別のものだね。"
"383","akutagawa","zoku_yajinseikeino_koto.txt",""
"384","akutagawa","zoku_yajinseikeino_koto.txt","客ぢや我我の芸術的衝動はああ云ふ大変に出合つたが最後、全部なくなつてしまふと云ふのかね？"
"385","akutagawa","zoku_yajinseikeino_koto.txt","主人そりや全部はなくならないね。"
"386","akutagawa","zoku_yajinseikeino_koto.txt","現に遭難民の話を聞いて見給へ。"
"387","akutagawa","zoku_yajinseikeino_koto.txt","思ひの外芸術的なものも沢山あるから。"
"388","akutagawa","zoku_yajinseikeino_koto.txt","――元来芸術的に表現される為にはまづ一応芸術的に印象されてゐなければならない筈だらう。"
"389","akutagawa","zoku_yajinseikeino_koto.txt","するとさう云ふ連中は知らず識らず芸術的に心を働かせて来た訣だね。"
"390","akutagawa","zoku_yajinseikeino_koto.txt",""
"391","akutagawa","zoku_yajinseikeino_koto.txt","客（反語的に）しかしさう云ふ連中も頭に火でもついた日にや、やつぱり芸術的衝動を失うことになるだらうね？"
"392","akutagawa","zoku_yajinseikeino_koto.txt","主人さあ、さうとも限らないね。"
"393","akutagawa","zoku_yajinseikeino_koto.txt","無意識の芸術的衝動だけは案外生死の瀬戸際にも最後の飛躍をするものだからね？辞世の歌で思ひ出したが、昔の侍の討死などは大抵戯曲的或は俳優的衝動の――つまり俗に云ふ芝居気の表はれたものとも見られさうぢやないか？"
"394","akutagawa","zoku_yajinseikeino_koto.txt","客ぢや芸術的衝動はどう云ふ時にもあり得ると云ふんだね？"
"395","akutagawa","zoku_yajinseikeino_koto.txt","主人無意識の芸術的衝動はね。"
"396","akutagawa","zoku_yajinseikeino_koto.txt","しかし意識した芸術的衝動はどうもあり得るとは思はれないね。"
"397","akutagawa","zoku_yajinseikeino_koto.txt","現在頭に火がついてゐるのに、………"
"398","akutagawa","zoku_yajinseikeino_koto.txt","客それはもう前にも聞かされたよ。"
"399","akutagawa","zoku_yajinseikeino_koto.txt","ぢや君も菊池寛氏に全然｜賛成してゐるのかね？"
"400","akutagawa","zoku_yajinseikeino_koto.txt","主人あり得ないと云ふことだけはね。"
"401","akutagawa","zoku_yajinseikeino_koto.txt","しかし菊池氏はあり得ないのを寂しいと云つてゐるのだらう？僕は寂しいとも思はないね、当り前だとしか思はないね。"
"402","akutagawa","zoku_yajinseikeino_koto.txt",""
"403","akutagawa","zoku_yajinseikeino_koto.txt","客なぜ？"
"404","akutagawa","zoku_yajinseikeino_koto.txt","主人なぜも何もありやしないさ。"
"405","akutagawa","zoku_yajinseikeino_koto.txt","命あつての物種と云ふ時にや、何も彼も忘れてゐるんだからね。"
"406","akutagawa","zoku_yajinseikeino_koto.txt","芸術も勿論忘れる筈ぢやないか？僕などは大地震どころぢやないね。"
"407","akutagawa","zoku_yajinseikeino_koto.txt","小便のつまつた時にさへレムブラントもゲエテも忘れてしまふがね。"
"408","akutagawa","zoku_yajinseikeino_koto.txt","格別その為に芸術を軽んずる気などは起らないね。"
"409","akutagawa","zoku_yajinseikeino_koto.txt",""
"410","akutagawa","zoku_yajinseikeino_koto.txt","客ぢや芸術は人生にさ程痛切なものぢやないと云ふのかね。"
"411","akutagawa","zoku_yajinseikeino_koto.txt",""
"412","akutagawa","zoku_yajinseikeino_koto.txt","主人莫迦を云ひ給へ。"
"413","akutagawa","zoku_yajinseikeino_koto.txt","芸術的衝動は無意識の裡にも我我を動かしてゐると云つたぢやないか？さうすりや芸術は人生の底へ一面深い根を張つてゐるんだ。"
"414","akutagawa","zoku_yajinseikeino_koto.txt","――と云ふよりも寧ろ人生は芸術の芽に満ちた苗床なんだ。"
"415","akutagawa","zoku_yajinseikeino_koto.txt",""
"416","akutagawa","zoku_yajinseikeino_koto.txt","客すると「玉は砕けず」かね？"
"417","akutagawa","zoku_yajinseikeino_koto.txt","主人玉は――さうさね。"
"418","akutagawa","zoku_yajinseikeino_koto.txt","玉は或は砕けるかも知れない。"
"419","akutagawa","zoku_yajinseikeino_koto.txt","しかし石は砕けないね。"
"420","akutagawa","zoku_yajinseikeino_koto.txt","芸術家は或は亡びるかも知れない。"
"421","akutagawa","zoku_yajinseikeino_koto.txt","しかしいつか知らず識らず芸術的衝動に支配される熊さんや八さんは亡びないね。"
"422","akutagawa","zoku_yajinseikeino_koto.txt",""
"423","akutagawa","zoku_yajinseikeino_koto.txt","客ぢや君は問題になつた里見氏の説にも菊池氏の説にも部分的には反対だと云ふのかね。"
"424","akutagawa","zoku_yajinseikeino_koto.txt",""
"425","akutagawa","zoku_yajinseikeino_koto.txt","主人部分的には賛成だと云ふことにしたいね。"
"426","akutagawa","zoku_yajinseikeino_koto.txt","何しろ両雄の挾み打ちを受けるのはいくら僕でも難渋だからね。"
"427","akutagawa","zoku_yajinseikeino_koto.txt","ああ、それからまだ菊池氏の説には信用出来ぬ部分もあるね。"
"428","akutagawa","zoku_yajinseikeino_koto.txt",""
"429","akutagawa","zoku_yajinseikeino_koto.txt","客信用の出来ぬ部分がある？"
"430","akutagawa","zoku_yajinseikeino_koto.txt","主人菊池氏は今度｜大向うからやんやと喝采される為には※が必要だと云ふことを痛感したと云つてゐるだらう。"
"431","akutagawa","zoku_yajinseikeino_koto.txt","あれは余り信用出来ないね。"
"432","akutagawa","zoku_yajinseikeino_koto.txt","恐らくはちよつと感じた位だね。"
"433","akutagawa","zoku_yajinseikeino_koto.txt","まあ、もう少し見てゐ給へ。"
"434","akutagawa","zoku_yajinseikeino_koto.txt","今に又何かほんたうのことをむきになつて云ひ出すから。"
"435","akutagawa","zoku_yajinseikeino_koto.txt",""
"436","akutagawa","zoku_yajinseikeino_koto.txt",""
"437","akutagawa","zoku_yajinseikeino_koto.txt","十梅花に対する感情"
"438","akutagawa","zoku_yajinseikeino_koto.txt",""
"439","akutagawa","zoku_yajinseikeino_koto.txt","このジヤアナリズムの一篇を謹厳なる西川英次郎君に献ず"
"440","akutagawa","zoku_yajinseikeino_koto.txt",""
"441","akutagawa","zoku_yajinseikeino_koto.txt","予等は芸術の士なるが故に、如実に万象を観ざる可らず。"
"442","akutagawa","zoku_yajinseikeino_koto.txt","少くとも万人の眼光を借らず、予等の眼光を以て見ざる可らず。"
"443","akutagawa","zoku_yajinseikeino_koto.txt","古来偉大なる芸術の士は皆この独自の眼光を有し、おのづから独自の表現を成せり。"
"444","akutagawa","zoku_yajinseikeino_koto.txt","ゴツホの向日葵の写真版の今日もなほ愛翫せらるる、豈偶然の結果ならんや。"
"445","akutagawa","zoku_yajinseikeino_koto.txt","（幸ひにＧＯＧＨをゴッホと呼ぶ発音の誤りを咎むること勿れ。"
"446","akutagawa","zoku_yajinseikeino_koto.txt","予はＡＮＤＥＲＳＥＮをアナアセンと呼ばず、アンデルゼンと呼ぶを恥ぢざるものなり。"
"447","akutagawa","zoku_yajinseikeino_koto.txt","）"
"448","akutagawa","zoku_yajinseikeino_koto.txt","こは芸術を使命とするものには白日よりも明らかなる事実なり。"
"449","akutagawa","zoku_yajinseikeino_koto.txt","然れども独自の眼を以てするは必しも容易の業にあらず。"
"450","akutagawa","zoku_yajinseikeino_koto.txt","（否、絶対に独自の眼を以てするは不可能と云ふも妨げざる可し。"
"451","akutagawa","zoku_yajinseikeino_koto.txt","）殊に万人の詩に入ること屡なりし景物を見るに独自の眼光を以てするは予等の最も難しとする所なり。"
"452","akutagawa","zoku_yajinseikeino_koto.txt","試みに「暮春」の句を成すを思へ。"
"453","akutagawa","zoku_yajinseikeino_koto.txt","蕪村の「暮春」を詠ぜし後、誰か又独自の眼光を以て「暮春」を詠じ得るの確信あらんや。"
"454","akutagawa","zoku_yajinseikeino_koto.txt","梅花の如きもその一のみ。"
"455","akutagawa","zoku_yajinseikeino_koto.txt","否、正にその最たるものなり。"
"456","akutagawa","zoku_yajinseikeino_koto.txt",""
"457","akutagawa","zoku_yajinseikeino_koto.txt","梅花は予に伊勢物語の歌より春信の画に至る柔媚の情を想起せしむることなきにあらず。"
"458","akutagawa","zoku_yajinseikeino_koto.txt","然れども梅花を見る毎に、まづ予の心を捉ふるものは支那に生じたる文人趣味なり。"
"459","akutagawa","zoku_yajinseikeino_koto.txt","こは啻に予のみにあらず、大方の君子も亦然るが如し。"
"460","akutagawa","zoku_yajinseikeino_koto.txt","（是に於て乎、中央公論記者も「梅花の賦」なる語を用ゐるならん。"
"461","akutagawa","zoku_yajinseikeino_koto.txt","）梅花を唯愛すべきジエヌス・プリヌスの花と做すは紅毛碧眼の詩人のことのみ。"
"462","akutagawa","zoku_yajinseikeino_koto.txt","予等は梅花の一瓣にも、鶴を想ひ、初月を想ひ、空山を想ひ、野水を想ひ、断角を想ひ、書燈を想ひ、脩竹を想ひ、清霜を想ひ、羅浮を想ひ、仙妃を想ひ、林処士の風流を想はざる能はず。"
"463","akutagawa","zoku_yajinseikeino_koto.txt","既に斯くの如しとせば、予等独自の眼光を以て万象を観んとする芸術の士の、梅花に好意を感ぜざるは必しも怪しむを要せざるべし。"
"464","akutagawa","zoku_yajinseikeino_koto.txt","（こは夙に永井荷風氏の「日本の庭」の一章たる「梅」の中に道破せる真理なり。"
"465","akutagawa","zoku_yajinseikeino_koto.txt","文壇は詩人も心臓以外に脳髄を有するの事実を認めず。"
"466","akutagawa","zoku_yajinseikeino_koto.txt","是予に今日この真理を盗用せしむる所以なり。"
"467","akutagawa","zoku_yajinseikeino_koto.txt","）"
"468","akutagawa","zoku_yajinseikeino_koto.txt","予の梅花を見る毎に、文人趣味を喚び起さるるは既に述べし所の如し。"
"469","akutagawa","zoku_yajinseikeino_koto.txt","然れども妄に予を以て所謂文人と做すこと勿れ。"
