"","auth","piece","line"
"0","natsume","eijitsu_shohin.txt","永日小品"
"1","natsume","eijitsu_shohin.txt","夏目漱石"
"2","natsume","eijitsu_shohin.txt",""
"3","natsume","eijitsu_shohin.txt","-------------------------------------------------------"
"4","natsume","eijitsu_shohin.txt","【テキスト中に現れる記号について】"
"5","natsume","eijitsu_shohin.txt",""
"6","natsume","eijitsu_shohin.txt","《》：ルビ"
"7","natsume","eijitsu_shohin.txt","（例）雑煮"
"8","natsume","eijitsu_shohin.txt",""
"9","natsume","eijitsu_shohin.txt","｜：ルビの付く文字列の始まりを特定する記号"
"10","natsume","eijitsu_shohin.txt","（例）元来｜謡のうの字も心得ない"
"11","natsume","eijitsu_shohin.txt",""
"12","natsume","eijitsu_shohin.txt","：入力者注主に外字の説明や、傍点の位置の指定"
"13","natsume","eijitsu_shohin.txt","（数字は、JIS X 0213の面区点番号、または底本のページと行数）"
"14","natsume","eijitsu_shohin.txt","（例）※"
"15","natsume","eijitsu_shohin.txt","-------------------------------------------------------"
"16","natsume","eijitsu_shohin.txt",""
"17","natsume","eijitsu_shohin.txt","元日"
"18","natsume","eijitsu_shohin.txt",""
"19","natsume","eijitsu_shohin.txt","雑煮を食って、書斎に引き取ると、しばらくして三四人来た。"
"20","natsume","eijitsu_shohin.txt","いずれも若い男である。"
"21","natsume","eijitsu_shohin.txt","そのうちの一人がフロックを着ている。"
"22","natsume","eijitsu_shohin.txt","着なれないせいか、メルトンに対して妙に遠慮する傾きがある。"
"23","natsume","eijitsu_shohin.txt","あとのものは皆和服で、かつ不断着のままだからとんと正月らしくない。"
"24","natsume","eijitsu_shohin.txt","この連中がフロックを眺めて、やあ――やあと一ツずつ云った。"
"25","natsume","eijitsu_shohin.txt","みんな驚いた証拠である。"
"26","natsume","eijitsu_shohin.txt","自分も一番あとで、やあと云った。"
"27","natsume","eijitsu_shohin.txt",""
"28","natsume","eijitsu_shohin.txt","フロックは白い手巾を出して、用もない顔を拭いた。"
"29","natsume","eijitsu_shohin.txt","そうして、しきりに屠蘇を飲んだ。"
"30","natsume","eijitsu_shohin.txt","ほかの連中も大いに膳のものを突ついている。"
"31","natsume","eijitsu_shohin.txt","ところへ虚子が車で来た。"
"32","natsume","eijitsu_shohin.txt","これは黒い羽織に黒い紋付を着て、極めて旧式にきまっている。"
"33","natsume","eijitsu_shohin.txt","あなたは黒紋付を持っていますが、やはり能をやるからその必要があるんでしょうと聞いたら、虚子が、ええそうですと答えた。"
"34","natsume","eijitsu_shohin.txt","そうして、一つ謡いませんかと云い出した。"
"35","natsume","eijitsu_shohin.txt","自分は謡ってもようござんすと応じた。"
"36","natsume","eijitsu_shohin.txt",""
"37","natsume","eijitsu_shohin.txt","それから二人して東北と云うものを謡った。"
"38","natsume","eijitsu_shohin.txt","よほど以前に習っただけで、ほとんど復習と云う事をやらないから、ところどころはなはだ曖昧である。"
"39","natsume","eijitsu_shohin.txt","その上、我ながら覚束ない声が出た。"
"40","natsume","eijitsu_shohin.txt","ようやく謡ってしまうと、聞いていた若い連中が、申し合せたように自分をまずいと云い出した。"
"41","natsume","eijitsu_shohin.txt","中にもフロックは、あなたの声はひょろひょろしていると云った。"
"42","natsume","eijitsu_shohin.txt","この連中は元来｜謡のうの字も心得ないもの共である。"
"43","natsume","eijitsu_shohin.txt","だから虚子と自分の優劣はとても分らないだろうと思っていた。"
"44","natsume","eijitsu_shohin.txt","しかし、批評をされて見ると、素人でも理の当然なところだからやむをえない。"
"45","natsume","eijitsu_shohin.txt","馬鹿を云えという勇気も出なかった。"
"46","natsume","eijitsu_shohin.txt",""
"47","natsume","eijitsu_shohin.txt","すると虚子が近来｜鼓を習っているという話しを始めた。"
"48","natsume","eijitsu_shohin.txt","謡のうの字も知らない連中が、一つ打って御覧なさい、是非御聞かせなさいと所望している。"
"49","natsume","eijitsu_shohin.txt","虚子は自分に、じゃ、あなた謡って下さいと依頼した。"
"50","natsume","eijitsu_shohin.txt","これは囃の何物たるを知らない自分にとっては、迷惑でもあったが、また斬新という興味もあった。"
"51","natsume","eijitsu_shohin.txt","謡いましょうと引き受けた。"
"52","natsume","eijitsu_shohin.txt","虚子は車夫を走らして鼓を取り寄せた。"
"53","natsume","eijitsu_shohin.txt","鼓がくると、台所から七輪を持って来さして、かんかんいう炭火の上で鼓の皮を焙り始めた。"
"54","natsume","eijitsu_shohin.txt","みんな驚いて見ている。"
"55","natsume","eijitsu_shohin.txt","自分もこの猛烈な焙りかたには驚いた。"
"56","natsume","eijitsu_shohin.txt","大丈夫ですかと尋ねたら、ええ大丈夫ですと答えながら、指の先で張切った皮の上をかんと弾いた。"
"57","natsume","eijitsu_shohin.txt","ちょっと好い音がした。"
"58","natsume","eijitsu_shohin.txt","もういいでしょうと、七輪からおろして、鼓の緒を締めにかかった。"
"59","natsume","eijitsu_shohin.txt","紋服の男が、赤い緒をいじくっているところが何となく品が好い。"
"60","natsume","eijitsu_shohin.txt","今度はみんな感心して見ている。"
"61","natsume","eijitsu_shohin.txt",""
"62","natsume","eijitsu_shohin.txt","虚子はやがて羽織を脱いだ。"
"63","natsume","eijitsu_shohin.txt","そうして鼓を抱い込んだ。"
"64","natsume","eijitsu_shohin.txt","自分は少し待ってくれと頼んだ。"
"65","natsume","eijitsu_shohin.txt","第一彼がどこいらで鼓を打つか見当がつかないからちょっと打ち合せをしたい。"
"66","natsume","eijitsu_shohin.txt","虚子は、ここで掛声をいくつかけて、ここで鼓をどう打つから、おやりなさいと懇に説明してくれた。"
"67","natsume","eijitsu_shohin.txt","自分にはとても呑み込めない。"
"68","natsume","eijitsu_shohin.txt","けれども合点の行くまで研究していれば、二三時間はかかる。"
"69","natsume","eijitsu_shohin.txt","やむをえず、好い加減に領承した。"
"70","natsume","eijitsu_shohin.txt","そこで羽衣の曲を謡い出した。"
"71","natsume","eijitsu_shohin.txt","春霞たなびきにけりと半行ほど来るうちに、どうも出が好くなかったと後悔し始めた。"
"72","natsume","eijitsu_shohin.txt","はなはだ無勢力である。"
"73","natsume","eijitsu_shohin.txt","けれども途中から急に振るい出しては、総体の調子が崩れるから、萎靡因循のまま、少し押して行くと、虚子がやにわに大きな掛声をかけて、鼓をかんと一つ打った。"
"74","natsume","eijitsu_shohin.txt",""
"75","natsume","eijitsu_shohin.txt","自分は虚子がこう猛烈に来ようとは夢にも予期していなかった。"
"76","natsume","eijitsu_shohin.txt","元来が優美な悠長なものとばかり考えていた掛声は、まるで真剣勝負のそれのように自分の鼓膜を動かした。"
"77","natsume","eijitsu_shohin.txt","自分の謡はこの掛声で二三度波を打った。"
"78","natsume","eijitsu_shohin.txt","それがようやく静まりかけた時に、虚子がまた腹いっぱいに横合から威嚇した。"
"79","natsume","eijitsu_shohin.txt","自分の声は威嚇されるたびによろよろする。"
"80","natsume","eijitsu_shohin.txt","そうして小さくなる。"
"81","natsume","eijitsu_shohin.txt","しばらくすると聞いているものがくすくす笑い出した。"
"82","natsume","eijitsu_shohin.txt","自分も内心から馬鹿馬鹿しくなった。"
"83","natsume","eijitsu_shohin.txt","その時フロックが真先に立って、どっと吹き出した。"
"84","natsume","eijitsu_shohin.txt","自分も調子につれて、いっしょに吹き出した。"
"85","natsume","eijitsu_shohin.txt",""
"86","natsume","eijitsu_shohin.txt","それからさんざんな批評を受けた。"
"87","natsume","eijitsu_shohin.txt","中にもフロックのはもっとも皮肉であった。"
"88","natsume","eijitsu_shohin.txt","虚子は微笑しながら、仕方なしに自分の鼓に、自分の謡を合せて、めでたく謡い納めた。"
"89","natsume","eijitsu_shohin.txt","やがて、まだ廻らなければならない所があると云って車に乗って帰って行った。"
"90","natsume","eijitsu_shohin.txt","あとからまたいろいろ若いものに冷かされた。"
"91","natsume","eijitsu_shohin.txt","細君までいっしょになって夫を貶した末、高浜さんが鼓を御打ちなさる時、襦袢の袖がぴらぴら見えたが、大変好い色だったと賞めている。"
"92","natsume","eijitsu_shohin.txt","フロックはたちまち賛成した。"
"93","natsume","eijitsu_shohin.txt","自分は虚子の襦袢の袖の色も、袖の色のぴらぴらするところもけっして好いとは思わない。"
"94","natsume","eijitsu_shohin.txt",""
"95","natsume","eijitsu_shohin.txt",""
"96","natsume","eijitsu_shohin.txt","蛇"
"97","natsume","eijitsu_shohin.txt",""
"98","natsume","eijitsu_shohin.txt","木戸を開けて表へ出ると、大きな馬の足迹の中に雨がいっぱい湛っていた。"
"99","natsume","eijitsu_shohin.txt","土を踏むと泥の音が蹠裏へ飛びついて来る。"
"100","natsume","eijitsu_shohin.txt","踵を上げるのが痛いくらいに思われた。"
"101","natsume","eijitsu_shohin.txt","手桶を右の手に提げているので、足の抜き差に都合が悪い。"
"102","natsume","eijitsu_shohin.txt","際どく踏み応える時には、腰から上で調子を取るために、手に持ったものを放り出したくなる。"
"103","natsume","eijitsu_shohin.txt","やがて手桶の尻をどっさと泥の底に据えてしまった。"
"104","natsume","eijitsu_shohin.txt","危く倒れるところを手桶の柄に乗し懸って向うを見ると、叔父さんは一間ばかり前にいた。"
"105","natsume","eijitsu_shohin.txt","蓑を着た肩の後から、三角に張った網の底がぶら下がっている。"
"106","natsume","eijitsu_shohin.txt","この時｜被った笠が少し動いた。"
"107","natsume","eijitsu_shohin.txt","笠のなかからひどい路だと云ったように聞えた。"
"108","natsume","eijitsu_shohin.txt","蓑の影はやがて雨に吹かれた。"
"109","natsume","eijitsu_shohin.txt",""
"110","natsume","eijitsu_shohin.txt","石橋の上に立って下を見ると、黒い水が草の間から推されて来る。"
"111","natsume","eijitsu_shohin.txt","不断は黒節の上を三寸とは超えない底に、長い藻が、うつらうつらと揺いて、見ても奇麗な流れであるのに、今日は底から濁った。"
"112","natsume","eijitsu_shohin.txt","下から泥を吹き上げる、上から雨が叩く、真中を渦が重なり合って通る。"
"113","natsume","eijitsu_shohin.txt","しばらくこの渦を見守っていた叔父さんは、口の内で、"
"114","natsume","eijitsu_shohin.txt","「獲れる」と云った。"
"115","natsume","eijitsu_shohin.txt",""
"116","natsume","eijitsu_shohin.txt","二人は橋を渡って、すぐ左へ切れた。"
"117","natsume","eijitsu_shohin.txt","渦は青い田の中をうねうねと延びて行く。"
"118","natsume","eijitsu_shohin.txt","どこまで押して行くか分らない流れの迹を跟けて一町ほど来た。"
"119","natsume","eijitsu_shohin.txt","そうして広い田の中にたった二人｜淋しく立った。"
"120","natsume","eijitsu_shohin.txt","雨ばかり見える。"
"121","natsume","eijitsu_shohin.txt","叔父さんは笠の中から空を仰いだ。"
"122","natsume","eijitsu_shohin.txt","空は茶壺の葢のように暗く封じられている。"
"123","natsume","eijitsu_shohin.txt","そのどこからか、隙間なく雨が落ちる。"
"124","natsume","eijitsu_shohin.txt","立っていると、ざあっと云う音がする。"
"125","natsume","eijitsu_shohin.txt","これは身に着けた笠と蓑にあたる音である。"
"126","natsume","eijitsu_shohin.txt","それから四方の田にあたる音である。"
"127","natsume","eijitsu_shohin.txt","向うに見える貴王の森にあたる音も遠くから交って来るらしい。"
"128","natsume","eijitsu_shohin.txt",""
"129","natsume","eijitsu_shohin.txt","森の上には、黒い雲が杉の梢に呼び寄せられて奥深く重なり合っている。"
"130","natsume","eijitsu_shohin.txt","それが自然の重みでだらりと上の方から下って来る。"
"131","natsume","eijitsu_shohin.txt","雲の足は今杉の頭に絡みついた。"
"132","natsume","eijitsu_shohin.txt","もう少しすると、森の中へ落ちそうだ。"
"133","natsume","eijitsu_shohin.txt",""
"134","natsume","eijitsu_shohin.txt","気がついて足元を見ると、渦は限なく水上から流れて来る。"
"135","natsume","eijitsu_shohin.txt","貴王様の裏の池の水が、あの雲に襲われたものだろう。"
"136","natsume","eijitsu_shohin.txt","渦の形が急に勢いづいたように見える。"
"137","natsume","eijitsu_shohin.txt","叔父さんはまた捲く渦を見守って、"
"138","natsume","eijitsu_shohin.txt","「獲れる」とさも何物をか取ったように云った。"
"139","natsume","eijitsu_shohin.txt","やがて蓑を着たまま水の中に下りた。"
"140","natsume","eijitsu_shohin.txt","勢いの凄じい割には、さほど深くもない。"
"141","natsume","eijitsu_shohin.txt","立って腰まで浸るくらいである。"
"142","natsume","eijitsu_shohin.txt","叔父さんは河の真中に腰を据えて、貴王の森を正面に、川上に向って、肩に担いだ網をおろした。"
"143","natsume","eijitsu_shohin.txt",""
"144","natsume","eijitsu_shohin.txt","二人は雨の音の中にじっとして、まともに押して来る渦の恰好を眺めていた。"
"145","natsume","eijitsu_shohin.txt","魚がこの渦の下を、貴王の池から流されて通るに違いない。"
"146","natsume","eijitsu_shohin.txt","うまくかかれば大きなのが獲れると、一心に凄い水の色を見つめていた。"
"147","natsume","eijitsu_shohin.txt","水は固より濁っている。"
"148","natsume","eijitsu_shohin.txt","上皮の動く具合だけで、どんなものが、水の底を流れるか全く分りかねる。"
"149","natsume","eijitsu_shohin.txt","それでも瞬もせずに、水際まで浸った叔父さんの手首の動くのを待っていた。"
"150","natsume","eijitsu_shohin.txt","けれどもそれがなかなかに動かない。"
"151","natsume","eijitsu_shohin.txt",""
"152","natsume","eijitsu_shohin.txt","雨脚はしだいに黒くなる。"
"153","natsume","eijitsu_shohin.txt","河の色はだんだん重くなる。"
"154","natsume","eijitsu_shohin.txt","渦の紋は劇しく水上から回って来る。"
"155","natsume","eijitsu_shohin.txt","この時どす黒い波が鋭く眼の前を通り過そうとする中に、ちらりと色の変った模様が見えた。"
"156","natsume","eijitsu_shohin.txt","瞬を容さぬとっさの光を受けたその模様には長さの感じがあった。"
"157","natsume","eijitsu_shohin.txt","これは大きな鰻だなと思った。"
"158","natsume","eijitsu_shohin.txt",""
"159","natsume","eijitsu_shohin.txt","途端に流れに逆らって、網の柄を握っていた叔父さんの右の手首が、蓑の下から肩の上まで弾ね返るように動いた。"
"160","natsume","eijitsu_shohin.txt","続いて長いものが叔父さんの手を離れた。"
"161","natsume","eijitsu_shohin.txt","それが暗い雨のふりしきる中に、重たい縄のような曲線を描いて、向うの土手の上に落ちた。"
"162","natsume","eijitsu_shohin.txt","と思うと、草の中からむくりと鎌首を一尺ばかり持上げた。"
"163","natsume","eijitsu_shohin.txt","そうして持上げたまま屹と二人を見た。"
"164","natsume","eijitsu_shohin.txt",""
"165","natsume","eijitsu_shohin.txt","「覚えていろ」"
"166","natsume","eijitsu_shohin.txt","声はたしかに叔父さんの声であった。"
"167","natsume","eijitsu_shohin.txt","同時に鎌首は草の中に消えた。"
"168","natsume","eijitsu_shohin.txt","叔父さんは蒼い顔をして、蛇を投げた所を見ている。"
"169","natsume","eijitsu_shohin.txt",""
"170","natsume","eijitsu_shohin.txt","「叔父さん、今、覚えていろと云ったのはあなたですか」"
"171","natsume","eijitsu_shohin.txt","叔父さんはようやくこっちを向いた。"
"172","natsume","eijitsu_shohin.txt","そうして低い声で、誰だかよく分らないと答えた。"
"173","natsume","eijitsu_shohin.txt","今でも叔父にこの話をするたびに、誰だかよく分らないと答えては妙な顔をする。"
"174","natsume","eijitsu_shohin.txt",""
"175","natsume","eijitsu_shohin.txt",""
"176","natsume","eijitsu_shohin.txt","泥棒"
"177","natsume","eijitsu_shohin.txt",""
"178","natsume","eijitsu_shohin.txt","寝ようと思って次の間へ出ると、炬燵の臭がぷんとした。"
"179","natsume","eijitsu_shohin.txt","厠の帰りに、火が強過ぎるようだから、気をつけなくてはいけないと妻に注意して、自分の部屋へ引取った。"
"180","natsume","eijitsu_shohin.txt","もう十一時を過ぎている。"
"181","natsume","eijitsu_shohin.txt","床の中の夢は常のごとく安らかであった。"
"182","natsume","eijitsu_shohin.txt","寒い割に風も吹かず、半鐘の音も耳に応えなかった。"
"183","natsume","eijitsu_shohin.txt","熟睡が時の世界を盛り潰したように正体を失った。"
"184","natsume","eijitsu_shohin.txt",""
"185","natsume","eijitsu_shohin.txt","すると忽然として、女の泣声で眼が覚めた。"
"186","natsume","eijitsu_shohin.txt","聞けばもよと云う下女の声である。"
"187","natsume","eijitsu_shohin.txt","この下女は驚いて狼狽えるといつでも泣声を出す。"
"188","natsume","eijitsu_shohin.txt","この間｜家の赤ん坊を湯に入れた時、赤ん坊が湯気に上って、引きつけたといって五分ばかり泣声を出した。"
"189","natsume","eijitsu_shohin.txt","自分がこの下女の異様な声を聞いたのは、それが始めてである。"
"190","natsume","eijitsu_shohin.txt","啜り上げるようにして早口に物を云う。"
"191","natsume","eijitsu_shohin.txt","訴えるような、口説くような、詫を入れるような、情人の死を悲しむような――とうてい普通の驚愕の場合に出る、鋭くって短い感投詞の調子ではない。"
"192","natsume","eijitsu_shohin.txt",""
"193","natsume","eijitsu_shohin.txt","自分は今云う通りこの異様の声で、眼が覚めた。"
"194","natsume","eijitsu_shohin.txt","声はたしかに妻の寝ている、次の部屋から出る。"
"195","natsume","eijitsu_shohin.txt","同時に襖を洩れて赤い火がさっと暗い書斎に射した。"
"196","natsume","eijitsu_shohin.txt","今開ける瞼の裏に、この光が届くや否や自分は火事だと合点して飛び起きた。"
"197","natsume","eijitsu_shohin.txt","そうして、突然隔ての唐紙をがらりと開けた。"
"198","natsume","eijitsu_shohin.txt",""
"199","natsume","eijitsu_shohin.txt","その時自分は顛覆返った炬燵を想像していた。"
"200","natsume","eijitsu_shohin.txt","焦げた蒲団を想像していた。"
"201","natsume","eijitsu_shohin.txt","漲ぎる煙と、燃える畳とを想像していた。"
"202","natsume","eijitsu_shohin.txt","ところが開けて見ると、洋灯は例のごとく点っている。"
"203","natsume","eijitsu_shohin.txt","妻と子供は常の通り寝ている。"
"204","natsume","eijitsu_shohin.txt","炬燵は宵の位地にちゃんとある。"
"205","natsume","eijitsu_shohin.txt","すべてが、寝る前に見た時と同じである。"
"206","natsume","eijitsu_shohin.txt","平和である。"
"207","natsume","eijitsu_shohin.txt","暖かである。"
"208","natsume","eijitsu_shohin.txt","ただ下女だけが泣いている。"
"209","natsume","eijitsu_shohin.txt",""
"210","natsume","eijitsu_shohin.txt","下女は妻の蒲団の裾を抑えるようにして早口に物を云う。"
"211","natsume","eijitsu_shohin.txt","妻は眼を覚まして、ぱちぱちさせるばかりで別に起きる様子もない。"
"212","natsume","eijitsu_shohin.txt","自分は何事が起ったのかほとんど判じかねて、敷居際に突立ったまま、ぼんやり部屋の中を見回した。"
"213","natsume","eijitsu_shohin.txt","途端に下女の泣声のうちに、泥棒という二字が出た。"
"214","natsume","eijitsu_shohin.txt","それが自分の耳に這入るや否や、すべてが解決されたように自分はたちまち妻の部屋を大股に横切って、次の間に飛び出しながら、何だ――と怒鳴りつけた。"
"215","natsume","eijitsu_shohin.txt","けれども飛び出した次の部屋は真暗である。"
"216","natsume","eijitsu_shohin.txt","続く台所の雨戸が一枚｜外れて、美しい月の光が部屋の入口まで射し込んでいる。"
"217","natsume","eijitsu_shohin.txt","自分は真夜中に人の住居の奥を照らす月影を見て、おのずから寒いと感じた。"
"218","natsume","eijitsu_shohin.txt","素足のまま板の間へ出て台所の流元まで来て見ると、四辺は寂としている。"
"219","natsume","eijitsu_shohin.txt","表を覗くと月ばかりである。"
"220","natsume","eijitsu_shohin.txt","自分は、戸口から一歩も外へ出る気にならなかった。"
"221","natsume","eijitsu_shohin.txt",""
"222","natsume","eijitsu_shohin.txt","引き返して、妻の所へ来て、泥棒は逃げた、安心しろ、何も窃られやしない、と云った。"
"223","natsume","eijitsu_shohin.txt","妻はこの時ようやく起き上っていた。"
"224","natsume","eijitsu_shohin.txt","何も云わずに洋灯を持って暗い部屋まで出て来て、箪笥の前に翳した。"
"225","natsume","eijitsu_shohin.txt","観音開きが取り外されている。"
"226","natsume","eijitsu_shohin.txt","抽斗が明けたままになっている。"
"227","natsume","eijitsu_shohin.txt","妻は自分の顔を見て、やっぱり窃られたんですと云った。"
"228","natsume","eijitsu_shohin.txt","自分もようやく泥棒が窃った後で逃げたんだと気がついた。"
"229","natsume","eijitsu_shohin.txt","何だか急に馬鹿馬鹿しくなった。"
"230","natsume","eijitsu_shohin.txt","片方を見ると、泣いて起しに来た下女の蒲団が取ってある。"
"231","natsume","eijitsu_shohin.txt","その枕元にもう一つ箪笥がある。"
"232","natsume","eijitsu_shohin.txt","その箪笥の上にまた用箪笥が乗っている。"
"233","natsume","eijitsu_shohin.txt","暮の事なので医者の薬礼その他がこの内に這入っているのだそうだ。"
"234","natsume","eijitsu_shohin.txt","妻に調べさせるとこっちの方は元の通りだと云う。"
"235","natsume","eijitsu_shohin.txt","下女が泣いて縁側の方から飛び出したので、泥棒もやむをえず仕事の中途で逃げたのかも知れない。"
"236","natsume","eijitsu_shohin.txt",""
"237","natsume","eijitsu_shohin.txt","そのうち、ほかの部屋に寝ていたものもみんな起きて来た。"
"238","natsume","eijitsu_shohin.txt","そうしてみんないろいろな事を云う。"
"239","natsume","eijitsu_shohin.txt","もう少し前に小用に起きたのにとか、今夜は寝つかれないで、二時頃までは眼が冴えていたのにとか、ことごとく残念そうである。"
"240","natsume","eijitsu_shohin.txt","そのなかで、十になる長女は、泥棒が台所から這入ったのも、泥棒がみしみし縁側を歩いたのも、すっかり知っていると云った。"
"241","natsume","eijitsu_shohin.txt","あらまあとお房さんが驚いている。"
"242","natsume","eijitsu_shohin.txt","お房さんは十八で、長女と同じ部屋に寝る親類の娘である。"
"243","natsume","eijitsu_shohin.txt","自分はまた床へ這入って寝た。"
"244","natsume","eijitsu_shohin.txt",""
"245","natsume","eijitsu_shohin.txt","明くる日はこの騒動で、例よりは少し遅く起きた。"
"246","natsume","eijitsu_shohin.txt","顔を洗って、朝食をやっていると、台所で下女が泥棒の足痕を見つけたとか、見つけないとか騒いでいる。"
"247","natsume","eijitsu_shohin.txt","面倒だから書斎へ引き取った。"
"248","natsume","eijitsu_shohin.txt","引き取って十分も経ったかと思うと、玄関で頼むと云う声がした。"
"249","natsume","eijitsu_shohin.txt","勇ましい声である。"
