"","auth","piece","line"
"1350","natsume","eijitsu_shohin.txt","それでね、私がちょうど向うにいた時分でしたが、浜から千八百俵ばかり注文がありました。"
"1351","natsume","eijitsu_shohin.txt","旨く行くと一升二円以上につくんですから、さっそくやりましたよ。"
"1352","natsume","eijitsu_shohin.txt","千八百俵｜拵えて、私が自分で栗といっしょに浜まで持って行くと、――なに相手は支那人で、本国へ送り出すんでさあ。"
"1353","natsume","eijitsu_shohin.txt","すると、支那人が出て来て、宜しいと云うから、もう済んだのかと思うと、蔵の前へ高さ一間もあろうと云う大きな樽を持ち出して、水をその中へどんどん汲み込ませるんです。"
"1354","natsume","eijitsu_shohin.txt","――いえ何のためだか私にもいっこう分らなかったんで。"
"1355","natsume","eijitsu_shohin.txt","何しろ大きな樽ですからね、水を張るんだって容易なこっちゃありません。"
"1356","natsume","eijitsu_shohin.txt","かれこれ半日かかっちまいました。"
"1357","natsume","eijitsu_shohin.txt","それから何をするかと思って見ていると、例の栗をね、俵をほどいて、どんどん樽の中へ放り込むんですよ。"
"1358","natsume","eijitsu_shohin.txt","――私も実に驚いたが、支那人てえ奴は本当に食えないもんだと後になって、ようやく気がついたんです。"
"1359","natsume","eijitsu_shohin.txt","栗を水の中に打ち込むとね、たしかな奴は尋常に沈みますが、虫の食った奴だけはみんな浮いちまうんです。"
"1360","natsume","eijitsu_shohin.txt","それを支那人の野郎｜笊でしゃくってね、ペケだって、俵の目方から引いてしまうんだからたまりません。"
"1361","natsume","eijitsu_shohin.txt","私は傍で見ていてはらはらしました。"
"1362","natsume","eijitsu_shohin.txt","何しろ七分通り虫が入ってたんだから弱りました。"
"1363","natsume","eijitsu_shohin.txt","大変な損でさあ。"
"1364","natsume","eijitsu_shohin.txt","――虫の食ったんですか。"
"1365","natsume","eijitsu_shohin.txt","いまいましいから、みんな打遣って来ました。"
"1366","natsume","eijitsu_shohin.txt","支那人の事ですから、やっぱり知らん顔をして、俵にして、おおかた本国へ送ったでげしょう。"
"1367","natsume","eijitsu_shohin.txt",""
"1368","natsume","eijitsu_shohin.txt","「それから薩摩芋を買い込んだこともありまさあ。"
"1369","natsume","eijitsu_shohin.txt","一俵四円で、二千俵の契約でね。"
"1370","natsume","eijitsu_shohin.txt","ところが注文の来たのが月半、十四日でして二十五日までにと云うんだから、どう骨を折ったって二千俵と云う数が寄りっこありませんや。"
"1371","natsume","eijitsu_shohin.txt","とうてい駄目だからって、一応断りました。"
"1372","natsume","eijitsu_shohin.txt","実を云うと残念でしたがな。"
"1373","natsume","eijitsu_shohin.txt","すると商館の番頭がいうには、否契約書には二十五日とあるけれども、けっしてその通りには厳行しないからと、再三｜勧めるもんだから、ついその気になりましてね。"
"1374","natsume","eijitsu_shohin.txt","――いえ芋は支那へ行くんじゃありません。"
"1375","natsume","eijitsu_shohin.txt","亜米利加でした。"
"1376","natsume","eijitsu_shohin.txt","やッぱり亜米利加にも薩摩芋を食う奴があると見えるんですよ。"
"1377","natsume","eijitsu_shohin.txt","妙な事があるもんで、――で、さっそく買収にかかりました。"
"1378","natsume","eijitsu_shohin.txt","埼玉から川越の方をな。"
"1379","natsume","eijitsu_shohin.txt","だが口でこそ二千俵ですが、いざ買い占めるとなるとなかなか大したもんですからな。"
"1380","natsume","eijitsu_shohin.txt","でもようやくの事で、とうとう二十八日過ぎに約束通りの俵を持って、行きますと、――実に狡猾な奴がいるもんで、約定書のうちに、もしはなはだしい日限の違約があるときは、八千円の損害賠償を出すと云う項目があるんですよ。"
"1381","natsume","eijitsu_shohin.txt","ところが彼はその条款を応用しちまって、どうしても代金を渡さないんです。"
"1382","natsume","eijitsu_shohin.txt","もっとも手付は四千円取っておきましたがね。"
"1383","natsume","eijitsu_shohin.txt","そうこうしている内に、先方では芋を船へ積み込んじまったから、どうする事もできない訳になりました。"
"1384","natsume","eijitsu_shohin.txt","あんまり業腹だから、千円の保証金を納めましてね、現物取押を申請して、とうとう芋を取り押えてやりました。"
"1385","natsume","eijitsu_shohin.txt","ところが上には上があるもんで、先方は八千円の保証金を納めて、構わず船を出しちまったんです。"
"1386","natsume","eijitsu_shohin.txt","でいよいよ裁判になったにはなったんですが、何しろ約定書が入れてあるもんだから、しようがない。"
"1387","natsume","eijitsu_shohin.txt","私は裁判官の前で泣きましたね。"
"1388","natsume","eijitsu_shohin.txt","芋はただ取られる、裁判には負ける、こんな馬鹿な事はない、少しは、まあ私の身になって考えて見て下さいって。"
"1389","natsume","eijitsu_shohin.txt","裁判官も腹のなかでは、だいぶ私の方に同情した様子でしたが、法律の力じゃ、どうする事もできないもんですからな。"
"1390","natsume","eijitsu_shohin.txt","とうとう負けました」"
"1391","natsume","eijitsu_shohin.txt",""
"1392","natsume","eijitsu_shohin.txt","行列"
"1393","natsume","eijitsu_shohin.txt",""
"1394","natsume","eijitsu_shohin.txt","ふと机から眼を上げて、入口の方を見ると、書斎の戸がいつの間にか、半分明いて、広い廊下が二尺ばかり見える。"
"1395","natsume","eijitsu_shohin.txt","廊下の尽きる所は唐めいた手摺に遮られて、上には硝子戸が立て切ってある。"
"1396","natsume","eijitsu_shohin.txt","青い空から、まともに落ちて来る日が、軒端を斜に、硝子を通して、縁側の手前だけを明るく色づけて、書斎の戸口までぱっと暖かに射した。"
"1397","natsume","eijitsu_shohin.txt","しばらく日の照る所を見つめていると、眼の底に陽炎が湧いたように、春の思いが饒かになる。"
"1398","natsume","eijitsu_shohin.txt",""
"1399","natsume","eijitsu_shohin.txt","その時この二尺あまりの隙間に、空を踏んで、手摺の高さほどのものがあらわれた。"
"1400","natsume","eijitsu_shohin.txt","赤に白く唐草を浮き織りにした絹紐を輪に結んで、額から髪の上へすぽりと嵌めた間に、海棠と思われる花を青い葉ごと、ぐるりと挿した。"
"1401","natsume","eijitsu_shohin.txt","黒髪の地に薄紅の莟が大きな雫のごとくはっきり見えた。"
"1402","natsume","eijitsu_shohin.txt","割合に詰った顎の真下から、一襞になって、ただ一枚の紫が縁までふわふわと動いている。"
"1403","natsume","eijitsu_shohin.txt","袖も手も足も見えない。"
"1404","natsume","eijitsu_shohin.txt","影は廊下に落ちた日を、するりと抜けるように通った。"
"1405","natsume","eijitsu_shohin.txt","後から、――"
"1406","natsume","eijitsu_shohin.txt","今度は少し低い。"
"1407","natsume","eijitsu_shohin.txt","真紅の厚い織物を脳天から肩先まで被って、余る背中に筋違の笹の葉の模様を背負っている。"
"1408","natsume","eijitsu_shohin.txt","胴中にただ一葉、消炭色の中に取り残された緑が見える。"
"1409","natsume","eijitsu_shohin.txt","それほど笹の模様は大きかった。"
"1410","natsume","eijitsu_shohin.txt","廊下に置く足よりも大きかった。"
"1411","natsume","eijitsu_shohin.txt","その足が赤くちらちらと三足ほど動いたら、低いものは、戸口の幅を、音なく行き過ぎた。"
"1412","natsume","eijitsu_shohin.txt",""
"1413","natsume","eijitsu_shohin.txt","第三の頭巾は白と藍の弁慶の格子である。"
"1414","natsume","eijitsu_shohin.txt","眉廂の下にあらわれた横顔は丸く膨らんでいる。"
"1415","natsume","eijitsu_shohin.txt","その片頬の真中が林檎の熟したほどに濃い。"
"1416","natsume","eijitsu_shohin.txt","尻だけ見える茶褐色の眉毛の下が急に落ち込んで、思わざる辺から丸い鼻が膨れた頬を少し乗り越して、先だけ顔の外へ出た。"
"1417","natsume","eijitsu_shohin.txt","顔から下は一面に黄色い縞で包まれている。"
"1418","natsume","eijitsu_shohin.txt","長い袖を三寸余も縁に牽いた。"
"1419","natsume","eijitsu_shohin.txt","これは頭より高い胡麻竹の杖を突いて来た。"
"1420","natsume","eijitsu_shohin.txt","杖の先には光を帯びた鳥の羽をふさふさと着けて、照る日に輝かした。"
"1421","natsume","eijitsu_shohin.txt","縁に牽く黄色い縞の、袖らしい裏が、銀のように光ったと思ったらこれも行き過ぎた。"
"1422","natsume","eijitsu_shohin.txt",""
"1423","natsume","eijitsu_shohin.txt","すると、すぐ後から真白な顔があらわれた。"
"1424","natsume","eijitsu_shohin.txt","額から始まって、平たい頬を塗って、顎から耳の附根まで遡ぼって、壁のように静かである。"
"1425","natsume","eijitsu_shohin.txt","中に眸だけが活きていた。"
"1426","natsume","eijitsu_shohin.txt","唇は紅の色を重ねて、青く光線を反射した。"
"1427","natsume","eijitsu_shohin.txt","胸のあたりは鳩の色のように見えて、下は裾までばっと視線を乱している中に、小さなヴァイオリンを抱えて、長い弓を厳かに担いでいる。"
"1428","natsume","eijitsu_shohin.txt","二足で通り過ぎる後には、背中へ黒い繻子の四角な片をあてて、その真中にある金糸の刺繍が、一度に日に浮いた。"
"1429","natsume","eijitsu_shohin.txt",""
"1430","natsume","eijitsu_shohin.txt","最後に出たものは、全く小さい。"
"1431","natsume","eijitsu_shohin.txt","手摺の下から転げ落ちそうである。"
"1432","natsume","eijitsu_shohin.txt","けれども大きな顔をしている。"
"1433","natsume","eijitsu_shohin.txt","その中でも頭はことに大きい。"
"1434","natsume","eijitsu_shohin.txt","それへ五色の冠を戴いてあらわれた。"
"1435","natsume","eijitsu_shohin.txt","冠の中央にあるぽっちが高く聳えているように思われる。"
"1436","natsume","eijitsu_shohin.txt","身には井の字の模様のある筒袖に、藤鼠の天鵞絨の房の下ったものを、背から腰の下まで三角に垂れて、赤い足袋を踏んでいた。"
"1437","natsume","eijitsu_shohin.txt","手に持った朝鮮の団扇が身体の半分ほどある。"
"1438","natsume","eijitsu_shohin.txt","団扇には赤と青と黄で巴を漆で描いた。"
"1439","natsume","eijitsu_shohin.txt",""
"1440","natsume","eijitsu_shohin.txt","行列は静かに自分の前を過ぎた。"
"1441","natsume","eijitsu_shohin.txt","開け放しになった戸が、空しい日の光を、書斎の入口に送って、縁側に幅四尺の寂しさを感じた時、向うの隅で急にヴァイオリンを擦る音がした。"
"1442","natsume","eijitsu_shohin.txt","ついで、小さい咽喉が寄り合って、どっと笑う声がした。"
"1443","natsume","eijitsu_shohin.txt",""
"1444","natsume","eijitsu_shohin.txt","宅の小供は毎日母の羽織や風呂敷を出して、こんな遊戯をしている。"
"1445","natsume","eijitsu_shohin.txt",""
"1446","natsume","eijitsu_shohin.txt",""
"1447","natsume","eijitsu_shohin.txt","昔"
"1448","natsume","eijitsu_shohin.txt",""
"1449","natsume","eijitsu_shohin.txt","ピトロクリの谷は秋の真下にある。"
"1450","natsume","eijitsu_shohin.txt","十月の日が、眼に入る野と林を暖かい色に染めた中に、人は寝たり起きたりしている。"
"1451","natsume","eijitsu_shohin.txt","十月の日は静かな谷の空気を空の半途で包んで、じかには地にも落ちて来ぬ。"
"1452","natsume","eijitsu_shohin.txt","と云って、山向へ逃げても行かぬ。"
"1453","natsume","eijitsu_shohin.txt","風のない村の上に、いつでも落ちついて、じっと動かずに靄んでいる。"
"1454","natsume","eijitsu_shohin.txt","その間に野と林の色がしだいに変って来る。"
"1455","natsume","eijitsu_shohin.txt","酸いものがいつの間にか甘くなるように、谷全体に時代がつく。"
"1456","natsume","eijitsu_shohin.txt","ピトロクリの谷は、この時百年の昔し、二百年の昔にかえって、やすやすと寂びてしまう。"
"1457","natsume","eijitsu_shohin.txt","人は世に熟れた顔を揃えて、山の背を渡る雲を見る。"
"1458","natsume","eijitsu_shohin.txt","その雲は或時は白くなり、或時は灰色になる。"
"1459","natsume","eijitsu_shohin.txt","折々は薄い底から山の地を透かせて見せる。"
"1460","natsume","eijitsu_shohin.txt","いつ見ても古い雲の心地がする。"
"1461","natsume","eijitsu_shohin.txt",""
"1462","natsume","eijitsu_shohin.txt","自分の家はこの雲とこの谷を眺めるに都合好く、小さな丘の上に立っている。"
"1463","natsume","eijitsu_shohin.txt","南から一面に家の壁へ日があたる。"
"1464","natsume","eijitsu_shohin.txt","幾年十月の日が射したものか、どこもかしこも鼠色に枯れている西の端に、一本の薔薇が這いかかって、冷たい壁と、暖かい日の間に挟まった花をいくつか着けた。"
"1465","natsume","eijitsu_shohin.txt","大きな弁は卵色に豊かな波を打って、萼から翻えるように口を開けたまま、ひそりとところどころに静まり返っている。"
"1466","natsume","eijitsu_shohin.txt","香は薄い日光に吸われて、二間の空気の裡に消えて行く。"
"1467","natsume","eijitsu_shohin.txt","自分はその二間の中に立って、上を見た。"
"1468","natsume","eijitsu_shohin.txt","薔薇は高く這い上って行く。"
"1469","natsume","eijitsu_shohin.txt","鼠色の壁は薔薇の蔓の届かぬ限りを尽くして真直に聳えている。"
"1470","natsume","eijitsu_shohin.txt","屋根が尽きた所にはまだ塔がある。"
"1471","natsume","eijitsu_shohin.txt","日はそのまた上の靄の奥から落ちて来る。"
"1472","natsume","eijitsu_shohin.txt",""
"1473","natsume","eijitsu_shohin.txt","足元は丘がピトロクリの谷へ落ち込んで、眼の届く遥の下が、平たく色で埋まっている。"
"1474","natsume","eijitsu_shohin.txt","その向う側の山へ上る所は層々と樺の黄葉が段々に重なり合って、濃淡の坂が幾階となく出来ている。"
"1475","natsume","eijitsu_shohin.txt","明かで寂びた調子が谷一面に反射して来る真中を、黒い筋が横に蜿って動いている。"
"1476","natsume","eijitsu_shohin.txt","泥炭を含んだ渓水は、染粉を溶いたように古びた色になる。"
"1477","natsume","eijitsu_shohin.txt","この山奥に来て始めて、こんな流を見た。"
"1478","natsume","eijitsu_shohin.txt",""
"1479","natsume","eijitsu_shohin.txt","後から主人が来た。"
"1480","natsume","eijitsu_shohin.txt","主人の髯は十月の日に照らされて七分がた白くなりかけた。"
"1481","natsume","eijitsu_shohin.txt","形装も尋常ではない。"
"1482","natsume","eijitsu_shohin.txt","腰にキルトというものを着けている。"
"1483","natsume","eijitsu_shohin.txt","俥の膝掛のように粗い縞の織物である。"
"1484","natsume","eijitsu_shohin.txt","それを行灯袴に、膝頭まで裁って、竪に襞を置いたから、膝脛は太い毛糸の靴足袋で隠すばかりである。"
"1485","natsume","eijitsu_shohin.txt","歩くたびにキルトの襞が揺れて、膝と股の間がちらちら出る。"
"1486","natsume","eijitsu_shohin.txt","肉の色に恥を置かぬ昔の袴である。"
"1487","natsume","eijitsu_shohin.txt",""
"1488","natsume","eijitsu_shohin.txt","主人は毛皮で作った、小さい木魚ほどの蟇口を前にぶら下げている。"
"1489","natsume","eijitsu_shohin.txt","夜｜煖炉の傍へ椅子を寄せて、音のする赤い石炭を眺めながら、この木魚の中から、パイプを出す、煙草を出す。"
"1490","natsume","eijitsu_shohin.txt","そうしてぷかりぷかりと夜長を吹かす。"
"1491","natsume","eijitsu_shohin.txt","木魚の名をスポーランと云う。"
"1492","natsume","eijitsu_shohin.txt",""
"1493","natsume","eijitsu_shohin.txt","主人といっしょに崖を下りて、小暗い路に這入った。"
"1494","natsume","eijitsu_shohin.txt","スコッチ・ファーと云う常磐木の葉が、刻み昆布に雲が這いかかって、払っても落ちないように見える。"
"1495","natsume","eijitsu_shohin.txt","その黒い幹をちょろちょろと栗鼠が長く太った尾を揺って、駆け上った。"
"1496","natsume","eijitsu_shohin.txt","と思うと古く厚みのついた苔の上をまた一匹、眸から疾く駆け抜けたものがある。"
"1497","natsume","eijitsu_shohin.txt","苔は膨れたまま動かない。"
"1498","natsume","eijitsu_shohin.txt","栗鼠の尾は蒼黒い地を払子のごとくに擦って暗がりに入った。"
"1499","natsume","eijitsu_shohin.txt",""
"1500","natsume","eijitsu_shohin.txt","主人は横をふり向いて、ピトロクリの明るい谷を指さした。"
"1501","natsume","eijitsu_shohin.txt","黒い河は依然としてその真中を流れている。"
"1502","natsume","eijitsu_shohin.txt","あの河を一里半北へ溯るとキリクランキーの峡間があると云った。"
"1503","natsume","eijitsu_shohin.txt",""
"1504","natsume","eijitsu_shohin.txt","高地人と低地人とキリクランキーの峡間で戦った時、屍が岩の間に挟って、岩を打つ水を塞いた。"
"1505","natsume","eijitsu_shohin.txt","高地人と低地人の血を飲んだ河の流れは色を変えて三日の間ピトロクリの谷を通った。"
"1506","natsume","eijitsu_shohin.txt",""
"1507","natsume","eijitsu_shohin.txt","自分は明日早朝キリクランキーの古戦場を訪おうと決心した。"
"1508","natsume","eijitsu_shohin.txt","崖から出たら足の下に美しい薔薇の花弁が二三片散っていた。"
"1509","natsume","eijitsu_shohin.txt",""
"1510","natsume","eijitsu_shohin.txt",""
"1511","natsume","eijitsu_shohin.txt","声"
"1512","natsume","eijitsu_shohin.txt",""
"1513","natsume","eijitsu_shohin.txt","豊三郎がこの下宿へ越して来てから三日になる。"
"1514","natsume","eijitsu_shohin.txt","始めの日は、薄暗い夕暮の中に、一生懸命に荷物の片づけやら、書物の整理やらで、忙しい影のごとく動いていた。"
"1515","natsume","eijitsu_shohin.txt","それから町の湯に入って、帰るや否や寝てしまった。"
"1516","natsume","eijitsu_shohin.txt","明る日は、学校から戻ると、机の前へ坐って、しばらく書見をして見たが、急に居所が変ったせいか、全く気が乗らない。"
"1517","natsume","eijitsu_shohin.txt","窓の外でしきりに鋸の音がする。"
"1518","natsume","eijitsu_shohin.txt",""
"1519","natsume","eijitsu_shohin.txt","豊三郎は坐ったまま手を延して障子を明けた。"
"1520","natsume","eijitsu_shohin.txt","すると、つい鼻の先で植木屋がせっせと梧桐の枝をおろしている。"
"1521","natsume","eijitsu_shohin.txt","可なり大きく延びた奴を、惜気もなく股の根から、ごしごし引いては、下へ落して行く内に、切口の白い所が目立つくらい夥しくなった。"
"1522","natsume","eijitsu_shohin.txt","同時に空しい空が遠くから窓にあつまるように広く見え出した。"
"1523","natsume","eijitsu_shohin.txt","豊三郎は机に頬杖を突いて、何気なく、梧桐の上を高く離れた秋晴を眺めていた。"
"1524","natsume","eijitsu_shohin.txt",""
"1525","natsume","eijitsu_shohin.txt","豊三郎が眼を梧桐から空へ移した時は、急に大きな心持がした。"
"1526","natsume","eijitsu_shohin.txt","その大きな心持が、しばらくして落ちついて来るうちに、懐かしい故郷の記憶が、点を打ったように、その一角にあらわれた。"
"1527","natsume","eijitsu_shohin.txt","点は遥かの向にあるけれども、机の上に乗せたほど明らかに見えた。"
"1528","natsume","eijitsu_shohin.txt",""
"1529","natsume","eijitsu_shohin.txt","山の裾に大きな藁葺があって、村から二町ほど上ると、路は自分の門の前で尽きている。"
"1530","natsume","eijitsu_shohin.txt","門を這入る馬がある。"
"1531","natsume","eijitsu_shohin.txt","鞍の横に一叢の菊を結いつけて、鈴を鳴らして、白壁の中へ隠れてしまった。"
"1532","natsume","eijitsu_shohin.txt","日は高く屋の棟を照らしている。"
"1533","natsume","eijitsu_shohin.txt","後の山を、こんもり隠す松の幹がことごとく光って見える。"
"1534","natsume","eijitsu_shohin.txt","茸の時節である。"
"1535","natsume","eijitsu_shohin.txt","豊三郎は机の上で今｜採ったばかりの茸の香を嗅いだ。"
"1536","natsume","eijitsu_shohin.txt","そうして、豊、豊という母の声を聞いた。"
"1537","natsume","eijitsu_shohin.txt","その声が非常に遠くにある。"
"1538","natsume","eijitsu_shohin.txt","それで手に取るように明らかに聞える。"
"1539","natsume","eijitsu_shohin.txt","――母は五年前に死んでしまった。"
"1540","natsume","eijitsu_shohin.txt",""
"1541","natsume","eijitsu_shohin.txt","豊三郎はふと驚いて、わが眼を動かした。"
"1542","natsume","eijitsu_shohin.txt","すると先刻見た梧桐の先がまた眸に映った。"
"1543","natsume","eijitsu_shohin.txt","延びようとする枝が、一所で伐り詰められているので、股の根は、瘤で埋まって、見悪いほど窮屈に力が入っている。"
"1544","natsume","eijitsu_shohin.txt","豊三郎はまた急に、机の前に押しつけられたような気がした。"
"1545","natsume","eijitsu_shohin.txt","梧桐を隔てて、垣根の外を見下すと、汚ない長屋が三四軒ある。"
"1546","natsume","eijitsu_shohin.txt","綿の出た蒲団が遠慮なく秋の日に照りつけられている。"
"1547","natsume","eijitsu_shohin.txt","傍に五十余りの婆さんが立って、梧桐の先を見ていた。"
"1548","natsume","eijitsu_shohin.txt",""
"1549","natsume","eijitsu_shohin.txt","ところどころ縞の消えかかった着物の上に、細帯を一筋巻いたなりで、乏しい髪を、大きな櫛のまわりに巻きつけて、茫然と、枝を透かした梧桐の頂辺を見たまま立っている。"
"1550","natsume","eijitsu_shohin.txt","豊三郎は婆さんの顔を見た。"
"1551","natsume","eijitsu_shohin.txt","その顔は蒼くむくんでいる。"
"1552","natsume","eijitsu_shohin.txt","婆さんは腫れぼったい瞼の奥から細い眼を出して、眩しそうに豊三郎を見上げた。"
"1553","natsume","eijitsu_shohin.txt","豊三郎は急に自分の眼を机の上に落した。"
"1554","natsume","eijitsu_shohin.txt",""
"1555","natsume","eijitsu_shohin.txt","三日目に豊三郎は花屋へ行って菊を買って来た。"
"1556","natsume","eijitsu_shohin.txt","国の庭に咲くようなのをと思って、探して見たが見当らないので、やむをえず花屋のあてがったのを、そのまま三本ほど藁で括って貰って、徳利のような花瓶へ活けた。"
"1557","natsume","eijitsu_shohin.txt","行李の底から、帆足万里の書いた小さい軸を出して、壁へ掛けた。"
"1558","natsume","eijitsu_shohin.txt","これは先年帰省した時、装飾用のためにわざわざ持って来たものである。"
"1559","natsume","eijitsu_shohin.txt","それから豊三郎は座蒲団の上へ坐って、しばらく軸と花を眺めていた。"
"1560","natsume","eijitsu_shohin.txt","その時窓の前の長屋の方で、豊々と云う声がした。"
"1561","natsume","eijitsu_shohin.txt","その声が調子と云い、音色といい、優しい故郷の母に少しも違わない。"
"1562","natsume","eijitsu_shohin.txt","豊三郎はたちまち窓の障子をがらりと開けた。"
"1563","natsume","eijitsu_shohin.txt","すると昨日見た蒼ぶくれの婆さんが、落ちかかる秋の日を額に受けて、十二三になる鼻垂小僧を手招きしていた。"
"1564","natsume","eijitsu_shohin.txt","がらりと云う音がすると同時に、婆さんは例のむくんだ眼を翻えして下から豊三郎を見上げた。"
"1565","natsume","eijitsu_shohin.txt",""
"1566","natsume","eijitsu_shohin.txt",""
"1567","natsume","eijitsu_shohin.txt","金"
"1568","natsume","eijitsu_shohin.txt",""
