"","auth","piece","line"
"916","natsume","eijitsu_shohin.txt","が、せっかく取り出したものを、一つだけ残して、あとは丁寧にしまってしまった。"
"917","natsume","eijitsu_shohin.txt","それからまた二番目の抽出を開けた。"
"918","natsume","eijitsu_shohin.txt","そうしてまた考えた。"
"919","natsume","eijitsu_shohin.txt","御作さんは、考えたり、出したり、またはしまったりするので約三十分ほど費やした。"
"920","natsume","eijitsu_shohin.txt","その間も始終心配そうに柱時計を眺めていた。"
"921","natsume","eijitsu_shohin.txt","ようやく衣裳を揃えて、大きな欝金木綿の風呂敷にくるんで、座敷の隅に押しやると、髪結が驚いたような大きな声を出して勝手口から這入って来た。"
"922","natsume","eijitsu_shohin.txt","どうも遅くなってすみません、と息を喘ませて言訳を云っている。"
"923","natsume","eijitsu_shohin.txt","御作さんは、本当に、御忙がしいところを御気の毒さまでしたねえと、長い煙管を出して髪結に煙草を呑ました。"
"924","natsume","eijitsu_shohin.txt",""
"925","natsume","eijitsu_shohin.txt","梳手が来ないので、髪を結うのにだいぶ暇が取れた。"
"926","natsume","eijitsu_shohin.txt","旦那は湯に入って、髭を剃って、やがて帰って来た。"
"927","natsume","eijitsu_shohin.txt","その間に、御作さんは、髪結に今日は美いちゃんを誘って、旦那に有楽座へ連れて行って貰うんだと話した。"
"928","natsume","eijitsu_shohin.txt","髪結はおやおや私も御伴をしたいもんだなどと、だいぶ冗談交りの御世辞を使った末、どうぞごゆっくりと帰って行った。"
"929","natsume","eijitsu_shohin.txt",""
"930","natsume","eijitsu_shohin.txt","旦那は欝金木綿の風呂敷を、ちょっと剥って見て、これを着て行くのかい、これよりか、この間の方がお前には似合うよと云った。"
"931","natsume","eijitsu_shohin.txt","でも、あれは、もう暮に、美いちゃんの所へ着て行ったんですものと御作さんが答えた。"
"932","natsume","eijitsu_shohin.txt","そうか、じゃこれが好いだろう。"
"933","natsume","eijitsu_shohin.txt","おれはあっちの綿入羽織を着て行こうか、少し寒いようだねと、旦那がまた云い出すと、およしなさいよ、見っともない、一つものばかり着てと、御作さんは絣の綿入羽織を出さなかった。"
"934","natsume","eijitsu_shohin.txt",""
"935","natsume","eijitsu_shohin.txt","やがて、御化粧が出来上って、流行の鶉縮緬の道行を着て、毛皮の襟巻をして、御作さんは旦那といっしょに表へ出た。"
"936","natsume","eijitsu_shohin.txt","歩きながら旦那にぶら下がるようにして話をする。"
"937","natsume","eijitsu_shohin.txt","四つ角まで出ると交番の所に人が大勢立っていた。"
"938","natsume","eijitsu_shohin.txt","御作さんは旦那の廻套の羽根を捕まえて、伸び上がりながら、群集の中を覗き込んだ。"
"939","natsume","eijitsu_shohin.txt",""
"940","natsume","eijitsu_shohin.txt","真中に印袢天を着た男が、立つとも坐るとも片づかずに、のらくらしている。"
"941","natsume","eijitsu_shohin.txt","今までも泥の中へ何度も倒れたと見えて、たださえ色の変った袢天がびたびたに濡れて寒く光っている。"
"942","natsume","eijitsu_shohin.txt","巡査が御前は何だと云うと、呂律の回らない舌で、お、おれは人間だと威張っている。"
"943","natsume","eijitsu_shohin.txt","そのたんびに、みんなが、どっと笑う。"
"944","natsume","eijitsu_shohin.txt","御作さんも旦那の顔を見て笑った。"
"945","natsume","eijitsu_shohin.txt","すると酔っ払いは承知しない。"
"946","natsume","eijitsu_shohin.txt","怖い眼をして、あたりを見廻しながら、な、なにがおかしい。"
"947","natsume","eijitsu_shohin.txt","おれが人間なのが、どこがおかしい。"
"948","natsume","eijitsu_shohin.txt","こう見えたって、と云って、だらりと首を垂れてしまうかと思うと、突然思い出したように、人間だいと大きな声を出す。"
"949","natsume","eijitsu_shohin.txt",""
"950","natsume","eijitsu_shohin.txt","ところへまた印袢天を着た背の高い黒い顔をした男が荷車を引いてどこからか、やって来た。"
"951","natsume","eijitsu_shohin.txt","人を押し分けて巡査に何か小さな声で云っていたが、やがて、酔っ払いの方を向いて、さあ、野郎連れて行ってやるから、この上へ乗れと云った。"
"952","natsume","eijitsu_shohin.txt","酔払いは嬉しそうな顔をして、ありがてえと云いながら荷車の上に、どさりと仰向けに寝た。"
"953","natsume","eijitsu_shohin.txt","明かるい空を見て、しょぼしょぼした眼を、二三度ぱちつかせたが、箆棒め、こう見えたって人間でえと云った。"
"954","natsume","eijitsu_shohin.txt","うん人間だ、人間だからおとなしくしているんだよと、背の高い男は藁の縄で酔払いを荷車の上へしっかり縛りつけた。"
"955","natsume","eijitsu_shohin.txt","そうして屠られた豚のように、がらがらと大通りを引いて行った。"
"956","natsume","eijitsu_shohin.txt","御作さんはやっぱり廻套の羽根を捕まえたまま、注目飾りの間を、向うへ押されて行く荷車の影を見送った。"
"957","natsume","eijitsu_shohin.txt","そうして、これから美いちゃんの所へ行って、美いちゃんに話す種が一つ殖えたのを喜んだ。"
"958","natsume","eijitsu_shohin.txt",""
"959","natsume","eijitsu_shohin.txt",""
"960","natsume","eijitsu_shohin.txt","山鳥"
"961","natsume","eijitsu_shohin.txt",""
"962","natsume","eijitsu_shohin.txt","五六人寄って、火鉢を囲みながら話をしていると、突然一人の青年が来た。"
"963","natsume","eijitsu_shohin.txt","名も聞かず、会った事もない、全く未知の男である。"
"964","natsume","eijitsu_shohin.txt","紹介状も携えずに、取次を通じて、面会を求めるので、座敷へ招じたら、青年は大勢いる所へ、一羽の山鳥を提げて這入って来た。"
"965","natsume","eijitsu_shohin.txt","初対面の挨拶が済むと、その山鳥を座の真中に出して、国から届きましたからといって、それを当座の贈物にした。"
"966","natsume","eijitsu_shohin.txt",""
"967","natsume","eijitsu_shohin.txt","その日は寒い日であった。"
"968","natsume","eijitsu_shohin.txt","すぐ、みんなで山鳥の羹を拵えて食った。"
"969","natsume","eijitsu_shohin.txt","山鳥を料る時、青年は袴ながら、台所へ立って、自分で毛を引いて、肉を割いて、骨をことことと敲いてくれた。"
"970","natsume","eijitsu_shohin.txt","青年は小作りの面長な質で、蒼白い額の下に、度の高そうな眼鏡を光らしていた。"
"971","natsume","eijitsu_shohin.txt","もっとも著るしく見えたのは、彼の近眼よりも、彼の薄黒い口髭よりも、彼の穿いていた袴であった。"
"972","natsume","eijitsu_shohin.txt","それは小倉織で、普通の学生には見出し得べからざるほどに、太い縞柄の派出な物であった。"
"973","natsume","eijitsu_shohin.txt","彼はこの袴の上に両手を載せて、自分は南部のものだと云った。"
"974","natsume","eijitsu_shohin.txt",""
"975","natsume","eijitsu_shohin.txt","青年は一週間ほど経ってまた来た。"
"976","natsume","eijitsu_shohin.txt","今度は自分の作った原稿を携えていた。"
"977","natsume","eijitsu_shohin.txt","あまり佳くできていなかったから、遠慮なくその旨を話すと、書き直して見ましょうと云って持って帰った。"
"978","natsume","eijitsu_shohin.txt","帰ってから一週間の後、また原稿を懐にして来た。"
"979","natsume","eijitsu_shohin.txt","かようにして彼れは来るたびごとに、書いたものを何か置いて行かない事はなかった。"
"980","natsume","eijitsu_shohin.txt","中には三冊続きの大作さえあった。"
"981","natsume","eijitsu_shohin.txt","しかしそれはもっとも不出来なものであった。"
"982","natsume","eijitsu_shohin.txt","自分は彼れの手に成ったもののうちで、もっとも傑れたと思われるのを、一二度雑誌へ周旋した事がある。"
"983","natsume","eijitsu_shohin.txt","けれども、それは、ただ編輯者の御情で誌上にあらわれただけで、一銭の稿料にもならなかったらしい。"
"984","natsume","eijitsu_shohin.txt","自分が彼の生活難を耳にしたのはこの時である。"
"985","natsume","eijitsu_shohin.txt","彼はこれから文を売って口を糊するつもりだと云っていた。"
"986","natsume","eijitsu_shohin.txt",""
"987","natsume","eijitsu_shohin.txt","或時妙なものを持って来てくれた。"
"988","natsume","eijitsu_shohin.txt","菊の花を乾して、薄い海苔のように一枚一枚に堅めたものである。"
"989","natsume","eijitsu_shohin.txt","精進の畳鰯だと云って、居合せた甲子が、さっそく浸しものに湯がいて、箸を下しながら、酒を飲んだ。"
"990","natsume","eijitsu_shohin.txt","それから、鈴蘭の造花を一枝持って来てくれた事もある。"
"991","natsume","eijitsu_shohin.txt","妹が拵えたんだと云って、指の股で、枝の心になっている針金をぐるぐる廻転さしていた。"
"992","natsume","eijitsu_shohin.txt","妹といっしょに家を持っている事はこの時始めて知った。"
"993","natsume","eijitsu_shohin.txt","兄妹して薪屋の二階を一間借りて、妹は毎日｜刺繍の稽古に通っているのだそうである。"
"994","natsume","eijitsu_shohin.txt","その次来た時には御納戸の結び目に、白い蝶を刺繍った襟飾りを、新聞紙にくるんだまま、もし御掛けなさるなら上げましょうと云って置いて行った。"
"995","natsume","eijitsu_shohin.txt","それを安野が私に下さいと云って取って帰った。"
"996","natsume","eijitsu_shohin.txt",""
"997","natsume","eijitsu_shohin.txt","そのほか彼は時々来た。"
"998","natsume","eijitsu_shohin.txt","来るたびに自分の国の景色やら、習慣やら、伝説やら、古めかしい祭礼の模様やら、いろいろの事を話した。"
"999","natsume","eijitsu_shohin.txt","彼の父は漢学者であると云う事も話した。"
"1000","natsume","eijitsu_shohin.txt","篆刻が旨いという事も話した。"
"1001","natsume","eijitsu_shohin.txt","御祖母さんは去る大名の御屋敷に奉公していた。"
"1002","natsume","eijitsu_shohin.txt","申の年の生れだったそうだ。"
"1003","natsume","eijitsu_shohin.txt","大変殿様の御気に入りで、猿に縁んだものを時々下さった。"
"1004","natsume","eijitsu_shohin.txt","その中に崋山の画いた手長猿の幅がある。"
"1005","natsume","eijitsu_shohin.txt","今度持って来て御覧に入れましょうと云った。"
"1006","natsume","eijitsu_shohin.txt","青年はそれぎり来なくなった。"
"1007","natsume","eijitsu_shohin.txt",""
"1008","natsume","eijitsu_shohin.txt","すると春が過ぎて、夏になって、この青年の事もいつか忘れるようになった或日、――その日は日に遠い座敷の真中に、単衣を唯一枚つけて、じっと書見をしていてさえ堪えがたいほどに暑かった。"
"1009","natsume","eijitsu_shohin.txt","――彼れは突然やって来た。"
"1010","natsume","eijitsu_shohin.txt",""
"1011","natsume","eijitsu_shohin.txt","相変らず例の派出な袴を穿いて、蒼白い額ににじんだ汗をこくめいに手拭で拭いている。"
"1012","natsume","eijitsu_shohin.txt","少し瘠せたようだ。"
"1013","natsume","eijitsu_shohin.txt","はなはだ申し兼ねたが金を二十円貸して下さいという。"
"1014","natsume","eijitsu_shohin.txt","実は友人が急病に罹ったから、さっそく病院へ入れたのだが、差し当り困るのは金で、いろいろ奔走もして見たが、ちょっとできない。"
"1015","natsume","eijitsu_shohin.txt","やむをえず上がった。"
"1016","natsume","eijitsu_shohin.txt","と説明した。"
"1017","natsume","eijitsu_shohin.txt",""
"1018","natsume","eijitsu_shohin.txt","自分は書見をやめて、青年の顔をじっと見た。"
"1019","natsume","eijitsu_shohin.txt","彼は例のごとく両手を膝の上に正しく置いたまま、どうぞと低い声で云った。"
"1020","natsume","eijitsu_shohin.txt","あなたの友人の家はそれほど貧しいのかと聞き返したら、いやそうではない、ただ遠方で急の間に合わないから御願をする、二週間｜経てば、国から届くはずだからその時はすぐと御返しするという答である。"
"1021","natsume","eijitsu_shohin.txt","自分は金の調達を引き受けた。"
"1022","natsume","eijitsu_shohin.txt","その時｜彼れは風呂敷包の中から一幅の懸物を取り出して、これがせんだって御話をした崋山の軸ですと云って、紙表装の半切ものを展べて見せた。"
"1023","natsume","eijitsu_shohin.txt","旨いのか不味いのか判然とは解らなかった。"
"1024","natsume","eijitsu_shohin.txt","印譜をしらべて見ると、渡辺崋山にも横山華山にも似寄った落款がない。"
"1025","natsume","eijitsu_shohin.txt","青年はこれを置いて行きますと云うから、それには及ばないと辞退したが、聞かずに預けて行った。"
"1026","natsume","eijitsu_shohin.txt","翌日また金を取りに来た。"
"1027","natsume","eijitsu_shohin.txt","それっきり音沙汰がない。"
"1028","natsume","eijitsu_shohin.txt","約束の二週間が来ても影も形も見せなかった。"
"1029","natsume","eijitsu_shohin.txt","自分は欺されたのかも知れないと思った。"
"1030","natsume","eijitsu_shohin.txt","猿の軸は壁へ懸けたまま秋になった。"
"1031","natsume","eijitsu_shohin.txt",""
"1032","natsume","eijitsu_shohin.txt","袷を着て気の緊まる時分に、長塚が例のごとく金を借してくれと云って来た。"
"1033","natsume","eijitsu_shohin.txt","自分はそうたびたび借すのが厭であった。"
"1034","natsume","eijitsu_shohin.txt","ふと例の青年の事を思い出して、こう云う金があるが、もし、それを君が取りに行く気なら取りに行け、取れたら貸してやろうと云うと、長塚は頭を掻いて、少し逡巡していたが、やがて思い切ったと見えて、行きましょうと答えた。"
"1035","natsume","eijitsu_shohin.txt","それから、せんだっての金をこの者に渡してくれろという手紙を書いて、それに猿の懸物を添えて、長塚に持たせてやった。"
"1036","natsume","eijitsu_shohin.txt",""
"1037","natsume","eijitsu_shohin.txt","長塚はあくる日また車でやって来た。"
"1038","natsume","eijitsu_shohin.txt","来るや否や懐から手紙を出したから、受け取って見ると昨日自分の書いたものである。"
"1039","natsume","eijitsu_shohin.txt","まだ封が切らずにある。"
"1040","natsume","eijitsu_shohin.txt","行かなかったのかと聞くと、長塚は額に八の字を寄せて、行ったんですけれども、とても駄目です、惨澹たるものです、汚ない所でしてね、妻君が刺繍をしていましてね、本人が病気でしてね、――金の事なんぞ云い出せる訳のものじゃないんだから、けっして御心配には及びませんと安心させて、掛物だけ帰して来ましたと云う。"
"1041","natsume","eijitsu_shohin.txt","自分はへええ、そうかと少し驚ろいた。"
"1042","natsume","eijitsu_shohin.txt",""
"1043","natsume","eijitsu_shohin.txt","翌る日、青年から、どうも嘘言を吐いてすまなかった、軸はたしかに受取ったと云う端書が来た。"
"1044","natsume","eijitsu_shohin.txt","自分はその端書を他の信書といっしょに重ねて、乱箱の中に入れた。"
"1045","natsume","eijitsu_shohin.txt","そうして、また青年の事を忘れるようになった。"
"1046","natsume","eijitsu_shohin.txt",""
"1047","natsume","eijitsu_shohin.txt","そのうち冬が来た。"
"1048","natsume","eijitsu_shohin.txt","例のごとく忙しい正月を迎えた。"
"1049","natsume","eijitsu_shohin.txt","客の来ない隙間を見て、仕事をしていると、下女が油紙に包んだ小包を持って来た。"
"1050","natsume","eijitsu_shohin.txt","どさりと音のする丸い物である。"
"1051","natsume","eijitsu_shohin.txt","差出人の名前は、忘れていた、いつぞやの青年である。"
"1052","natsume","eijitsu_shohin.txt","油紙を解いて新聞紙を剥ぐと、中から一羽の山鳥が出た。"
"1053","natsume","eijitsu_shohin.txt","手紙がついている。"
"1054","natsume","eijitsu_shohin.txt","その後いろいろの事情があって、今国へ帰っている。"
"1055","natsume","eijitsu_shohin.txt","御恩借の金子は三月頃上京の節是非御返しをするつもりだとある。"
"1056","natsume","eijitsu_shohin.txt","手紙は山鳥の血で堅まって容易に剥れなかった。"
"1057","natsume","eijitsu_shohin.txt",""
"1058","natsume","eijitsu_shohin.txt","その日はまた木曜で、若い人の集まる晩であった。"
"1059","natsume","eijitsu_shohin.txt","自分はまた五六人と共に、大きな食卓を囲んで、山鳥の羹を食った。"
"1060","natsume","eijitsu_shohin.txt","そうして、派出な小倉の袴を着けた蒼白い青年の成功を祈った。"
"1061","natsume","eijitsu_shohin.txt","五六人の帰ったあとで、自分はこの青年に礼状を書いた。"
"1062","natsume","eijitsu_shohin.txt","そのなかに先年の金子の件｜御介意に及ばずと云う一句を添えた。"
"1063","natsume","eijitsu_shohin.txt",""
"1064","natsume","eijitsu_shohin.txt",""
"1065","natsume","eijitsu_shohin.txt","モナリサ"
"1066","natsume","eijitsu_shohin.txt",""
"1067","natsume","eijitsu_shohin.txt","井深は日曜になると、襟巻に懐手で、そこいらの古道具屋を覗き込んで歩るく。"
"1068","natsume","eijitsu_shohin.txt","そのうちでもっとも汚ならしい、前代の廃物ばかり並んでいそうな見世を選っては、あれの、これのと捻くり廻す。"
"1069","natsume","eijitsu_shohin.txt","固より茶人でないから、好いの悪いのが解る次第ではないが、安くて面白そうなものを、ちょいちょい買って帰るうちには、一年に一度ぐらい掘り出し物に、あたるだろうとひそかに考えている。"
"1070","natsume","eijitsu_shohin.txt",""
"1071","natsume","eijitsu_shohin.txt","井深は一箇月ほど前に十五銭で鉄瓶の葢だけを買って文鎮にした。"
"1072","natsume","eijitsu_shohin.txt","この間の日曜には二十五銭で鉄の鍔を買って、これまた文鎮にした。"
"1073","natsume","eijitsu_shohin.txt","今日はもう少し大きい物を目懸けている。"
"1074","natsume","eijitsu_shohin.txt","懸物でも額でもすぐ人の眼につくような、書斎の装飾が一つ欲しいと思って、見廻していると、色摺の西洋の女の画が、埃だらけになって、横に立て懸けてあった。"
"1075","natsume","eijitsu_shohin.txt","溝の磨れた井戸車の上に、何とも知れぬ花瓶が載っていて、その中から黄色い尺八の歌口がこの画の邪魔をしている。"
"1076","natsume","eijitsu_shohin.txt",""
"1077","natsume","eijitsu_shohin.txt","西洋の画はこの古道具屋に似合わない。"
"1078","natsume","eijitsu_shohin.txt","ただその色具合が、とくに現代を超越して、上昔の空気の中に黒く埋っている。"
"1079","natsume","eijitsu_shohin.txt","いかにもこの古道具屋にあって然るべき調子である。"
"1080","natsume","eijitsu_shohin.txt","井深はきっと安いものだと鑑定した。"
"1081","natsume","eijitsu_shohin.txt","聞いて見ると一円と云うのに、少し首を捻ったが、硝子も割れていないし、額縁もたしかだから、爺さんに談判して、八十銭までに負けさせた。"
"1082","natsume","eijitsu_shohin.txt",""
"1083","natsume","eijitsu_shohin.txt","井深がこの半身の画像を抱いて、家へ帰ったのは、寒い日の暮方であった。"
"1084","natsume","eijitsu_shohin.txt","薄暗い部屋へ入って、さっそく額を裸にして、壁へ立て懸けて、じっとその前へ坐り込んでいると、洋灯を持って細君がやって来た。"
"1085","natsume","eijitsu_shohin.txt","井深は細君に灯を画の傍へ翳さして、もう一遍とっくりと八十銭の額を眺めた。"
"1086","natsume","eijitsu_shohin.txt","総体に渋く黒ずんでいる中に、顔だけが黄ばんで見える。"
"1087","natsume","eijitsu_shohin.txt","これも時代のせいだろう。"
"1088","natsume","eijitsu_shohin.txt","井深は坐ったまま細君を顧みて、どうだと聞いた。"
"1089","natsume","eijitsu_shohin.txt","細君は洋灯を翳した片手を少し上に上げて、しばらく物も言わずに黄ばんだ女の顔を眺めていたが、やがて、気味の悪い顔です事ねえと云った。"
"1090","natsume","eijitsu_shohin.txt","井深はただ笑って、八十銭だよと答えたぎりである。"
"1091","natsume","eijitsu_shohin.txt",""
"1092","natsume","eijitsu_shohin.txt","飯を食ってから、踏台をして欄間に釘を打って、買って来た額を頭の上へ掛けた。"
"1093","natsume","eijitsu_shohin.txt","その時細君は、この女は何をするか分らない人相だ。"
"1094","natsume","eijitsu_shohin.txt","見ていると変な心持になるから、掛けるのは廃すが好いと云ってしきりに止めたけれども、井深はなあに御前の神経だと云って聞かなかった。"
"1095","natsume","eijitsu_shohin.txt",""
"1096","natsume","eijitsu_shohin.txt","細君は茶の間へ下る。"
"1097","natsume","eijitsu_shohin.txt","井深は机に向って調べものを始めた。"
"1098","natsume","eijitsu_shohin.txt","十分ばかりすると、ふと首を上げて、額の中が見たくなった。"
"1099","natsume","eijitsu_shohin.txt","筆を休めて、眼を転ずると、黄色い女が、額の中で薄笑いをしている。"
"1100","natsume","eijitsu_shohin.txt","井深はじっとその口元を見つめた。"
"1101","natsume","eijitsu_shohin.txt","全く画工の光線のつけ方である。"
"1102","natsume","eijitsu_shohin.txt","薄い唇が両方の端で少し反り返って、その反り返った所にちょっと凹を見せている。"
"1103","natsume","eijitsu_shohin.txt","結んだ口をこれから開けようとするようにも取れる。"
"1104","natsume","eijitsu_shohin.txt","または開いた口をわざと、閉じたようにも取れる。"
"1105","natsume","eijitsu_shohin.txt","ただしなぜだか分らない。"
"1106","natsume","eijitsu_shohin.txt","井深は変な心持がしたが、また机に向った。"
"1107","natsume","eijitsu_shohin.txt",""
"1108","natsume","eijitsu_shohin.txt","調べものとは云い条、半分は写しものである。"
"1109","natsume","eijitsu_shohin.txt","大して注意を払う必要もないので、少し経ったら、また首を挙げて画の方を見た。"
"1110","natsume","eijitsu_shohin.txt","やはり口元に何か曰くがある。"
"1111","natsume","eijitsu_shohin.txt","けれども非常に落ちついている。"
"1112","natsume","eijitsu_shohin.txt","切れ長の一重瞼の中から静かな眸が座敷の下に落ちた。"
"1113","natsume","eijitsu_shohin.txt","井深はまた机の方に向き直った。"
"1114","natsume","eijitsu_shohin.txt",""
"1115","natsume","eijitsu_shohin.txt","その晩井深は何遍となくこの画を見た。"
"1116","natsume","eijitsu_shohin.txt","そうして、どことなく細君の評が当っているような気がし出した。"
"1117","natsume","eijitsu_shohin.txt","けれども明る日になったら、そうでもないような顔をして役所へ出勤した。"
"1118","natsume","eijitsu_shohin.txt","四時頃｜家へ帰って見ると、昨夕の額は仰向けに机の上に乗せてある。"
"1119","natsume","eijitsu_shohin.txt","午少し過に、欄間の上から突然落ちたのだという。"
"1120","natsume","eijitsu_shohin.txt","道理で硝子がめちゃめちゃに破れている。"
"1121","natsume","eijitsu_shohin.txt","井深は額の裏を返して見た。"
"1122","natsume","eijitsu_shohin.txt","昨夕｜紐を通した環が、どうした具合か抜けている。"
"1123","natsume","eijitsu_shohin.txt","井深はそのついでに額の裏を開けて見た。"
"1124","natsume","eijitsu_shohin.txt","すると画と背中合せに、四つ折の西洋紙が出た。"
"1125","natsume","eijitsu_shohin.txt","開けて見ると、印気で妙な事が書いてある。"
"1126","natsume","eijitsu_shohin.txt",""
